kernels/ptpc/mi300x_tuned_configs/a8w8_tuned_gemm.csv
cu_num,M,N,K,kernelId,splitK,us,kernelName,errRatio,tflops,bw
304,1,192,7168,34,0,12.1743,a8w8_rowwise_256x16x64x512_16x16_1x1_32x8x1_32x8x1_1x16x1x16_4x4x1_1x1_intrawave_v3,0.0,0.23,113.67
304,1,512,7168,34,0,14.0432,a8w8_rowwise_256x16x64x512_16x16_1x1_32x8x1_32x8x1_1x16x1x16_4x4x1_1x1_intrawave_v3,0.0,0.52,261.92
304,1,896,5120,34,0,11.1603,a8w8_rowwise_256x16x64x512_16x16_1x1_32x8x1_32x8x1_1x16x1x16_4x4x1_1x1_intrawave_v3,0.0,0.82,411.68
304,1,1024,5632,34,0,12.2176,a8w8_rowwise_256x16x64x512_16x16_1x1_32x8x1_32x8x1_1x16x1x16_4x4x1_1x1_intrawave_v3,0.0,0.94,472.67
304,1,1056,1408,34,0,5.0312,a8w8_rowwise_256x16x64x512_16x16_1x1_32x8x1_32x8x1_1x16x1x16_4x4x1_1x1_intrawave_v3,0.0,0.59,296.23
304,1,1280,4096,34,0,9.5024,a8w8_rowwise_256x16x64x512_16x16_1x1_32x8x1_32x8x1_1x16x1x16_4x4x1_1x1_intrawave_v3,0.0,1.1,552.44
304,1,1408,352,78,0,3.4289,a8w8_rowwise_64x16x16x128_16x16_1x1_8x8x1_8x8x1_1x16x1x4_4x4x1_1x1_interwave_v2,0.0,0.29,145.46
304,1,1408,1408,79,0,5.0448,a8w8_rowwise_128x16x32x128_16x16_1x1_8x16x1_8x16x1_1x16x1x8_4x4x1_1x1_interwave_v2,0.0,0.79,393.81
304,1,1536,2048,34,0,6.3207,a8w8_rowwise_256x16x64x512_16x16_1x1_32x8x1_32x8x1_1x16x1x16_4x4x1_1x1_intrawave_v3,0.0,1.0,498.5
304,1,1792,6144,34,0,12.8057,a8w8_rowwise_256x16x64x512_16x16_1x1_32x8x1_32x8x1_1x16x1x16_4x4x1_1x1_intrawave_v3,0.0,1.72,860.54
304,1,2048,1536,76,0,5.6384,a8w8_rowwise_128x32x16x128_16x16_1x1_8x16x1_8x16x1_1x16x1x8_2x2x1_1x1_interwave_v2,0.0,1.12,558.91
304,1,2048,6144,34,0,12.6052,a8w8_rowwise_256x16x64x512_16x16_1x1_32x8x1_32x8x1_1x16x1x16_4x4x1_1x1_intrawave_v3,0.0,2.0,999.04
304,1,3072,4096,34,0,10.0921,a8w8_rowwise_256x16x64x512_16x16_1x1_32x8x1_32x8x1_1x16x1x16_4x4x1_1x1_intrawave_v3,0.0,2.49,1247.82
304,1,3584,6144,34,0,13.1498,a8w8_rowwise_256x16x64x512_16x16_1x1_32x8x1_32x8x1_1x16x1x16_4x4x1_1x1_intrawave_v3,0.0,3.35,1675.57
304,1,4096,640,79,0,4.0385,a8w8_rowwise_128x16x32x128_16x16_1x1_8x16x1_8x16x1_1x16x1x8_4x4x1_1x1_interwave_v2,0.0,1.3,651.3
304,1,4096,1024,76,0,5.3836,a8w8_rowwise_128x32x16x128_16x16_1x1_8x16x1_8x16x1_1x16x1x8_2x2x1_1x1_interwave_v2,0.0,1.56,780.8
304,1,4096,3072,34,0,8.2801,a8w8_rowwise_256x16x64x512_16x16_1x1_32x8x1_32x8x1_1x16x1x16_4x4x1_1x1_intrawave_v3,0.0,3.04,1521.02
304,1,5120,640,79,0,4.2129,a8w8_rowwise_128x16x32x128_16x16_1x1_8x16x1_8x16x1_1x16x1x8_4x4x1_1x1_interwave_v2,0.0,1.56,780.38
304,1,5120,2048,34,0,7.2592,a8w8_rowwise_256x16x64x512_16x16_1x1_32x8x1_32x8x1_1x16x1x16_4x4x1_1x1_intrawave_v3,0.0,2.89,1446.17
304,1,6144,768,79,0,4.5469,a8w8_rowwise_128x16x32x128_16x16_1x1_8x16x1_8x16x1_1x16x1x8_4x4x1_1x1_interwave_v2,0.0,2.08,1040.63
304,1,6144,1024,79,0,5.7692,a8w8_rowwise_128x16x32x128_16x16_1x1_8x16x1_8x16x1_1x16x1x8_4x4x1_1x1_interwave_v2,0.0,2.18,1092.83
304,1,6144,1536,79,0,6.604,a8w8_rowwise_128x16x32x128_16x16_1x1_8x16x1_8x16x1_1x16x1x8_4x4x1_1x1_interwave_v2,0.0,2.86,1431.1
304,1,6144,2048,34,0,7.9253,a8w8_rowwise_256x16x64x512_16x16_1x1_32x8x1_32x8x1_1x16x1x16_4x4x1_1x1_intrawave_v3,0.0,3.18,1589.5
304,1,7168,256,49,0,3.313,a8w8_rowwise_64x16x16x128_16x16_1x1_8x8x1_8x8x1_1x16x1x4_4x4x1_1x1_intrawave_v1,0.0,1.11,558.29
304,1,7168,2304,79,0,7.9042,a8w8_rowwise_128x16x32x128_16x16_1x1_8x16x1_8x16x1_1x16x1x8_4x4x1_1x1_interwave_v2,0.0,4.18,2091.51
304,2,192,7168,34,0,12.1744,a8w8_rowwise_256x16x64x512_16x16_1x1_32x8x1_32x8x1_1x16x1x16_4x4x1_1x1_intrawave_v3,0.0,0.45,114.29
304,2,512,7168,34,0,13.9077,a8w8_rowwise_256x16x64x512_16x16_1x1_32x8x1_32x8x1_1x16x1x16_4x4x1_1x1_intrawave_v3,0.0,1.06,265.06
304,2,896,5120,34,0,11.2666,a8w8_rowwise_256x16x64x512_16x16_1x1_32x8x1_32x8x1_1x16x1x16_4x4x1_1x1_intrawave_v3,0.0,1.63,408.41
304,2,1024,5632,34,0,12.3197,a8w8_rowwise_256x16x64x512_16x16_1x1_32x8x1_32x8x1_1x16x1x16_4x4x1_1x1_intrawave_v3,0.0,1.87,469.37
304,2,1056,1408,34,0,5.0526,a8w8_rowwise_256x16x64x512_16x16_1x1_32x8x1_32x8x1_1x16x1x16_4x4x1_1x1_intrawave_v3,0.0,1.18,295.67
304,2,1280,4096,34,0,9.5889,a8w8_rowwise_256x16x64x512_16x16_1x1_32x8x1_32x8x1_1x16x1x16_4x4x1_1x1_intrawave_v3,0.0,2.19,548.15
304,2,1408,352,78,0,3.4153,a8w8_rowwise_64x16x16x128_16x16_1x1_8x8x1_8x8x1_1x16x1x4_4x4x1_1x1_interwave_v2,0.0,0.58,146.97
304,2,1408,1408,34,0,5.0408,a8w8_rowwise_256x16x64x512_16x16_1x1_32x8x1_32x8x1_1x16x1x16_4x4x1_1x1_intrawave_v3,0.0,1.57,394.96
304,2,1536,2048,34,0,6.3326,a8w8_rowwise_256x16x64x512_16x16_1x1_32x8x1_32x8x1_1x16x1x16_4x4x1_1x1_intrawave_v3,0.0,1.99,498.37
304,2,1792,6144,34,0,12.6674,a8w8_rowwise_256x16x64x512_16x16_1x1_32x8x1_32x8x1_1x16x1x16_4x4x1_1x1_intrawave_v3,0.0,3.48,870.7
304,2,2048,1536,76,0,5.674,a8w8_rowwise_128x32x16x128_16x16_1x1_8x16x1_8x16x1_1x16x1x8_2x2x1_1x1_interwave_v2,0.0,2.22,556.4
304,2,2048,6144,34,0,12.6796,a8w8_rowwise_256x16x64x512_16x16_1x1_32x8x1_32x8x1_1x16x1x16_4x4x1_1x1_intrawave_v3,0.0,3.97,993.99
304,2,3072,4096,34,0,10.1565,a8w8_rowwise_256x16x64x512_16x16_1x1_32x8x1_32x8x1_1x16x1x16_4x4x1_1x1_intrawave_v3,0.0,4.96,1240.92
304,2,3584,6144,34,0,13.2748,a8w8_rowwise_256x16x64x512_16x16_1x1_32x8x1_32x8x1_1x16x1x16_4x4x1_1x1_intrawave_v3,0.0,6.64,1660.79
304,2,4096,640,79,0,4.0677,a8w8_rowwise_128x16x32x128_16x16_1x1_8x16x1_8x16x1_1x16x1x8_4x4x1_1x1_interwave_v2,0.0,2.58,648.8
304,2,4096,1024,76,0,5.4784,a8w8_rowwise_128x32x16x128_16x16_1x1_8x16x1_8x16x1_1x16x1x8_2x2x1_1x1_interwave_v2,0.0,3.06,768.97
304,2,4096,3072,34,0,8.2673,a8w8_rowwise_256x16x64x512_16x16_1x1_32x8x1_32x8x1_1x16x1x16_4x4x1_1x1_intrawave_v3,0.0,6.09,1524.73
304,2,5120,640,79,0,4.2515,a8w8_rowwise_128x16x32x128_16x16_1x1_8x16x1_8x16x1_1x16x1x8_4x4x1_1x1_interwave_v2,0.0,3.08,775.86
304,2,5120,2048,34,0,7.6458,a8w8_rowwise_256x16x64x512_16x16_1x1_32x8x1_32x8x1_1x16x1x16_4x4x1_1x1_intrawave_v3,0.0,5.49,1374.65
304,2,6144,768,79,0,4.551,a8w8_rowwise_128x16x32x128_16x16_1x1_8x16x1_8x16x1_1x16x1x8_4x4x1_1x1_interwave_v2,0.0,4.15,1042.56
304,2,6144,1024,79,0,5.8101,a8w8_rowwise_128x16x32x128_16x16_1x1_8x16x1_8x16x1_1x16x1x8_4x4x1_1x1_interwave_v2,0.0,4.33,1087.43
304,2,6144,1536,79,0,6.6085,a8w8_rowwise_128x16x32x128_16x16_1x1_8x16x1_8x16x1_1x16x1x8_4x4x1_1x1_interwave_v2,0.0,5.71,1432.22
304,2,6144,2048,34,0,7.878,a8w8_rowwise_256x16x64x512_16x16_1x1_32x8x1_32x8x1_1x16x1x16_4x4x1_1x1_intrawave_v3,0.0,6.39,1600.86
304,2,7168,256,50,0,3.3284,a8w8_rowwise_128x16x32x128_16x16_1x1_8x16x1_8x16x1_1x16x1x8_4x4x1_1x1_intrawave_v1,0.0,2.21,560.09
304,2,7168,2304,79,0,8.0921,a8w8_rowwise_128x16x32x128_16x16_1x1_8x16x1_8x16x1_1x16x1x8_4x4x1_1x1_interwave_v2,0.0,8.16,2045.0
304,4,192,7168,34,0,12.2164,a8w8_rowwise_256x16x64x512_16x16_1x1_32x8x1_32x8x1_1x16x1x16_4x4x1_1x1_intrawave_v3,0.0,0.9,115.13
304,4,512,7168,34,0,13.8688,a8w8_rowwise_256x16x64x512_16x16_1x1_32x8x1_32x8x1_1x16x1x16_4x4x1_1x1_intrawave_v3,0.0,2.12,266.99
304,4,896,5120,34,0,11.2737,a8w8_rowwise_256x16x64x512_16x16_1x1_32x8x1_32x8x1_1x16x1x16_4x4x1_1x1_intrawave_v3,0.0,3.26,409.37
304,4,1024,5632,34,0,12.1993,a8w8_rowwise_256x16x64x512_16x16_1x1_32x8x1_32x8x1_1x16x1x16_4x4x1_1x1_intrawave_v3,0.0,3.78,475.26
304,4,1056,1408,76,0,5.0486,a8w8_rowwise_128x32x16x128_16x16_1x1_8x16x1_8x16x1_1x16x1x8_2x2x1_1x1_interwave_v2,0.0,2.36,297.3
304,4,1280,4096,34,0,9.7007,a8w8_rowwise_256x16x64x512_16x16_1x1_32x8x1_32x8x1_1x16x1x16_4x4x1_1x1_intrawave_v3,0.0,4.32,543.21
304,4,1408,352,78,0,3.37,a8w8_rowwise_64x16x16x128_16x16_1x1_8x8x1_8x8x1_1x16x1x4_4x4x1_1x1_interwave_v2,0.0,1.18,150.83
304,4,1408,1408,76,0,5.0782,a8w8_rowwise_128x32x16x128_16x16_1x1_8x16x1_8x16x1_1x16x1x8_2x2x1_1x1_interwave_v2,0.0,3.12,393.71
304,4,1536,2048,34,0,6.4308,a8w8_rowwise_256x16x64x512_16x16_1x1_32x8x1_32x8x1_1x16x1x16_4x4x1_1x1_intrawave_v3,0.0,3.91,492.35
304,4,1792,6144,34,0,12.687,a8w8_rowwise_256x16x64x512_16x16_1x1_32x8x1_32x8x1_1x16x1x16_4x4x1_1x1_intrawave_v3,0.0,6.94,870.89
304,4,2048,1536,34,0,5.6779,a8w8_rowwise_256x16x64x512_16x16_1x1_32x8x1_32x8x1_1x16x1x16_4x4x1_1x1_intrawave_v3,0.0,4.43,558.0
304,4,2048,6144,34,0,12.6777,a8w8_rowwise_256x16x64x512_16x16_1x1_32x8x1_32x8x1_1x16x1x16_4x4x1_1x1_intrawave_v3,0.0,7.94,995.75
304,4,3072,4096,34,0,10.1503,a8w8_rowwise_256x16x64x512_16x16_1x1_32x8x1_32x8x1_1x16x1x16_4x4x1_1x1_intrawave_v3,0.0,9.92,1243.69
304,4,3584,6144,34,0,13.3186,a8w8_rowwise_256x16x64x512_16x16_1x1_32x8x1_32x8x1_1x16x1x16_4x4x1_1x1_intrawave_v3,0.0,13.23,1657.33
304,4,4096,640,79,0,4.0499,a8w8_rowwise_128x16x32x128_16x16_1x1_8x16x1_8x16x1_1x16x1x8_4x4x1_1x1_interwave_v2,0.0,5.18,656.01
304,4,4096,1024,76,0,5.4447,a8w8_rowwise_128x32x16x128_16x16_1x1_8x16x1_8x16x1_1x16x1x8_2x2x1_1x1_interwave_v2,0.0,6.16,777.12
304,4,4096,3072,34,0,8.332,a8w8_rowwise_256x16x64x512_16x16_1x1_32x8x1_32x8x1_1x16x1x16_4x4x1_1x1_intrawave_v3,0.0,12.08,1515.6
304,4,5120,640,79,0,4.2102,a8w8_rowwise_128x16x32x128_16x16_1x1_8x16x1_8x16x1_1x16x1x8_4x4x1_1x1_interwave_v2,0.0,6.23,788.64
304,4,5120,2048,34,0,7.3837,a8w8_rowwise_256x16x64x512_16x16_1x1_32x8x1_32x8x1_1x16x1x16_4x4x1_1x1_intrawave_v3,0.0,11.36,1426.78
304,4,6144,768,79,0,4.5907,a8w8_rowwise_128x16x32x128_16x16_1x1_8x16x1_8x16x1_1x16x1x8_4x4x1_1x1_interwave_v2,0.0,8.22,1039.23
304,4,6144,1024,79,0,5.8265,a8w8_rowwise_128x16x32x128_16x16_1x1_8x16x1_8x16x1_1x16x1x8_4x4x1_1x1_interwave_v2,0.0,8.64,1088.94
304,4,6144,1536,79,0,6.6814,a8w8_rowwise_128x16x32x128_16x16_1x1_8x16x1_8x16x1_1x16x1x8_4x4x1_1x1_interwave_v2,0.0,11.3,1420.73
304,4,6144,2048,34,0,7.8816,a8w8_rowwise_256x16x64x512_16x16_1x1_32x8x1_32x8x1_1x16x1x16_4x4x1_1x1_intrawave_v3,0.0,12.77,1603.77
304,4,7168,256,50,0,3.3498,a8w8_rowwise_128x16x32x128_16x16_1x1_8x16x1_8x16x1_1x16x1x8_4x4x1_1x1_intrawave_v1,0.0,4.38,565.22
304,4,7168,2304,34,0,8.2904,a8w8_rowwise_256x16x64x512_16x16_1x1_32x8x1_32x8x1_1x16x1x16_4x4x1_1x1_intrawave_v3,0.0,15.94,2000.1
304,8,192,7168,34,0,12.225,a8w8_rowwise_256x16x64x512_16x16_1x1_32x8x1_32x8x1_1x16x1x16_4x4x1_1x1_intrawave_v3,0.0,1.8,117.52
304,8,512,7168,34,0,13.7888,a8w8_rowwise_256x16x64x512_16x16_1x1_32x8x1_32x8x1_1x16x1x16_4x4x1_1x1_intrawave_v3,0.0,4.26,270.91
304,8,896,5120,34,0,11.283,a8w8_rowwise_256x16x64x512_16x16_1x1_32x8x1_32x8x1_1x16x1x16_4x4x1_1x1_intrawave_v3,0.0,6.51,411.49
304,8,1024,5632,34,0,12.3262,a8w8_rowwise_256x16x64x512_16x16_1x1_32x8x1_32x8x1_1x16x1x16_4x4x1_1x1_intrawave_v3,0.0,7.49,472.86
304,8,1056,1408,76,0,5.103,a8w8_rowwise_128x32x16x128_16x16_1x1_8x16x1_8x16x1_1x16x1x8_2x2x1_1x1_interwave_v2,0.0,4.66,296.89
304,8,1280,4096,34,0,9.6823,a8w8_rowwise_256x16x64x512_16x16_1x1_32x8x1_32x8x1_1x16x1x16_4x4x1_1x1_intrawave_v3,0.0,8.66,546.99
304,8,1408,352,78,0,3.4693,a8w8_rowwise_64x16x16x128_16x16_1x1_8x8x1_8x8x1_1x16x1x4_4x4x1_1x1_interwave_v2,0.0,2.29,150.16
304,8,1408,1408,34,0,5.1113,a8w8_rowwise_256x16x64x512_16x16_1x1_32x8x1_32x8x1_1x16x1x16_4x4x1_1x1_intrawave_v3,0.0,6.21,394.47
304,8,1536,2048,34,0,6.4858,a8w8_rowwise_256x16x64x512_16x16_1x1_32x8x1_32x8x1_1x16x1x16_4x4x1_1x1_intrawave_v3,0.0,7.76,491.33
304,8,1792,6144,34,0,12.6677,a8w8_rowwise_256x16x64x512_16x16_1x1_32x8x1_32x8x1_1x16x1x16_4x4x1_1x1_intrawave_v3,0.0,13.91,875.29
304,8,2048,1536,76,0,5.6646,a8w8_rowwise_128x32x16x128_16x16_1x1_8x16x1_8x16x1_1x16x1x8_2x2x1_1x1_interwave_v2,0.0,8.89,563.28
304,8,2048,6144,34,0,12.734,a8w8_rowwise_256x16x64x512_16x16_1x1_32x8x1_32x8x1_1x16x1x16_4x4x1_1x1_intrawave_v3,0.0,15.81,994.57
304,8,3072,4096,34,0,10.1856,a8w8_rowwise_256x16x64x512_16x16_1x1_32x8x1_32x8x1_1x16x1x16_4x4x1_1x1_intrawave_v3,0.0,19.77,1243.41
304,8,3584,6144,34,0,13.245,a8w8_rowwise_256x16x64x512_16x16_1x1_32x8x1_32x8x1_1x16x1x16_4x4x1_1x1_intrawave_v3,0.0,26.6,1670.56
304,8,4096,640,79,0,4.1179,a8w8_rowwise_128x16x32x128_16x16_1x1_8x16x1_8x16x1_1x16x1x8_4x4x1_1x1_interwave_v2,0.0,10.19,653.75
304,8,4096,1024,76,0,5.4571,a8w8_rowwise_128x32x16x128_16x16_1x1_8x16x1_8x16x1_1x16x1x8_2x2x1_1x1_interwave_v2,0.0,12.3,782.11
304,8,4096,3072,34,0,8.4854,a8w8_rowwise_256x16x64x512_16x16_1x1_32x8x1_32x8x1_1x16x1x16_4x4x1_1x1_intrawave_v3,0.0,23.73,1493.51
304,8,5120,640,79,0,4.2331,a8w8_rowwise_128x16x32x128_16x16_1x1_8x16x1_8x16x1_1x16x1x8_4x4x1_1x1_interwave_v2,0.0,12.39,794.65
304,8,5120,2048,34,0,7.5697,a8w8_rowwise_256x16x64x512_16x16_1x1_32x8x1_32x8x1_1x16x1x16_4x4x1_1x1_intrawave_v3,0.0,22.16,1398.21
304,8,6144,768,79,0,4.6058,a8w8_rowwise_128x16x32x128_16x16_1x1_8x16x1_8x16x1_1x16x1x8_4x4x1_1x1_interwave_v2,0.0,16.39,1047.17
304,8,6144,1024,79,0,5.8502,a8w8_rowwise_128x16x32x128_16x16_1x1_8x16x1_8x16x1_1x16x1x8_4x4x1_1x1_interwave_v2,0.0,17.21,1093.63
304,8,6144,1536,79,0,6.7134,a8w8_rowwise_128x16x32x128_16x16_1x1_8x16x1_8x16x1_1x16x1x8_4x4x1_1x1_interwave_v2,0.0,22.49,1422.2
304,8,6144,2048,34,0,7.944,a8w8_rowwise_256x16x64x512_16x16_1x1_32x8x1_32x8x1_1x16x1x16_4x4x1_1x1_intrawave_v3,0.0,25.34,1598.39
304,8,7168,256,49,0,3.3496,a8w8_rowwise_64x16x16x128_16x16_1x1_8x8x1_8x8x1_1x16x1x4_4x4x1_1x1_intrawave_v1,0.0,8.77,582.68
304,8,7168,2304,79,0,7.9874,a8w8_rowwise_128x16x32x128_16x16_1x1_8x16x1_8x16x1_1x16x1x8_4x4x1_1x1_interwave_v2,0.0,33.08,2084.31
304,16,192,7168,34,0,10.487,a8w8_rowwise_256x16x64x512_16x16_1x1_32x8x1_32x8x1_1x16x1x16_4x4x1_1x1_intrawave_v3,0.0,4.2,142.76
304,16,512,7168,34,0,11.7628,a8w8_rowwise_256x16x64x512_16x16_1x1_32x8x1_32x8x1_1x16x1x16_4x4x1_1x1_intrawave_v3,0.0,9.98,323.14
304,16,896,5120,34,0,9.5209,a8w8_rowwise_256x16x64x512_16x16_1x1_32x8x1_32x8x1_1x16x1x16_4x4x1_1x1_intrawave_v3,0.0,15.42,493.45
304,16,1024,5632,34,0,10.3429,a8w8_rowwise_256x16x64x512_16x16_1x1_32x8x1_32x8x1_1x16x1x16_4x4x1_1x1_intrawave_v3,0.0,17.84,569.48
304,16,1056,1408,79,0,4.9031,a8w8_rowwise_128x16x32x128_16x16_1x1_8x16x1_8x16x1_1x16x1x8_4x4x1_1x1_interwave_v2,0.0,9.7,314.73
304,16,1280,4096,34,0,8.2945,a8w8_rowwise_256x16x64x512_16x16_1x1_32x8x1_32x8x1_1x16x1x16_4x4x1_1x1_intrawave_v3,0.0,20.23,644.93
304,16,1408,352,78,0,3.479,a8w8_rowwise_64x16x16x128_16x16_1x1_8x8x1_8x8x1_1x16x1x4_4x4x1_1x1_interwave_v2,0.0,4.56,157.03
304,16,1408,1408,79,0,4.8919,a8w8_rowwise_128x16x32x128_16x16_1x1_8x16x1_8x16x1_1x16x1x8_4x4x1_1x1_interwave_v2,0.0,12.97,419.07
304,16,1536,2048,34,0,5.7535,a8w8_rowwise_256x16x64x512_16x16_1x1_32x8x1_32x8x1_1x16x1x16_4x4x1_1x1_intrawave_v3,0.0,17.5,560.99
304,16,1792,6144,34,0,10.6554,a8w8_rowwise_256x16x64x512_16x16_1x1_32x8x1_32x8x1_1x16x1x16_4x4x1_1x1_intrawave_v3,0.0,33.07,1047.89
304,16,2048,1536,34,0,5.2569,a8w8_rowwise_256x16x64x512_16x16_1x1_32x8x1_32x8x1_1x16x1x16_4x4x1_1x1_intrawave_v3,0.0,19.15,615.54
304,16,2048,6144,34,0,10.6058,a8w8_rowwise_256x16x64x512_16x16_1x1_32x8x1_32x8x1_1x16x1x16_4x4x1_1x1_intrawave_v3,0.0,37.97,1201.87
304,16,3072,4096,34,0,8.7731,a8w8_rowwise_256x16x64x512_16x16_1x1_32x8x1_32x8x1_1x16x1x16_4x4x1_1x1_intrawave_v3,0.0,45.9,1452.94
304,16,3584,6144,34,0,11.084,a8w8_rowwise_256x16x64x512_16x16_1x1_32x8x1_32x8x1_1x16x1x16_4x4x1_1x1_intrawave_v3,0.0,63.57,2005.87
304,16,4096,640,79,0,3.9831,a8w8_rowwise_128x16x32x128_16x16_1x1_8x16x1_8x16x1_1x16x1x8_4x4x1_1x1_interwave_v2,0.0,21.06,693.62
304,16,4096,1024,79,0,5.532,a8w8_rowwise_128x16x32x128_16x16_1x1_8x16x1_8x16x1_1x16x1x8_4x4x1_1x1_interwave_v2,0.0,24.26,784.84
304,16,4096,3072,34,0,7.9285,a8w8_rowwise_256x16x64x512_16x16_1x1_32x8x1_32x8x1_1x16x1x16_4x4x1_1x1_intrawave_v3,0.0,50.79,1609.78
304,16,5120,640,79,0,4.2593,a8w8_rowwise_128x16x32x128_16x16_1x1_8x16x1_8x16x1_1x16x1x8_4x4x1_1x1_interwave_v2,0.0,24.62,810.2
304,16,5120,2048,34,0,6.9031,a8w8_rowwise_256x16x64x512_16x16_1x1_32x8x1_32x8x1_1x16x1x16_4x4x1_1x1_intrawave_v3,0.0,48.61,1547.47
304,16,6144,768,79,0,4.5374,a8w8_rowwise_128x16x32x128_16x16_1x1_8x16x1_8x16x1_1x16x1x8_4x4x1_1x1_interwave_v2,0.0,33.28,1085.97
304,16,6144,1024,79,0,5.8966,a8w8_rowwise_128x16x32x128_16x16_1x1_8x16x1_8x16x1_1x16x1x8_4x4x1_1x1_interwave_v2,0.0,34.14,1103.08
304,16,6144,1536,34,0,6.5307,a8w8_rowwise_256x16x64x512_16x16_1x1_32x8x1_32x8x1_1x16x1x16_4x4x1_1x1_intrawave_v3,0.0,46.24,1478.92
304,16,6144,2048,34,0,7.5348,a8w8_rowwise_256x16x64x512_16x16_1x1_32x8x1_32x8x1_1x16x1x16_4x4x1_1x1_intrawave_v3,0.0,53.44,1700.42
304,16,7168,256,50,0,3.2609,a8w8_rowwise_128x16x32x128_16x16_1x1_8x16x1_8x16x1_1x16x1x8_4x4x1_1x1_intrawave_v1,0.0,18.01,634.33
304,16,7168,2304,79,0,7.5063,a8w8_rowwise_128x16x32x128_16x16_1x1_8x16x1_8x16x1_1x16x1x8_4x4x1_1x1_interwave_v2,0.0,70.41,2235.63
304,24,192,7168,34,0,13.0368,a8w8_rowwise_256x16x64x512_16x16_1x1_32x8x1_32x8x1_1x16x1x16_4x4x1_1x1_intrawave_v3,0.0,5.07,119.47
304,24,512,7168,34,0,14.0299,a8w8_rowwise_256x16x64x512_16x16_1x1_32x8x1_32x8x1_1x16x1x16_4x4x1_1x1_intrawave_v3,0.0,12.56,275.6
304,24,896,5120,34,0,11.5157,a8w8_rowwise_256x16x64x512_16x16_1x1_32x8x1_32x8x1_1x16x1x16_4x4x1_1x1_intrawave_v3,0.0,19.12,412.78
304,24,1024,5632,34,0,12.4948,a8w8_rowwise_256x16x64x512_16x16_1x1_32x8x1_32x8x1_1x16x1x16_4x4x1_1x1_intrawave_v3,0.0,22.16,476.32
304,24,1056,1408,76,0,5.2035,a8w8_rowwise_128x32x16x128_16x16_1x1_8x16x1_8x16x1_1x16x1x8_2x2x1_1x1_interwave_v2,0.0,13.72,301.98
304,24,1280,4096,34,0,9.8826,a8w8_rowwise_256x16x64x512_16x16_1x1_32x8x1_32x8x1_1x16x1x16_4x4x1_1x1_intrawave_v3,0.0,25.46,546.68
304,24,1408,352,78,0,3.5214,a8w8_rowwise_64x16x16x128_16x16_1x1_8x8x1_8x8x1_1x16x1x4_4x4x1_1x1_interwave_v2,0.0,6.76,162.34
304,24,1408,1408,76,0,5.253,a8w8_rowwise_128x32x16x128_16x16_1x1_8x16x1_8x16x1_1x16x1x8_2x2x1_1x1_interwave_v2,0.0,18.12,396.7
304,24,1536,2048,34,0,6.6034,a8w8_rowwise_256x16x64x512_16x16_1x1_32x8x1_32x8x1_1x16x1x16_4x4x1_1x1_intrawave_v3,0.0,22.87,494.99
304,24,1792,6144,34,0,12.994,a8w8_rowwise_256x16x64x512_16x16_1x1_32x8x1_32x8x1_1x16x1x16_4x4x1_1x1_intrawave_v3,0.0,40.67,865.29
304,24,2048,1536,76,0,5.7259,a8w8_rowwise_128x32x16x128_16x16_1x1_8x16x1_8x16x1_1x16x1x8_2x2x1_1x1_interwave_v2,0.0,26.37,572.99
304,24,2048,6144,34,0,13.0149,a8w8_rowwise_256x16x64x512_16x16_1x1_32x8x1_32x8x1_1x16x1x16_4x4x1_1x1_intrawave_v3,0.0,46.41,985.69
304,24,3072,4096,34,0,10.1195,a8w8_rowwise_256x16x64x512_16x16_1x1_32x8x1_32x8x1_1x16x1x16_4x4x1_1x1_intrawave_v3,0.0,59.68,1267.72
304,24,3584,6144,34,0,13.495,a8w8_rowwise_256x16x64x512_16x16_1x1_32x8x1_32x8x1_1x16x1x16_4x4x1_1x1_intrawave_v3,0.0,78.32,1655.4
304,24,4096,640,79,0,4.2723,a8w8_rowwise_128x16x32x128_16x16_1x1_8x16x1_8x16x1_1x16x1x8_4x4x1_1x1_interwave_v2,0.0,29.45,663.2
304,24,4096,1024,79,0,5.4014,a8w8_rowwise_128x16x32x128_16x16_1x1_8x16x1_8x16x1_1x16x1x8_4x4x1_1x1_interwave_v2,0.0,37.27,817.47
304,24,4096,3072,34,0,8.6133,a8w8_rowwise_256x16x64x512_16x16_1x1_32x8x1_32x8x1_1x16x1x16_4x4x1_1x1_intrawave_v3,0.0,70.12,1492.26
304,24,5120,640,76,0,4.5054,a8w8_rowwise_128x32x16x128_16x16_1x1_8x16x1_8x16x1_1x16x1x8_2x2x1_1x1_interwave_v2,0.0,34.91,785.26
304,24,5120,2048,34,0,7.6373,a8w8_rowwise_256x16x64x512_16x16_1x1_32x8x1_32x8x1_1x16x1x16_4x4x1_1x1_intrawave_v3,0.0,65.9,1411.58
304,24,6144,768,76,0,4.9656,a8w8_rowwise_128x32x16x128_16x16_1x1_8x16x1_8x16x1_1x16x1x8_2x2x1_1x1_interwave_v2,0.0,45.61,1013.36
304,24,6144,1024,79,0,6.0444,a8w8_rowwise_128x16x32x128_16x16_1x1_8x16x1_8x16x1_1x16x1x8_4x4x1_1x1_interwave_v2,0.0,49.96,1093.73
304,24,6144,1536,76,0,6.9651,a8w8_rowwise_128x32x16x128_16x16_1x1_8x16x1_8x16x1_1x16x1x8_2x2x1_1x1_interwave_v2,0.0,65.04,1402.56
304,24,6144,2048,34,0,8.1514,a8w8_rowwise_256x16x64x512_16x16_1x1_32x8x1_32x8x1_1x16x1x16_4x4x1_1x1_intrawave_v3,0.0,74.1,1585.86
304,24,7168,256,48,0,3.5455,a8w8_rowwise_128x32x16x128_16x16_1x1_8x16x1_8x16x1_1x16x1x8_2x2x1_1x1_intrawave_v1,0.0,24.84,616.34
304,24,7168,2304,57,0,9.6408,a8w8_rowwise_128x32x16x128_16x16_1x1_8x16x1_8x16x1_1x16x1x8_2x2x1_1x1_intrawave_v2,0.0,82.23,1754.46
304,32,192,7168,34,0,11.287,a8w8_rowwise_256x16x64x512_16x16_1x1_32x8x1_32x8x1_1x16x1x16_4x4x1_1x1_intrawave_v3,0.0,7.8,143.34
304,32,512,7168,34,0,11.9115,a8w8_rowwise_256x16x64x512_16x16_1x1_32x8x1_32x8x1_1x16x1x16_4x4x1_1x1_intrawave_v3,0.0,19.72,330.11
304,32,896,5120,34,0,9.7775,a8w8_rowwise_256x16x64x512_16x16_1x1_32x8x1_32x8x1_1x16x1x16_4x4x1_1x1_intrawave_v3,0.0,30.03,491.81
304,32,1024,5632,34,0,10.4751,a8w8_rowwise_256x16x64x512_16x16_1x1_32x8x1_32x8x1_1x16x1x16_4x4x1_1x1_intrawave_v3,0.0,35.24,574.02
304,32,1056,1408,76,0,4.8966,a8w8_rowwise_128x32x16x128_16x16_1x1_8x16x1_8x16x1_1x16x1x8_2x2x1_1x1_interwave_v2,0.0,19.43,326.65
304,32,1280,4096,34,0,8.5434,a8w8_rowwise_256x16x64x512_16x16_1x1_32x8x1_32x8x1_1x16x1x16_4x4x1_1x1_intrawave_v3,0.0,39.28,638.61
304,32,1408,352,78,0,3.5279,a8w8_rowwise_64x16x16x128_16x16_1x1_8x8x1_8x8x1_1x16x1x4_4x4x1_1x1_interwave_v2,0.0,8.99,169.22
304,32,1408,1408,76,0,4.896,a8w8_rowwise_128x32x16x128_16x16_1x1_8x16x1_8x16x1_1x16x1x8_2x2x1_1x1_interwave_v2,0.0,25.91,432.52
304,32,1536,2048,34,0,5.9986,a8w8_rowwise_256x16x64x512_16x16_1x1_32x8x1_32x8x1_1x16x1x16_4x4x1_1x1_intrawave_v3,0.0,33.56,551.72
304,32,1792,6144,34,0,10.8454,a8w8_rowwise_256x16x64x512_16x16_1x1_32x8x1_32x8x1_1x16x1x16_4x4x1_1x1_intrawave_v3,0.0,64.97,1043.88
304,32,2048,1536,76,0,5.4817,a8w8_rowwise_128x32x16x128_16x16_1x1_8x16x1_8x16x1_1x16x1x8_2x2x1_1x1_interwave_v2,0.0,36.73,606.74
304,32,2048,6144,34,0,10.8788,a8w8_rowwise_256x16x64x512_16x16_1x1_32x8x1_32x8x1_1x16x1x16_4x4x1_1x1_intrawave_v3,0.0,74.03,1186.77
304,32,3072,4096,34,0,8.7289,a8w8_rowwise_256x16x64x512_16x16_1x1_32x8x1_32x8x1_1x16x1x16_4x4x1_1x1_intrawave_v3,0.0,92.26,1479.06
304,32,3584,6144,34,0,11.7628,a8w8_rowwise_256x16x64x512_16x16_1x1_32x8x1_32x8x1_1x16x1x16_4x4x1_1x1_intrawave_v3,0.0,119.81,1908.23
304,32,4096,640,76,0,4.164,a8w8_rowwise_128x32x16x128_16x16_1x1_8x16x1_8x16x1_1x16x1x8_2x2x1_1x1_interwave_v2,0.0,40.29,697.42
304,32,4096,1024,79,0,5.2723,a8w8_rowwise_128x16x32x128_16x16_1x1_8x16x1_8x16x1_1x16x1x8_4x4x1_1x1_interwave_v2,0.0,50.91,851.47
304,32,4096,3072,34,0,8.0343,a8w8_rowwise_256x16x64x512_16x16_1x1_32x8x1_32x8x1_1x16x1x16_4x4x1_1x1_intrawave_v3,0.0,100.23,1611.01
304,32,5120,640,79,0,4.4896,a8w8_rowwise_128x16x32x128_16x16_1x1_8x16x1_8x16x1_1x16x1x8_4x4x1_1x1_interwave_v2,0.0,46.71,807.41
304,32,5120,2048,34,0,7.211,a8w8_rowwise_256x16x64x512_16x16_1x1_32x8x1_32x8x1_1x16x1x16_4x4x1_1x1_intrawave_v3,0.0,93.06,1508.66
304,32,6144,768,76,0,4.8033,a8w8_rowwise_128x32x16x128_16x16_1x1_8x16x1_8x16x1_1x16x1x8_2x2x1_1x1_interwave_v2,0.0,62.87,1069.34
304,32,6144,1024,79,0,6.1898,a8w8_rowwise_128x16x32x128_16x16_1x1_8x16x1_8x16x1_1x16x1x8_4x4x1_1x1_interwave_v2,0.0,65.05,1085.24
304,32,6144,1536,34,0,6.7182,a8w8_rowwise_256x16x64x512_16x16_1x1_32x8x1_32x8x1_1x16x1x16_4x4x1_1x1_intrawave_v3,0.0,89.9,1470.57
304,32,6144,2048,34,0,8.1523,a8w8_rowwise_256x16x64x512_16x16_1x1_32x8x1_32x8x1_1x16x1x16_4x4x1_1x1_intrawave_v3,0.0,98.78,1599.75
304,32,7168,256,67,0,3.5342,a8w8_rowwise_128x32x16x128_16x16_1x1_8x16x1_8x16x1_1x16x1x8_2x2x1_1x1_interwave_v1,0.0,33.23,651.34
304,32,7168,2304,57,0,9.1271,a8w8_rowwise_128x32x16x128_16x16_1x1_8x16x1_8x16x1_1x16x1x8_2x2x1_1x1_intrawave_v2,0.0,115.81,1867.8
304,40,192,7168,34,0,13.0303,a8w8_rowwise_256x16x64x512_16x16_1x1_32x8x1_32x8x1_1x16x1x16_4x4x1_1x1_intrawave_v3,0.0,8.45,128.8
304,40,512,7168,34,0,13.9742,a8w8_rowwise_256x16x64x512_16x16_1x1_32x8x1_32x8x1_1x16x1x16_4x4x1_1x1_intrawave_v3,0.0,21.01,286.08
304,40,896,5120,34,0,11.4243,a8w8_rowwise_256x16x64x512_16x16_1x1_32x8x1_32x8x1_1x16x1x16_4x4x1_1x1_intrawave_v3,0.0,32.12,425.76
304,40,1024,5632,34,0,12.4487,a8w8_rowwise_256x16x64x512_16x16_1x1_32x8x1_32x8x1_1x16x1x16_4x4x1_1x1_intrawave_v3,0.0,37.06,487.95
304,40,1056,1408,76,0,5.2696,a8w8_rowwise_128x32x16x128_16x16_1x1_8x16x1_8x16x1_1x16x1x8_2x2x1_1x1_interwave_v2,0.0,22.57,308.88
304,40,1280,4096,34,0,9.9508,a8w8_rowwise_256x16x64x512_16x16_1x1_32x8x1_32x8x1_1x16x1x16_4x4x1_1x1_intrawave_v3,0.0,42.15,553.64
304,40,1408,352,78,0,3.5223,a8w8_rowwise_64x16x16x128_16x16_1x1_8x8x1_8x8x1_1x16x1x4_4x4x1_1x1_interwave_v2,0.0,11.26,176.68
304,40,1408,1408,79,0,5.3382,a8w8_rowwise_128x16x32x128_16x16_1x1_8x16x1_8x16x1_1x16x1x8_4x4x1_1x1_interwave_v2,0.0,29.71,403.02
304,40,1536,2048,34,0,6.7334,a8w8_rowwise_256x16x64x512_16x16_1x1_32x8x1_32x8x1_1x16x1x16_4x4x1_1x1_intrawave_v3,0.0,37.37,497.6
304,40,1792,6144,34,0,12.8906,a8w8_rowwise_256x16x64x512_16x16_1x1_32x8x1_32x8x1_1x16x1x16_4x4x1_1x1_intrawave_v3,0.0,68.33,884.3
304,40,2048,1536,76,0,5.9413,a8w8_rowwise_128x32x16x128_16x16_1x1_8x16x1_8x16x1_1x16x1x8_2x2x1_1x1_interwave_v2,0.0,42.36,567.39
304,40,2048,6144,34,0,13.0574,a8w8_rowwise_256x16x64x512_16x16_1x1_32x8x1_32x8x1_1x16x1x16_4x4x1_1x1_intrawave_v3,0.0,77.09,995.03
304,40,3072,4096,34,0,10.1574,a8w8_rowwise_256x16x64x512_16x16_1x1_32x8x1_32x8x1_1x16x1x16_4x4x1_1x1_intrawave_v3,0.0,99.1,1279.12
304,40,3584,6144,34,0,14.2607,a8w8_rowwise_256x16x64x512_16x16_1x1_32x8x1_32x8x1_1x16x1x16_4x4x1_1x1_intrawave_v3,0.0,123.53,1581.45
304,40,4096,640,79,0,4.4204,a8w8_rowwise_128x16x32x128_16x16_1x1_8x16x1_8x16x1_1x16x1x8_4x4x1_1x1_interwave_v2,0.0,47.44,672.95
304,40,4096,1024,76,0,5.5994,a8w8_rowwise_128x32x16x128_16x16_1x1_8x16x1_8x16x1_1x16x1x8_2x2x1_1x1_interwave_v2,0.0,59.93,814.9
304,40,4096,3072,34,0,9.3813,a8w8_rowwise_256x16x64x512_16x16_1x1_32x8x1_32x8x1_1x16x1x16_4x4x1_1x1_intrawave_v3,0.0,107.3,1389.3
304,40,5120,640,79,0,4.7507,a8w8_rowwise_128x16x32x128_16x16_1x1_8x16x1_8x16x1_1x16x1x8_4x4x1_1x1_interwave_v2,0.0,55.18,781.36
304,40,5120,2048,30,0,8.1224,a8w8_rowwise_256x32x64x512_16x16_1x2_32x8x1_32x8x1_1x32x1x8_8x8x1_1x2_intrawave_v3,0.0,103.28,1351.48
304,40,6144,768,79,0,5.0758,a8w8_rowwise_128x16x32x128_16x16_1x1_8x16x1_8x16x1_1x16x1x8_4x4x1_1x1_interwave_v2,0.0,74.37,1032.51
304,40,6144,1024,79,0,6.1338,a8w8_rowwise_128x16x32x128_16x16_1x1_8x16x1_8x16x1_1x16x1x8_4x4x1_1x1_interwave_v2,0.0,82.06,1112.51
304,40,6144,1536,79,0,7.6957,a8w8_rowwise_128x16x32x128_16x16_1x1_8x16x1_8x16x1_1x16x1x8_4x4x1_1x1_interwave_v2,0.0,98.1,1298.15
304,40,6144,2048,34,0,9.117,a8w8_rowwise_256x16x64x512_16x16_1x1_32x8x1_32x8x1_1x16x1x16_4x4x1_1x1_intrawave_v3,0.0,110.41,1443.06
304,40,7168,256,50,0,3.7687,a8w8_rowwise_128x16x32x128_16x16_1x1_8x16x1_8x16x1_1x16x1x8_4x4x1_1x1_intrawave_v1,0.0,38.95,641.78
304,40,7168,2304,79,0,10.9283,a8w8_rowwise_128x16x32x128_16x16_1x1_8x16x1_8x16x1_1x16x1x8_4x4x1_1x1_interwave_v2,0.0,120.9,1572.13
304,48,192,7168,34,0,11.2257,a8w8_rowwise_256x16x64x512_16x16_1x1_32x8x1_32x8x1_1x16x1x16_4x4x1_1x1_intrawave_v3,0.0,11.77,154.89
304,48,512,7168,34,0,11.9101,a8w8_rowwise_256x16x64x512_16x16_1x1_32x8x1_32x8x1_1x16x1x16_4x4x1_1x1_intrawave_v3,0.0,29.58,341.16
304,48,896,5120,34,0,9.6842,a8w8_rowwise_256x16x64x512_16x16_1x1_32x8x1_32x8x1_1x16x1x16_4x4x1_1x1_intrawave_v3,0.0,45.48,507.97
304,48,1024,5632,34,0,10.5603,a8w8_rowwise_256x16x64x512_16x16_1x1_32x8x1_32x8x1_1x16x1x16_4x4x1_1x1_intrawave_v3,0.0,52.43,581.03
304,48,1056,1408,79,0,5.0466,a8w8_rowwise_128x16x32x128_16x16_1x1_8x16x1_8x16x1_1x16x1x8_4x4x1_1x1_interwave_v2,0.0,28.28,328.1
304,48,1280,4096,34,0,8.5438,a8w8_rowwise_256x16x64x512_16x16_1x1_32x8x1_32x8x1_1x16x1x16_4x4x1_1x1_intrawave_v3,0.0,58.91,651.04
304,48,1408,352,78,0,3.5218,a8w8_rowwise_64x16x16x128_16x16_1x1_8x8x1_8x8x1_1x16x1x4_4x4x1_1x1_interwave_v2,0.0,13.51,183.91
304,48,1408,1408,79,0,5.0261,a8w8_rowwise_128x16x32x128_16x16_1x1_8x16x1_8x16x1_1x16x1x8_4x4x1_1x1_interwave_v2,0.0,37.87,434.77
304,48,1536,2048,34,0,6.0233,a8w8_rowwise_256x16x64x512_16x16_1x1_32x8x1_32x8x1_1x16x1x16_4x4x1_1x1_intrawave_v3,0.0,50.14,563.06
304,48,1792,6144,34,0,10.877,a8w8_rowwise_256x16x64x512_16x16_1x1_32x8x1_32x8x1_1x16x1x16_4x4x1_1x1_intrawave_v3,0.0,97.17,1055.16
304,48,2048,1536,34,0,5.5517,a8w8_rowwise_256x16x64x512_16x16_1x1_32x8x1_32x8x1_1x16x1x16_4x4x1_1x1_intrawave_v3,0.0,54.4,615.32
304,48,2048,6144,34,0,10.9632,a8w8_rowwise_256x16x64x512_16x16_1x1_32x8x1_32x8x1_1x16x1x16_4x4x1_1x1_intrawave_v3,0.0,110.18,1192.57
304,48,3072,4096,34,0,9.0499,a8w8_rowwise_256x16x64x512_16x16_1x1_32x8x1_32x8x1_1x16x1x16_4x4x1_1x1_intrawave_v3,0.0,133.48,1444.7
304,48,3584,6144,34,0,13.4154,a8w8_rowwise_256x16x64x512_16x16_1x1_32x8x1_32x8x1_1x16x1x16_4x4x1_1x1_intrawave_v3,0.0,157.57,1689.03
304,48,4096,640,79,0,4.3466,a8w8_rowwise_128x16x32x128_16x16_1x1_8x16x1_8x16x1_1x16x1x8_4x4x1_1x1_interwave_v2,0.0,57.9,700.63
304,48,4096,1024,76,0,5.6879,a8w8_rowwise_128x32x16x128_16x16_1x1_8x16x1_8x16x1_1x16x1x8_2x2x1_1x1_interwave_v2,0.0,70.79,815.18
304,48,4096,3072,34,0,9.5217,a8w8_rowwise_256x16x64x512_16x16_1x1_32x8x1_32x8x1_1x16x1x16_4x4x1_1x1_intrawave_v3,0.0,126.86,1378.28
304,48,5120,640,79,0,4.6463,a8w8_rowwise_128x16x32x128_16x16_1x1_8x16x1_8x16x1_1x16x1x8_4x4x1_1x1_interwave_v2,0.0,67.7,817.65
304,48,5120,2048,30,0,8.219,a8w8_rowwise_256x32x64x512_16x16_1x2_32x8x1_32x8x1_1x32x1x8_8x8x1_1x2_intrawave_v3,0.0,122.48,1347.56
304,48,6144,768,79,0,5.099,a8w8_rowwise_128x16x32x128_16x16_1x1_8x16x1_8x16x1_1x16x1x8_4x4x1_1x1_interwave_v2,0.0,88.84,1048.3
304,48,6144,1024,79,0,6.2303,a8w8_rowwise_128x16x32x128_16x16_1x1_8x16x1_8x16x1_1x16x1x8_4x4x1_1x1_interwave_v2,0.0,96.94,1112.38
304,48,6144,1536,79,0,7.8122,a8w8_rowwise_128x16x32x128_16x16_1x1_8x16x1_8x16x1_1x16x1x8_4x4x1_1x1_interwave_v2,0.0,115.97,1292.94
304,48,6144,2048,34,0,9.1622,a8w8_rowwise_256x16x64x512_16x16_1x1_32x8x1_32x8x1_1x16x1x16_4x4x1_1x1_intrawave_v3,0.0,131.84,1448.46
304,48,7168,256,50,0,3.7178,a8w8_rowwise_128x16x32x128_16x16_1x1_8x16x1_8x16x1_1x16x1x8_4x4x1_1x1_intrawave_v1,0.0,47.38,681.97
304,48,7168,2304,60,0,10.7062,a8w8_rowwise_128x16x32x128_16x16_1x1_8x16x1_8x16x1_1x16x1x8_4x4x1_1x1_intrawave_v2,0.0,148.09,1617.17
304,56,192,7168,34,0,13.0541,a8w8_rowwise_256x16x64x512_16x16_1x1_32x8x1_32x8x1_1x16x1x16_4x4x1_1x1_intrawave_v3,0.0,11.81,137.82
304,56,512,7168,34,0,14.4397,a8w8_rowwise_256x16x64x512_16x16_1x1_32x8x1_32x8x1_1x16x1x16_4x4x1_1x1_intrawave_v3,0.0,28.47,285.93
304,56,896,5120,34,0,11.5237,a8w8_rowwise_256x16x64x512_16x16_1x1_32x8x1_32x8x1_1x16x1x16_4x4x1_1x1_intrawave_v3,0.0,44.59,431.68
304,56,1024,5632,34,0,12.4684,a8w8_rowwise_256x16x64x512_16x16_1x1_32x8x1_32x8x1_1x16x1x16_4x4x1_1x1_intrawave_v3,0.0,51.8,497.04
304,56,1056,1408,79,0,5.3718,a8w8_rowwise_128x16x32x128_16x16_1x1_8x16x1_8x16x1_1x16x1x8_4x4x1_1x1_interwave_v2,0.0,31.0,313.48
304,56,1280,4096,34,0,9.9382,a8w8_rowwise_256x16x64x512_16x16_1x1_32x8x1_32x8x1_1x16x1x16_4x4x1_1x1_intrawave_v3,0.0,59.09,565.05
304,56,1408,352,78,0,3.5113,a8w8_rowwise_64x16x16x128_16x16_1x1_8x8x1_8x8x1_1x16x1x4_4x4x1_1x1_interwave_v2,0.0,15.81,191.67
304,56,1408,1408,76,0,5.3806,a8w8_rowwise_128x32x16x128_16x16_1x1_8x16x1_8x16x1_1x16x1x8_2x2x1_1x1_interwave_v2,0.0,41.27,412.41
304,56,1536,2048,34,0,6.7422,a8w8_rowwise_256x16x64x512_16x16_1x1_32x8x1_32x8x1_1x16x1x16_4x4x1_1x1_intrawave_v3,0.0,52.26,509.1
304,56,1792,6144,34,0,13.0765,a8w8_rowwise_256x16x64x512_16x16_1x1_32x8x1_32x8x1_1x16x1x16_4x4x1_1x1_intrawave_v3,0.0,94.3,883.63
304,56,2048,1536,76,0,5.9605,a8w8_rowwise_128x32x16x128_16x16_1x1_8x16x1_8x16x1_1x16x1x8_2x2x1_1x1_interwave_v2,0.0,59.11,580.68
304,56,2048,6144,34,0,13.1669,a8w8_rowwise_256x16x64x512_16x16_1x1_32x8x1_32x8x1_1x16x1x16_4x4x1_1x1_intrawave_v3,0.0,107.03,999.2
304,56,3072,4096,34,0,11.1168,a8w8_rowwise_256x16x64x512_16x16_1x1_32x8x1_32x8x1_1x16x1x16_4x4x1_1x1_intrawave_v3,0.0,126.77,1183.47
304,56,3584,6144,30,0,14.908,a8w8_rowwise_256x32x64x512_16x16_1x2_32x8x1_32x8x1_1x32x1x8_8x8x1_1x2_intrawave_v3,0.0,165.43,1527.07
304,56,4096,640,79,0,4.5087,a8w8_rowwise_128x16x32x128_16x16_1x1_8x16x1_8x16x1_1x16x1x8_4x4x1_1x1_interwave_v2,0.0,65.12,691.12
304,56,4096,1024,76,0,5.6615,a8w8_rowwise_128x32x16x128_16x16_1x1_8x16x1_8x16x1_1x16x1x8_2x2x1_1x1_interwave_v2,0.0,82.97,832.01
304,56,4096,3072,30,0,9.8076,a8w8_rowwise_256x32x64x512_16x16_1x2_32x8x1_32x8x1_1x32x1x8_8x8x1_1x2_intrawave_v3,0.0,143.69,1347.29
304,56,5120,640,79,0,4.9348,a8w8_rowwise_128x16x32x128_16x16_1x1_8x16x1_8x16x1_1x16x1x8_4x4x1_1x1_interwave_v2,0.0,74.37,787.48
304,56,5120,2048,30,0,8.3221,a8w8_rowwise_256x32x64x512_16x16_1x2_32x8x1_32x8x1_1x32x1x8_8x8x1_1x2_intrawave_v3,0.0,141.12,1342.68
304,56,6144,768,76,0,5.4451,a8w8_rowwise_128x32x16x128_16x16_1x1_8x16x1_8x16x1_1x16x1x8_2x2x1_1x1_interwave_v2,0.0,97.06,1000.85
304,56,6144,1024,76,0,6.4074,a8w8_rowwise_128x32x16x128_16x16_1x1_8x16x1_8x16x1_1x16x1x8_2x2x1_1x1_interwave_v2,0.0,109.97,1098.25
304,56,6144,1536,30,0,8.4728,a8w8_rowwise_256x32x64x512_16x16_1x2_32x8x1_32x8x1_1x32x1x8_8x8x1_1x2_intrawave_v3,0.0,124.75,1205.19
304,56,6144,2048,30,0,9.6448,a8w8_rowwise_256x32x64x512_16x16_1x2_32x8x1_32x8x1_1x32x1x8_8x8x1_1x2_intrawave_v3,0.0,146.12,1387.87
304,56,7168,256,50,0,4.0587,a8w8_rowwise_128x16x32x128_16x16_1x1_8x16x1_8x16x1_1x16x1x8_4x4x1_1x1_intrawave_v1,0.0,50.64,653.45
304,56,7168,2304,30,0,11.4979,a8w8_rowwise_256x32x64x512_16x16_1x2_32x8x1_32x8x1_1x32x1x8_8x8x1_1x2_intrawave_v3,0.0,160.87,1517.4
304,64,192,7168,34,0,11.2733,a8w8_rowwise_256x16x64x512_16x16_1x1_32x8x1_32x8x1_1x16x1x16_4x4x1_1x1_intrawave_v3,0.0,15.63,164.95
304,64,512,7168,34,0,11.9348,a8w8_rowwise_256x16x64x512_16x16_1x1_32x8x1_32x8x1_1x16x1x16_4x4x1_1x1_intrawave_v3,0.0,39.36,351.43
304,64,896,5120,34,0,9.6582,a8w8_rowwise_256x16x64x512_16x16_1x1_32x8x1_32x8x1_1x16x1x16_4x4x1_1x1_intrawave_v3,0.0,60.8,520.79
304,64,1024,5632,34,0,10.5427,a8w8_rowwise_256x16x64x512_16x16_1x1_32x8x1_32x8x1_1x16x1x16_4x4x1_1x1_intrawave_v3,0.0,70.02,593.65
304,64,1056,1408,76,0,5.0679,a8w8_rowwise_128x32x16x128_16x16_1x1_8x16x1_8x16x1_1x16x1x8_2x2x1_1x1_interwave_v2,0.0,37.55,337.84
304,64,1280,4096,34,0,8.5653,a8w8_rowwise_256x16x64x512_16x16_1x1_32x8x1_32x8x1_1x16x1x16_4x4x1_1x1_intrawave_v3,0.0,78.35,661.84
304,64,1408,352,78,0,3.6039,a8w8_rowwise_64x16x16x128_16x16_1x1_8x8x1_8x8x1_1x16x1x4_4x4x1_1x1_interwave_v2,0.0,17.6,193.78
304,64,1408,1408,79,0,5.0609,a8w8_rowwise_128x16x32x128_16x16_1x1_8x16x1_8x16x1_1x16x1x8_4x4x1_1x1_interwave_v2,0.0,50.14,445.14
304,64,1536,2048,34,0,6.088,a8w8_rowwise_256x16x64x512_16x16_1x1_32x8x1_32x8x1_1x16x1x16_4x4x1_1x1_intrawave_v3,0.0,66.14,570.53
304,64,1792,6144,34,0,10.9769,a8w8_rowwise_256x16x64x512_16x16_1x1_32x8x1_32x8x1_1x16x1x16_4x4x1_1x1_intrawave_v3,0.0,128.39,1059.74
304,64,2048,1536,34,0,5.5724,a8w8_rowwise_256x16x64x512_16x16_1x1_32x8x1_32x8x1_1x16x1x16_4x4x1_1x1_intrawave_v3,0.0,72.26,629.2
304,64,2048,6144,34,0,11.013,a8w8_rowwise_256x16x64x512_16x16_1x1_32x8x1_32x8x1_1x16x1x16_4x4x1_1x1_intrawave_v3,0.0,146.25,1202.06
304,64,3072,4096,34,0,10.049,a8w8_rowwise_256x16x64x512_16x16_1x1_32x8x1_32x8x1_1x16x1x16_4x4x1_1x1_intrawave_v3,0.0,160.28,1317.37
304,64,3584,6144,34,0,14.2004,a8w8_rowwise_256x16x64x512_16x16_1x1_32x8x1_32x8x1_1x16x1x16_4x4x1_1x1_intrawave_v3,0.0,198.49,1610.66
304,64,4096,640,79,0,4.4444,a8w8_rowwise_128x16x32x128_16x16_1x1_8x16x1_8x16x1_1x16x1x8_4x4x1_1x1_interwave_v2,0.0,75.5,717.01
304,64,4096,1024,76,0,5.6654,a8w8_rowwise_128x32x16x128_16x16_1x1_8x16x1_8x16x1_1x16x1x8_2x2x1_1x1_interwave_v2,0.0,94.76,844.45
304,64,4096,3072,30,0,9.3185,a8w8_rowwise_256x32x64x512_16x16_1x2_32x8x1_32x8x1_1x32x1x8_8x8x1_1x2_intrawave_v3,0.0,172.84,1427.68
304,64,5120,640,79,0,4.8163,a8w8_rowwise_128x16x32x128_16x16_1x1_8x16x1_8x16x1_1x16x1x8_4x4x1_1x1_interwave_v2,0.0,87.09,824.93
304,64,5120,2048,30,0,8.487,a8w8_rowwise_256x32x64x512_16x16_1x2_32x8x1_32x8x1_1x32x1x8_8x8x1_1x2_intrawave_v3,0.0,158.15,1328.17
304,64,6144,768,76,0,5.3081,a8w8_rowwise_128x32x16x128_16x16_1x1_8x16x1_8x16x1_1x16x1x8_2x2x1_1x1_interwave_v2,0.0,113.78,1046.36
304,64,6144,1024,76,0,6.5436,a8w8_rowwise_128x32x16x128_16x16_1x1_8x16x1_8x16x1_1x16x1x8_2x2x1_1x1_interwave_v2,0.0,123.07,1091.67
304,64,6144,1536,23,0,8.0872,a8w8_rowwise_256x64x64x512_32x32_1x1_32x8x1_32x8x1_1x32x1x8_8x8x1_1x1_intrawave_v3,0.0,149.37,1276.33
304,64,6144,2048,30,0,9.3832,a8w8_rowwise_256x32x64x512_16x16_1x2_32x8x1_32x8x1_1x32x1x8_8x8x1_1x2_intrawave_v3,0.0,171.65,1438.79
304,64,7168,256,50,0,3.9525,a8w8_rowwise_128x16x32x128_16x16_1x1_8x16x1_8x16x1_1x16x1x8_4x4x1_1x1_intrawave_v1,0.0,59.43,700.54
304,64,7168,2304,76,0,11.0459,a8w8_rowwise_128x32x16x128_16x16_1x1_8x16x1_8x16x1_1x16x1x8_2x2x1_1x1_interwave_v2,0.0,191.38,1591.54
304,72,192,7168,34,0,13.1143,a8w8_rowwise_256x16x64x512_16x16_1x1_32x8x1_32x8x1_1x16x1x16_4x4x1_1x1_intrawave_v3,0.0,15.11,146.41
304,72,512,7168,34,0,14.2034,a8w8_rowwise_256x16x64x512_16x16_1x1_32x8x1_32x8x1_1x16x1x16_4x4x1_1x1_intrawave_v3,0.0,37.21,299.92
304,72,896,5120,34,0,11.4249,a8w8_rowwise_256x16x64x512_16x16_1x1_32x8x1_32x8x1_1x16x1x16_4x4x1_1x1_intrawave_v3,0.0,57.82,445.1
304,72,1024,5632,34,0,12.4764,a8w8_rowwise_256x16x64x512_16x16_1x1_32x8x1_32x8x1_1x16x1x16_4x4x1_1x1_intrawave_v3,0.0,66.56,506.57
304,72,1056,1408,79,0,5.3492,a8w8_rowwise_128x16x32x128_16x16_1x1_8x16x1_8x16x1_1x16x1x8_4x4x1_1x1_interwave_v2,0.0,40.03,325.34
304,72,1280,4096,34,0,10.0142,a8w8_rowwise_256x16x64x512_16x16_1x1_32x8x1_32x8x1_1x16x1x16_4x4x1_1x1_intrawave_v3,0.0,75.39,571.4
304,72,1408,352,78,0,3.6494,a8w8_rowwise_64x16x16x128_16x16_1x1_8x8x1_8x8x1_1x16x1x4_4x4x1_1x1_interwave_v2,0.0,19.56,198.31
304,72,1408,1408,76,0,5.4792,a8w8_rowwise_128x32x16x128_16x16_1x1_8x16x1_8x16x1_1x16x1x8_2x2x1_1x1_interwave_v2,0.0,52.1,417.32
304,72,1536,2048,34,0,6.8864,a8w8_rowwise_256x16x64x512_16x16_1x1_32x8x1_32x8x1_1x16x1x16_4x4x1_1x1_intrawave_v3,0.0,65.78,510.33
304,72,1792,6144,34,0,13.5967,a8w8_rowwise_256x16x64x512_16x16_1x1_32x8x1_32x8x1_1x16x1x16_4x4x1_1x1_intrawave_v3,0.0,116.61,861.27
304,72,2048,1536,34,0,6.237,a8w8_rowwise_256x16x64x512_16x16_1x1_32x8x1_32x8x1_1x16x1x16_4x4x1_1x1_intrawave_v3,0.0,72.63,569.38
304,72,2048,6144,34,0,13.9856,a8w8_rowwise_256x16x64x512_16x16_1x1_32x8x1_32x8x1_1x16x1x16_4x4x1_1x1_intrawave_v3,0.0,129.56,952.42
304,72,3072,4096,30,0,11.6984,a8w8_rowwise_256x32x64x512_16x16_1x2_32x8x1_32x8x1_1x32x1x8_8x8x1_1x2_intrawave_v3,0.0,154.89,1138.63
304,72,3584,6144,30,0,17.4049,a8w8_rowwise_256x32x64x512_16x16_1x2_32x8x1_32x8x1_1x32x1x8_8x8x1_1x2_intrawave_v3,0.0,182.18,1320.24
304,72,4096,640,76,0,4.9771,a8w8_rowwise_128x32x16x128_16x16_1x1_8x16x1_8x16x1_1x16x1x8_2x2x1_1x1_interwave_v2,0.0,75.84,654.47
304,72,4096,1024,76,0,6.4542,a8w8_rowwise_128x32x16x128_16x16_1x1_8x16x1_8x16x1_1x16x1x8_2x2x1_1x1_interwave_v2,0.0,93.58,752.67
304,72,4096,3072,30,0,11.0979,a8w8_rowwise_256x32x64x512_16x16_1x2_32x8x1_32x8x1_1x32x1x8_8x8x1_1x2_intrawave_v3,0.0,163.27,1206.89
304,72,5120,640,76,0,5.3445,a8w8_rowwise_128x32x16x128_16x16_1x1_8x16x1_8x16x1_1x16x1x8_2x2x1_1x1_interwave_v2,0.0,88.29,759.69
304,72,5120,2048,30,0,9.5707,a8w8_rowwise_256x32x64x512_16x16_1x2_32x8x1_32x8x1_1x32x1x8_8x8x1_1x2_intrawave_v3,0.0,157.77,1188.05
304,72,6144,768,57,0,6.1257,a8w8_rowwise_128x32x16x128_16x16_1x1_8x16x1_8x16x1_1x16x1x8_2x2x1_1x1_intrawave_v2,0.0,110.92,923.75
304,72,6144,1024,57,0,8.1587,a8w8_rowwise_128x32x16x128_16x16_1x1_8x16x1_8x16x1_1x16x1x8_2x2x1_1x1_intrawave_v2,0.0,111.04,888.61
304,72,6144,1536,30,0,9.4944,a8w8_rowwise_256x32x64x512_16x16_1x2_32x8x1_32x8x1_1x32x1x8_8x8x1_1x2_intrawave_v3,0.0,143.13,1098.81
304,72,6144,2048,30,0,10.2452,a8w8_rowwise_256x32x64x512_16x16_1x2_32x8x1_32x8x1_1x32x1x8_8x8x1_1x2_intrawave_v3,0.0,176.86,1328.93
304,72,7168,256,50,0,4.2073,a8w8_rowwise_128x16x32x128_16x16_1x1_8x16x1_8x16x1_1x16x1x8_4x4x1_1x1_intrawave_v1,0.0,62.81,685.86
304,72,7168,2304,28,0,12.9268,a8w8_rowwise_256x32x128x256_32x32_1x1_16x16x1_16x16x1_1x32x1x8_8x8x1_1x1_intrawave_v3,0.0,183.97,1370.27
304,80,192,7168,34,0,11.8683,a8w8_rowwise_256x16x64x512_16x16_1x1_32x8x1_32x8x1_1x16x1x16_4x4x1_1x1_intrawave_v3,0.0,18.55,166.87
304,80,512,7168,34,0,12.1341,a8w8_rowwise_256x16x64x512_16x16_1x1_32x8x1_32x8x1_1x16x1x16_4x4x1_1x1_intrawave_v3,0.0,48.39,356.46
304,80,896,5120,34,0,9.951,a8w8_rowwise_256x16x64x512_16x16_1x1_32x8x1_32x8x1_1x16x1x16_4x4x1_1x1_intrawave_v3,0.0,73.76,516.58
304,80,1024,5632,34,0,10.7977,a8w8_rowwise_256x16x64x512_16x16_1x1_32x8x1_32x8x1_1x16x1x16_4x4x1_1x1_intrawave_v3,0.0,85.46,591.01
304,80,1056,1408,79,0,5.7058,a8w8_rowwise_128x16x32x128_16x16_1x1_8x16x1_8x16x1_1x16x1x8_4x4x1_1x1_interwave_v2,0.0,41.69,309.94
304,80,1280,4096,34,0,8.9167,a8w8_rowwise_256x16x64x512_16x16_1x1_32x8x1_32x8x1_1x16x1x16_4x4x1_1x1_intrawave_v3,0.0,94.08,647.7
304,80,1408,352,78,0,4.2878,a8w8_rowwise_64x16x16x128_16x16_1x1_8x8x1_8x8x1_1x16x1x4_4x4x1_1x1_interwave_v2,0.0,18.49,174.69
304,80,1408,1408,79,0,5.715,a8w8_rowwise_128x16x32x128_16x16_1x1_8x16x1_8x16x1_1x16x1x8_4x4x1_1x1_interwave_v2,0.0,55.5,406.02
304,80,1536,2048,34,0,6.5899,a8w8_rowwise_256x16x64x512_16x16_1x1_32x8x1_32x8x1_1x16x1x16_4x4x1_1x1_intrawave_v3,0.0,76.38,539.51
304,80,1792,6144,34,0,12.8339,a8w8_rowwise_256x16x64x512_16x16_1x1_32x8x1_32x8x1_1x16x1x16_4x4x1_1x1_intrawave_v3,0.0,137.26,918.53
304,80,2048,1536,34,0,6.1379,a8w8_rowwise_256x16x64x512_16x16_1x1_32x8x1_32x8x1_1x16x1x16_4x4x1_1x1_intrawave_v3,0.0,82.0,585.92
304,80,2048,6144,34,0,13.8196,a8w8_rowwise_256x16x64x512_16x16_1x1_32x8x1_32x8x1_1x16x1x16_4x4x1_1x1_intrawave_v3,0.0,145.68,969.79
304,80,3072,4096,30,0,12.4908,a8w8_rowwise_256x32x64x512_16x16_1x2_32x8x1_32x8x1_1x32x1x8_8x8x1_1x2_intrawave_v3,0.0,161.18,1072.96
304,80,3584,6144,30,0,18.3712,a8w8_rowwise_256x32x64x512_16x16_1x2_32x8x1_32x8x1_1x32x1x8_8x8x1_1x2_intrawave_v3,0.0,191.78,1256.59
304,80,4096,640,79,0,5.4541,a8w8_rowwise_128x16x32x128_16x16_1x1_8x16x1_8x16x1_1x16x1x8_4x4x1_1x1_interwave_v2,0.0,76.9,610.18
304,80,4096,1024,78,0,6.8232,a8w8_rowwise_64x16x16x128_16x16_1x1_8x8x1_8x8x1_1x16x1x4_4x4x1_1x1_interwave_v2,0.0,98.35,722.77
304,80,4096,3072,30,0,11.8329,a8w8_rowwise_256x32x64x512_16x16_1x2_32x8x1_32x8x1_1x32x1x8_8x8x1_1x2_intrawave_v3,0.0,170.14,1139.54
304,80,5120,640,76,0,5.8217,a8w8_rowwise_128x32x16x128_16x16_1x1_8x16x1_8x16x1_1x16x1x8_2x2x1_1x1_interwave_v2,0.0,90.06,712.37
304,80,5120,2048,30,0,10.2776,a8w8_rowwise_256x32x64x512_16x16_1x2_32x8x1_32x8x1_1x32x1x8_8x8x1_1x2_intrawave_v3,0.0,163.24,1115.9
304,80,6144,768,57,0,6.5536,a8w8_rowwise_128x32x16x128_16x16_1x1_8x16x1_8x16x1_1x16x1x8_2x2x1_1x1_intrawave_v2,0.0,115.2,879.38
304,80,6144,1024,75,0,8.6451,a8w8_rowwise_128x64x16x128_16x16_2x1_8x16x1_8x16x1_1x16x1x8_2x2x1_1x1_interwave_v2,0.0,116.44,850.93
304,80,6144,1536,30,0,9.7752,a8w8_rowwise_256x32x64x512_16x16_1x2_32x8x1_32x8x1_1x32x1x8_8x8x1_1x2_intrawave_v3,0.0,154.47,1078.56
304,80,6144,2048,30,0,10.8659,a8w8_rowwise_256x32x64x512_16x16_1x2_32x8x1_32x8x1_1x32x1x8_8x8x1_1x2_intrawave_v3,0.0,185.28,1263.57
304,80,7168,256,50,0,4.7131,a8w8_rowwise_128x16x32x128_16x16_1x1_8x16x1_8x16x1_1x16x1x8_4x4x1_1x1_intrawave_v1,0.0,62.29,637.03
304,80,7168,2304,28,0,13.6267,a8w8_rowwise_256x32x128x256_32x32_1x1_16x16x1_16x16x1_1x32x1x8_8x8x1_1x1_intrawave_v3,0.0,193.91,1309.65
304,88,192,7168,34,0,13.6886,a8w8_rowwise_256x16x64x512_16x16_1x1_32x8x1_32x8x1_1x16x1x16_4x4x1_1x1_intrawave_v3,0.0,17.7,149.09
304,88,512,7168,34,0,14.3832,a8w8_rowwise_256x16x64x512_16x16_1x1_32x8x1_32x8x1_1x16x1x16_4x4x1_1x1_intrawave_v3,0.0,44.91,305.28
304,88,896,5120,34,0,11.6105,a8w8_rowwise_256x16x64x512_16x16_1x1_32x8x1_32x8x1_1x16x1x16_4x4x1_1x1_intrawave_v3,0.0,69.54,447.51
304,88,1024,5632,34,0,12.7361,a8w8_rowwise_256x16x64x512_16x16_1x1_32x8x1_32x8x1_1x16x1x16_4x4x1_1x1_intrawave_v3,0.0,79.7,505.89
304,88,1056,1408,79,0,5.9427,a8w8_rowwise_128x16x32x128_16x16_1x1_8x16x1_8x16x1_1x16x1x8_4x4x1_1x1_interwave_v2,0.0,44.03,302.32
304,88,1280,4096,34,0,10.2391,a8w8_rowwise_256x16x64x512_16x16_1x1_32x8x1_32x8x1_1x16x1x16_4x4x1_1x1_intrawave_v3,0.0,90.12,569.25
304,88,1408,352,78,0,4.2113,a8w8_rowwise_64x16x16x128_16x16_1x1_8x8x1_8x8x1_1x16x1x4_4x4x1_1x1_interwave_v2,0.0,20.71,183.89
304,88,1408,1408,79,0,6.0419,a8w8_rowwise_128x16x32x128_16x16_1x1_8x16x1_8x16x1_1x16x1x8_4x4x1_1x1_interwave_v2,0.0,57.75,389.64
304,88,1536,2048,34,0,7.0635,a8w8_rowwise_256x16x64x512_16x16_1x1_32x8x1_32x8x1_1x16x1x16_4x4x1_1x1_intrawave_v3,0.0,78.38,509.14
304,88,1792,6144,34,0,14.2434,a8w8_rowwise_256x16x64x512_16x16_1x1_32x8x1_32x8x1_1x16x1x16_4x4x1_1x1_intrawave_v3,0.0,136.05,833.1
304,88,2048,1536,34,0,6.4554,a8w8_rowwise_256x16x64x512_16x16_1x1_32x8x1_32x8x1_1x16x1x16_4x4x1_1x1_intrawave_v3,0.0,85.77,564.08
304,88,2048,6144,34,0,14.9331,a8w8_rowwise_256x16x64x512_16x16_1x1_32x8x1_32x8x1_1x16x1x16_4x4x1_1x1_intrawave_v3,0.0,148.3,902.96
304,88,3072,4096,30,0,12.6088,a8w8_rowwise_256x32x64x512_16x16_1x2_32x8x1_32x8x1_1x32x1x8_8x8x1_1x2_intrawave_v3,0.0,175.64,1069.41
304,88,3584,6144,30,0,18.6151,a8w8_rowwise_256x32x64x512_16x16_1x2_32x8x1_32x8x1_1x32x1x8_8x8x1_1x2_intrawave_v3,0.0,208.19,1245.85
304,88,4096,640,79,0,5.4577,a8w8_rowwise_128x16x32x128_16x16_1x1_8x16x1_8x16x1_1x16x1x8_4x4x1_1x1_interwave_v2,0.0,84.54,622.73
304,88,4096,1024,79,0,6.7707,a8w8_rowwise_128x16x32x128_16x16_1x1_8x16x1_8x16x1_1x16x1x8_4x4x1_1x1_interwave_v2,0.0,109.03,739.26
304,88,4096,3072,30,0,11.8571,a8w8_rowwise_256x32x64x512_16x16_1x2_32x8x1_32x8x1_1x32x1x8_8x8x1_1x2_intrawave_v3,0.0,186.77,1144.81
304,88,5120,640,79,0,5.7474,a8w8_rowwise_128x16x32x128_16x16_1x1_8x16x1_8x16x1_1x16x1x8_4x4x1_1x1_interwave_v2,0.0,100.34,736.72
304,88,5120,2048,30,0,10.2791,a8w8_rowwise_256x32x64x512_16x16_1x2_32x8x1_32x8x1_1x32x1x8_8x8x1_1x2_intrawave_v3,0.0,179.54,1125.3
304,88,6144,768,57,0,6.719,a8w8_rowwise_128x32x16x128_16x16_1x1_8x16x1_8x16x1_1x16x1x8_2x2x1_1x1_intrawave_v2,0.0,123.6,873.27
304,88,6144,1024,57,0,8.985,a8w8_rowwise_128x32x16x128_16x16_1x1_8x16x1_8x16x1_1x16x1x8_2x2x1_1x1_intrawave_v2,0.0,123.24,830.6
304,88,6144,1536,30,0,9.9121,a8w8_rowwise_256x32x64x512_16x16_1x2_32x8x1_32x8x1_1x32x1x8_8x8x1_1x2_intrawave_v3,0.0,167.57,1074.82
304,88,6144,2048,30,0,10.8526,a8w8_rowwise_256x32x64x512_16x16_1x2_32x8x1_32x8x1_1x32x1x8_8x8x1_1x2_intrawave_v3,0.0,204.06,1275.68
304,88,7168,256,50,0,4.9727,a8w8_rowwise_128x16x32x128_16x16_1x1_8x16x1_8x16x1_1x16x1x8_4x4x1_1x1_intrawave_v1,0.0,64.95,627.25
304,88,7168,2304,28,0,13.876,a8w8_rowwise_256x32x128x256_32x32_1x1_16x16x1_16x16x1_1x32x1x8_8x8x1_1x1_intrawave_v3,0.0,209.47,1295.72
304,96,192,7168,34,0,11.8543,a8w8_rowwise_256x16x64x512_16x16_1x1_32x8x1_32x8x1_1x16x1x16_4x4x1_1x1_intrawave_v3,0.0,22.29,177.26
304,96,512,7168,34,0,12.1082,a8w8_rowwise_256x16x64x512_16x16_1x1_32x8x1_32x8x1_1x16x1x16_4x4x1_1x1_intrawave_v3,0.0,58.2,368.05
304,96,896,5120,34,0,9.9054,a8w8_rowwise_256x16x64x512_16x16_1x1_32x8x1_32x8x1_1x16x1x16_4x4x1_1x1_intrawave_v3,0.0,88.92,530.12
304,96,1024,5632,34,0,10.7257,a8w8_rowwise_256x16x64x512_16x16_1x1_32x8x1_32x8x1_1x16x1x16_4x4x1_1x1_intrawave_v3,0.0,103.24,606.44
304,96,1056,1408,79,0,5.7129,a8w8_rowwise_128x16x32x128_16x16_1x1_8x16x1_8x16x1_1x16x1x8_4x4x1_1x1_interwave_v2,0.0,49.97,319.41
304,96,1280,4096,34,0,8.8939,a8w8_rowwise_256x16x64x512_16x16_1x1_32x8x1_32x8x1_1x16x1x16_4x4x1_1x1_intrawave_v3,0.0,113.18,661.34
304,96,1408,352,78,0,4.2678,a8w8_rowwise_64x16x16x128_16x16_1x1_8x8x1_8x8x1_1x16x1x4_4x4x1_1x1_interwave_v2,0.0,22.3,187.39
304,96,1408,1408,76,0,5.7931,a8w8_rowwise_128x32x16x128_16x16_1x1_8x16x1_8x16x1_1x16x1x8_2x2x1_1x1_interwave_v2,0.0,65.7,412.21
304,96,1536,2048,34,0,6.5046,a8w8_rowwise_256x16x64x512_16x16_1x1_32x8x1_32x8x1_1x16x1x16_4x4x1_1x1_intrawave_v3,0.0,92.85,559.18
304,96,1792,6144,34,0,12.6872,a8w8_rowwise_256x16x64x512_16x16_1x1_32x8x1_32x8x1_1x16x1x16_4x4x1_1x1_intrawave_v3,0.0,166.62,941.42
304,96,2048,1536,34,0,5.9533,a8w8_rowwise_256x16x64x512_16x16_1x1_32x8x1_32x8x1_1x16x1x16_4x4x1_1x1_intrawave_v3,0.0,101.45,619.22
304,96,2048,6144,34,0,13.6362,a8w8_rowwise_256x16x64x512_16x16_1x1_32x8x1_32x8x1_1x16x1x16_4x4x1_1x1_intrawave_v3,0.0,177.17,994.85
304,96,3072,4096,30,0,12.1866,a8w8_rowwise_256x32x64x512_16x16_1x2_32x8x1_32x8x1_1x32x1x8_8x8x1_1x2_intrawave_v3,0.0,198.24,1113.19
304,96,3584,6144,30,0,16.1849,a8w8_rowwise_256x32x64x512_16x16_1x2_32x8x1_32x8x1_1x32x1x8_8x8x1_1x2_intrawave_v3,0.0,261.22,1439.49
304,96,4096,640,79,0,5.2796,a8w8_rowwise_128x16x32x128_16x16_1x1_8x16x1_8x16x1_1x16x1x8_4x4x1_1x1_interwave_v2,0.0,95.33,657.12
304,96,4096,1024,79,0,6.7871,a8w8_rowwise_128x16x32x128_16x16_1x1_8x16x1_8x16x1_1x16x1x8_4x4x1_1x1_interwave_v2,0.0,118.65,748.34
304,96,4096,3072,30,0,11.3989,a8w8_rowwise_256x32x64x512_16x16_1x2_32x8x1_32x8x1_1x32x1x8_8x8x1_1x2_intrawave_v3,0.0,211.94,1198.73
304,96,5120,640,79,0,5.6646,a8w8_rowwise_128x16x32x128_16x16_1x1_8x16x1_8x16x1_1x16x1x8_4x4x1_1x1_interwave_v2,0.0,111.07,762.86
304,96,5120,2048,30,0,9.8978,a8w8_rowwise_256x32x64x512_16x16_1x2_32x8x1_32x8x1_1x32x1x8_8x8x1_1x2_intrawave_v3,0.0,203.41,1178.59
304,96,6144,768,80,0,6.6362,a8w8_rowwise_128x16x64x128_16x16_1x2_8x16x1_8x16x1_1x16x1x8_4x4x1_1x1_interwave_v2,0.0,136.52,899.91
304,96,6144,1024,29,0,8.7453,a8w8_rowwise_256x32x96x256_16x16_1x3_16x16x1_16x16x1_1x32x1x8_4x4x1_1x1_intrawave_v3,0.0,138.13,865.54
304,96,6144,1536,30,0,9.7063,a8w8_rowwise_256x32x64x512_16x16_1x2_32x8x1_32x8x1_1x32x1x8_8x8x1_1x2_intrawave_v3,0.0,186.68,1109.0
304,96,6144,2048,30,0,10.5465,a8w8_rowwise_256x32x64x512_16x16_1x2_32x8x1_32x8x1_1x32x1x8_8x8x1_1x2_intrawave_v3,0.0,229.07,1323.58
304,96,7168,256,50,0,4.8892,a8w8_rowwise_128x16x32x128_16x16_1x1_8x16x1_8x16x1_1x16x1x8_4x4x1_1x1_intrawave_v1,0.0,72.06,661.83
304,96,7168,2304,28,0,13.1075,a8w8_rowwise_256x32x128x256_32x32_1x1_16x16x1_16x16x1_1x32x1x8_8x8x1_1x1_intrawave_v3,0.0,241.91,1381.84
304,104,192,7168,34,0,13.6886,a8w8_rowwise_256x16x64x512_16x16_1x1_32x8x1_32x8x1_1x16x1x16_4x4x1_1x1_intrawave_v3,0.0,20.91,157.92
304,104,512,7168,34,0,14.4114,a8w8_rowwise_256x16x64x512_16x16_1x1_32x8x1_32x8x1_1x16x1x16_4x4x1_1x1_intrawave_v3,0.0,52.97,313.78
304,104,896,5120,34,0,11.5584,a8w8_rowwise_256x16x64x512_16x16_1x1_32x8x1_32x8x1_1x16x1x16_4x4x1_1x1_intrawave_v3,0.0,82.56,459.09
304,104,1024,5632,34,0,12.5088,a8w8_rowwise_256x16x64x512_16x16_1x1_32x8x1_32x8x1_1x16x1x16_4x4x1_1x1_intrawave_v3,0.0,95.9,524.9
304,104,1056,1408,76,0,6.0356,a8w8_rowwise_128x32x16x128_16x16_1x1_8x16x1_8x16x1_1x16x1x8_2x2x1_1x1_interwave_v2,0.0,51.24,307.0
304,104,1280,4096,34,0,10.1883,a8w8_rowwise_256x16x64x512_16x16_1x1_32x8x1_32x8x1_1x16x1x16_4x4x1_1x1_intrawave_v3,0.0,107.04,582.54
304,104,1408,352,78,0,4.3012,a8w8_rowwise_64x16x16x128_16x16_1x1_8x8x1_8x8x1_1x16x1x4_4x4x1_1x1_interwave_v2,0.0,23.97,191.83
304,104,1408,1408,79,0,6.1018,a8w8_rowwise_128x16x32x128_16x16_1x1_8x16x1_8x16x1_1x16x1x8_4x4x1_1x1_interwave_v2,0.0,67.58,396.89
304,104,1536,2048,34,0,7.0272,a8w8_rowwise_256x16x64x512_16x16_1x1_32x8x1_32x8x1_1x16x1x16_4x4x1_1x1_intrawave_v3,0.0,93.11,523.42
304,104,1792,6144,34,0,14.612,a8w8_rowwise_256x16x64x512_16x16_1x1_32x8x1_32x8x1_1x16x1x16_4x4x1_1x1_intrawave_v3,0.0,156.73,822.73
304,104,2048,1536,34,0,6.4255,a8w8_rowwise_256x16x64x512_16x16_1x1_32x8x1_32x8x1_1x16x1x16_4x4x1_1x1_intrawave_v3,0.0,101.83,580.73
304,104,2048,6144,34,0,15.3609,a8w8_rowwise_256x16x64x512_16x16_1x1_32x8x1_32x8x1_1x16x1x16_4x4x1_1x1_intrawave_v3,0.0,170.38,888.48
304,104,3072,4096,30,0,13.6105,a8w8_rowwise_256x32x64x512_16x16_1x2_32x8x1_32x8x1_1x32x1x8_8x8x1_1x2_intrawave_v3,0.0,192.3,1002.75
304,104,3584,6144,30,0,19.2837,a8w8_rowwise_256x32x64x512_16x16_1x2_32x8x1_32x8x1_1x32x1x8_8x8x1_1x2_intrawave_v3,0.0,237.52,1213.7
304,104,4096,640,79,0,5.5024,a8w8_rowwise_128x16x32x128_16x16_1x1_8x16x1_8x16x1_1x16x1x8_4x4x1_1x1_interwave_v2,0.0,99.09,643.35
304,104,4096,1024,60,0,7.1782,a8w8_rowwise_128x16x32x128_16x16_1x1_8x16x1_8x16x1_1x16x1x8_4x4x1_1x1_intrawave_v2,0.0,121.54,717.84
304,104,4096,3072,30,0,13.0258,a8w8_rowwise_256x32x64x512_16x16_1x2_32x8x1_32x8x1_1x32x1x8_8x8x1_1x2_intrawave_v3,0.0,200.93,1055.93
304,104,5120,640,80,0,6.0761,a8w8_rowwise_128x16x64x128_16x16_1x2_8x16x1_8x16x1_1x16x1x8_4x4x1_1x1_interwave_v2,0.0,112.17,725.52
304,104,5120,2048,23,0,12.4588,a8w8_rowwise_256x64x64x512_32x32_1x1_32x8x1_32x8x1_1x32x1x8_8x8x1_1x1_intrawave_v3,0.0,175.06,944.21
304,104,6144,768,75,0,7.2273,a8w8_rowwise_128x64x16x128_16x16_2x1_8x16x1_8x16x1_1x16x1x8_2x2x1_1x1_interwave_v2,0.0,135.8,840.76
304,104,6144,1024,28,0,9.3093,a8w8_rowwise_256x32x128x256_32x32_1x1_16x16x1_16x16x1_1x32x1x8_8x8x1_1x1_intrawave_v3,0.0,140.57,824.54
304,104,6144,1536,23,0,11.0999,a8w8_rowwise_256x64x64x512_32x32_1x1_32x8x1_32x8x1_1x32x1x8_8x8x1_1x1_intrawave_v3,0.0,176.84,979.73
304,104,6144,2048,23,0,13.3569,a8w8_rowwise_256x64x64x512_32x32_1x1_32x8x1_32x8x1_1x32x1x8_8x8x1_1x1_intrawave_v3,0.0,195.95,1053.68
304,104,7168,256,50,0,5.1303,a8w8_rowwise_128x16x32x128_16x16_1x1_8x16x1_8x16x1_1x16x1x8_4x4x1_1x1_intrawave_v1,0.0,74.4,653.49
304,104,7168,2304,47,0,14.9524,a8w8_rowwise_256x64x64x128_32x32_1x1_8x32x1_8x32x1_1x32x1x8_8x8x1_1x1_intrawave_v3,0.0,229.74,1220.25
304,112,192,7168,34,0,11.9356,a8w8_rowwise_256x16x64x512_16x16_1x1_32x8x1_32x8x1_1x16x1x16_4x4x1_1x1_intrawave_v3,0.0,25.83,186.17
304,112,512,7168,34,0,12.0772,a8w8_rowwise_256x16x64x512_16x16_1x1_32x8x1_32x8x1_1x16x1x16_4x4x1_1x1_intrawave_v3,0.0,68.07,379.85
304,112,896,5120,34,0,9.9184,a8w8_rowwise_256x16x64x512_16x16_1x1_32x8x1_32x8x1_1x16x1x16_4x4x1_1x1_intrawave_v3,0.0,103.61,540.58
304,112,1024,5632,34,0,10.6937,a8w8_rowwise_256x16x64x512_16x16_1x1_32x8x1_32x8x1_1x16x1x16_4x4x1_1x1_intrawave_v3,0.0,120.8,619.74
304,112,1056,1408,79,0,5.7496,a8w8_rowwise_128x16x32x128_16x16_1x1_8x16x1_8x16x1_1x16x1x8_4x4x1_1x1_interwave_v2,0.0,57.93,327.17
304,112,1280,4096,34,0,8.8967,a8w8_rowwise_256x16x64x512_16x16_1x1_32x8x1_32x8x1_1x16x1x16_4x4x1_1x1_intrawave_v3,0.0,132.0,673.1
304,112,1408,352,78,0,4.3194,a8w8_rowwise_64x16x16x128_16x16_1x1_8x8x1_8x8x1_1x16x1x4_4x4x1_1x1_interwave_v2,0.0,25.7,196.89
304,112,1408,1408,79,0,5.8077,a8w8_rowwise_128x16x32x128_16x16_1x1_8x16x1_8x16x1_1x16x1x8_4x4x1_1x1_interwave_v2,0.0,76.46,422.81
304,112,1536,2048,34,0,6.4215,a8w8_rowwise_256x16x64x512_16x16_1x1_32x8x1_32x8x1_1x16x1x16_4x4x1_1x1_intrawave_v3,0.0,109.73,579.17
304,112,1792,6144,34,0,13.3992,a8w8_rowwise_256x16x64x512_16x16_1x1_32x8x1_32x8x1_1x16x1x16_4x4x1_1x1_intrawave_v3,0.0,184.06,903.01
304,112,2048,1536,34,0,5.9784,a8w8_rowwise_256x16x64x512_16x16_1x1_32x8x1_32x8x1_1x16x1x16_4x4x1_1x1_intrawave_v3,0.0,117.86,631.69
304,112,2048,6144,34,0,14.3777,a8w8_rowwise_256x16x64x512_16x16_1x1_32x8x1_32x8x1_1x16x1x16_4x4x1_1x1_intrawave_v3,0.0,196.04,954.94
304,112,3072,4096,30,0,13.7134,a8w8_rowwise_256x32x64x512_16x16_1x2_32x8x1_32x8x1_1x32x1x8_8x8x1_1x2_intrawave_v3,0.0,205.53,1001.2
304,112,3584,6144,30,0,19.5345,a8w8_rowwise_256x32x64x512_16x16_1x2_32x8x1_32x8x1_1x32x1x8_8x8x1_1x2_intrawave_v3,0.0,252.5,1203.56
304,112,4096,640,79,0,5.3083,a8w8_rowwise_128x16x32x128_16x16_1x1_8x16x1_8x16x1_1x16x1x8_4x4x1_1x1_interwave_v2,0.0,110.62,680.18
304,112,4096,1024,60,0,6.8884,a8w8_rowwise_128x16x32x128_16x16_1x1_8x16x1_8x16x1_1x16x1x8_4x4x1_1x1_intrawave_v2,0.0,136.39,758.74
304,112,4096,3072,30,0,13.0797,a8w8_rowwise_256x32x64x512_16x16_1x2_32x8x1_32x8x1_1x32x1x8_8x8x1_1x2_intrawave_v3,0.0,215.49,1058.47
304,112,5120,640,60,0,5.9506,a8w8_rowwise_128x16x32x128_16x16_1x1_8x16x1_8x16x1_1x16x1x8_4x4x1_1x1_intrawave_v2,0.0,123.35,755.45
304,112,5120,2048,33,0,12.3289,a8w8_rowwise_256x16x128x256_16x16_1x2_16x16x1_16x16x1_1x16x1x16_8x8x1_1x2_intrawave_v3,0.0,190.51,962.13
304,112,6144,768,75,0,7.2639,a8w8_rowwise_128x64x16x128_16x16_2x1_8x16x1_8x16x1_1x16x1x8_2x2x1_1x1_interwave_v2,0.0,145.51,850.9
304,112,6144,1024,29,0,9.3438,a8w8_rowwise_256x32x96x256_16x16_1x3_16x16x1_16x16x1_1x32x1x8_4x4x1_1x1_intrawave_v3,0.0,150.83,832.89
304,112,6144,1536,23,0,11.4589,a8w8_rowwise_256x64x64x512_32x32_1x1_32x8x1_32x8x1_1x32x1x8_8x8x1_1x1_intrawave_v3,0.0,184.48,958.68
304,112,6144,2048,23,0,13.3656,a8w8_rowwise_256x64x64x512_32x32_1x1_32x8x1_32x8x1_1x32x1x8_8x8x1_1x1_intrawave_v3,0.0,210.88,1061.57
304,112,7168,256,50,0,5.0311,a8w8_rowwise_128x16x32x128_16x16_1x1_8x16x1_8x16x1_1x16x1x8_4x4x1_1x1_intrawave_v1,0.0,81.7,689.57
304,112,7168,2304,28,0,14.6871,a8w8_rowwise_256x32x128x256_32x32_1x1_16x16x1_16x16x1_1x32x1x8_8x8x1_1x1_intrawave_v3,0.0,251.88,1251.35
304,120,192,7168,34,0,13.7335,a8w8_rowwise_256x16x64x512_16x16_1x1_32x8x1_32x8x1_1x16x1x16_4x4x1_1x1_intrawave_v3,0.0,24.05,166.2
304,120,512,7168,34,0,13.9189,a8w8_rowwise_256x16x64x512_16x16_1x1_32x8x1_32x8x1_1x16x1x16_4x4x1_1x1_intrawave_v3,0.0,63.28,334.3
304,120,896,5120,34,0,11.29,a8w8_rowwise_256x16x64x512_16x16_1x1_32x8x1_32x8x1_1x16x1x16_4x4x1_1x1_intrawave_v3,0.0,97.52,479.8
304,120,1024,5632,34,0,12.3738,a8w8_rowwise_256x16x64x512_16x16_1x1_32x8x1_32x8x1_1x16x1x16_4x4x1_1x1_intrawave_v3,0.0,111.86,540.56
304,120,1056,1408,79,0,6.0035,a8w8_rowwise_128x16x32x128_16x16_1x1_8x16x1_8x16x1_1x16x1x8_4x4x1_1x1_interwave_v2,0.0,59.44,318.02
304,120,1280,4096,34,0,10.0307,a8w8_rowwise_256x16x64x512_16x16_1x1_32x8x1_32x8x1_1x16x1x16_4x4x1_1x1_intrawave_v3,0.0,125.44,602.31
304,120,1408,352,78,0,4.3619,a8w8_rowwise_64x16x16x128_16x16_1x1_8x8x1_8x8x1_1x16x1x4_4x4x1_1x1_interwave_v2,0.0,27.27,200.78
304,120,1408,1408,34,0,6.1942,a8w8_rowwise_256x16x64x512_16x16_1x1_32x8x1_32x8x1_1x16x1x16_4x4x1_1x1_intrawave_v3,0.0,76.81,401.88
304,120,1536,2048,34,0,7.0436,a8w8_rowwise_256x16x64x512_16x16_1x1_32x8x1_32x8x1_1x16x1x16_4x4x1_1x1_intrawave_v3,0.0,107.19,533.84
304,120,1792,6144,34,0,15.0272,a8w8_rowwise_256x16x64x512_16x16_1x1_32x8x1_32x8x1_1x16x1x16_4x4x1_1x1_intrawave_v3,0.0,175.84,810.36
304,120,2048,1536,34,0,6.4231,a8w8_rowwise_256x16x64x512_16x16_1x1_32x8x1_32x8x1_1x16x1x16_4x4x1_1x1_intrawave_v3,0.0,117.54,594.97
304,120,2048,6144,30,0,15.0624,a8w8_rowwise_256x32x64x512_16x16_1x2_32x8x1_32x8x1_1x32x1x8_8x8x1_1x2_intrawave_v3,0.0,200.49,916.97
304,120,3072,4096,30,0,13.9686,a8w8_rowwise_256x32x64x512_16x16_1x2_32x8x1_32x8x1_1x32x1x8_8x8x1_1x2_intrawave_v3,0.0,216.19,988.77
304,120,3584,6144,30,0,19.424,a8w8_rowwise_256x32x64x512_16x16_1x2_32x8x1_32x8x1_1x32x1x8_8x8x1_1x2_intrawave_v3,0.0,272.08,1215.89
304,120,4096,640,79,0,5.6582,a8w8_rowwise_128x16x32x128_16x16_1x1_8x16x1_8x16x1_1x16x1x8_4x4x1_1x1_interwave_v2,0.0,111.19,650.61
304,120,4096,1024,60,0,7.8703,a8w8_rowwise_128x16x32x128_16x16_1x1_8x16x1_8x16x1_1x16x1x8_4x4x1_1x1_intrawave_v2,0.0,127.9,673.45
304,120,4096,3072,30,0,13.3008,a8w8_rowwise_256x32x64x512_16x16_1x2_32x8x1_32x8x1_1x32x1x8_8x8x1_1x2_intrawave_v3,0.0,227.05,1047.65
304,120,5120,640,69,0,6.4482,a8w8_rowwise_128x16x32x128_16x16_1x1_8x16x1_8x16x1_1x16x1x8_4x4x1_1x1_interwave_v1,0.0,121.96,710.65
304,120,5120,2048,23,0,12.5837,a8w8_rowwise_256x64x64x512_32x32_1x1_32x8x1_32x8x1_1x32x1x8_8x8x1_1x1_intrawave_v3,0.0,199.99,950.46
304,120,6144,768,75,0,7.2798,a8w8_rowwise_128x64x16x128_16x16_2x1_8x16x1_8x16x1_1x16x1x8_2x2x1_1x1_interwave_v2,0.0,155.56,863.39
304,120,6144,1024,29,0,9.4503,a8w8_rowwise_256x32x96x256_16x16_1x3_16x16x1_16x16x1_1x32x1x8_4x4x1_1x1_intrawave_v3,0.0,159.78,834.78
304,120,6144,1536,23,0,11.618,a8w8_rowwise_256x64x64x512_32x32_1x1_32x8x1_32x8x1_1x32x1x8_8x8x1_1x1_intrawave_v3,0.0,194.95,955.08
304,120,6144,2048,23,0,13.5434,a8w8_rowwise_256x64x64x512_32x32_1x1_32x8x1_32x8x1_1x32x1x8_8x8x1_1x1_intrawave_v3,0.0,222.98,1056.1
304,120,7168,256,50,0,5.1781,a8w8_rowwise_128x16x32x128_16x16_1x1_8x16x1_8x16x1_1x16x1x8_4x4x1_1x1_intrawave_v1,0.0,85.05,692.54
304,120,7168,2304,28,0,14.7878,a8w8_rowwise_256x32x128x256_32x32_1x1_16x16x1_16x16x1_1x32x1x8_8x8x1_1x1_intrawave_v3,0.0,268.03,1251.83
304,128,192,7168,34,0,11.9404,a8w8_rowwise_256x16x64x512_16x16_1x1_32x8x1_32x8x1_1x16x1x16_4x4x1_1x1_intrawave_v3,0.0,29.51,196.22
304,128,512,7168,34,0,12.0098,a8w8_rowwise_256x16x64x512_16x16_1x1_32x8x1_32x8x1_1x16x1x16_4x4x1_1x1_intrawave_v3,0.0,78.23,392.9
304,128,896,5120,34,0,9.8594,a8w8_rowwise_256x16x64x512_16x16_1x1_32x8x1_32x8x1_1x16x1x16_4x4x1_1x1_intrawave_v3,0.0,119.12,555.03
304,128,1024,5632,34,0,10.6193,a8w8_rowwise_256x16x64x512_16x16_1x1_32x8x1_32x8x1_1x16x1x16_4x4x1_1x1_intrawave_v3,0.0,139.03,635.65
304,128,1056,1408,76,0,5.7374,a8w8_rowwise_128x32x16x128_16x16_1x1_8x16x1_8x16x1_1x16x1x8_2x2x1_1x1_interwave_v2,0.0,66.34,337.68
304,128,1280,4096,34,0,8.8987,a8w8_rowwise_256x16x64x512_16x16_1x1_32x8x1_32x8x1_1x16x1x16_4x4x1_1x1_intrawave_v3,0.0,150.83,684.91
304,128,1408,352,78,0,4.3476,a8w8_rowwise_64x16x16x128_16x16_1x1_8x8x1_8x8x1_1x16x1x4_4x4x1_1x1_interwave_v2,0.0,29.18,207.27
304,128,1408,1408,79,0,5.9867,a8w8_rowwise_128x16x32x128_16x16_1x1_8x16x1_8x16x1_1x16x1x8_4x4x1_1x1_interwave_v2,0.0,84.77,421.46
304,128,1536,2048,34,0,6.4502,a8w8_rowwise_256x16x64x512_16x16_1x1_32x8x1_32x8x1_1x16x1x16_4x4x1_1x1_intrawave_v3,0.0,124.85,589.3
304,128,1792,6144,34,0,14.0067,a8w8_rowwise_256x16x64x512_16x16_1x1_32x8x1_32x8x1_1x16x1x16_4x4x1_1x1_intrawave_v3,0.0,201.23,874.95
304,128,2048,1536,34,0,6.1965,a8w8_rowwise_256x16x64x512_16x16_1x1_32x8x1_32x8x1_1x16x1x16_4x4x1_1x1_intrawave_v3,0.0,129.96,624.0
304,128,2048,6144,30,0,14.4775,a8w8_rowwise_256x32x64x512_16x16_1x2_32x8x1_32x8x1_1x32x1x8_8x8x1_1x2_intrawave_v3,0.0,222.5,959.67
304,128,3072,4096,30,0,12.9349,a8w8_rowwise_256x32x64x512_16x16_1x2_32x8x1_32x8x1_1x32x1x8_8x8x1_1x2_intrawave_v3,0.0,249.03,1074.12
304,128,3584,6144,30,0,18.0959,a8w8_rowwise_256x32x64x512_16x16_1x2_32x8x1_32x8x1_1x32x1x8_8x8x1_1x2_intrawave_v3,0.0,311.52,1311.02
304,128,4096,640,79,0,5.4904,a8w8_rowwise_128x16x32x128_16x16_1x1_8x16x1_8x16x1_1x16x1x8_4x4x1_1x1_interwave_v2,0.0,122.23,683.36
304,128,4096,1024,33,0,7.4505,a8w8_rowwise_256x16x128x256_16x16_1x2_16x16x1_16x16x1_1x16x1x16_8x8x1_1x2_intrawave_v3,0.0,144.12,721.29
304,128,4096,3072,30,0,12.2733,a8w8_rowwise_256x32x64x512_16x16_1x2_32x8x1_32x8x1_1x32x1x8_8x8x1_1x2_intrawave_v3,0.0,262.46,1142.7
304,128,5120,640,50,0,6.2164,a8w8_rowwise_128x16x32x128_16x16_1x1_8x16x1_8x16x1_1x16x1x8_4x4x1_1x1_intrawave_v1,0.0,134.94,751.15
304,128,5120,2048,23,0,11.1218,a8w8_rowwise_256x64x64x512_32x32_1x1_32x8x1_32x8x1_1x32x1x8_8x8x1_1x1_intrawave_v3,0.0,241.36,1084.23
304,128,6144,768,75,0,7.1057,a8w8_rowwise_128x64x16x128_16x16_2x1_8x16x1_8x16x1_1x16x1x8_2x2x1_1x1_interwave_v2,0.0,170.0,899.24
304,128,6144,1024,29,0,9.0023,a8w8_rowwise_256x32x96x256_16x16_1x3_16x16x1_16x16x1_1x32x1x8_4x4x1_1x1_intrawave_v3,0.0,178.91,888.15
304,128,6144,1536,23,0,10.8047,a8w8_rowwise_256x64x64x512_32x32_1x1_32x8x1_32x8x1_1x32x1x8_8x8x1_1x1_intrawave_v3,0.0,223.6,1037.2
304,128,6144,2048,23,0,11.7463,a8w8_rowwise_256x64x64x512_32x32_1x1_32x8x1_32x8x1_1x32x1x8_8x8x1_1x1_intrawave_v3,0.0,274.23,1227.44
304,128,7168,256,69,0,5.0445,a8w8_rowwise_128x16x32x128_16x16_1x1_8x16x1_8x16x1_1x16x1x8_4x4x1_1x1_interwave_v1,0.0,93.12,734.02
304,128,7168,2304,28,0,14.4768,a8w8_rowwise_256x32x128x256_32x32_1x1_16x16x1_16x16x1_1x32x1x8_8x8x1_1x1_intrawave_v3,0.0,292.04,1287.92
304,136,192,7168,34,0,13.7467,a8w8_rowwise_256x16x64x512_16x16_1x1_32x8x1_32x8x1_1x16x1x16_4x4x1_1x1_intrawave_v3,0.0,27.23,174.83
304,136,512,7168,34,0,14.1008,a8w8_rowwise_256x16x64x512_16x16_1x1_32x8x1_32x8x1_1x16x1x16_4x4x1_1x1_intrawave_v3,0.0,70.79,339.28
304,136,896,5120,34,0,11.5202,a8w8_rowwise_256x16x64x512_16x16_1x1_32x8x1_32x8x1_1x16x1x16_4x4x1_1x1_intrawave_v3,0.0,108.31,479.81
304,136,1024,5632,34,0,12.4852,a8w8_rowwise_256x16x64x512_16x16_1x1_32x8x1_32x8x1_1x16x1x16_4x4x1_1x1_intrawave_v3,0.0,125.64,545.58
304,136,1056,1408,79,0,6.0773,a8w8_rowwise_128x16x32x128_16x16_1x1_8x16x1_8x16x1_1x16x1x8_4x4x1_1x1_interwave_v2,0.0,66.55,323.43
304,136,1280,4096,34,0,10.6889,a8w8_rowwise_256x16x64x512_16x16_1x1_32x8x1_32x8x1_1x16x1x16_4x4x1_1x1_intrawave_v3,0.0,133.42,575.19
304,136,1408,352,78,0,4.4546,a8w8_rowwise_64x16x16x128_16x16_1x1_8x8x1_8x8x1_1x16x1x4_4x4x1_1x1_interwave_v2,0.0,30.26,207.98
304,136,1408,1408,34,0,6.3255,a8w8_rowwise_256x16x64x512_16x16_1x1_32x8x1_32x8x1_1x16x1x16_4x4x1_1x1_intrawave_v3,0.0,85.25,404.23
304,136,1536,2048,34,0,7.3929,a8w8_rowwise_256x16x64x512_16x16_1x1_32x8x1_32x8x1_1x16x1x16_4x4x1_1x1_intrawave_v3,0.0,115.74,519.69
304,136,1792,6144,30,0,15.35,a8w8_rowwise_256x32x64x512_16x16_1x2_32x8x1_32x8x1_1x32x1x8_8x8x1_1x2_intrawave_v3,0.0,195.1,803.46
304,136,2048,1536,79,0,7.0422,a8w8_rowwise_128x16x32x128_16x16_1x1_8x16x1_8x16x1_1x16x1x8_4x4x1_1x1_interwave_v2,0.0,121.5,555.46
304,136,2048,6144,30,0,17.6689,a8w8_rowwise_256x32x64x512_16x16_1x2_32x8x1_32x8x1_1x32x1x8_8x8x1_1x2_intrawave_v3,0.0,193.7,790.97
304,136,3072,4096,30,0,17.1037,a8w8_rowwise_256x32x64x512_16x16_1x2_32x8x1_32x8x1_1x32x1x8_8x8x1_1x2_intrawave_v3,0.0,200.11,817.11
304,136,3584,6144,30,0,24.1911,a8w8_rowwise_256x32x64x512_16x16_1x2_32x8x1_32x8x1_1x32x1x8_8x8x1_1x2_intrawave_v3,0.0,247.59,985.09
304,136,4096,640,50,0,5.9464,a8w8_rowwise_128x16x32x128_16x16_1x1_8x16x1_8x16x1_1x16x1x8_4x4x1_1x1_intrawave_v1,0.0,119.91,642.84
304,136,4096,1024,47,0,8.5419,a8w8_rowwise_256x64x64x128_32x32_1x1_8x32x1_8x32x1_1x32x1x8_8x8x1_1x1_intrawave_v3,0.0,133.56,637.76
304,136,4096,3072,23,0,17.2603,a8w8_rowwise_256x64x64x512_32x32_1x1_32x8x1_32x8x1_1x32x1x8_8x8x1_1x1_intrawave_v3,0.0,198.29,817.76
304,136,5120,640,47,0,6.9786,a8w8_rowwise_256x64x64x128_32x32_1x1_8x32x1_8x32x1_1x32x1x8_8x8x1_1x1_intrawave_v3,0.0,127.72,681.58
304,136,5120,2048,23,0,13.6384,a8w8_rowwise_256x64x64x512_32x32_1x1_32x8x1_32x8x1_1x32x1x8_8x8x1_1x1_intrawave_v3,0.0,209.12,891.37
304,136,6144,768,47,0,8.0704,a8w8_rowwise_256x64x64x128_32x32_1x1_8x32x1_8x32x1_1x32x1x8_8x8x1_1x1_intrawave_v3,0.0,159.03,804.69
304,136,6144,1024,47,0,9.9375,a8w8_rowwise_256x64x64x128_32x32_1x1_8x32x1_8x32x1_1x32x1x8_8x8x1_1x1_intrawave_v3,0.0,172.2,815.28
304,136,6144,1536,47,0,12.3084,a8w8_rowwise_256x64x64x128_32x32_1x1_8x32x1_8x32x1_1x32x1x8_8x8x1_1x1_intrawave_v3,0.0,208.55,919.47
304,136,6144,2048,47,0,14.5944,a8w8_rowwise_256x64x64x128_32x32_1x1_8x32x1_8x32x1_1x32x1x8_8x8x1_1x1_intrawave_v3,0.0,234.51,995.77
304,136,7168,256,69,0,5.4135,a8w8_rowwise_128x16x32x128_16x16_1x1_8x16x1_8x16x1_1x16x1x8_4x4x1_1x1_interwave_v1,0.0,92.2,705.55
304,136,7168,2304,22,0,18.057,a8w8_rowwise_256x64x96x256_16x16_2x3_16x16x1_16x16x1_1x64x1x4_8x8x1_2x1_intrawave_v3,0.0,248.77,1039.94
304,144,192,7168,34,0,11.9158,a8w8_rowwise_256x16x64x512_16x16_1x1_32x8x1_32x8x1_1x16x1x16_4x4x1_1x1_intrawave_v3,0.0,33.26,206.76
304,144,512,7168,34,0,12.078,a8w8_rowwise_256x16x64x512_16x16_1x1_32x8x1_32x8x1_1x16x1x16_4x4x1_1x1_intrawave_v3,0.0,87.51,401.53
304,144,896,5120,34,0,9.9944,a8w8_rowwise_256x16x64x512_16x16_1x1_32x8x1_32x8x1_1x16x1x16_4x4x1_1x1_intrawave_v3,0.0,132.19,558.6
304,144,1024,5632,34,0,10.8838,a8w8_rowwise_256x16x64x512_16x16_1x1_32x8x1_32x8x1_1x16x1x16_4x4x1_1x1_intrawave_v3,0.0,152.61,631.5
304,144,1056,1408,79,0,5.7432,a8w8_rowwise_128x16x32x128_16x16_1x1_8x16x1_8x16x1_1x16x1x8_4x4x1_1x1_interwave_v2,0.0,74.56,347.15
304,144,1280,4096,34,0,10.2092,a8w8_rowwise_256x16x64x512_16x16_1x1_32x8x1_32x8x1_1x16x1x16_4x4x1_1x1_intrawave_v3,0.0,147.9,607.43
304,144,1408,352,78,0,4.4206,a8w8_rowwise_64x16x16x128_16x16_1x1_8x8x1_8x8x1_1x16x1x4_4x4x1_1x1_interwave_v2,0.0,32.29,215.31
304,144,1408,1408,79,0,6.0363,a8w8_rowwise_128x16x32x128_16x16_1x1_8x16x1_8x16x1_1x16x1x8_4x4x1_1x1_interwave_v2,0.0,94.59,429.19
304,144,1536,2048,34,0,7.0178,a8w8_rowwise_256x16x64x512_16x16_1x1_32x8x1_32x8x1_1x16x1x16_4x4x1_1x1_intrawave_v3,0.0,129.1,553.31
304,144,1792,6144,34,0,15.8469,a8w8_rowwise_256x16x64x512_16x16_1x1_32x8x1_32x8x1_1x16x1x16_4x4x1_1x1_intrawave_v3,0.0,200.1,783.17
304,144,2048,1536,79,0,6.7214,a8w8_rowwise_128x16x32x128_16x16_1x1_8x16x1_8x16x1_1x16x1x8_4x4x1_1x1_interwave_v2,0.0,134.79,588.68
304,144,2048,6144,30,0,18.2258,a8w8_rowwise_256x32x64x512_16x16_1x2_32x8x1_32x8x1_1x32x1x8_8x8x1_1x2_intrawave_v3,0.0,198.83,771.3
304,144,3072,4096,30,0,17.1546,a8w8_rowwise_256x32x64x512_16x16_1x2_32x8x1_32x8x1_1x32x1x8_8x8x1_1x2_intrawave_v3,0.0,211.25,819.46
304,144,3584,6144,30,0,24.2426,a8w8_rowwise_256x32x64x512_16x16_1x2_32x8x1_32x8x1_1x32x1x8_8x8x1_1x2_intrawave_v3,0.0,261.6,987.4
304,144,4096,640,50,0,5.7681,a8w8_rowwise_128x16x32x128_16x16_1x1_8x16x1_8x16x1_1x16x1x8_4x4x1_1x1_intrawave_v1,0.0,130.89,674.96
304,144,4096,1024,47,0,8.6119,a8w8_rowwise_256x64x64x128_32x32_1x1_8x32x1_8x32x1_1x32x1x8_8x8x1_1x1_intrawave_v3,0.0,140.27,641.14
304,144,4096,3072,23,0,16.5036,a8w8_rowwise_256x64x64x512_32x32_1x1_32x8x1_32x8x1_1x32x1x8_8x8x1_1x1_intrawave_v3,0.0,219.58,860.72
304,144,5120,640,47,0,6.9931,a8w8_rowwise_256x64x64x128_32x32_1x1_8x32x1_8x32x1_1x32x1x8_8x8x1_1x1_intrawave_v3,0.0,134.95,692.61
304,144,5120,2048,23,0,13.8196,a8w8_rowwise_256x64x64x512_32x32_1x1_32x8x1_32x8x1_1x32x1x8_8x8x1_1x1_intrawave_v3,0.0,218.52,886.8
304,144,6144,768,47,0,8.1043,a8w8_rowwise_256x64x64x128_32x32_1x1_8x32x1_8x32x1_1x32x1x8_8x8x1_1x1_intrawave_v3,0.0,167.68,814.22
304,144,6144,1024,47,0,10.0156,a8w8_rowwise_256x64x64x128_32x32_1x1_8x32x1_8x32x1_1x32x1x8_8x8x1_1x1_intrawave_v3,0.0,180.91,819.56
304,144,6144,1536,47,0,12.4662,a8w8_rowwise_256x64x64x128_32x32_1x1_8x32x1_8x32x1_1x32x1x8_8x8x1_1x1_intrawave_v3,0.0,218.02,916.71
304,144,6144,2048,21,0,14.9436,a8w8_rowwise_256x64x128x256_32x32_1x2_16x16x1_16x16x1_1x32x1x8_8x8x1_1x1_intrawave_v3,0.0,242.5,980.17
304,144,7168,256,50,0,5.2282,a8w8_rowwise_128x16x32x128_16x16_1x1_8x16x1_8x16x1_1x16x1x8_4x4x1_1x1_intrawave_v1,0.0,101.08,752.89
304,144,7168,2304,22,0,18.1555,a8w8_rowwise_256x64x96x256_16x16_2x3_16x16x1_16x16x1_1x64x1x4_8x8x1_2x1_intrawave_v3,0.0,261.98,1041.63
304,152,192,7168,34,0,13.6312,a8w8_rowwise_256x16x64x512_16x16_1x1_32x8x1_32x8x1_1x16x1x16_4x4x1_1x1_intrawave_v3,0.0,30.69,185.18
304,152,512,7168,34,0,14.0661,a8w8_rowwise_256x16x64x512_16x16_1x1_32x8x1_32x8x1_1x16x1x16_4x4x1_1x1_intrawave_v3,0.0,79.32,349.44
304,152,896,5120,34,0,11.5082,a8w8_rowwise_256x16x64x512_16x16_1x1_32x8x1_32x8x1_1x16x1x16_4x4x1_1x1_intrawave_v3,0.0,121.18,489.92
304,152,1024,5632,34,0,12.4903,a8w8_rowwise_256x16x64x512_16x16_1x1_32x8x1_32x8x1_1x16x1x16_4x4x1_1x1_intrawave_v3,0.0,140.37,555.19
304,152,1056,1408,34,0,6.1225,a8w8_rowwise_256x16x64x512_16x16_1x1_32x8x1_32x8x1_1x16x1x16_4x4x1_1x1_intrawave_v3,0.0,73.83,330.24
304,152,1280,4096,34,0,11.2374,a8w8_rowwise_256x16x64x512_16x16_1x1_32x8x1_32x8x1_1x16x1x16_4x4x1_1x1_intrawave_v3,0.0,141.83,556.59
304,152,1408,352,50,0,4.4352,a8w8_rowwise_128x16x32x128_16x16_1x1_8x16x1_8x16x1_1x16x1x8_4x4x1_1x1_intrawave_v1,0.0,33.97,220.32
304,152,1408,1408,34,0,6.3068,a8w8_rowwise_256x16x64x512_16x16_1x1_32x8x1_32x8x1_1x16x1x16_4x4x1_1x1_intrawave_v3,0.0,95.56,416.14
304,152,1536,2048,34,0,7.5974,a8w8_rowwise_256x16x64x512_16x16_1x1_32x8x1_32x8x1_1x16x1x16_4x4x1_1x1_intrawave_v3,0.0,125.87,516.49
304,152,1792,6144,30,0,15.4598,a8w8_rowwise_256x32x64x512_16x16_1x2_32x8x1_32x8x1_1x32x1x8_8x8x1_1x2_intrawave_v3,0.0,216.5,807.82
304,152,2048,1536,76,0,7.4801,a8w8_rowwise_128x32x16x128_16x16_1x1_8x16x1_8x16x1_1x16x1x8_2x2x1_1x1_interwave_v2,0.0,127.85,534.99
304,152,2048,6144,30,0,18.2049,a8w8_rowwise_256x32x64x512_16x16_1x2_32x8x1_32x8x1_1x32x1x8_8x8x1_1x2_intrawave_v3,0.0,210.12,776.68
304,152,3072,4096,30,0,17.2039,a8w8_rowwise_256x32x64x512_16x16_1x2_32x8x1_32x8x1_1x32x1x8_8x8x1_1x2_intrawave_v3,0.0,222.35,821.87
304,152,3584,6144,30,0,24.4087,a8w8_rowwise_256x32x64x512_16x16_1x2_32x8x1_32x8x1_1x32x1x8_8x8x1_1x2_intrawave_v3,0.0,274.25,985.04
304,152,4096,640,57,0,6.4429,a8w8_rowwise_128x32x16x128_16x16_1x1_8x16x1_8x16x1_1x16x1x8_2x2x1_1x1_intrawave_v2,0.0,123.69,615.24
304,152,4096,1024,47,0,8.7056,a8w8_rowwise_256x64x64x128_32x32_1x1_8x32x1_8x32x1_1x32x1x8_8x8x1_1x1_intrawave_v3,0.0,146.47,642.71
304,152,4096,3072,23,0,17.5258,a8w8_rowwise_256x64x64x512_32x32_1x1_32x8x1_32x8x1_1x32x1x8_8x8x1_1x1_intrawave_v3,0.0,218.26,815.66
304,152,5120,640,47,0,7.0122,a8w8_rowwise_256x64x64x128_32x32_1x1_8x32x1_8x32x1_1x32x1x8_8x8x1_1x1_intrawave_v3,0.0,142.06,703.14
304,152,5120,2048,23,0,13.9821,a8w8_rowwise_256x64x64x512_32x32_1x1_32x8x1_32x8x1_1x32x1x8_8x8x1_1x1_intrawave_v3,0.0,227.98,883.53
304,152,6144,768,47,0,8.2804,a8w8_rowwise_256x64x64x128_32x32_1x1_8x32x1_8x32x1_1x32x1x8_8x8x1_1x1_intrawave_v3,0.0,173.23,809.51
304,152,6144,1024,47,0,10.2032,a8w8_rowwise_256x64x64x128_32x32_1x1_8x32x1_8x32x1_1x32x1x8_8x8x1_1x1_intrawave_v3,0.0,187.45,814.93
304,152,6144,1536,47,0,12.8005,a8w8_rowwise_256x64x64x128_32x32_1x1_8x32x1_8x32x1_1x32x1x8_8x8x1_1x1_intrawave_v3,0.0,224.12,901.4
304,152,6144,2048,47,0,15.0568,a8w8_rowwise_256x64x64x128_32x32_1x1_8x32x1_8x32x1_1x32x1x8_8x8x1_1x1_intrawave_v3,0.0,254.05,980.42
304,152,7168,256,69,0,5.6583,a8w8_rowwise_128x16x32x128_16x16_1x1_8x16x1_8x16x1_1x16x1x8_4x4x1_1x1_interwave_v1,0.0,98.59,716.29
304,152,7168,2304,22,0,18.3051,a8w8_rowwise_256x64x96x256_16x16_2x3_16x16x1_16x16x1_1x64x1x4_8x8x1_2x1_intrawave_v3,0.0,274.27,1040.39
304,160,192,7168,34,0,11.8624,a8w8_rowwise_256x16x64x512_16x16_1x1_32x8x1_32x8x1_1x16x1x16_4x4x1_1x1_intrawave_v3,0.0,37.13,217.88
304,160,512,7168,34,0,12.093,a8w8_rowwise_256x16x64x512_16x16_1x1_32x8x1_32x8x1_1x16x1x16_4x4x1_1x1_intrawave_v3,0.0,97.11,411.87
304,160,896,5120,34,0,9.9751,a8w8_rowwise_256x16x64x512_16x16_1x1_32x8x1_32x8x1_1x16x1x16_4x4x1_1x1_intrawave_v3,0.0,147.17,570.77
304,160,1024,5632,34,0,11.4941,a8w8_rowwise_256x16x64x512_16x16_1x1_32x8x1_32x8x1_1x16x1x16_4x4x1_1x1_intrawave_v3,0.0,160.56,608.66
304,160,1056,1408,76,0,5.9035,a8w8_rowwise_128x32x16x128_16x16_1x1_8x16x1_8x16x1_1x16x1x8_2x2x1_1x1_interwave_v2,0.0,80.59,347.26
304,160,1280,4096,34,0,10.1516,a8w8_rowwise_256x16x64x512_16x16_1x1_32x8x1_32x8x1_1x16x1x16_4x4x1_1x1_intrawave_v3,0.0,165.27,621.36
304,160,1408,352,78,0,4.452,a8w8_rowwise_64x16x16x128_16x16_1x1_8x8x1_8x8x1_1x16x1x4_4x4x1_1x1_interwave_v2,0.0,35.62,225.18
304,160,1408,1408,79,0,6.0356,a8w8_rowwise_128x16x32x128_16x16_1x1_8x16x1_8x16x1_1x16x1x8_4x4x1_1x1_interwave_v2,0.0,105.11,440.44
304,160,1536,2048,34,0,7.2224,a8w8_rowwise_256x16x64x512_16x16_1x1_32x8x1_32x8x1_1x16x1x16_4x4x1_1x1_intrawave_v3,0.0,139.38,548.98
304,160,1792,6144,30,0,14.9489,a8w8_rowwise_256x32x64x512_16x16_1x2_32x8x1_32x8x1_1x32x1x8_8x8x1_1x2_intrawave_v3,0.0,235.68,840.63
304,160,2048,1536,79,0,7.0604,a8w8_rowwise_128x16x32x128_16x16_1x1_8x16x1_8x16x1_1x16x1x8_4x4x1_1x1_interwave_v2,0.0,142.57,573.18
304,160,2048,6144,30,0,16.2152,a8w8_rowwise_256x32x64x512_16x16_1x2_32x8x1_32x8x1_1x32x1x8_8x8x1_1x2_intrawave_v3,0.0,248.32,877.04
304,160,3072,4096,30,0,16.133,a8w8_rowwise_256x32x64x512_16x16_1x2_32x8x1_32x8x1_1x32x1x8_8x8x1_1x2_intrawave_v3,0.0,249.58,881.5
304,160,3584,6144,30,0,22.9169,a8w8_rowwise_256x32x64x512_16x16_1x2_32x8x1_32x8x1_1x32x1x8_8x8x1_1x2_intrawave_v3,0.0,307.48,1053.81
304,160,4096,640,50,0,6.1606,a8w8_rowwise_128x16x32x128_16x16_1x1_8x16x1_8x16x1_1x16x1x8_4x4x1_1x1_intrawave_v1,0.0,136.17,654.9
304,160,4096,1024,28,0,8.4656,a8w8_rowwise_256x32x128x256_32x32_1x1_16x16x1_16x16x1_1x32x1x8_8x8x1_1x1_intrawave_v3,0.0,158.54,669.64
304,160,4096,3072,23,0,16.8101,a8w8_rowwise_256x64x64x512_32x32_1x1_32x8x1_32x8x1_1x32x1x8_8x8x1_1x1_intrawave_v3,0.0,239.53,855.74
304,160,5120,640,62,0,6.9329,a8w8_rowwise_128x32x64x128_32x32_1x1_8x16x1_8x16x1_1x16x1x8_8x8x1_1x1_intrawave_v2,0.0,151.25,723.74
304,160,5120,2048,23,0,13.984,a8w8_rowwise_256x64x64x512_32x32_1x1_32x8x1_32x8x1_1x32x1x8_8x8x1_1x1_intrawave_v3,0.0,239.95,890.43
304,160,6144,768,81,0,8.1704,a8w8_rowwise_128x32x64x128_32x32_1x1_8x16x1_8x16x1_1x16x1x8_8x8x1_1x1_interwave_v2,0.0,184.81,833.2
304,160,6144,1024,47,0,10.3348,a8w8_rowwise_256x64x64x128_32x32_1x1_8x32x1_8x32x1_1x32x1x8_8x8x1_1x1_intrawave_v3,0.0,194.8,814.86
304,160,6144,1536,47,0,12.8055,a8w8_rowwise_256x64x64x128_32x32_1x1_8x32x1_8x32x1_1x32x1x8_8x8x1_1x1_intrawave_v3,0.0,235.83,909.69
304,160,6144,2048,47,0,15.1473,a8w8_rowwise_256x64x64x128_32x32_1x1_8x32x1_8x32x1_1x32x1x8_8x8x1_1x1_intrawave_v3,0.0,265.83,982.13
304,160,7168,256,50,0,5.4556,a8w8_rowwise_128x16x32x128_16x16_1x1_8x16x1_8x16x1_1x16x1x8_4x4x1_1x1_intrawave_v1,0.0,107.63,764.3
304,160,7168,2304,22,0,18.3322,a8w8_rowwise_256x64x96x256_16x16_2x3_16x16x1_16x16x1_1x64x1x4_8x8x1_2x1_intrawave_v3,0.0,288.28,1046.11
304,168,192,7168,34,0,13.7178,a8w8_rowwise_256x16x64x512_16x16_1x1_32x8x1_32x8x1_1x16x1x16_4x4x1_1x1_intrawave_v3,0.0,33.71,192.81
304,168,512,7168,34,0,14.1198,a8w8_rowwise_256x16x64x512_16x16_1x1_32x8x1_32x8x1_1x16x1x16_4x4x1_1x1_intrawave_v3,0.0,87.33,357.39
304,168,896,5120,34,0,11.5301,a8w8_rowwise_256x16x64x512_16x16_1x1_32x8x1_32x8x1_1x16x1x16_4x4x1_1x1_intrawave_v3,0.0,133.69,498.59
304,168,1024,5632,34,0,12.7506,a8w8_rowwise_256x16x64x512_16x16_1x1_32x8x1_32x8x1_1x16x1x16_4x4x1_1x1_intrawave_v3,0.0,151.97,553.5
304,168,1056,1408,34,0,6.1822,a8w8_rowwise_256x16x64x512_16x16_1x1_32x8x1_32x8x1_1x16x1x16_4x4x1_1x1_intrawave_v3,0.0,80.81,336.16
304,168,1280,4096,34,0,11.2883,a8w8_rowwise_256x16x64x512_16x16_1x1_32x8x1_32x8x1_1x16x1x16_4x4x1_1x1_intrawave_v3,0.0,156.06,563.51
304,168,1408,352,50,0,4.4464,a8w8_rowwise_128x16x32x128_16x16_1x1_8x16x1_8x16x1_1x16x1x8_4x4x1_1x1_intrawave_v1,0.0,37.45,231.16
304,168,1408,1408,34,0,6.3193,a8w8_rowwise_256x16x64x512_16x16_1x1_32x8x1_32x8x1_1x16x1x16_4x4x1_1x1_intrawave_v3,0.0,105.41,426.01
304,168,1536,2048,79,0,8.0703,a8w8_rowwise_128x16x32x128_16x16_1x1_8x16x1_8x16x1_1x16x1x8_4x4x1_1x1_interwave_v2,0.0,130.97,496.37
304,168,1792,6144,30,0,17.7899,a8w8_rowwise_256x32x64x512_16x16_1x2_32x8x1_32x8x1_1x32x1x8_8x8x1_1x2_intrawave_v3,0.0,207.95,710.76
304,168,2048,1536,30,0,7.4582,a8w8_rowwise_256x32x64x512_16x16_1x2_32x8x1_32x8x1_1x32x1x8_8x8x1_1x2_intrawave_v3,0.0,141.72,548.64
304,168,2048,6144,30,0,18.8202,a8w8_rowwise_256x32x64x512_16x16_1x2_32x8x1_32x8x1_1x32x1x8_8x8x1_1x2_intrawave_v3,0.0,224.64,759.99
304,168,3072,4096,30,0,15.8613,a8w8_rowwise_256x32x64x512_16x16_1x2_32x8x1_32x8x1_1x32x1x8_8x8x1_1x2_intrawave_v3,0.0,266.55,901.77
304,168,3584,6144,28,0,28.0738,a8w8_rowwise_256x32x128x256_32x32_1x1_16x16x1_16x16x1_1x32x1x8_8x8x1_1x1_intrawave_v3,0.0,263.55,864.03
304,168,4096,640,75,0,6.7526,a8w8_rowwise_128x64x16x128_16x16_2x1_8x16x1_8x16x1_1x16x1x8_2x2x1_1x1_interwave_v2,0.0,130.44,607.95
304,168,4096,1024,29,0,8.846,a8w8_rowwise_256x32x96x256_16x16_1x3_16x16x1_16x16x1_1x32x1x8_4x4x1_1x1_intrawave_v3,0.0,159.31,649.17
304,168,4096,3072,23,0,17.8114,a8w8_rowwise_256x64x64x512_32x32_1x1_32x8x1_32x8x1_1x32x1x8_8x8x1_1x1_intrawave_v3,0.0,237.37,812.7
304,168,5120,640,47,0,7.0164,a8w8_rowwise_256x64x64x128_32x32_1x1_8x32x1_8x32x1_1x32x1x8_8x8x1_1x1_intrawave_v3,0.0,156.92,727.53
304,168,5120,2048,23,0,14.4077,a8w8_rowwise_256x64x64x512_32x32_1x1_32x8x1_32x8x1_1x32x1x8_8x8x1_1x1_intrawave_v3,0.0,244.54,871.07
304,168,6144,768,47,0,8.4589,a8w8_rowwise_256x64x64x128_32x32_1x1_8x32x1_8x32x1_1x32x1x8_8x8x1_1x1_intrawave_v3,0.0,187.43,817.13
304,168,6144,1024,47,0,10.5031,a8w8_rowwise_256x64x64x128_32x32_1x1_8x32x1_8x32x1_1x32x1x8_8x8x1_1x1_intrawave_v3,0.0,201.27,811.94
304,168,6144,1536,47,0,12.9665,a8w8_rowwise_256x64x64x128_32x32_1x1_8x32x1_8x32x1_1x32x1x8_8x8x1_1x1_intrawave_v3,0.0,244.55,906.92
304,168,6144,2048,47,0,15.2748,a8w8_rowwise_256x64x64x128_32x32_1x1_8x32x1_8x32x1_1x32x1x8_8x8x1_1x1_intrawave_v3,0.0,276.79,981.44
304,168,7168,256,67,0,6.0851,a8w8_rowwise_128x32x16x128_16x16_1x1_8x16x1_8x16x1_1x16x1x8_2x2x1_1x1_interwave_v1,0.0,101.32,704.42
304,168,7168,2304,46,0,18.3002,a8w8_rowwise_256x64x128x128_32x32_1x2_8x32x1_8x32x1_1x32x1x8_8x8x1_1x1_intrawave_v3,0.0,303.22,1055.21
304,176,192,7168,34,0,11.3591,a8w8_rowwise_256x16x64x512_16x16_1x1_32x8x1_32x8x1_1x16x1x16_4x4x1_1x1_intrawave_v3,0.0,42.65,238.17
304,176,512,7168,34,0,11.7373,a8w8_rowwise_256x16x64x512_16x16_1x1_32x8x1_32x8x1_1x16x1x16_4x4x1_1x1_intrawave_v3,0.0,110.06,435.52
304,176,896,5120,34,0,9.9282,a8w8_rowwise_256x16x64x512_16x16_1x1_32x8x1_32x8x1_1x16x1x16_4x4x1_1x1_intrawave_v3,0.0,162.65,584.6
304,176,1024,5632,34,0,11.5041,a8w8_rowwise_256x16x64x512_16x16_1x1_32x8x1_32x8x1_1x16x1x16_4x4x1_1x1_intrawave_v3,0.0,176.46,618.81
304,176,1056,1408,79,0,5.3896,a8w8_rowwise_128x16x32x128_16x16_1x1_8x16x1_8x16x1_1x16x1x8_4x4x1_1x1_interwave_v2,0.0,97.11,390.82
304,176,1280,4096,34,0,9.9755,a8w8_rowwise_256x16x64x512_16x16_1x1_32x8x1_32x8x1_1x16x1x16_4x4x1_1x1_intrawave_v3,0.0,185.0,643.01
304,176,1408,352,49,0,3.9188,a8w8_rowwise_64x16x16x128_16x16_1x1_8x8x1_8x8x1_1x16x1x4_4x4x1_1x1_intrawave_v1,0.0,44.52,268.75
304,176,1408,1408,79,0,5.5236,a8w8_rowwise_128x16x32x128_16x16_1x1_8x16x1_8x16x1_1x16x1x8_4x4x1_1x1_interwave_v2,0.0,126.34,493.5
304,176,1536,2048,34,0,7.3065,a8w8_rowwise_256x16x64x512_16x16_1x1_32x8x1_32x8x1_1x16x1x16_4x4x1_1x1_intrawave_v3,0.0,151.55,553.87
304,176,1792,6144,30,0,17.306,a8w8_rowwise_256x32x64x512_16x16_1x2_32x8x1_32x8x1_1x32x1x8_8x8x1_1x2_intrawave_v3,0.0,223.94,735.13
304,176,2048,1536,30,0,7.0439,a8w8_rowwise_256x32x64x512_16x16_1x2_32x8x1_32x8x1_1x32x1x8_8x8x1_1x2_intrawave_v3,0.0,157.2,587.31
304,176,2048,6144,30,0,18.4561,a8w8_rowwise_256x32x64x512_16x16_1x2_32x8x1_32x8x1_1x32x1x8_8x8x1_1x2_intrawave_v3,0.0,239.98,779.43
304,176,3072,4096,30,0,16.4527,a8w8_rowwise_256x32x64x512_16x16_1x2_32x8x1_32x8x1_1x32x1x8_8x8x1_1x2_intrawave_v3,0.0,269.21,874.33
304,176,3584,6144,28,0,28.2816,a8w8_rowwise_256x32x128x256_32x32_1x1_16x16x1_16x16x1_1x32x1x8_8x8x1_1x1_intrawave_v3,0.0,274.07,861.44
304,176,4096,640,75,0,6.2491,a8w8_rowwise_128x64x16x128_16x16_2x1_8x16x1_8x16x1_1x16x1x8_2x2x1_1x1_interwave_v2,0.0,147.66,668.24
304,176,4096,1024,29,0,8.6875,a8w8_rowwise_256x32x96x256_16x16_1x3_16x16x1_16x16x1_1x32x1x8_4x4x1_1x1_intrawave_v3,0.0,169.94,669.5
304,176,4096,3072,23,0,17.1037,a8w8_rowwise_256x64x64x512_32x32_1x1_32x8x1_32x8x1_1x32x1x8_8x8x1_1x1_intrawave_v3,0.0,258.96,851.59
304,176,5120,640,47,0,6.6217,a8w8_rowwise_256x64x64x128_32x32_1x1_8x32x1_8x32x1_1x32x1x8_8x8x1_1x1_intrawave_v3,0.0,174.19,784.04
304,176,5120,2048,23,0,14.1901,a8w8_rowwise_256x64x64x512_32x32_1x1_32x8x1_32x8x1_1x32x1x8_8x8x1_1x1_intrawave_v3,0.0,260.11,891.36
304,176,6144,768,47,0,8.3663,a8w8_rowwise_256x64x64x128_32x32_1x1_8x32x1_8x32x1_1x32x1x8_8x8x1_1x1_intrawave_v3,0.0,198.53,838.66
304,176,6144,1024,22,0,10.0823,a8w8_rowwise_256x64x96x256_16x16_2x3_16x16x1_16x16x1_1x64x1x4_8x8x1_2x1_intrawave_v3,0.0,219.65,856.39
304,176,6144,1536,23,0,12.5567,a8w8_rowwise_256x64x64x512_32x32_1x1_32x8x1_32x8x1_1x32x1x8_8x8x1_1x1_intrawave_v3,0.0,264.55,945.33
304,176,6144,2048,22,0,15.966,a8w8_rowwise_256x64x96x256_16x16_2x3_16x16x1_16x16x1_1x64x1x4_8x8x1_2x1_intrawave_v3,0.0,277.41,946.14
304,176,7168,256,50,0,5.7536,a8w8_rowwise_128x16x32x128_16x16_1x1_8x16x1_8x16x1_1x16x1x8_4x4x1_1x1_intrawave_v1,0.0,112.26,765.29
304,176,7168,2304,21,0,17.4032,a8w8_rowwise_256x64x128x256_32x32_1x2_16x16x1_16x16x1_1x32x1x8_8x8x1_1x1_intrawave_v3,0.0,334.04,1117.25
304,184,192,7168,34,0,13.294,a8w8_rowwise_256x16x64x512_16x16_1x1_32x8x1_32x8x1_1x16x1x16_4x4x1_1x1_intrawave_v3,0.0,38.1,208.05
304,184,512,7168,34,0,13.8072,a8w8_rowwise_256x16x64x512_16x16_1x1_32x8x1_32x8x1_1x16x1x16_4x4x1_1x1_intrawave_v3,0.0,97.82,374.97
304,184,896,5120,34,0,11.5106,a8w8_rowwise_256x16x64x512_16x16_1x1_32x8x1_32x8x1_1x16x1x16_4x4x1_1x1_intrawave_v3,0.0,146.67,509.04
304,184,1024,5632,34,0,13.0733,a8w8_rowwise_256x16x64x512_16x16_1x1_32x8x1_32x8x1_1x16x1x16_4x4x1_1x1_intrawave_v3,0.0,162.34,549.23
304,184,1056,1408,34,0,5.6948,a8w8_rowwise_256x16x64x512_16x16_1x1_32x8x1_32x8x1_1x16x1x16_4x4x1_1x1_intrawave_v3,0.0,96.08,374.82
304,184,1280,4096,34,0,11.3375,a8w8_rowwise_256x16x64x512_16x16_1x1_32x8x1_32x8x1_1x16x1x16_4x4x1_1x1_intrawave_v3,0.0,170.18,570.46
304,184,1408,352,50,0,3.9195,a8w8_rowwise_128x16x32x128_16x16_1x1_8x16x1_8x16x1_1x16x1x8_4x4x1_1x1_intrawave_v1,0.0,46.53,275.17
304,184,1408,1408,34,0,5.8625,a8w8_rowwise_256x16x64x512_16x16_1x1_32x8x1_32x8x1_1x16x1x16_4x4x1_1x1_intrawave_v3,0.0,124.44,470.73
304,184,1536,2048,30,0,7.7852,a8w8_rowwise_256x32x64x512_16x16_1x2_32x8x1_32x8x1_1x32x1x8_8x8x1_1x2_intrawave_v3,0.0,148.7,525.07
304,184,1792,6144,30,0,17.3395,a8w8_rowwise_256x32x64x512_16x16_1x2_32x8x1_32x8x1_1x32x1x8_8x8x1_1x2_intrawave_v3,0.0,233.67,738.2
304,184,2048,1536,30,0,7.0229,a8w8_rowwise_256x32x64x512_16x16_1x2_32x8x1_32x8x1_1x32x1x8_8x8x1_1x2_intrawave_v3,0.0,164.84,595.48
304,184,2048,6144,30,0,17.8744,a8w8_rowwise_256x32x64x512_16x16_1x2_32x8x1_32x8x1_1x32x1x8_8x8x1_1x2_intrawave_v3,0.0,259.06,809.37
304,184,3072,4096,30,0,17.0603,a8w8_rowwise_256x32x64x512_16x16_1x2_32x8x1_32x8x1_1x32x1x8_8x8x1_1x2_intrawave_v3,0.0,271.42,848.0
304,184,3584,6144,28,0,28.0765,a8w8_rowwise_256x32x128x256_32x32_1x1_16x16x1_16x16x1_1x32x1x8_8x8x1_1x1_intrawave_v3,0.0,288.62,871.53
304,184,4096,640,47,0,6.3945,a8w8_rowwise_256x64x64x128_32x32_1x1_8x32x1_8x32x1_1x32x1x8_8x8x1_1x1_intrawave_v3,0.0,150.86,664.09
304,184,4096,1024,29,0,8.7157,a8w8_rowwise_256x32x96x256_16x16_1x3_16x16x1_16x16x1_1x32x1x8_4x4x1_1x1_intrawave_v3,0.0,177.09,675.8
304,184,4096,3072,23,0,16.9882,a8w8_rowwise_256x64x64x512_32x32_1x1_32x8x1_32x8x1_1x32x1x8_8x8x1_1x1_intrawave_v3,0.0,272.57,862.69
304,184,5120,640,47,0,7.1288,a8w8_rowwise_256x64x64x128_32x32_1x1_8x32x1_8x32x1_1x32x1x8_8x8x1_1x1_intrawave_v3,0.0,169.15,740.48
304,184,5120,2048,28,0,14.6233,a8w8_rowwise_256x32x128x256_32x32_1x1_16x16x1_16x16x1_1x32x1x8_8x8x1_1x1_intrawave_v3,0.0,263.88,871.67
304,184,6144,768,47,0,8.4103,a8w8_rowwise_256x64x64x128_32x32_1x1_8x32x1_8x32x1_1x32x1x8_8x8x1_1x1_intrawave_v3,0.0,206.47,846.69
304,184,6144,1024,22,0,10.2779,a8w8_rowwise_256x64x96x256_16x16_2x3_16x16x1_16x16x1_1x64x1x4_8x8x1_2x1_intrawave_v3,0.0,225.27,850.45
304,184,6144,1536,23,0,12.7312,a8w8_rowwise_256x64x64x512_32x32_1x1_32x8x1_32x8x1_1x32x1x8_8x8x1_1x1_intrawave_v3,0.0,272.79,941.06
304,184,6144,2048,28,0,15.7605,a8w8_rowwise_256x32x128x256_32x32_1x1_16x16x1_16x16x1_1x32x1x8_8x8x1_1x1_intrawave_v3,0.0,293.8,965.75
304,184,7168,256,67,0,5.7219,a8w8_rowwise_128x32x16x128_16x16_1x1_8x16x1_8x16x1_1x16x1x8_2x2x1_1x1_interwave_v1,0.0,118.02,789.94
304,184,7168,2304,21,0,17.8211,a8w8_rowwise_256x64x128x256_32x32_1x2_16x16x1_16x16x1_1x32x1x8_8x8x1_1x1_intrawave_v3,0.0,341.03,1098.52
304,192,192,7168,34,0,11.2782,a8w8_rowwise_256x16x64x512_16x16_1x1_32x8x1_32x8x1_1x16x1x16_4x4x1_1x1_intrawave_v3,0.0,46.86,250.59
304,192,512,7168,34,0,11.7304,a8w8_rowwise_256x16x64x512_16x16_1x1_32x8x1_32x8x1_1x16x1x16_4x4x1_1x1_intrawave_v3,0.0,120.14,446.95
304,192,896,5120,34,0,10.3647,a8w8_rowwise_256x16x64x512_16x16_1x1_32x8x1_32x8x1_1x16x1x16_4x4x1_1x1_intrawave_v3,0.0,169.96,570.65
304,192,1024,5632,34,0,11.6115,a8w8_rowwise_256x16x64x512_16x16_1x1_32x8x1_32x8x1_1x16x1x16_4x4x1_1x1_intrawave_v3,0.0,190.72,623.67
304,192,1056,1408,79,0,5.3965,a8w8_rowwise_128x16x32x128_16x16_1x1_8x16x1_8x16x1_1x16x1x8_4x4x1_1x1_interwave_v2,0.0,105.8,400.76
304,192,1280,4096,30,0,10.2183,a8w8_rowwise_256x32x64x512_16x16_1x2_32x8x1_32x8x1_1x32x1x8_8x8x1_1x2_intrawave_v3,0.0,197.03,638.15
304,192,1408,352,48,0,3.8958,a8w8_rowwise_128x32x16x128_16x16_1x1_8x16x1_8x16x1_1x16x1x8_2x2x1_1x1_intrawave_v1,0.0,48.85,283.35
304,192,1408,1408,79,0,5.6034,a8w8_rowwise_128x16x32x128_16x16_1x1_8x16x1_8x16x1_1x16x1x8_4x4x1_1x1_interwave_v2,0.0,135.86,498.53
304,192,1536,2048,30,0,7.166,a8w8_rowwise_256x32x64x512_16x16_1x2_32x8x1_32x8x1_1x32x1x8_8x8x1_1x2_intrawave_v3,0.0,168.57,576.16
304,192,1792,6144,30,0,15.4171,a8w8_rowwise_256x32x64x512_16x16_1x2_32x8x1_32x8x1_1x32x1x8_8x8x1_1x2_intrawave_v3,0.0,274.23,835.29
304,192,2048,1536,30,0,6.6246,a8w8_rowwise_256x32x64x512_16x16_1x2_32x8x1_32x8x1_1x32x1x8_8x8x1_1x2_intrawave_v3,0.0,182.34,638.09
304,192,2048,6144,30,0,17.147,a8w8_rowwise_256x32x64x512_16x16_1x2_32x8x1_32x8x1_1x32x1x8_8x8x1_1x2_intrawave_v3,0.0,281.79,848.49
304,192,3072,4096,30,0,15.0338,a8w8_rowwise_256x32x64x512_16x16_1x2_32x8x1_32x8x1_1x32x1x8_8x8x1_1x2_intrawave_v3,0.0,321.4,967.75
304,192,3584,6144,23,0,22.4276,a8w8_rowwise_256x64x64x512_32x32_1x1_32x8x1_32x8x1_1x32x1x8_8x8x1_1x1_intrawave_v3,0.0,377.02,1095.79
304,192,4096,640,75,0,6.1538,a8w8_rowwise_128x64x16x128_16x16_2x1_8x16x1_8x16x1_1x16x1x8_2x2x1_1x1_interwave_v2,0.0,163.58,701.55
304,192,4096,1024,28,0,8.5004,a8w8_rowwise_256x32x128x256_32x32_1x1_16x16x1_16x16x1_1x32x1x8_8x8x1_1x1_intrawave_v3,0.0,189.47,701.59
304,192,4096,3072,23,0,14.2879,a8w8_rowwise_256x64x64x512_32x32_1x1_32x8x1_32x8x1_1x32x1x8_8x8x1_1x1_intrawave_v3,0.0,338.18,1032.03
304,192,5120,640,47,0,6.4758,a8w8_rowwise_256x64x64x128_32x32_1x1_8x32x1_8x32x1_1x32x1x8_8x8x1_1x1_intrawave_v3,0.0,194.31,828.59
304,192,5120,2048,23,0,12.2354,a8w8_rowwise_256x64x64x512_32x32_1x1_32x8x1_32x8x1_1x32x1x8_8x8x1_1x1_intrawave_v3,0.0,329.09,1049.83
304,192,6144,768,47,0,8.313,a8w8_rowwise_256x64x64x128_32x32_1x1_8x32x1_8x32x1_1x32x1x8_8x8x1_1x1_intrawave_v3,0.0,217.96,869.16
304,192,6144,1024,22,0,10.0784,a8w8_rowwise_256x64x96x256_16x16_2x3_16x16x1_16x16x1_1x64x1x4_8x8x1_2x1_intrawave_v3,0.0,239.71,877.85
304,192,6144,1536,23,0,11.0472,a8w8_rowwise_256x64x64x512_32x32_1x1_32x8x1_32x8x1_1x32x1x8_8x8x1_1x1_intrawave_v3,0.0,328.04,1094.52
304,192,6144,2048,23,0,13.3968,a8w8_rowwise_256x64x64x512_32x32_1x1_32x8x1_32x8x1_1x32x1x8_8x8x1_1x1_intrawave_v3,0.0,360.67,1144.71
304,192,7168,256,48,0,5.6936,a8w8_rowwise_128x32x16x128_16x16_1x1_8x16x1_8x16x1_1x16x1x8_2x2x1_1x1_intrawave_v1,0.0,123.76,814.37
304,192,7168,2304,21,0,17.8953,a8w8_rowwise_256x64x128x256_32x32_1x2_16x16x1_16x16x1_1x32x1x8_8x8x1_1x1_intrawave_v3,0.0,354.38,1101.4
304,200,192,7168,34,0,13.6158,a8w8_rowwise_256x16x64x512_16x16_1x1_32x8x1_32x8x1_1x16x1x16_4x4x1_1x1_intrawave_v3,0.0,40.43,212.01
304,200,512,7168,34,0,14.2791,a8w8_rowwise_256x16x64x512_16x16_1x1_32x8x1_32x8x1_1x16x1x16_4x4x1_1x1_intrawave_v3,0.0,102.81,371.76
304,200,896,5120,34,0,11.9152,a8w8_rowwise_256x16x64x512_16x16_1x1_32x8x1_32x8x1_1x16x1x16_4x4x1_1x1_intrawave_v3,0.0,154.01,501.03
304,200,1024,5632,34,0,13.5977,a8w8_rowwise_256x16x64x512_16x16_1x1_32x8x1_32x8x1_1x16x1x16_4x4x1_1x1_intrawave_v3,0.0,169.65,537.09
304,200,1056,1408,76,0,5.7563,a8w8_rowwise_128x32x16x128_16x16_1x1_8x16x1_8x16x1_1x16x1x8_2x2x1_1x1_interwave_v2,0.0,103.32,380.6
304,200,1280,4096,30,0,11.4597,a8w8_rowwise_256x32x64x512_16x16_1x2_32x8x1_32x8x1_1x32x1x8_8x8x1_1x2_intrawave_v3,0.0,183.0,573.67
304,200,1408,352,50,0,3.9389,a8w8_rowwise_128x16x32x128_16x16_1x1_8x16x1_8x16x1_1x16x1x8_4x4x1_1x1_intrawave_v1,0.0,50.33,286.68
304,200,1408,1408,79,0,6.1449,a8w8_rowwise_128x16x32x128_16x16_1x1_8x16x1_8x16x1_1x16x1x8_4x4x1_1x1_interwave_v2,0.0,129.05,460.1
304,200,1536,2048,30,0,7.7203,a8w8_rowwise_256x32x64x512_16x16_1x2_32x8x1_32x8x1_1x32x1x8_8x8x1_1x2_intrawave_v3,0.0,162.98,540.1
304,200,1792,6144,30,0,17.9166,a8w8_rowwise_256x32x64x512_16x16_1x2_32x8x1_32x8x1_1x32x1x8_8x8x1_1x2_intrawave_v3,0.0,245.81,723.11
304,200,2048,1536,30,0,7.4245,a8w8_rowwise_256x32x64x512_16x16_1x2_32x8x1_32x8x1_1x32x1x8_8x8x1_1x2_intrawave_v3,0.0,169.48,575.41
304,200,2048,6144,30,0,18.9747,a8w8_rowwise_256x32x64x512_16x16_1x2_32x8x1_32x8x1_1x32x1x8_8x8x1_1x2_intrawave_v3,0.0,265.26,771.07
304,200,3072,4096,28,0,19.705,a8w8_rowwise_256x32x128x256_32x32_1x1_16x16x1_16x16x1_1x32x1x8_8x8x1_1x1_intrawave_v3,0.0,255.43,742.5
304,200,3584,6144,28,0,30.3442,a8w8_rowwise_256x32x128x256_32x32_1x1_16x16x1_16x16x1_1x32x1x8_8x8x1_1x1_intrawave_v3,0.0,290.27,813.42
304,200,4096,640,47,0,6.5012,a8w8_rowwise_256x64x64x128_32x32_1x1_8x32x1_8x32x1_1x32x1x8_8x8x1_1x1_intrawave_v3,0.0,161.29,674.93
304,200,4096,1024,47,0,8.6515,a8w8_rowwise_256x64x64x128_32x32_1x1_8x32x1_8x32x1_1x32x1x8_8x8x1_1x1_intrawave_v3,0.0,193.92,697.86
304,200,4096,3072,28,0,18.1382,a8w8_rowwise_256x32x128x256_32x32_1x1_16x16x1_16x16x1_1x32x1x8_8x8x1_1x1_intrawave_v3,0.0,277.49,817.93
304,200,5120,640,62,0,7.4696,a8w8_rowwise_128x32x64x128_32x32_1x1_8x16x1_8x16x1_1x16x1x8_8x8x1_1x1_intrawave_v2,0.0,175.47,730.0
304,200,5120,2048,28,0,14.6341,a8w8_rowwise_256x32x128x256_32x32_1x1_16x16x1_16x16x1_1x32x1x8_8x8x1_1x1_intrawave_v3,0.0,286.61,884.47
304,200,6144,768,45,0,9.4206,a8w8_rowwise_256x128x64x128_32x32_2x1_8x32x1_8x32x1_1x32x1x8_8x8x1_1x1_intrawave_v3,0.0,200.35,778.06
304,200,6144,1024,22,0,11.1028,a8w8_rowwise_256x64x96x256_16x16_2x3_16x16x1_16x16x1_1x64x1x4_8x8x1_2x1_intrawave_v3,0.0,226.66,806.45
304,200,6144,1536,22,0,14.0486,a8w8_rowwise_256x64x96x256_16x16_2x3_16x16x1_16x16x1_1x64x1x4_8x8x1_2x1_intrawave_v3,0.0,268.7,868.56
304,200,6144,2048,22,0,17.6244,a8w8_rowwise_256x64x96x256_16x16_2x3_16x16x1_16x16x1_1x64x1x4_8x8x1_2x1_intrawave_v3,0.0,285.58,876.63
304,200,7168,256,69,0,6.7045,a8w8_rowwise_128x16x32x128_16x16_1x1_8x16x1_8x16x1_1x16x1x8_4x4x1_1x1_interwave_v1,0.0,109.48,708.99
304,200,7168,2304,15,0,19.148,a8w8_rowwise_256x128x64x256_32x32_2x1_16x16x1_16x16x1_1x32x1x8_8x8x1_1x1_intrawave_v3,0.0,345.0,1036.3
304,208,192,7168,34,0,11.404,a8w8_rowwise_256x16x64x512_16x16_1x1_32x8x1_32x8x1_1x16x1x16_4x4x1_1x1_intrawave_v3,0.0,50.2,258.42
304,208,512,7168,34,0,11.8135,a8w8_rowwise_256x16x64x512_16x16_1x1_32x8x1_32x8x1_1x16x1x16_4x4x1_1x1_intrawave_v3,0.0,129.24,454.9
304,208,896,5120,34,0,10.7899,a8w8_rowwise_256x16x64x512_16x16_1x1_32x8x1_32x8x1_1x16x1x16_4x4x1_1x1_intrawave_v3,0.0,176.87,558.41
304,208,1024,5632,34,0,12.2773,a8w8_rowwise_256x16x64x512_16x16_1x1_32x8x1_32x8x1_1x16x1x16_4x4x1_1x1_intrawave_v3,0.0,195.41,599.86
304,208,1056,1408,79,0,5.5004,a8w8_rowwise_128x16x32x128_16x16_1x1_8x16x1_8x16x1_1x16x1x8_4x4x1_1x1_interwave_v2,0.0,112.45,403.43
304,208,1280,4096,34,0,11.4426,a8w8_rowwise_256x16x64x512_16x16_1x1_32x8x1_32x8x1_1x16x1x16_4x4x1_1x1_intrawave_v3,0.0,190.61,579.18
304,208,1408,352,50,0,3.9451,a8w8_rowwise_128x16x32x128_16x16_1x1_8x16x1_8x16x1_1x16x1x8_4x4x1_1x1_intrawave_v1,0.0,52.26,292.66
304,208,1408,1408,79,0,5.7123,a8w8_rowwise_128x16x32x128_16x16_1x1_8x16x1_8x16x1_1x16x1x8_4x4x1_1x1_interwave_v2,0.0,144.37,500.86
304,208,1536,2048,30,0,7.8659,a8w8_rowwise_256x32x64x512_16x16_1x2_32x8x1_32x8x1_1x32x1x8_8x8x1_1x2_intrawave_v3,0.0,166.37,535.31
304,208,1792,6144,30,0,18.3216,a8w8_rowwise_256x32x64x512_16x16_1x2_32x8x1_32x8x1_1x32x1x8_8x8x1_1x2_intrawave_v3,0.0,249.99,711.37
304,208,2048,1536,30,0,7.5102,a8w8_rowwise_256x32x64x512_16x16_1x2_32x8x1_32x8x1_1x32x1x8_8x8x1_1x2_intrawave_v3,0.0,174.25,574.84
304,208,2048,6144,30,0,19.0896,a8w8_rowwise_256x32x64x512_16x16_1x2_32x8x1_32x8x1_1x32x1x8_8x8x1_1x2_intrawave_v3,0.0,274.21,770.73
304,208,3072,4096,28,0,19.4857,a8w8_rowwise_256x32x128x256_32x32_1x1_16x16x1_16x16x1_1x32x1x8_8x8x1_1x1_intrawave_v3,0.0,268.63,755.06
304,208,3584,6144,28,0,29.6886,a8w8_rowwise_256x32x128x256_32x32_1x1_16x16x1_16x16x1_1x32x1x8_8x8x1_1x1_intrawave_v3,0.0,308.55,834.97
304,208,4096,640,47,0,6.5183,a8w8_rowwise_256x64x64x128_32x32_1x1_8x32x1_8x32x1_1x32x1x8_8x8x1_1x1_intrawave_v3,0.0,167.3,684.0
304,208,4096,1024,47,0,8.8723,a8w8_rowwise_256x64x64x128_32x32_1x1_8x32x1_8x32x1_1x32x1x8_8x8x1_1x1_intrawave_v3,0.0,196.66,688.8
304,208,4096,3072,28,0,18.4696,a8w8_rowwise_256x32x128x256_32x32_1x1_16x16x1_16x16x1_1x32x1x8_8x8x1_1x1_intrawave_v3,0.0,283.41,808.13
304,208,5120,640,62,0,7.7041,a8w8_rowwise_128x32x64x128_32x32_1x1_8x16x1_8x16x1_1x16x1x8_8x8x1_1x1_intrawave_v2,0.0,176.94,719.08
304,208,5120,2048,28,0,14.7708,a8w8_rowwise_256x32x128x256_32x32_1x1_16x16x1_16x16x1_1x32x1x8_8x8x1_1x1_intrawave_v3,0.0,295.32,882.94
304,208,6144,768,22,0,9.534,a8w8_rowwise_256x64x96x256_16x16_2x3_16x16x1_16x16x1_1x64x1x4_8x8x1_2x1_intrawave_v3,0.0,205.89,779.76
304,208,6144,1024,22,0,11.1696,a8w8_rowwise_256x64x96x256_16x16_2x3_16x16x1_16x16x1_1x64x1x4_8x8x1_2x1_intrawave_v3,0.0,234.32,811.16
304,208,6144,1536,22,0,14.1686,a8w8_rowwise_256x64x96x256_16x16_2x3_16x16x1_16x16x1_1x64x1x4_8x8x1_2x1_intrawave_v3,0.0,277.08,869.0
304,208,6144,2048,22,0,17.1574,a8w8_rowwise_256x64x96x256_16x16_2x3_16x16x1_16x16x1_1x64x1x4_8x8x1_2x1_intrawave_v3,0.0,305.09,907.18
304,208,7168,256,50,0,6.3734,a8w8_rowwise_128x16x32x128_16x16_1x1_8x16x1_8x16x1_1x16x1x8_4x4x1_1x1_intrawave_v1,0.0,119.77,764.14
304,208,7168,2304,15,0,19.2737,a8w8_rowwise_256x128x64x256_32x32_2x1_16x16x1_16x16x1_1x32x1x8_8x8x1_1x1_intrawave_v3,0.0,356.46,1036.45
304,216,192,7168,34,0,13.5524,a8w8_rowwise_256x16x64x512_16x16_1x1_32x8x1_32x8x1_1x16x1x16_4x4x1_1x1_intrawave_v3,0.0,43.87,221.92
304,216,512,7168,34,0,14.2174,a8w8_rowwise_256x16x64x512_16x16_1x1_32x8x1_32x8x1_1x16x1x16_4x4x1_1x1_intrawave_v3,0.0,111.51,382.59
304,216,896,5120,34,0,12.2136,a8w8_rowwise_256x16x64x512_16x16_1x1_32x8x1_32x8x1_1x16x1x16_4x4x1_1x1_intrawave_v3,0.0,162.26,497.85
304,216,1024,5632,34,0,13.9474,a8w8_rowwise_256x16x64x512_16x16_1x1_32x8x1_32x8x1_1x16x1x16_4x4x1_1x1_intrawave_v3,0.0,178.63,532.43
304,216,1056,1408,34,0,5.8116,a8w8_rowwise_256x16x64x512_16x16_1x1_32x8x1_32x8x1_1x16x1x16_4x4x1_1x1_intrawave_v3,0.0,110.52,386.67
304,216,1280,4096,30,0,11.588,a8w8_rowwise_256x32x64x512_16x16_1x2_32x8x1_32x8x1_1x32x1x8_8x8x1_1x2_intrawave_v3,0.0,195.45,576.51
304,216,1408,352,48,0,4.0745,a8w8_rowwise_128x32x16x128_16x16_1x1_8x16x1_8x16x1_1x16x1x8_2x2x1_1x1_intrawave_v1,0.0,52.55,289.58
304,216,1408,1408,76,0,6.3376,a8w8_rowwise_128x32x16x128_16x16_1x1_8x16x1_8x16x1_1x16x1x8_2x2x1_1x1_interwave_v2,0.0,135.13,456.77
304,216,1536,2048,30,0,7.8572,a8w8_rowwise_256x32x64x512_16x16_1x2_32x8x1_32x8x1_1x32x1x8_8x8x1_1x2_intrawave_v3,0.0,172.96,541.11
304,216,1792,6144,30,0,18.1199,a8w8_rowwise_256x32x64x512_16x16_1x2_32x8x1_32x8x1_1x32x1x8_8x8x1_1x2_intrawave_v3,0.0,262.49,723.59
304,216,2048,1536,30,0,7.5868,a8w8_rowwise_256x32x64x512_16x16_1x2_32x8x1_32x8x1_1x32x1x8_8x8x1_1x2_intrawave_v3,0.0,179.12,574.98
304,216,2048,6144,30,0,19.2458,a8w8_rowwise_256x32x64x512_16x16_1x2_32x8x1_32x8x1_1x32x1x8_8x8x1_1x2_intrawave_v3,0.0,282.44,768.73
304,216,3072,4096,28,0,19.8667,a8w8_rowwise_256x32x128x256_32x32_1x1_16x16x1_16x16x1_1x32x1x8_8x8x1_1x1_intrawave_v3,0.0,273.61,744.7
304,216,3584,6144,28,0,29.6937,a8w8_rowwise_256x32x128x256_32x32_1x1_16x16x1_16x16x1_1x32x1x8_8x8x1_1x1_intrawave_v3,0.0,320.36,838.41
304,216,4096,640,47,0,6.5772,a8w8_rowwise_256x64x64x128_32x32_1x1_8x32x1_8x32x1_1x32x1x8_8x8x1_1x1_intrawave_v3,0.0,172.18,688.61
304,216,4096,1024,47,0,8.9872,a8w8_rowwise_256x64x64x128_32x32_1x1_8x32x1_8x32x1_1x32x1x8_8x8x1_1x1_intrawave_v3,0.0,201.61,688.2
304,216,4096,3072,28,0,18.3463,a8w8_rowwise_256x32x128x256_32x32_1x1_16x16x1_16x16x1_1x32x1x8_8x8x1_1x1_intrawave_v3,0.0,296.29,818.47
304,216,5120,640,62,0,7.7273,a8w8_rowwise_128x32x64x128_32x32_1x1_8x16x1_8x16x1_1x16x1x8_8x8x1_1x1_intrawave_v2,0.0,183.19,728.18
304,216,5120,2048,28,0,14.9359,a8w8_rowwise_256x32x128x256_32x32_1x1_16x16x1_16x16x1_1x32x1x8_8x8x1_1x1_intrawave_v3,0.0,303.29,879.76
304,216,6144,768,22,0,9.5952,a8w8_rowwise_256x64x96x256_16x16_2x3_16x16x1_16x16x1_1x64x1x4_8x8x1_2x1_intrawave_v3,0.0,212.44,785.67
304,216,6144,1024,22,0,11.1834,a8w8_rowwise_256x64x96x256_16x16_2x3_16x16x1_16x16x1_1x64x1x4_8x8x1_2x1_intrawave_v3,0.0,243.03,819.68
304,216,6144,1536,22,0,14.2262,a8w8_rowwise_256x64x96x256_16x16_2x3_16x16x1_16x16x1_1x64x1x4_8x8x1_2x1_intrawave_v3,0.0,286.57,873.26
304,216,6144,2048,22,0,17.6269,a8w8_rowwise_256x64x96x256_16x16_2x3_16x16x1_16x16x1_1x64x1x4_8x8x1_2x1_intrawave_v3,0.0,308.38,889.52
304,216,7168,256,48,0,7.4266,a8w8_rowwise_128x32x16x128_16x16_1x1_8x16x1_8x16x1_1x16x1x8_2x2x1_1x1_intrawave_v1,0.0,106.74,671.49
304,216,7168,2304,15,0,19.4475,a8w8_rowwise_256x128x64x256_32x32_2x1_16x16x1_16x16x1_1x32x1x8_8x8x1_1x1_intrawave_v3,0.0,366.86,1034.03
304,224,192,7168,34,0,11.3868,a8w8_rowwise_256x16x64x512_16x16_1x1_32x8x1_32x8x1_1x16x1x16_4x4x1_1x1_intrawave_v3,0.0,54.15,269.43
304,224,512,7168,34,0,11.8366,a8w8_rowwise_256x16x64x512_16x16_1x1_32x8x1_32x8x1_1x16x1x16_4x4x1_1x1_intrawave_v3,0.0,138.91,465.08
304,224,896,5120,34,0,10.8573,a8w8_rowwise_256x16x64x512_16x16_1x1_32x8x1_32x8x1_1x16x1x16_4x4x1_1x1_intrawave_v3,0.0,189.29,565.13
304,224,1024,5632,30,0,12.6527,a8w8_rowwise_256x32x64x512_16x16_1x2_32x8x1_32x8x1_1x32x1x8_8x8x1_1x2_intrawave_v3,0.0,204.2,591.77
304,224,1056,1408,76,0,5.474,a8w8_rowwise_128x32x16x128_16x16_1x1_8x16x1_8x16x1_1x16x1x8_2x2x1_1x1_interwave_v2,0.0,121.69,415.66
304,224,1280,4096,30,0,10.6461,a8w8_rowwise_256x32x64x512_16x16_1x2_32x8x1_32x8x1_1x32x1x8_8x8x1_1x2_intrawave_v3,0.0,220.63,632.52
304,224,1408,352,50,0,4.0455,a8w8_rowwise_128x16x32x128_16x16_1x1_8x16x1_8x16x1_1x16x1x8_4x4x1_1x1_intrawave_v1,0.0,54.88,297.92
304,224,1408,1408,76,0,6.0869,a8w8_rowwise_128x32x16x128_16x16_1x1_8x16x1_8x16x1_1x16x1x8_2x2x1_1x1_interwave_v2,0.0,145.91,481.14
304,224,1536,2048,30,0,7.2135,a8w8_rowwise_256x32x64x512_16x16_1x2_32x8x1_32x8x1_1x32x1x8_8x8x1_1x2_intrawave_v3,0.0,195.37,595.08
304,224,1792,6144,30,0,16.8826,a8w8_rowwise_256x32x64x512_16x16_1x2_32x8x1_32x8x1_1x32x1x8_8x8x1_1x2_intrawave_v3,0.0,292.16,781.23
304,224,2048,1536,30,0,7.3249,a8w8_rowwise_256x32x64x512_16x16_1x2_32x8x1_32x8x1_1x32x1x8_8x8x1_1x2_intrawave_v3,0.0,192.4,601.69
304,224,2048,6144,30,0,18.3789,a8w8_rowwise_256x32x64x512_16x16_1x2_32x8x1_32x8x1_1x32x1x8_8x8x1_1x2_intrawave_v3,0.0,306.72,809.44
304,224,3072,4096,29,0,19.3122,a8w8_rowwise_256x32x96x256_16x16_1x3_16x16x1_16x16x1_1x32x1x8_4x4x1_1x1_intrawave_v3,0.0,291.9,770.33
304,224,3584,6144,28,0,28.5241,a8w8_rowwise_256x32x128x256_32x32_1x1_16x16x1_16x16x1_1x32x1x8_8x8x1_1x1_intrawave_v3,0.0,345.85,876.52
304,224,4096,640,62,0,6.5059,a8w8_rowwise_128x32x64x128_32x32_1x1_8x16x1_8x16x1_1x16x1x8_8x8x1_1x1_intrawave_v2,0.0,180.51,707.02
304,224,4096,1024,47,0,9.0861,a8w8_rowwise_256x64x64x128_32x32_1x1_8x32x1_8x32x1_1x32x1x8_8x8x1_1x1_intrawave_v3,0.0,206.8,688.82
304,224,4096,3072,28,0,17.8373,a8w8_rowwise_256x32x128x256_32x32_1x1_16x16x1_16x16x1_1x32x1x8_8x8x1_1x1_intrawave_v3,0.0,316.03,846.88
304,224,5120,640,81,0,7.6249,a8w8_rowwise_128x32x64x128_32x32_1x1_8x16x1_8x16x1_1x16x1x8_8x8x1_1x1_interwave_v2,0.0,192.53,749.38
304,224,5120,2048,28,0,14.5896,a8w8_rowwise_256x32x128x256_32x32_1x1_16x16x1_16x16x1_1x32x1x8_8x8x1_1x1_intrawave_v3,0.0,321.98,907.38
304,224,6144,768,81,0,9.4883,a8w8_rowwise_128x32x64x128_32x32_1x1_8x16x1_8x16x1_1x16x1x8_8x8x1_1x1_interwave_v2,0.0,222.79,805.53
304,224,6144,1024,22,0,11.3367,a8w8_rowwise_256x64x96x256_16x16_2x3_16x16x1_16x16x1_1x64x1x4_8x8x1_2x1_intrawave_v3,0.0,248.62,817.99
304,224,6144,1536,22,0,14.4534,a8w8_rowwise_256x64x96x256_16x16_2x3_16x16x1_16x16x1_1x64x1x4_8x8x1_2x1_intrawave_v3,0.0,292.52,867.18
304,224,6144,2048,22,0,17.8216,a8w8_rowwise_256x64x96x256_16x16_2x3_16x16x1_16x16x1_1x64x1x4_8x8x1_2x1_intrawave_v3,0.0,316.31,886.24
304,224,7168,256,67,0,7.2866,a8w8_rowwise_128x32x16x128_16x16_1x1_8x16x1_8x16x1_1x16x1x8_2x2x1_1x1_interwave_v1,0.0,112.82,700.41
304,224,7168,2304,15,0,19.5644,a8w8_rowwise_256x128x64x256_32x32_2x1_16x16x1_16x16x1_1x32x1x8_8x8x1_1x1_intrawave_v3,0.0,378.17,1034.66
304,232,192,7168,34,0,13.6525,a8w8_rowwise_256x16x64x512_16x16_1x1_32x8x1_32x8x1_1x16x1x16_4x4x1_1x1_intrawave_v3,0.0,46.77,229.14
304,232,512,7168,34,0,14.2686,a8w8_rowwise_256x16x64x512_16x16_1x1_32x8x1_32x8x1_1x16x1x16_4x4x1_1x1_intrawave_v3,0.0,119.35,390.41
304,232,896,5120,34,0,12.5329,a8w8_rowwise_256x16x64x512_16x16_1x1_32x8x1_32x8x1_1x16x1x16_4x4x1_1x1_intrawave_v3,0.0,169.84,493.99
304,232,1024,5632,30,0,14.259,a8w8_rowwise_256x32x64x512_16x16_1x2_32x8x1_32x8x1_1x32x1x8_8x8x1_1x2_intrawave_v3,0.0,187.67,529.41
304,232,1056,1408,34,0,5.7603,a8w8_rowwise_256x16x64x512_16x16_1x1_32x8x1_32x8x1_1x16x1x16_4x4x1_1x1_intrawave_v3,0.0,119.77,399.89
304,232,1280,4096,30,0,11.712,a8w8_rowwise_256x32x64x512_16x16_1x2_32x8x1_32x8x1_1x32x1x8_8x8x1_1x2_intrawave_v3,0.0,207.71,579.5
304,232,1408,352,50,0,4.0463,a8w8_rowwise_128x16x32x128_16x16_1x1_8x16x1_8x16x1_1x16x1x8_4x4x1_1x1_intrawave_v1,0.0,56.83,304.13
304,232,1408,1408,79,0,6.4972,a8w8_rowwise_128x16x32x128_16x16_1x1_8x16x1_8x16x1_1x16x1x8_4x4x1_1x1_interwave_v2,0.0,141.58,455.96
304,232,1536,2048,30,0,7.881,a8w8_rowwise_256x32x64x512_16x16_1x2_32x8x1_32x8x1_1x32x1x8_8x8x1_1x2_intrawave_v3,0.0,185.21,549.88
304,232,1792,6144,30,0,18.814,a8w8_rowwise_256x32x64x512_16x16_1x2_32x8x1_32x8x1_1x32x1x8_8x8x1_1x2_intrawave_v3,0.0,271.54,705.16
304,232,2048,1536,30,0,8.034,a8w8_rowwise_256x32x64x512_16x16_1x2_32x8x1_32x8x1_1x32x1x8_8x8x1_1x2_intrawave_v3,0.0,181.68,554.19
304,232,2048,6144,30,0,19.9356,a8w8_rowwise_256x32x64x512_16x16_1x2_32x8x1_32x8x1_1x32x1x8_8x8x1_1x2_intrawave_v3,0.0,292.87,750.35
304,232,3072,4096,28,0,21.0086,a8w8_rowwise_256x32x128x256_32x32_1x1_16x16x1_16x16x1_1x32x1x8_8x8x1_1x1_intrawave_v3,0.0,277.91,712.02
304,232,3584,6144,28,0,31.1978,a8w8_rowwise_256x32x128x256_32x32_1x1_16x16x1_16x16x1_1x32x1x8_8x8x1_1x1_intrawave_v3,0.0,327.5,804.82
304,232,4096,640,47,0,6.6089,a8w8_rowwise_256x64x64x128_32x32_1x1_8x32x1_8x32x1_1x32x1x8_8x8x1_1x1_intrawave_v3,0.0,184.05,706.69
304,232,4096,1024,47,0,9.272,a8w8_rowwise_256x64x64x128_32x32_1x1_8x32x1_8x32x1_1x32x1x8_8x8x1_1x1_intrawave_v3,0.0,209.9,682.96
304,232,4096,3072,28,0,18.9606,a8w8_rowwise_256x32x128x256_32x32_1x1_16x16x1_16x16x1_1x32x1x8_8x8x1_1x1_intrawave_v3,0.0,307.93,801.46
304,232,5120,640,45,0,8.0818,a8w8_rowwise_256x128x64x128_32x32_2x1_8x32x1_8x32x1_1x32x1x8_8x8x1_1x1_intrawave_v3,0.0,188.13,717.78
304,232,5120,2048,15,0,15.9672,a8w8_rowwise_256x128x64x256_32x32_2x1_16x16x1_16x16x1_1x32x1x8_8x8x1_1x1_intrawave_v3,0.0,304.71,835.25
304,232,6144,768,22,0,9.7586,a8w8_rowwise_256x64x96x256_16x16_2x3_16x16x1_16x16x1_1x64x1x4_8x8x1_2x1_intrawave_v3,0.0,224.36,793.92
304,232,6144,1024,22,0,11.4022,a8w8_rowwise_256x64x96x256_16x16_2x3_16x16x1_16x16x1_1x64x1x4_8x8x1_2x1_intrawave_v3,0.0,256.02,822.63
304,232,6144,1536,22,0,14.5197,a8w8_rowwise_256x64x96x256_16x16_2x3_16x16x1_16x16x1_1x64x1x4_8x8x1_2x1_intrawave_v3,0.0,301.58,870.84
304,232,6144,2048,22,0,18.0457,a8w8_rowwise_256x64x96x256_16x16_2x3_16x16x1_16x16x1_1x64x1x4_8x8x1_2x1_intrawave_v3,0.0,323.54,881.59
304,232,7168,256,67,0,7.6961,a8w8_rowwise_128x32x16x128_16x16_1x1_8x16x1_8x16x1_1x16x1x8_2x2x1_1x1_interwave_v1,0.0,110.63,678.31
304,232,7168,2304,22,0,19.7059,a8w8_rowwise_256x64x96x256_16x16_2x3_16x16x1_16x16x1_1x64x1x4_8x8x1_2x1_intrawave_v3,0.0,388.87,1033.98
304,240,192,7168,34,0,11.9258,a8w8_rowwise_256x16x64x512_16x16_1x1_32x8x1_32x8x1_1x16x1x16_4x4x1_1x1_intrawave_v3,0.0,55.39,267.38
304,240,512,7168,34,0,12.256,a8w8_rowwise_256x16x64x512_16x16_1x1_32x8x1_32x8x1_1x16x1x16_4x4x1_1x1_intrawave_v3,0.0,143.73,459.86
304,240,896,5120,34,0,11.4577,a8w8_rowwise_256x16x64x512_16x16_1x1_32x8x1_32x8x1_1x16x1x16_4x4x1_1x1_intrawave_v3,0.0,192.19,545.17
304,240,1024,5632,34,0,13.5856,a8w8_rowwise_256x16x64x512_16x16_1x1_32x8x1_32x8x1_1x16x1x16_4x4x1_1x1_intrawave_v3,0.0,203.76,560.18
304,240,1056,1408,79,0,6.0981,a8w8_rowwise_128x16x32x128_16x16_1x1_8x16x1_8x16x1_1x16x1x8_4x4x1_1x1_interwave_v2,0.0,117.03,382.36
304,240,1280,4096,30,0,12.2071,a8w8_rowwise_256x32x64x512_16x16_1x2_32x8x1_32x8x1_1x32x1x8_8x8x1_1x2_intrawave_v3,0.0,206.16,560.36
304,240,1408,352,50,0,4.6739,a8w8_rowwise_128x16x32x128_16x16_1x1_8x16x1_8x16x1_1x16x1x8_4x4x1_1x1_intrawave_v1,0.0,50.9,268.71
304,240,1408,1408,79,0,6.6297,a8w8_rowwise_128x16x32x128_16x16_1x1_8x16x1_8x16x1_1x16x1x8_4x4x1_1x1_interwave_v2,0.0,143.53,451.94
304,240,1536,2048,30,0,8.3154,a8w8_rowwise_256x32x64x512_16x16_1x2_32x8x1_32x8x1_1x32x1x8_8x8x1_1x2_intrawave_v3,0.0,181.58,526.08
304,240,1792,6144,30,0,18.618,a8w8_rowwise_256x32x64x512_16x16_1x2_32x8x1_32x8x1_1x32x1x8_8x8x1_1x2_intrawave_v3,0.0,283.86,716.77
304,240,2048,1536,30,0,8.499,a8w8_rowwise_256x32x64x512_16x16_1x2_32x8x1_32x8x1_1x32x1x8_8x8x1_1x2_intrawave_v3,0.0,177.66,529.17
304,240,2048,6144,30,0,19.9509,a8w8_rowwise_256x32x64x512_16x16_1x2_32x8x1_32x8x1_1x32x1x8_8x8x1_1x2_intrawave_v3,0.0,302.73,753.88
304,240,3072,4096,28,0,21.2254,a8w8_rowwise_256x32x128x256_32x32_1x1_16x16x1_16x16x1_1x32x1x8_8x8x1_1x1_intrawave_v3,0.0,284.56,708.61
304,240,3584,6144,28,0,31.3498,a8w8_rowwise_256x32x128x256_32x32_1x1_16x16x1_16x16x1_1x32x1x8_8x8x1_1x1_intrawave_v3,0.0,337.15,804.31
304,240,4096,640,47,0,7.0227,a8w8_rowwise_256x64x64x128_32x32_1x1_8x32x1_8x32x1_1x32x1x8_8x8x1_1x1_intrawave_v3,0.0,179.17,675.11
304,240,4096,1024,47,0,9.6838,a8w8_rowwise_256x64x64x128_32x32_1x1_8x32x1_8x32x1_1x32x1x8_8x8x1_1x1_intrawave_v3,0.0,207.9,661.53
304,240,4096,3072,28,0,19.0907,a8w8_rowwise_256x32x128x256_32x32_1x1_16x16x1_16x16x1_1x32x1x8_8x8x1_1x1_intrawave_v3,0.0,316.37,800.72
304,240,5120,640,45,0,8.4772,a8w8_rowwise_256x128x64x128_32x32_2x1_8x32x1_8x32x1_1x32x1x8_8x8x1_1x1_intrawave_v3,0.0,185.54,694.57
304,240,5120,2048,22,0,17.0721,a8w8_rowwise_256x64x96x256_16x16_2x3_16x16x1_16x16x1_1x64x1x4_8x8x1_2x1_intrawave_v3,0.0,294.82,786.95
304,240,6144,768,22,0,10.1306,a8w8_rowwise_256x64x96x256_16x16_2x3_16x16x1_16x16x1_1x64x1x4_8x8x1_2x1_intrawave_v3,0.0,223.57,775.08
304,240,6144,1024,22,0,11.9429,a8w8_rowwise_256x64x96x256_16x16_2x3_16x16x1_16x16x1_1x64x1x4_8x8x1_2x1_intrawave_v3,0.0,252.86,794.31
304,240,6144,1536,15,0,14.5812,a8w8_rowwise_256x128x64x256_32x32_2x1_16x16x1_16x16x1_1x32x1x8_8x8x1_1x1_intrawave_v3,0.0,310.66,874.75
304,240,6144,2048,22,0,17.6881,a8w8_rowwise_256x64x96x256_16x16_2x3_16x16x1_16x16x1_1x64x1x4_8x8x1_2x1_intrawave_v3,0.0,341.46,905.89
304,240,7168,256,67,0,7.9333,a8w8_rowwise_128x32x16x128_16x16_1x1_8x16x1_8x16x1_1x16x1x8_2x2x1_1x1_interwave_v1,0.0,111.03,672.75
304,240,7168,2304,15,0,19.8908,a8w8_rowwise_256x128x64x256_32x32_2x1_16x16x1_16x16x1_1x32x1x8_8x8x1_1x1_intrawave_v3,0.0,398.54,1031.06
304,248,192,7168,34,0,13.9986,a8w8_rowwise_256x16x64x512_16x16_1x1_32x8x1_32x8x1_1x16x1x16_4x4x1_1x1_intrawave_v3,0.0,48.76,232.11
304,248,512,7168,34,0,14.3101,a8w8_rowwise_256x16x64x512_16x16_1x1_32x8x1_32x8x1_1x16x1x16_4x4x1_1x1_intrawave_v3,0.0,127.21,398.43
304,248,896,5120,34,0,13.0724,a8w8_rowwise_256x16x64x512_16x16_1x1_32x8x1_32x8x1_1x16x1x16_4x4x1_1x1_intrawave_v3,0.0,174.06,482.06
304,248,1024,5632,30,0,14.4673,a8w8_rowwise_256x32x64x512_16x16_1x2_32x8x1_32x8x1_1x32x1x8_8x8x1_1x2_intrawave_v3,0.0,197.72,530.29
304,248,1056,1408,34,0,6.4165,a8w8_rowwise_256x16x64x512_16x16_1x1_32x8x1_32x8x1_1x16x1x16_4x4x1_1x1_intrawave_v3,0.0,114.93,367.77
304,248,1280,4096,30,0,12.2739,a8w8_rowwise_256x32x64x512_16x16_1x2_32x8x1_32x8x1_1x32x1x8_8x8x1_1x2_intrawave_v3,0.0,211.87,561.64
304,248,1408,352,69,0,4.6679,a8w8_rowwise_128x16x32x128_16x16_1x1_8x16x1_8x16x1_1x16x1x8_4x4x1_1x1_interwave_v1,0.0,52.66,274.49
304,248,1408,1408,76,0,7.0763,a8w8_rowwise_128x32x16x128_16x16_1x1_8x16x1_8x16x1_1x16x1x8_2x2x1_1x1_interwave_v2,0.0,138.96,428.19
304,248,1536,2048,30,0,8.3614,a8w8_rowwise_256x32x64x512_16x16_1x2_32x8x1_32x8x1_1x32x1x8_8x8x1_1x2_intrawave_v3,0.0,186.61,528.08
304,248,1792,6144,30,0,19.1354,a8w8_rowwise_256x32x64x512_16x16_1x2_32x8x1_32x8x1_1x32x1x8_8x8x1_1x2_intrawave_v3,0.0,285.39,701.45
304,248,2048,1536,30,0,8.5081,a8w8_rowwise_256x32x64x512_16x16_1x2_32x8x1_32x8x1_1x32x1x8_8x8x1_1x2_intrawave_v3,0.0,183.39,533.9
304,248,2048,6144,30,0,20.1296,a8w8_rowwise_256x32x64x512_16x16_1x2_32x8x1_32x8x1_1x32x1x8_8x8x1_1x2_intrawave_v3,0.0,310.05,751.25
304,248,3072,4096,28,0,21.2966,a8w8_rowwise_256x32x128x256_32x32_1x1_16x16x1_16x16x1_1x32x1x8_8x8x1_1x1_intrawave_v3,0.0,293.06,710.09
304,248,3584,6144,28,0,31.5288,a8w8_rowwise_256x32x128x256_32x32_1x1_16x16x1_16x16x1_1x32x1x8_8x8x1_1x1_intrawave_v3,0.0,346.41,803.12
304,248,4096,640,47,0,7.0099,a8w8_rowwise_256x64x64x128_32x32_1x1_8x32x1_8x32x1_1x32x1x8_8x8x1_1x1_intrawave_v3,0.0,185.49,686.43
304,248,4096,1024,47,0,9.8247,a8w8_rowwise_256x64x64x128_32x32_1x1_8x32x1_8x32x1_1x32x1x8_8x8x1_1x1_intrawave_v3,0.0,211.75,659.55
304,248,4096,3072,23,0,19.3073,a8w8_rowwise_256x64x64x512_32x32_1x1_32x8x1_32x8x1_1x32x1x8_8x8x1_1x1_intrawave_v3,0.0,323.25,796.4
304,248,5120,640,45,0,8.484,a8w8_rowwise_256x128x64x128_32x32_2x1_8x32x1_8x32x1_1x32x1x8_8x8x1_1x1_intrawave_v3,0.0,191.57,704.27
304,248,5120,2048,15,0,17.293,a8w8_rowwise_256x128x64x256_32x32_2x1_16x16x1_16x16x1_1x32x1x8_8x8x1_1x1_intrawave_v3,0.0,300.75,782.58
304,248,6144,768,15,0,10.1501,a8w8_rowwise_256x128x64x256_32x32_2x1_16x16x1_16x16x1_1x32x1x8_8x8x1_1x1_intrawave_v3,0.0,230.58,783.88
304,248,6144,1024,22,0,12.0493,a8w8_rowwise_256x64x96x256_16x16_2x3_16x16x1_16x16x1_1x64x1x4_8x8x1_2x1_intrawave_v3,0.0,258.98,796.13
304,248,6144,1536,22,0,14.8502,a8w8_rowwise_256x64x96x256_16x16_2x3_16x16x1_16x16x1_1x64x1x4_8x8x1_2x1_intrawave_v3,0.0,315.2,866.35
304,248,6144,2048,22,0,17.8289,a8w8_rowwise_256x64x96x256_16x16_2x3_16x16x1_16x16x1_1x64x1x4_8x8x1_2x1_intrawave_v3,0.0,350.06,905.17
304,248,7168,256,67,0,7.9949,a8w8_rowwise_128x32x16x128_16x16_1x1_8x16x1_8x16x1_1x16x1x8_2x2x1_1x1_interwave_v1,0.0,113.84,682.16
304,248,7168,2304,15,0,19.9306,a8w8_rowwise_256x128x64x256_32x32_2x1_16x16x1_16x16x1_1x32x1x8_8x8x1_1x1_intrawave_v3,0.0,411.0,1035.68
304,256,192,7168,34,0,11.5009,a8w8_rowwise_256x16x64x512_16x16_1x1_32x8x1_32x8x1_1x16x1x16_4x4x1_1x1_intrawave_v3,0.0,61.27,287.77
304,256,512,7168,34,0,11.8903,a8w8_rowwise_256x16x64x512_16x16_1x1_32x8x1_32x8x1_1x16x1x16_4x4x1_1x1_intrawave_v3,0.0,158.03,485.03
304,256,896,5120,34,0,11.535,a8w8_rowwise_256x16x64x512_16x16_1x1_32x8x1_32x8x1_1x16x1x16_4x4x1_1x1_intrawave_v3,0.0,203.62,551.1
304,256,1024,5632,30,0,12.6318,a8w8_rowwise_256x32x64x512_16x16_1x2_32x8x1_32x8x1_1x32x1x8_8x8x1_1x2_intrawave_v3,0.0,233.76,612.2
304,256,1056,1408,79,0,6.1361,a8w8_rowwise_128x16x32x128_16x16_1x1_8x16x1_8x16x1_1x16x1x8_4x4x1_1x1_interwave_v2,0.0,124.06,389.17
304,256,1280,4096,30,0,11.3788,a8w8_rowwise_256x32x64x512_16x16_1x2_32x8x1_32x8x1_1x32x1x8_8x8x1_1x2_intrawave_v3,0.0,235.91,610.51
304,256,1408,352,48,0,4.7432,a8w8_rowwise_128x32x16x128_16x16_1x1_8x16x1_8x16x1_1x16x1x8_2x2x1_1x1_intrawave_v1,0.0,53.5,275.47
304,256,1408,1408,79,0,6.7404,a8w8_rowwise_128x16x32x128_16x16_1x1_8x16x1_8x16x1_1x16x1x8_4x4x1_1x1_interwave_v2,0.0,150.59,454.54
304,256,1536,2048,30,0,7.5703,a8w8_rowwise_256x32x64x512_16x16_1x2_32x8x1_32x8x1_1x32x1x8_8x8x1_1x2_intrawave_v3,0.0,212.75,588.68
304,256,1792,6144,30,0,17.848,a8w8_rowwise_256x32x64x512_16x16_1x2_32x8x1_32x8x1_1x32x1x8_8x8x1_1x2_intrawave_v3,0.0,315.84,756.41
304,256,2048,1536,30,0,7.7366,a8w8_rowwise_256x32x64x512_16x16_1x2_32x8x1_32x8x1_1x32x1x8_8x8x1_1x2_intrawave_v3,0.0,208.18,592.96
304,256,2048,6144,30,0,18.6965,a8w8_rowwise_256x32x64x512_16x16_1x2_32x8x1_32x8x1_1x32x1x8_8x8x1_1x2_intrawave_v3,0.0,344.58,813.22
304,256,3072,4096,23,0,18.2039,a8w8_rowwise_256x64x64x512_32x32_1x1_32x8x1_32x8x1_1x32x1x8_8x8x1_1x1_intrawave_v3,0.0,353.9,835.22
304,256,3584,6144,23,0,25.02,a8w8_rowwise_256x64x64x512_32x32_1x1_32x8x1_32x8x1_1x32x1x8_8x8x1_1x1_intrawave_v3,0.0,450.61,1016.31
304,256,4096,640,47,0,6.5455,a8w8_rowwise_256x64x64x128_32x32_1x1_8x32x1_8x32x1_1x32x1x8_8x8x1_1x1_intrawave_v3,0.0,205.05,745.92
304,256,4096,1024,47,0,9.8032,a8w8_rowwise_256x64x64x128_32x32_1x1_8x32x1_8x32x1_1x32x1x8_8x8x1_1x1_intrawave_v3,0.0,219.06,668.52
304,256,4096,3072,23,0,16.5741,a8w8_rowwise_256x64x64x512_32x32_1x1_32x8x1_32x8x1_1x32x1x8_8x8x1_1x1_intrawave_v3,0.0,388.71,933.17
304,256,5120,640,46,0,8.0113,a8w8_rowwise_256x64x128x128_32x32_1x2_8x32x1_8x32x1_1x32x1x8_8x8x1_1x1_intrawave_v3,0.0,209.42,756.69
304,256,5120,2048,21,0,16.4409,a8w8_rowwise_256x64x128x256_32x32_1x2_16x16x1_16x16x1_1x32x1x8_8x8x1_1x1_intrawave_v3,0.0,326.55,829.12
304,256,6144,768,22,0,9.5613,a8w8_rowwise_256x64x96x256_16x16_2x3_16x16x1_16x16x1_1x64x1x4_8x8x1_2x1_intrawave_v3,0.0,252.68,843.08
304,256,6144,1024,22,0,11.2865,a8w8_rowwise_256x64x96x256_16x16_2x3_16x16x1_16x16x1_1x64x1x4_8x8x1_2x1_intrawave_v3,0.0,285.41,859.37
304,256,6144,1536,22,0,14.0924,a8w8_rowwise_256x64x96x256_16x16_2x3_16x16x1_16x16x1_1x64x1x4_8x8x1_2x1_intrawave_v3,0.0,342.87,920.79
304,256,6144,2048,22,0,17.3432,a8w8_rowwise_256x64x96x256_16x16_2x3_16x16x1_16x16x1_1x64x1x4_8x8x1_2x1_intrawave_v3,0.0,371.47,937.14
304,256,7168,256,67,0,7.5327,a8w8_rowwise_128x32x16x128_16x16_1x1_8x16x1_8x16x1_1x16x1x8_2x2x1_1x1_interwave_v1,0.0,124.73,739.52
304,256,7168,2304,15,0,19.2069,a8w8_rowwise_256x128x64x256_32x32_2x1_16x16x1_16x16x1_1x32x1x8_8x8x1_1x1_intrawave_v3,0.0,440.24,1081.64
304,264,192,7168,34,0,13.8654,a8w8_rowwise_256x16x64x512_16x16_1x1_32x8x1_32x8x1_1x16x1x16_4x4x1_1x1_intrawave_v3,0.0,52.41,243.05
304,264,512,7168,34,0,14.2833,a8w8_rowwise_256x16x64x512_16x16_1x1_32x8x1_32x8x1_1x16x1x16_4x4x1_1x1_intrawave_v3,0.0,135.67,408.36
304,264,896,5120,34,0,13.24,a8w8_rowwise_256x16x64x512_16x16_1x1_32x8x1_32x8x1_1x16x1x16_4x4x1_1x1_intrawave_v3,0.0,182.95,484.31
304,264,1024,5632,30,0,14.3068,a8w8_rowwise_256x32x64x512_16x16_1x2_32x8x1_32x8x1_1x32x1x8_8x8x1_1x2_intrawave_v3,0.0,212.84,544.82
304,264,1056,1408,79,0,5.9605,a8w8_rowwise_128x16x32x128_16x16_1x1_8x16x1_8x16x1_1x16x1x8_4x4x1_1x1_interwave_v2,0.0,131.71,405.36
304,264,1280,4096,30,0,12.778,a8w8_rowwise_256x32x64x512_16x16_1x2_32x8x1_32x8x1_1x32x1x8_8x8x1_1x2_intrawave_v3,0.0,216.64,547.82
304,264,1408,352,50,0,4.1432,a8w8_rowwise_128x16x32x128_16x16_1x1_8x16x1_8x16x1_1x16x1x8_4x4x1_1x1_intrawave_v1,0.0,63.16,321.48
304,264,1408,1408,30,0,6.8368,a8w8_rowwise_256x32x64x512_16x16_1x2_32x8x1_32x8x1_1x32x1x8_8x8x1_1x2_intrawave_v3,0.0,153.1,453.08
304,264,1536,2048,30,0,9.083,a8w8_rowwise_256x32x64x512_16x16_1x2_32x8x1_32x8x1_1x32x1x8_8x8x1_1x2_intrawave_v3,0.0,182.86,495.15
304,264,1792,6144,30,0,20.314,a8w8_rowwise_256x32x64x512_16x16_1x2_32x8x1_32x8x1_1x32x1x8_8x8x1_1x2_intrawave_v3,0.0,286.17,668.42
304,264,2048,1536,30,0,8.8349,a8w8_rowwise_256x32x64x512_16x16_1x2_32x8x1_32x8x1_1x32x1x8_8x8x1_1x2_intrawave_v3,0.0,188.0,524.35
304,264,2048,6144,30,0,22.1488,a8w8_rowwise_256x32x64x512_16x16_1x2_32x8x1_32x8x1_1x32x1x8_8x8x1_1x2_intrawave_v3,0.0,299.96,690.16
304,264,3072,4096,28,0,22.3806,a8w8_rowwise_256x32x128x256_32x32_1x1_16x16x1_16x16x1_1x32x1x8_8x8x1_1x1_intrawave_v3,0.0,296.85,683.01
304,264,3584,6144,28,0,33.8118,a8w8_rowwise_256x32x128x256_32x32_1x1_16x16x1_16x16x1_1x32x1x8_8x8x1_1x1_intrawave_v3,0.0,343.86,755.19
304,264,4096,640,62,0,7.7455,a8w8_rowwise_128x32x64x128_32x32_1x1_8x16x1_8x16x1_1x16x1x8_8x8x1_1x1_intrawave_v2,0.0,178.7,639.48
304,264,4096,1024,22,0,10.3215,a8w8_rowwise_256x64x96x256_16x16_2x3_16x16x1_16x16x1_1x64x1x4_8x8x1_2x1_intrawave_v3,0.0,214.56,642.09
304,264,4096,3072,28,0,20.8965,a8w8_rowwise_256x32x128x256_32x32_1x1_16x16x1_16x16x1_1x32x1x8_8x8x1_1x1_intrawave_v3,0.0,317.94,744.46
304,264,5120,640,45,0,8.9571,a8w8_rowwise_256x128x64x128_32x32_2x1_8x32x1_8x32x1_1x32x1x8_8x8x1_1x1_intrawave_v3,0.0,193.16,686.51
304,264,5120,2048,22,0,18.2407,a8w8_rowwise_256x64x96x256_16x16_2x3_16x16x1_16x16x1_1x64x1x4_8x8x1_2x1_intrawave_v3,0.0,303.52,752.7
304,264,6144,768,47,0,10.4874,a8w8_rowwise_256x64x64x128_32x32_1x1_8x32x1_8x32x1_1x32x1x8_8x8x1_1x1_intrawave_v3,0.0,237.56,778.59
304,264,6144,1024,21,0,12.9269,a8w8_rowwise_256x64x128x256_32x32_1x2_16x16x1_16x16x1_1x32x1x8_8x8x1_1x1_intrawave_v3,0.0,256.97,758.56
304,264,6144,1536,47,0,16.2684,a8w8_rowwise_256x64x64x128_32x32_1x1_8x32x1_8x32x1_1x32x1x8_8x8x1_1x1_intrawave_v3,0.0,306.29,804.43
304,264,6144,2048,21,0,19.6657,a8w8_rowwise_256x64x128x256_32x32_1x2_16x16x1_16x16x1_1x32x1x8_8x8x1_1x1_intrawave_v3,0.0,337.84,832.29
304,264,7168,256,69,0,8.4961,a8w8_rowwise_128x16x32x128_16x16_1x1_8x16x1_8x16x1_1x16x1x8_4x4x1_1x1_interwave_v1,0.0,114.04,669.4
304,264,7168,2304,46,0,22.9104,a8w8_rowwise_256x64x128x128_32x32_1x2_8x32x1_8x32x1_1x32x1x8_8x8x1_1x1_intrawave_v3,0.0,380.61,912.6
304,272,192,7168,34,0,11.494,a8w8_rowwise_256x16x64x512_16x16_1x1_32x8x1_32x8x1_1x16x1x16_4x4x1_1x1_intrawave_v3,0.0,65.14,298.45
304,272,512,7168,34,0,11.9564,a8w8_rowwise_256x16x64x512_16x16_1x1_32x8x1_32x8x1_1x16x1x16_4x4x1_1x1_intrawave_v3,0.0,166.98,493.31
304,272,896,5120,34,0,11.9304,a8w8_rowwise_256x16x64x512_16x16_1x1_32x8x1_32x8x1_1x16x1x16_4x4x1_1x1_intrawave_v3,0.0,209.18,542.11
304,272,1024,5632,34,0,13.7255,a8w8_rowwise_256x16x64x512_16x16_1x1_32x8x1_32x8x1_1x16x1x16_4x4x1_1x1_intrawave_v3,0.0,228.58,572.37
304,272,1056,1408,79,0,5.6615,a8w8_rowwise_128x16x32x128_16x16_1x1_8x16x1_8x16x1_1x16x1x8_4x4x1_1x1_interwave_v2,0.0,142.87,431.74
304,272,1280,4096,30,0,13.0322,a8w8_rowwise_256x32x64x512_16x16_1x2_32x8x1_32x8x1_1x32x1x8_8x8x1_1x2_intrawave_v3,0.0,218.85,541.22
304,272,1408,352,50,0,4.1317,a8w8_rowwise_128x16x32x128_16x16_1x1_8x16x1_8x16x1_1x16x1x8_4x4x1_1x1_intrawave_v1,0.0,65.26,328.51
304,272,1408,1408,60,0,6.7174,a8w8_rowwise_128x16x32x128_16x16_1x1_8x16x1_8x16x1_1x16x1x8_4x4x1_1x1_intrawave_v2,0.0,160.55,466.16
304,272,1536,2048,30,0,9.1318,a8w8_rowwise_256x32x64x512_16x16_1x2_32x8x1_32x8x1_1x32x1x8_8x8x1_1x2_intrawave_v3,0.0,187.4,496.99
304,272,1792,6144,30,0,20.7429,a8w8_rowwise_256x32x64x512_16x16_1x2_32x8x1_32x8x1_1x32x1x8_8x8x1_1x2_intrawave_v3,0.0,288.75,658.35
304,272,2048,1536,30,0,8.8221,a8w8_rowwise_256x32x64x512_16x16_1x2_32x8x1_32x8x1_1x32x1x8_8x8x1_1x2_intrawave_v3,0.0,193.98,530.22
304,272,2048,6144,30,0,22.0476,a8w8_rowwise_256x32x64x512_16x16_1x2_32x8x1_32x8x1_1x32x1x8_8x8x1_1x2_intrawave_v3,0.0,310.47,697.05
304,272,3072,4096,28,0,22.8998,a8w8_rowwise_256x32x128x256_32x32_1x1_16x16x1_16x16x1_1x32x1x8_8x8x1_1x1_intrawave_v3,0.0,298.92,671.11
304,272,3584,6144,28,0,33.6753,a8w8_rowwise_256x32x128x256_32x32_1x1_16x16x1_16x16x1_1x32x1x8_8x8x1_1x1_intrawave_v3,0.0,355.72,761.42
304,272,4096,640,62,0,7.742,a8w8_rowwise_128x32x64x128_32x32_1x1_8x16x1_8x16x1_1x16x1x8_8x8x1_1x1_intrawave_v2,0.0,184.2,648.89
304,272,4096,1024,22,0,10.366,a8w8_rowwise_256x64x96x256_16x16_2x3_16x16x1_16x16x1_1x64x1x4_8x8x1_2x1_intrawave_v3,0.0,220.11,646.45
304,272,4096,3072,28,0,20.9836,a8w8_rowwise_256x32x128x256_32x32_1x1_16x16x1_16x16x1_1x32x1x8_8x8x1_1x1_intrawave_v3,0.0,326.21,745.66
304,272,5120,640,81,0,9.0393,a8w8_rowwise_128x32x64x128_32x32_1x1_8x16x1_8x16x1_1x16x1x8_8x8x1_1x1_interwave_v2,0.0,197.2,689.89
304,272,5120,2048,22,0,17.9146,a8w8_rowwise_256x64x96x256_16x16_2x3_16x16x1_16x16x1_1x64x1x4_8x8x1_2x1_intrawave_v3,0.0,318.41,771.89
304,272,6144,768,81,0,10.5599,a8w8_rowwise_128x32x64x128_32x32_1x1_8x16x1_8x16x1_1x16x1x8_8x8x1_1x1_interwave_v2,0.0,243.08,783.13
304,272,6144,1024,21,0,12.9442,a8w8_rowwise_256x64x128x256_32x32_1x2_16x16x1_16x16x1_1x32x1x8_8x8x1_1x1_intrawave_v3,0.0,264.41,765.77
304,272,6144,1536,47,0,16.7877,a8w8_rowwise_256x64x64x128_32x32_1x1_8x32x1_8x32x1_1x32x1x8_8x8x1_1x1_intrawave_v3,0.0,305.81,786.13
304,272,6144,2048,21,0,19.7558,a8w8_rowwise_256x64x128x256_32x32_1x2_16x16x1_16x16x1_1x32x1x8_8x8x1_1x1_intrawave_v3,0.0,346.49,834.3
304,272,7168,256,69,0,8.2617,a8w8_rowwise_128x16x32x128_16x16_1x1_8x16x1_8x16x1_1x16x1x8_4x4x1_1x1_interwave_v1,0.0,120.83,702.52
304,272,7168,2304,46,0,22.8109,a8w8_rowwise_256x64x128x128_32x32_1x2_8x32x1_8x32x1_1x32x1x8_8x8x1_1x1_intrawave_v3,0.0,393.86,922.42
304,280,192,7168,34,0,13.9536,a8w8_rowwise_256x16x64x512_16x16_1x1_32x8x1_32x8x1_1x16x1x16_4x4x1_1x1_intrawave_v3,0.0,55.23,250.17
304,280,512,7168,34,0,14.263,a8w8_rowwise_256x16x64x512_16x16_1x1_32x8x1_32x8x1_1x16x1x16_4x4x1_1x1_intrawave_v3,0.0,144.09,418.13
304,280,896,5120,30,0,13.2769,a8w8_rowwise_256x32x64x512_16x16_1x2_32x8x1_32x8x1_1x32x1x8_8x8x1_1x2_intrawave_v3,0.0,193.49,491.3
304,280,1024,5632,30,0,14.4065,a8w8_rowwise_256x32x64x512_16x16_1x2_32x8x1_32x8x1_1x32x1x8_8x8x1_1x2_intrawave_v3,0.0,224.18,549.58
304,280,1056,1408,79,0,5.9789,a8w8_rowwise_128x16x32x128_16x16_1x1_8x16x1_8x16x1_1x16x1x8_4x4x1_1x1_interwave_v2,0.0,139.26,413.53
304,280,1280,4096,30,0,13.0626,a8w8_rowwise_256x32x64x512_16x16_1x2_32x8x1_32x8x1_1x32x1x8_8x8x1_1x2_intrawave_v3,0.0,224.76,544.04
304,280,1408,352,50,0,4.1605,a8w8_rowwise_128x16x32x128_16x16_1x1_8x16x1_8x16x1_1x16x1x8_4x4x1_1x1_intrawave_v1,0.0,66.71,332.33
304,280,1408,1408,30,0,6.8872,a8w8_rowwise_256x32x64x512_16x16_1x2_32x8x1_32x8x1_1x32x1x8_8x8x1_1x2_intrawave_v3,0.0,161.19,459.57
304,280,1536,2048,30,0,9.275,a8w8_rowwise_256x32x64x512_16x16_1x2_32x8x1_32x8x1_1x32x1x8_8x8x1_1x2_intrawave_v3,0.0,189.93,493.73
304,280,1792,6144,30,0,20.6285,a8w8_rowwise_256x32x64x512_16x16_1x2_32x8x1_32x8x1_1x32x1x8_8x8x1_1x2_intrawave_v3,0.0,298.89,665.77
304,280,2048,1536,30,0,8.8826,a8w8_rowwise_256x32x64x512_16x16_1x2_32x8x1_32x8x1_1x32x1x8_8x8x1_1x2_intrawave_v3,0.0,198.32,531.68
304,280,2048,6144,30,0,22.1236,a8w8_rowwise_256x32x64x512_16x16_1x2_32x8x1_32x8x1_1x32x1x8_8x8x1_1x2_intrawave_v3,0.0,318.5,698.35
304,280,3072,4096,47,0,23.456,a8w8_rowwise_256x64x64x128_32x32_1x1_8x32x1_8x32x1_1x32x1x8_8x8x1_1x1_intrawave_v3,0.0,300.41,658.68
304,280,3584,6144,28,0,33.9687,a8w8_rowwise_256x32x128x256_32x32_1x1_16x16x1_16x16x1_1x32x1x8_8x8x1_1x1_intrawave_v3,0.0,363.02,757.98
304,280,4096,640,62,0,7.8912,a8w8_rowwise_128x32x64x128_32x32_1x1_8x16x1_8x16x1_1x16x1x8_8x8x1_1x1_intrawave_v2,0.0,186.03,645.58
304,280,4096,1024,22,0,10.4625,a8w8_rowwise_256x64x96x256_16x16_2x3_16x16x1_16x16x1_1x64x1x4_8x8x1_2x1_intrawave_v3,0.0,224.5,647.53
304,280,4096,3072,28,0,21.0646,a8w8_rowwise_256x32x128x256_32x32_1x1_16x16x1_16x16x1_1x32x1x8_8x8x1_1x1_intrawave_v3,0.0,334.52,747.07
304,280,5120,640,81,0,9.0797,a8w8_rowwise_128x32x64x128_32x32_1x1_8x16x1_8x16x1_1x16x1x8_8x8x1_1x1_interwave_v2,0.0,202.1,696.41
304,280,5120,2048,22,0,18.2619,a8w8_rowwise_256x64x96x256_16x16_2x3_16x16x1_16x16x1_1x64x1x4_8x8x1_2x1_intrawave_v3,0.0,321.55,762.59
304,280,6144,768,47,0,10.5399,a8w8_rowwise_256x64x64x128_32x32_1x1_8x32x1_8x32x1_1x32x1x8_8x8x1_1x1_intrawave_v3,0.0,250.71,794.53
304,280,6144,1024,21,0,13.0357,a8w8_rowwise_256x64x128x256_32x32_1x2_16x16x1_16x16x1_1x32x1x8_8x8x1_1x1_intrawave_v3,0.0,270.27,768.57
304,280,6144,1536,21,0,16.5765,a8w8_rowwise_256x64x128x256_32x32_1x2_16x16x1_16x16x1_1x32x1x8_8x8x1_1x1_intrawave_v3,0.0,318.81,802.82
304,280,6144,2048,21,0,19.8469,a8w8_rowwise_256x64x128x256_32x32_1x2_16x16x1_16x16x1_1x32x1x8_8x8x1_1x1_intrawave_v3,0.0,355.04,836.25
304,280,7168,256,67,0,8.7208,a8w8_rowwise_128x32x16x128_16x16_1x1_8x16x1_8x16x1_1x16x1x8_2x2x1_1x1_interwave_v1,0.0,117.83,678.92
304,280,7168,2304,46,0,22.9629,a8w8_rowwise_256x64x128x128_32x32_1x2_8x32x1_8x32x1_1x32x1x8_8x8x1_1x1_intrawave_v3,0.0,402.76,922.11
304,288,192,7168,34,0,11.434,a8w8_rowwise_256x16x64x512_16x16_1x1_32x8x1_32x8x1_1x16x1x16_4x4x1_1x1_intrawave_v3,0.0,69.33,310.59
304,288,512,7168,34,0,12.5189,a8w8_rowwise_256x16x64x512_16x16_1x1_32x8x1_32x8x1_1x16x1x16_4x4x1_1x1_intrawave_v3,0.0,168.86,481.62
304,288,896,5120,30,0,11.7757,a8w8_rowwise_256x32x64x512_16x16_1x2_32x8x1_32x8x1_1x32x1x8_8x8x1_1x2_intrawave_v3,0.0,224.4,558.62
304,288,1024,5632,30,0,13.4323,a8w8_rowwise_256x32x64x512_16x16_1x2_32x8x1_32x8x1_1x32x1x8_8x8x1_1x2_intrawave_v3,0.0,247.31,594.02
304,288,1056,1408,79,0,5.614,a8w8_rowwise_128x16x32x128_16x16_1x1_8x16x1_8x16x1_1x16x1x8_4x4x1_1x1_interwave_v2,0.0,152.55,445.42
304,288,1280,4096,30,0,12.0803,a8w8_rowwise_256x32x64x512_16x16_1x2_32x8x1_32x8x1_1x32x1x8_8x8x1_1x2_intrawave_v3,0.0,249.99,592.68
304,288,1408,352,69,0,4.1896,a8w8_rowwise_128x16x32x128_16x16_1x1_8x16x1_8x16x1_1x16x1x8_4x4x1_1x1_interwave_v1,0.0,68.14,336.07
304,288,1408,1408,76,0,6.5792,a8w8_rowwise_128x32x16x128_16x16_1x1_8x16x1_8x16x1_1x16x1x8_2x2x1_1x1_interwave_v2,0.0,173.56,486.23
304,288,1536,2048,30,0,8.8794,a8w8_rowwise_256x32x64x512_16x16_1x2_32x8x1_32x8x1_1x32x1x8_8x8x1_1x2_intrawave_v3,0.0,204.06,520.34
304,288,1792,6144,30,0,20.084,a8w8_rowwise_256x32x64x512_16x16_1x2_32x8x1_32x8x1_1x32x1x8_8x8x1_1x2_intrawave_v3,0.0,315.76,687.7
304,288,2048,1536,30,0,8.6835,a8w8_rowwise_256x32x64x512_16x16_1x2_32x8x1_32x8x1_1x32x1x8_8x8x1_1x2_intrawave_v3,0.0,208.66,549.06
304,288,2048,6144,30,0,20.9296,a8w8_rowwise_256x32x64x512_16x16_1x2_32x8x1_32x8x1_1x32x1x8_8x8x1_1x2_intrawave_v3,0.0,346.29,742.11
304,288,3072,4096,29,0,22.389,a8w8_rowwise_256x32x96x256_16x16_1x3_16x16x1_16x16x1_1x32x1x8_4x4x1_1x1_intrawave_v3,0.0,323.72,693.73
304,288,3584,6144,28,0,33.2061,a8w8_rowwise_256x32x128x256_32x32_1x1_16x16x1_16x16x1_1x32x1x8_8x8x1_1x1_intrawave_v3,0.0,381.97,778.59
304,288,4096,640,62,0,7.7421,a8w8_rowwise_128x32x64x128_32x32_1x1_8x16x1_8x16x1_1x16x1x8_8x8x1_1x1_intrawave_v2,0.0,195.03,667.14
304,288,4096,1024,28,0,10.6201,a8w8_rowwise_256x32x128x256_32x32_1x1_16x16x1_16x16x1_1x32x1x8_8x8x1_1x1_intrawave_v3,0.0,227.49,644.86
304,288,4096,3072,28,0,20.4497,a8w8_rowwise_256x32x128x256_32x32_1x1_16x16x1_16x16x1_1x32x1x8_8x8x1_1x1_intrawave_v3,0.0,354.42,773.95
304,288,5120,640,81,0,8.8558,a8w8_rowwise_128x32x64x128_32x32_1x1_8x16x1_8x16x1_1x16x1x8_8x8x1_1x1_interwave_v2,0.0,213.13,723.85
304,288,5120,2048,21,0,18.3331,a8w8_rowwise_256x64x128x256_32x32_1x2_16x16x1_16x16x1_1x32x1x8_8x8x1_1x1_intrawave_v3,0.0,329.45,764.99
304,288,6144,768,81,0,10.4153,a8w8_rowwise_128x32x64x128_32x32_1x1_8x16x1_8x16x1_1x16x1x8_8x8x1_1x1_interwave_v2,0.0,260.95,814.06
304,288,6144,1024,21,0,13.278,a8w8_rowwise_256x64x128x256_32x32_1x2_16x16x1_16x16x1_1x32x1x8_8x8x1_1x1_intrawave_v3,0.0,272.92,762.56
304,288,6144,1536,21,0,16.3322,a8w8_rowwise_256x64x128x256_32x32_1x2_16x16x1_16x16x1_1x32x1x8_8x8x1_1x1_intrawave_v3,0.0,332.83,821.6
304,288,6144,2048,21,0,20.0155,a8w8_rowwise_256x64x128x256_32x32_1x2_16x16x1_16x16x1_1x32x1x8_8x8x1_1x1_intrawave_v3,0.0,362.11,834.94
304,288,7168,256,67,0,8.7265,a8w8_rowwise_128x32x16x128_16x16_1x1_8x16x1_8x16x1_1x16x1x8_2x2x1_1x1_interwave_v1,0.0,121.12,691.86
304,288,7168,2304,46,0,23.0306,a8w8_rowwise_256x64x128x128_32x32_1x2_8x32x1_8x32x1_1x32x1x8_8x8x1_1x1_intrawave_v3,0.0,413.05,925.18
304,296,192,7168,34,0,13.8027,a8w8_rowwise_256x16x64x512_16x16_1x1_32x8x1_32x8x1_1x16x1x16_4x4x1_1x1_intrawave_v3,0.0,59.03,261.66
304,296,512,7168,34,0,14.2494,a8w8_rowwise_256x16x64x512_16x16_1x1_32x8x1_32x8x1_1x16x1x16_4x4x1_1x1_intrawave_v3,0.0,152.47,427.73
304,296,896,5120,30,0,13.2212,a8w8_rowwise_256x32x64x512_16x16_1x2_32x8x1_32x8x1_1x32x1x8_8x8x1_1x2_intrawave_v3,0.0,205.41,501.73
304,296,1024,5632,30,0,14.2687,a8w8_rowwise_256x32x64x512_16x16_1x2_32x8x1_32x8x1_1x32x1x8_8x8x1_1x2_intrawave_v3,0.0,239.28,563.5
304,296,1056,1408,79,0,6.3308,a8w8_rowwise_128x16x32x128_16x16_1x1_8x16x1_8x16x1_1x16x1x8_4x4x1_1x1_interwave_v2,0.0,139.04,399.44
304,296,1280,4096,30,0,13.0803,a8w8_rowwise_256x32x64x512_16x16_1x2_32x8x1_32x8x1_1x32x1x8_8x8x1_1x2_intrawave_v3,0.0,237.29,551.44
304,296,1408,352,50,0,4.1227,a8w8_rowwise_128x16x32x128_16x16_1x1_8x16x1_8x16x1_1x16x1x8_4x4x1_1x1_intrawave_v1,0.0,71.17,347.67
304,296,1408,1408,30,0,7.0148,a8w8_rowwise_256x32x64x512_16x16_1x2_32x8x1_32x8x1_1x32x1x8_8x8x1_1x2_intrawave_v3,0.0,167.31,460.85
304,296,1536,2048,30,0,9.2913,a8w8_rowwise_256x32x64x512_16x16_1x2_32x8x1_32x8x1_1x32x1x8_8x8x1_1x2_intrawave_v3,0.0,200.43,501.68
304,296,1792,6144,30,0,21.2712,a8w8_rowwise_256x32x64x512_16x16_1x2_32x8x1_32x8x1_1x32x1x8_8x8x1_1x2_intrawave_v3,0.0,306.42,652.97
304,296,2048,1536,28,0,9.8845,a8w8_rowwise_256x32x128x256_32x32_1x1_16x16x1_16x16x1_1x32x1x8_8x8x1_1x1_intrawave_v3,0.0,188.4,486.9
304,296,2048,6144,28,0,27.9026,a8w8_rowwise_256x32x128x256_32x32_1x1_16x16x1_16x16x1_1x32x1x8_8x8x1_1x1_intrawave_v3,0.0,266.97,559.59
304,296,3072,4096,28,0,23.3563,a8w8_rowwise_256x32x128x256_32x32_1x1_16x16x1_16x16x1_1x32x1x8_8x8x1_1x1_intrawave_v3,0.0,318.93,668.51
304,296,3584,6144,28,0,35.0901,a8w8_rowwise_256x32x128x256_32x32_1x1_16x16x1_16x16x1_1x32x1x8_8x8x1_1x1_intrawave_v3,0.0,371.5,739.82
304,296,4096,640,45,0,8.0449,a8w8_rowwise_256x128x64x128_32x32_2x1_8x32x1_8x32x1_1x32x1x8_8x8x1_1x1_intrawave_v3,0.0,192.9,650.81
304,296,4096,1024,22,0,10.6099,a8w8_rowwise_256x64x96x256_16x16_2x3_16x16x1_16x16x1_1x64x1x4_8x8x1_2x1_intrawave_v3,0.0,234.03,652.43
304,296,4096,3072,22,0,22.06,a8w8_rowwise_256x64x96x256_16x16_2x3_16x16x1_16x16x1_1x64x1x4_8x8x1_2x1_intrawave_v3,0.0,337.67,721.53
304,296,5120,640,46,0,9.1173,a8w8_rowwise_256x64x128x128_32x32_1x2_8x32x1_8x32x1_1x32x1x8_8x8x1_1x1_intrawave_v3,0.0,212.77,712.63
304,296,5120,2048,22,0,18.3521,a8w8_rowwise_256x64x96x256_16x16_2x3_16x16x1_16x16x1_1x64x1x4_8x8x1_2x1_intrawave_v3,0.0,338.25,769.56
304,296,6144,768,47,0,10.5971,a8w8_rowwise_256x64x64x128_32x32_1x1_8x32x1_8x32x1_1x32x1x8_8x8x1_1x1_intrawave_v3,0.0,263.6,809.95
304,296,6144,1024,21,0,13.2379,a8w8_rowwise_256x64x128x256_32x32_1x2_16x16x1_16x16x1_1x32x1x8_8x8x1_1x1_intrawave_v3,0.0,281.35,772.92
304,296,6144,1536,15,0,16.9346,a8w8_rowwise_256x128x64x256_32x32_2x1_16x16x1_16x16x1_1x32x1x8_8x8x1_1x1_intrawave_v3,0.0,329.91,798.9
304,296,6144,2048,21,0,20.1963,a8w8_rowwise_256x64x128x256_32x32_1x2_16x16x1_16x16x1_1x32x1x8_8x8x1_1x1_intrawave_v3,0.0,368.83,833.14
304,296,7168,256,69,0,9.0658,a8w8_rowwise_128x16x32x128_16x16_1x1_8x16x1_8x16x1_1x16x1x8_4x4x1_1x1_interwave_v1,0.0,119.83,678.84
304,296,7168,2304,46,0,23.1344,a8w8_rowwise_256x64x128x128_32x32_1x2_8x32x1_8x32x1_1x32x1x8_8x8x1_1x1_intrawave_v3,0.0,422.61,926.78
304,304,192,7168,34,0,11.5374,a8w8_rowwise_256x16x64x512_16x16_1x1_32x8x1_32x8x1_1x16x1x16_4x4x1_1x1_intrawave_v3,0.0,72.53,318.27
304,304,512,7168,34,0,12.3686,a8w8_rowwise_256x16x64x512_16x16_1x1_32x8x1_32x8x1_1x16x1x16_4x4x1_1x1_intrawave_v3,0.0,180.41,498.07
304,304,896,5120,34,0,12.8743,a8w8_rowwise_256x16x64x512_16x16_1x1_32x8x1_32x8x1_1x16x1x16_4x4x1_1x1_intrawave_v3,0.0,216.65,519.54
304,304,1024,5632,34,0,14.5134,a8w8_rowwise_256x16x64x512_16x16_1x1_32x8x1_32x8x1_1x16x1x16_4x4x1_1x1_intrawave_v3,0.0,241.6,558.24
304,304,1056,1408,79,0,5.9755,a8w8_rowwise_128x16x32x128_16x16_1x1_8x16x1_8x16x1_1x16x1x8_4x4x1_1x1_interwave_v2,0.0,151.29,427.9
304,304,1280,4096,30,0,13.4839,a8w8_rowwise_256x32x64x512_16x16_1x2_32x8x1_32x8x1_1x32x1x8_8x8x1_1x2_intrawave_v3,0.0,236.41,538.89
304,304,1408,352,69,0,4.202,a8w8_rowwise_128x16x32x128_16x16_1x1_8x16x1_8x16x1_1x16x1x8_4x4x1_1x1_interwave_v1,0.0,71.71,347.14
304,304,1408,1408,30,0,7.0325,a8w8_rowwise_256x32x64x512_16x16_1x2_32x8x1_32x8x1_1x32x1x8_8x8x1_1x2_intrawave_v3,0.0,171.4,464.49
304,304,1536,2048,30,0,9.2812,a8w8_rowwise_256x32x64x512_16x16_1x2_32x8x1_32x8x1_1x32x1x8_8x8x1_1x2_intrawave_v3,0.0,206.07,506.64
304,304,1792,6144,30,0,21.1966,a8w8_rowwise_256x32x64x512_16x16_1x2_32x8x1_32x8x1_1x32x1x8_8x8x1_1x2_intrawave_v3,0.0,315.81,658.94
304,304,2048,1536,23,0,9.9309,a8w8_rowwise_256x64x64x512_32x32_1x1_32x8x1_32x8x1_1x32x1x8_8x8x1_1x1_intrawave_v3,0.0,192.59,489.17
304,304,2048,6144,28,0,27.0389,a8w8_rowwise_256x32x128x256_32x32_1x1_16x16x1_16x16x1_1x32x1x8_8x8x1_1x1_intrawave_v3,0.0,282.94,580.49
304,304,3072,4096,28,0,23.6332,a8w8_rowwise_256x32x128x256_32x32_1x1_16x16x1_16x16x1_1x32x1x8_8x8x1_1x1_intrawave_v3,0.0,323.71,664.15
304,304,3584,6144,28,0,35.145,a8w8_rowwise_256x32x128x256_32x32_1x1_16x16x1_16x16x1_1x32x1x8_8x8x1_1x1_intrawave_v3,0.0,380.94,741.7
304,304,4096,640,45,0,8.0212,a8w8_rowwise_256x128x64x128_32x32_2x1_8x32x1_8x32x1_1x32x1x8_8x8x1_1x1_intrawave_v3,0.0,198.7,661.54
304,304,4096,1024,22,0,10.7242,a8w8_rowwise_256x64x96x256_16x16_2x3_16x16x1_16x16x1_1x64x1x4_8x8x1_2x1_intrawave_v3,0.0,237.79,652.35
304,304,4096,3072,22,0,21.9967,a8w8_rowwise_256x64x96x256_16x16_2x3_16x16x1_16x16x1_1x64x1x4_8x8x1_2x1_intrawave_v3,0.0,347.8,727.71
304,304,5120,640,46,0,9.234,a8w8_rowwise_256x64x128x128_32x32_1x2_8x32x1_8x32x1_1x32x1x8_8x8x1_1x1_intrawave_v3,0.0,215.76,713.05
304,304,5120,2048,22,0,18.7469,a8w8_rowwise_256x64x96x256_16x16_2x3_16x16x1_16x16x1_1x64x1x4_8x8x1_2x1_intrawave_v3,0.0,340.07,758.6
304,304,6144,768,47,0,10.6093,a8w8_rowwise_256x64x64x128_32x32_1x1_8x32x1_8x32x1_1x32x1x8_8x8x1_1x1_intrawave_v3,0.0,270.41,818.87
304,304,6144,1024,21,0,13.372,a8w8_rowwise_256x64x128x256_32x32_1x2_16x16x1_16x16x1_1x32x1x8_8x8x1_1x1_intrawave_v3,0.0,286.06,773.13
304,304,6144,1536,21,0,17.6771,a8w8_rowwise_256x64x128x256_32x32_1x2_16x16x1_16x16x1_1x32x1x8_8x8x1_1x1_intrawave_v3,0.0,324.59,771.6
304,304,6144,2048,15,0,20.3226,a8w8_rowwise_256x128x64x256_32x32_2x1_16x16x1_16x16x1_1x32x1x8_8x8x1_1x1_intrawave_v3,0.0,376.45,833.61
304,304,7168,256,69,0,8.7733,a8w8_rowwise_128x16x32x128_16x16_1x1_8x16x1_8x16x1_1x16x1x8_4x4x1_1x1_interwave_v1,0.0,127.17,714.78
304,304,7168,2304,46,0,23.3281,a8w8_rowwise_256x64x128x128_32x32_1x2_8x32x1_8x32x1_1x32x1x8_8x8x1_1x1_intrawave_v3,0.0,430.43,924.79
304,312,192,7168,34,0,13.9685,a8w8_rowwise_256x16x64x512_16x16_1x1_32x8x1_32x8x1_1x16x1x16_4x4x1_1x1_intrawave_v3,0.0,61.48,267.21
304,312,512,7168,34,0,14.3623,a8w8_rowwise_256x16x64x512_16x16_1x1_32x8x1_32x8x1_1x16x1x16_4x4x1_1x1_intrawave_v3,0.0,159.45,433.49
304,312,896,5120,30,0,13.4358,a8w8_rowwise_256x32x64x512_16x16_1x2_32x8x1_32x8x1_1x32x1x8_8x8x1_1x2_intrawave_v3,0.0,213.06,501.95
304,312,1024,5632,30,0,14.7572,a8w8_rowwise_256x32x64x512_16x16_1x2_32x8x1_32x8x1_1x32x1x8_8x8x1_1x2_intrawave_v3,0.0,243.86,553.18
304,312,1056,1408,76,0,6.4167,a8w8_rowwise_128x32x16x128_16x16_1x1_8x16x1_8x16x1_1x16x1x8_2x2x1_1x1_interwave_v2,0.0,144.59,402.87
304,312,1280,4096,30,0,13.3401,a8w8_rowwise_256x32x64x512_16x16_1x2_32x8x1_32x8x1_1x32x1x8_8x8x1_1x2_intrawave_v3,0.0,245.24,548.69
304,312,1408,352,50,0,4.18,a8w8_rowwise_128x16x32x128_16x16_1x1_8x16x1_8x16x1_1x16x1x8_4x4x1_1x1_intrawave_v1,0.0,73.99,355.03
304,312,1408,1408,30,0,7.0712,a8w8_rowwise_256x32x64x512_16x16_1x2_32x8x1_32x8x1_1x32x1x8_8x8x1_1x2_intrawave_v3,0.0,174.94,466.73
304,312,1536,2048,30,0,9.3393,a8w8_rowwise_256x32x64x512_16x16_1x2_32x8x1_32x8x1_1x32x1x8_8x8x1_1x2_intrawave_v3,0.0,210.18,507.87
304,312,1792,6144,30,0,21.2744,a8w8_rowwise_256x32x64x512_16x16_1x2_32x8x1_32x8x1_1x32x1x8_8x8x1_1x2_intrawave_v3,0.0,322.94,660.19
304,312,2048,1536,23,0,9.9476,a8w8_rowwise_256x64x64x512_32x32_1x1_32x8x1_32x8x1_1x32x1x8_8x8x1_1x1_intrawave_v3,0.0,197.33,492.87
304,312,2048,6144,28,0,27.0559,a8w8_rowwise_256x32x128x256_32x32_1x1_16x16x1_16x16x1_1x32x1x8_8x8x1_1x1_intrawave_v3,0.0,290.2,583.16
304,312,3072,4096,28,0,23.4141,a8w8_rowwise_256x32x128x256_32x32_1x1_16x16x1_16x16x1_1x32x1x8_8x8x1_1x1_intrawave_v3,0.0,335.34,673.86
304,312,3584,6144,28,0,35.6521,a8w8_rowwise_256x32x128x256_32x32_1x1_16x16x1_16x16x1_1x32x1x8_8x8x1_1x1_intrawave_v3,0.0,385.41,734.13
304,312,4096,640,46,0,8.1017,a8w8_rowwise_256x64x128x128_32x32_1x2_8x32x1_8x32x1_1x32x1x8_8x8x1_1x1_intrawave_v3,0.0,201.91,663.69
304,312,4096,1024,22,0,10.8993,a8w8_rowwise_256x64x96x256_16x16_2x3_16x16x1_16x16x1_1x64x1x4_8x8x1_2x1_intrawave_v3,0.0,240.13,648.64
304,312,4096,3072,22,0,22.2091,a8w8_rowwise_256x64x96x256_16x16_2x3_16x16x1_16x16x1_1x64x1x4_8x8x1_2x1_intrawave_v3,0.0,353.54,724.81
304,312,5120,640,46,0,9.2956,a8w8_rowwise_256x64x128x128_32x32_1x2_8x32x1_8x32x1_1x32x1x8_8x8x1_1x1_intrawave_v3,0.0,219.97,717.69
304,312,5120,2048,22,0,18.4923,a8w8_rowwise_256x64x96x256_16x16_2x3_16x16x1_16x16x1_1x64x1x4_8x8x1_2x1_intrawave_v3,0.0,353.83,774.36
304,312,6144,768,47,0,10.8924,a8w8_rowwise_256x64x64x128_32x32_1x1_8x32x1_8x32x1_1x32x1x8_8x8x1_1x1_intrawave_v3,0.0,270.32,807.17
304,312,6144,1024,15,0,13.5412,a8w8_rowwise_256x128x64x256_32x32_2x1_16x16x1_16x16x1_1x32x1x8_8x8x1_1x1_intrawave_v3,0.0,289.92,771.33
304,312,6144,1536,15,0,17.435,a8w8_rowwise_256x128x64x256_32x32_2x1_16x16x1_16x16x1_1x32x1x8_8x8x1_1x1_intrawave_v3,0.0,337.76,788.66
304,312,6144,2048,15,0,20.3429,a8w8_rowwise_256x128x64x256_32x32_2x1_16x16x1_16x16x1_1x32x1x8_8x8x1_1x1_intrawave_v3,0.0,385.97,838.41
304,312,7168,256,69,0,9.6643,a8w8_rowwise_128x16x32x128_16x16_1x1_8x16x1_8x16x1_1x16x1x8_4x4x1_1x1_interwave_v1,0.0,118.48,660.96
304,312,7168,2304,46,0,23.6538,a8w8_rowwise_256x64x128x128_32x32_1x2_8x32x1_8x32x1_1x32x1x8_8x8x1_1x1_intrawave_v3,0.0,435.68,917.69
304,320,192,7168,34,0,12.0301,a8w8_rowwise_256x16x64x512_16x16_1x1_32x8x1_32x8x1_1x16x1x16_4x4x1_1x1_intrawave_v3,0.0,73.22,315.28
304,320,512,7168,34,0,13.1782,a8w8_rowwise_256x16x64x512_16x16_1x1_32x8x1_32x8x1_1x16x1x16_4x4x1_1x1_intrawave_v3,0.0,178.23,477.41
304,320,896,5120,30,0,12.94,a8w8_rowwise_256x32x64x512_16x16_1x2_32x8x1_32x8x1_1x32x1x8_8x8x1_1x2_intrawave_v3,0.0,226.89,525.45
304,320,1024,5632,30,0,14.4681,a8w8_rowwise_256x32x64x512_16x16_1x2_32x8x1_32x8x1_1x32x1x8_8x8x1_1x2_intrawave_v3,0.0,255.11,568.48
304,320,1056,1408,79,0,6.6273,a8w8_rowwise_128x16x32x128_16x16_1x1_8x16x1_8x16x1_1x16x1x8_4x4x1_1x1_interwave_v2,0.0,143.59,394.32
304,320,1280,4096,30,0,12.7717,a8w8_rowwise_256x32x64x512_16x16_1x2_32x8x1_32x8x1_1x32x1x8_8x8x1_1x2_intrawave_v3,0.0,262.72,577.28
304,320,1408,352,50,0,4.8271,a8w8_rowwise_128x16x32x128_16x16_1x1_8x16x1_8x16x1_1x16x1x8_4x4x1_1x1_intrawave_v1,0.0,65.71,312.69
304,320,1408,1408,30,0,7.4181,a8w8_rowwise_256x32x64x512_16x16_1x2_32x8x1_32x8x1_1x32x1x8_8x8x1_1x2_intrawave_v3,0.0,171.04,449.46
304,320,1536,2048,30,0,9.2277,a8w8_rowwise_256x32x64x512_16x16_1x2_32x8x1_32x8x1_1x32x1x8_8x8x1_1x2_intrawave_v3,0.0,218.18,518.45
304,320,1792,6144,30,0,19.4814,a8w8_rowwise_256x32x64x512_16x16_1x2_32x8x1_32x8x1_1x32x1x8_8x8x1_1x2_intrawave_v3,0.0,361.7,724.95
304,320,2048,1536,23,0,9.0868,a8w8_rowwise_256x64x64x512_32x32_1x1_32x8x1_32x8x1_1x32x1x8_8x8x1_1x1_intrawave_v3,0.0,221.56,544.52
304,320,2048,6144,23,0,21.9331,a8w8_rowwise_256x64x64x512_32x32_1x1_32x8x1_32x8x1_1x32x1x8_8x8x1_1x1_intrawave_v3,0.0,367.16,723.09
304,320,3072,4096,23,0,20.4055,a8w8_rowwise_256x64x64x512_32x32_1x1_32x8x1_32x8x1_1x32x1x8_8x8x1_1x1_intrawave_v3,0.0,394.65,777.23
304,320,3584,6144,23,0,30.085,a8w8_rowwise_256x64x64x512_32x32_1x1_32x8x1_32x8x1_1x32x1x8_8x8x1_1x1_intrawave_v3,0.0,468.43,873.52
304,320,4096,640,46,0,8.212,a8w8_rowwise_256x64x128x128_32x32_1x2_8x32x1_8x32x1_1x32x1x8_8x8x1_1x1_intrawave_v3,0.0,204.3,663.38
304,320,4096,1024,22,0,11.4068,a8w8_rowwise_256x64x96x256_16x16_2x3_16x16x1_16x16x1_1x64x1x4_8x8x1_2x1_intrawave_v3,0.0,235.33,626.24
304,320,4096,3072,21,0,22.0553,a8w8_rowwise_256x64x128x256_32x32_1x2_16x16x1_16x16x1_1x32x1x8_8x8x1_1x1_intrawave_v3,0.0,365.13,733.95
304,320,5120,640,46,0,9.3866,a8w8_rowwise_256x64x128x128_32x32_1x2_8x32x1_8x32x1_1x32x1x8_8x8x1_1x1_intrawave_v3,0.0,223.42,720.01
304,320,5120,2048,21,0,19.1541,a8w8_rowwise_256x64x128x256_32x32_1x2_16x16x1_16x16x1_1x32x1x8_8x8x1_1x1_intrawave_v3,0.0,350.36,752.73
304,320,6144,768,47,0,10.7566,a8w8_rowwise_256x64x64x128_32x32_1x1_8x32x1_8x32x1_1x32x1x8_8x8x1_1x1_intrawave_v3,0.0,280.75,827.07
304,320,6144,1024,21,0,13.6726,a8w8_rowwise_256x64x128x256_32x32_1x2_16x16x1_16x16x1_1x32x1x8_8x8x1_1x1_intrawave_v3,0.0,294.5,771.71
304,320,6144,1536,21,0,17.0885,a8w8_rowwise_256x64x128x256_32x32_1x2_16x16x1_16x16x1_1x32x1x8_8x8x1_1x1_intrawave_v3,0.0,353.44,811.12
304,320,6144,2048,21,0,20.4424,a8w8_rowwise_256x64x128x256_32x32_1x2_16x16x1_16x16x1_1x32x1x8_8x8x1_1x1_intrawave_v3,0.0,393.94,839.94
304,320,7168,256,48,0,9.2848,a8w8_rowwise_128x32x16x128_16x16_1x1_8x16x1_8x16x1_1x16x1x8_2x2x1_1x1_intrawave_v1,0.0,126.49,700.55
304,320,7168,2304,21,0,23.071,a8w8_rowwise_256x64x128x256_32x32_1x2_16x16x1_16x16x1_1x32x1x8_8x8x1_1x1_intrawave_v3,0.0,458.14,946.64
304,328,192,7168,34,0,13.8589,a8w8_rowwise_256x16x64x512_16x16_1x1_32x8x1_32x8x1_1x16x1x16_4x4x1_1x1_intrawave_v3,0.0,65.14,278.04
304,328,512,7168,34,0,14.3396,a8w8_rowwise_256x16x64x512_16x16_1x1_32x8x1_32x8x1_1x16x1x16_4x4x1_1x1_intrawave_v3,0.0,167.89,443.32
304,328,896,5120,30,0,13.9106,a8w8_rowwise_256x32x64x512_16x16_1x2_32x8x1_32x8x1_1x32x1x8_8x8x1_1x2_intrawave_v3,0.0,216.34,492.76
304,328,1024,5632,30,0,15.676,a8w8_rowwise_256x32x64x512_16x16_1x2_32x8x1_32x8x1_1x32x1x8_8x8x1_1x2_intrawave_v3,0.0,241.34,528.59
304,328,1056,1408,79,0,7.0552,a8w8_rowwise_128x16x32x128_16x16_1x1_8x16x1_8x16x1_1x16x1x8_4x4x1_1x1_interwave_v2,0.0,138.25,374.39
304,328,1280,4096,30,0,14.3776,a8w8_rowwise_256x32x64x512_16x16_1x2_32x8x1_32x8x1_1x32x1x8_8x8x1_1x2_intrawave_v3,0.0,239.21,516.5
304,328,1408,352,50,0,4.811,a8w8_rowwise_128x16x32x128_16x16_1x1_8x16x1_8x16x1_1x16x1x8_4x4x1_1x1_intrawave_v1,0.0,67.58,319.0
304,328,1408,1408,30,0,7.8455,a8w8_rowwise_256x32x64x512_16x16_1x2_32x8x1_32x8x1_1x32x1x8_8x8x1_1x2_intrawave_v3,0.0,165.76,429.28
304,328,1536,2048,30,0,9.4461,a8w8_rowwise_256x32x64x512_16x16_1x2_32x8x1_32x8x1_1x32x1x8_8x8x1_1x2_intrawave_v3,0.0,218.46,510.8
304,328,1792,6144,28,0,26.4712,a8w8_rowwise_256x32x128x256_32x32_1x1_16x16x1_16x16x1_1x32x1x8_8x8x1_1x1_intrawave_v3,0.0,272.85,536.46
304,328,2048,1536,23,0,10.0737,a8w8_rowwise_256x64x64x512_32x32_1x1_32x8x1_32x8x1_1x32x1x8_8x8x1_1x1_intrawave_v3,0.0,204.85,495.65
304,328,2048,6144,28,0,28.3061,a8w8_rowwise_256x32x128x256_32x32_1x1_16x16x1_16x16x1_1x32x1x8_8x8x1_1x1_intrawave_v3,0.0,291.61,563.19
304,328,3072,4096,28,0,24.1899,a8w8_rowwise_256x32x128x256_32x32_1x1_16x16x1_16x16x1_1x32x1x8_8x8x1_1x1_intrawave_v3,0.0,341.23,659.02
304,328,3584,6144,21,0,39.5059,a8w8_rowwise_256x64x128x256_32x32_1x2_16x16x1_16x16x1_1x32x1x8_8x8x1_1x1_intrawave_v3,0.0,365.65,667.91
304,328,4096,640,46,0,8.5402,a8w8_rowwise_256x64x128x128_32x32_1x2_8x32x1_8x32x1_1x32x1x8_8x8x1_1x1_intrawave_v3,0.0,201.36,646.16
304,328,4096,1024,22,0,11.2099,a8w8_rowwise_256x64x96x256_16x16_2x3_16x16x1_16x16x1_1x64x1x4_8x8x1_2x1_intrawave_v3,0.0,245.45,643.82
304,328,4096,3072,15,0,23.1484,a8w8_rowwise_256x128x64x256_32x32_2x1_16x16x1_16x16x1_1x32x1x8_8x8x1_1x1_intrawave_v3,0.0,356.59,703.18
304,328,5120,640,45,0,9.7683,a8w8_rowwise_256x128x64x128_32x32_2x1_8x32x1_8x32x1_1x32x1x8_8x8x1_1x1_intrawave_v3,0.0,220.06,700.78
304,328,5120,2048,21,0,19.4061,a8w8_rowwise_256x64x128x256_32x32_1x2_16x16x1_16x16x1_1x32x1x8_8x8x1_1x1_intrawave_v3,0.0,354.46,748.02
304,328,6144,768,15,0,11.035,a8w8_rowwise_256x128x64x256_32x32_2x1_16x16x1_16x16x1_1x32x1x8_8x8x1_1x1_intrawave_v3,0.0,280.51,815.67
304,328,6144,1024,15,0,13.5937,a8w8_rowwise_256x128x64x256_32x32_2x1_16x16x1_16x16x1_1x32x1x8_8x8x1_1x1_intrawave_v3,0.0,303.61,784.02
304,328,6144,1536,15,0,17.8152,a8w8_rowwise_256x128x64x256_32x32_2x1_16x16x1_16x16x1_1x32x1x8_8x8x1_1x1_intrawave_v3,0.0,347.5,784.24
304,328,6144,2048,15,0,20.6242,a8w8_rowwise_256x128x64x256_32x32_2x1_16x16x1_16x16x1_1x32x1x8_8x8x1_1x1_intrawave_v3,0.0,400.23,838.1
304,328,7168,256,50,0,9.4939,a8w8_rowwise_128x16x32x128_16x16_1x1_8x16x1_8x16x1_1x16x1x8_4x4x1_1x1_intrawave_v1,0.0,126.79,697.41
304,328,7168,2304,14,0,24.5214,a8w8_rowwise_256x128x96x256_32x32_1x3_16x16x1_16x16x1_1x64x1x4_8x8x1_1x1_intrawave_v3,0.0,441.81,896.07
304,336,192,7168,34,0,11.5787,a8w8_rowwise_256x16x64x512_16x16_1x1_32x8x1_32x8x1_1x16x1x16_4x4x1_1x1_intrawave_v3,0.0,79.87,338.01
304,336,512,7168,34,0,13.1353,a8w8_rowwise_256x16x64x512_16x16_1x1_32x8x1_32x8x1_1x16x1x16_4x4x1_1x1_intrawave_v3,0.0,187.76,488.95
304,336,896,5120,34,0,13.3595,a8w8_rowwise_256x16x64x512_16x16_1x1_32x8x1_32x8x1_1x16x1x16_4x4x1_1x1_intrawave_v3,0.0,230.76,517.23
304,336,1024,5632,30,0,15.6269,a8w8_rowwise_256x32x64x512_16x16_1x2_32x8x1_32x8x1_1x32x1x8_8x8x1_1x2_intrawave_v3,0.0,248.0,534.18
304,336,1056,1408,79,0,6.112,a8w8_rowwise_128x16x32x128_16x16_1x1_8x16x1_8x16x1_1x16x1x8_4x4x1_1x1_interwave_v2,0.0,163.48,436.77
304,336,1280,4096,30,0,14.1545,a8w8_rowwise_256x32x64x512_16x16_1x2_32x8x1_32x8x1_1x32x1x8_8x8x1_1x2_intrawave_v3,0.0,248.91,528.4
304,336,1408,352,50,0,4.2545,a8w8_rowwise_128x16x32x128_16x16_1x1_8x16x1_8x16x1_1x16x1x8_4x4x1_1x1_intrawave_v1,0.0,78.28,366.69
304,336,1408,1408,30,0,7.5707,a8w8_rowwise_256x32x64x512_16x16_1x2_32x8x1_32x8x1_1x32x1x8_8x8x1_1x2_intrawave_v3,0.0,175.97,449.33
304,336,1536,2048,30,0,9.4747,a8w8_rowwise_256x32x64x512_16x16_1x2_32x8x1_32x8x1_1x32x1x8_8x8x1_1x2_intrawave_v3,0.0,223.11,513.58
304,336,1792,6144,28,0,26.9827,a8w8_rowwise_256x32x128x256_32x32_1x1_16x16x1_16x16x1_1x32x1x8_8x8x1_1x1_intrawave_v3,0.0,274.2,529.18
304,336,2048,1536,23,0,10.1158,a8w8_rowwise_256x64x64x512_32x32_1x1_32x8x1_32x8x1_1x32x1x8_8x8x1_1x1_intrawave_v3,0.0,208.97,498.04
304,336,2048,6144,28,0,28.2537,a8w8_rowwise_256x32x128x256_32x32_1x1_16x16x1_16x16x1_1x32x1x8_8x8x1_1x1_intrawave_v3,0.0,299.28,567.13
304,336,3072,4096,28,0,24.2852,a8w8_rowwise_256x32x128x256_32x32_1x1_16x16x1_16x16x1_1x32x1x8_8x8x1_1x1_intrawave_v3,0.0,348.18,659.81
304,336,3584,6144,15,0,40.6508,a8w8_rowwise_256x128x64x256_32x32_2x1_16x16x1_16x16x1_1x32x1x8_8x8x1_1x1_intrawave_v3,0.0,364.02,651.72
304,336,4096,640,45,0,8.2562,a8w8_rowwise_256x128x64x128_32x32_2x1_8x32x1_8x32x1_1x32x1x8_8x8x1_1x1_intrawave_v3,0.0,213.37,676.94
304,336,4096,1024,22,0,11.2716,a8w8_rowwise_256x64x96x256_16x16_2x3_16x16x1_16x16x1_1x64x1x4_8x8x1_2x1_intrawave_v3,0.0,250.06,646.84
304,336,4096,3072,15,0,23.3925,a8w8_rowwise_256x128x64x256_32x32_2x1_16x16x1_16x16x1_1x32x1x8_8x8x1_1x1_intrawave_v3,0.0,361.47,699.7
304,336,5120,640,47,0,9.5073,a8w8_rowwise_256x64x64x128_32x32_1x1_8x32x1_8x32x1_1x32x1x8_8x8x1_1x1_intrawave_v3,0.0,231.61,729.17
304,336,5120,2048,15,0,19.1615,a8w8_rowwise_256x128x64x256_32x32_2x1_16x16x1_16x16x1_1x32x1x8_8x8x1_1x1_intrawave_v3,0.0,367.74,762.7
304,336,6144,768,15,0,11.0783,a8w8_rowwise_256x128x64x256_32x32_2x1_16x16x1_16x16x1_1x32x1x8_8x8x1_1x1_intrawave_v3,0.0,286.23,821.91
304,336,6144,1024,15,0,13.6598,a8w8_rowwise_256x128x64x256_32x32_2x1_16x16x1_16x16x1_1x32x1x8_8x8x1_1x1_intrawave_v3,0.0,309.51,788.03
304,336,6144,1536,21,0,17.3765,a8w8_rowwise_256x64x128x256_32x32_1x2_16x16x1_16x16x1_1x32x1x8_8x8x1_1x1_intrawave_v3,0.0,364.96,810.41
304,336,6144,2048,15,0,20.6048,a8w8_rowwise_256x128x64x256_32x32_2x1_16x16x1_16x16x1_1x32x1x8_8x8x1_1x1_intrawave_v3,0.0,410.38,844.45
304,336,7168,256,50,0,9.1272,a8w8_rowwise_128x16x32x128_16x16_1x1_8x16x1_8x16x1_1x16x1x8_4x4x1_1x1_intrawave_v1,0.0,135.1,738.22
304,336,7168,2304,14,0,24.6366,a8w8_rowwise_256x128x96x256_32x32_1x3_16x16x1_16x16x1_1x64x1x4_8x8x1_1x1_intrawave_v3,0.0,450.47,897.29
304,344,192,7168,34,0,14.0142,a8w8_rowwise_256x16x64x512_16x16_1x1_32x8x1_32x8x1_1x16x1x16_4x4x1_1x1_intrawave_v3,0.0,67.56,283.58
304,344,512,7168,34,0,14.5382,a8w8_rowwise_256x16x64x512_16x16_1x1_32x8x1_32x8x1_1x16x1x16_4x4x1_1x1_intrawave_v3,0.0,173.68,446.28
304,344,896,5120,30,0,13.7775,a8w8_rowwise_256x32x64x512_16x16_1x2_32x8x1_32x8x1_1x32x1x8_8x8x1_1x2_intrawave_v3,0.0,229.08,505.55
304,344,1024,5632,30,0,15.6915,a8w8_rowwise_256x32x64x512_16x16_1x2_32x8x1_32x8x1_1x32x1x8_8x8x1_1x2_intrawave_v3,0.0,252.86,535.9
304,344,1056,1408,76,0,6.6341,a8w8_rowwise_128x32x16x128_16x16_1x1_8x16x1_8x16x1_1x16x1x8_2x2x1_1x1_interwave_v2,0.0,154.2,406.65
304,344,1280,4096,30,0,14.1241,a8w8_rowwise_256x32x64x512_16x16_1x2_32x8x1_32x8x1_1x32x1x8_8x8x1_1x2_intrawave_v3,0.0,255.39,533.31
304,344,1408,352,69,0,4.3082,a8w8_rowwise_128x16x32x128_16x16_1x1_8x16x1_8x16x1_1x16x1x8_4x4x1_1x1_interwave_v1,0.0,79.15,368.0
304,344,1408,1408,30,0,7.5794,a8w8_rowwise_256x32x64x512_16x16_1x2_32x8x1_32x8x1_1x32x1x8_8x8x1_1x2_intrawave_v3,0.0,179.95,453.27
304,344,1536,2048,30,0,9.417,a8w8_rowwise_256x32x64x512_16x16_1x2_32x8x1_32x8x1_1x32x1x8_8x8x1_1x2_intrawave_v3,0.0,229.82,521.08
304,344,1792,6144,28,0,26.825,a8w8_rowwise_256x32x128x256_32x32_1x1_16x16x1_16x16x1_1x32x1x8_8x8x1_1x1_intrawave_v3,0.0,282.38,535.19
304,344,2048,1536,23,0,10.1726,a8w8_rowwise_256x64x64x512_32x32_1x1_32x8x1_32x8x1_1x32x1x8_8x8x1_1x1_intrawave_v3,0.0,212.75,499.69
304,344,2048,6144,28,0,28.0776,a8w8_rowwise_256x32x128x256_32x32_1x1_16x16x1_16x16x1_1x32x1x8_8x8x1_1x1_intrawave_v3,0.0,308.33,573.61
304,344,3072,4096,28,0,24.2701,a8w8_rowwise_256x32x128x256_32x32_1x1_16x16x1_16x16x1_1x32x1x8_8x8x1_1x1_intrawave_v3,0.0,356.7,663.59
304,344,3584,6144,22,0,40.267,a8w8_rowwise_256x64x96x256_16x16_2x3_16x16x1_16x16x1_1x64x1x4_8x8x1_2x1_intrawave_v3,0.0,376.23,660.58
304,344,4096,640,45,0,8.2958,a8w8_rowwise_256x128x64x128_32x32_2x1_8x32x1_8x32x1_1x32x1x8_8x8x1_1x1_intrawave_v3,0.0,217.41,682.23
304,344,4096,1024,22,0,11.3339,a8w8_rowwise_256x64x96x256_16x16_2x3_16x16x1_16x16x1_1x64x1x4_8x8x1_2x1_intrawave_v3,0.0,254.61,649.79
304,344,4096,3072,15,0,23.5278,a8w8_rowwise_256x128x64x256_32x32_2x1_16x16x1_16x16x1_1x32x1x8_8x8x1_1x1_intrawave_v3,0.0,367.95,699.5
304,344,5120,640,47,0,9.5312,a8w8_rowwise_256x64x64x128_32x32_1x1_8x32x1_8x32x1_1x32x1x8_8x8x1_1x1_intrawave_v3,0.0,236.53,736.48
304,344,5120,2048,15,0,19.3374,a8w8_rowwise_256x128x64x256_32x32_2x1_16x16x1_16x16x1_1x32x1x8_8x8x1_1x1_intrawave_v3,0.0,373.07,760.85
304,344,6144,768,15,0,11.1384,a8w8_rowwise_256x128x64x256_32x32_2x1_16x16x1_16x16x1_1x32x1x8_8x8x1_1x1_intrawave_v3,0.0,291.46,826.86
304,344,6144,1024,15,0,13.5672,a8w8_rowwise_256x128x64x256_32x32_2x1_16x16x1_16x16x1_1x32x1x8_8x8x1_1x1_intrawave_v3,0.0,319.04,801.25
304,344,6144,1536,21,0,17.7326,a8w8_rowwise_256x64x128x256_32x32_1x2_16x16x1_16x16x1_1x32x1x8_8x8x1_1x1_intrawave_v3,0.0,366.15,800.37
304,344,6144,2048,15,0,20.9235,a8w8_rowwise_256x128x64x256_32x32_2x1_16x16x1_16x16x1_1x32x1x8_8x8x1_1x1_intrawave_v3,0.0,413.75,837.07
304,344,7168,256,44,0,9.5308,a8w8_rowwise_256x128x128x128_32x32_2x2_8x32x1_8x32x1_1x32x1x8_8x8x1_1x1_interwave_v1,0.0,132.46,719.21
304,344,7168,2304,14,0,24.8111,a8w8_rowwise_256x128x96x256_32x32_1x3_16x16x1_16x16x1_1x64x1x4_8x8x1_1x1_intrawave_v3,0.0,457.96,896.34
304,352,192,7168,34,0,11.5189,a8w8_rowwise_256x16x64x512_16x16_1x1_32x8x1_32x8x1_1x16x1x16_4x4x1_1x1_intrawave_v3,0.0,84.11,350.26
304,352,512,7168,34,0,13.2463,a8w8_rowwise_256x16x64x512_16x16_1x1_32x8x1_32x8x1_1x16x1x16_4x4x1_1x1_intrawave_v3,0.0,195.05,494.75
304,352,896,5120,30,0,12.8573,a8w8_rowwise_256x32x64x512_16x16_1x2_32x8x1_32x8x1_1x32x1x8_8x8x1_1x2_intrawave_v3,0.0,251.19,546.04
304,352,1024,5632,30,0,14.8178,a8w8_rowwise_256x32x64x512_16x16_1x2_32x8x1_32x8x1_1x32x1x8_8x8x1_1x2_intrawave_v3,0.0,274.0,571.65
304,352,1056,1408,76,0,6.262,a8w8_rowwise_128x32x16x128_16x16_1x1_8x16x1_8x16x1_1x16x1x8_2x2x1_1x1_interwave_v2,0.0,167.16,435.31
304,352,1280,4096,30,0,13.0091,a8w8_rowwise_256x32x64x512_16x16_1x2_32x8x1_32x8x1_1x32x1x8_8x8x1_1x2_intrawave_v3,0.0,283.72,583.11
304,352,1408,352,69,0,4.3723,a8w8_rowwise_128x16x32x128_16x16_1x1_8x16x1_8x16x1_1x16x1x8_4x4x1_1x1_interwave_v1,0.0,79.8,368.4
304,352,1408,1408,30,0,7.6675,a8w8_rowwise_256x32x64x512_16x16_1x2_32x8x1_32x8x1_1x32x1x8_8x8x1_1x2_intrawave_v3,0.0,182.02,452.47
304,352,1536,2048,30,0,8.9715,a8w8_rowwise_256x32x64x512_16x16_1x2_32x8x1_32x8x1_1x32x1x8_8x8x1_1x2_intrawave_v3,0.0,246.85,551.52
304,352,1792,6144,28,0,25.6949,a8w8_rowwise_256x32x128x256_32x32_1x1_16x16x1_16x16x1_1x32x1x8_8x8x1_1x1_intrawave_v3,0.0,301.66,561.76
304,352,2048,1536,23,0,10.1962,a8w8_rowwise_256x64x64x512_32x32_1x1_32x8x1_32x8x1_1x32x1x8_8x8x1_1x1_intrawave_v3,0.0,217.2,502.95
304,352,2048,6144,28,0,27.0941,a8w8_rowwise_256x32x128x256_32x32_1x1_16x16x1_16x16x1_1x32x1x8_8x8x1_1x1_intrawave_v3,0.0,326.95,597.45
304,352,3072,4096,28,0,23.4267,a8w8_rowwise_256x32x128x256_32x32_1x1_16x16x1_16x16x1_1x32x1x8_8x8x1_1x1_intrawave_v3,0.0,378.13,690.98
304,352,3584,6144,15,0,39.9915,a8w8_rowwise_256x128x64x256_32x32_2x1_16x16x1_16x16x1_1x32x1x8_8x8x1_1x1_intrawave_v3,0.0,387.64,667.79
304,352,4096,640,45,0,8.3679,a8w8_rowwise_256x128x64x128_32x32_2x1_8x32x1_8x32x1_1x32x1x8_8x8x1_1x1_intrawave_v3,0.0,220.54,684.8
304,352,4096,1024,22,0,11.3611,a8w8_rowwise_256x64x96x256_16x16_2x3_16x16x1_16x16x1_1x64x1x4_8x8x1_2x1_intrawave_v3,0.0,259.9,654.72
304,352,4096,3072,15,0,23.5048,a8w8_rowwise_256x128x64x256_32x32_2x1_16x16x1_16x16x1_1x32x1x8_8x8x1_1x1_intrawave_v3,0.0,376.87,704.02
304,352,5120,640,81,0,9.3288,a8w8_rowwise_128x32x64x128_32x32_1x1_8x16x1_8x16x1_1x16x1x8_8x8x1_1x1_interwave_v2,0.0,247.28,761.79
304,352,5120,2048,21,0,19.511,a8w8_rowwise_256x64x128x256_32x32_1x2_16x16x1_16x16x1_1x32x1x8_8x8x1_1x1_intrawave_v3,0.0,378.35,759.12
304,352,6144,768,15,0,11.2281,a8w8_rowwise_256x128x64x256_32x32_2x1_16x16x1_16x16x1_1x32x1x8_8x8x1_1x1_intrawave_v3,0.0,295.85,829.55
304,352,6144,1024,15,0,13.5212,a8w8_rowwise_256x128x64x256_32x32_2x1_16x16x1_16x16x1_1x32x1x8_8x8x1_1x1_intrawave_v3,0.0,327.57,811.86
304,352,6144,1536,15,0,17.8836,a8w8_rowwise_256x128x64x256_32x32_2x1_16x16x1_16x16x1_1x32x1x8_8x8x1_1x1_intrawave_v3,0.0,371.5,799.8
304,352,6144,2048,15,0,20.8692,a8w8_rowwise_256x128x64x256_32x32_2x1_16x16x1_16x16x1_1x32x1x8_8x8x1_1x1_intrawave_v3,0.0,424.47,844.75
304,352,7168,256,67,0,9.4091,a8w8_rowwise_128x32x16x128_16x16_1x1_8x16x1_8x16x1_1x16x1x8_2x2x1_1x1_interwave_v1,0.0,137.3,740.92
304,352,7168,2304,14,0,24.7541,a8w8_rowwise_256x128x96x256_32x32_1x3_16x16x1_16x16x1_1x64x1x4_8x8x1_1x1_intrawave_v3,0.0,469.68,903.78
304,360,192,7168,34,0,13.9469,a8w8_rowwise_256x16x64x512_16x16_1x1_32x8x1_32x8x1_1x16x1x16_4x4x1_1x1_intrawave_v3,0.0,71.05,293.61
304,360,512,7168,34,0,14.9364,a8w8_rowwise_256x16x64x512_16x16_1x1_32x8x1_32x8x1_1x16x1x16_4x4x1_1x1_intrawave_v3,0.0,176.91,443.15
304,360,896,5120,30,0,14.2773,a8w8_rowwise_256x32x64x512_16x16_1x2_32x8x1_32x8x1_1x32x1x8_8x8x1_1x2_intrawave_v3,0.0,231.35,495.6
304,360,1024,5632,30,0,16.0912,a8w8_rowwise_256x32x64x512_16x16_1x2_32x8x1_32x8x1_1x32x1x8_8x8x1_1x2_intrawave_v3,0.0,258.05,530.23
304,360,1056,1408,30,0,6.7323,a8w8_rowwise_256x32x64x512_16x16_1x2_32x8x1_32x8x1_1x32x1x8_8x8x1_1x2_intrawave_v3,0.0,159.01,409.08
304,360,1280,4096,30,0,14.4217,a8w8_rowwise_256x32x64x512_16x16_1x2_32x8x1_32x8x1_1x32x1x8_8x8x1_1x2_intrawave_v3,0.0,261.75,529.69
304,360,1408,352,50,0,4.3664,a8w8_rowwise_128x16x32x128_16x16_1x1_8x16x1_8x16x1_1x16x1x8_4x4x1_1x1_intrawave_v1,0.0,81.72,374.7
304,360,1408,1408,30,0,7.9889,a8w8_rowwise_256x32x64x512_16x16_1x2_32x8x1_32x8x1_1x32x1x8_8x8x1_1x2_intrawave_v3,0.0,178.67,438.5
304,360,1536,2048,30,0,9.6666,a8w8_rowwise_256x32x64x512_16x16_1x2_32x8x1_32x8x1_1x32x1x8_8x8x1_1x2_intrawave_v3,0.0,234.3,516.1
304,360,1792,6144,28,0,27.4885,a8w8_rowwise_256x32x128x256_32x32_1x1_16x16x1_16x16x1_1x32x1x8_8x8x1_1x1_intrawave_v3,0.0,288.38,527.93
304,360,2048,1536,23,0,10.247,a8w8_rowwise_256x64x64x512_32x32_1x1_32x8x1_32x8x1_1x32x1x8_8x8x1_1x1_intrawave_v3,0.0,221.03,504.85
304,360,2048,6144,28,0,29.2405,a8w8_rowwise_256x32x128x256_32x32_1x1_16x16x1_16x16x1_1x32x1x8_8x8x1_1x1_intrawave_v3,0.0,309.83,556.4
304,360,3072,4096,28,0,25.0034,a8w8_rowwise_256x32x128x256_32x32_1x1_16x16x1_16x16x1_1x32x1x8_8x8x1_1x1_intrawave_v3,0.0,362.34,650.68
304,360,3584,6144,21,0,39.5383,a8w8_rowwise_256x64x128x256_32x32_1x2_16x16x1_16x16x1_1x32x1x8_8x8x1_1x1_intrawave_v3,0.0,400.99,678.14
304,360,4096,640,45,0,8.3798,a8w8_rowwise_256x128x64x128_32x32_2x1_8x32x1_8x32x1_1x32x1x8_8x8x1_1x1_intrawave_v3,0.0,225.24,692.26
304,360,4096,1024,22,0,11.4889,a8w8_rowwise_256x64x96x256_16x16_2x3_16x16x1_16x16x1_1x64x1x4_8x8x1_2x1_intrawave_v3,0.0,262.85,653.85
304,360,4096,3072,15,0,23.9958,a8w8_rowwise_256x128x64x256_32x32_2x1_16x16x1_16x16x1_1x32x1x8_8x8x1_1x1_intrawave_v3,0.0,377.55,693.37
304,360,5120,640,47,0,9.5635,a8w8_rowwise_256x64x64x128_32x32_1x1_8x32x1_8x32x1_1x32x1x8_8x8x1_1x1_intrawave_v3,0.0,246.7,752.19
304,360,5120,2048,15,0,19.4083,a8w8_rowwise_256x128x64x256_32x32_2x1_16x16x1_16x16x1_1x32x1x8_8x8x1_1x1_intrawave_v3,0.0,389.0,768.2
304,360,6144,768,15,0,11.2409,a8w8_rowwise_256x128x64x256_32x32_2x1_16x16x1_16x16x1_1x32x1x8_8x8x1_1x1_intrawave_v3,0.0,302.23,837.9
304,360,6144,1024,15,0,13.6101,a8w8_rowwise_256x128x64x256_32x32_2x1_16x16x1_16x16x1_1x32x1x8_8x8x1_1x1_intrawave_v3,0.0,332.83,814.38
304,360,6144,1536,15,0,17.9686,a8w8_rowwise_256x128x64x256_32x32_2x1_16x16x1_16x16x1_1x32x1x8_8x8x1_1x1_intrawave_v3,0.0,378.15,802.17
304,360,6144,2048,15,0,21.0123,a8w8_rowwise_256x128x64x256_32x32_2x1_16x16x1_16x16x1_1x32x1x8_8x8x1_1x1_intrawave_v3,0.0,431.16,844.45
304,360,7168,256,44,0,9.6203,a8w8_rowwise_256x128x128x128_32x32_2x2_8x32x1_8x32x1_1x32x1x8_8x8x1_1x1_interwave_v1,0.0,137.34,736.79
304,360,7168,2304,14,0,25.106,a8w8_rowwise_256x128x96x256_32x32_1x3_16x16x1_16x16x1_1x64x1x4_8x8x1_1x1_intrawave_v3,0.0,473.63,896.42
304,368,192,7168,34,0,12.1459,a8w8_rowwise_256x16x64x512_16x16_1x1_32x8x1_32x8x1_1x16x1x16_4x4x1_1x1_intrawave_v3,0.0,83.4,342.12
304,368,512,7168,34,0,14.1652,a8w8_rowwise_256x16x64x512_16x16_1x1_32x8x1_32x8x1_1x16x1x16_4x4x1_1x1_intrawave_v3,0.0,190.69,471.91
304,368,896,5120,30,0,14.4365,a8w8_rowwise_256x32x64x512_16x16_1x2_32x8x1_32x8x1_1x32x1x8_8x8x1_1x2_intrawave_v3,0.0,233.88,493.97
304,368,1024,5632,30,0,17.6123,a8w8_rowwise_256x32x64x512_16x16_1x2_32x8x1_32x8x1_1x32x1x8_8x8x1_1x2_intrawave_v3,0.0,241.0,487.92
304,368,1056,1408,79,0,7.142,a8w8_rowwise_128x16x32x128_16x16_1x1_8x16x1_8x16x1_1x16x1x8_4x4x1_1x1_interwave_v2,0.0,153.22,389.56
304,368,1280,4096,30,0,14.8178,a8w8_rowwise_256x32x64x512_16x16_1x2_32x8x1_32x8x1_1x32x1x8_8x8x1_1x2_intrawave_v3,0.0,260.41,519.12
304,368,1408,352,50,0,5.0073,a8w8_rowwise_128x16x32x128_16x16_1x1_8x16x1_8x16x1_1x16x1x8_4x4x1_1x1_intrawave_v1,0.0,72.85,331.8
304,368,1408,1408,30,0,8.4445,a8w8_rowwise_256x32x64x512_16x16_1x2_32x8x1_32x8x1_1x32x1x8_8x8x1_1x2_intrawave_v3,0.0,172.79,418.84
304,368,1536,2048,30,0,10.2188,a8w8_rowwise_256x32x64x512_16x16_1x2_32x8x1_32x8x1_1x32x1x8_8x8x1_1x2_intrawave_v3,0.0,226.57,492.22
304,368,1792,6144,28,0,27.4555,a8w8_rowwise_256x32x128x256_32x32_1x1_16x16x1_16x16x1_1x32x1x8_8x8x1_1x1_intrawave_v3,0.0,295.15,531.4
304,368,2048,1536,23,0,10.657,a8w8_rowwise_256x64x64x512_32x32_1x1_32x8x1_32x8x1_1x32x1x8_8x8x1_1x1_intrawave_v3,0.0,217.25,489.66
304,368,2048,6144,28,0,29.3067,a8w8_rowwise_256x32x128x256_32x32_1x1_16x16x1_16x16x1_1x32x1x8_8x8x1_1x1_intrawave_v3,0.0,316.0,557.93
304,368,3072,4096,28,0,25.2537,a8w8_rowwise_256x32x128x256_32x32_1x1_16x16x1_16x16x1_1x32x1x8_8x8x1_1x1_intrawave_v3,0.0,366.72,647.48
304,368,3584,6144,21,0,39.5956,a8w8_rowwise_256x64x128x256_32x32_1x2_16x16x1_16x16x1_1x32x1x8_8x8x1_1x1_intrawave_v3,0.0,409.31,679.85
304,368,4096,640,45,0,8.8574,a8w8_rowwise_256x128x64x128_32x32_2x1_8x32x1_8x32x1_1x32x1x8_8x8x1_1x1_intrawave_v3,0.0,217.83,662.91
304,368,4096,1024,22,0,11.7762,a8w8_rowwise_256x64x96x256_16x16_2x3_16x16x1_16x16x1_1x64x1x4_8x8x1_2x1_intrawave_v3,0.0,262.14,644.16
304,368,4096,3072,15,0,23.9317,a8w8_rowwise_256x128x64x256_32x32_2x1_16x16x1_16x16x1_1x32x1x8_8x8x1_1x1_intrawave_v3,0.0,386.98,698.99
304,368,5120,640,47,0,9.978,a8w8_rowwise_256x64x64x128_32x32_1x1_8x32x1_8x32x1_1x32x1x8_8x8x1_1x1_intrawave_v3,0.0,241.7,729.67
304,368,5120,2048,15,0,19.5757,a8w8_rowwise_256x128x64x256_32x32_2x1_16x16x1_16x16x1_1x32x1x8_8x8x1_1x1_intrawave_v3,0.0,394.24,766.65
304,368,6144,768,47,0,11.5374,a8w8_rowwise_256x64x64x128_32x32_1x1_8x32x1_8x32x1_1x32x1x8_8x8x1_1x1_intrawave_v3,0.0,301.01,825.42
304,368,6144,1024,15,0,13.9874,a8w8_rowwise_256x128x64x256_32x32_2x1_16x16x1_16x16x1_1x32x1x8_8x8x1_1x1_intrawave_v3,0.0,331.05,800.03
304,368,6144,1536,15,0,18.2595,a8w8_rowwise_256x128x64x256_32x32_2x1_16x16x1_16x16x1_1x32x1x8_8x8x1_1x1_intrawave_v3,0.0,380.39,795.44
304,368,6144,2048,15,0,21.1813,a8w8_rowwise_256x128x64x256_32x32_2x1_16x16x1_16x16x1_1x32x1x8_8x8x1_1x1_intrawave_v3,0.0,437.23,843.13
304,368,7168,256,69,0,10.1369,a8w8_rowwise_128x16x32x128_16x16_1x1_8x16x1_8x16x1_1x16x1x8_4x4x1_1x1_interwave_v1,0.0,133.23,710.76
304,368,7168,2304,14,0,25.2337,a8w8_rowwise_256x128x96x256_32x32_1x3_16x16x1_16x16x1_1x64x1x4_8x8x1_1x1_intrawave_v3,0.0,481.7,897.16
304,376,192,7168,34,0,14.1911,a8w8_rowwise_256x16x64x512_16x16_1x1_32x8x1_32x8x1_1x16x1x16_4x4x1_1x1_intrawave_v3,0.0,72.93,297.07
304,376,512,7168,34,0,14.8915,a8w8_rowwise_256x16x64x512_16x16_1x1_32x8x1_32x8x1_1x16x1x16_4x4x1_1x1_intrawave_v3,0.0,185.33,453.29
304,376,896,5120,30,0,14.5618,a8w8_rowwise_256x32x64x512_16x16_1x2_32x8x1_32x8x1_1x32x1x8_8x8x1_1x2_intrawave_v3,0.0,236.91,493.51
304,376,1024,5632,30,0,17.2678,a8w8_rowwise_256x32x64x512_16x16_1x2_32x8x1_32x8x1_1x32x1x8_8x8x1_1x2_intrawave_v3,0.0,251.16,501.21
304,376,1056,1408,76,0,7.3192,a8w8_rowwise_128x32x16x128_16x16_1x1_8x16x1_8x16x1_1x16x1x8_2x2x1_1x1_interwave_v2,0.0,152.76,383.97
304,376,1280,4096,30,0,14.7514,a8w8_rowwise_256x32x64x512_16x16_1x2_32x8x1_32x8x1_1x32x1x8_8x8x1_1x2_intrawave_v3,0.0,267.27,525.07
304,376,1408,352,69,0,4.9852,a8w8_rowwise_128x16x32x128_16x16_1x1_8x16x1_8x16x1_1x16x1x8_4x4x1_1x1_interwave_v1,0.0,74.76,338.36
304,376,1408,1408,30,0,8.5546,a8w8_rowwise_256x32x64x512_16x16_1x2_32x8x1_32x8x1_1x32x1x8_8x8x1_1x2_intrawave_v3,0.0,174.27,417.4
304,376,1536,2048,30,0,10.1991,a8w8_rowwise_256x32x64x512_16x16_1x2_32x8x1_32x8x1_1x32x1x8_8x8x1_1x2_intrawave_v3,0.0,231.94,497.19
304,376,1792,6144,28,0,27.7273,a8w8_rowwise_256x32x128x256_32x32_1x1_16x16x1_16x16x1_1x32x1x8_8x8x1_1x1_intrawave_v3,0.0,298.61,529.0
304,376,2048,1536,23,0,10.7152,a8w8_rowwise_256x64x64x512_32x32_1x1_32x8x1_32x8x1_1x32x1x8_8x8x1_1x1_intrawave_v3,0.0,220.77,491.21
304,376,2048,6144,28,0,29.4789,a8w8_rowwise_256x32x128x256_32x32_1x1_16x16x1_16x16x1_1x32x1x8_8x8x1_1x1_intrawave_v3,0.0,320.99,557.45
304,376,3072,4096,28,0,25.5963,a8w8_rowwise_256x32x128x256_32x32_1x1_16x16x1_16x16x1_1x32x1x8_8x8x1_1x1_intrawave_v3,0.0,369.68,642.01
304,376,3584,6144,21,0,40.2198,a8w8_rowwise_256x64x128x256_32x32_1x2_16x16x1_16x16x1_1x32x1x8_8x8x1_1x1_intrawave_v3,0.0,411.72,671.94
304,376,4096,640,45,0,8.8662,a8w8_rowwise_256x128x64x128_32x32_2x1_8x32x1_8x32x1_1x32x1x8_8x8x1_1x1_intrawave_v3,0.0,222.34,670.22
304,376,4096,1024,22,0,11.8187,a8w8_rowwise_256x64x96x256_16x16_2x3_16x16x1_16x16x1_1x64x1x4_8x8x1_2x1_intrawave_v3,0.0,266.88,648.08
304,376,4096,3072,15,0,24.0184,a8w8_rowwise_256x128x64x256_32x32_2x1_16x16x1_16x16x1_1x32x1x8_8x8x1_1x1_intrawave_v3,0.0,393.96,700.22
304,376,5120,640,47,0,10.0135,a8w8_rowwise_256x64x64x128_32x32_1x1_8x32x1_8x32x1_1x32x1x8_8x8x1_1x1_intrawave_v3,0.0,246.08,735.77
304,376,5120,2048,15,0,19.509,a8w8_rowwise_256x128x64x256_32x32_2x1_16x16x1_16x16x1_1x32x1x8_8x8x1_1x1_intrawave_v3,0.0,404.19,774.31
304,376,6144,768,47,0,11.5822,a8w8_rowwise_256x64x64x128_32x32_1x1_8x32x1_8x32x1_1x32x1x8_8x8x1_1x1_intrawave_v3,0.0,306.37,831.25
304,376,6144,1024,15,0,14.0439,a8w8_rowwise_256x128x64x256_32x32_2x1_16x16x1_16x16x1_1x32x1x8_8x8x1_1x1_intrawave_v3,0.0,336.88,804.39
304,376,6144,1536,15,0,18.3435,a8w8_rowwise_256x128x64x256_32x32_2x1_16x16x1_16x16x1_1x32x1x8_8x8x1_1x1_intrawave_v3,0.0,386.88,797.83
304,376,6144,2048,15,0,21.4056,a8w8_rowwise_256x128x64x256_32x32_2x1_16x16x1_16x16x1_1x32x1x8_8x8x1_1x1_intrawave_v3,0.0,442.05,839.65
304,376,7168,256,44,0,10.1726,a8w8_rowwise_256x128x128x128_32x32_2x2_8x32x1_8x32x1_1x32x1x8_8x8x1_1x1_interwave_v1,0.0,135.65,719.74
304,376,7168,2304,14,0,25.4254,a8w8_rowwise_256x128x96x256_32x32_1x3_16x16x1_16x16x1_1x64x1x4_8x8x1_1x1_intrawave_v3,0.0,488.46,895.63
304,384,192,7168,34,0,12.1067,a8w8_rowwise_256x16x64x512_16x16_1x1_32x8x1_32x8x1_1x16x1x16_4x4x1_1x1_intrawave_v3,0.0,87.3,353.21
304,384,512,7168,34,0,14.2097,a8w8_rowwise_256x16x64x512_16x16_1x1_32x8x1_32x8x1_1x16x1x16_4x4x1_1x1_intrawave_v3,0.0,198.36,479.65
304,384,896,5120,30,0,13.5669,a8w8_rowwise_256x32x64x512_16x16_1x2_32x8x1_32x8x1_1x32x1x8_8x8x1_1x2_intrawave_v3,0.0,259.69,533.78
304,384,1024,5632,30,0,15.0198,a8w8_rowwise_256x32x64x512_16x16_1x2_32x8x1_32x8x1_1x32x1x8_8x8x1_1x2_intrawave_v3,0.0,294.89,580.32
304,384,1056,1408,76,0,6.9154,a8w8_rowwise_128x32x16x128_16x16_1x1_8x16x1_8x16x1_1x16x1x8_2x2x1_1x1_interwave_v2,0.0,165.12,410.46
304,384,1280,4096,30,0,14.0349,a8w8_rowwise_256x32x64x512_16x16_1x2_32x8x1_32x8x1_1x32x1x8_8x8x1_1x2_intrawave_v3,0.0,286.89,555.67
304,384,1408,352,69,0,4.9887,a8w8_rowwise_128x16x32x128_16x16_1x1_8x16x1_8x16x1_1x16x1x8_4x4x1_1x1_interwave_v1,0.0,76.3,343.2
304,384,1408,1408,75,0,8.0547,a8w8_rowwise_128x64x16x128_16x16_2x1_8x16x1_8x16x1_1x16x1x8_2x2x1_1x1_interwave_v2,0.0,189.02,447.5
304,384,1536,2048,30,0,9.6845,a8w8_rowwise_256x32x64x512_16x16_1x2_32x8x1_32x8x1_1x32x1x8_8x8x1_1x2_intrawave_v3,0.0,249.46,527.83
304,384,1792,6144,23,0,22.2418,a8w8_rowwise_256x64x64x512_32x32_1x1_32x8x1_32x8x1_1x32x1x8_8x8x1_1x1_intrawave_v3,0.0,380.17,662.97
304,384,2048,1536,23,0,9.7331,a8w8_rowwise_256x64x64x512_32x32_1x1_32x8x1_32x8x1_1x32x1x8_8x8x1_1x1_intrawave_v3,0.0,248.22,545.4
304,384,2048,6144,23,0,23.4474,a8w8_rowwise_256x64x64x512_32x32_1x1_32x8x1_32x8x1_1x32x1x8_8x8x1_1x1_intrawave_v3,0.0,412.14,704.35
304,384,3072,4096,23,0,21.4505,a8w8_rowwise_256x64x64x512_32x32_1x1_32x8x1_32x8x1_1x32x1x8_8x8x1_1x1_intrawave_v3,0.0,450.51,769.92
304,384,3584,6144,15,0,38.6791,a8w8_rowwise_256x128x64x256_32x32_2x1_16x16x1_16x16x1_1x32x1x8_8x8x1_1x1_intrawave_v3,0.0,437.22,701.46
304,384,4096,640,45,0,8.7288,a8w8_rowwise_256x128x64x128_32x32_2x1_8x32x1_8x32x1_1x32x1x8_8x8x1_1x1_intrawave_v3,0.0,230.65,688.86
304,384,4096,1024,15,0,11.7075,a8w8_rowwise_256x128x64x256_32x32_2x1_16x16x1_16x16x1_1x32x1x8_8x8x1_1x1_intrawave_v3,0.0,275.14,660.54
304,384,4096,3072,15,0,23.2423,a8w8_rowwise_256x128x64x256_32x32_2x1_16x16x1_16x16x1_1x32x1x8_8x8x1_1x1_intrawave_v3,0.0,415.78,727.48
304,384,5120,640,47,0,9.814,a8w8_rowwise_256x64x64x128_32x32_1x1_8x32x1_8x32x1_1x32x1x8_8x8x1_1x1_intrawave_v3,0.0,256.43,759.6
304,384,5120,2048,15,0,19.0152,a8w8_rowwise_256x128x64x256_32x32_2x1_16x16x1_16x16x1_1x32x1x8_8x8x1_1x1_intrawave_v3,0.0,423.51,799.59
304,384,6144,768,15,0,11.4474,a8w8_rowwise_256x128x64x256_32x32_2x1_16x16x1_16x16x1_1x32x1x8_8x8x1_1x1_intrawave_v3,0.0,316.57,850.16
304,384,6144,1024,15,0,13.6373,a8w8_rowwise_256x128x64x256_32x32_2x1_16x16x1_16x16x1_1x32x1x8_8x8x1_1x1_intrawave_v3,0.0,354.31,836.18
304,384,6144,1536,15,0,18.2375,a8w8_rowwise_256x128x64x256_32x32_2x1_16x16x1_16x16x1_1x32x1x8_8x8x1_1x1_intrawave_v3,0.0,397.41,808.53
304,384,6144,2048,15,0,20.6586,a8w8_rowwise_256x128x64x256_32x32_2x1_16x16x1_16x16x1_1x32x1x8_8x8x1_1x1_intrawave_v3,0.0,467.78,875.56
304,384,7168,256,36,0,10.0692,a8w8_rowwise_256x128x128x64_32x32_2x2_4x64x1_4x64x1_1x32x1x8_8x8x1_1x1_intrawave_v4,0.0,139.96,738.72
304,384,7168,2304,14,0,25.3018,a8w8_rowwise_256x128x96x256_32x32_1x3_16x16x1_16x16x1_1x64x1x4_8x8x1_1x1_intrawave_v3,0.0,501.29,905.26
304,392,192,7168,34,0,14.2516,a8w8_rowwise_256x16x64x512_16x16_1x1_32x8x1_32x8x1_1x16x1x16_4x4x1_1x1_intrawave_v3,0.0,75.71,304.29
304,392,512,7168,34,0,15.2874,a8w8_rowwise_256x16x64x512_16x16_1x1_32x8x1_32x8x1_1x16x1x16_4x4x1_1x1_intrawave_v3,0.0,188.21,450.13
304,392,896,5120,30,0,14.9151,a8w8_rowwise_256x32x64x512_16x16_1x2_32x8x1_32x8x1_1x32x1x8_8x8x1_1x2_intrawave_v3,0.0,241.14,489.24
304,392,1024,5632,30,0,18.0323,a8w8_rowwise_256x32x64x512_16x16_1x2_32x8x1_32x8x1_1x32x1x8_8x8x1_1x2_intrawave_v3,0.0,250.74,486.78
304,392,1056,1408,30,0,7.4192,a8w8_rowwise_256x32x64x512_16x16_1x2_32x8x1_32x8x1_1x32x1x8_8x8x1_1x2_intrawave_v3,0.0,157.12,386.39
304,392,1280,4096,30,0,14.7998,a8w8_rowwise_256x32x64x512_16x16_1x2_32x8x1_32x8x1_1x32x1x8_8x8x1_1x2_intrawave_v3,0.0,277.73,530.55
304,392,1408,352,69,0,5.0617,a8w8_rowwise_128x16x32x128_16x16_1x1_8x16x1_8x16x1_1x16x1x8_4x4x1_1x1_interwave_v1,0.0,76.77,343.26
304,392,1408,1408,30,0,8.8774,a8w8_rowwise_256x32x64x512_16x16_1x2_32x8x1_32x8x1_1x32x1x8_8x8x1_1x2_intrawave_v3,0.0,175.08,409.84
304,392,1536,2048,28,0,11.768,a8w8_rowwise_256x32x128x256_32x32_1x1_16x16x1_16x16x1_1x32x1x8_8x8x1_1x1_intrawave_v3,0.0,209.57,437.86
304,392,1792,6144,28,0,28.5243,a8w8_rowwise_256x32x128x256_32x32_1x1_16x16x1_16x16x1_1x32x1x8_8x8x1_1x1_intrawave_v3,0.0,302.61,519.68
304,392,2048,1536,28,0,11.1226,a8w8_rowwise_256x32x128x256_32x32_1x1_16x16x1_16x16x1_1x32x1x8_8x8x1_1x1_intrawave_v3,0.0,221.73,481.31
304,392,2048,6144,28,0,30.5069,a8w8_rowwise_256x32x128x256_32x32_1x1_16x16x1_16x16x1_1x32x1x8_8x8x1_1x1_intrawave_v3,0.0,323.37,544.04
304,392,3072,4096,21,0,27.5065,a8w8_rowwise_256x64x128x256_32x32_1x2_16x16x1_16x16x1_1x32x1x8_8x8x1_1x1_intrawave_v3,0.0,358.64,603.38
304,392,3584,6144,21,0,42.7833,a8w8_rowwise_256x64x128x256_32x32_1x2_16x16x1_16x16x1_1x32x1x8_8x8x1_1x1_intrawave_v3,0.0,403.52,636.66
304,392,4096,640,46,0,9.3402,a8w8_rowwise_256x64x128x128_32x32_1x2_8x32x1_8x32x1_1x32x1x8_8x8x1_1x1_intrawave_v3,0.0,220.04,651.33
304,392,4096,1024,22,0,11.9748,a8w8_rowwise_256x64x96x256_16x16_2x3_16x16x1_16x16x1_1x64x1x4_8x8x1_2x1_intrawave_v3,0.0,274.6,651.95
304,392,4096,3072,21,0,25.1122,a8w8_rowwise_256x64x128x256_32x32_1x2_16x16x1_16x16x1_1x32x1x8_8x8x1_1x1_intrawave_v3,0.0,392.84,676.9
304,392,5120,640,47,0,10.0151,a8w8_rowwise_256x64x64x128_32x32_1x1_8x32x1_8x32x1_1x32x1x8_8x8x1_1x1_intrawave_v3,0.0,256.51,753.04
304,392,5120,2048,21,0,20.7987,a8w8_rowwise_256x64x128x256_32x32_1x2_16x16x1_16x16x1_1x32x1x8_8x8x1_1x1_intrawave_v3,0.0,395.26,735.75
304,392,6144,768,14,0,13.2014,a8w8_rowwise_256x128x96x256_32x32_1x3_16x16x1_16x16x1_1x64x1x4_8x8x1_1x1_intrawave_v3,0.0,280.23,745.11
304,392,6144,1024,14,0,15.4483,a8w8_rowwise_256x128x96x256_32x32_1x3_16x16x1_16x16x1_1x64x1x4_8x8x1_1x1_intrawave_v3,0.0,319.29,745.05
304,392,6144,1536,14,0,20.227,a8w8_rowwise_256x128x96x256_32x32_1x3_16x16x1_16x16x1_1x64x1x4_8x8x1_1x1_intrawave_v3,0.0,365.79,734.47
304,392,6144,2048,14,0,24.189,a8w8_rowwise_256x128x96x256_32x32_1x3_16x16x1_16x16x1_1x64x1x4_8x8x1_1x1_intrawave_v3,0.0,407.83,752.52
304,392,7168,256,36,0,10.2296,a8w8_rowwise_256x128x128x64_32x32_2x2_4x64x1_4x64x1_1x32x1x8_8x8x1_1x1_intrawave_v4,0.0,140.64,738.55
304,392,7168,2304,14,0,27.3517,a8w8_rowwise_256x128x96x256_32x32_1x3_16x16x1_16x16x1_1x64x1x4_8x8x1_1x1_intrawave_v3,0.0,473.38,842.29
304,400,192,7168,34,0,12.1785,a8w8_rowwise_256x16x64x512_16x16_1x1_32x8x1_32x8x1_1x16x1x16_4x4x1_1x1_intrawave_v3,0.0,90.41,361.05
304,400,512,7168,34,0,14.2931,a8w8_rowwise_256x16x64x512_16x16_1x1_32x8x1_32x8x1_1x16x1x16_4x4x1_1x1_intrawave_v3,0.0,205.41,486.03
304,400,896,5120,30,0,14.4843,a8w8_rowwise_256x32x64x512_16x16_1x2_32x8x1_32x8x1_1x32x1x8_8x8x1_1x2_intrawave_v3,0.0,253.38,507.61
304,400,1024,5632,30,0,17.6764,a8w8_rowwise_256x32x64x512_16x16_1x2_32x8x1_32x8x1_1x32x1x8_8x8x1_1x2_intrawave_v3,0.0,261.01,500.05
304,400,1056,1408,30,0,7.4218,a8w8_rowwise_256x32x64x512_16x16_1x2_32x8x1_32x8x1_1x32x1x8_8x8x1_1x2_intrawave_v3,0.0,160.27,390.05
304,400,1280,4096,30,0,14.4646,a8w8_rowwise_256x32x64x512_16x16_1x2_32x8x1_32x8x1_1x32x1x8_8x8x1_1x2_intrawave_v3,0.0,289.97,546.53
304,400,1408,352,50,0,5.0396,a8w8_rowwise_128x16x32x128_16x16_1x1_8x16x1_8x16x1_1x16x1x8_4x4x1_1x1_intrawave_v1,0.0,78.68,349.79
304,400,1408,1408,30,0,8.8481,a8w8_rowwise_256x32x64x512_16x16_1x2_32x8x1_32x8x1_1x32x1x8_8x8x1_1x2_intrawave_v3,0.0,179.24,415.01
304,400,1536,2048,28,0,11.8648,a8w8_rowwise_256x32x128x256_32x32_1x1_16x16x1_16x16x1_1x32x1x8_8x8x1_1x1_intrawave_v3,0.0,212.1,437.74
304,400,1792,6144,28,0,28.6965,a8w8_rowwise_256x32x128x256_32x32_1x1_16x16x1_16x16x1_1x32x1x8_8x8x1_1x1_intrawave_v3,0.0,306.94,519.27
304,400,2048,1536,28,0,11.1482,a8w8_rowwise_256x32x128x256_32x32_1x1_16x16x1_16x16x1_1x32x1x8_8x8x1_1x1_intrawave_v3,0.0,225.74,484.25
304,400,2048,6144,28,0,30.6807,a8w8_rowwise_256x32x128x256_32x32_1x1_16x16x1_16x16x1_1x32x1x8_8x8x1_1x1_intrawave_v3,0.0,328.1,543.63
304,400,3072,4096,21,0,27.5571,a8w8_rowwise_256x64x128x256_32x32_1x2_16x16x1_16x16x1_1x32x1x8_8x8x1_1x1_intrawave_v3,0.0,365.29,605.25
304,400,3584,6144,21,0,41.9391,a8w8_rowwise_256x64x128x256_32x32_1x2_16x16x1_16x16x1_1x32x1x8_8x8x1_1x1_intrawave_v3,0.0,420.04,652.01
304,400,4096,640,46,0,9.3936,a8w8_rowwise_256x64x128x128_32x32_1x2_8x32x1_8x32x1_1x32x1x8_8x8x1_1x1_intrawave_v3,0.0,223.25,655.15
304,400,4096,1024,22,0,11.9958,a8w8_rowwise_256x64x96x256_16x16_2x3_16x16x1_16x16x1_1x64x1x4_8x8x1_2x1_intrawave_v3,0.0,279.72,656.96
304,400,4096,3072,22,0,25.2002,a8w8_rowwise_256x64x96x256_16x16_2x3_16x16x1_16x16x1_1x64x1x4_8x8x1_2x1_intrawave_v3,0.0,399.45,678.11
304,400,5120,640,47,0,10.0552,a8w8_rowwise_256x64x64x128_32x32_1x1_8x32x1_8x32x1_1x32x1x8_8x8x1_1x1_intrawave_v3,0.0,260.7,758.69
304,400,5120,2048,21,0,20.9118,a8w8_rowwise_256x64x128x256_32x32_1x2_16x16x1_16x16x1_1x32x1x8_8x8x1_1x1_intrawave_v3,0.0,401.14,736.47
304,400,6144,768,14,0,13.2794,a8w8_rowwise_256x128x96x256_32x32_1x3_16x16x1_16x16x1_1x64x1x4_8x8x1_1x1_intrawave_v3,0.0,284.27,748.6
304,400,6144,1024,14,0,16.3979,a8w8_rowwise_256x128x96x256_32x32_1x3_16x16x1_16x16x1_1x64x1x4_8x8x1_1x1_intrawave_v3,0.0,306.94,708.4
304,400,6144,1536,14,0,20.1536,a8w8_rowwise_256x128x96x256_32x32_1x3_16x16x1_16x16x1_1x64x1x4_8x8x1_1x1_intrawave_v3,0.0,374.61,742.64
304,400,6144,2048,14,0,24.32,a8w8_rowwise_256x128x96x256_32x32_1x3_16x16x1_16x16x1_1x64x1x4_8x8x1_1x1_intrawave_v3,0.0,413.91,753.18
304,400,7168,256,36,0,10.2084,a8w8_rowwise_256x128x128x64_32x32_2x2_4x64x1_4x64x1_1x32x1x8_8x8x1_1x1_intrawave_v4,0.0,143.8,751.52
304,400,7168,2304,14,0,27.7404,a8w8_rowwise_256x128x96x256_32x32_1x3_16x16x1_16x16x1_1x64x1x4_8x8x1_1x1_intrawave_v3,0.0,476.27,835.28
304,408,192,7168,34,0,14.2242,a8w8_rowwise_256x16x64x512_16x16_1x1_32x8x1_32x8x1_1x16x1x16_4x4x1_1x1_intrawave_v3,0.0,78.95,313.37
304,408,512,7168,34,0,16.935,a8w8_rowwise_256x16x64x512_16x16_1x1_32x8x1_32x8x1_1x16x1x16_4x4x1_1x1_intrawave_v3,0.0,176.84,414.07
304,408,896,5120,30,0,14.786,a8w8_rowwise_256x32x64x512_16x16_1x2_32x8x1_32x8x1_1x32x1x8_8x8x1_1x2_intrawave_v3,0.0,253.17,500.99
304,408,1024,5632,30,0,18.1164,a8w8_rowwise_256x32x64x512_16x16_1x2_32x8x1_32x8x1_1x32x1x8_8x8x1_1x2_intrawave_v3,0.0,259.77,491.3
304,408,1056,1408,30,0,7.4421,a8w8_rowwise_256x32x64x512_16x16_1x2_32x8x1_32x8x1_1x32x1x8_8x8x1_1x2_intrawave_v3,0.0,163.03,392.77
304,408,1280,4096,30,0,15.0222,a8w8_rowwise_256x32x64x512_16x16_1x2_32x8x1_32x8x1_1x32x1x8_8x8x1_1x2_intrawave_v3,0.0,284.79,529.78
304,408,1408,352,69,0,5.0279,a8w8_rowwise_128x16x32x128_16x16_1x1_8x16x1_8x16x1_1x16x1x8_4x4x1_1x1_interwave_v1,0.0,80.44,355.65
304,408,1408,1408,30,0,8.8903,a8w8_rowwise_256x32x64x512_16x16_1x2_32x8x1_32x8x1_1x32x1x8_8x8x1_1x2_intrawave_v3,0.0,181.96,416.84
304,408,1536,2048,28,0,11.9608,a8w8_rowwise_256x32x128x256_32x32_1x1_16x16x1_16x16x1_1x32x1x8_8x8x1_1x1_intrawave_v3,0.0,214.61,437.65
304,408,1792,6144,28,0,28.945,a8w8_rowwise_256x32x128x256_32x32_1x1_16x16x1_16x16x1_1x32x1x8_8x8x1_1x1_intrawave_v3,0.0,310.39,517.5
304,408,2048,1536,28,0,11.112,a8w8_rowwise_256x32x128x256_32x32_1x1_16x16x1_16x16x1_1x32x1x8_8x8x1_1x1_intrawave_v3,0.0,231.0,489.88
304,408,2048,6144,28,0,30.8081,a8w8_rowwise_256x32x128x256_32x32_1x1_16x16x1_16x16x1_1x32x1x8_8x8x1_1x1_intrawave_v3,0.0,333.28,544.04
304,408,3072,4096,22,0,27.7396,a8w8_rowwise_256x64x96x256_16x16_2x3_16x16x1_16x16x1_1x64x1x4_8x8x1_2x1_intrawave_v3,0.0,370.14,604.22
304,408,3584,6144,21,0,43.624,a8w8_rowwise_256x64x128x256_32x32_1x2_16x16x1_16x16x1_1x32x1x8_8x8x1_1x1_intrawave_v3,0.0,411.89,629.27
304,408,4096,640,47,0,9.7228,a8w8_rowwise_256x64x64x128_32x32_1x1_8x32x1_8x32x1_1x32x1x8_8x8x1_1x1_intrawave_v3,0.0,220.01,640.24
304,408,4096,1024,22,0,12.1627,a8w8_rowwise_256x64x96x256_16x16_2x3_16x16x1_16x16x1_1x64x1x4_8x8x1_2x1_intrawave_v3,0.0,281.4,654.0
304,408,4096,3072,21,0,25.3773,a8w8_rowwise_256x64x128x256_32x32_1x2_16x16x1_16x16x1_1x32x1x8_8x8x1_1x1_intrawave_v3,0.0,404.6,676.93
304,408,5120,640,47,0,10.1982,a8w8_rowwise_256x64x64x128_32x32_1x1_8x32x1_8x32x1_1x32x1x8_8x8x1_1x1_intrawave_v3,0.0,262.19,756.59
304,408,5120,2048,21,0,21.0835,a8w8_rowwise_256x64x128x256_32x32_1x2_16x16x1_16x16x1_1x32x1x8_8x8x1_1x1_intrawave_v3,0.0,405.83,735.14
304,408,6144,768,14,0,13.26,a8w8_rowwise_256x128x96x256_32x32_1x3_16x16x1_16x16x1_1x64x1x4_8x8x1_1x1_intrawave_v3,0.0,290.37,757.57
304,408,6144,1024,14,0,16.1763,a8w8_rowwise_256x128x96x256_32x32_1x3_16x16x1_16x16x1_1x64x1x4_8x8x1_1x1_intrawave_v3,0.0,317.37,724.69
304,408,6144,1536,14,0,20.2991,a8w8_rowwise_256x128x96x256_32x32_1x3_16x16x1_16x16x1_1x64x1x4_8x8x1_1x1_intrawave_v3,0.0,379.36,742.76
304,408,6144,2048,14,0,24.4294,a8w8_rowwise_256x128x96x256_32x32_1x3_16x16x1_16x16x1_1x64x1x4_8x8x1_1x1_intrawave_v3,0.0,420.3,754.5
304,408,7168,256,44,0,10.3082,a8w8_rowwise_256x128x128x128_32x32_2x2_8x32x1_8x32x1_1x32x1x8_8x8x1_1x1_interwave_v1,0.0,145.26,755.57
304,408,7168,2304,14,0,27.8381,a8w8_rowwise_256x128x96x256_32x32_1x3_16x16x1_16x16x1_1x64x1x4_8x8x1_1x1_intrawave_v3,0.0,484.1,837.13
304,416,192,7168,34,0,12.2188,a8w8_rowwise_256x16x64x512_16x16_1x1_32x8x1_32x8x1_1x16x1x16_4x4x1_1x1_intrawave_v3,0.0,93.71,369.75
304,416,512,7168,34,0,14.4749,a8w8_rowwise_256x16x64x512_16x16_1x1_32x8x1_32x8x1_1x16x1x16_4x4x1_1x1_intrawave_v3,0.0,210.95,488.98
304,416,896,5120,30,0,14.4483,a8w8_rowwise_256x32x64x512_16x16_1x2_32x8x1_32x8x1_1x32x1x8_8x8x1_1x2_intrawave_v3,0.0,264.17,516.53
304,416,1024,5632,30,0,15.7373,a8w8_rowwise_256x32x64x512_16x16_1x2_32x8x1_32x8x1_1x32x1x8_8x8x1_1x2_intrawave_v3,0.0,304.9,569.48
304,416,1056,1408,57,0,7.2411,a8w8_rowwise_128x32x16x128_16x16_1x1_8x16x1_8x16x1_1x16x1x8_2x2x1_1x1_intrawave_v2,0.0,170.84,407.56
304,416,1280,4096,30,0,14.64,a8w8_rowwise_256x32x64x512_16x16_1x2_32x8x1_32x8x1_1x32x1x8_8x8x1_1x2_intrawave_v3,0.0,297.96,547.25
304,416,1408,352,50,0,5.0209,a8w8_rowwise_128x16x32x128_16x16_1x1_8x16x1_8x16x1_1x16x1x8_4x4x1_1x1_intrawave_v1,0.0,82.13,361.19
304,416,1408,1408,62,0,8.4167,a8w8_rowwise_128x32x64x128_32x32_1x1_8x16x1_8x16x1_1x16x1x8_8x8x1_1x1_intrawave_v2,0.0,195.97,444.31
304,416,1536,2048,29,0,11.6187,a8w8_rowwise_256x32x96x256_16x16_1x3_16x16x1_16x16x1_1x32x1x8_4x4x1_1x1_intrawave_v3,0.0,225.26,454.07
304,416,1792,6144,28,0,27.6094,a8w8_rowwise_256x32x128x256_32x32_1x1_16x16x1_16x16x1_1x32x1x8_8x8x1_1x1_intrawave_v3,0.0,331.78,545.35
304,416,2048,1536,28,0,10.9062,a8w8_rowwise_256x32x128x256_32x32_1x1_16x16x1_16x16x1_1x32x1x8_8x8x1_1x1_intrawave_v3,0.0,239.98,503.26
304,416,2048,6144,28,0,29.2034,a8w8_rowwise_256x32x128x256_32x32_1x1_16x16x1_16x16x1_1x32x1x8_8x8x1_1x1_intrawave_v3,0.0,358.49,576.74
304,416,3072,4096,22,0,27.4195,a8w8_rowwise_256x64x96x256_16x16_2x3_16x16x1_16x16x1_1x64x1x4_8x8x1_2x1_intrawave_v3,0.0,381.81,614.26
304,416,3584,6144,21,0,43.3137,a8w8_rowwise_256x64x128x256_32x32_1x2_16x16x1_16x16x1_1x32x1x8_8x8x1_1x1_intrawave_v3,0.0,422.98,636.24
304,416,4096,640,46,0,9.4555,a8w8_rowwise_256x64x128x128_32x32_1x2_8x32x1_8x32x1_1x32x1x8_8x8x1_1x1_intrawave_v3,0.0,230.66,665.81
304,416,4096,1024,22,0,12.2083,a8w8_rowwise_256x64x96x256_16x16_2x3_16x16x1_16x16x1_1x64x1x4_8x8x1_2x1_intrawave_v3,0.0,285.84,657.6
304,416,4096,3072,22,0,25.1205,a8w8_rowwise_256x64x96x256_16x16_2x3_16x16x1_16x16x1_1x64x1x4_8x8x1_2x1_intrawave_v3,0.0,416.75,687.44
304,416,5120,640,47,0,10.1247,a8w8_rowwise_256x64x64x128_32x32_1x1_8x32x1_8x32x1_1x32x1x8_8x8x1_1x1_intrawave_v3,0.0,269.27,770.68
304,416,5120,2048,21,0,20.8633,a8w8_rowwise_256x64x128x256_32x32_1x2_16x16x1_16x16x1_1x32x1x8_8x8x1_1x1_intrawave_v3,0.0,418.16,747.61
304,416,6144,768,14,0,13.2548,a8w8_rowwise_256x128x96x256_32x32_1x3_16x16x1_16x16x1_1x64x1x4_8x8x1_1x1_intrawave_v3,0.0,296.18,765.75
304,416,6144,1024,14,0,15.9075,a8w8_rowwise_256x128x96x256_32x32_1x3_16x16x1_16x16x1_1x64x1x4_8x8x1_1x1_intrawave_v3,0.0,329.06,743.63
304,416,6144,1536,14,0,20.4958,a8w8_rowwise_256x128x96x256_32x32_1x3_16x16x1_16x16x1_1x64x1x4_8x8x1_1x1_intrawave_v3,0.0,383.09,741.03
304,416,6144,2048,14,0,24.3127,a8w8_rowwise_256x128x96x256_32x32_1x3_16x16x1_16x16x1_1x64x1x4_8x8x1_1x1_intrawave_v3,0.0,430.6,762.84
304,416,7168,256,36,0,10.3223,a8w8_rowwise_256x128x128x64_32x32_2x2_4x64x1_4x64x1_1x32x1x8_8x8x1_1x1_intrawave_v4,0.0,147.91,765.84
304,416,7168,2304,14,0,28.0096,a8w8_rowwise_256x128x96x256_32x32_1x3_16x16x1_16x16x1_1x64x1x4_8x8x1_1x1_intrawave_v3,0.0,490.57,836.76
304,424,192,7168,34,0,14.2715,a8w8_rowwise_256x16x64x512_16x16_1x1_32x8x1_32x8x1_1x16x1x16_4x4x1_1x1_intrawave_v3,0.0,81.78,320.8
304,424,512,7168,34,0,17.0196,a8w8_rowwise_256x16x64x512_16x16_1x1_32x8x1_32x8x1_1x16x1x16_4x4x1_1x1_intrawave_v3,0.0,182.86,419.72
304,424,896,5120,30,0,15.3026,a8w8_rowwise_256x32x64x512_16x16_1x2_32x8x1_32x8x1_1x32x1x8_8x8x1_1x2_intrawave_v3,0.0,254.22,491.3
304,424,1024,5632,30,0,18.1156,a8w8_rowwise_256x32x64x512_16x16_1x2_32x8x1_32x8x1_1x32x1x8_8x8x1_1x2_intrawave_v3,0.0,269.96,498.11
304,424,1056,1408,30,0,7.5739,a8w8_rowwise_256x32x64x512_16x16_1x2_32x8x1_32x8x1_1x32x1x8_8x8x1_1x2_intrawave_v3,0.0,166.47,393.37
304,424,1280,4096,30,0,14.7802,a8w8_rowwise_256x32x64x512_16x16_1x2_32x8x1_32x8x1_1x32x1x8_8x8x1_1x2_intrawave_v3,0.0,300.81,545.66
304,424,1408,352,50,0,5.1142,a8w8_rowwise_128x16x32x128_16x16_1x1_8x16x1_8x16x1_1x16x1x8_4x4x1_1x1_intrawave_v1,0.0,82.18,359.56
304,424,1408,1408,28,0,9.1589,a8w8_rowwise_256x32x128x256_32x32_1x1_16x16x1_16x16x1_1x32x1x8_8x8x1_1x1_intrawave_v3,0.0,183.55,412.0
304,424,1536,2048,23,0,12.2796,a8w8_rowwise_256x64x64x512_32x32_1x1_32x8x1_32x8x1_1x32x1x8_8x8x1_1x1_intrawave_v3,0.0,217.24,432.96
304,424,1792,6144,28,0,29.5299,a8w8_rowwise_256x32x128x256_32x32_1x1_16x16x1_16x16x1_1x32x1x8_8x8x1_1x1_intrawave_v3,0.0,316.17,512.52
304,424,2048,1536,47,0,11.3246,a8w8_rowwise_256x64x64x128_32x32_1x1_8x32x1_8x32x1_1x32x1x8_8x8x1_1x1_intrawave_v3,0.0,235.56,488.64
304,424,2048,6144,28,0,31.2993,a8w8_rowwise_256x32x128x256_32x32_1x1_16x16x1_16x16x1_1x32x1x8_8x8x1_1x1_intrawave_v3,0.0,340.91,540.74
304,424,3072,4096,21,0,27.8922,a8w8_rowwise_256x64x128x256_32x32_1x2_16x16x1_16x16x1_1x32x1x8_8x8x1_1x1_intrawave_v3,0.0,382.56,606.79
304,424,3584,6144,21,0,42.7845,a8w8_rowwise_256x64x128x256_32x32_1x2_16x16x1_16x16x1_1x32x1x8_8x8x1_1x1_intrawave_v3,0.0,436.44,646.6
304,424,4096,640,46,0,9.5337,a8w8_rowwise_256x64x128x128_32x32_1x2_8x32x1_8x32x1_1x32x1x8_8x8x1_1x1_intrawave_v3,0.0,233.17,667.76
304,424,4096,1024,22,0,12.2324,a8w8_rowwise_256x64x96x256_16x16_2x3_16x16x1_16x16x1_1x64x1x4_8x8x1_2x1_intrawave_v3,0.0,290.77,662.33
304,424,4096,3072,22,0,25.18,a8w8_rowwise_256x64x96x256_16x16_2x3_16x16x1_16x16x1_1x64x1x4_8x8x1_2x1_intrawave_v3,0.0,423.76,689.39
304,424,5120,640,47,0,10.209,a8w8_rowwise_256x64x64x128_32x32_1x1_8x32x1_8x32x1_1x32x1x8_8x8x1_1x1_intrawave_v3,0.0,272.18,772.84
304,424,5120,2048,21,0,20.9225,a8w8_rowwise_256x64x128x256_32x32_1x2_16x16x1_16x16x1_1x32x1x8_8x8x1_1x1_intrawave_v3,0.0,424.99,750.19
304,424,6144,768,14,0,13.2447,a8w8_rowwise_256x128x96x256_32x32_1x3_16x16x1_16x16x1_1x64x1x4_8x8x1_1x1_intrawave_v3,0.0,302.11,774.22
304,424,6144,1024,14,0,16.0093,a8w8_rowwise_256x128x96x256_32x32_1x3_16x16x1_16x16x1_1x64x1x4_8x8x1_1x1_intrawave_v3,0.0,333.25,745.55
304,424,6144,1536,14,0,20.4017,a8w8_rowwise_256x128x96x256_32x32_1x3_16x16x1_16x16x1_1x64x1x4_8x8x1_1x1_intrawave_v3,0.0,392.26,749.87
304,424,6144,2048,14,0,24.4175,a8w8_rowwise_256x128x96x256_32x32_1x3_16x16x1_16x16x1_1x64x1x4_8x8x1_1x1_intrawave_v3,0.0,436.99,764.26
304,424,7168,256,44,0,10.4081,a8w8_rowwise_256x128x128x128_32x32_2x2_8x32x1_8x32x1_1x32x1x8_8x8x1_1x1_interwave_v1,0.0,149.51,770.75
304,424,7168,2304,14,0,27.9058,a8w8_rowwise_256x128x96x256_32x32_1x3_16x16x1_16x16x1_1x64x1x4_8x8x1_1x1_intrawave_v3,0.0,501.86,844.64
304,432,192,7168,34,0,12.1235,a8w8_rowwise_256x16x64x512_16x16_1x1_32x8x1_32x8x1_1x16x1x16_4x4x1_1x1_intrawave_v3,0.0,98.08,382.62
304,432,512,7168,34,0,14.8251,a8w8_rowwise_256x16x64x512_16x16_1x1_32x8x1_32x8x1_1x16x1x16_4x4x1_1x1_intrawave_v3,0.0,213.89,486.27
304,432,896,5120,30,0,14.8991,a8w8_rowwise_256x32x64x512_16x16_1x2_32x8x1_32x8x1_1x32x1x8_8x8x1_1x2_intrawave_v3,0.0,266.03,508.32
304,432,1024,5632,30,0,18.1269,a8w8_rowwise_256x32x64x512_16x16_1x2_32x8x1_32x8x1_1x32x1x8_8x8x1_1x2_intrawave_v3,0.0,274.89,501.18
304,432,1056,1408,30,0,7.7095,a8w8_rowwise_256x32x64x512_16x16_1x2_32x8x1_32x8x1_1x32x1x8_8x8x1_1x2_intrawave_v3,0.0,166.63,390.1
304,432,1280,4096,30,0,15.1536,a8w8_rowwise_256x32x64x512_16x16_1x2_32x8x1_32x8x1_1x32x1x8_8x8x1_1x2_intrawave_v3,0.0,298.93,535.73
304,432,1408,352,50,0,5.1157,a8w8_rowwise_128x16x32x128_16x16_1x1_8x16x1_8x16x1_1x16x1x8_4x4x1_1x1_intrawave_v1,0.0,83.71,364.41
304,432,1408,1408,28,0,9.2803,a8w8_rowwise_256x32x128x256_32x32_1x1_16x16x1_16x16x1_1x32x1x8_8x8x1_1x1_intrawave_v3,0.0,184.57,410.25
304,432,1536,2048,23,0,12.2533,a8w8_rowwise_256x64x64x512_32x32_1x1_32x8x1_32x8x1_1x32x1x8_8x8x1_1x1_intrawave_v3,0.0,221.81,437.23
304,432,1792,6144,28,0,29.7153,a8w8_rowwise_256x32x128x256_32x32_1x1_16x16x1_16x16x1_1x32x1x8_8x8x1_1x1_intrawave_v3,0.0,320.13,511.94
304,432,2048,1536,47,0,11.374,a8w8_rowwise_256x64x64x128_32x32_1x1_8x32x1_8x32x1_1x32x1x8_8x8x1_1x1_intrawave_v3,0.0,238.96,490.48
304,432,2048,6144,28,0,31.3951,a8w8_rowwise_256x32x128x256_32x32_1x1_16x16x1_16x16x1_1x32x1x8_8x8x1_1x1_intrawave_v3,0.0,346.28,541.7
304,432,3072,4096,21,0,27.8818,a8w8_rowwise_256x64x128x256_32x32_1x2_16x16x1_16x16x1_1x32x1x8_8x8x1_1x1_intrawave_v3,0.0,389.92,609.95
304,432,3584,6144,22,0,43.3596,a8w8_rowwise_256x64x96x256_16x16_2x3_16x16x1_16x16x1_1x64x1x4_8x8x1_2x1_intrawave_v3,0.0,438.78,640.48
304,432,4096,640,46,0,9.5788,a8w8_rowwise_256x64x128x128_32x32_1x2_8x32x1_8x32x1_1x32x1x8_8x8x1_1x1_intrawave_v3,0.0,236.45,671.99
304,432,4096,1024,22,0,12.2655,a8w8_rowwise_256x64x96x256_16x16_2x3_16x16x1_16x16x1_1x64x1x4_8x8x1_2x1_intrawave_v3,0.0,295.45,666.55
304,432,4096,3072,21,0,25.5728,a8w8_rowwise_256x64x128x256_32x32_1x2_16x16x1_16x16x1_1x32x1x8_8x8x1_1x1_intrawave_v3,0.0,425.12,682.32
304,432,5120,640,47,0,10.2138,a8w8_rowwise_256x64x64x128_32x32_1x1_8x32x1_8x32x1_1x32x1x8_8x8x1_1x1_intrawave_v3,0.0,277.19,781.0
304,432,5120,2048,21,0,21.0108,a8w8_rowwise_256x64x128x256_32x32_1x2_16x16x1_16x16x1_1x32x1x8_8x8x1_1x1_intrawave_v3,0.0,431.19,751.72
304,432,6144,768,14,0,13.3648,a8w8_rowwise_256x128x96x256_32x32_1x3_16x16x1_16x16x1_1x64x1x4_8x8x1_1x1_intrawave_v3,0.0,305.04,775.08
304,432,6144,1024,14,0,16.0101,a8w8_rowwise_256x128x96x256_32x32_1x3_16x16x1_16x16x1_1x64x1x4_8x8x1_1x1_intrawave_v3,0.0,339.52,752.17
304,432,6144,1536,14,0,20.5429,a8w8_rowwise_256x128x96x256_32x32_1x3_16x16x1_16x16x1_1x64x1x4_8x8x1_1x1_intrawave_v3,0.0,396.91,750.1
304,432,6144,2048,14,0,24.493,a8w8_rowwise_256x128x96x256_32x32_1x3_16x16x1_16x16x1_1x64x1x4_8x8x1_1x1_intrawave_v3,0.0,443.87,766.59
304,432,7168,256,44,0,10.3609,a8w8_rowwise_256x128x128x128_32x32_2x2_8x32x1_8x32x1_1x32x1x8_8x8x1_1x1_interwave_v1,0.0,153.02,785.53
304,432,7168,2304,14,0,28.2648,a8w8_rowwise_256x128x96x256_32x32_1x3_16x16x1_16x16x1_1x64x1x4_8x8x1_1x1_intrawave_v3,0.0,504.83,838.62
304,440,192,7168,34,0,14.2795,a8w8_rowwise_256x16x64x512_16x16_1x1_32x8x1_32x8x1_1x16x1x16_4x4x1_1x1_intrawave_v3,0.0,84.81,329.08
304,440,512,7168,34,0,16.8754,a8w8_rowwise_256x16x64x512_16x16_1x1_32x8x1_32x8x1_1x16x1x16_4x4x1_1x1_intrawave_v3,0.0,191.38,431.07
304,440,896,5120,30,0,15.2148,a8w8_rowwise_256x32x64x512_16x16_1x2_32x8x1_32x8x1_1x32x1x8_8x8x1_1x2_intrawave_v3,0.0,265.33,501.41
304,440,1024,5632,30,0,18.4256,a8w8_rowwise_256x32x64x512_16x16_1x2_32x8x1_32x8x1_1x32x1x8_8x8x1_1x2_intrawave_v3,0.0,275.44,496.39
304,440,1056,1408,30,0,7.6762,a8w8_rowwise_256x32x64x512_16x16_1x2_32x8x1_32x8x1_1x32x1x8_8x8x1_1x2_intrawave_v3,0.0,170.45,395.46
304,440,1280,4096,30,0,15.1742,a8w8_rowwise_256x32x64x512_16x16_1x2_32x8x1_32x8x1_1x32x1x8_8x8x1_1x2_intrawave_v3,0.0,304.05,538.51
304,440,1408,352,47,0,5.359,a8w8_rowwise_256x64x64x128_32x32_1x1_8x32x1_8x32x1_1x32x1x8_8x8x1_1x1_intrawave_v3,0.0,81.38,352.59
304,440,1408,1408,28,0,9.2973,a8w8_rowwise_256x32x128x256_32x32_1x1_16x16x1_16x16x1_1x32x1x8_8x8x1_1x1_intrawave_v3,0.0,187.64,413.13
304,440,1536,2048,23,0,12.3206,a8w8_rowwise_256x64x64x512_32x32_1x1_32x8x1_32x8x1_1x32x1x8_8x8x1_1x1_intrawave_v3,0.0,224.68,438.17
304,440,1792,6144,28,0,29.8435,a8w8_rowwise_256x32x128x256_32x32_1x1_16x16x1_16x16x1_1x32x1x8_8x8x1_1x1_intrawave_v3,0.0,324.66,512.35
304,440,2048,1536,28,0,11.3929,a8w8_rowwise_256x32x128x256_32x32_1x1_16x16x1_16x16x1_1x32x1x8_8x8x1_1x1_intrawave_v3,0.0,242.98,493.62
304,440,2048,6144,28,0,31.7321,a8w8_rowwise_256x32x128x256_32x32_1x1_16x16x1_16x16x1_1x32x1x8_8x8x1_1x1_intrawave_v3,0.0,348.95,538.52
304,440,3072,4096,22,0,28.0076,a8w8_rowwise_256x64x96x256_16x16_2x3_16x16x1_16x16x1_1x64x1x4_8x8x1_2x1_intrawave_v3,0.0,395.36,610.14
304,440,3584,6144,21,0,42.4163,a8w8_rowwise_256x64x128x256_32x32_1x2_16x16x1_16x16x1_1x32x1x8_8x8x1_1x1_intrawave_v3,0.0,456.85,657.23
304,440,4096,640,46,0,9.6187,a8w8_rowwise_256x64x128x128_32x32_1x2_8x32x1_8x32x1_1x32x1x8_8x8x1_1x1_intrawave_v3,0.0,239.83,676.55
304,440,4096,1024,22,0,12.3544,a8w8_rowwise_256x64x96x256_16x16_2x3_16x16x1_16x16x1_1x64x1x4_8x8x1_2x1_intrawave_v3,0.0,298.76,667.73
304,440,4096,3072,22,0,25.2095,a8w8_rowwise_256x64x96x256_16x16_2x3_16x16x1_16x16x1_1x64x1x4_8x8x1_2x1_intrawave_v3,0.0,439.24,695.73
304,440,5120,640,47,0,10.2264,a8w8_rowwise_256x64x64x128_32x32_1x1_8x32x1_8x32x1_1x32x1x8_8x8x1_1x1_intrawave_v3,0.0,281.97,788.55
304,440,5120,2048,21,0,21.1812,a8w8_rowwise_256x64x128x256_32x32_1x2_16x16x1_16x16x1_1x32x1x8_8x8x1_1x1_intrawave_v3,0.0,435.64,750.31
304,440,6144,768,14,0,13.4086,a8w8_rowwise_256x128x96x256_32x32_1x3_16x16x1_16x16x1_1x64x1x4_8x8x1_1x1_intrawave_v3,0.0,309.68,780.34
304,440,6144,1024,14,0,16.0273,a8w8_rowwise_256x128x96x256_32x32_1x3_16x16x1_16x16x1_1x64x1x4_8x8x1_1x1_intrawave_v3,0.0,345.44,758.0
304,440,6144,1536,14,0,20.619,a8w8_rowwise_256x128x96x256_32x32_1x3_16x16x1_16x16x1_1x64x1x4_8x8x1_1x1_intrawave_v3,0.0,402.77,752.69
304,440,6144,2048,14,0,24.4057,a8w8_rowwise_256x128x96x256_32x32_1x3_16x16x1_16x16x1_1x64x1x4_8x8x1_1x1_intrawave_v3,0.0,453.7,774.03
304,440,7168,256,44,0,10.4425,a8w8_rowwise_256x128x128x128_32x32_2x2_8x32x1_8x32x1_1x32x1x8_8x8x1_1x1_interwave_v1,0.0,154.64,790.57
304,440,7168,2304,14,0,28.3076,a8w8_rowwise_256x128x96x256_32x32_1x3_16x16x1_16x16x1_1x64x1x4_8x8x1_1x1_intrawave_v3,0.0,513.4,842.06
304,448,192,7168,34,0,12.1889,a8w8_rowwise_256x16x64x512_16x16_1x1_32x8x1_32x8x1_1x16x1x16_4x4x1_1x1_intrawave_v3,0.0,101.17,390.48
304,448,512,7168,34,0,14.7738,a8w8_rowwise_256x16x64x512_16x16_1x1_32x8x1_32x8x1_1x16x1x16_4x4x1_1x1_intrawave_v3,0.0,222.58,496.83
304,448,896,5120,30,0,14.6819,a8w8_rowwise_256x32x64x512_16x16_1x2_32x8x1_32x8x1_1x32x1x8_8x8x1_1x2_intrawave_v3,0.0,279.96,523.37
304,448,1024,5632,30,0,15.7144,a8w8_rowwise_256x32x64x512_16x16_1x2_32x8x1_32x8x1_1x32x1x8_8x8x1_1x2_intrawave_v3,0.0,328.83,585.95
304,448,1056,1408,30,0,7.7173,a8w8_rowwise_256x32x64x512_16x16_1x2_32x8x1_32x8x1_1x32x1x8_8x8x1_1x2_intrawave_v3,0.0,172.63,397.01
304,448,1280,4096,30,0,14.6172,a8w8_rowwise_256x32x64x512_16x16_1x2_32x8x1_32x8x1_1x32x1x8_8x8x1_1x2_intrawave_v3,0.0,321.38,562.68
304,448,1408,352,47,0,5.3572,a8w8_rowwise_256x64x64x128_32x32_1x1_8x32x1_8x32x1_1x32x1x8_8x8x1_1x1_intrawave_v3,0.0,82.89,357.44
304,448,1408,1408,55,0,8.627,a8w8_rowwise_128x64x32x128_32x32_1x1_8x16x1_8x16x1_1x16x1x8_4x4x1_1x1_intrawave_v2,0.0,205.9,449.15
304,448,1536,2048,23,0,10.7416,a8w8_rowwise_256x64x64x512_32x32_1x1_32x8x1_32x8x1_1x32x1x8_8x8x1_1x1_intrawave_v3,0.0,262.4,506.39
304,448,1792,6144,23,0,23.7599,a8w8_rowwise_256x64x64x512_32x32_1x1_32x8x1_32x8x1_1x32x1x8_8x8x1_1x1_intrawave_v3,0.0,415.2,646.81
304,448,2048,1536,23,0,10.3716,a8w8_rowwise_256x64x64x512_32x32_1x1_32x8x1_32x8x1_1x32x1x8_8x8x1_1x1_intrawave_v3,0.0,271.76,546.58
304,448,2048,6144,23,0,25.119,a8w8_rowwise_256x64x64x512_32x32_1x1_32x8x1_32x8x1_1x32x1x8_8x8x1_1x1_intrawave_v3,0.0,448.84,683.56
304,448,3072,4096,22,0,27.2363,a8w8_rowwise_256x64x96x256_16x16_2x3_16x16x1_16x16x1_1x64x1x4_8x8x1_2x1_intrawave_v3,0.0,413.94,630.42
304,448,3584,6144,21,0,41.8922,a8w8_rowwise_256x64x128x256_32x32_1x2_16x16x1_16x16x1_1x32x1x8_8x8x1_1x1_intrawave_v3,0.0,470.97,668.0
304,448,4096,640,46,0,9.4361,a8w8_rowwise_256x64x128x128_32x32_1x2_8x32x1_8x32x1_1x32x1x8_8x8x1_1x1_intrawave_v3,0.0,248.92,697.13
304,448,4096,1024,22,0,12.4422,a8w8_rowwise_256x64x96x256_16x16_2x3_16x16x1_16x16x1_1x64x1x4_8x8x1_2x1_intrawave_v3,0.0,302.04,668.94
304,448,4096,3072,21,0,24.8959,a8w8_rowwise_256x64x128x256_32x32_1x2_16x16x1_16x16x1_1x32x1x8_8x8x1_1x1_intrawave_v3,0.0,452.86,708.12
304,448,5120,640,47,0,10.2187,a8w8_rowwise_256x64x64x128_32x32_1x1_8x32x1_8x32x1_1x32x1x8_8x8x1_1x1_intrawave_v3,0.0,287.32,797.66
304,448,5120,2048,21,0,20.7391,a8w8_rowwise_256x64x128x256_32x32_1x2_16x16x1_16x16x1_1x32x1x8_8x8x1_1x1_intrawave_v3,0.0,453.02,771.05
304,448,6144,768,14,0,13.4541,a8w8_rowwise_256x128x96x256_32x32_1x3_16x16x1_16x16x1_1x64x1x4_8x8x1_1x1_intrawave_v3,0.0,314.24,785.46
304,448,6144,1024,14,0,16.3446,a8w8_rowwise_256x128x96x256_32x32_1x3_16x16x1_16x16x1_1x64x1x4_8x8x1_1x1_intrawave_v3,0.0,344.89,749.8
304,448,6144,1536,14,0,20.5919,a8w8_rowwise_256x128x96x256_32x32_1x3_16x16x1_16x16x1_1x64x1x4_8x8x1_1x1_intrawave_v3,0.0,410.63,759.05
304,448,6144,2048,14,0,24.6427,a8w8_rowwise_256x128x96x256_32x32_1x3_16x16x1_16x16x1_1x64x1x4_8x8x1_1x1_intrawave_v3,0.0,457.51,771.24
304,448,7168,256,44,0,10.432,a8w8_rowwise_256x128x128x128_32x32_2x2_8x32x1_8x32x1_1x32x1x8_8x8x1_1x1_interwave_v1,0.0,157.61,802.55
304,448,7168,2304,14,0,28.5317,a8w8_rowwise_256x128x96x256_32x32_1x3_16x16x1_16x16x1_1x64x1x4_8x8x1_1x1_intrawave_v3,0.0,518.63,840.11
304,456,192,7168,34,0,14.2855,a8w8_rowwise_256x16x64x512_16x16_1x1_32x8x1_32x8x1_1x16x1x16_4x4x1_1x1_intrawave_v3,0.0,87.86,337.4
304,456,512,7168,30,0,17.2932,a8w8_rowwise_256x32x64x512_16x16_1x2_32x8x1_32x8x1_1x32x1x8_8x8x1_1x2_intrawave_v3,0.0,193.55,428.24
304,456,896,5120,30,0,15.8484,a8w8_rowwise_256x32x64x512_16x16_1x2_32x8x1_32x8x1_1x32x1x8_8x8x1_1x2_intrawave_v3,0.0,263.99,488.34
304,456,1024,5632,30,0,18.6481,a8w8_rowwise_256x32x64x512_16x16_1x2_32x8x1_32x8x1_1x32x1x8_8x8x1_1x2_intrawave_v3,0.0,282.05,497.06
304,456,1056,1408,30,0,8.0886,a8w8_rowwise_256x32x64x512_16x16_1x2_32x8x1_32x8x1_1x32x1x8_8x8x1_1x2_intrawave_v3,0.0,167.64,382.26
304,456,1280,4096,30,0,15.4394,a8w8_rowwise_256x32x64x512_16x16_1x2_32x8x1_32x8x1_1x32x1x8_8x8x1_1x2_intrawave_v3,0.0,309.7,536.16
304,456,1408,352,47,0,5.3614,a8w8_rowwise_256x64x64x128_32x32_1x1_8x32x1_8x32x1_1x32x1x8_8x8x1_1x1_intrawave_v3,0.0,84.31,361.89
304,456,1408,1408,47,0,9.4697,a8w8_rowwise_256x64x64x128_32x32_1x1_8x32x1_8x32x1_1x32x1x8_8x8x1_1x1_intrawave_v3,0.0,190.93,412.75
304,456,1536,2048,23,0,12.4727,a8w8_rowwise_256x64x64x512_32x32_1x1_32x8x1_32x8x1_1x32x1x8_8x8x1_1x1_intrawave_v3,0.0,230.01,439.4
304,456,1792,6144,28,0,30.5229,a8w8_rowwise_256x32x128x256_32x32_1x1_16x16x1_16x16x1_1x32x1x8_8x8x1_1x1_intrawave_v3,0.0,328.97,506.05
304,456,2048,1536,28,0,11.6668,a8w8_rowwise_256x32x128x256_32x32_1x1_16x16x1_16x16x1_1x32x1x8_8x8x1_1x1_intrawave_v3,0.0,245.9,489.76
304,456,2048,6144,28,0,32.3154,a8w8_rowwise_256x32x128x256_32x32_1x1_16x16x1_16x16x1_1x32x1x8_8x8x1_1x1_intrawave_v3,0.0,355.11,533.87
304,456,3072,4096,22,0,29.2894,a8w8_rowwise_256x64x96x256_16x16_2x3_16x16x1_16x16x1_1x64x1x4_8x8x1_2x1_intrawave_v3,0.0,391.8,589.03
304,456,3584,6144,15,0,45.2697,a8w8_rowwise_256x128x64x256_32x32_2x1_16x16x1_16x16x1_1x32x1x8_8x8x1_1x1_intrawave_v3,0.0,443.62,620.51
304,456,4096,640,47,0,9.6919,a8w8_rowwise_256x64x64x128_32x32_1x1_8x32x1_8x32x1_1x32x1x8_8x8x1_1x1_intrawave_v3,0.0,246.68,686.02
304,456,4096,1024,15,0,12.7605,a8w8_rowwise_256x128x64x256_32x32_2x1_16x16x1_16x16x1_1x32x1x8_8x8x1_1x1_intrawave_v3,0.0,299.77,658.03
304,456,4096,3072,21,0,26.2679,a8w8_rowwise_256x64x128x256_32x32_1x2_16x16x1_16x16x1_1x32x1x8_8x8x1_1x1_intrawave_v3,0.0,436.87,674.56
304,456,5120,640,81,0,11.2888,a8w8_rowwise_128x32x64x128_32x32_1x1_8x16x1_8x16x1_1x16x1x8_8x8x1_1x1_interwave_v2,0.0,264.73,729.76
304,456,5120,2048,14,0,23.1034,a8w8_rowwise_256x128x96x256_32x32_1x3_16x16x1_16x16x1_1x64x1x4_8x8x1_1x1_intrawave_v3,0.0,413.92,696.39
304,456,6144,768,14,0,13.5717,a8w8_rowwise_256x128x96x256_32x32_1x3_16x16x1_16x16x1_1x64x1x4_8x8x1_1x1_intrawave_v3,0.0,317.08,786.35
304,456,6144,1024,14,0,16.2897,a8w8_rowwise_256x128x96x256_32x32_1x3_16x16x1_16x16x1_1x64x1x4_8x8x1_1x1_intrawave_v3,0.0,352.24,758.87
304,456,6144,1536,14,0,20.5897,a8w8_rowwise_256x128x96x256_32x32_1x3_16x16x1_16x16x1_1x64x1x4_8x8x1_1x1_intrawave_v3,0.0,418.01,764.5
304,456,6144,2048,14,0,24.8965,a8w8_rowwise_256x128x96x256_32x32_1x3_16x16x1_16x16x1_1x64x1x4_8x8x1_1x1_intrawave_v3,0.0,460.93,767.98
304,456,7168,256,44,0,10.4501,a8w8_rowwise_256x128x128x128_32x32_2x2_8x32x1_8x32x1_1x32x1x8_8x8x1_1x1_interwave_v1,0.0,160.14,812.33
304,456,7168,2304,14,0,28.4924,a8w8_rowwise_256x128x96x256_32x32_1x3_16x16x1_16x16x1_1x64x1x4_8x8x1_1x1_intrawave_v3,0.0,528.62,845.94
304,464,192,7168,34,0,12.1986,a8w8_rowwise_256x16x64x512_16x16_1x1_32x8x1_32x8x1_1x16x1x16_4x4x1_1x1_intrawave_v3,0.0,104.7,400.08
304,464,512,7168,34,0,15.4441,a8w8_rowwise_256x16x64x512_16x16_1x1_32x8x1_32x8x1_1x16x1x16_4x4x1_1x1_intrawave_v3,0.0,220.52,483.75
304,464,896,5120,30,0,15.8851,a8w8_rowwise_256x32x64x512_16x16_1x2_32x8x1_32x8x1_1x32x1x8_8x8x1_1x2_intrawave_v3,0.0,268.0,490.69
304,464,1024,5632,30,0,19.6287,a8w8_rowwise_256x32x64x512_16x16_1x2_32x8x1_32x8x1_1x32x1x8_8x8x1_1x2_intrawave_v3,0.0,272.66,475.36
304,464,1056,1408,30,0,8.1787,a8w8_rowwise_256x32x64x512_16x16_1x2_32x8x1_32x8x1_1x32x1x8_8x8x1_1x2_intrawave_v3,0.0,168.71,381.49
304,464,1280,4096,30,0,16.1419,a8w8_rowwise_256x32x64x512_16x16_1x2_32x8x1_32x8x1_1x32x1x8_8x8x1_1x2_intrawave_v3,0.0,301.41,516.13
304,464,1408,352,48,0,5.4183,a8w8_rowwise_128x32x16x128_16x16_1x1_8x16x1_8x16x1_1x16x1x8_2x2x1_1x1_intrawave_v1,0.0,84.88,362.76
304,464,1408,1408,47,0,9.4644,a8w8_rowwise_256x64x64x128_32x32_1x1_8x32x1_8x32x1_1x32x1x8_8x8x1_1x1_intrawave_v3,0.0,194.38,416.55
304,464,1536,2048,28,0,12.6508,a8w8_rowwise_256x32x128x256_32x32_1x1_16x16x1_16x16x1_1x32x1x8_8x8x1_1x1_intrawave_v3,0.0,230.76,436.45
304,464,1792,6144,28,0,30.5994,a8w8_rowwise_256x32x128x256_32x32_1x1_16x16x1_16x16x1_1x32x1x8_8x8x1_1x1_intrawave_v3,0.0,333.91,507.32
304,464,2048,1536,28,0,11.7364,a8w8_rowwise_256x32x128x256_32x32_1x1_16x16x1_16x16x1_1x32x1x8_8x8x1_1x1_intrawave_v3,0.0,248.73,490.69
304,464,2048,6144,28,0,32.6736,a8w8_rowwise_256x32x128x256_32x32_1x1_16x16x1_16x16x1_1x32x1x8_8x8x1_1x1_intrawave_v3,0.0,357.38,530.53
304,464,3072,4096,21,0,29.2838,a8w8_rowwise_256x64x128x256_32x32_1x2_16x16x1_16x16x1_1x32x1x8_8x8x1_1x1_intrawave_v3,0.0,398.75,591.94
304,464,3584,6144,15,0,44.6211,a8w8_rowwise_256x128x64x256_32x32_2x1_16x16x1_16x16x1_1x32x1x8_8x8x1_1x1_intrawave_v3,0.0,457.96,631.92
304,464,4096,640,47,0,9.7864,a8w8_rowwise_256x64x64x128_32x32_1x1_8x32x1_8x32x1_1x32x1x8_8x8x1_1x1_intrawave_v3,0.0,248.58,686.61
304,464,4096,1024,15,0,12.9212,a8w8_rowwise_256x128x64x256_32x32_2x1_16x16x1_16x16x1_1x32x1x8_8x8x1_1x1_intrawave_v3,0.0,301.23,655.55
304,464,4096,3072,21,0,26.3197,a8w8_rowwise_256x64x128x256_32x32_1x2_16x16x1_16x16x1_1x32x1x8_8x8x1_1x1_intrawave_v3,0.0,443.66,676.66
304,464,5120,640,81,0,11.4609,a8w8_rowwise_128x32x64x128_32x32_1x1_8x16x1_8x16x1_1x16x1x8_8x8x1_1x1_interwave_v2,0.0,265.33,726.39
304,464,5120,2048,14,0,23.2324,a8w8_rowwise_256x128x96x256_32x32_1x3_16x16x1_16x16x1_1x64x1x4_8x8x1_1x1_intrawave_v3,0.0,418.85,696.76
304,464,6144,768,14,0,13.6319,a8w8_rowwise_256x128x96x256_32x32_1x3_16x16x1_16x16x1_1x64x1x4_8x8x1_1x1_intrawave_v3,0.0,321.22,790.54
304,464,6144,1024,14,0,16.0926,a8w8_rowwise_256x128x96x256_32x32_1x3_16x16x1_16x16x1_1x64x1x4_8x8x1_1x1_intrawave_v3,0.0,362.8,774.78
304,464,6144,1536,14,0,20.7036,a8w8_rowwise_256x128x96x256_32x32_1x3_16x16x1_16x16x1_1x64x1x4_8x8x1_1x1_intrawave_v3,0.0,423.0,765.64
304,464,6144,2048,14,0,24.9886,a8w8_rowwise_256x128x96x256_32x32_1x3_16x16x1_16x16x1_1x64x1x4_8x8x1_1x1_intrawave_v3,0.0,467.29,769.74
304,464,7168,256,44,0,10.5291,a8w8_rowwise_256x128x128x128_32x32_2x2_8x32x1_8x32x1_1x32x1x8_8x8x1_1x1_interwave_v1,0.0,161.73,817.32
304,464,7168,2304,14,0,28.7036,a8w8_rowwise_256x128x96x256_32x32_1x3_16x16x1_16x16x1_1x64x1x4_8x8x1_1x1_intrawave_v3,0.0,533.94,844.36
304,472,192,7168,34,0,14.2934,a8w8_rowwise_256x16x64x512_16x16_1x1_32x8x1_32x8x1_1x16x1x16_4x4x1_1x1_intrawave_v3,0.0,90.89,345.67
304,472,512,7168,30,0,16.5441,a8w8_rowwise_256x32x64x512_16x16_1x2_32x8x1_32x8x1_1x32x1x8_8x8x1_1x2_intrawave_v3,0.0,209.41,455.55
304,472,896,5120,30,0,16.2182,a8w8_rowwise_256x32x64x512_16x16_1x2_32x8x1_32x8x1_1x32x1x8_8x8x1_1x2_intrawave_v3,0.0,267.02,484.02
304,472,1024,5632,30,0,19.5033,a8w8_rowwise_256x32x64x512_16x16_1x2_32x8x1_32x8x1_1x32x1x8_8x8x1_1x2_intrawave_v3,0.0,279.14,481.57
304,472,1056,1408,30,0,8.1973,a8w8_rowwise_256x32x64x512_16x16_1x2_32x8x1_32x8x1_1x32x1x8_8x8x1_1x2_intrawave_v3,0.0,171.23,384.06
304,472,1280,4096,30,0,15.6723,a8w8_rowwise_256x32x64x512_16x16_1x2_32x8x1_32x8x1_1x32x1x8_8x8x1_1x2_intrawave_v3,0.0,315.8,534.99
304,472,1408,352,67,0,5.48,a8w8_rowwise_128x32x16x128_16x16_1x1_8x16x1_8x16x1_1x16x1x8_2x2x1_1x1_interwave_v1,0.0,85.38,363.31
304,472,1408,1408,47,0,9.393,a8w8_rowwise_256x64x64x128_32x32_1x1_8x32x1_8x32x1_1x32x1x8_8x8x1_1x1_intrawave_v3,0.0,199.24,423.31
304,472,1536,2048,28,0,12.6332,a8w8_rowwise_256x32x128x256_32x32_1x1_16x16x1_16x16x1_1x32x1x8_8x8x1_1x1_intrawave_v3,0.0,235.06,440.3
304,472,1792,6144,28,0,30.6214,a8w8_rowwise_256x32x128x256_32x32_1x1_16x16x1_16x16x1_1x32x1x8_8x8x1_1x1_intrawave_v3,0.0,339.42,509.5
304,472,2048,1536,28,0,11.9036,a8w8_rowwise_256x32x128x256_32x32_1x1_16x16x1_16x16x1_1x32x1x8_8x8x1_1x1_intrawave_v3,0.0,249.47,487.59
304,472,2048,6144,28,0,32.2663,a8w8_rowwise_256x32x128x256_32x32_1x1_16x16x1_16x16x1_1x32x1x8_8x8x1_1x1_intrawave_v3,0.0,368.13,539.76
304,472,3072,4096,21,0,29.2153,a8w8_rowwise_256x64x128x256_32x32_1x2_16x16x1_16x16x1_1x32x1x8_8x8x1_1x1_intrawave_v3,0.0,406.58,596.13
304,472,3584,6144,21,0,45.2657,a8w8_rowwise_256x64x128x256_32x32_1x2_16x16x1_16x16x1_1x32x1x8_8x8x1_1x1_intrawave_v3,0.0,459.22,625.27
304,472,4096,640,47,0,9.7185,a8w8_rowwise_256x64x64x128_32x32_1x1_8x32x1_8x32x1_1x32x1x8_8x8x1_1x1_intrawave_v3,0.0,254.63,698.68
304,472,4096,1024,15,0,12.8234,a8w8_rowwise_256x128x64x256_32x32_2x1_16x16x1_16x16x1_1x32x1x8_8x8x1_1x1_intrawave_v3,0.0,308.77,666.3
304,472,4096,3072,21,0,26.5869,a8w8_rowwise_256x64x128x256_32x32_1x2_16x16x1_16x16x1_1x32x1x8_8x8x1_1x1_intrawave_v3,0.0,446.77,673.25
304,472,5120,640,81,0,11.384,a8w8_rowwise_128x32x64x128_32x32_1x1_8x16x1_8x16x1_1x16x1x8_8x8x1_1x1_interwave_v2,0.0,271.72,738.95
304,472,5120,2048,14,0,23.1188,a8w8_rowwise_256x128x96x256_32x32_1x3_16x16x1_16x16x1_1x64x1x4_8x8x1_1x1_intrawave_v3,0.0,428.16,704.44
304,472,6144,768,14,0,13.6887,a8w8_rowwise_256x128x96x256_32x32_1x3_16x16x1_16x16x1_1x64x1x4_8x8x1_1x1_intrawave_v3,0.0,325.4,794.89
304,472,6144,1024,14,0,16.101,a8w8_rowwise_256x128x96x256_32x32_1x3_16x16x1_16x16x1_1x64x1x4_8x8x1_1x1_intrawave_v3,0.0,368.87,780.99
304,472,6144,1536,14,0,20.8078,a8w8_rowwise_256x128x96x256_32x32_1x3_16x16x1_16x16x1_1x64x1x4_8x8x1_1x1_intrawave_v3,0.0,428.14,767.12
304,472,6144,2048,14,0,25.0731,a8w8_rowwise_256x128x96x256_32x32_1x3_16x16x1_16x16x1_1x64x1x4_8x8x1_1x1_intrawave_v3,0.0,473.75,771.72
304,472,7168,256,44,0,10.4954,a8w8_rowwise_256x128x128x128_32x32_2x2_8x32x1_8x32x1_1x32x1x8_8x8x1_1x1_interwave_v1,0.0,165.05,831.07
304,472,7168,2304,14,0,28.8081,a8w8_rowwise_256x128x96x256_32x32_1x3_16x16x1_16x16x1_1x64x1x4_8x8x1_1x1_intrawave_v3,0.0,541.18,845.91
304,480,192,7168,34,0,12.1475,a8w8_rowwise_256x16x64x512_16x16_1x1_32x8x1_32x8x1_1x16x1x16_4x4x1_1x1_intrawave_v3,0.0,108.76,411.71
304,480,512,7168,30,0,15.1435,a8w8_rowwise_256x32x64x512_16x16_1x2_32x8x1_32x8x1_1x32x1x8_8x8x1_1x2_intrawave_v3,0.0,232.66,502.01
304,480,896,5120,30,0,15.2467,a8w8_rowwise_256x32x64x512_16x16_1x2_32x8x1_32x8x1_1x32x1x8_8x8x1_1x2_intrawave_v3,0.0,288.85,518.49
304,480,1024,5632,30,0,16.4435,a8w8_rowwise_256x32x64x512_16x16_1x2_32x8x1_32x8x1_1x32x1x8_8x8x1_1x2_intrawave_v3,0.0,336.7,574.91
304,480,1056,1408,30,0,8.2575,a8w8_rowwise_256x32x64x512_16x16_1x2_32x8x1_32x8x1_1x32x1x8_8x8x1_1x2_intrawave_v3,0.0,172.86,384.67
304,480,1280,4096,30,0,15.0768,a8w8_rowwise_256x32x64x512_16x16_1x2_32x8x1_32x8x1_1x32x1x8_8x8x1_1x2_intrawave_v3,0.0,333.84,559.65
304,480,1408,352,67,0,5.3899,a8w8_rowwise_128x32x16x128_16x16_1x1_8x16x1_8x16x1_1x16x1x8_2x2x1_1x1_interwave_v1,0.0,88.27,374.08
304,480,1408,1408,81,0,9.0865,a8w8_rowwise_128x32x64x128_32x32_1x1_8x16x1_8x16x1_1x16x1x8_8x8x1_1x1_interwave_v2,0.0,209.45,441.31
304,480,1536,2048,28,0,12.2434,a8w8_rowwise_256x32x128x256_32x32_1x1_16x16x1_16x16x1_1x32x1x8_8x8x1_1x1_intrawave_v3,0.0,246.66,457.66
304,480,1792,6144,28,0,28.8941,a8w8_rowwise_256x32x128x256_32x32_1x1_16x16x1_16x16x1_1x32x1x8_8x8x1_1x1_intrawave_v3,0.0,365.81,542.65
304,480,2048,1536,28,0,11.3634,a8w8_rowwise_256x32x128x256_32x32_1x1_16x16x1_16x16x1_1x32x1x8_8x8x1_1x1_intrawave_v3,0.0,265.76,514.73
304,480,2048,6144,28,0,30.8165,a8w8_rowwise_256x32x128x256_32x32_1x1_16x16x1_16x16x1_1x32x1x8_8x8x1_1x1_intrawave_v3,0.0,391.98,567.82
304,480,3072,4096,21,0,29.4176,a8w8_rowwise_256x64x128x256_32x32_1x2_16x16x1_16x16x1_1x32x1x8_8x8x1_1x1_intrawave_v3,0.0,410.62,594.82
304,480,3584,6144,15,0,44.4591,a8w8_rowwise_256x128x64x256_32x32_2x1_16x16x1_16x16x1_1x32x1x8_8x8x1_1x1_intrawave_v3,0.0,475.48,639.01
304,480,4096,640,47,0,9.7687,a8w8_rowwise_256x64x64x128_32x32_1x1_8x32x1_8x32x1_1x32x1x8_8x8x1_1x1_intrawave_v3,0.0,257.62,702.32
304,480,4096,1024,15,0,12.9317,a8w8_rowwise_256x128x64x256_32x32_2x1_16x16x1_16x16x1_1x32x1x8_8x8x1_1x1_intrawave_v3,0.0,311.37,666.42
304,480,4096,3072,21,0,26.2525,a8w8_rowwise_256x64x128x256_32x32_1x2_16x16x1_16x16x1_1x32x1x8_8x8x1_1x1_intrawave_v3,0.0,460.13,685.25
304,480,5120,640,81,0,11.0977,a8w8_rowwise_128x32x64x128_32x32_1x1_8x16x1_8x16x1_1x16x1x8_8x8x1_1x1_interwave_v2,0.0,283.46,765.85
304,480,5120,2048,14,0,23.2272,a8w8_rowwise_256x128x96x256_32x32_1x3_16x16x1_16x16x1_1x64x1x4_8x8x1_1x1_intrawave_v3,0.0,433.39,705.38
304,480,6144,768,14,0,13.699,a8w8_rowwise_256x128x96x256_32x32_1x3_16x16x1_16x16x1_1x64x1x4_8x8x1_1x1_intrawave_v3,0.0,330.67,801.92
304,480,6144,1024,14,0,16.2885,a8w8_rowwise_256x128x96x256_32x32_1x3_16x16x1_16x16x1_1x64x1x4_8x8x1_1x1_intrawave_v3,0.0,370.8,778.54
304,480,6144,1536,14,0,20.7476,a8w8_rowwise_256x128x96x256_32x32_1x3_16x16x1_16x16x1_1x64x1x4_8x8x1_1x1_intrawave_v3,0.0,436.66,774.68
304,480,6144,2048,14,0,25.0949,a8w8_rowwise_256x128x96x256_32x32_1x3_16x16x1_16x16x1_1x64x1x4_8x8x1_1x1_intrawave_v3,0.0,481.36,775.62
304,480,7168,256,44,0,10.5616,a8w8_rowwise_256x128x128x128_32x32_2x2_8x32x1_8x32x1_1x32x1x8_8x8x1_1x1_interwave_v1,0.0,166.79,836.92
304,480,7168,2304,14,0,28.5584,a8w8_rowwise_256x128x96x256_32x32_1x3_16x16x1_16x16x1_1x64x1x4_8x8x1_1x1_intrawave_v3,0.0,555.16,857.97
304,488,192,7168,34,0,14.4082,a8w8_rowwise_256x16x64x512_16x16_1x1_32x8x1_32x8x1_1x16x1x16_4x4x1_1x1_intrawave_v3,0.0,93.23,351.3
304,488,512,7168,30,0,16.8645,a8w8_rowwise_256x32x64x512_16x16_1x2_32x8x1_32x8x1_1x32x1x8_8x8x1_1x2_intrawave_v3,0.0,212.4,454.67
304,488,896,5120,30,0,16.0906,a8w8_rowwise_256x32x64x512_16x16_1x2_32x8x1_32x8x1_1x32x1x8_8x8x1_1x2_intrawave_v3,0.0,278.26,494.73
304,488,1024,5632,30,0,18.8781,a8w8_rowwise_256x32x64x512_16x16_1x2_32x8x1_32x8x1_1x32x1x8_8x8x1_1x2_intrawave_v3,0.0,298.16,504.02
304,488,1056,1408,75,0,8.3756,a8w8_rowwise_128x64x16x128_16x16_2x1_8x16x1_8x16x1_1x16x1x8_2x2x1_1x1_interwave_v2,0.0,173.26,382.61
304,488,1280,4096,29,0,19.6149,a8w8_rowwise_256x32x96x256_16x16_1x3_16x16x1_16x16x1_1x32x1x8_4x4x1_1x1_intrawave_v3,0.0,260.88,432.89
304,488,1408,352,67,0,5.4139,a8w8_rowwise_128x32x16x128_16x16_1x1_8x16x1_8x16x1_1x16x1x8_2x2x1_1x1_interwave_v1,0.0,89.35,377.1
304,488,1408,1408,47,0,9.4935,a8w8_rowwise_256x64x64x128_32x32_1x1_8x32x1_8x32x1_1x32x1x8_8x8x1_1x1_intrawave_v3,0.0,203.81,425.95
304,488,1536,2048,23,0,12.7056,a8w8_rowwise_256x64x64x512_32x32_1x1_32x8x1_32x8x1_1x32x1x8_8x8x1_1x1_intrawave_v3,0.0,241.64,444.24
304,488,1792,6144,28,0,31.1995,a8w8_rowwise_256x32x128x256_32x32_1x1_16x16x1_16x16x1_1x32x1x8_8x8x1_1x1_intrawave_v3,0.0,344.42,505.05
304,488,2048,1536,47,0,11.9339,a8w8_rowwise_256x64x64x128_32x32_1x1_8x32x1_8x32x1_1x32x1x8_8x8x1_1x1_intrawave_v3,0.0,257.27,493.9
304,488,2048,6144,28,0,32.7706,a8w8_rowwise_256x32x128x256_32x32_1x1_16x16x1_16x16x1_1x32x1x8_8x8x1_1x1_intrawave_v3,0.0,374.75,536.46
304,488,3072,4096,21,0,29.0691,a8w8_rowwise_256x64x128x256_32x32_1x2_16x16x1_16x16x1_1x32x1x8_8x8x1_1x1_intrawave_v3,0.0,422.47,604.77
304,488,3584,6144,21,0,45.2884,a8w8_rowwise_256x64x128x256_32x32_1x2_16x16x1_16x16x1_1x32x1x8_8x8x1_1x1_intrawave_v3,0.0,474.55,629.66
304,488,4096,640,47,0,9.8357,a8w8_rowwise_256x64x64x128_32x32_1x1_8x32x1_8x32x1_1x32x1x8_8x8x1_1x1_intrawave_v3,0.0,260.13,704.72
304,488,4096,1024,15,0,13.0002,a8w8_rowwise_256x128x64x256_32x32_2x1_16x16x1_16x16x1_1x32x1x8_8x8x1_1x1_intrawave_v3,0.0,314.89,668.58
304,488,4096,3072,21,0,26.7276,a8w8_rowwise_256x64x128x256_32x32_1x2_16x16x1_16x16x1_1x32x1x8_8x8x1_1x1_intrawave_v3,0.0,459.48,676.44
304,488,5120,640,47,0,11.594,a8w8_rowwise_256x64x64x128_32x32_1x1_8x32x1_8x32x1_1x32x1x8_8x8x1_1x1_intrawave_v3,0.0,275.85,740.58
304,488,5120,2048,14,0,23.4261,a8w8_rowwise_256x128x96x256_32x32_1x3_16x16x1_16x16x1_1x64x1x4_8x8x1_1x1_intrawave_v3,0.0,436.87,703.59
304,488,6144,768,14,0,13.7743,a8w8_rowwise_256x128x96x256_32x32_1x3_16x16x1_16x16x1_1x64x1x4_8x8x1_1x1_intrawave_v3,0.0,334.34,805.12
304,488,6144,1024,14,0,16.1835,a8w8_rowwise_256x128x96x256_32x32_1x3_16x16x1_16x16x1_1x64x1x4_8x8x1_1x1_intrawave_v3,0.0,379.43,790.17
304,488,6144,1536,14,0,20.9951,a8w8_rowwise_256x128x96x256_32x32_1x3_16x16x1_16x16x1_1x64x1x4_8x8x1_1x1_intrawave_v3,0.0,438.71,770.81
304,488,6144,2048,14,0,25.1742,a8w8_rowwise_256x128x96x256_32x32_1x3_16x16x1_16x16x1_1x64x1x4_8x8x1_1x1_intrawave_v3,0.0,487.84,777.74
304,488,7168,256,44,0,10.5476,a8w8_rowwise_256x128x128x128_32x32_2x2_8x32x1_8x32x1_1x32x1x8_8x8x1_1x1_interwave_v1,0.0,169.8,849.09
304,488,7168,2304,14,0,28.9153,a8w8_rowwise_256x128x96x256_32x32_1x3_16x16x1_16x16x1_1x64x1x4_8x8x1_1x1_intrawave_v3,0.0,557.45,851.98
304,496,192,7168,34,0,12.3242,a8w8_rowwise_256x16x64x512_16x16_1x1_32x8x1_32x8x1_1x16x1x16_4x4x1_1x1_intrawave_v3,0.0,110.78,415.61
304,496,512,7168,34,0,14.9291,a8w8_rowwise_256x16x64x512_16x16_1x1_32x8x1_32x8x1_1x16x1x16_4x4x1_1x1_intrawave_v3,0.0,243.86,518.0
304,496,896,5120,30,0,15.4317,a8w8_rowwise_256x32x64x512_16x16_1x2_32x8x1_32x8x1_1x32x1x8_8x8x1_1x2_intrawave_v3,0.0,294.9,519.44
304,496,1024,5632,30,0,18.738,a8w8_rowwise_256x32x64x512_16x16_1x2_32x8x1_32x8x1_1x32x1x8_8x8x1_1x2_intrawave_v3,0.0,305.32,511.07
304,496,1056,1408,30,0,8.057,a8w8_rowwise_256x32x64x512_16x16_1x2_32x8x1_32x8x1_1x32x1x8_8x8x1_1x2_intrawave_v3,0.0,183.06,401.24
304,496,1280,4096,28,0,18.9051,a8w8_rowwise_256x32x128x256_32x32_1x1_16x16x1_16x16x1_1x32x1x8_8x8x1_1x1_intrawave_v3,0.0,275.11,451.96
304,496,1408,352,47,0,5.413,a8w8_rowwise_256x64x64x128_32x32_1x1_8x32x1_8x32x1_1x32x1x8_8x8x1_1x1_intrawave_v3,0.0,90.83,381.85
304,496,1408,1408,47,0,9.4964,a8w8_rowwise_256x64x64x128_32x32_1x1_8x32x1_8x32x1_1x32x1x8_8x8x1_1x1_intrawave_v3,0.0,207.09,429.38
304,496,1536,2048,28,0,12.8521,a8w8_rowwise_256x32x128x256_32x32_1x1_16x16x1_16x16x1_1x32x1x8_8x8x1_1x1_intrawave_v3,0.0,242.81,442.36
304,496,1792,6144,28,0,30.9551,a8w8_rowwise_256x32x128x256_32x32_1x1_16x16x1_16x16x1_1x32x1x8_8x8x1_1x1_intrawave_v3,0.0,352.83,511.55
304,496,2048,1536,47,0,12.0446,a8w8_rowwise_256x64x64x128_32x32_1x1_8x32x1_8x32x1_1x32x1x8_8x8x1_1x1_intrawave_v3,0.0,259.08,493.1
304,496,2048,6144,28,0,33.2145,a8w8_rowwise_256x32x128x256_32x32_1x1_16x16x1_16x16x1_1x32x1x8_8x8x1_1x1_intrawave_v3,0.0,375.81,531.75
304,496,3072,4096,21,0,29.3696,a8w8_rowwise_256x64x128x256_32x32_1x2_16x16x1_16x16x1_1x32x1x8_8x8x1_1x1_intrawave_v3,0.0,425.01,601.37
304,496,3584,6144,21,0,44.2095,a8w8_rowwise_256x64x128x256_32x32_1x2_16x16x1_16x16x1_1x32x1x8_8x8x1_1x1_intrawave_v3,0.0,494.1,647.44
304,496,4096,640,47,0,9.602,a8w8_rowwise_256x64x64x128_32x32_1x1_8x32x1_8x32x1_1x32x1x8_8x8x1_1x1_intrawave_v3,0.0,270.83,729.23
304,496,4096,1024,15,0,12.9981,a8w8_rowwise_256x128x64x256_32x32_2x1_16x16x1_16x16x1_1x32x1x8_8x8x1_1x1_intrawave_v3,0.0,320.1,674.36
304,496,4096,3072,15,0,26.7889,a8w8_rowwise_256x128x64x256_32x32_2x1_16x16x1_16x16x1_1x32x1x8_8x8x1_1x1_intrawave_v3,0.0,465.95,678.26
304,496,5120,640,47,0,11.3995,a8w8_rowwise_256x64x64x128_32x32_1x1_8x32x1_8x32x1_1x32x1x8_8x8x1_1x1_intrawave_v3,0.0,285.15,760.85
304,496,5120,2048,14,0,23.3719,a8w8_rowwise_256x128x96x256_32x32_1x3_16x16x1_16x16x1_1x64x1x4_8x8x1_1x1_intrawave_v3,0.0,445.06,709.42
304,496,6144,768,14,0,13.6729,a8w8_rowwise_256x128x96x256_32x32_1x3_16x16x1_16x16x1_1x64x1x4_8x8x1_1x1_intrawave_v3,0.0,342.34,818.73
304,496,6144,1024,14,0,17.5848,a8w8_rowwise_256x128x96x256_32x32_1x3_16x16x1_16x16x1_1x64x1x4_8x8x1_1x1_intrawave_v3,0.0,354.92,733.26
304,496,6144,1536,14,0,21.1782,a8w8_rowwise_256x128x96x256_32x32_1x3_16x16x1_16x16x1_1x64x1x4_8x8x1_1x1_intrawave_v3,0.0,442.04,769.37
304,496,6144,2048,14,0,25.4021,a8w8_rowwise_256x128x96x256_32x32_1x3_16x16x1_16x16x1_1x64x1x4_8x8x1_1x1_intrawave_v3,0.0,491.39,775.27
304,496,7168,256,44,0,10.578,a8w8_rowwise_256x128x128x128_32x32_2x2_8x32x1_8x32x1_1x32x1x8_8x8x1_1x1_interwave_v1,0.0,172.09,857.69
304,496,7168,2304,14,0,28.9584,a8w8_rowwise_256x128x96x256_32x32_1x3_16x16x1_16x16x1_1x64x1x4_8x8x1_1x1_intrawave_v3,0.0,565.74,855.31
304,504,192,7168,34,0,14.4553,a8w8_rowwise_256x16x64x512_16x16_1x1_32x8x1_32x8x1_1x16x1x16_4x4x1_1x1_intrawave_v3,0.0,95.97,358.52
304,504,512,7168,34,0,18.1537,a8w8_rowwise_256x16x64x512_16x16_1x1_32x8x1_32x8x1_1x16x1x16_4x4x1_1x1_intrawave_v3,0.0,203.78,429.6
304,504,896,5120,30,0,16.186,a8w8_rowwise_256x32x64x512_16x16_1x2_32x8x1_32x8x1_1x32x1x8_8x8x1_1x2_intrawave_v3,0.0,285.69,498.65
304,504,1024,5632,30,0,18.7454,a8w8_rowwise_256x32x64x512_16x16_1x2_32x8x1_32x8x1_1x32x1x8_8x8x1_1x2_intrawave_v3,0.0,310.12,514.15
304,504,1056,1408,30,0,8.4355,a8w8_rowwise_256x32x64x512_16x16_1x2_32x8x1_32x8x1_1x32x1x8_8x8x1_1x2_intrawave_v3,0.0,177.67,386.57
304,504,1280,4096,28,0,19.079,a8w8_rowwise_256x32x128x256_32x32_1x1_16x16x1_16x16x1_1x32x1x8_8x8x1_1x1_intrawave_v3,0.0,277.0,450.63
304,504,1408,352,48,0,5.4087,a8w8_rowwise_128x32x16x128_16x16_1x1_8x16x1_8x16x1_1x16x1x8_2x2x1_1x1_intrawave_v1,0.0,92.37,386.84
304,504,1408,1408,47,0,9.5292,a8w8_rowwise_256x64x64x128_32x32_1x1_8x32x1_8x32x1_1x32x1x8_8x8x1_1x1_intrawave_v3,0.0,209.71,431.45
304,504,1536,2048,23,0,12.7989,a8w8_rowwise_256x64x64x512_32x32_1x1_32x8x1_32x8x1_1x32x1x8_8x8x1_1x1_intrawave_v3,0.0,247.75,447.4
304,504,1792,6144,28,0,31.0437,a8w8_rowwise_256x32x128x256_32x32_1x1_16x16x1_16x16x1_1x32x1x8_8x8x1_1x1_intrawave_v3,0.0,357.5,512.6
304,504,2048,1536,47,0,12.1199,a8w8_rowwise_256x64x64x128_32x32_1x1_8x32x1_8x32x1_1x32x1x8_8x8x1_1x1_intrawave_v3,0.0,261.63,493.75
304,504,2048,6144,28,0,33.0727,a8w8_rowwise_256x32x128x256_32x32_1x1_16x16x1_16x16x1_1x32x1x8_8x8x1_1x1_intrawave_v3,0.0,383.51,536.51
304,504,3072,4096,21,0,29.5138,a8w8_rowwise_256x64x128x256_32x32_1x2_16x16x1_16x16x1_1x32x1x8_8x8x1_1x1_intrawave_v3,0.0,429.75,601.21
304,504,3584,6144,21,0,44.7443,a8w8_rowwise_256x64x128x256_32x32_1x2_16x16x1_16x16x1_1x32x1x8_8x8x1_1x1_intrawave_v3,0.0,496.07,642.08
304,504,4096,640,47,0,9.963,a8w8_rowwise_256x64x64x128_32x32_1x1_8x32x1_8x32x1_1x32x1x8_8x8x1_1x1_intrawave_v3,0.0,265.22,709.9
304,504,4096,1024,15,0,13.012,a8w8_rowwise_256x128x64x256_32x32_2x1_16x16x1_16x16x1_1x32x1x8_8x8x1_1x1_intrawave_v3,0.0,324.92,679.31
304,504,4096,3072,15,0,26.6649,a8w8_rowwise_256x128x64x256_32x32_2x1_16x16x1_16x16x1_1x32x1x8_8x8x1_1x1_intrawave_v3,0.0,475.67,684.79
304,504,5120,640,47,0,11.7329,a8w8_rowwise_256x64x64x128_32x32_1x1_8x32x1_8x32x1_1x32x1x8_8x8x1_1x1_intrawave_v3,0.0,281.52,746.65
304,504,5120,2048,14,0,23.3629,a8w8_rowwise_256x128x96x256_32x32_1x3_16x16x1_16x16x1_1x64x1x4_8x8x1_1x1_intrawave_v3,0.0,452.41,713.91
304,504,6144,768,14,0,13.7395,a8w8_rowwise_256x128x96x256_32x32_1x3_16x16x1_16x16x1_1x64x1x4_8x8x1_1x1_intrawave_v3,0.0,346.18,822.36
304,504,6144,1024,14,0,17.1121,a8w8_rowwise_256x128x96x256_32x32_1x3_16x16x1_16x16x1_1x64x1x4_8x8x1_1x1_intrawave_v3,0.0,370.6,759.74
304,504,6144,1536,14,0,21.3281,a8w8_rowwise_256x128x96x256_32x32_1x3_16x16x1_16x16x1_1x64x1x4_8x8x1_1x1_intrawave_v3,0.0,446.02,769.15
304,504,6144,2048,14,0,25.4627,a8w8_rowwise_256x128x96x256_32x32_1x3_16x16x1_16x16x1_1x64x1x4_8x8x1_1x1_intrawave_v3,0.0,498.12,777.93
304,504,7168,256,44,0,10.6667,a8w8_rowwise_256x128x128x128_32x32_2x2_8x32x1_8x32x1_1x32x1x8_8x8x1_1x1_interwave_v1,0.0,173.41,861.5
304,504,7168,2304,14,0,29.1281,a8w8_rowwise_256x128x96x256_32x32_1x3_16x16x1_16x16x1_1x64x1x4_8x8x1_1x1_intrawave_v3,0.0,571.52,854.9
304,512,192,7168,34,0,12.344,a8w8_rowwise_256x16x64x512_16x16_1x1_32x8x1_32x8x1_1x16x1x16_4x4x1_1x1_intrawave_v3,0.0,114.17,424.73
304,512,512,7168,30,0,14.8932,a8w8_rowwise_256x32x64x512_16x16_1x2_32x8x1_32x8x1_1x32x1x8_8x8x1_1x2_intrawave_v3,0.0,252.34,528.05
304,512,896,5120,30,0,14.9484,a8w8_rowwise_256x32x64x512_16x16_1x2_32x8x1_32x8x1_1x32x1x8_8x8x1_1x2_intrawave_v3,0.0,314.26,543.63
304,512,1024,5632,30,0,17.9804,a8w8_rowwise_256x32x64x512_16x16_1x2_32x8x1_32x8x1_1x32x1x8_8x8x1_1x2_intrawave_v3,0.0,328.45,539.44
304,512,1056,1408,75,0,8.0101,a8w8_rowwise_128x64x16x128_16x16_2x1_8x16x1_8x16x1_1x16x1x8_2x2x1_1x1_interwave_v2,0.0,190.08,410.62
304,512,1280,4096,23,0,16.4463,a8w8_rowwise_256x64x64x512_32x32_1x1_32x8x1_32x8x1_1x32x1x8_8x8x1_1x1_intrawave_v3,0.0,326.44,526.0
304,512,1408,352,48,0,5.4095,a8w8_rowwise_128x32x16x128_16x16_1x1_8x16x1_8x16x1_1x16x1x8_2x2x1_1x1_intrawave_v1,0.0,93.82,391.47
304,512,1408,1408,47,0,8.97,a8w8_rowwise_256x64x64x128_32x32_1x1_8x32x1_8x32x1_1x32x1x8_8x8x1_1x1_intrawave_v3,0.0,226.31,462.11
304,512,1536,2048,23,0,11.029,a8w8_rowwise_256x64x64x512_32x32_1x1_32x8x1_32x8x1_1x32x1x8_8x8x1_1x1_intrawave_v3,0.0,292.07,522.91
304,512,1792,6144,23,0,24.8872,a8w8_rowwise_256x64x64x512_32x32_1x1_32x8x1_32x8x1_1x32x1x8_8x8x1_1x1_intrawave_v3,0.0,453.02,642.53
304,512,2048,1536,23,0,10.6557,a8w8_rowwise_256x64x64x512_32x32_1x1_32x8x1_32x8x1_1x32x1x8_8x8x1_1x1_intrawave_v3,0.0,302.3,565.83
304,512,2048,6144,23,0,26.4624,a8w8_rowwise_256x64x64x512_32x32_1x1_32x8x1_32x8x1_1x32x1x8_8x8x1_1x1_intrawave_v3,0.0,486.91,673.63
304,512,3072,4096,22,0,28.5772,a8w8_rowwise_256x64x96x256_16x16_2x3_16x16x1_16x16x1_1x64x1x4_8x8x1_2x1_intrawave_v3,0.0,450.88,623.78
304,512,3584,6144,15,0,44.0246,a8w8_rowwise_256x128x64x256_32x32_2x1_16x16x1_16x16x1_1x32x1x8_8x8x1_1x1_intrawave_v3,0.0,512.18,654.99
304,512,4096,640,47,0,9.7331,a8w8_rowwise_256x64x64x128_32x32_1x1_8x32x1_8x32x1_1x32x1x8_8x8x1_1x1_intrawave_v3,0.0,275.8,733.93
304,512,4096,1024,15,0,12.6779,a8w8_rowwise_256x128x64x256_32x32_2x1_16x16x1_16x16x1_1x32x1x8_8x8x1_1x1_intrawave_v3,0.0,338.78,703.03
304,512,4096,3072,15,0,25.7368,a8w8_rowwise_256x128x64x256_32x32_2x1_16x16x1_16x16x1_1x32x1x8_8x8x1_1x1_intrawave_v3,0.0,500.64,712.99
304,512,5120,640,47,0,11.5435,a8w8_rowwise_256x64x64x128_32x32_1x1_8x32x1_8x32x1_1x32x1x8_8x8x1_1x1_intrawave_v3,0.0,290.68,766.44
304,512,5120,2048,14,0,23.4659,a8w8_rowwise_256x128x96x256_32x32_1x3_16x16x1_16x16x1_1x64x1x4_8x8x1_1x1_intrawave_v3,0.0,457.58,714.96
304,512,6144,768,14,0,13.4765,a8w8_rowwise_256x128x96x256_32x32_1x3_16x16x1_16x16x1_1x64x1x4_8x8x1_1x1_intrawave_v3,0.0,358.54,846.16
304,512,6144,1024,14,0,16.5858,a8w8_rowwise_256x128x96x256_32x32_1x3_16x16x1_16x16x1_1x64x1x4_8x8x1_1x1_intrawave_v3,0.0,388.43,790.27
304,512,6144,1536,14,0,20.7437,a8w8_rowwise_256x128x96x256_32x32_1x3_16x16x1_16x16x1_1x64x1x4_8x8x1_1x1_intrawave_v3,0.0,465.86,796.15
304,512,6144,2048,14,0,24.6641,a8w8_rowwise_256x128x96x256_32x32_1x3_16x16x1_16x16x1_1x64x1x4_8x8x1_1x1_intrawave_v3,0.0,522.42,807.77
304,512,7168,256,44,0,10.546,a8w8_rowwise_256x128x128x128_32x32_2x2_8x32x1_8x32x1_1x32x1x8_8x8x1_1x1_interwave_v1,0.0,178.18,882.43
304,512,7168,2304,12,0,29.2243,a8w8_rowwise_256x128x128x256_32x32_2x2_16x16x1_16x16x1_1x32x1x8_8x8x1_1x1_intrawave_v3,0.0,578.68,856.64
304,1024,192,7168,34,0,14.3421,a8w8_rowwise_256x16x64x512_16x16_1x1_32x8x1_32x8x1_1x16x1x16_4x4x1_1x1_intrawave_v3,0.0,196.52,635.16
304,1024,512,7168,30,0,20.6032,a8w8_rowwise_256x32x64x512_16x16_1x2_32x8x1_32x8x1_1x32x1x8_8x8x1_1x2_intrawave_v3,0.0,364.81,585.28
304,1024,896,5120,23,0,21.6911,a8w8_rowwise_256x64x64x512_32x32_1x1_32x8x1_32x8x1_1x32x1x8_8x8x1_1x1_intrawave_v3,0.0,433.14,537.8
304,1024,1024,5632,23,0,24.8869,a8w8_rowwise_256x64x64x512_32x32_1x1_32x8x1_32x8x1_1x32x1x8_8x8x1_1x1_intrawave_v3,0.0,474.59,547.74
304,1024,1056,1408,47,0,11.032,a8w8_rowwise_256x64x64x128_32x32_1x1_8x32x1_8x32x1_1x32x1x8_8x8x1_1x1_intrawave_v3,0.0,276.02,461.51
304,1024,1280,4096,21,0,26.4957,a8w8_rowwise_256x64x128x256_32x32_1x2_16x16x1_16x16x1_1x32x1x8_8x8x1_1x1_intrawave_v3,0.0,405.25,455.12
304,1024,1408,352,47,0,6.8328,a8w8_rowwise_256x64x64x128_32x32_1x1_8x32x1_8x32x1_1x32x1x8_8x8x1_1x1_intrawave_v3,0.0,148.55,547.31
304,1024,1408,1408,46,0,12.2998,a8w8_rowwise_256x64x128x128_32x32_1x2_8x32x1_8x32x1_1x32x1x8_8x8x1_1x1_intrawave_v3,0.0,330.09,512.84
304,1024,1536,2048,22,0,17.935,a8w8_rowwise_256x64x96x256_16x16_2x3_16x16x1_16x16x1_1x64x1x4_8x8x1_2x1_intrawave_v3,0.0,359.21,467.72
304,1024,1792,6144,15,0,44.0022,a8w8_rowwise_256x128x64x256_32x32_2x1_16x16x1_16x16x1_1x32x1x8_8x8x1_1x1_intrawave_v3,0.0,512.44,476.6
304,1024,2048,1536,21,0,16.8445,a8w8_rowwise_256x64x128x256_32x32_1x2_16x16x1_16x16x1_1x32x1x8_8x8x1_1x1_intrawave_v3,0.0,382.47,529.13
304,1024,2048,6144,15,0,45.5513,a8w8_rowwise_256x128x64x256_32x32_2x1_16x16x1_16x16x1_1x32x1x8_8x8x1_1x1_intrawave_v3,0.0,565.73,506.43
304,1024,3072,4096,14,0,41.4576,a8w8_rowwise_256x128x96x256_32x32_1x3_16x16x1_16x16x1_1x64x1x4_8x8x1_1x1_intrawave_v3,0.0,621.59,556.44
304,1024,3584,6144,14,0,68.2269,a8w8_rowwise_256x128x96x256_32x32_1x3_16x16x1_16x16x1_1x64x1x4_8x8x1_1x1_intrawave_v3,0.0,660.99,522.54
304,1024,4096,640,13,0,13.8658,a8w8_rowwise_256x128x128x128_32x32_2x2_8x32x1_8x32x1_1x32x1x8_8x8x1_1x1_intrawave_v3,0.0,387.19,841.31
304,1024,4096,1024,12,0,19.2805,a8w8_rowwise_256x128x128x256_32x32_2x2_16x16x1_16x16x1_1x32x1x8_8x8x1_1x1_intrawave_v3,0.0,445.52,707.01
304,1024,4096,3072,12,0,41.4308,a8w8_rowwise_256x128x128x256_32x32_2x2_16x16x1_16x16x1_1x32x1x8_8x8x1_1x1_intrawave_v3,0.0,622.0,582.11
304,1024,5120,640,11,0,17.8171,a8w8_rowwise_256x128x160x128_32x32_1x5_8x32x1_8x32x1_1x64x1x4_8x8x1_1x1_intrawave_v3,0.0,376.65,809.22
304,1024,5120,2048,11,0,38.6302,a8w8_rowwise_256x128x160x128_32x32_1x5_8x32x1_8x32x1_1x64x1x4_8x8x1_1x1_intrawave_v3,0.0,555.91,597.17
304,1024,6144,768,10,0,21.7381,a8w8_rowwise_256x128x192x128_32x32_2x3_8x32x1_8x32x1_1x32x1x8_8x8x1_1x1_intrawave_v3,0.0,444.55,832.08
304,1024,6144,1024,10,0,27.6562,a8w8_rowwise_256x128x192x128_32x32_2x3_8x32x1_8x32x1_1x32x1x8_8x8x1_1x1_intrawave_v3,0.0,465.9,720.38
304,1024,6144,1536,10,0,35.292,a8w8_rowwise_256x128x192x128_32x32_2x3_8x32x1_8x32x1_1x32x1x8_8x8x1_1x1_intrawave_v3,0.0,547.64,668.51
304,1024,6144,2048,10,0,43.3052,a8w8_rowwise_256x128x192x128_32x32_2x3_8x32x1_8x32x1_1x32x1x8_8x8x1_1x1_intrawave_v3,0.0,595.07,629.55
304,1024,7168,256,44,0,14.8624,a8w8_rowwise_256x128x128x128_32x32_2x2_8x32x1_8x32x1_1x32x1x8_8x8x1_1x1_interwave_v1,0.0,252.86,1128.84
304,1024,7168,2304,10,0,50.0008,a8w8_rowwise_256x128x192x128_32x32_2x3_8x32x1_8x32x1_1x32x1x8_8x8x1_1x1_intrawave_v3,0.0,676.45,671.08
304,8192,192,7168,22,0,51.4006,a8w8_rowwise_256x64x96x256_16x16_2x3_16x16x1_16x16x1_1x64x1x4_8x8x1_2x1_intrawave_v3,0.0,438.68,1230.38
304,8192,512,7168,12,0,84.6508,a8w8_rowwise_256x128x128x256_32x32_2x2_16x16x1_16x16x1_1x32x1x8_8x8x1_1x1_intrawave_v3,0.0,710.32,836.13
304,8192,896,5120,41,0,100.924,a8w8_rowwise_256x128x128x128_32x32_2x2_8x32x1_8x32x1_1x32x1x8_8x8x1_1x1_intrawave_v5,0.0,744.74,606.5
304,8192,1024,5632,13,0,121.3129,a8w8_rowwise_256x128x128x128_32x32_2x2_8x32x1_8x32x1_1x32x1x8_8x8x1_1x1_intrawave_v3,0.0,778.89,566.15
304,8192,1056,1408,13,0,39.9511,a8w8_rowwise_256x128x128x128_32x32_2x2_8x32x1_8x32x1_1x32x1x8_8x8x1_1x1_intrawave_v3,0.0,609.76,759.0
304,8192,1280,4096,4,0,109.2248,a8w8_rowwise_256x256x160x128_32x32_2x5_8x32x1_8x32x1_1x64x1x4_8x8x1_2x1_intrawave_v3,0.0,786.45,547.21
304,8192,1408,352,44,0,25.4581,a8w8_rowwise_256x128x128x128_32x32_2x2_8x32x1_8x32x1_1x32x1x8_8x8x1_1x1_interwave_v1,0.0,318.96,1038.88
304,8192,1408,1408,4,0,51.0257,a8w8_rowwise_256x256x160x128_32x32_2x5_8x32x1_8x32x1_1x64x1x4_8x8x1_2x1_intrawave_v3,0.0,636.56,717.0
304,8192,1536,2048,3,0,73.4173,a8w8_rowwise_256x256x192x128_32x32_4x3_8x32x1_8x32x1_1x32x1x8_8x8x1_1x1_intrawave_v3,0.0,702.01,614.14
304,8192,1792,6144,2,0,201.3316,a8w8_rowwise_256x256x224x128_32x32_2x7_8x32x1_8x32x1_1x64x1x4_8x8x1_2x1_intrawave_v3,0.0,895.98,450.51
304,8192,2048,1536,39,0,74.2513,a8w8_rowwise_256x224x256x128_16x16_7x8_8x32x1_8x32x1_1x32x1x8_8x8x1_1x2_intrawave_v3,0.0,694.12,663.73
304,8192,2048,6144,39,0,224.7282,a8w8_rowwise_256x224x256x128_16x16_7x8_8x32x1_8x32x1_1x32x1x8_8x8x1_1x2_intrawave_v3,0.0,917.37,429.27
304,8192,3072,4096,3,0,235.5366,a8w8_rowwise_256x256x192x128_32x32_4x3_8x32x1_8x32x1_1x32x1x8_8x8x1_1x1_intrawave_v3,0.0,875.27,409.57
304,8192,3584,6144,3,0,386.2269,a8w8_rowwise_256x256x192x128_32x32_4x3_8x32x1_8x32x1_1x32x1x8_8x8x1_1x1_intrawave_v3,0.0,934.11,339.37
304,8192,4096,640,13,0,75.641,a8w8_rowwise_256x128x128x128_32x32_2x2_8x32x1_8x32x1_1x32x1x8_8x8x1_1x1_intrawave_v3,0.0,567.81,991.17
304,8192,4096,1024,39,0,107.082,a8w8_rowwise_256x224x256x128_16x16_7x8_8x32x1_8x32x1_1x32x1x8_8x8x1_1x2_intrawave_v3,0.0,641.75,744.21
304,8192,4096,3072,39,0,238.7569,a8w8_rowwise_256x224x256x128_16x16_7x8_8x32x1_8x32x1_1x32x1x8_8x8x1_1x2_intrawave_v3,0.0,863.47,439.18
304,8192,5120,640,13,0,95.9995,a8w8_rowwise_256x128x128x128_32x32_2x2_8x32x1_8x32x1_1x32x1x8_8x8x1_1x1_intrawave_v3,0.0,559.24,962.57
304,8192,5120,2048,3,0,217.8629,a8w8_rowwise_256x256x192x128_32x32_4x3_8x32x1_8x32x1_1x32x1x8_8x8x1_1x1_intrawave_v3,0.0,788.56,510.18
304,8192,6144,768,13,0,127.8101,a8w8_rowwise_256x128x128x128_32x32_2x2_8x32x1_8x32x1_1x32x1x8_8x8x1_1x1_intrawave_v3,0.0,604.88,873.74
304,8192,6144,1024,13,0,154.546,a8w8_rowwise_256x128x128x128_32x32_2x2_8x32x1_8x32x1_1x32x1x8_8x8x1_1x1_intrawave_v3,0.0,666.98,746.34
304,8192,6144,1536,39,0,204.2537,a8w8_rowwise_256x224x256x128_16x16_7x8_8x32x1_8x32x1_1x32x1x8_8x8x1_1x2_intrawave_v3,0.0,756.99,600.64
304,8192,6144,2048,2,0,254.253,a8w8_rowwise_256x256x224x128_32x32_2x7_8x32x1_8x32x1_1x64x1x4_8x8x1_2x1_intrawave_v3,0.0,810.84,511.39
304,8192,7168,256,44,0,82.264,a8w8_rowwise_256x128x128x128_32x32_2x2_8x32x1_8x32x1_1x32x1x8_8x8x1_1x1_interwave_v1,0.0,365.47,1475.4
304,8192,7168,2304,0,0,303.6765,a8w8_rowwise_256x256x256x64_32x32_4x4_4x64x1_4x64x1_1x32x1x8_8x8x1_1x1_intrawave_v4,0.0,891.02,503.27
