kernels/ptpc/mi300x_tuned_configs/a8w8_bpreshuffle_tuned_gemm.csv
cu_num,M,N,K,kernelId,splitK,us,kernelName,errRatio,tflops,bw
304,1,192,7168,5,0,-1.0,a8w8_bpreshuffle_256x16x64x512_16x16_16x16_32x8x1_32x8x1_1x16x1x16_4x4x1_1x1_intrawave_v1,1.0,-1.0,-1.0
304,1,512,7168,10,0,-1.0,a8w8_bpreshuffle_128x16x32x512_16x16_16x16_32x4x1_32x4x1_1x16x1x8_4x4x1_1x1_intrawave_v1,1.0,-1.0,-1.0
304,1,576,7168,10,0,9.6418,a8w8_bpreshuffle_128x16x32x512_16x16_16x16_32x4x1_32x4x1_1x16x1x8_4x4x1_1x1_intrawave_v1,0.86,429.08,0.0
304,1,896,5120,10,0,8.0754,a8w8_bpreshuffle_128x16x32x512_16x16_16x16_32x4x1_32x4x1_1x16x1x8_4x4x1_1x1_intrawave_v1,0.0,1.14,568.94
304,1,1024,5632,10,0,8.5533,a8w8_bpreshuffle_128x16x32x512_16x16_16x16_32x4x1_32x4x1_1x16x1x8_4x4x1_1x1_intrawave_v1,0.0,1.35,675.16
304,1,1056,1408,9,0,5.8457,a8w8_bpreshuffle_128x16x32x128_16x16_16x16_8x16x1_8x16x1_1x16x1x8_4x4x1_1x1_intrawave_v1,0.0,0.51,254.95
304,1,1280,4096,10,0,7.1564,a8w8_bpreshuffle_128x16x32x512_16x16_16x16_32x4x1_32x4x1_1x16x1x8_4x4x1_1x1_intrawave_v1,0.0,1.47,733.54
304,1,1408,352,0,0,-1.0,a8w8_bpreshuffle_256x128x128x128_16x16_16x16_8x32x1_8x32x1_1x32x1x8_8x8x1_2x1_intrawave_v3,1.0,-1.0,-1.0
304,1,1408,1408,23,0,-1.0,a8w8_bpreshuffle_128x16x32x128_16x16_16x16_8x16x1_8x16x1_1x16x1x8_4x4x1_1x1_intrawave_v2,1.0,-1.0,-1.0
304,1,1536,2048,10,0,-1.0,a8w8_bpreshuffle_128x16x32x512_16x16_16x16_32x4x1_32x4x1_1x16x1x8_4x4x1_1x1_intrawave_v1,1.0,-1.0,-1.0
304,1,1536,7168,10,0,10.1771,a8w8_bpreshuffle_128x16x32x512_16x16_16x16_32x4x1_32x4x1_1x16x1x8_4x4x1_1x1_intrawave_v1,2.16,1082.85,0.0
304,1,1792,6144,10,0,-1.0,a8w8_bpreshuffle_128x16x32x512_16x16_16x16_32x4x1_32x4x1_1x16x1x8_4x4x1_1x1_intrawave_v1,1.0,-1.0,-1.0
304,1,2048,1536,10,0,-1.0,a8w8_bpreshuffle_128x16x32x512_16x16_16x16_32x4x1_32x4x1_1x16x1x8_4x4x1_1x1_intrawave_v1,1.0,-1.0,-1.0
304,1,2048,6144,10,0,-1.0,a8w8_bpreshuffle_128x16x32x512_16x16_16x16_32x4x1_32x4x1_1x16x1x8_4x4x1_1x1_intrawave_v1,1.0,-1.0,-1.0
304,1,2112,7168,10,0,9.9299,a8w8_bpreshuffle_128x16x32x512_16x16_16x16_32x4x1_32x4x1_1x16x1x8_4x4x1_1x1_intrawave_v1,3.05,1525.72,0.0
304,1,3072,1536,10,0,4.6023,a8w8_bpreshuffle_128x16x32x512_16x16_16x16_32x4x1_32x4x1_1x16x1x8_4x4x1_1x1_intrawave_v1,2.05,1026.94,0.0
304,1,3072,4096,10,0,-1.0,a8w8_bpreshuffle_128x16x32x512_16x16_16x16_32x4x1_32x4x1_1x16x1x8_4x4x1_1x1_intrawave_v1,1.0,-1.0,-1.0
304,1,3584,6144,10,0,-1.0,a8w8_bpreshuffle_128x16x32x512_16x16_16x16_32x4x1_32x4x1_1x16x1x8_4x4x1_1x1_intrawave_v1,1.0,-1.0,-1.0
304,1,4096,512,9,0,3.9713,a8w8_bpreshuffle_128x16x32x128_16x16_16x16_8x16x1_8x16x1_1x16x1x8_4x4x1_1x1_intrawave_v1,1.06,530.27,0.0
304,1,4096,640,23,0,4.7217,a8w8_bpreshuffle_128x16x32x128_16x16_16x16_8x16x1_8x16x1_1x16x1x8_4x4x1_1x1_intrawave_v2,0.0,1.11,557.06
304,1,4096,1024,15,0,-1.0,a8w8_bpreshuffle_256x16x64x256_16x16_16x16_16x16x1_16x16x1_1x16x1x16_4x4x1_1x1_intrawave_v1,1.0,-1.0,-1.0
304,1,4096,3072,10,0,-1.0,a8w8_bpreshuffle_128x16x32x512_16x16_16x16_32x4x1_32x4x1_1x16x1x8_4x4x1_1x1_intrawave_v1,1.0,-1.0,-1.0
304,1,4608,7168,10,0,11.3829,a8w8_bpreshuffle_128x16x32x512_16x16_16x16_32x4x1_32x4x1_1x16x1x8_4x4x1_1x1_intrawave_v1,5.8,2903.17,0.0
304,1,5120,640,9,0,5.3947,a8w8_bpreshuffle_128x16x32x128_16x16_16x16_8x16x1_8x16x1_1x16x1x8_4x4x1_1x1_intrawave_v1,0.0,1.21,609.43
304,1,5120,2048,10,0,5.982,a8w8_bpreshuffle_128x16x32x512_16x16_16x16_32x4x1_32x4x1_1x16x1x8_4x4x1_1x1_intrawave_v1,0.0,3.51,1754.94
304,1,6144,768,108,0,-1.0,a8w8_bpreshuffle_256x16x64x256_16x16_16x16_16x16x1_16x16x1_1x16x1x16_4x4x1_1x1_intrawave_v1,1.0,-1.0,-1.0
304,1,6144,1024,108,0,-1.0,a8w8_bpreshuffle_256x16x64x256_16x16_16x16_16x16x1_16x16x1_1x16x1x16_4x4x1_1x1_intrawave_v1,1.0,-1.0,-1.0
304,1,6144,1536,10,0,-1.0,a8w8_bpreshuffle_128x16x32x512_16x16_16x16_32x4x1_32x4x1_1x16x1x8_4x4x1_1x1_intrawave_v1,1.0,-1.0,-1.0
304,1,6144,2048,10,0,-1.0,a8w8_bpreshuffle_128x16x32x512_16x16_16x16_32x4x1_32x4x1_1x16x1x8_4x4x1_1x1_intrawave_v1,1.0,-1.0,-1.0
304,1,7168,256,75,0,-1.0,a8w8_bpreshuffle_128x16x256x64_16x16_16x16_4x16x1_4x32x1_1x16x1x8_8x8x1_1x2_intrawave_v1,1.0,-1.0,-1.0
304,1,7168,2048,10,0,6.5863,a8w8_bpreshuffle_128x16x32x512_16x16_16x16_32x4x1_32x4x1_1x16x1x8_4x4x1_1x1_intrawave_v1,4.46,2231.37,0.0
304,1,7168,2304,108,0,-1.0,a8w8_bpreshuffle_256x16x64x256_16x16_16x16_16x16x1_16x16x1_1x16x1x16_4x4x1_1x1_intrawave_v1,1.0,-1.0,-1.0
304,2,192,7168,11,0,-1.0,a8w8_bpreshuffle_256x16x64x512_16x16_16x16_32x8x1_32x8x1_1x16x1x16_4x4x1_1x1_intrawave_v1,1.0,-1.0,-1.0
304,2,512,7168,10,0,-1.0,a8w8_bpreshuffle_128x16x32x512_16x16_16x16_32x4x1_32x4x1_1x16x1x8_4x4x1_1x1_intrawave_v1,1.0,-1.0,-1.0
304,2,576,7168,10,0,9.9307,a8w8_bpreshuffle_128x16x32x512_16x16_16x16_32x4x1_32x4x1_1x16x1x8_4x4x1_1x1_intrawave_v1,1.66,417.43,0.0
304,2,896,5120,10,0,-1.0,a8w8_bpreshuffle_128x16x32x512_16x16_16x16_32x4x1_32x4x1_1x16x1x8_4x4x1_1x1_intrawave_v1,1.0,-1.0,-1.0
304,2,1024,5632,10,0,-1.0,a8w8_bpreshuffle_128x16x32x512_16x16_16x16_32x4x1_32x4x1_1x16x1x8_4x4x1_1x1_intrawave_v1,1.0,-1.0,-1.0
304,2,1056,1408,9,0,-1.0,a8w8_bpreshuffle_128x16x32x128_16x16_16x16_8x16x1_8x16x1_1x16x1x8_4x4x1_1x1_intrawave_v1,1.0,-1.0,-1.0
304,2,1280,4096,10,0,-1.0,a8w8_bpreshuffle_128x16x32x512_16x16_16x16_32x4x1_32x4x1_1x16x1x8_4x4x1_1x1_intrawave_v1,1.0,-1.0,-1.0
304,2,1408,352,0,0,-1.0,a8w8_bpreshuffle_256x128x128x128_16x16_16x16_8x32x1_8x32x1_1x32x1x8_8x8x1_2x1_intrawave_v3,1.0,-1.0,-1.0
304,2,1408,1408,9,0,-1.0,a8w8_bpreshuffle_128x16x32x128_16x16_16x16_8x16x1_8x16x1_1x16x1x8_4x4x1_1x1_intrawave_v1,1.0,-1.0,-1.0
304,2,1536,2048,10,0,-1.0,a8w8_bpreshuffle_128x16x32x512_16x16_16x16_32x4x1_32x4x1_1x16x1x8_4x4x1_1x1_intrawave_v1,1.0,-1.0,-1.0
304,2,1536,7168,10,0,10.4757,a8w8_bpreshuffle_128x16x32x512_16x16_16x16_32x4x1_32x4x1_1x16x1x8_4x4x1_1x1_intrawave_v1,4.2,1052.96,0.0
304,2,1792,6144,10,0,-1.0,a8w8_bpreshuffle_128x16x32x512_16x16_16x16_32x4x1_32x4x1_1x16x1x8_4x4x1_1x1_intrawave_v1,1.0,-1.0,-1.0
304,2,2048,1536,10,0,-1.0,a8w8_bpreshuffle_128x16x32x512_16x16_16x16_32x4x1_32x4x1_1x16x1x8_4x4x1_1x1_intrawave_v1,1.0,-1.0,-1.0
304,2,2048,6144,10,0,-1.0,a8w8_bpreshuffle_128x16x32x512_16x16_16x16_32x4x1_32x4x1_1x16x1x8_4x4x1_1x1_intrawave_v1,1.0,-1.0,-1.0
304,2,2112,7168,10,0,10.2224,a8w8_bpreshuffle_128x16x32x512_16x16_16x16_32x4x1_32x4x1_1x16x1x8_4x4x1_1x1_intrawave_v1,5.92,1483.17,0.0
304,2,3072,1536,10,0,5.0017,a8w8_bpreshuffle_128x16x32x512_16x16_16x16_32x4x1_32x4x1_1x16x1x8_4x4x1_1x1_intrawave_v1,3.77,946.47,0.0
304,2,3072,4096,10,0,-1.0,a8w8_bpreshuffle_128x16x32x512_16x16_16x16_32x4x1_32x4x1_1x16x1x8_4x4x1_1x1_intrawave_v1,1.0,-1.0,-1.0
304,2,3584,6144,10,0,-1.0,a8w8_bpreshuffle_128x16x32x512_16x16_16x16_32x4x1_32x4x1_1x16x1x8_4x4x1_1x1_intrawave_v1,1.0,-1.0,-1.0
304,2,4096,512,9,0,4.0471,a8w8_bpreshuffle_128x16x32x128_16x16_16x16_8x16x1_8x16x1_1x16x1x8_4x4x1_1x1_intrawave_v1,2.07,522.49,0.0
304,2,4096,640,9,0,-1.0,a8w8_bpreshuffle_128x16x32x128_16x16_16x16_8x16x1_8x16x1_1x16x1x8_4x4x1_1x1_intrawave_v1,1.0,-1.0,-1.0
304,2,4096,1024,108,0,-1.0,a8w8_bpreshuffle_256x16x64x256_16x16_16x16_16x16x1_16x16x1_1x16x1x16_4x4x1_1x1_intrawave_v1,1.0,-1.0,-1.0
304,2,4096,3072,5,0,-1.0,a8w8_bpreshuffle_256x16x64x512_16x16_16x16_32x8x1_32x8x1_1x16x1x16_4x4x1_1x1_intrawave_v1,1.0,-1.0,-1.0
304,2,4608,7168,24,0,11.5387,a8w8_bpreshuffle_128x16x32x512_16x16_16x16_32x4x1_32x4x1_1x16x1x8_4x4x1_1x1_intrawave_v2,11.45,2865.39,0.0
304,2,5120,640,23,0,-1.0,a8w8_bpreshuffle_128x16x32x128_16x16_16x16_8x16x1_8x16x1_1x16x1x8_4x4x1_1x1_intrawave_v2,1.0,-1.0,-1.0
304,2,5120,2048,10,0,-1.0,a8w8_bpreshuffle_128x16x32x512_16x16_16x16_32x4x1_32x4x1_1x16x1x8_4x4x1_1x1_intrawave_v1,1.0,-1.0,-1.0
304,2,6144,768,108,0,-1.0,a8w8_bpreshuffle_256x16x64x256_16x16_16x16_16x16x1_16x16x1_1x16x1x16_4x4x1_1x1_intrawave_v1,1.0,-1.0,-1.0
304,2,6144,1024,108,0,-1.0,a8w8_bpreshuffle_256x16x64x256_16x16_16x16_16x16x1_16x16x1_1x16x1x16_4x4x1_1x1_intrawave_v1,1.0,-1.0,-1.0
304,2,6144,1536,10,0,-1.0,a8w8_bpreshuffle_128x16x32x512_16x16_16x16_32x4x1_32x4x1_1x16x1x8_4x4x1_1x1_intrawave_v1,1.0,-1.0,-1.0
304,2,6144,2048,10,0,-1.0,a8w8_bpreshuffle_128x16x32x512_16x16_16x16_32x4x1_32x4x1_1x16x1x8_4x4x1_1x1_intrawave_v1,1.0,-1.0,-1.0
304,2,7168,256,75,0,-1.0,a8w8_bpreshuffle_128x16x256x64_16x16_16x16_4x16x1_4x32x1_1x16x1x8_8x8x1_1x2_intrawave_v1,1.0,-1.0,-1.0
304,2,7168,2048,10,0,6.0971,a8w8_bpreshuffle_128x16x32x512_16x16_16x16_32x4x1_32x4x1_1x16x1x8_4x4x1_1x1_intrawave_v1,9.63,2413.09,0.0
304,2,7168,2304,108,0,-1.0,a8w8_bpreshuffle_256x16x64x256_16x16_16x16_16x16x1_16x16x1_1x16x1x16_4x4x1_1x1_intrawave_v1,1.0,-1.0,-1.0
304,4,192,7168,11,0,-1.0,a8w8_bpreshuffle_256x16x64x512_16x16_16x16_32x8x1_32x8x1_1x16x1x16_4x4x1_1x1_intrawave_v1,1.0,-1.0,-1.0
304,4,512,7168,10,0,-1.0,a8w8_bpreshuffle_128x16x32x512_16x16_16x16_32x4x1_32x4x1_1x16x1x8_4x4x1_1x1_intrawave_v1,1.0,-1.0,-1.0
304,4,576,7168,10,0,9.9911,a8w8_bpreshuffle_128x16x32x512_16x16_16x16_32x4x1_32x4x1_1x16x1x8_4x4x1_1x1_intrawave_v1,3.31,416.58,0.0
304,4,896,5120,10,0,-1.0,a8w8_bpreshuffle_128x16x32x512_16x16_16x16_32x4x1_32x4x1_1x16x1x8_4x4x1_1x1_intrawave_v1,1.0,-1.0,-1.0
304,4,1024,5632,10,0,-1.0,a8w8_bpreshuffle_128x16x32x512_16x16_16x16_32x4x1_32x4x1_1x16x1x8_4x4x1_1x1_intrawave_v1,1.0,-1.0,-1.0
304,4,1056,1408,9,0,-1.0,a8w8_bpreshuffle_128x16x32x128_16x16_16x16_8x16x1_8x16x1_1x16x1x8_4x4x1_1x1_intrawave_v1,1.0,-1.0,-1.0
304,4,1280,4096,10,0,-1.0,a8w8_bpreshuffle_128x16x32x512_16x16_16x16_32x4x1_32x4x1_1x16x1x8_4x4x1_1x1_intrawave_v1,1.0,-1.0,-1.0
304,4,1408,352,0,0,-1.0,a8w8_bpreshuffle_256x128x128x128_16x16_16x16_8x32x1_8x32x1_1x32x1x8_8x8x1_2x1_intrawave_v3,1.0,-1.0,-1.0
304,4,1408,1408,23,0,-1.0,a8w8_bpreshuffle_128x16x32x128_16x16_16x16_8x16x1_8x16x1_1x16x1x8_4x4x1_1x1_intrawave_v2,1.0,-1.0,-1.0
304,4,1536,2048,10,0,-1.0,a8w8_bpreshuffle_128x16x32x512_16x16_16x16_32x4x1_32x4x1_1x16x1x8_4x4x1_1x1_intrawave_v1,1.0,-1.0,-1.0
304,4,1536,7168,10,0,10.2908,a8w8_bpreshuffle_128x16x32x512_16x16_16x16_32x4x1_32x4x1_1x16x1x8_4x4x1_1x1_intrawave_v1,8.56,1073.87,0.0
304,4,1792,6144,10,0,-1.0,a8w8_bpreshuffle_128x16x32x512_16x16_16x16_32x4x1_32x4x1_1x16x1x8_4x4x1_1x1_intrawave_v1,1.0,-1.0,-1.0
304,4,2048,1536,10,0,-1.0,a8w8_bpreshuffle_128x16x32x512_16x16_16x16_32x4x1_32x4x1_1x16x1x8_4x4x1_1x1_intrawave_v1,1.0,-1.0,-1.0
304,4,2048,6144,10,0,-1.0,a8w8_bpreshuffle_128x16x32x512_16x16_16x16_32x4x1_32x4x1_1x16x1x8_4x4x1_1x1_intrawave_v1,1.0,-1.0,-1.0
304,4,2112,7168,10,0,10.1922,a8w8_bpreshuffle_128x16x32x512_16x16_16x16_32x4x1_32x4x1_1x16x1x8_4x4x1_1x1_intrawave_v1,11.88,1489.8,0.0
304,4,3072,1536,10,0,4.6416,a8w8_bpreshuffle_128x16x32x512_16x16_16x16_32x4x1_32x4x1_1x16x1x8_4x4x1_1x1_intrawave_v1,8.13,1023.21,0.0
304,4,3072,4096,10,0,-1.0,a8w8_bpreshuffle_128x16x32x512_16x16_16x16_32x4x1_32x4x1_1x16x1x8_4x4x1_1x1_intrawave_v1,1.0,-1.0,-1.0
304,4,3584,6144,10,0,-1.0,a8w8_bpreshuffle_128x16x32x512_16x16_16x16_32x4x1_32x4x1_1x16x1x8_4x4x1_1x1_intrawave_v1,1.0,-1.0,-1.0
304,4,4096,512,9,0,3.4336,a8w8_bpreshuffle_128x16x32x128_16x16_16x16_8x16x1_8x16x1_1x16x1x8_4x4x1_1x1_intrawave_v1,4.89,620.91,0.0
304,4,4096,640,23,0,-1.0,a8w8_bpreshuffle_128x16x32x128_16x16_16x16_8x16x1_8x16x1_1x16x1x8_4x4x1_1x1_intrawave_v2,1.0,-1.0,-1.0
304,4,4096,1024,108,0,-1.0,a8w8_bpreshuffle_256x16x64x256_16x16_16x16_16x16x1_16x16x1_1x16x1x16_4x4x1_1x1_intrawave_v1,1.0,-1.0,-1.0
304,4,4096,3072,8,0,-1.0,a8w8_bpreshuffle_128x32x16x512_16x16_16x16_32x4x1_32x4x1_1x32x1x4_4x4x1_1x1_intrawave_v1,1.0,-1.0,-1.0
304,4,4608,7168,11,0,11.5491,a8w8_bpreshuffle_256x16x64x512_16x16_16x16_32x8x1_32x8x1_1x16x1x16_4x4x1_1x1_intrawave_v1,22.88,2865.65,0.0
304,4,5120,640,23,0,-1.0,a8w8_bpreshuffle_128x16x32x128_16x16_16x16_8x16x1_8x16x1_1x16x1x8_4x4x1_1x1_intrawave_v2,1.0,-1.0,-1.0
304,4,5120,2048,10,0,-1.0,a8w8_bpreshuffle_128x16x32x512_16x16_16x16_32x4x1_32x4x1_1x16x1x8_4x4x1_1x1_intrawave_v1,1.0,-1.0,-1.0
304,4,6144,768,108,0,-1.0,a8w8_bpreshuffle_256x16x64x256_16x16_16x16_16x16x1_16x16x1_1x16x1x16_4x4x1_1x1_intrawave_v1,1.0,-1.0,-1.0
304,4,6144,1024,15,0,-1.0,a8w8_bpreshuffle_256x16x64x256_16x16_16x16_16x16x1_16x16x1_1x16x1x16_4x4x1_1x1_intrawave_v1,1.0,-1.0,-1.0
304,4,6144,1536,10,0,-1.0,a8w8_bpreshuffle_128x16x32x512_16x16_16x16_32x4x1_32x4x1_1x16x1x8_4x4x1_1x1_intrawave_v1,1.0,-1.0,-1.0
304,4,6144,2048,10,0,-1.0,a8w8_bpreshuffle_128x16x32x512_16x16_16x16_32x4x1_32x4x1_1x16x1x8_4x4x1_1x1_intrawave_v1,1.0,-1.0,-1.0
304,4,7168,256,75,0,-1.0,a8w8_bpreshuffle_128x16x256x64_16x16_16x16_4x16x1_4x32x1_1x16x1x8_8x8x1_1x2_intrawave_v1,1.0,-1.0,-1.0
304,4,7168,2048,10,0,6.5632,a8w8_bpreshuffle_128x16x32x512_16x16_16x16_32x4x1_32x4x1_1x16x1x8_4x4x1_1x1_intrawave_v1,17.89,2246.71,0.0
304,4,7168,2304,15,0,-1.0,a8w8_bpreshuffle_256x16x64x256_16x16_16x16_16x16x1_16x16x1_1x16x1x16_4x4x1_1x1_intrawave_v1,1.0,-1.0,-1.0
304,8,192,7168,11,0,-1.0,a8w8_bpreshuffle_256x16x64x512_16x16_16x16_32x8x1_32x8x1_1x16x1x16_4x4x1_1x1_intrawave_v1,1.0,-1.0,-1.0
304,8,512,7168,10,0,-1.0,a8w8_bpreshuffle_128x16x32x512_16x16_16x16_32x4x1_32x4x1_1x16x1x8_4x4x1_1x1_intrawave_v1,1.0,-1.0,-1.0
304,8,576,7168,10,0,9.7507,a8w8_bpreshuffle_128x16x32x512_16x16_16x16_32x4x1_32x4x1_1x16x1x8_4x4x1_1x1_intrawave_v1,6.77,430.26,0.0
304,8,896,5120,10,0,-1.0,a8w8_bpreshuffle_128x16x32x512_16x16_16x16_32x4x1_32x4x1_1x16x1x8_4x4x1_1x1_intrawave_v1,1.0,-1.0,-1.0
304,8,1024,5632,10,0,-1.0,a8w8_bpreshuffle_128x16x32x512_16x16_16x16_32x4x1_32x4x1_1x16x1x8_4x4x1_1x1_intrawave_v1,1.0,-1.0,-1.0
304,8,1056,1408,9,0,-1.0,a8w8_bpreshuffle_128x16x32x128_16x16_16x16_8x16x1_8x16x1_1x16x1x8_4x4x1_1x1_intrawave_v1,1.0,-1.0,-1.0
304,8,1280,4096,10,0,-1.0,a8w8_bpreshuffle_128x16x32x512_16x16_16x16_32x4x1_32x4x1_1x16x1x8_4x4x1_1x1_intrawave_v1,1.0,-1.0,-1.0
304,8,1408,352,0,0,-1.0,a8w8_bpreshuffle_256x128x128x128_16x16_16x16_8x32x1_8x32x1_1x32x1x8_8x8x1_2x1_intrawave_v3,1.0,-1.0,-1.0
304,8,1408,1408,9,0,-1.0,a8w8_bpreshuffle_128x16x32x128_16x16_16x16_8x16x1_8x16x1_1x16x1x8_4x4x1_1x1_intrawave_v1,1.0,-1.0,-1.0
304,8,1536,2048,10,0,-1.0,a8w8_bpreshuffle_128x16x32x512_16x16_16x16_32x4x1_32x4x1_1x16x1x8_4x4x1_1x1_intrawave_v1,1.0,-1.0,-1.0
304,8,1536,7168,10,0,10.1574,a8w8_bpreshuffle_128x16x32x512_16x16_16x16_32x4x1_32x4x1_1x16x1x8_4x4x1_1x1_intrawave_v1,17.34,1092.01,0.0
304,8,1792,6144,10,0,-1.0,a8w8_bpreshuffle_128x16x32x512_16x16_16x16_32x4x1_32x4x1_1x16x1x8_4x4x1_1x1_intrawave_v1,1.0,-1.0,-1.0
304,8,2048,1536,10,0,-1.0,a8w8_bpreshuffle_128x16x32x512_16x16_16x16_32x4x1_32x4x1_1x16x1x8_4x4x1_1x1_intrawave_v1,1.0,-1.0,-1.0
304,8,2048,6144,10,0,-1.0,a8w8_bpreshuffle_128x16x32x512_16x16_16x16_32x4x1_32x4x1_1x16x1x8_4x4x1_1x1_intrawave_v1,1.0,-1.0,-1.0
304,8,2112,7168,10,0,10.2338,a8w8_bpreshuffle_128x16x32x512_16x16_16x16_32x4x1_32x4x1_1x16x1x8_4x4x1_1x1_intrawave_v1,23.67,1488.2,0.0
304,8,3072,1536,10,0,5.1102,a8w8_bpreshuffle_128x16x32x512_16x16_16x16_32x4x1_32x4x1_1x16x1x8_4x4x1_1x1_intrawave_v1,14.77,935.39,0.0
304,8,3072,4096,10,0,-1.0,a8w8_bpreshuffle_128x16x32x512_16x16_16x16_32x4x1_32x4x1_1x16x1x8_4x4x1_1x1_intrawave_v1,1.0,-1.0,-1.0
304,8,3584,6144,10,0,-1.0,a8w8_bpreshuffle_128x16x32x512_16x16_16x16_32x4x1_32x4x1_1x16x1x8_4x4x1_1x1_intrawave_v1,1.0,-1.0,-1.0
304,8,4096,512,9,0,3.5379,a8w8_bpreshuffle_128x16x32x128_16x16_16x16_8x16x1_8x16x1_1x16x1x8_4x4x1_1x1_intrawave_v1,9.48,612.45,0.0
304,8,4096,640,9,0,-1.0,a8w8_bpreshuffle_128x16x32x128_16x16_16x16_8x16x1_8x16x1_1x16x1x8_4x4x1_1x1_intrawave_v1,1.0,-1.0,-1.0
304,8,4096,1024,108,0,-1.0,a8w8_bpreshuffle_256x16x64x256_16x16_16x16_16x16x1_16x16x1_1x16x1x16_4x4x1_1x1_intrawave_v1,1.0,-1.0,-1.0
304,8,4096,3072,8,0,-1.0,a8w8_bpreshuffle_128x32x16x512_16x16_16x16_32x4x1_32x4x1_1x32x1x4_4x4x1_1x1_intrawave_v1,1.0,-1.0,-1.0
304,8,4608,7168,11,0,11.4105,a8w8_bpreshuffle_256x16x64x512_16x16_16x16_32x8x1_32x8x1_1x16x1x16_4x4x1_1x1_intrawave_v1,46.32,2906.2,0.0
304,8,5120,640,23,0,-1.0,a8w8_bpreshuffle_128x16x32x128_16x16_16x16_8x16x1_8x16x1_1x16x1x8_4x4x1_1x1_intrawave_v2,1.0,-1.0,-1.0
304,8,5120,2048,10,0,-1.0,a8w8_bpreshuffle_128x16x32x512_16x16_16x16_32x4x1_32x4x1_1x16x1x8_4x4x1_1x1_intrawave_v1,1.0,-1.0,-1.0
304,8,6144,768,15,0,-1.0,a8w8_bpreshuffle_256x16x64x256_16x16_16x16_16x16x1_16x16x1_1x16x1x16_4x4x1_1x1_intrawave_v1,1.0,-1.0,-1.0
304,8,6144,1024,15,0,-1.0,a8w8_bpreshuffle_256x16x64x256_16x16_16x16_16x16x1_16x16x1_1x16x1x16_4x4x1_1x1_intrawave_v1,1.0,-1.0,-1.0
304,8,6144,1536,10,0,-1.0,a8w8_bpreshuffle_128x16x32x512_16x16_16x16_32x4x1_32x4x1_1x16x1x8_4x4x1_1x1_intrawave_v1,1.0,-1.0,-1.0
304,8,6144,2048,10,0,-1.0,a8w8_bpreshuffle_128x16x32x512_16x16_16x16_32x4x1_32x4x1_1x16x1x8_4x4x1_1x1_intrawave_v1,1.0,-1.0,-1.0
304,8,7168,256,75,0,-1.0,a8w8_bpreshuffle_128x16x256x64_16x16_16x16_4x16x1_4x32x1_1x16x1x8_8x8x1_1x2_intrawave_v1,1.0,-1.0,-1.0
304,8,7168,2048,10,0,6.7266,a8w8_bpreshuffle_128x16x32x512_16x16_16x16_32x4x1_32x4x1_1x16x1x8_4x4x1_1x1_intrawave_v1,34.92,2201.88,0.0
304,8,7168,2304,108,0,-1.0,a8w8_bpreshuffle_256x16x64x256_16x16_16x16_16x16x1_16x16x1_1x16x1x16_4x4x1_1x1_intrawave_v1,1.0,-1.0,-1.0
304,16,192,7168,10,0,-1.0,a8w8_bpreshuffle_128x16x32x512_16x16_16x16_32x4x1_32x4x1_1x16x1x8_4x4x1_1x1_intrawave_v1,1.0,-1.0,-1.0
304,16,512,7168,10,0,-1.0,a8w8_bpreshuffle_128x16x32x512_16x16_16x16_32x4x1_32x4x1_1x16x1x8_4x4x1_1x1_intrawave_v1,1.0,-1.0,-1.0
304,16,576,7168,10,0,9.127,a8w8_bpreshuffle_128x16x32x512_16x16_16x16_32x4x1_32x4x1_1x16x1x8_4x4x1_1x1_intrawave_v1,14.48,466.95,0.0
304,16,896,5120,10,0,7.7362,a8w8_bpreshuffle_128x16x32x512_16x16_16x16_32x4x1_32x4x1_1x16x1x8_4x4x1_1x1_intrawave_v1,0.0,18.98,607.29
304,16,1024,5632,10,0,8.6607,a8w8_bpreshuffle_128x16x32x512_16x16_16x16_32x4x1_32x4x1_1x16x1x8_4x4x1_1x1_intrawave_v1,0.0,21.31,680.09
304,16,1056,1408,9,0,6.0298,a8w8_bpreshuffle_128x16x32x128_16x16_16x16_8x16x1_8x16x1_1x16x1x8_4x4x1_1x1_intrawave_v1,0.0,7.89,255.92
304,16,1280,4096,10,0,7.0371,a8w8_bpreshuffle_128x16x32x512_16x16_16x16_32x4x1_32x4x1_1x16x1x8_4x4x1_1x1_intrawave_v1,0.0,23.84,760.17
304,16,1408,352,0,0,-1.0,a8w8_bpreshuffle_256x128x128x128_16x16_16x16_8x32x1_8x32x1_1x32x1x8_8x8x1_2x1_intrawave_v3,1.0,-1.0,-1.0
304,16,1408,1408,9,0,-1.0,a8w8_bpreshuffle_128x16x32x128_16x16_16x16_8x16x1_8x16x1_1x16x1x8_4x4x1_1x1_intrawave_v1,1.0,-1.0,-1.0
304,16,1536,2048,10,0,-1.0,a8w8_bpreshuffle_128x16x32x512_16x16_16x16_32x4x1_32x4x1_1x16x1x8_4x4x1_1x1_intrawave_v1,1.0,-1.0,-1.0
304,16,1536,7168,10,0,9.4094,a8w8_bpreshuffle_128x16x32x512_16x16_16x16_32x4x1_32x4x1_1x16x1x8_4x4x1_1x1_intrawave_v1,37.44,1187.52,0.0
304,16,1792,6144,10,0,-1.0,a8w8_bpreshuffle_128x16x32x512_16x16_16x16_32x4x1_32x4x1_1x16x1x8_4x4x1_1x1_intrawave_v1,1.0,-1.0,-1.0
304,16,2048,1536,10,0,-1.0,a8w8_bpreshuffle_128x16x32x512_16x16_16x16_32x4x1_32x4x1_1x16x1x8_4x4x1_1x1_intrawave_v1,1.0,-1.0,-1.0
304,16,2048,6144,10,0,-1.0,a8w8_bpreshuffle_128x16x32x512_16x16_16x16_32x4x1_32x4x1_1x16x1x8_4x4x1_1x1_intrawave_v1,1.0,-1.0,-1.0
304,16,2112,7168,10,0,9.6308,a8w8_bpreshuffle_128x16x32x512_16x16_16x16_32x4x1_32x4x1_1x16x1x8_4x4x1_1x1_intrawave_v1,50.3,1590.84,0.0
304,16,3072,1536,10,0,4.6159,a8w8_bpreshuffle_128x16x32x512_16x16_16x16_32x4x1_32x4x1_1x16x1x8_4x4x1_1x1_intrawave_v1,32.71,1048.87,0.0
304,16,3072,4096,10,0,-1.0,a8w8_bpreshuffle_128x16x32x512_16x16_16x16_32x4x1_32x4x1_1x16x1x8_4x4x1_1x1_intrawave_v1,1.0,-1.0,-1.0
304,16,3584,6144,10,0,-1.0,a8w8_bpreshuffle_128x16x32x512_16x16_16x16_32x4x1_32x4x1_1x16x1x8_4x4x1_1x1_intrawave_v1,1.0,-1.0,-1.0
304,16,4096,512,9,0,4.0406,a8w8_bpreshuffle_128x16x32x128_16x16_16x16_8x16x1_8x16x1_1x16x1x8_4x4x1_1x1_intrawave_v1,16.61,553.49,0.0
304,16,4096,640,23,0,5.0895,a8w8_bpreshuffle_128x16x32x128_16x16_16x16_8x16x1_8x16x1_1x16x1x8_4x4x1_1x1_intrawave_v2,0.0,16.48,542.83
304,16,4096,1024,108,0,-1.0,a8w8_bpreshuffle_256x16x64x256_16x16_16x16_16x16x1_16x16x1_1x16x1x16_4x4x1_1x1_intrawave_v1,1.0,-1.0,-1.0
304,16,4096,3072,10,0,-1.0,a8w8_bpreshuffle_128x16x32x512_16x16_16x16_32x4x1_32x4x1_1x16x1x8_4x4x1_1x1_intrawave_v1,1.0,-1.0,-1.0
304,16,4608,7168,10,0,10.8825,a8w8_bpreshuffle_128x16x32x512_16x16_16x16_32x4x1_32x4x1_1x16x1x8_4x4x1_1x1_intrawave_v1,97.13,3059.25,0.0
304,16,5120,640,9,0,5.4698,a8w8_bpreshuffle_128x16x32x128_16x16_16x16_8x16x1_8x16x1_1x16x1x8_4x4x1_1x1_intrawave_v1,0.0,19.17,630.9
304,16,5120,2048,10,0,6.1466,a8w8_bpreshuffle_128x16x32x512_16x16_16x16_32x4x1_32x4x1_1x16x1x8_4x4x1_1x1_intrawave_v1,0.0,54.59,1737.93
304,16,6144,768,15,0,-1.0,a8w8_bpreshuffle_256x16x64x256_16x16_16x16_16x16x1_16x16x1_1x16x1x16_4x4x1_1x1_intrawave_v1,1.0,-1.0,-1.0
304,16,6144,1024,108,0,-1.0,a8w8_bpreshuffle_256x16x64x256_16x16_16x16_16x16x1_16x16x1_1x16x1x16_4x4x1_1x1_intrawave_v1,1.0,-1.0,-1.0
304,16,6144,1536,10,0,-1.0,a8w8_bpreshuffle_128x16x32x512_16x16_16x16_32x4x1_32x4x1_1x16x1x8_4x4x1_1x1_intrawave_v1,1.0,-1.0,-1.0
304,16,6144,2048,10,0,-1.0,a8w8_bpreshuffle_128x16x32x512_16x16_16x16_32x4x1_32x4x1_1x16x1x8_4x4x1_1x1_intrawave_v1,1.0,-1.0,-1.0
304,16,7168,256,75,0,-1.0,a8w8_bpreshuffle_128x16x256x64_16x16_16x16_4x16x1_4x32x1_1x16x1x8_8x8x1_1x2_intrawave_v1,1.0,-1.0,-1.0
304,16,7168,2048,10,0,6.501,a8w8_bpreshuffle_128x16x32x512_16x16_16x16_32x4x1_32x4x1_1x16x1x8_4x4x1_1x1_intrawave_v1,72.26,2298.45,0.0
304,16,7168,2304,108,0,-1.0,a8w8_bpreshuffle_256x16x64x256_16x16_16x16_16x16x1_16x16x1_1x16x1x16_4x4x1_1x1_intrawave_v1,1.0,-1.0,-1.0
304,24,192,7168,10,0,-1.0,a8w8_bpreshuffle_128x16x32x512_16x16_16x16_32x4x1_32x4x1_1x16x1x8_4x4x1_1x1_intrawave_v1,1.0,-1.0,-1.0
304,24,512,7168,10,0,-1.0,a8w8_bpreshuffle_128x16x32x512_16x16_16x16_32x4x1_32x4x1_1x16x1x8_4x4x1_1x1_intrawave_v1,1.0,-1.0,-1.0
304,24,576,7168,10,0,10.2305,a8w8_bpreshuffle_128x16x32x512_16x16_16x16_32x4x1_32x4x1_1x16x1x8_4x4x1_1x1_intrawave_v1,19.37,423.09,0.0
304,24,896,5120,10,0,-1.0,a8w8_bpreshuffle_128x16x32x512_16x16_16x16_32x4x1_32x4x1_1x16x1x8_4x4x1_1x1_intrawave_v1,1.0,-1.0,-1.0
304,24,1024,5632,10,0,-1.0,a8w8_bpreshuffle_128x16x32x512_16x16_16x16_32x4x1_32x4x1_1x16x1x8_4x4x1_1x1_intrawave_v1,1.0,-1.0,-1.0
304,24,1056,1408,9,0,-1.0,a8w8_bpreshuffle_128x16x32x128_16x16_16x16_8x16x1_8x16x1_1x16x1x8_4x4x1_1x1_intrawave_v1,1.0,-1.0,-1.0
304,24,1280,4096,10,0,-1.0,a8w8_bpreshuffle_128x16x32x512_16x16_16x16_32x4x1_32x4x1_1x16x1x8_4x4x1_1x1_intrawave_v1,1.0,-1.0,-1.0
304,24,1408,352,0,0,-1.0,a8w8_bpreshuffle_256x128x128x128_16x16_16x16_8x32x1_8x32x1_1x32x1x8_8x8x1_2x1_intrawave_v3,1.0,-1.0,-1.0
304,24,1408,1408,9,0,-1.0,a8w8_bpreshuffle_128x16x32x128_16x16_16x16_8x16x1_8x16x1_1x16x1x8_4x4x1_1x1_intrawave_v1,1.0,-1.0,-1.0
304,24,1536,2048,10,0,-1.0,a8w8_bpreshuffle_128x16x32x512_16x16_16x16_32x4x1_32x4x1_1x16x1x8_4x4x1_1x1_intrawave_v1,1.0,-1.0,-1.0
304,24,1536,7168,10,0,10.2948,a8w8_bpreshuffle_128x16x32x512_16x16_16x16_32x4x1_32x4x1_1x16x1x8_4x4x1_1x1_intrawave_v1,51.33,1093.35,0.0
304,24,1792,6144,10,0,-1.0,a8w8_bpreshuffle_128x16x32x512_16x16_16x16_32x4x1_32x4x1_1x16x1x8_4x4x1_1x1_intrawave_v1,1.0,-1.0,-1.0
304,24,2048,1536,10,0,-1.0,a8w8_bpreshuffle_128x16x32x512_16x16_16x16_32x4x1_32x4x1_1x16x1x8_4x4x1_1x1_intrawave_v1,1.0,-1.0,-1.0
304,24,2048,6144,10,0,-1.0,a8w8_bpreshuffle_128x16x32x512_16x16_16x16_32x4x1_32x4x1_1x16x1x8_4x4x1_1x1_intrawave_v1,1.0,-1.0,-1.0
304,24,2112,7168,10,0,10.1864,a8w8_bpreshuffle_128x16x32x512_16x16_16x16_32x4x1_32x4x1_1x16x1x8_4x4x1_1x1_intrawave_v1,71.34,1513.02,0.0
304,24,3072,1536,8,0,4.8582,a8w8_bpreshuffle_128x32x16x512_16x16_16x16_32x4x1_32x4x1_1x32x1x4_4x4x1_1x1_intrawave_v1,46.62,1009.2,0.0
304,24,3072,4096,10,0,-1.0,a8w8_bpreshuffle_128x16x32x512_16x16_16x16_32x4x1_32x4x1_1x16x1x8_4x4x1_1x1_intrawave_v1,1.0,-1.0,-1.0
304,24,3584,6144,11,0,-1.0,a8w8_bpreshuffle_256x16x64x512_16x16_16x16_32x8x1_32x8x1_1x16x1x16_4x4x1_1x1_intrawave_v1,1.0,-1.0,-1.0
304,24,4096,512,9,0,4.3475,a8w8_bpreshuffle_128x16x32x128_16x16_16x16_8x16x1_8x16x1_1x16x1x8_4x4x1_1x1_intrawave_v1,23.15,530.43,0.0
304,24,4096,640,23,0,-1.0,a8w8_bpreshuffle_128x16x32x128_16x16_16x16_8x16x1_8x16x1_1x16x1x8_4x4x1_1x1_intrawave_v2,1.0,-1.0,-1.0
304,24,4096,1024,15,0,-1.0,a8w8_bpreshuffle_256x16x64x256_16x16_16x16_16x16x1_16x16x1_1x16x1x16_4x4x1_1x1_intrawave_v1,1.0,-1.0,-1.0
304,24,4096,3072,10,0,-1.0,a8w8_bpreshuffle_128x16x32x512_16x16_16x16_32x4x1_32x4x1_1x16x1x8_4x4x1_1x1_intrawave_v1,1.0,-1.0,-1.0
304,24,4608,7168,10,0,14.0996,a8w8_bpreshuffle_128x16x32x512_16x16_16x16_32x4x1_32x4x1_1x16x1x8_4x4x1_1x1_intrawave_v1,112.45,2370.52,0.0
304,24,5120,640,23,0,-1.0,a8w8_bpreshuffle_128x16x32x128_16x16_16x16_8x16x1_8x16x1_1x16x1x8_4x4x1_1x1_intrawave_v2,1.0,-1.0,-1.0
304,24,5120,2048,11,0,-1.0,a8w8_bpreshuffle_256x16x64x512_16x16_16x16_32x8x1_32x8x1_1x16x1x16_4x4x1_1x1_intrawave_v1,1.0,-1.0,-1.0
304,24,6144,768,15,0,-1.0,a8w8_bpreshuffle_256x16x64x256_16x16_16x16_16x16x1_16x16x1_1x16x1x16_4x4x1_1x1_intrawave_v1,1.0,-1.0,-1.0
304,24,6144,1024,15,0,-1.0,a8w8_bpreshuffle_256x16x64x256_16x16_16x16_16x16x1_16x16x1_1x16x1x16_4x4x1_1x1_intrawave_v1,1.0,-1.0,-1.0
304,24,6144,1536,11,0,-1.0,a8w8_bpreshuffle_256x16x64x512_16x16_16x16_32x8x1_32x8x1_1x16x1x16_4x4x1_1x1_intrawave_v1,1.0,-1.0,-1.0
304,24,6144,2048,11,0,-1.0,a8w8_bpreshuffle_256x16x64x512_16x16_16x16_32x8x1_32x8x1_1x16x1x16_4x4x1_1x1_intrawave_v1,1.0,-1.0,-1.0
304,24,7168,256,75,0,-1.0,a8w8_bpreshuffle_128x16x256x64_16x16_16x16_4x16x1_4x32x1_1x16x1x8_8x8x1_1x2_intrawave_v1,1.0,-1.0,-1.0
304,24,7168,2048,11,0,7.5529,a8w8_bpreshuffle_256x16x64x512_16x16_16x16_32x8x1_32x8x1_1x16x1x16_4x4x1_1x1_intrawave_v1,93.29,1995.69,0.0
304,24,7168,2304,112,0,-1.0,a8w8_bpreshuffle_256x32x64x256_16x16_16x16_16x16x1_16x16x1_1x32x1x8_8x8x1_2x1_intrawave_v1,1.0,-1.0,-1.0
304,32,192,7168,10,0,-1.0,a8w8_bpreshuffle_128x16x32x512_16x16_16x16_32x4x1_32x4x1_1x16x1x8_4x4x1_1x1_intrawave_v1,1.0,-1.0,-1.0
304,32,512,7168,8,0,-1.0,a8w8_bpreshuffle_128x32x16x512_16x16_16x16_32x4x1_32x4x1_1x32x1x4_4x4x1_1x1_intrawave_v1,1.0,-1.0,-1.0
304,32,576,7168,10,0,9.1378,a8w8_bpreshuffle_128x16x32x512_16x16_16x16_32x4x1_32x4x1_1x16x1x8_4x4x1_1x1_intrawave_v1,28.92,480.97,0.0
304,32,896,5120,8,0,-1.0,a8w8_bpreshuffle_128x32x16x512_16x16_16x16_32x4x1_32x4x1_1x32x1x4_4x4x1_1x1_intrawave_v1,1.0,-1.0,-1.0
304,32,1024,5632,8,0,-1.0,a8w8_bpreshuffle_128x32x16x512_16x16_16x16_32x4x1_32x4x1_1x32x1x4_4x4x1_1x1_intrawave_v1,1.0,-1.0,-1.0
304,32,1056,1408,9,0,-1.0,a8w8_bpreshuffle_128x16x32x128_16x16_16x16_8x16x1_8x16x1_1x16x1x8_4x4x1_1x1_intrawave_v1,1.0,-1.0,-1.0
304,32,1280,4096,8,0,-1.0,a8w8_bpreshuffle_128x32x16x512_16x16_16x16_32x4x1_32x4x1_1x32x1x4_4x4x1_1x1_intrawave_v1,1.0,-1.0,-1.0
304,32,1408,352,0,0,-1.0,a8w8_bpreshuffle_256x128x128x128_16x16_16x16_8x32x1_8x32x1_1x32x1x8_8x8x1_2x1_intrawave_v3,1.0,-1.0,-1.0
304,32,1408,1408,9,0,-1.0,a8w8_bpreshuffle_128x16x32x128_16x16_16x16_8x16x1_8x16x1_1x16x1x8_4x4x1_1x1_intrawave_v1,1.0,-1.0,-1.0
304,32,1536,2048,8,0,-1.0,a8w8_bpreshuffle_128x32x16x512_16x16_16x16_32x4x1_32x4x1_1x32x1x4_4x4x1_1x1_intrawave_v1,1.0,-1.0,-1.0
304,32,1536,7168,8,0,9.7635,a8w8_bpreshuffle_128x32x16x512_16x16_16x16_32x4x1_32x4x1_1x32x1x4_4x4x1_1x1_intrawave_v1,72.17,1161.24,0.0
304,32,1792,6144,8,0,-1.0,a8w8_bpreshuffle_128x32x16x512_16x16_16x16_32x4x1_32x4x1_1x32x1x4_4x4x1_1x1_intrawave_v1,1.0,-1.0,-1.0
304,32,2048,1536,8,0,-1.0,a8w8_bpreshuffle_128x32x16x512_16x16_16x16_32x4x1_32x4x1_1x32x1x4_4x4x1_1x1_intrawave_v1,1.0,-1.0,-1.0
304,32,2048,6144,8,0,-1.0,a8w8_bpreshuffle_128x32x16x512_16x16_16x16_32x4x1_32x4x1_1x32x1x4_4x4x1_1x1_intrawave_v1,1.0,-1.0,-1.0
304,32,2112,7168,8,0,9.3479,a8w8_bpreshuffle_128x32x16x512_16x16_16x16_32x4x1_32x4x1_1x32x1x4_4x4x1_1x1_intrawave_v1,103.65,1658.49,0.0
304,32,3072,1536,8,0,5.1394,a8w8_bpreshuffle_128x32x16x512_16x16_16x16_32x4x1_32x4x1_1x32x1x4_4x4x1_1x1_intrawave_v1,58.76,965.94,0.0
304,32,3072,4096,10,0,-1.0,a8w8_bpreshuffle_128x16x32x512_16x16_16x16_32x4x1_32x4x1_1x16x1x8_4x4x1_1x1_intrawave_v1,1.0,-1.0,-1.0
304,32,3584,6144,10,0,-1.0,a8w8_bpreshuffle_128x16x32x512_16x16_16x16_32x4x1_32x4x1_1x16x1x8_4x4x1_1x1_intrawave_v1,1.0,-1.0,-1.0
304,32,4096,512,9,0,4.2867,a8w8_bpreshuffle_128x16x32x128_16x16_16x16_8x16x1_8x16x1_1x16x1x8_4x4x1_1x1_intrawave_v1,31.31,554.2,0.0
304,32,4096,640,23,0,-1.0,a8w8_bpreshuffle_128x16x32x128_16x16_16x16_8x16x1_8x16x1_1x16x1x8_4x4x1_1x1_intrawave_v2,1.0,-1.0,-1.0
304,32,4096,1024,112,0,-1.0,a8w8_bpreshuffle_256x32x64x256_16x16_16x16_16x16x1_16x16x1_1x32x1x8_8x8x1_2x1_intrawave_v1,1.0,-1.0,-1.0
304,32,4096,3072,11,0,-1.0,a8w8_bpreshuffle_256x16x64x512_16x16_16x16_32x8x1_32x8x1_1x16x1x16_4x4x1_1x1_intrawave_v1,1.0,-1.0,-1.0
304,32,4608,7168,10,0,12.869,a8w8_bpreshuffle_128x16x32x512_16x16_16x16_32x4x1_32x4x1_1x16x1x8_4x4x1_1x1_intrawave_v1,164.27,2607.38,0.0
304,32,5120,640,9,0,-1.0,a8w8_bpreshuffle_128x16x32x128_16x16_16x16_8x16x1_8x16x1_1x16x1x8_4x4x1_1x1_intrawave_v1,1.0,-1.0,-1.0
304,32,5120,2048,5,0,-1.0,a8w8_bpreshuffle_256x16x64x512_16x16_16x16_32x8x1_32x8x1_1x16x1x16_4x4x1_1x1_intrawave_v1,1.0,-1.0,-1.0
304,32,6144,768,15,0,-1.0,a8w8_bpreshuffle_256x16x64x256_16x16_16x16_16x16x1_16x16x1_1x16x1x16_4x4x1_1x1_intrawave_v1,1.0,-1.0,-1.0
304,32,6144,1024,108,0,-1.0,a8w8_bpreshuffle_256x16x64x256_16x16_16x16_16x16x1_16x16x1_1x16x1x16_4x4x1_1x1_intrawave_v1,1.0,-1.0,-1.0
304,32,6144,1536,5,0,-1.0,a8w8_bpreshuffle_256x16x64x512_16x16_16x16_32x8x1_32x8x1_1x16x1x16_4x4x1_1x1_intrawave_v1,1.0,-1.0,-1.0
304,32,6144,2048,5,0,-1.0,a8w8_bpreshuffle_256x16x64x512_16x16_16x16_32x8x1_32x8x1_1x16x1x16_4x4x1_1x1_intrawave_v1,1.0,-1.0,-1.0
304,32,7168,256,75,0,-1.0,a8w8_bpreshuffle_128x16x256x64_16x16_16x16_4x16x1_4x32x1_1x16x1x8_8x8x1_1x2_intrawave_v1,1.0,-1.0,-1.0
304,32,7168,2048,5,0,7.1158,a8w8_bpreshuffle_256x16x64x512_16x16_16x16_32x8x1_32x8x1_1x16x1x16_4x4x1_1x1_intrawave_v1,132.03,2136.7,0.0
304,32,7168,2304,108,0,-1.0,a8w8_bpreshuffle_256x16x64x256_16x16_16x16_16x16x1_16x16x1_1x16x1x16_4x4x1_1x1_intrawave_v1,1.0,-1.0,-1.0
304,40,192,7168,10,0,-1.0,a8w8_bpreshuffle_128x16x32x512_16x16_16x16_32x4x1_32x4x1_1x16x1x8_4x4x1_1x1_intrawave_v1,1.0,-1.0,-1.0
304,40,512,7168,10,0,-1.0,a8w8_bpreshuffle_128x16x32x512_16x16_16x16_32x4x1_32x4x1_1x16x1x8_4x4x1_1x1_intrawave_v1,1.0,-1.0,-1.0
304,40,576,7168,10,0,10.2907,a8w8_bpreshuffle_128x16x32x512_16x16_16x16_32x4x1_32x4x1_1x16x1x8_4x4x1_1x1_intrawave_v1,32.1,433.55,0.0
304,40,896,5120,10,0,-1.0,a8w8_bpreshuffle_128x16x32x512_16x16_16x16_32x4x1_32x4x1_1x16x1x8_4x4x1_1x1_intrawave_v1,1.0,-1.0,-1.0
304,40,1024,5632,10,0,-1.0,a8w8_bpreshuffle_128x16x32x512_16x16_16x16_32x4x1_32x4x1_1x16x1x8_4x4x1_1x1_intrawave_v1,1.0,-1.0,-1.0
304,40,1056,1408,23,0,-1.0,a8w8_bpreshuffle_128x16x32x128_16x16_16x16_8x16x1_8x16x1_1x16x1x8_4x4x1_1x1_intrawave_v2,1.0,-1.0,-1.0
304,40,1280,4096,10,0,-1.0,a8w8_bpreshuffle_128x16x32x512_16x16_16x16_32x4x1_32x4x1_1x16x1x8_4x4x1_1x1_intrawave_v1,1.0,-1.0,-1.0
304,40,1408,352,0,0,-1.0,a8w8_bpreshuffle_256x128x128x128_16x16_16x16_8x32x1_8x32x1_1x32x1x8_8x8x1_2x1_intrawave_v3,1.0,-1.0,-1.0
304,40,1408,1408,9,0,-1.0,a8w8_bpreshuffle_128x16x32x128_16x16_16x16_8x16x1_8x16x1_1x16x1x8_4x4x1_1x1_intrawave_v1,1.0,-1.0,-1.0
304,40,1536,2048,10,0,-1.0,a8w8_bpreshuffle_128x16x32x512_16x16_16x16_32x4x1_32x4x1_1x16x1x8_4x4x1_1x1_intrawave_v1,1.0,-1.0,-1.0
304,40,1536,7168,10,0,10.3192,a8w8_bpreshuffle_128x16x32x512_16x16_16x16_32x4x1_32x4x1_1x16x1x8_4x4x1_1x1_intrawave_v1,85.36,1106.64,0.0
304,40,1792,6144,10,0,-1.0,a8w8_bpreshuffle_128x16x32x512_16x16_16x16_32x4x1_32x4x1_1x16x1x8_4x4x1_1x1_intrawave_v1,1.0,-1.0,-1.0
304,40,2048,1536,10,0,-1.0,a8w8_bpreshuffle_128x16x32x512_16x16_16x16_32x4x1_32x4x1_1x16x1x8_4x4x1_1x1_intrawave_v1,1.0,-1.0,-1.0
304,40,2048,6144,10,0,-1.0,a8w8_bpreshuffle_128x16x32x512_16x16_16x16_32x4x1_32x4x1_1x16x1x8_4x4x1_1x1_intrawave_v1,1.0,-1.0,-1.0
304,40,2112,7168,10,0,10.3617,a8w8_bpreshuffle_128x16x32x512_16x16_16x16_32x4x1_32x4x1_1x16x1x8_4x4x1_1x1_intrawave_v1,116.88,1505.01,0.0
304,40,3072,1536,10,0,5.386,a8w8_bpreshuffle_128x16x32x512_16x16_16x16_32x4x1_32x4x1_1x16x1x8_4x4x1_1x1_intrawave_v1,70.09,933.12,0.0
304,40,3072,4096,5,0,-1.0,a8w8_bpreshuffle_256x16x64x512_16x16_16x16_32x8x1_32x8x1_1x16x1x16_4x4x1_1x1_intrawave_v1,1.0,-1.0,-1.0
304,40,3584,6144,5,0,-1.0,a8w8_bpreshuffle_256x16x64x512_16x16_16x16_32x8x1_32x8x1_1x16x1x16_4x4x1_1x1_intrawave_v1,1.0,-1.0,-1.0
304,40,4096,512,9,0,4.4064,a8w8_bpreshuffle_128x16x32x128_16x16_16x16_8x16x1_8x16x1_1x16x1x8_4x4x1_1x1_intrawave_v1,38.07,554.95,0.0
304,40,4096,640,9,0,-1.0,a8w8_bpreshuffle_128x16x32x128_16x16_16x16_8x16x1_8x16x1_1x16x1x8_4x4x1_1x1_intrawave_v1,1.0,-1.0,-1.0
304,40,4096,1024,15,0,-1.0,a8w8_bpreshuffle_256x16x64x256_16x16_16x16_16x16x1_16x16x1_1x16x1x16_4x4x1_1x1_intrawave_v1,1.0,-1.0,-1.0
304,40,4096,3072,5,0,-1.0,a8w8_bpreshuffle_256x16x64x512_16x16_16x16_32x8x1_32x8x1_1x16x1x16_4x4x1_1x1_intrawave_v1,1.0,-1.0,-1.0
304,40,4608,7168,5,0,15.0576,a8w8_bpreshuffle_256x16x64x512_16x16_16x16_32x8x1_32x8x1_1x16x1x16_4x4x1_1x1_intrawave_v1,175.49,2237.11,0.0
304,40,5120,640,9,0,-1.0,a8w8_bpreshuffle_128x16x32x128_16x16_16x16_8x16x1_8x16x1_1x16x1x8_4x4x1_1x1_intrawave_v1,1.0,-1.0,-1.0
304,40,5120,2048,5,0,-1.0,a8w8_bpreshuffle_256x16x64x512_16x16_16x16_32x8x1_32x8x1_1x16x1x16_4x4x1_1x1_intrawave_v1,1.0,-1.0,-1.0
304,40,6144,768,15,0,-1.0,a8w8_bpreshuffle_256x16x64x256_16x16_16x16_16x16x1_16x16x1_1x16x1x16_4x4x1_1x1_intrawave_v1,1.0,-1.0,-1.0
304,40,6144,1024,15,0,-1.0,a8w8_bpreshuffle_256x16x64x256_16x16_16x16_16x16x1_16x16x1_1x16x1x16_4x4x1_1x1_intrawave_v1,1.0,-1.0,-1.0
304,40,6144,1536,11,0,-1.0,a8w8_bpreshuffle_256x16x64x512_16x16_16x16_32x8x1_32x8x1_1x16x1x16_4x4x1_1x1_intrawave_v1,1.0,-1.0,-1.0
304,40,6144,2048,11,0,-1.0,a8w8_bpreshuffle_256x16x64x512_16x16_16x16_32x8x1_32x8x1_1x16x1x16_4x4x1_1x1_intrawave_v1,1.0,-1.0,-1.0
304,40,7168,256,75,0,-1.0,a8w8_bpreshuffle_128x16x256x64_16x16_16x16_4x16x1_4x32x1_1x16x1x8_8x8x1_1x2_intrawave_v1,1.0,-1.0,-1.0
304,40,7168,2048,109,0,8.6949,a8w8_bpreshuffle_256x16x128x256_16x16_16x16_16x16x1_16x16x1_1x16x1x16_8x8x1_1x2_intrawave_v1,135.07,1763.73,0.0
304,40,7168,2304,113,0,-1.0,a8w8_bpreshuffle_256x48x64x256_16x16_16x16_16x16x1_16x16x1_1x16x1x16_4x4x1_1x1_intrawave_v1,1.0,-1.0,-1.0
304,48,192,7168,10,0,-1.0,a8w8_bpreshuffle_128x16x32x512_16x16_16x16_32x4x1_32x4x1_1x16x1x8_4x4x1_1x1_intrawave_v1,1.0,-1.0,-1.0
304,48,512,7168,10,0,-1.0,a8w8_bpreshuffle_128x16x32x512_16x16_16x16_32x4x1_32x4x1_1x16x1x8_4x4x1_1x1_intrawave_v1,1.0,-1.0,-1.0
304,48,576,7168,10,0,9.6154,a8w8_bpreshuffle_128x16x32x512_16x16_16x16_32x4x1_32x4x1_1x16x1x8_4x4x1_1x1_intrawave_v1,41.22,470.92,0.0
304,48,896,5120,10,0,7.9128,a8w8_bpreshuffle_128x16x32x512_16x16_16x16_32x4x1_32x4x1_1x16x1x8_4x4x1_1x1_intrawave_v1,0.0,55.66,621.69
304,48,1024,5632,10,0,8.9099,a8w8_bpreshuffle_128x16x32x512_16x16_16x16_32x4x1_32x4x1_1x16x1x8_4x4x1_1x1_intrawave_v1,0.0,62.14,688.65
304,48,1056,1408,9,0,6.2615,a8w8_bpreshuffle_128x16x32x128_16x16_16x16_8x16x1_8x16x1_1x16x1x8_4x4x1_1x1_intrawave_v1,0.0,22.8,264.44
304,48,1280,4096,10,0,7.1961,a8w8_bpreshuffle_128x16x32x512_16x16_16x16_32x4x1_32x4x1_1x16x1x8_4x4x1_1x1_intrawave_v1,0.0,69.94,772.97
304,48,1408,352,0,0,-1.0,a8w8_bpreshuffle_256x128x128x128_16x16_16x16_8x32x1_8x32x1_1x32x1x8_8x8x1_2x1_intrawave_v3,1.0,-1.0,-1.0
304,48,1408,1408,9,0,-1.0,a8w8_bpreshuffle_128x16x32x128_16x16_16x16_8x16x1_8x16x1_1x16x1x8_4x4x1_1x1_intrawave_v1,1.0,-1.0,-1.0
304,48,1536,2048,10,0,-1.0,a8w8_bpreshuffle_128x16x32x512_16x16_16x16_32x4x1_32x4x1_1x16x1x8_4x4x1_1x1_intrawave_v1,1.0,-1.0,-1.0
304,48,1536,7168,10,0,9.7044,a8w8_bpreshuffle_128x16x32x512_16x16_16x16_32x4x1_32x4x1_1x16x1x8_4x4x1_1x1_intrawave_v1,108.92,1185.19,0.0
304,48,1792,6144,10,0,-1.0,a8w8_bpreshuffle_128x16x32x512_16x16_16x16_32x4x1_32x4x1_1x16x1x8_4x4x1_1x1_intrawave_v1,1.0,-1.0,-1.0
304,48,2048,1536,10,0,-1.0,a8w8_bpreshuffle_128x16x32x512_16x16_16x16_32x4x1_32x4x1_1x16x1x8_4x4x1_1x1_intrawave_v1,1.0,-1.0,-1.0
304,48,2048,6144,10,0,-1.0,a8w8_bpreshuffle_128x16x32x512_16x16_16x16_32x4x1_32x4x1_1x16x1x8_4x4x1_1x1_intrawave_v1,1.0,-1.0,-1.0
304,48,2112,7168,10,0,9.9254,a8w8_bpreshuffle_128x16x32x512_16x16_16x16_32x4x1_32x4x1_1x16x1x8_4x4x1_1x1_intrawave_v1,146.42,1580.35,0.0
304,48,3072,1536,10,0,5.3342,a8w8_bpreshuffle_128x16x32x512_16x16_16x16_32x4x1_32x4x1_1x16x1x8_4x4x1_1x1_intrawave_v1,84.92,953.7,0.0
304,48,3072,4096,5,0,-1.0,a8w8_bpreshuffle_256x16x64x512_16x16_16x16_32x8x1_32x8x1_1x16x1x16_4x4x1_1x1_intrawave_v1,1.0,-1.0,-1.0
304,48,3584,6144,5,0,-1.0,a8w8_bpreshuffle_256x16x64x512_16x16_16x16_32x8x1_32x8x1_1x16x1x16_4x4x1_1x1_intrawave_v1,1.0,-1.0,-1.0
304,48,4096,512,9,0,4.4022,a8w8_bpreshuffle_128x16x32x128_16x16_16x16_8x16x1_8x16x1_1x16x1x8_4x4x1_1x1_intrawave_v1,45.73,571.29,0.0
304,48,4096,640,23,0,5.5908,a8w8_bpreshuffle_128x16x32x128_16x16_16x16_8x16x1_8x16x1_1x16x1x8_4x4x1_1x1_intrawave_v2,0.0,45.01,544.71
304,48,4096,1024,15,0,-1.0,a8w8_bpreshuffle_256x16x64x256_16x16_16x16_16x16x1_16x16x1_1x16x1x16_4x4x1_1x1_intrawave_v1,1.0,-1.0,-1.0
304,48,4096,3072,11,0,-1.0,a8w8_bpreshuffle_256x16x64x512_16x16_16x16_32x8x1_32x8x1_1x16x1x16_4x4x1_1x1_intrawave_v1,1.0,-1.0,-1.0
304,48,4608,7168,5,0,14.2956,a8w8_bpreshuffle_256x16x64x512_16x16_16x16_32x8x1_32x8x1_1x16x1x16_4x4x1_1x1_intrawave_v1,221.81,2365.52,0.0
304,48,5120,640,9,0,5.7388,a8w8_bpreshuffle_128x16x32x128_16x16_16x16_8x16x1_8x16x1_1x16x1x8_4x4x1_1x1_intrawave_v1,0.0,54.82,661.99
304,48,5120,2048,11,0,7.0405,a8w8_bpreshuffle_256x16x64x512_16x16_16x16_32x8x1_32x8x1_1x16x1x16_4x4x1_1x1_intrawave_v1,0.0,142.98,1573.12
304,48,6144,768,15,0,-1.0,a8w8_bpreshuffle_256x16x64x256_16x16_16x16_16x16x1_16x16x1_1x16x1x16_4x4x1_1x1_intrawave_v1,1.0,-1.0,-1.0
304,48,6144,1024,108,0,-1.0,a8w8_bpreshuffle_256x16x64x256_16x16_16x16_16x16x1_16x16x1_1x16x1x16_4x4x1_1x1_intrawave_v1,1.0,-1.0,-1.0
304,48,6144,1536,11,0,-1.0,a8w8_bpreshuffle_256x16x64x512_16x16_16x16_32x8x1_32x8x1_1x16x1x16_4x4x1_1x1_intrawave_v1,1.0,-1.0,-1.0
304,48,6144,2048,11,0,-1.0,a8w8_bpreshuffle_256x16x64x512_16x16_16x16_32x8x1_32x8x1_1x16x1x16_4x4x1_1x1_intrawave_v1,1.0,-1.0,-1.0
304,48,7168,256,75,0,-1.0,a8w8_bpreshuffle_128x16x256x64_16x16_16x16_4x16x1_4x32x1_1x16x1x8_8x8x1_1x2_intrawave_v1,1.0,-1.0,-1.0
304,48,7168,2048,113,0,8.7785,a8w8_bpreshuffle_256x48x64x256_16x16_16x16_16x16x1_16x16x1_1x16x1x16_4x4x1_1x1_intrawave_v1,160.54,1761.86,0.0
304,48,7168,2304,113,0,-1.0,a8w8_bpreshuffle_256x48x64x256_16x16_16x16_16x16x1_16x16x1_1x16x1x16_4x4x1_1x1_intrawave_v1,1.0,-1.0,-1.0
304,56,192,7168,10,0,-1.0,a8w8_bpreshuffle_128x16x32x512_16x16_16x16_32x4x1_32x4x1_1x16x1x8_4x4x1_1x1_intrawave_v1,1.0,-1.0,-1.0
304,56,512,7168,10,0,-1.0,a8w8_bpreshuffle_128x16x32x512_16x16_16x16_32x4x1_32x4x1_1x16x1x8_4x4x1_1x1_intrawave_v1,1.0,-1.0,-1.0
304,56,576,7168,10,0,10.2411,a8w8_bpreshuffle_128x16x32x512_16x16_16x16_32x4x1_32x4x1_1x16x1x8_4x4x1_1x1_intrawave_v1,45.15,448.65,0.0
304,56,896,5120,10,0,-1.0,a8w8_bpreshuffle_128x16x32x512_16x16_16x16_32x4x1_32x4x1_1x16x1x8_4x4x1_1x1_intrawave_v1,1.0,-1.0,-1.0
304,56,1024,5632,10,0,-1.0,a8w8_bpreshuffle_128x16x32x512_16x16_16x16_32x4x1_32x4x1_1x16x1x8_4x4x1_1x1_intrawave_v1,1.0,-1.0,-1.0
304,56,1056,1408,23,0,-1.0,a8w8_bpreshuffle_128x16x32x128_16x16_16x16_8x16x1_8x16x1_1x16x1x8_4x4x1_1x1_intrawave_v2,1.0,-1.0,-1.0
304,56,1280,4096,10,0,-1.0,a8w8_bpreshuffle_128x16x32x512_16x16_16x16_32x4x1_32x4x1_1x16x1x8_4x4x1_1x1_intrawave_v1,1.0,-1.0,-1.0
304,56,1408,352,0,0,-1.0,a8w8_bpreshuffle_256x128x128x128_16x16_16x16_8x32x1_8x32x1_1x32x1x8_8x8x1_2x1_intrawave_v3,1.0,-1.0,-1.0
304,56,1408,1408,9,0,-1.0,a8w8_bpreshuffle_128x16x32x128_16x16_16x16_8x16x1_8x16x1_1x16x1x8_4x4x1_1x1_intrawave_v1,1.0,-1.0,-1.0
304,56,1536,2048,10,0,-1.0,a8w8_bpreshuffle_128x16x32x512_16x16_16x16_32x4x1_32x4x1_1x16x1x8_4x4x1_1x1_intrawave_v1,1.0,-1.0,-1.0
304,56,1536,7168,10,0,10.6472,a8w8_bpreshuffle_128x16x32x512_16x16_16x16_32x4x1_32x4x1_1x16x1x8_4x4x1_1x1_intrawave_v1,115.82,1087.94,0.0
304,56,1792,6144,10,0,-1.0,a8w8_bpreshuffle_128x16x32x512_16x16_16x16_32x4x1_32x4x1_1x16x1x8_4x4x1_1x1_intrawave_v1,1.0,-1.0,-1.0
304,56,2048,1536,10,0,-1.0,a8w8_bpreshuffle_128x16x32x512_16x16_16x16_32x4x1_32x4x1_1x16x1x8_4x4x1_1x1_intrawave_v1,1.0,-1.0,-1.0
304,56,2048,6144,10,0,-1.0,a8w8_bpreshuffle_128x16x32x512_16x16_16x16_32x4x1_32x4x1_1x16x1x8_4x4x1_1x1_intrawave_v1,1.0,-1.0,-1.0
304,56,2112,7168,11,0,11.0328,a8w8_bpreshuffle_256x16x64x512_16x16_16x16_32x8x1_32x8x1_1x16x1x16_4x4x1_1x1_intrawave_v1,153.68,1429.99,0.0
304,56,3072,1536,10,0,5.2809,a8w8_bpreshuffle_128x16x32x512_16x16_16x16_32x4x1_32x4x1_1x16x1x8_4x4x1_1x1_intrawave_v1,100.07,974.96,0.0
304,56,3072,4096,11,0,-1.0,a8w8_bpreshuffle_256x16x64x512_16x16_16x16_32x8x1_32x8x1_1x16x1x16_4x4x1_1x1_intrawave_v1,1.0,-1.0,-1.0
304,56,3584,6144,11,0,-1.0,a8w8_bpreshuffle_256x16x64x512_16x16_16x16_32x8x1_32x8x1_1x16x1x16_4x4x1_1x1_intrawave_v1,1.0,-1.0,-1.0
304,56,4096,512,9,0,3.9504,a8w8_bpreshuffle_128x16x32x128_16x16_16x16_8x16x1_8x16x1_1x16x1x8_4x4x1_1x1_intrawave_v1,59.46,654.26,0.0
304,56,4096,640,9,0,-1.0,a8w8_bpreshuffle_128x16x32x128_16x16_16x16_8x16x1_8x16x1_1x16x1x8_4x4x1_1x1_intrawave_v1,1.0,-1.0,-1.0
304,56,4096,1024,15,0,-1.0,a8w8_bpreshuffle_256x16x64x256_16x16_16x16_16x16x1_16x16x1_1x16x1x16_4x4x1_1x1_intrawave_v1,1.0,-1.0,-1.0
304,56,4096,3072,5,0,-1.0,a8w8_bpreshuffle_256x16x64x512_16x16_16x16_32x8x1_32x8x1_1x16x1x16_4x4x1_1x1_intrawave_v1,1.0,-1.0,-1.0
304,56,4608,7168,5,0,16.2307,a8w8_bpreshuffle_256x16x64x512_16x16_16x16_32x8x1_32x8x1_1x16x1x16_4x4x1_1x1_intrawave_v1,227.92,2091.57,0.0
304,56,5120,640,9,0,-1.0,a8w8_bpreshuffle_128x16x32x128_16x16_16x16_8x16x1_8x16x1_1x16x1x8_4x4x1_1x1_intrawave_v1,1.0,-1.0,-1.0
304,56,5120,2048,12,0,-1.0,a8w8_bpreshuffle_256x32x64x512_16x16_16x16_32x8x1_32x8x1_1x32x1x8_8x8x1_1x2_intrawave_v1,1.0,-1.0,-1.0
304,56,6144,768,108,0,-1.0,a8w8_bpreshuffle_256x16x64x256_16x16_16x16_16x16x1_16x16x1_1x16x1x16_4x4x1_1x1_intrawave_v1,1.0,-1.0,-1.0
304,56,6144,1024,15,0,-1.0,a8w8_bpreshuffle_256x16x64x256_16x16_16x16_16x16x1_16x16x1_1x16x1x16_4x4x1_1x1_intrawave_v1,1.0,-1.0,-1.0
304,56,6144,1536,112,0,-1.0,a8w8_bpreshuffle_256x32x64x256_16x16_16x16_16x16x1_16x16x1_1x32x1x8_8x8x1_2x1_intrawave_v1,1.0,-1.0,-1.0
304,56,6144,2048,112,0,-1.0,a8w8_bpreshuffle_256x32x64x256_16x16_16x16_16x16x1_16x16x1_1x32x1x8_8x8x1_2x1_intrawave_v1,1.0,-1.0,-1.0
304,56,7168,256,75,0,-1.0,a8w8_bpreshuffle_128x16x256x64_16x16_16x16_4x16x1_4x32x1_1x16x1x8_8x8x1_1x2_intrawave_v1,1.0,-1.0,-1.0
304,56,7168,2048,112,0,9.4054,a8w8_bpreshuffle_256x32x64x256_16x16_16x16_16x16x1_16x16x1_1x32x1x8_8x8x1_2x1_intrawave_v1,174.81,1658.36,0.0
304,56,7168,2304,112,0,-1.0,a8w8_bpreshuffle_256x32x64x256_16x16_16x16_16x16x1_16x16x1_1x32x1x8_8x8x1_2x1_intrawave_v1,1.0,-1.0,-1.0
304,64,192,7168,10,0,-1.0,a8w8_bpreshuffle_128x16x32x512_16x16_16x16_32x4x1_32x4x1_1x16x1x8_4x4x1_1x1_intrawave_v1,1.0,-1.0,-1.0
304,64,512,7168,10,0,-1.0,a8w8_bpreshuffle_128x16x32x512_16x16_16x16_32x4x1_32x4x1_1x16x1x8_4x4x1_1x1_intrawave_v1,1.0,-1.0,-1.0
304,64,576,7168,10,0,9.2156,a8w8_bpreshuffle_128x16x32x512_16x16_16x16_32x4x1_32x4x1_1x16x1x8_4x4x1_1x1_intrawave_v1,57.35,505.8,0.0
304,64,896,5120,8,0,-1.0,a8w8_bpreshuffle_128x32x16x512_16x16_16x16_32x4x1_32x4x1_1x32x1x4_4x4x1_1x1_intrawave_v1,1.0,-1.0,-1.0
304,64,1024,5632,8,0,-1.0,a8w8_bpreshuffle_128x32x16x512_16x16_16x16_32x4x1_32x4x1_1x32x1x4_4x4x1_1x1_intrawave_v1,1.0,-1.0,-1.0
304,64,1056,1408,9,0,-1.0,a8w8_bpreshuffle_128x16x32x128_16x16_16x16_8x16x1_8x16x1_1x16x1x8_4x4x1_1x1_intrawave_v1,1.0,-1.0,-1.0
304,64,1280,4096,8,0,-1.0,a8w8_bpreshuffle_128x32x16x512_16x16_16x16_32x4x1_32x4x1_1x32x1x4_4x4x1_1x1_intrawave_v1,1.0,-1.0,-1.0
304,64,1408,352,0,0,-1.0,a8w8_bpreshuffle_256x128x128x128_16x16_16x16_8x32x1_8x32x1_1x32x1x8_8x8x1_2x1_intrawave_v3,1.0,-1.0,-1.0
304,64,1408,1408,9,0,-1.0,a8w8_bpreshuffle_128x16x32x128_16x16_16x16_8x16x1_8x16x1_1x16x1x8_4x4x1_1x1_intrawave_v1,1.0,-1.0,-1.0
304,64,1536,2048,10,0,-1.0,a8w8_bpreshuffle_128x16x32x512_16x16_16x16_32x4x1_32x4x1_1x16x1x8_4x4x1_1x1_intrawave_v1,1.0,-1.0,-1.0
304,64,1536,7168,10,0,9.7048,a8w8_bpreshuffle_128x16x32x512_16x16_16x16_32x4x1_32x4x1_1x16x1x8_4x4x1_1x1_intrawave_v1,145.22,1202.02,0.0
304,64,1792,6144,10,0,-1.0,a8w8_bpreshuffle_128x16x32x512_16x16_16x16_32x4x1_32x4x1_1x16x1x8_4x4x1_1x1_intrawave_v1,1.0,-1.0,-1.0
304,64,2048,1536,10,0,-1.0,a8w8_bpreshuffle_128x16x32x512_16x16_16x16_32x4x1_32x4x1_1x16x1x8_4x4x1_1x1_intrawave_v1,1.0,-1.0,-1.0
304,64,2048,6144,11,0,-1.0,a8w8_bpreshuffle_256x16x64x512_16x16_16x16_32x8x1_32x8x1_1x16x1x16_4x4x1_1x1_intrawave_v1,1.0,-1.0,-1.0
304,64,2112,7168,10,0,10.665,a8w8_bpreshuffle_128x16x32x512_16x16_16x16_32x4x1_32x4x1_1x16x1x8_4x4x1_1x1_intrawave_v1,181.69,1487.85,0.0
304,64,3072,1536,11,0,5.1784,a8w8_bpreshuffle_256x16x64x512_16x16_16x16_32x8x1_32x8x1_1x16x1x16_4x4x1_1x1_intrawave_v1,116.63,1006.12,0.0
304,64,3072,4096,5,0,-1.0,a8w8_bpreshuffle_256x16x64x512_16x16_16x16_32x8x1_32x8x1_1x16x1x16_4x4x1_1x1_intrawave_v1,1.0,-1.0,-1.0
304,64,3584,6144,11,0,-1.0,a8w8_bpreshuffle_256x16x64x512_16x16_16x16_32x8x1_32x8x1_1x16x1x16_4x4x1_1x1_intrawave_v1,1.0,-1.0,-1.0
304,64,4096,512,9,0,4.6796,a8w8_bpreshuffle_128x16x32x128_16x16_16x16_8x16x1_8x16x1_1x16x1x8_4x4x1_1x1_intrawave_v1,57.36,567.19,0.0
304,64,4096,640,23,0,-1.0,a8w8_bpreshuffle_128x16x32x128_16x16_16x16_8x16x1_8x16x1_1x16x1x8_4x4x1_1x1_intrawave_v2,1.0,-1.0,-1.0
304,64,4096,1024,15,0,-1.0,a8w8_bpreshuffle_256x16x64x256_16x16_16x16_16x16x1_16x16x1_1x16x1x16_4x4x1_1x1_intrawave_v1,1.0,-1.0,-1.0
304,64,4096,3072,5,0,-1.0,a8w8_bpreshuffle_256x16x64x512_16x16_16x16_32x8x1_32x8x1_1x16x1x16_4x4x1_1x1_intrawave_v1,1.0,-1.0,-1.0
304,64,4608,7168,11,0,15.7662,a8w8_bpreshuffle_256x16x64x512_16x16_16x16_32x8x1_32x8x1_1x16x1x16_4x4x1_1x1_intrawave_v1,268.16,2161.5,0.0
304,64,5120,640,9,0,-1.0,a8w8_bpreshuffle_128x16x32x128_16x16_16x16_8x16x1_8x16x1_1x16x1x8_4x4x1_1x1_intrawave_v1,1.0,-1.0,-1.0
304,64,5120,2048,112,0,-1.0,a8w8_bpreshuffle_256x32x64x256_16x16_16x16_16x16x1_16x16x1_1x32x1x8_8x8x1_2x1_intrawave_v1,1.0,-1.0,-1.0
304,64,6144,768,15,0,-1.0,a8w8_bpreshuffle_256x16x64x256_16x16_16x16_16x16x1_16x16x1_1x16x1x16_4x4x1_1x1_intrawave_v1,1.0,-1.0,-1.0
304,64,6144,1024,15,0,-1.0,a8w8_bpreshuffle_256x16x64x256_16x16_16x16_16x16x1_16x16x1_1x16x1x16_4x4x1_1x1_intrawave_v1,1.0,-1.0,-1.0
304,64,6144,1536,112,0,-1.0,a8w8_bpreshuffle_256x32x64x256_16x16_16x16_16x16x1_16x16x1_1x32x1x8_8x8x1_2x1_intrawave_v1,1.0,-1.0,-1.0
304,64,6144,2048,112,0,-1.0,a8w8_bpreshuffle_256x32x64x256_16x16_16x16_16x16x1_16x16x1_1x32x1x8_8x8x1_2x1_intrawave_v1,1.0,-1.0,-1.0
304,64,7168,256,75,0,-1.0,a8w8_bpreshuffle_128x16x256x64_16x16_16x16_4x16x1_4x32x1_1x16x1x8_8x8x1_1x2_intrawave_v1,1.0,-1.0,-1.0
304,64,7168,2048,112,0,9.2867,a8w8_bpreshuffle_256x32x64x256_16x16_16x16_16x16x1_16x16x1_1x32x1x8_8x8x1_2x1_intrawave_v1,202.34,1693.67,0.0
304,64,7168,2304,112,0,-1.0,a8w8_bpreshuffle_256x32x64x256_16x16_16x16_16x16x1_16x16x1_1x32x1x8_8x8x1_2x1_intrawave_v1,1.0,-1.0,-1.0
304,72,192,7168,10,0,-1.0,a8w8_bpreshuffle_128x16x32x512_16x16_16x16_32x4x1_32x4x1_1x16x1x8_4x4x1_1x1_intrawave_v1,1.0,-1.0,-1.0
304,72,512,7168,10,0,-1.0,a8w8_bpreshuffle_128x16x32x512_16x16_16x16_32x4x1_32x4x1_1x16x1x8_4x4x1_1x1_intrawave_v1,1.0,-1.0,-1.0
304,72,576,7168,10,0,10.5451,a8w8_bpreshuffle_128x16x32x512_16x16_16x16_32x4x1_32x4x1_1x16x1x8_4x4x1_1x1_intrawave_v1,56.38,448.34,0.0
304,72,896,5120,10,0,-1.0,a8w8_bpreshuffle_128x16x32x512_16x16_16x16_32x4x1_32x4x1_1x16x1x8_4x4x1_1x1_intrawave_v1,1.0,-1.0,-1.0
304,72,1024,5632,10,0,-1.0,a8w8_bpreshuffle_128x16x32x512_16x16_16x16_32x4x1_32x4x1_1x16x1x8_4x4x1_1x1_intrawave_v1,1.0,-1.0,-1.0
304,72,1056,1408,9,0,-1.0,a8w8_bpreshuffle_128x16x32x128_16x16_16x16_8x16x1_8x16x1_1x16x1x8_4x4x1_1x1_intrawave_v1,1.0,-1.0,-1.0
304,72,1280,4096,11,0,-1.0,a8w8_bpreshuffle_256x16x64x512_16x16_16x16_32x8x1_32x8x1_1x16x1x16_4x4x1_1x1_intrawave_v1,1.0,-1.0,-1.0
304,72,1408,352,0,0,-1.0,a8w8_bpreshuffle_256x128x128x128_16x16_16x16_8x32x1_8x32x1_1x32x1x8_8x8x1_2x1_intrawave_v3,1.0,-1.0,-1.0
304,72,1408,1408,9,0,-1.0,a8w8_bpreshuffle_128x16x32x128_16x16_16x16_8x16x1_8x16x1_1x16x1x8_4x4x1_1x1_intrawave_v1,1.0,-1.0,-1.0
304,72,1536,2048,8,0,-1.0,a8w8_bpreshuffle_128x32x16x512_16x16_16x16_32x4x1_32x4x1_1x32x1x4_4x4x1_1x1_intrawave_v1,1.0,-1.0,-1.0
304,72,1536,7168,5,0,11.7961,a8w8_bpreshuffle_256x16x64x512_16x16_16x16_32x8x1_32x8x1_1x16x1x16_4x4x1_1x1_intrawave_v1,134.4,995.87,0.0
304,72,1792,6144,11,0,-1.0,a8w8_bpreshuffle_256x16x64x512_16x16_16x16_32x8x1_32x8x1_1x16x1x16_4x4x1_1x1_intrawave_v1,1.0,-1.0,-1.0
304,72,2048,1536,11,0,-1.0,a8w8_bpreshuffle_256x16x64x512_16x16_16x16_32x8x1_32x8x1_1x16x1x16_4x4x1_1x1_intrawave_v1,1.0,-1.0,-1.0
304,72,2048,6144,11,0,-1.0,a8w8_bpreshuffle_256x16x64x512_16x16_16x16_32x8x1_32x8x1_1x16x1x16_4x4x1_1x1_intrawave_v1,1.0,-1.0,-1.0
304,72,2112,7168,12,0,13.8581,a8w8_bpreshuffle_256x32x64x512_16x16_16x16_32x8x1_32x8x1_1x32x1x8_8x8x1_1x2_intrawave_v1,157.31,1151.6,0.0
304,72,3072,1536,15,0,6.3797,a8w8_bpreshuffle_256x16x64x256_16x16_16x16_16x16x1_16x16x1_1x16x1x16_4x4x1_1x1_intrawave_v1,106.51,826.3,0.0
304,72,3072,4096,12,0,-1.0,a8w8_bpreshuffle_256x32x64x512_16x16_16x16_32x8x1_32x8x1_1x32x1x8_8x8x1_1x2_intrawave_v1,1.0,-1.0,-1.0
304,72,3584,6144,12,0,-1.0,a8w8_bpreshuffle_256x32x64x512_16x16_16x16_32x8x1_32x8x1_1x32x1x8_8x8x1_1x2_intrawave_v1,1.0,-1.0,-1.0
304,72,4096,512,9,0,4.7677,a8w8_bpreshuffle_128x16x32x128_16x16_16x16_8x16x1_8x16x1_1x16x1x8_4x4x1_1x1_intrawave_v1,63.34,571.31,0.0
304,72,4096,640,9,0,-1.0,a8w8_bpreshuffle_128x16x32x128_16x16_16x16_8x16x1_8x16x1_1x16x1x8_4x4x1_1x1_intrawave_v1,1.0,-1.0,-1.0
304,72,4096,1024,112,0,-1.0,a8w8_bpreshuffle_256x32x64x256_16x16_16x16_16x16x1_16x16x1_1x32x1x8_8x8x1_2x1_intrawave_v1,1.0,-1.0,-1.0
304,72,4096,3072,112,0,-1.0,a8w8_bpreshuffle_256x32x64x256_16x16_16x16_16x16x1_16x16x1_1x32x1x8_8x8x1_2x1_intrawave_v1,1.0,-1.0,-1.0
304,72,4608,7168,12,0,19.8479,a8w8_bpreshuffle_256x32x64x512_16x16_16x16_32x8x1_32x8x1_1x32x1x8_8x8x1_1x2_intrawave_v1,239.64,1723.6,0.0
304,72,5120,640,9,0,-1.0,a8w8_bpreshuffle_128x16x32x128_16x16_16x16_8x16x1_8x16x1_1x16x1x8_4x4x1_1x1_intrawave_v1,1.0,-1.0,-1.0
304,72,5120,2048,112,0,-1.0,a8w8_bpreshuffle_256x32x64x256_16x16_16x16_16x16x1_16x16x1_1x32x1x8_8x8x1_2x1_intrawave_v1,1.0,-1.0,-1.0
304,72,6144,768,112,0,-1.0,a8w8_bpreshuffle_256x32x64x256_16x16_16x16_16x16x1_16x16x1_1x32x1x8_8x8x1_2x1_intrawave_v1,1.0,-1.0,-1.0
304,72,6144,1024,112,0,-1.0,a8w8_bpreshuffle_256x32x64x256_16x16_16x16_16x16x1_16x16x1_1x32x1x8_8x8x1_2x1_intrawave_v1,1.0,-1.0,-1.0
304,72,6144,1536,119,0,-1.0,a8w8_bpreshuffle_256x32x128x256_16x16_16x16_16x16x1_16x16x1_1x16x1x16_8x8x1_1x2_intrawave_v1,1.0,-1.0,-1.0
304,72,6144,2048,112,0,-1.0,a8w8_bpreshuffle_256x32x64x256_16x16_16x16_16x16x1_16x16x1_1x32x1x8_8x8x1_2x1_intrawave_v1,1.0,-1.0,-1.0
304,72,7168,256,75,0,-1.0,a8w8_bpreshuffle_128x16x256x64_16x16_16x16_4x16x1_4x32x1_1x16x1x8_8x8x1_1x2_intrawave_v1,1.0,-1.0,-1.0
304,72,7168,2048,113,0,9.7432,a8w8_bpreshuffle_256x48x64x256_16x16_16x16_16x16x1_16x16x1_1x16x1x16_4x4x1_1x1_intrawave_v1,216.96,1627.77,0.0
304,72,7168,2304,113,0,-1.0,a8w8_bpreshuffle_256x48x64x256_16x16_16x16_16x16x1_16x16x1_1x16x1x16_4x4x1_1x1_intrawave_v1,1.0,-1.0,-1.0
304,80,192,7168,10,0,-1.0,a8w8_bpreshuffle_128x16x32x512_16x16_16x16_32x4x1_32x4x1_1x16x1x8_4x4x1_1x1_intrawave_v1,1.0,-1.0,-1.0
304,80,512,7168,10,0,-1.0,a8w8_bpreshuffle_128x16x32x512_16x16_16x16_32x4x1_32x4x1_1x16x1x8_4x4x1_1x1_intrawave_v1,1.0,-1.0,-1.0
304,80,576,7168,10,0,9.4259,a8w8_bpreshuffle_128x16x32x512_16x16_16x16_32x4x1_32x4x1_1x16x1x8_4x4x1_1x1_intrawave_v1,70.08,508.64,0.0
304,80,896,5120,10,0,8.0466,a8w8_bpreshuffle_128x16x32x512_16x16_16x16_32x4x1_32x4x1_1x16x1x8_4x4x1_1x1_intrawave_v1,0.0,91.22,638.84
304,80,1024,5632,10,0,8.9247,a8w8_bpreshuffle_128x16x32x512_16x16_16x16_32x4x1_32x4x1_1x16x1x8_4x4x1_1x1_intrawave_v1,0.0,103.39,715.05
304,80,1056,1408,9,0,6.3784,a8w8_bpreshuffle_128x16x32x128_16x16_16x16_8x16x1_8x16x1_1x16x1x8_4x4x1_1x1_intrawave_v1,0.0,37.3,277.26
304,80,1280,4096,10,0,7.7899,a8w8_bpreshuffle_128x16x32x512_16x16_16x16_32x4x1_32x4x1_1x16x1x8_4x4x1_1x1_intrawave_v1,0.0,107.69,741.39
304,80,1408,352,0,0,-1.0,a8w8_bpreshuffle_256x128x128x128_16x16_16x16_8x32x1_8x32x1_1x32x1x8_8x8x1_2x1_intrawave_v3,1.0,-1.0,-1.0
304,80,1408,1408,9,0,-1.0,a8w8_bpreshuffle_128x16x32x128_16x16_16x16_8x16x1_8x16x1_1x16x1x8_4x4x1_1x1_intrawave_v1,1.0,-1.0,-1.0
304,80,1536,2048,10,0,-1.0,a8w8_bpreshuffle_128x16x32x512_16x16_16x16_32x4x1_32x4x1_1x16x1x8_4x4x1_1x1_intrawave_v1,1.0,-1.0,-1.0
304,80,1536,7168,11,0,11.6955,a8w8_bpreshuffle_256x16x64x512_16x16_16x16_32x8x1_32x8x1_1x16x1x16_4x4x1_1x1_intrawave_v1,150.62,1011.44,0.0
304,80,1792,6144,11,0,-1.0,a8w8_bpreshuffle_256x16x64x512_16x16_16x16_32x8x1_32x8x1_1x16x1x16_4x4x1_1x1_intrawave_v1,1.0,-1.0,-1.0
304,80,2048,1536,11,0,-1.0,a8w8_bpreshuffle_256x16x64x512_16x16_16x16_32x8x1_32x8x1_1x16x1x16_4x4x1_1x1_intrawave_v1,1.0,-1.0,-1.0
304,80,2048,6144,11,0,-1.0,a8w8_bpreshuffle_256x16x64x512_16x16_16x16_32x8x1_32x8x1_1x16x1x16_4x4x1_1x1_intrawave_v1,1.0,-1.0,-1.0
304,80,2112,7168,5,0,14.6704,a8w8_bpreshuffle_256x16x64x512_16x16_16x16_32x8x1_32x8x1_1x16x1x16_4x4x1_1x1_intrawave_v1,165.11,1094.05,0.0
304,80,3072,1536,15,0,6.6954,a8w8_bpreshuffle_256x16x64x256_16x16_16x16_16x16x1_16x16x1_1x16x1x16_4x4x1_1x1_intrawave_v1,112.76,796.52,0.0
304,80,3072,4096,12,0,-1.0,a8w8_bpreshuffle_256x32x64x512_16x16_16x16_32x8x1_32x8x1_1x32x1x8_8x8x1_1x2_intrawave_v1,1.0,-1.0,-1.0
304,80,3584,6144,12,0,-1.0,a8w8_bpreshuffle_256x32x64x512_16x16_16x16_32x8x1_32x8x1_1x32x1x8_8x8x1_1x2_intrawave_v1,1.0,-1.0,-1.0
304,80,4096,512,9,0,4.4101,a8w8_bpreshuffle_128x16x32x128_16x16_16x16_8x16x1_8x16x1_1x16x1x8_4x4x1_1x1_intrawave_v1,76.09,633.43,0.0
304,80,4096,640,23,0,5.5362,a8w8_bpreshuffle_128x16x32x128_16x16_16x16_8x16x1_8x16x1_1x16x1x8_4x4x1_1x1_intrawave_v2,0.0,75.76,601.13
304,80,4096,1024,112,0,-1.0,a8w8_bpreshuffle_256x32x64x256_16x16_16x16_16x16x1_16x16x1_1x32x1x8_8x8x1_2x1_intrawave_v1,1.0,-1.0,-1.0
304,80,4096,3072,12,0,-1.0,a8w8_bpreshuffle_256x32x64x512_16x16_16x16_32x8x1_32x8x1_1x32x1x8_8x8x1_1x2_intrawave_v1,1.0,-1.0,-1.0
304,80,4608,7168,12,0,19.8615,a8w8_bpreshuffle_256x32x64x512_16x16_16x16_32x8x1_32x8x1_1x32x1x8_8x8x1_1x2_intrawave_v1,266.08,1729.02,0.0
304,80,5120,640,9,0,5.7964,a8w8_bpreshuffle_128x16x32x128_16x16_16x16_8x16x1_8x16x1_1x16x1x8_4x4x1_1x1_intrawave_v1,0.0,90.45,715.48
304,80,5120,2048,113,0,8.7921,a8w8_bpreshuffle_256x48x64x256_16x16_16x16_16x16x1_16x16x1_1x16x1x16_4x4x1_1x1_intrawave_v1,0.0,190.82,1304.44
304,80,6144,768,112,0,-1.0,a8w8_bpreshuffle_256x32x64x256_16x16_16x16_16x16x1_16x16x1_1x32x1x8_8x8x1_2x1_intrawave_v1,1.0,-1.0,-1.0
304,80,6144,1024,112,0,-1.0,a8w8_bpreshuffle_256x32x64x256_16x16_16x16_16x16x1_16x16x1_1x32x1x8_8x8x1_2x1_intrawave_v1,1.0,-1.0,-1.0
304,80,6144,1536,119,0,-1.0,a8w8_bpreshuffle_256x32x128x256_16x16_16x16_16x16x1_16x16x1_1x16x1x16_8x8x1_1x2_intrawave_v1,1.0,-1.0,-1.0
304,80,6144,2048,112,0,-1.0,a8w8_bpreshuffle_256x32x64x256_16x16_16x16_16x16x1_16x16x1_1x32x1x8_8x8x1_2x1_intrawave_v1,1.0,-1.0,-1.0
304,80,7168,256,75,0,-1.0,a8w8_bpreshuffle_128x16x256x64_16x16_16x16_4x16x1_4x32x1_1x16x1x8_8x8x1_1x2_intrawave_v1,1.0,-1.0,-1.0
304,80,7168,2048,113,0,10.2086,a8w8_bpreshuffle_256x48x64x256_16x16_16x16_16x16x1_16x16x1_1x16x1x16_4x4x1_1x1_intrawave_v1,230.08,1566.4,0.0
304,80,7168,2304,119,0,-1.0,a8w8_bpreshuffle_256x32x128x256_16x16_16x16_16x16x1_16x16x1_1x16x1x16_8x8x1_1x2_intrawave_v1,1.0,-1.0,-1.0
304,88,192,7168,10,0,-1.0,a8w8_bpreshuffle_128x16x32x512_16x16_16x16_32x4x1_32x4x1_1x16x1x8_4x4x1_1x1_intrawave_v1,1.0,-1.0,-1.0
304,88,512,7168,10,0,-1.0,a8w8_bpreshuffle_128x16x32x512_16x16_16x16_32x4x1_32x4x1_1x16x1x8_4x4x1_1x1_intrawave_v1,1.0,-1.0,-1.0
304,88,576,7168,10,0,10.3344,a8w8_bpreshuffle_128x16x32x512_16x16_16x16_32x4x1_32x4x1_1x16x1x8_4x4x1_1x1_intrawave_v1,70.31,470.36,0.0
304,88,896,5120,10,0,-1.0,a8w8_bpreshuffle_128x16x32x512_16x16_16x16_32x4x1_32x4x1_1x16x1x8_4x4x1_1x1_intrawave_v1,1.0,-1.0,-1.0
304,88,1024,5632,10,0,-1.0,a8w8_bpreshuffle_128x16x32x512_16x16_16x16_32x4x1_32x4x1_1x16x1x8_4x4x1_1x1_intrawave_v1,1.0,-1.0,-1.0
304,88,1056,1408,23,0,-1.0,a8w8_bpreshuffle_128x16x32x128_16x16_16x16_8x16x1_8x16x1_1x16x1x8_4x4x1_1x1_intrawave_v2,1.0,-1.0,-1.0
304,88,1280,4096,11,0,-1.0,a8w8_bpreshuffle_256x16x64x512_16x16_16x16_32x8x1_32x8x1_1x16x1x16_4x4x1_1x1_intrawave_v1,1.0,-1.0,-1.0
304,88,1408,352,0,0,-1.0,a8w8_bpreshuffle_256x128x128x128_16x16_16x16_8x32x1_8x32x1_1x32x1x8_8x8x1_2x1_intrawave_v3,1.0,-1.0,-1.0
304,88,1408,1408,9,0,-1.0,a8w8_bpreshuffle_128x16x32x128_16x16_16x16_8x16x1_8x16x1_1x16x1x8_4x4x1_1x1_intrawave_v1,1.0,-1.0,-1.0
304,88,1536,2048,10,0,-1.0,a8w8_bpreshuffle_128x16x32x512_16x16_16x16_32x4x1_32x4x1_1x16x1x8_4x4x1_1x1_intrawave_v1,1.0,-1.0,-1.0
304,88,1536,7168,10,0,11.7699,a8w8_bpreshuffle_128x16x32x512_16x16_16x16_32x4x1_32x4x1_1x16x1x8_4x4x1_1x1_intrawave_v1,164.64,1012.0,0.0
304,88,1792,6144,11,0,-1.0,a8w8_bpreshuffle_256x16x64x512_16x16_16x16_32x8x1_32x8x1_1x16x1x16_4x4x1_1x1_intrawave_v1,1.0,-1.0,-1.0
304,88,2048,1536,5,0,-1.0,a8w8_bpreshuffle_256x16x64x512_16x16_16x16_32x8x1_32x8x1_1x16x1x16_4x4x1_1x1_intrawave_v1,1.0,-1.0,-1.0
304,88,2048,6144,11,0,-1.0,a8w8_bpreshuffle_256x16x64x512_16x16_16x16_32x8x1_32x8x1_1x16x1x16_4x4x1_1x1_intrawave_v1,1.0,-1.0,-1.0
304,88,2112,7168,5,0,12.9954,a8w8_bpreshuffle_256x16x64x512_16x16_16x16_32x8x1_32x8x1_1x16x1x16_4x4x1_1x1_intrawave_v1,205.03,1242.08,0.0
304,88,3072,1536,5,0,5.9655,a8w8_bpreshuffle_256x16x64x512_16x16_16x16_32x8x1_32x8x1_1x16x1x16_4x4x1_1x1_intrawave_v1,139.21,904.27,0.0
304,88,3072,4096,112,0,-1.0,a8w8_bpreshuffle_256x32x64x256_16x16_16x16_16x16x1_16x16x1_1x32x1x8_8x8x1_2x1_intrawave_v1,1.0,-1.0,-1.0
304,88,3584,6144,12,0,-1.0,a8w8_bpreshuffle_256x32x64x512_16x16_16x16_32x8x1_32x8x1_1x32x1x8_8x8x1_1x2_intrawave_v1,1.0,-1.0,-1.0
304,88,4096,512,9,0,4.3344,a8w8_bpreshuffle_128x16x32x128_16x16_16x16_8x16x1_8x16x1_1x16x1x8_4x4x1_1x1_intrawave_v1,85.16,660.55,0.0
304,88,4096,640,23,0,-1.0,a8w8_bpreshuffle_128x16x32x128_16x16_16x16_8x16x1_8x16x1_1x16x1x8_4x4x1_1x1_intrawave_v2,1.0,-1.0,-1.0
304,88,4096,1024,108,0,-1.0,a8w8_bpreshuffle_256x16x64x256_16x16_16x16_16x16x1_16x16x1_1x16x1x16_4x4x1_1x1_intrawave_v1,1.0,-1.0,-1.0
304,88,4096,3072,12,0,-1.0,a8w8_bpreshuffle_256x32x64x512_16x16_16x16_32x8x1_32x8x1_1x32x1x8_8x8x1_1x2_intrawave_v1,1.0,-1.0,-1.0
304,88,4608,7168,12,0,20.1094,a8w8_bpreshuffle_256x32x64x512_16x16_16x16_32x8x1_32x8x1_1x32x1x8_8x8x1_1x2_intrawave_v1,289.08,1714.22,0.0
304,88,5120,640,9,0,-1.0,a8w8_bpreshuffle_128x16x32x128_16x16_16x16_8x16x1_8x16x1_1x16x1x8_4x4x1_1x1_intrawave_v1,1.0,-1.0,-1.0
304,88,5120,2048,112,0,-1.0,a8w8_bpreshuffle_256x32x64x256_16x16_16x16_16x16x1_16x16x1_1x32x1x8_8x8x1_2x1_intrawave_v1,1.0,-1.0,-1.0
304,88,6144,768,112,0,-1.0,a8w8_bpreshuffle_256x32x64x256_16x16_16x16_16x16x1_16x16x1_1x32x1x8_8x8x1_2x1_intrawave_v1,1.0,-1.0,-1.0
304,88,6144,1024,112,0,-1.0,a8w8_bpreshuffle_256x32x64x256_16x16_16x16_16x16x1_16x16x1_1x32x1x8_8x8x1_2x1_intrawave_v1,1.0,-1.0,-1.0
304,88,6144,1536,119,0,-1.0,a8w8_bpreshuffle_256x32x128x256_16x16_16x16_16x16x1_16x16x1_1x16x1x16_8x8x1_1x2_intrawave_v1,1.0,-1.0,-1.0
304,88,6144,2048,112,0,-1.0,a8w8_bpreshuffle_256x32x64x256_16x16_16x16_16x16x1_16x16x1_1x32x1x8_8x8x1_2x1_intrawave_v1,1.0,-1.0,-1.0
304,88,7168,256,75,0,-1.0,a8w8_bpreshuffle_128x16x256x64_16x16_16x16_4x16x1_4x32x1_1x16x1x8_8x8x1_1x2_intrawave_v1,1.0,-1.0,-1.0
304,88,7168,2048,113,0,10.312,a8w8_bpreshuffle_256x48x64x256_16x16_16x16_16x16x1_16x16x1_1x16x1x16_4x4x1_1x1_intrawave_v1,250.55,1563.41,0.0
304,88,7168,2304,119,0,-1.0,a8w8_bpreshuffle_256x32x128x256_16x16_16x16_16x16x1_16x16x1_1x16x1x16_8x8x1_1x2_intrawave_v1,1.0,-1.0,-1.0
304,96,192,7168,10,0,-1.0,a8w8_bpreshuffle_128x16x32x512_16x16_16x16_32x4x1_32x4x1_1x16x1x8_4x4x1_1x1_intrawave_v1,1.0,-1.0,-1.0
304,96,512,7168,10,0,-1.0,a8w8_bpreshuffle_128x16x32x512_16x16_16x16_32x4x1_32x4x1_1x16x1x8_4x4x1_1x1_intrawave_v1,1.0,-1.0,-1.0
304,96,576,7168,10,0,9.2247,a8w8_bpreshuffle_128x16x32x512_16x16_16x16_32x4x1_32x4x1_1x16x1x8_4x4x1_1x1_intrawave_v1,85.93,534.16,0.0
304,96,896,5120,10,0,-1.0,a8w8_bpreshuffle_128x16x32x512_16x16_16x16_32x4x1_32x4x1_1x16x1x8_4x4x1_1x1_intrawave_v1,1.0,-1.0,-1.0
304,96,1024,5632,10,0,-1.0,a8w8_bpreshuffle_128x16x32x512_16x16_16x16_32x4x1_32x4x1_1x16x1x8_4x4x1_1x1_intrawave_v1,1.0,-1.0,-1.0
304,96,1056,1408,23,0,-1.0,a8w8_bpreshuffle_128x16x32x128_16x16_16x16_8x16x1_8x16x1_1x16x1x8_4x4x1_1x1_intrawave_v2,1.0,-1.0,-1.0
304,96,1280,4096,10,0,-1.0,a8w8_bpreshuffle_128x16x32x512_16x16_16x16_32x4x1_32x4x1_1x16x1x8_4x4x1_1x1_intrawave_v1,1.0,-1.0,-1.0
304,96,1408,352,0,0,-1.0,a8w8_bpreshuffle_256x128x128x128_16x16_16x16_8x32x1_8x32x1_1x32x1x8_8x8x1_2x1_intrawave_v3,1.0,-1.0,-1.0
304,96,1408,1408,9,0,-1.0,a8w8_bpreshuffle_128x16x32x128_16x16_16x16_8x16x1_8x16x1_1x16x1x8_4x4x1_1x1_intrawave_v1,1.0,-1.0,-1.0
304,96,1536,2048,8,0,-1.0,a8w8_bpreshuffle_128x32x16x512_16x16_16x16_32x4x1_32x4x1_1x32x1x4_4x4x1_1x1_intrawave_v1,1.0,-1.0,-1.0
304,96,1536,7168,10,0,11.3318,a8w8_bpreshuffle_128x16x32x512_16x16_16x16_32x4x1_32x4x1_1x16x1x8_4x4x1_1x1_intrawave_v1,186.55,1058.36,0.0
304,96,1792,6144,11,0,-1.0,a8w8_bpreshuffle_256x16x64x512_16x16_16x16_32x8x1_32x8x1_1x16x1x16_4x4x1_1x1_intrawave_v1,1.0,-1.0,-1.0
304,96,2048,1536,5,0,-1.0,a8w8_bpreshuffle_256x16x64x512_16x16_16x16_32x8x1_32x8x1_1x16x1x16_4x4x1_1x1_intrawave_v1,1.0,-1.0,-1.0
304,96,2048,6144,5,0,-1.0,a8w8_bpreshuffle_256x16x64x512_16x16_16x16_32x8x1_32x8x1_1x16x1x16_4x4x1_1x1_intrawave_v1,1.0,-1.0,-1.0
304,96,2112,7168,5,0,12.908,a8w8_bpreshuffle_256x16x64x512_16x16_16x16_32x8x1_32x8x1_1x16x1x16_4x4x1_1x1_intrawave_v1,225.18,1257.55,0.0
304,96,3072,1536,5,0,5.8249,a8w8_bpreshuffle_256x16x64x512_16x16_16x16_32x8x1_32x8x1_1x16x1x16_4x4x1_1x1_intrawave_v1,155.53,936.65,0.0
304,96,3072,4096,112,0,-1.0,a8w8_bpreshuffle_256x32x64x256_16x16_16x16_16x16x1_16x16x1_1x32x1x8_8x8x1_2x1_intrawave_v1,1.0,-1.0,-1.0
304,96,3584,6144,12,0,-1.0,a8w8_bpreshuffle_256x32x64x512_16x16_16x16_32x8x1_32x8x1_1x32x1x8_8x8x1_1x2_intrawave_v1,1.0,-1.0,-1.0
304,96,4096,512,9,0,4.2906,a8w8_bpreshuffle_128x16x32x128_16x16_16x16_8x16x1_8x16x1_1x16x1x8_4x4x1_1x1_intrawave_v1,93.85,683.53,0.0
304,96,4096,640,9,0,-1.0,a8w8_bpreshuffle_128x16x32x128_16x16_16x16_8x16x1_8x16x1_1x16x1x8_4x4x1_1x1_intrawave_v1,1.0,-1.0,-1.0
304,96,4096,1024,112,0,-1.0,a8w8_bpreshuffle_256x32x64x256_16x16_16x16_16x16x1_16x16x1_1x32x1x8_8x8x1_2x1_intrawave_v1,1.0,-1.0,-1.0
304,96,4096,3072,112,0,-1.0,a8w8_bpreshuffle_256x32x64x256_16x16_16x16_16x16x1_16x16x1_1x32x1x8_8x8x1_2x1_intrawave_v1,1.0,-1.0,-1.0
304,96,4608,7168,112,0,19.8087,a8w8_bpreshuffle_256x32x64x256_16x16_16x16_16x16x1_16x16x1_1x32x1x8_8x8x1_2x1_intrawave_v1,320.15,1746.86,0.0
304,96,5120,640,9,0,-1.0,a8w8_bpreshuffle_128x16x32x128_16x16_16x16_8x16x1_8x16x1_1x16x1x8_4x4x1_1x1_intrawave_v1,1.0,-1.0,-1.0
304,96,5120,2048,112,0,-1.0,a8w8_bpreshuffle_256x32x64x256_16x16_16x16_16x16x1_16x16x1_1x32x1x8_8x8x1_2x1_intrawave_v1,1.0,-1.0,-1.0
304,96,6144,768,112,0,-1.0,a8w8_bpreshuffle_256x32x64x256_16x16_16x16_16x16x1_16x16x1_1x32x1x8_8x8x1_2x1_intrawave_v1,1.0,-1.0,-1.0
304,96,6144,1024,112,0,-1.0,a8w8_bpreshuffle_256x32x64x256_16x16_16x16_16x16x1_16x16x1_1x32x1x8_8x8x1_2x1_intrawave_v1,1.0,-1.0,-1.0
304,96,6144,1536,112,0,-1.0,a8w8_bpreshuffle_256x32x64x256_16x16_16x16_16x16x1_16x16x1_1x32x1x8_8x8x1_2x1_intrawave_v1,1.0,-1.0,-1.0
304,96,6144,2048,112,0,-1.0,a8w8_bpreshuffle_256x32x64x256_16x16_16x16_16x16x1_16x16x1_1x32x1x8_8x8x1_2x1_intrawave_v1,1.0,-1.0,-1.0
304,96,7168,256,75,0,-1.0,a8w8_bpreshuffle_128x16x256x64_16x16_16x16_4x16x1_4x32x1_1x16x1x8_8x8x1_1x2_intrawave_v1,1.0,-1.0,-1.0
304,96,7168,2048,113,0,10.2194,a8w8_bpreshuffle_256x48x64x256_16x16_16x16_16x16x1_16x16x1_1x16x1x16_4x4x1_1x1_intrawave_v1,275.81,1590.4,0.0
304,96,7168,2304,119,0,-1.0,a8w8_bpreshuffle_256x32x128x256_16x16_16x16_16x16x1_16x16x1_1x16x1x16_8x8x1_1x2_intrawave_v1,1.0,-1.0,-1.0
304,104,192,7168,10,0,-1.0,a8w8_bpreshuffle_128x16x32x512_16x16_16x16_32x4x1_32x4x1_1x16x1x8_4x4x1_1x1_intrawave_v1,1.0,-1.0,-1.0
304,104,512,7168,11,0,-1.0,a8w8_bpreshuffle_256x16x64x512_16x16_16x16_32x8x1_32x8x1_1x16x1x16_4x4x1_1x1_intrawave_v1,1.0,-1.0,-1.0
304,104,576,7168,11,0,10.5775,a8w8_bpreshuffle_256x16x64x512_16x16_16x16_32x8x1_32x8x1_1x16x1x16_4x4x1_1x1_intrawave_v1,81.19,472.14,0.0
304,104,896,5120,5,0,-1.0,a8w8_bpreshuffle_256x16x64x512_16x16_16x16_32x8x1_32x8x1_1x16x1x16_4x4x1_1x1_intrawave_v1,1.0,-1.0,-1.0
304,104,1024,5632,10,0,-1.0,a8w8_bpreshuffle_128x16x32x512_16x16_16x16_32x4x1_32x4x1_1x16x1x8_4x4x1_1x1_intrawave_v1,1.0,-1.0,-1.0
304,104,1056,1408,23,0,-1.0,a8w8_bpreshuffle_128x16x32x128_16x16_16x16_8x16x1_8x16x1_1x16x1x8_4x4x1_1x1_intrawave_v2,1.0,-1.0,-1.0
304,104,1280,4096,11,0,-1.0,a8w8_bpreshuffle_256x16x64x512_16x16_16x16_32x8x1_32x8x1_1x16x1x16_4x4x1_1x1_intrawave_v1,1.0,-1.0,-1.0
304,104,1408,352,0,0,-1.0,a8w8_bpreshuffle_256x128x128x128_16x16_16x16_8x32x1_8x32x1_1x32x1x8_8x8x1_2x1_intrawave_v3,1.0,-1.0,-1.0
304,104,1408,1408,9,0,-1.0,a8w8_bpreshuffle_128x16x32x128_16x16_16x16_8x16x1_8x16x1_1x16x1x8_4x4x1_1x1_intrawave_v1,1.0,-1.0,-1.0
304,104,1536,2048,11,0,-1.0,a8w8_bpreshuffle_256x16x64x512_16x16_16x16_32x8x1_32x8x1_1x16x1x16_4x4x1_1x1_intrawave_v1,1.0,-1.0,-1.0
304,104,1536,7168,11,0,11.3172,a8w8_bpreshuffle_256x16x64x512_16x16_16x16_32x8x1_32x8x1_1x16x1x16_4x4x1_1x1_intrawave_v1,202.35,1066.96,0.0
304,104,1792,6144,11,0,-1.0,a8w8_bpreshuffle_256x16x64x512_16x16_16x16_32x8x1_32x8x1_1x16x1x16_4x4x1_1x1_intrawave_v1,1.0,-1.0,-1.0
304,104,2048,1536,5,0,-1.0,a8w8_bpreshuffle_256x16x64x512_16x16_16x16_32x8x1_32x8x1_1x16x1x16_4x4x1_1x1_intrawave_v1,1.0,-1.0,-1.0
304,104,2048,6144,11,0,-1.0,a8w8_bpreshuffle_256x16x64x512_16x16_16x16_32x8x1_32x8x1_1x16x1x16_4x4x1_1x1_intrawave_v1,1.0,-1.0,-1.0
304,104,2112,7168,19,0,14.1429,a8w8_bpreshuffle_256x16x64x512_16x16_16x16_32x8x1_32x8x1_1x16x1x16_4x4x1_1x1_intrawave_v2,222.65,1154.19,0.0
304,104,3072,1536,108,0,6.339,a8w8_bpreshuffle_256x16x64x256_16x16_16x16_16x16x1_16x16x1_1x16x1x16_4x4x1_1x1_intrawave_v1,154.83,870.38,0.0
304,104,3072,4096,12,0,-1.0,a8w8_bpreshuffle_256x32x64x512_16x16_16x16_32x8x1_32x8x1_1x32x1x8_8x8x1_1x2_intrawave_v1,1.0,-1.0,-1.0
304,104,3584,6144,119,0,-1.0,a8w8_bpreshuffle_256x32x128x256_16x16_16x16_16x16x1_16x16x1_1x16x1x16_8x8x1_1x2_intrawave_v1,1.0,-1.0,-1.0
304,104,4096,512,9,0,4.8815,a8w8_bpreshuffle_128x16x32x128_16x16_16x16_8x16x1_8x16x1_1x16x1x8_4x4x1_1x1_intrawave_v1,89.36,615.05,0.0
304,104,4096,640,9,0,-1.0,a8w8_bpreshuffle_128x16x32x128_16x16_16x16_8x16x1_8x16x1_1x16x1x8_4x4x1_1x1_intrawave_v1,1.0,-1.0,-1.0
304,104,4096,1024,15,0,-1.0,a8w8_bpreshuffle_256x16x64x256_16x16_16x16_16x16x1_16x16x1_1x16x1x16_4x4x1_1x1_intrawave_v1,1.0,-1.0,-1.0
304,104,4096,3072,12,0,-1.0,a8w8_bpreshuffle_256x32x64x512_16x16_16x16_32x8x1_32x8x1_1x32x1x8_8x8x1_1x2_intrawave_v1,1.0,-1.0,-1.0
304,104,4608,7168,12,0,22.1051,a8w8_bpreshuffle_256x32x64x512_16x16_16x16_32x8x1_32x8x1_1x32x1x8_8x8x1_1x2_intrawave_v1,310.8,1571.32,0.0
304,104,5120,640,9,0,-1.0,a8w8_bpreshuffle_128x16x32x128_16x16_16x16_8x16x1_8x16x1_1x16x1x8_4x4x1_1x1_intrawave_v1,1.0,-1.0,-1.0
304,104,5120,2048,119,0,-1.0,a8w8_bpreshuffle_256x32x128x256_16x16_16x16_16x16x1_16x16x1_1x16x1x16_8x8x1_1x2_intrawave_v1,1.0,-1.0,-1.0
304,104,6144,768,119,0,-1.0,a8w8_bpreshuffle_256x32x128x256_16x16_16x16_16x16x1_16x16x1_1x16x1x16_8x8x1_1x2_intrawave_v1,1.0,-1.0,-1.0
304,104,6144,1024,119,0,-1.0,a8w8_bpreshuffle_256x32x128x256_16x16_16x16_16x16x1_16x16x1_1x16x1x16_8x8x1_1x2_intrawave_v1,1.0,-1.0,-1.0
304,104,6144,1536,119,0,-1.0,a8w8_bpreshuffle_256x32x128x256_16x16_16x16_16x16x1_16x16x1_1x16x1x16_8x8x1_1x2_intrawave_v1,1.0,-1.0,-1.0
304,104,6144,2048,113,0,-1.0,a8w8_bpreshuffle_256x48x64x256_16x16_16x16_16x16x1_16x16x1_1x16x1x16_4x4x1_1x1_intrawave_v1,1.0,-1.0,-1.0
304,104,7168,256,75,0,-1.0,a8w8_bpreshuffle_128x16x256x64_16x16_16x16_4x16x1_4x32x1_1x16x1x8_8x8x1_1x2_intrawave_v1,1.0,-1.0,-1.0
304,104,7168,2048,119,0,10.6454,a8w8_bpreshuffle_256x32x128x256_16x16_16x16_16x16x1_16x16x1_1x16x1x16_8x8x1_1x2_intrawave_v1,286.83,1539.07,0.0
304,104,7168,2304,119,0,-1.0,a8w8_bpreshuffle_256x32x128x256_16x16_16x16_16x16x1_16x16x1_1x16x1x16_8x8x1_1x2_intrawave_v1,1.0,-1.0,-1.0
304,112,192,7168,10,0,-1.0,a8w8_bpreshuffle_128x16x32x512_16x16_16x16_32x4x1_32x4x1_1x16x1x8_4x4x1_1x1_intrawave_v1,1.0,-1.0,-1.0
304,112,512,7168,10,0,-1.0,a8w8_bpreshuffle_128x16x32x512_16x16_16x16_32x4x1_32x4x1_1x16x1x8_4x4x1_1x1_intrawave_v1,1.0,-1.0,-1.0
304,112,576,7168,10,0,9.1778,a8w8_bpreshuffle_128x16x32x512_16x16_16x16_32x4x1_32x4x1_1x16x1x8_4x4x1_1x1_intrawave_v1,100.77,551.4,0.0
304,112,896,5120,10,0,7.9336,a8w8_bpreshuffle_128x16x32x512_16x16_16x16_32x4x1_32x4x1_1x16x1x8_4x4x1_1x1_intrawave_v1,0.0,129.53,675.82
304,112,1024,5632,24,0,8.6823,a8w8_bpreshuffle_128x16x32x512_16x16_16x16_32x4x1_32x4x1_1x16x1x8_4x4x1_1x1_intrawave_v2,0.0,148.79,763.31
304,112,1056,1408,9,0,6.3545,a8w8_bpreshuffle_128x16x32x128_16x16_16x16_8x16x1_8x16x1_1x16x1x8_4x4x1_1x1_intrawave_v1,0.0,52.41,296.02
304,112,1280,4096,10,0,7.4297,a8w8_bpreshuffle_128x16x32x512_16x16_16x16_32x4x1_32x4x1_1x16x1x8_4x4x1_1x1_intrawave_v1,0.0,158.07,806.0
304,112,1408,352,0,0,-1.0,a8w8_bpreshuffle_256x128x128x128_16x16_16x16_8x32x1_8x32x1_1x32x1x8_8x8x1_2x1_intrawave_v3,1.0,-1.0,-1.0
304,112,1408,1408,9,0,-1.0,a8w8_bpreshuffle_128x16x32x128_16x16_16x16_8x16x1_8x16x1_1x16x1x8_4x4x1_1x1_intrawave_v1,1.0,-1.0,-1.0
304,112,1536,2048,11,0,-1.0,a8w8_bpreshuffle_256x16x64x512_16x16_16x16_32x8x1_32x8x1_1x16x1x16_4x4x1_1x1_intrawave_v1,1.0,-1.0,-1.0
304,112,1536,7168,11,0,11.6018,a8w8_bpreshuffle_256x16x64x512_16x16_16x16_32x8x1_32x8x1_1x16x1x16_4x4x1_1x1_intrawave_v1,212.57,1047.85,0.0
304,112,1792,6144,5,0,-1.0,a8w8_bpreshuffle_256x16x64x512_16x16_16x16_32x8x1_32x8x1_1x16x1x16_4x4x1_1x1_intrawave_v1,1.0,-1.0,-1.0
304,112,2048,1536,5,0,-1.0,a8w8_bpreshuffle_256x16x64x512_16x16_16x16_32x8x1_32x8x1_1x16x1x16_4x4x1_1x1_intrawave_v1,1.0,-1.0,-1.0
304,112,2048,6144,5,0,-1.0,a8w8_bpreshuffle_256x16x64x512_16x16_16x16_32x8x1_32x8x1_1x16x1x16_4x4x1_1x1_intrawave_v1,1.0,-1.0,-1.0
304,112,2112,7168,19,0,13.6363,a8w8_bpreshuffle_256x16x64x512_16x16_16x16_32x8x1_32x8x1_1x16x1x16_4x4x1_1x1_intrawave_v2,248.68,1203.75,0.0
304,112,3072,1536,15,0,6.7103,a8w8_bpreshuffle_256x16x64x256_16x16_16x16_16x16x1_16x16x1_1x16x1x16_4x4x1_1x1_intrawave_v1,157.51,831.37,0.0
304,112,3072,4096,12,0,-1.0,a8w8_bpreshuffle_256x32x64x512_16x16_16x16_32x8x1_32x8x1_1x32x1x8_8x8x1_1x2_intrawave_v1,1.0,-1.0,-1.0
304,112,3584,6144,12,0,-1.0,a8w8_bpreshuffle_256x32x64x512_16x16_16x16_32x8x1_32x8x1_1x32x1x8_8x8x1_1x2_intrawave_v1,1.0,-1.0,-1.0
304,112,4096,512,9,0,4.8278,a8w8_bpreshuffle_128x16x32x128_16x16_16x16_8x16x1_8x16x1_1x16x1x8_4x4x1_1x1_intrawave_v1,97.3,636.31,0.0
304,112,4096,640,23,0,5.5206,a8w8_bpreshuffle_128x16x32x128_16x16_16x16_8x16x1_8x16x1_1x16x1x8_4x4x1_1x1_intrawave_v2,0.0,106.37,654.03
304,112,4096,1024,108,0,-1.0,a8w8_bpreshuffle_256x16x64x256_16x16_16x16_16x16x1_16x16x1_1x16x1x16_4x4x1_1x1_intrawave_v1,1.0,-1.0,-1.0
304,112,4096,3072,12,0,-1.0,a8w8_bpreshuffle_256x32x64x512_16x16_16x16_32x8x1_32x8x1_1x32x1x8_8x8x1_1x2_intrawave_v1,1.0,-1.0,-1.0
304,112,4608,7168,12,0,22.3228,a8w8_bpreshuffle_256x32x64x512_16x16_16x16_32x8x1_32x8x1_1x32x1x8_8x8x1_1x2_intrawave_v1,331.44,1561.86,0.0
304,112,5120,640,23,0,5.7884,a8w8_bpreshuffle_128x16x32x128_16x16_16x16_8x16x1_8x16x1_1x16x1x8_4x4x1_1x1_intrawave_v2,0.0,126.81,776.62
304,112,5120,2048,119,0,9.7555,a8w8_bpreshuffle_256x32x128x256_16x16_16x16_16x16x1_16x16x1_1x16x1x16_8x8x1_1x2_intrawave_v1,0.0,240.77,1215.93
304,112,6144,768,119,0,-1.0,a8w8_bpreshuffle_256x32x128x256_16x16_16x16_16x16x1_16x16x1_1x16x1x16_8x8x1_1x2_intrawave_v1,1.0,-1.0,-1.0
304,112,6144,1024,119,0,-1.0,a8w8_bpreshuffle_256x32x128x256_16x16_16x16_16x16x1_16x16x1_1x16x1x16_8x8x1_1x2_intrawave_v1,1.0,-1.0,-1.0
304,112,6144,1536,119,0,-1.0,a8w8_bpreshuffle_256x32x128x256_16x16_16x16_16x16x1_16x16x1_1x16x1x16_8x8x1_1x2_intrawave_v1,1.0,-1.0,-1.0
304,112,6144,2048,119,0,-1.0,a8w8_bpreshuffle_256x32x128x256_16x16_16x16_16x16x1_16x16x1_1x16x1x16_8x8x1_1x2_intrawave_v1,1.0,-1.0,-1.0
304,112,7168,256,75,0,-1.0,a8w8_bpreshuffle_128x16x256x64_16x16_16x16_4x16x1_4x32x1_1x16x1x8_8x8x1_1x2_intrawave_v1,1.0,-1.0,-1.0
304,112,7168,2048,119,0,10.7949,a8w8_bpreshuffle_256x32x128x256_16x16_16x16_16x16x1_16x16x1_1x16x1x16_8x8x1_1x2_intrawave_v1,304.62,1529.9,0.0
304,112,7168,2304,119,0,-1.0,a8w8_bpreshuffle_256x32x128x256_16x16_16x16_16x16x1_16x16x1_1x16x1x16_8x8x1_1x2_intrawave_v1,1.0,-1.0,-1.0
304,120,192,7168,10,0,-1.0,a8w8_bpreshuffle_128x16x32x512_16x16_16x16_32x4x1_32x4x1_1x16x1x8_4x4x1_1x1_intrawave_v1,1.0,-1.0,-1.0
304,120,512,7168,11,0,-1.0,a8w8_bpreshuffle_256x16x64x512_16x16_16x16_32x8x1_32x8x1_1x16x1x16_4x4x1_1x1_intrawave_v1,1.0,-1.0,-1.0
304,120,576,7168,11,0,10.6104,a8w8_bpreshuffle_256x16x64x512_16x16_16x16_32x8x1_32x8x1_1x16x1x16_4x4x1_1x1_intrawave_v1,93.39,483.22,0.0
304,120,896,5120,11,0,-1.0,a8w8_bpreshuffle_256x16x64x512_16x16_16x16_32x8x1_32x8x1_1x16x1x16_4x4x1_1x1_intrawave_v1,1.0,-1.0,-1.0
304,120,1024,5632,10,0,-1.0,a8w8_bpreshuffle_128x16x32x512_16x16_16x16_32x4x1_32x4x1_1x16x1x8_4x4x1_1x1_intrawave_v1,1.0,-1.0,-1.0
304,120,1056,1408,23,0,-1.0,a8w8_bpreshuffle_128x16x32x128_16x16_16x16_8x16x1_8x16x1_1x16x1x8_4x4x1_1x1_intrawave_v2,1.0,-1.0,-1.0
304,120,1280,4096,11,0,-1.0,a8w8_bpreshuffle_256x16x64x512_16x16_16x16_32x8x1_32x8x1_1x16x1x16_4x4x1_1x1_intrawave_v1,1.0,-1.0,-1.0
304,120,1408,352,0,0,-1.0,a8w8_bpreshuffle_256x128x128x128_16x16_16x16_8x32x1_8x32x1_1x32x1x8_8x8x1_2x1_intrawave_v3,1.0,-1.0,-1.0
304,120,1408,1408,9,0,-1.0,a8w8_bpreshuffle_128x16x32x128_16x16_16x16_8x16x1_8x16x1_1x16x1x8_4x4x1_1x1_intrawave_v1,1.0,-1.0,-1.0
304,120,1536,2048,5,0,-1.0,a8w8_bpreshuffle_256x16x64x512_16x16_16x16_32x8x1_32x8x1_1x16x1x16_4x4x1_1x1_intrawave_v1,1.0,-1.0,-1.0
304,120,1536,7168,11,0,12.1775,a8w8_bpreshuffle_256x16x64x512_16x16_16x16_32x8x1_32x8x1_1x16x1x16_4x4x1_1x1_intrawave_v1,216.99,1005.04,0.0
304,120,1792,6144,5,0,-1.0,a8w8_bpreshuffle_256x16x64x512_16x16_16x16_32x8x1_32x8x1_1x16x1x16_4x4x1_1x1_intrawave_v1,1.0,-1.0,-1.0
304,120,2048,1536,5,0,-1.0,a8w8_bpreshuffle_256x16x64x512_16x16_16x16_32x8x1_32x8x1_1x16x1x16_4x4x1_1x1_intrawave_v1,1.0,-1.0,-1.0
304,120,2048,6144,5,0,-1.0,a8w8_bpreshuffle_256x16x64x512_16x16_16x16_32x8x1_32x8x1_1x16x1x16_4x4x1_1x1_intrawave_v1,1.0,-1.0,-1.0
304,120,2112,7168,5,0,15.0372,a8w8_bpreshuffle_256x16x64x512_16x16_16x16_32x8x1_32x8x1_1x16x1x16_4x4x1_1x1_intrawave_v1,241.62,1097.67,0.0
304,120,3072,1536,6,0,6.5823,a8w8_bpreshuffle_256x16x128x512_16x16_16x16_32x8x1_32x8x1_1x16x1x16_8x8x1_1x2_intrawave_v1,172.05,856.87,0.0
304,120,3072,4096,12,0,-1.0,a8w8_bpreshuffle_256x32x64x512_16x16_16x16_32x8x1_32x8x1_1x32x1x8_8x8x1_1x2_intrawave_v1,1.0,-1.0,-1.0
304,120,3584,6144,112,0,-1.0,a8w8_bpreshuffle_256x32x64x256_16x16_16x16_16x16x1_16x16x1_1x32x1x8_8x8x1_2x1_intrawave_v1,1.0,-1.0,-1.0
304,120,4096,512,9,0,4.5727,a8w8_bpreshuffle_128x16x32x128_16x16_16x16_8x16x1_8x16x1_1x16x1x8_4x4x1_1x1_intrawave_v1,110.07,687.04,0.0
304,120,4096,640,23,0,-1.0,a8w8_bpreshuffle_128x16x32x128_16x16_16x16_8x16x1_8x16x1_1x16x1x8_4x4x1_1x1_intrawave_v2,1.0,-1.0,-1.0
304,120,4096,1024,15,0,-1.0,a8w8_bpreshuffle_256x16x64x256_16x16_16x16_16x16x1_16x16x1_1x16x1x16_4x4x1_1x1_intrawave_v1,1.0,-1.0,-1.0
304,120,4096,3072,112,0,-1.0,a8w8_bpreshuffle_256x32x64x256_16x16_16x16_16x16x1_16x16x1_1x32x1x8_8x8x1_2x1_intrawave_v1,1.0,-1.0,-1.0
304,120,4608,7168,12,0,22.4782,a8w8_bpreshuffle_256x32x64x512_16x16_16x16_32x8x1_32x8x1_1x32x1x8_8x8x1_1x2_intrawave_v1,352.66,1556.9,0.0
304,120,5120,640,9,0,-1.0,a8w8_bpreshuffle_128x16x32x128_16x16_16x16_8x16x1_8x16x1_1x16x1x8_4x4x1_1x1_intrawave_v1,1.0,-1.0,-1.0
304,120,5120,2048,119,0,-1.0,a8w8_bpreshuffle_256x32x128x256_16x16_16x16_16x16x1_16x16x1_1x16x1x16_8x8x1_1x2_intrawave_v1,1.0,-1.0,-1.0
304,120,6144,768,119,0,-1.0,a8w8_bpreshuffle_256x32x128x256_16x16_16x16_16x16x1_16x16x1_1x16x1x16_8x8x1_1x2_intrawave_v1,1.0,-1.0,-1.0
304,120,6144,1024,119,0,-1.0,a8w8_bpreshuffle_256x32x128x256_16x16_16x16_16x16x1_16x16x1_1x16x1x16_8x8x1_1x2_intrawave_v1,1.0,-1.0,-1.0
304,120,6144,1536,119,0,-1.0,a8w8_bpreshuffle_256x32x128x256_16x16_16x16_16x16x1_16x16x1_1x16x1x16_8x8x1_1x2_intrawave_v1,1.0,-1.0,-1.0
304,120,6144,2048,119,0,-1.0,a8w8_bpreshuffle_256x32x128x256_16x16_16x16_16x16x1_16x16x1_1x16x1x16_8x8x1_1x2_intrawave_v1,1.0,-1.0,-1.0
304,120,7168,256,75,0,-1.0,a8w8_bpreshuffle_128x16x256x64_16x16_16x16_4x16x1_4x32x1_1x16x1x8_8x8x1_1x2_intrawave_v1,1.0,-1.0,-1.0
304,120,7168,2048,119,0,10.9617,a8w8_bpreshuffle_256x32x128x256_16x16_16x16_16x16x1_16x16x1_1x16x1x16_8x8x1_1x2_intrawave_v1,321.41,1518.57,0.0
304,120,7168,2304,119,0,-1.0,a8w8_bpreshuffle_256x32x128x256_16x16_16x16_16x16x1_16x16x1_1x16x1x16_8x8x1_1x2_intrawave_v1,1.0,-1.0,-1.0
304,128,192,7168,10,0,-1.0,a8w8_bpreshuffle_128x16x32x512_16x16_16x16_32x4x1_32x4x1_1x16x1x8_4x4x1_1x1_intrawave_v1,1.0,-1.0,-1.0
304,128,512,7168,10,0,-1.0,a8w8_bpreshuffle_128x16x32x512_16x16_16x16_32x4x1_32x4x1_1x16x1x8_4x4x1_1x1_intrawave_v1,1.0,-1.0,-1.0
304,128,576,7168,10,0,9.2091,a8w8_bpreshuffle_128x16x32x512_16x16_16x16_32x4x1_32x4x1_1x16x1x8_4x4x1_1x1_intrawave_v1,114.77,563.98,0.0
304,128,896,5120,10,0,-1.0,a8w8_bpreshuffle_128x16x32x512_16x16_16x16_32x4x1_32x4x1_1x16x1x8_4x4x1_1x1_intrawave_v1,1.0,-1.0,-1.0
304,128,1024,5632,10,0,-1.0,a8w8_bpreshuffle_128x16x32x512_16x16_16x16_32x4x1_32x4x1_1x16x1x8_4x4x1_1x1_intrawave_v1,1.0,-1.0,-1.0
304,128,1056,1408,9,0,-1.0,a8w8_bpreshuffle_128x16x32x128_16x16_16x16_8x16x1_8x16x1_1x16x1x8_4x4x1_1x1_intrawave_v1,1.0,-1.0,-1.0
304,128,1280,4096,11,0,-1.0,a8w8_bpreshuffle_256x16x64x512_16x16_16x16_32x8x1_32x8x1_1x16x1x16_4x4x1_1x1_intrawave_v1,1.0,-1.0,-1.0
304,128,1408,352,0,0,-1.0,a8w8_bpreshuffle_256x128x128x128_16x16_16x16_8x32x1_8x32x1_1x32x1x8_8x8x1_2x1_intrawave_v3,1.0,-1.0,-1.0
304,128,1408,1408,9,0,-1.0,a8w8_bpreshuffle_128x16x32x128_16x16_16x16_8x16x1_8x16x1_1x16x1x8_4x4x1_1x1_intrawave_v1,1.0,-1.0,-1.0
304,128,1536,2048,11,0,-1.0,a8w8_bpreshuffle_256x16x64x512_16x16_16x16_32x8x1_32x8x1_1x16x1x16_4x4x1_1x1_intrawave_v1,1.0,-1.0,-1.0
304,128,1536,7168,5,0,11.5653,a8w8_bpreshuffle_256x16x64x512_16x16_16x16_32x8x1_32x8x1_1x16x1x16_4x4x1_1x1_intrawave_v1,243.71,1065.32,0.0
304,128,1792,6144,5,0,-1.0,a8w8_bpreshuffle_256x16x64x512_16x16_16x16_32x8x1_32x8x1_1x16x1x16_4x4x1_1x1_intrawave_v1,1.0,-1.0,-1.0
304,128,2048,1536,11,0,-1.0,a8w8_bpreshuffle_256x16x64x512_16x16_16x16_32x8x1_32x8x1_1x16x1x16_4x4x1_1x1_intrawave_v1,1.0,-1.0,-1.0
304,128,2048,6144,11,0,-1.0,a8w8_bpreshuffle_256x16x64x512_16x16_16x16_32x8x1_32x8x1_1x16x1x16_4x4x1_1x1_intrawave_v1,1.0,-1.0,-1.0
304,128,2112,7168,11,0,14.1126,a8w8_bpreshuffle_256x16x64x512_16x16_16x16_32x8x1_32x8x1_1x16x1x16_4x4x1_1x1_intrawave_v1,274.62,1176.04,0.0
304,128,3072,1536,109,0,6.8601,a8w8_bpreshuffle_256x16x128x256_16x16_16x16_16x16x1_16x16x1_1x16x1x16_8x8x1_1x2_intrawave_v1,176.08,831.13,0.0
304,128,3072,4096,112,0,-1.0,a8w8_bpreshuffle_256x32x64x256_16x16_16x16_16x16x1_16x16x1_1x32x1x8_8x8x1_2x1_intrawave_v1,1.0,-1.0,-1.0
304,128,3584,6144,12,0,-1.0,a8w8_bpreshuffle_256x32x64x512_16x16_16x16_32x8x1_32x8x1_1x32x1x8_8x8x1_1x2_intrawave_v1,1.0,-1.0,-1.0
304,128,4096,512,9,0,4.8486,a8w8_bpreshuffle_128x16x32x128_16x16_16x16_8x16x1_8x16x1_1x16x1x8_4x4x1_1x1_intrawave_v1,110.73,662.31,0.0
304,128,4096,640,9,0,-1.0,a8w8_bpreshuffle_128x16x32x128_16x16_16x16_8x16x1_8x16x1_1x16x1x8_4x4x1_1x1_intrawave_v1,1.0,-1.0,-1.0
304,128,4096,1024,15,0,-1.0,a8w8_bpreshuffle_256x16x64x256_16x16_16x16_16x16x1_16x16x1_1x16x1x16_4x4x1_1x1_intrawave_v1,1.0,-1.0,-1.0
304,128,4096,3072,112,0,-1.0,a8w8_bpreshuffle_256x32x64x256_16x16_16x16_16x16x1_16x16x1_1x32x1x8_8x8x1_2x1_intrawave_v1,1.0,-1.0,-1.0
304,128,4608,7168,112,0,22.0843,a8w8_bpreshuffle_256x32x64x256_16x16_16x16_16x16x1_16x16x1_1x32x1x8_8x8x1_2x1_intrawave_v1,382.88,1590.6,0.0
304,128,5120,640,9,0,-1.0,a8w8_bpreshuffle_128x16x32x128_16x16_16x16_8x16x1_8x16x1_1x16x1x8_4x4x1_1x1_intrawave_v1,1.0,-1.0,-1.0
304,128,5120,2048,119,0,-1.0,a8w8_bpreshuffle_256x32x128x256_16x16_16x16_16x16x1_16x16x1_1x16x1x16_8x8x1_1x2_intrawave_v1,1.0,-1.0,-1.0
304,128,6144,768,119,0,-1.0,a8w8_bpreshuffle_256x32x128x256_16x16_16x16_16x16x1_16x16x1_1x16x1x16_8x8x1_1x2_intrawave_v1,1.0,-1.0,-1.0
304,128,6144,1024,119,0,-1.0,a8w8_bpreshuffle_256x32x128x256_16x16_16x16_16x16x1_16x16x1_1x16x1x16_8x8x1_1x2_intrawave_v1,1.0,-1.0,-1.0
304,128,6144,1536,119,0,-1.0,a8w8_bpreshuffle_256x32x128x256_16x16_16x16_16x16x1_16x16x1_1x16x1x16_8x8x1_1x2_intrawave_v1,1.0,-1.0,-1.0
304,128,6144,2048,119,0,-1.0,a8w8_bpreshuffle_256x32x128x256_16x16_16x16_16x16x1_16x16x1_1x16x1x16_8x8x1_1x2_intrawave_v1,1.0,-1.0,-1.0
304,128,7168,256,75,0,-1.0,a8w8_bpreshuffle_128x16x256x64_16x16_16x16_4x16x1_4x32x1_1x16x1x8_8x8x1_1x2_intrawave_v1,1.0,-1.0,-1.0
304,128,7168,2048,119,0,10.9032,a8w8_bpreshuffle_256x32x128x256_16x16_16x16_16x16x1_16x16x1_1x16x1x16_8x8x1_1x2_intrawave_v1,344.68,1538.74,0.0
304,128,7168,2304,119,0,-1.0,a8w8_bpreshuffle_256x32x128x256_16x16_16x16_16x16x1_16x16x1_1x16x1x16_8x8x1_1x2_intrawave_v1,1.0,-1.0,-1.0
304,136,192,7168,10,0,-1.0,a8w8_bpreshuffle_128x16x32x512_16x16_16x16_32x4x1_32x4x1_1x16x1x8_4x4x1_1x1_intrawave_v1,1.0,-1.0,-1.0
304,136,512,7168,11,0,-1.0,a8w8_bpreshuffle_256x16x64x512_16x16_16x16_32x8x1_32x8x1_1x16x1x16_4x4x1_1x1_intrawave_v1,1.0,-1.0,-1.0
304,136,576,7168,11,0,10.5618,a8w8_bpreshuffle_256x16x64x512_16x16_16x16_32x8x1_32x8x1_1x16x1x16_4x4x1_1x1_intrawave_v1,106.33,498.05,0.0
304,136,896,5120,11,0,-1.0,a8w8_bpreshuffle_256x16x64x512_16x16_16x16_32x8x1_32x8x1_1x16x1x16_4x4x1_1x1_intrawave_v1,1.0,-1.0,-1.0
304,136,1024,5632,25,0,-1.0,a8w8_bpreshuffle_256x16x64x512_16x16_16x16_32x8x1_32x8x1_1x16x1x16_4x4x1_1x1_intrawave_v2,1.0,-1.0,-1.0
304,136,1056,1408,23,0,-1.0,a8w8_bpreshuffle_128x16x32x128_16x16_16x16_8x16x1_8x16x1_1x16x1x8_4x4x1_1x1_intrawave_v2,1.0,-1.0,-1.0
304,136,1280,4096,11,0,-1.0,a8w8_bpreshuffle_256x16x64x512_16x16_16x16_32x8x1_32x8x1_1x16x1x16_4x4x1_1x1_intrawave_v1,1.0,-1.0,-1.0
304,136,1408,352,0,0,-1.0,a8w8_bpreshuffle_256x128x128x128_16x16_16x16_8x32x1_8x32x1_1x32x1x8_8x8x1_2x1_intrawave_v3,1.0,-1.0,-1.0
304,136,1408,1408,9,0,-1.0,a8w8_bpreshuffle_128x16x32x128_16x16_16x16_8x16x1_8x16x1_1x16x1x8_4x4x1_1x1_intrawave_v1,1.0,-1.0,-1.0
304,136,1536,2048,5,0,-1.0,a8w8_bpreshuffle_256x16x64x512_16x16_16x16_32x8x1_32x8x1_1x16x1x16_4x4x1_1x1_intrawave_v1,1.0,-1.0,-1.0
304,136,1536,7168,11,0,14.8155,a8w8_bpreshuffle_256x16x64x512_16x16_16x16_32x8x1_32x8x1_1x16x1x16_4x4x1_1x1_intrawave_v1,202.14,837.14,0.0
304,136,1792,6144,12,0,-1.0,a8w8_bpreshuffle_256x32x64x512_16x16_16x16_32x8x1_32x8x1_1x32x1x8_8x8x1_1x2_intrawave_v1,1.0,-1.0,-1.0
304,136,2048,1536,15,0,-1.0,a8w8_bpreshuffle_256x16x64x256_16x16_16x16_16x16x1_16x16x1_1x16x1x16_4x4x1_1x1_intrawave_v1,1.0,-1.0,-1.0
304,136,2048,6144,12,0,-1.0,a8w8_bpreshuffle_256x32x64x512_16x16_16x16_32x8x1_32x8x1_1x32x1x8_8x8x1_1x2_intrawave_v1,1.0,-1.0,-1.0
304,136,2112,7168,12,0,17.4245,a8w8_bpreshuffle_256x32x64x512_16x16_16x16_32x8x1_32x8x1_1x32x1x8_8x8x1_1x2_intrawave_v1,236.32,957.74,0.0
304,136,3072,1536,112,0,7.1369,a8w8_bpreshuffle_256x32x64x256_16x16_16x16_16x16x1_16x16x1_1x32x1x8_8x8x1_2x1_intrawave_v1,179.83,807.5,0.0
304,136,3072,4096,113,0,-1.0,a8w8_bpreshuffle_256x48x64x256_16x16_16x16_16x16x1_16x16x1_1x16x1x16_4x4x1_1x1_intrawave_v1,1.0,-1.0,-1.0
304,136,3584,6144,113,0,-1.0,a8w8_bpreshuffle_256x48x64x256_16x16_16x16_16x16x1_16x16x1_1x16x1x16_4x4x1_1x1_intrawave_v1,1.0,-1.0,-1.0
304,136,4096,512,9,0,5.1074,a8w8_bpreshuffle_128x16x32x128_16x16_16x16_8x16x1_8x16x1_1x16x1x8_4x4x1_1x1_intrawave_v1,111.69,642.38,0.0
304,136,4096,640,9,0,-1.0,a8w8_bpreshuffle_128x16x32x128_16x16_16x16_8x16x1_8x16x1_1x16x1x8_4x4x1_1x1_intrawave_v1,1.0,-1.0,-1.0
304,136,4096,1024,113,0,-1.0,a8w8_bpreshuffle_256x48x64x256_16x16_16x16_16x16x1_16x16x1_1x16x1x16_4x4x1_1x1_intrawave_v1,1.0,-1.0,-1.0
304,136,4096,3072,113,0,-1.0,a8w8_bpreshuffle_256x48x64x256_16x16_16x16_16x16x1_16x16x1_1x16x1x16_4x4x1_1x1_intrawave_v1,1.0,-1.0,-1.0
304,136,4608,7168,113,0,24.4716,a8w8_bpreshuffle_256x48x64x256_16x16_16x16_16x16x1_16x16x1_1x16x1x16_4x4x1_1x1_intrawave_v1,367.13,1440.79,0.0
304,136,5120,640,76,0,-1.0,a8w8_bpreshuffle_256x32x64x128_16x16_16x16_8x32x1_8x32x1_1x32x1x8_8x8x1_2x1_intrawave_v1,1.0,-1.0,-1.0
304,136,5120,2048,113,0,-1.0,a8w8_bpreshuffle_256x48x64x256_16x16_16x16_16x16x1_16x16x1_1x16x1x16_4x4x1_1x1_intrawave_v1,1.0,-1.0,-1.0
304,136,6144,768,113,0,-1.0,a8w8_bpreshuffle_256x48x64x256_16x16_16x16_16x16x1_16x16x1_1x16x1x16_4x4x1_1x1_intrawave_v1,1.0,-1.0,-1.0
304,136,6144,1024,113,0,-1.0,a8w8_bpreshuffle_256x48x64x256_16x16_16x16_16x16x1_16x16x1_1x16x1x16_4x4x1_1x1_intrawave_v1,1.0,-1.0,-1.0
304,136,6144,1536,113,0,-1.0,a8w8_bpreshuffle_256x48x64x256_16x16_16x16_16x16x1_16x16x1_1x16x1x16_4x4x1_1x1_intrawave_v1,1.0,-1.0,-1.0
304,136,6144,2048,113,0,-1.0,a8w8_bpreshuffle_256x48x64x256_16x16_16x16_16x16x1_16x16x1_1x16x1x16_4x4x1_1x1_intrawave_v1,1.0,-1.0,-1.0
304,136,7168,256,75,0,-1.0,a8w8_bpreshuffle_128x16x256x64_16x16_16x16_4x16x1_4x32x1_1x16x1x8_8x8x1_1x2_intrawave_v1,1.0,-1.0,-1.0
304,136,7168,2048,120,0,11.7967,a8w8_bpreshuffle_256x48x128x256_16x16_16x16_16x16x1_16x16x1_1x16x1x16_8x8x1_1x2_intrawave_v1,338.48,1433.31,0.0
304,136,7168,2304,120,0,-1.0,a8w8_bpreshuffle_256x48x128x256_16x16_16x16_16x16x1_16x16x1_1x16x1x16_8x8x1_1x2_intrawave_v1,1.0,-1.0,-1.0
304,144,192,7168,10,0,-1.0,a8w8_bpreshuffle_128x16x32x512_16x16_16x16_32x4x1_32x4x1_1x16x1x8_4x4x1_1x1_intrawave_v1,1.0,-1.0,-1.0
304,144,512,7168,10,0,-1.0,a8w8_bpreshuffle_128x16x32x512_16x16_16x16_32x4x1_32x4x1_1x16x1x8_4x4x1_1x1_intrawave_v1,1.0,-1.0,-1.0
304,144,576,7168,10,0,10.1466,a8w8_bpreshuffle_128x16x32x512_16x16_16x16_32x4x1_32x4x1_1x16x1x8_4x4x1_1x1_intrawave_v1,117.19,524.99,0.0
304,144,896,5120,5,0,8.704,a8w8_bpreshuffle_256x16x64x512_16x16_16x16_32x8x1_32x8x1_1x16x1x16_4x4x1_1x1_intrawave_v1,0.0,151.79,641.41
304,144,1024,5632,11,0,9.9445,a8w8_bpreshuffle_256x16x64x512_16x16_16x16_32x8x1_32x8x1_1x16x1x16_4x4x1_1x1_intrawave_v1,0.0,167.02,691.14
304,144,1056,1408,23,0,6.413,a8w8_bpreshuffle_128x16x32x128_16x16_16x16_8x16x1_8x16x1_1x16x1x8_4x4x1_1x1_intrawave_v2,0.0,66.77,310.89
304,144,1280,4096,11,0,9.0034,a8w8_bpreshuffle_256x16x64x512_16x16_16x16_32x8x1_32x8x1_1x16x1x16_4x4x1_1x1_intrawave_v1,0.0,167.71,688.78
304,144,1408,352,0,0,-1.0,a8w8_bpreshuffle_256x128x128x128_16x16_16x16_8x32x1_8x32x1_1x32x1x8_8x8x1_2x1_intrawave_v3,1.0,-1.0,-1.0
304,144,1408,1408,9,0,-1.0,a8w8_bpreshuffle_128x16x32x128_16x16_16x16_8x16x1_8x16x1_1x16x1x8_4x4x1_1x1_intrawave_v1,1.0,-1.0,-1.0
304,144,1536,2048,5,0,-1.0,a8w8_bpreshuffle_256x16x64x512_16x16_16x16_32x8x1_32x8x1_1x16x1x16_4x4x1_1x1_intrawave_v1,1.0,-1.0,-1.0
304,144,1536,7168,26,0,15.6121,a8w8_bpreshuffle_256x32x64x512_16x16_16x16_32x8x1_32x8x1_1x32x1x8_8x8x1_1x2_intrawave_v2,203.1,799.68,0.0
304,144,1792,6144,12,0,-1.0,a8w8_bpreshuffle_256x32x64x512_16x16_16x16_32x8x1_32x8x1_1x32x1x8_8x8x1_1x2_intrawave_v1,1.0,-1.0,-1.0
304,144,2048,1536,15,0,-1.0,a8w8_bpreshuffle_256x16x64x256_16x16_16x16_16x16x1_16x16x1_1x16x1x16_4x4x1_1x1_intrawave_v1,1.0,-1.0,-1.0
304,144,2048,6144,113,0,-1.0,a8w8_bpreshuffle_256x48x64x256_16x16_16x16_16x16x1_16x16x1_1x16x1x16_4x4x1_1x1_intrawave_v1,1.0,-1.0,-1.0
304,144,2112,7168,113,0,17.3313,a8w8_bpreshuffle_256x48x64x256_16x16_16x16_16x16x1_16x16x1_1x16x1x16_4x4x1_1x1_intrawave_v1,251.57,968.15,0.0
304,144,3072,1536,112,0,7.5019,a8w8_bpreshuffle_256x32x64x256_16x16_16x16_16x16x1_16x16x1_1x32x1x8_8x8x1_2x1_intrawave_v1,181.15,776.4,0.0
304,144,3072,4096,113,0,-1.0,a8w8_bpreshuffle_256x48x64x256_16x16_16x16_16x16x1_16x16x1_1x16x1x16_4x4x1_1x1_intrawave_v1,1.0,-1.0,-1.0
304,144,3584,6144,113,0,-1.0,a8w8_bpreshuffle_256x48x64x256_16x16_16x16_16x16x1_16x16x1_1x16x1x16_4x4x1_1x1_intrawave_v1,1.0,-1.0,-1.0
304,144,4096,512,9,0,4.7903,a8w8_bpreshuffle_128x16x32x128_16x16_16x16_8x16x1_8x16x1_1x16x1x8_4x4x1_1x1_intrawave_v1,126.08,699.44,0.0
304,144,4096,640,9,0,5.5706,a8w8_bpreshuffle_128x16x32x128_16x16_16x16_8x16x1_8x16x1_1x16x1x8_4x4x1_1x1_intrawave_v1,0.0,135.53,698.89
304,144,4096,1024,113,0,-1.0,a8w8_bpreshuffle_256x48x64x256_16x16_16x16_16x16x1_16x16x1_1x16x1x16_4x4x1_1x1_intrawave_v1,1.0,-1.0,-1.0
304,144,4096,3072,113,0,-1.0,a8w8_bpreshuffle_256x48x64x256_16x16_16x16_16x16x1_16x16x1_1x16x1x16_4x4x1_1x1_intrawave_v1,1.0,-1.0,-1.0
304,144,4608,7168,113,0,23.338,a8w8_bpreshuffle_256x48x64x256_16x16_16x16_16x16x1_16x16x1_1x16x1x16_4x4x1_1x1_intrawave_v1,407.6,1516.39,0.0
304,144,5120,640,76,0,6.2421,a8w8_bpreshuffle_256x32x64x128_16x16_16x16_8x32x1_8x32x1_1x32x1x8_8x8x1_2x1_intrawave_v1,0.0,151.19,775.94
304,144,5120,2048,113,0,9.996,a8w8_bpreshuffle_256x48x64x256_16x16_16x16_16x16x1_16x16x1_1x16x1x16_4x4x1_1x1_intrawave_v1,0.0,302.11,1226.01
304,144,6144,768,120,0,-1.0,a8w8_bpreshuffle_256x48x128x256_16x16_16x16_16x16x1_16x16x1_1x16x1x16_8x8x1_1x2_intrawave_v1,1.0,-1.0,-1.0
304,144,6144,1024,113,0,-1.0,a8w8_bpreshuffle_256x48x64x256_16x16_16x16_16x16x1_16x16x1_1x16x1x16_4x4x1_1x1_intrawave_v1,1.0,-1.0,-1.0
304,144,6144,1536,113,0,-1.0,a8w8_bpreshuffle_256x48x64x256_16x16_16x16_16x16x1_16x16x1_1x16x1x16_4x4x1_1x1_intrawave_v1,1.0,-1.0,-1.0
304,144,6144,2048,113,0,-1.0,a8w8_bpreshuffle_256x48x64x256_16x16_16x16_16x16x1_16x16x1_1x16x1x16_4x4x1_1x1_intrawave_v1,1.0,-1.0,-1.0
304,144,7168,256,75,0,-1.0,a8w8_bpreshuffle_128x16x256x64_16x16_16x16_4x16x1_4x32x1_1x16x1x8_8x8x1_1x2_intrawave_v1,1.0,-1.0,-1.0
304,144,7168,2048,120,0,11.8686,a8w8_bpreshuffle_256x48x128x256_16x16_16x16_16x16x1_16x16x1_1x16x1x16_8x8x1_1x2_intrawave_v1,356.22,1435.67,0.0
304,144,7168,2304,120,0,-1.0,a8w8_bpreshuffle_256x48x128x256_16x16_16x16_16x16x1_16x16x1_1x16x1x16_8x8x1_1x2_intrawave_v1,1.0,-1.0,-1.0
304,152,192,7168,10,0,-1.0,a8w8_bpreshuffle_128x16x32x512_16x16_16x16_32x4x1_32x4x1_1x16x1x8_4x4x1_1x1_intrawave_v1,1.0,-1.0,-1.0
304,152,512,7168,5,0,-1.0,a8w8_bpreshuffle_256x16x64x512_16x16_16x16_32x8x1_32x8x1_1x16x1x16_4x4x1_1x1_intrawave_v1,1.0,-1.0,-1.0
304,152,576,7168,11,0,10.3853,a8w8_bpreshuffle_256x16x64x512_16x16_16x16_32x8x1_32x8x1_1x16x1x16_4x4x1_1x1_intrawave_v1,120.86,519.33,0.0
304,152,896,5120,11,0,-1.0,a8w8_bpreshuffle_256x16x64x512_16x16_16x16_32x8x1_32x8x1_1x16x1x16_4x4x1_1x1_intrawave_v1,1.0,-1.0,-1.0
304,152,1024,5632,11,0,-1.0,a8w8_bpreshuffle_256x16x64x512_16x16_16x16_32x8x1_32x8x1_1x16x1x16_4x4x1_1x1_intrawave_v1,1.0,-1.0,-1.0
304,152,1056,1408,9,0,-1.0,a8w8_bpreshuffle_128x16x32x128_16x16_16x16_8x16x1_8x16x1_1x16x1x8_4x4x1_1x1_intrawave_v1,1.0,-1.0,-1.0
304,152,1280,4096,11,0,-1.0,a8w8_bpreshuffle_256x16x64x512_16x16_16x16_32x8x1_32x8x1_1x16x1x16_4x4x1_1x1_intrawave_v1,1.0,-1.0,-1.0
304,152,1408,352,0,0,-1.0,a8w8_bpreshuffle_256x128x128x128_16x16_16x16_8x32x1_8x32x1_1x32x1x8_8x8x1_2x1_intrawave_v3,1.0,-1.0,-1.0
304,152,1408,1408,9,0,-1.0,a8w8_bpreshuffle_128x16x32x128_16x16_16x16_8x16x1_8x16x1_1x16x1x8_4x4x1_1x1_intrawave_v1,1.0,-1.0,-1.0
304,152,1536,2048,11,0,-1.0,a8w8_bpreshuffle_256x16x64x512_16x16_16x16_32x8x1_32x8x1_1x16x1x16_4x4x1_1x1_intrawave_v1,1.0,-1.0,-1.0
304,152,1536,7168,25,0,14.4813,a8w8_bpreshuffle_256x16x64x512_16x16_16x16_32x8x1_32x8x1_1x16x1x16_4x4x1_1x1_intrawave_v2,231.13,867.78,0.0
304,152,1792,6144,5,0,-1.0,a8w8_bpreshuffle_256x16x64x512_16x16_16x16_32x8x1_32x8x1_1x16x1x16_4x4x1_1x1_intrawave_v1,1.0,-1.0,-1.0
304,152,2048,1536,108,0,-1.0,a8w8_bpreshuffle_256x16x64x256_16x16_16x16_16x16x1_16x16x1_1x16x1x16_4x4x1_1x1_intrawave_v1,1.0,-1.0,-1.0
304,152,2048,6144,16,0,-1.0,a8w8_bpreshuffle_256x16x128x256_16x16_16x16_16x16x1_16x16x1_1x16x1x16_8x8x1_1x2_intrawave_v1,1.0,-1.0,-1.0
304,152,2112,7168,12,0,17.4902,a8w8_bpreshuffle_256x32x64x512_16x16_16x16_32x8x1_32x8x1_1x32x1x8_8x8x1_1x2_intrawave_v1,263.13,964.56,0.0
304,152,3072,1536,113,0,7.7967,a8w8_bpreshuffle_256x48x64x256_16x16_16x16_16x16x1_16x16x1_1x16x1x16_4x4x1_1x1_intrawave_v1,183.98,754.93,0.0
304,152,3072,4096,113,0,-1.0,a8w8_bpreshuffle_256x48x64x256_16x16_16x16_16x16x1_16x16x1_1x16x1x16_4x4x1_1x1_intrawave_v1,1.0,-1.0,-1.0
304,152,3584,6144,114,0,-1.0,a8w8_bpreshuffle_256x64x64x256_16x16_16x16_16x16x1_16x16x1_1x32x1x8_8x8x1_2x1_intrawave_v3,1.0,-1.0,-1.0
304,152,4096,512,9,0,5.2513,a8w8_bpreshuffle_128x16x32x128_16x16_16x16_8x16x1_8x16x1_1x16x1x8_4x4x1_1x1_intrawave_v1,121.41,651.3,0.0
304,152,4096,640,9,0,-1.0,a8w8_bpreshuffle_128x16x32x128_16x16_16x16_8x16x1_8x16x1_1x16x1x8_4x4x1_1x1_intrawave_v1,1.0,-1.0,-1.0
304,152,4096,1024,114,0,-1.0,a8w8_bpreshuffle_256x64x64x256_16x16_16x16_16x16x1_16x16x1_1x32x1x8_8x8x1_2x1_intrawave_v3,1.0,-1.0,-1.0
304,152,4096,3072,114,0,-1.0,a8w8_bpreshuffle_256x64x64x256_16x16_16x16_16x16x1_16x16x1_1x32x1x8_8x8x1_2x1_intrawave_v3,1.0,-1.0,-1.0
304,152,4608,7168,114,0,26.4615,a8w8_bpreshuffle_256x64x64x256_16x16_16x16_16x16x1_16x16x1_1x32x1x8_8x8x1_2x1_intrawave_v3,379.46,1342.35,0.0
304,152,5120,640,76,0,-1.0,a8w8_bpreshuffle_256x32x64x128_16x16_16x16_8x32x1_8x32x1_1x32x1x8_8x8x1_2x1_intrawave_v1,1.0,-1.0,-1.0
304,152,5120,2048,114,0,-1.0,a8w8_bpreshuffle_256x64x64x256_16x16_16x16_16x16x1_16x16x1_1x32x1x8_8x8x1_2x1_intrawave_v3,1.0,-1.0,-1.0
304,152,6144,768,120,0,-1.0,a8w8_bpreshuffle_256x48x128x256_16x16_16x16_16x16x1_16x16x1_1x16x1x16_8x8x1_1x2_intrawave_v1,1.0,-1.0,-1.0
304,152,6144,1024,120,0,-1.0,a8w8_bpreshuffle_256x48x128x256_16x16_16x16_16x16x1_16x16x1_1x16x1x16_8x8x1_1x2_intrawave_v1,1.0,-1.0,-1.0
304,152,6144,1536,114,0,-1.0,a8w8_bpreshuffle_256x64x64x256_16x16_16x16_16x16x1_16x16x1_1x32x1x8_8x8x1_2x1_intrawave_v3,1.0,-1.0,-1.0
304,152,6144,2048,114,0,-1.0,a8w8_bpreshuffle_256x64x64x256_16x16_16x16_16x16x1_16x16x1_1x32x1x8_8x8x1_2x1_intrawave_v3,1.0,-1.0,-1.0
304,152,7168,256,75,0,-1.0,a8w8_bpreshuffle_128x16x256x64_16x16_16x16_4x16x1_4x32x1_1x16x1x8_8x8x1_1x2_intrawave_v1,1.0,-1.0,-1.0
304,152,7168,2048,120,0,13.2794,a8w8_bpreshuffle_256x48x128x256_16x16_16x16_16x16x1_16x16x1_1x16x1x16_8x8x1_1x2_intrawave_v1,336.06,1293.01,0.0
304,152,7168,2304,120,0,-1.0,a8w8_bpreshuffle_256x48x128x256_16x16_16x16_16x16x1_16x16x1_1x16x1x16_8x8x1_1x2_intrawave_v1,1.0,-1.0,-1.0
304,160,192,7168,10,0,-1.0,a8w8_bpreshuffle_128x16x32x512_16x16_16x16_32x4x1_32x4x1_1x16x1x8_4x4x1_1x1_intrawave_v1,1.0,-1.0,-1.0
304,160,512,7168,10,0,-1.0,a8w8_bpreshuffle_128x16x32x512_16x16_16x16_32x4x1_32x4x1_1x16x1x8_4x4x1_1x1_intrawave_v1,1.0,-1.0,-1.0
304,160,576,7168,10,0,9.3108,a8w8_bpreshuffle_128x16x32x512_16x16_16x16_32x4x1_32x4x1_1x16x1x8_4x4x1_1x1_intrawave_v1,141.9,586.41,0.0
304,160,896,5120,5,0,-1.0,a8w8_bpreshuffle_256x16x64x512_16x16_16x16_32x8x1_32x8x1_1x16x1x16_4x4x1_1x1_intrawave_v1,1.0,-1.0,-1.0
304,160,1024,5632,5,0,-1.0,a8w8_bpreshuffle_256x16x64x512_16x16_16x16_32x8x1_32x8x1_1x16x1x16_4x4x1_1x1_intrawave_v1,1.0,-1.0,-1.0
304,160,1056,1408,23,0,-1.0,a8w8_bpreshuffle_128x16x32x128_16x16_16x16_8x16x1_8x16x1_1x16x1x8_4x4x1_1x1_intrawave_v2,1.0,-1.0,-1.0
304,160,1280,4096,11,0,-1.0,a8w8_bpreshuffle_256x16x64x512_16x16_16x16_32x8x1_32x8x1_1x16x1x16_4x4x1_1x1_intrawave_v1,1.0,-1.0,-1.0
304,160,1408,352,0,0,-1.0,a8w8_bpreshuffle_256x128x128x128_16x16_16x16_8x32x1_8x32x1_1x32x1x8_8x8x1_2x1_intrawave_v3,1.0,-1.0,-1.0
304,160,1408,1408,9,0,-1.0,a8w8_bpreshuffle_128x16x32x128_16x16_16x16_8x16x1_8x16x1_1x16x1x8_4x4x1_1x1_intrawave_v1,1.0,-1.0,-1.0
304,160,1536,2048,5,0,-1.0,a8w8_bpreshuffle_256x16x64x512_16x16_16x16_32x8x1_32x8x1_1x16x1x16_4x4x1_1x1_intrawave_v1,1.0,-1.0,-1.0
304,160,1536,7168,5,0,14.2321,a8w8_bpreshuffle_256x16x64x512_16x16_16x16_32x8x1_32x8x1_1x16x1x16_4x4x1_1x1_intrawave_v1,247.55,888.73,0.0
304,160,1792,6144,10,0,-1.0,a8w8_bpreshuffle_128x16x32x512_16x16_16x16_32x4x1_32x4x1_1x16x1x8_4x4x1_1x1_intrawave_v1,1.0,-1.0,-1.0
304,160,2048,1536,15,0,-1.0,a8w8_bpreshuffle_256x16x64x256_16x16_16x16_16x16x1_16x16x1_1x16x1x16_4x4x1_1x1_intrawave_v1,1.0,-1.0,-1.0
304,160,2048,6144,12,0,-1.0,a8w8_bpreshuffle_256x32x64x512_16x16_16x16_32x8x1_32x8x1_1x32x1x8_8x8x1_1x2_intrawave_v1,1.0,-1.0,-1.0
304,160,2112,7168,112,0,17.5192,a8w8_bpreshuffle_256x32x64x256_16x16_16x16_16x16x1_16x16x1_1x32x1x8_8x8x1_2x1_intrawave_v1,276.52,968.17,0.0
304,160,3072,1536,112,0,7.1978,a8w8_bpreshuffle_256x32x64x256_16x16_16x16_16x16x1_16x16x1_1x32x1x8_8x8x1_2x1_intrawave_v1,209.78,826.28,0.0
304,160,3072,4096,113,0,-1.0,a8w8_bpreshuffle_256x48x64x256_16x16_16x16_16x16x1_16x16x1_1x16x1x16_4x4x1_1x1_intrawave_v1,1.0,-1.0,-1.0
304,160,3584,6144,114,0,-1.0,a8w8_bpreshuffle_256x64x64x256_16x16_16x16_16x16x1_16x16x1_1x32x1x8_8x8x1_2x1_intrawave_v3,1.0,-1.0,-1.0
304,160,4096,512,9,0,5.1951,a8w8_bpreshuffle_128x16x32x128_16x16_16x16_8x16x1_8x16x1_1x16x1x8_4x4x1_1x1_intrawave_v1,129.18,671.75,0.0
304,160,4096,640,9,0,-1.0,a8w8_bpreshuffle_128x16x32x128_16x16_16x16_8x16x1_8x16x1_1x16x1x8_4x4x1_1x1_intrawave_v1,1.0,-1.0,-1.0
304,160,4096,1024,113,0,-1.0,a8w8_bpreshuffle_256x48x64x256_16x16_16x16_16x16x1_16x16x1_1x16x1x16_4x4x1_1x1_intrawave_v1,1.0,-1.0,-1.0
304,160,4096,3072,113,0,-1.0,a8w8_bpreshuffle_256x48x64x256_16x16_16x16_16x16x1_16x16x1_1x16x1x16_4x4x1_1x1_intrawave_v1,1.0,-1.0,-1.0
304,160,4608,7168,113,0,26.6613,a8w8_bpreshuffle_256x48x64x256_16x16_16x16_16x16x1_16x16x1_1x16x1x16_4x4x1_1x1_intrawave_v1,396.44,1337.2,0.0
304,160,5120,640,76,0,-1.0,a8w8_bpreshuffle_256x32x64x128_16x16_16x16_8x32x1_8x32x1_1x32x1x8_8x8x1_2x1_intrawave_v1,1.0,-1.0,-1.0
304,160,5120,2048,114,0,-1.0,a8w8_bpreshuffle_256x64x64x256_16x16_16x16_16x16x1_16x16x1_1x32x1x8_8x8x1_2x1_intrawave_v3,1.0,-1.0,-1.0
304,160,6144,768,120,0,-1.0,a8w8_bpreshuffle_256x48x128x256_16x16_16x16_16x16x1_16x16x1_1x16x1x16_8x8x1_1x2_intrawave_v1,1.0,-1.0,-1.0
304,160,6144,1024,120,0,-1.0,a8w8_bpreshuffle_256x48x128x256_16x16_16x16_16x16x1_16x16x1_1x16x1x16_8x8x1_1x2_intrawave_v1,1.0,-1.0,-1.0
304,160,6144,1536,114,0,-1.0,a8w8_bpreshuffle_256x64x64x256_16x16_16x16_16x16x1_16x16x1_1x32x1x8_8x8x1_2x1_intrawave_v3,1.0,-1.0,-1.0
304,160,6144,2048,114,0,-1.0,a8w8_bpreshuffle_256x64x64x256_16x16_16x16_16x16x1_16x16x1_1x32x1x8_8x8x1_2x1_intrawave_v3,1.0,-1.0,-1.0
304,160,7168,256,75,0,-1.0,a8w8_bpreshuffle_128x16x256x64_16x16_16x16_4x16x1_4x32x1_1x16x1x8_8x8x1_1x2_intrawave_v1,1.0,-1.0,-1.0
304,160,7168,2048,115,0,14.1833,a8w8_bpreshuffle_256x80x64x256_16x16_16x16_16x16x1_16x16x1_1x16x1x16_4x4x1_1x1_intrawave_v3,331.21,1219.85,0.0
304,160,7168,2304,120,0,-1.0,a8w8_bpreshuffle_256x48x128x256_16x16_16x16_16x16x1_16x16x1_1x16x1x16_8x8x1_1x2_intrawave_v1,1.0,-1.0,-1.0
304,168,192,7168,10,0,-1.0,a8w8_bpreshuffle_128x16x32x512_16x16_16x16_32x4x1_32x4x1_1x16x1x8_4x4x1_1x1_intrawave_v1,1.0,-1.0,-1.0
304,168,512,7168,5,0,-1.0,a8w8_bpreshuffle_256x16x64x512_16x16_16x16_32x8x1_32x8x1_1x16x1x16_4x4x1_1x1_intrawave_v1,1.0,-1.0,-1.0
304,168,576,7168,11,0,10.5415,a8w8_bpreshuffle_256x16x64x512_16x16_16x16_32x8x1_32x8x1_1x16x1x16_4x4x1_1x1_intrawave_v1,131.6,524.26,0.0
304,168,896,5120,5,0,-1.0,a8w8_bpreshuffle_256x16x64x512_16x16_16x16_32x8x1_32x8x1_1x16x1x16_4x4x1_1x1_intrawave_v1,1.0,-1.0,-1.0
304,168,1024,5632,11,0,-1.0,a8w8_bpreshuffle_256x16x64x512_16x16_16x16_32x8x1_32x8x1_1x16x1x16_4x4x1_1x1_intrawave_v1,1.0,-1.0,-1.0
304,168,1056,1408,9,0,-1.0,a8w8_bpreshuffle_128x16x32x128_16x16_16x16_8x16x1_8x16x1_1x16x1x8_4x4x1_1x1_intrawave_v1,1.0,-1.0,-1.0
304,168,1280,4096,5,0,-1.0,a8w8_bpreshuffle_256x16x64x512_16x16_16x16_32x8x1_32x8x1_1x16x1x16_4x4x1_1x1_intrawave_v1,1.0,-1.0,-1.0
304,168,1408,352,0,0,-1.0,a8w8_bpreshuffle_256x128x128x128_16x16_16x16_8x32x1_8x32x1_1x32x1x8_8x8x1_2x1_intrawave_v3,1.0,-1.0,-1.0
304,168,1408,1408,9,0,-1.0,a8w8_bpreshuffle_128x16x32x128_16x16_16x16_8x16x1_8x16x1_1x16x1x8_4x4x1_1x1_intrawave_v1,1.0,-1.0,-1.0
304,168,1536,2048,11,0,-1.0,a8w8_bpreshuffle_256x16x64x512_16x16_16x16_32x8x1_32x8x1_1x16x1x16_4x4x1_1x1_intrawave_v1,1.0,-1.0,-1.0
304,168,1536,7168,5,0,14.3981,a8w8_bpreshuffle_256x16x64x512_16x16_16x16_32x8x1_32x8x1_1x16x1x16_4x4x1_1x1_intrawave_v1,256.94,884.17,0.0
304,168,1792,6144,6,0,-1.0,a8w8_bpreshuffle_256x16x128x512_16x16_16x16_32x8x1_32x8x1_1x16x1x16_8x8x1_1x2_intrawave_v1,1.0,-1.0,-1.0
304,168,2048,1536,6,0,-1.0,a8w8_bpreshuffle_256x16x128x512_16x16_16x16_32x8x1_32x8x1_1x16x1x16_8x8x1_1x2_intrawave_v1,1.0,-1.0,-1.0
304,168,2048,6144,12,0,-1.0,a8w8_bpreshuffle_256x32x64x512_16x16_16x16_32x8x1_32x8x1_1x32x1x8_8x8x1_1x2_intrawave_v1,1.0,-1.0,-1.0
304,168,2112,7168,12,0,18.3761,a8w8_bpreshuffle_256x32x64x512_16x16_16x16_32x8x1_32x8x1_1x32x1x8_8x8x1_1x2_intrawave_v1,276.81,927.98,0.0
304,168,3072,1536,113,0,7.8317,a8w8_bpreshuffle_256x48x64x256_16x16_16x16_16x16x1_16x16x1_1x16x1x16_4x4x1_1x1_intrawave_v1,202.44,767.24,0.0
304,168,3072,4096,12,0,-1.0,a8w8_bpreshuffle_256x32x64x512_16x16_16x16_32x8x1_32x8x1_1x32x1x8_8x8x1_1x2_intrawave_v1,1.0,-1.0,-1.0
304,168,3584,6144,114,0,-1.0,a8w8_bpreshuffle_256x64x64x256_16x16_16x16_16x16x1_16x16x1_1x32x1x8_8x8x1_2x1_intrawave_v3,1.0,-1.0,-1.0
304,168,4096,512,9,0,5.4222,a8w8_bpreshuffle_128x16x32x128_16x16_16x16_8x16x1_8x16x1_1x16x1x8_4x4x1_1x1_intrawave_v1,129.96,656.45,0.0
304,168,4096,640,76,0,-1.0,a8w8_bpreshuffle_256x32x64x128_16x16_16x16_8x32x1_8x32x1_1x32x1x8_8x8x1_2x1_intrawave_v1,1.0,-1.0,-1.0
304,168,4096,1024,113,0,-1.0,a8w8_bpreshuffle_256x48x64x256_16x16_16x16_16x16x1_16x16x1_1x16x1x16_4x4x1_1x1_intrawave_v1,1.0,-1.0,-1.0
304,168,4096,3072,113,0,-1.0,a8w8_bpreshuffle_256x48x64x256_16x16_16x16_16x16x1_16x16x1_1x16x1x16_4x4x1_1x1_intrawave_v1,1.0,-1.0,-1.0
304,168,4608,7168,113,0,26.8888,a8w8_bpreshuffle_256x48x64x256_16x16_16x16_16x16x1_16x16x1_1x16x1x16_4x4x1_1x1_intrawave_v1,412.74,1330.76,0.0
304,168,5120,640,76,0,-1.0,a8w8_bpreshuffle_256x32x64x128_16x16_16x16_8x32x1_8x32x1_1x32x1x8_8x8x1_2x1_intrawave_v1,1.0,-1.0,-1.0
304,168,5120,2048,114,0,-1.0,a8w8_bpreshuffle_256x64x64x256_16x16_16x16_16x16x1_16x16x1_1x32x1x8_8x8x1_2x1_intrawave_v3,1.0,-1.0,-1.0
304,168,6144,768,120,0,-1.0,a8w8_bpreshuffle_256x48x128x256_16x16_16x16_16x16x1_16x16x1_1x16x1x16_8x8x1_1x2_intrawave_v1,1.0,-1.0,-1.0
304,168,6144,1024,120,0,-1.0,a8w8_bpreshuffle_256x48x128x256_16x16_16x16_16x16x1_16x16x1_1x16x1x16_8x8x1_1x2_intrawave_v1,1.0,-1.0,-1.0
304,168,6144,1536,114,0,-1.0,a8w8_bpreshuffle_256x64x64x256_16x16_16x16_16x16x1_16x16x1_1x32x1x8_8x8x1_2x1_intrawave_v3,1.0,-1.0,-1.0
304,168,6144,2048,114,0,-1.0,a8w8_bpreshuffle_256x64x64x256_16x16_16x16_16x16x1_16x16x1_1x32x1x8_8x8x1_2x1_intrawave_v3,1.0,-1.0,-1.0
304,168,7168,256,75,0,-1.0,a8w8_bpreshuffle_128x16x256x64_16x16_16x16_4x16x1_4x32x1_1x16x1x8_8x8x1_1x2_intrawave_v1,1.0,-1.0,-1.0
304,168,7168,2048,120,0,13.4006,a8w8_bpreshuffle_256x48x128x256_16x16_16x16_16x16x1_16x16x1_1x16x1x16_8x8x1_1x2_intrawave_v1,368.08,1300.88,0.0
304,168,7168,2304,120,0,-1.0,a8w8_bpreshuffle_256x48x128x256_16x16_16x16_16x16x1_16x16x1_1x16x1x16_8x8x1_1x2_intrawave_v1,1.0,-1.0,-1.0
304,176,192,7168,24,0,-1.0,a8w8_bpreshuffle_128x16x32x512_16x16_16x16_32x4x1_32x4x1_1x16x1x8_4x4x1_1x1_intrawave_v2,1.0,-1.0,-1.0
304,176,512,7168,10,0,-1.0,a8w8_bpreshuffle_128x16x32x512_16x16_16x16_32x4x1_32x4x1_1x16x1x8_4x4x1_1x1_intrawave_v1,1.0,-1.0,-1.0
304,176,576,7168,10,0,9.3661,a8w8_bpreshuffle_128x16x32x512_16x16_16x16_32x4x1_32x4x1_1x16x1x8_4x4x1_1x1_intrawave_v1,155.17,597.16,0.0
304,176,896,5120,5,0,8.4984,a8w8_bpreshuffle_256x16x64x512_16x16_16x16_32x8x1_32x8x1_1x16x1x16_4x4x1_1x1_intrawave_v1,0.0,190.01,682.96
304,176,1024,5632,5,0,10.068,a8w8_bpreshuffle_256x16x64x512_16x16_16x16_32x8x1_32x8x1_1x16x1x16_4x4x1_1x1_intrawave_v1,0.0,201.63,707.08
304,176,1056,1408,9,0,6.516,a8w8_bpreshuffle_128x16x32x128_16x16_16x16_8x16x1_8x16x1_1x16x1x8_4x4x1_1x1_intrawave_v1,0.0,80.32,323.26
304,176,1280,4096,11,0,8.9476,a8w8_bpreshuffle_256x16x64x512_16x16_16x16_32x8x1_32x8x1_1x16x1x16_4x4x1_1x1_intrawave_v1,0.0,206.26,716.88
304,176,1408,352,0,0,-1.0,a8w8_bpreshuffle_256x128x128x128_16x16_16x16_8x32x1_8x32x1_1x32x1x8_8x8x1_2x1_intrawave_v3,1.0,-1.0,-1.0
304,176,1408,1408,9,0,-1.0,a8w8_bpreshuffle_128x16x32x128_16x16_16x16_8x16x1_8x16x1_1x16x1x8_4x4x1_1x1_intrawave_v1,1.0,-1.0,-1.0
304,176,1536,2048,11,0,-1.0,a8w8_bpreshuffle_256x16x64x512_16x16_16x16_32x8x1_32x8x1_1x16x1x16_4x4x1_1x1_intrawave_v1,1.0,-1.0,-1.0
304,176,1536,7168,19,0,14.6175,a8w8_bpreshuffle_256x16x64x512_16x16_16x16_32x8x1_32x8x1_1x16x1x16_4x4x1_1x1_intrawave_v2,265.13,876.5,0.0
304,176,1792,6144,12,0,-1.0,a8w8_bpreshuffle_256x32x64x512_16x16_16x16_32x8x1_32x8x1_1x32x1x8_8x8x1_1x2_intrawave_v1,1.0,-1.0,-1.0
304,176,2048,1536,6,0,-1.0,a8w8_bpreshuffle_256x16x128x512_16x16_16x16_32x8x1_32x8x1_1x16x1x16_8x8x1_1x2_intrawave_v1,1.0,-1.0,-1.0
304,176,2048,6144,12,0,-1.0,a8w8_bpreshuffle_256x32x64x512_16x16_16x16_32x8x1_32x8x1_1x32x1x8_8x8x1_1x2_intrawave_v1,1.0,-1.0,-1.0
304,176,2112,7168,12,0,18.1569,a8w8_bpreshuffle_256x32x64x512_16x16_16x16_32x8x1_32x8x1_1x32x1x8_8x8x1_1x2_intrawave_v1,293.49,944.2,0.0
304,176,3072,1536,113,0,7.803,a8w8_bpreshuffle_256x48x64x256_16x16_16x16_16x16x1_16x16x1_1x16x1x16_4x4x1_1x1_intrawave_v1,212.86,777.94,0.0
304,176,3072,4096,12,0,-1.0,a8w8_bpreshuffle_256x32x64x512_16x16_16x16_32x8x1_32x8x1_1x32x1x8_8x8x1_1x2_intrawave_v1,1.0,-1.0,-1.0
304,176,3584,6144,113,0,-1.0,a8w8_bpreshuffle_256x48x64x256_16x16_16x16_16x16x1_16x16x1_1x16x1x16_4x4x1_1x1_intrawave_v1,1.0,-1.0,-1.0
304,176,4096,512,9,0,5.3253,a8w8_bpreshuffle_128x16x32x128_16x16_16x16_8x16x1_8x16x1_1x16x1x8_4x4x1_1x1_intrawave_v1,138.62,681.47,0.0
304,176,4096,640,9,0,5.8671,a8w8_bpreshuffle_128x16x32x128_16x16_16x16_8x16x1_8x16x1_1x16x1x8_4x4x1_1x1_intrawave_v1,0.0,157.27,711.74
304,176,4096,1024,113,0,-1.0,a8w8_bpreshuffle_256x48x64x256_16x16_16x16_16x16x1_16x16x1_1x16x1x16_4x4x1_1x1_intrawave_v1,1.0,-1.0,-1.0
304,176,4096,3072,113,0,-1.0,a8w8_bpreshuffle_256x48x64x256_16x16_16x16_16x16x1_16x16x1_1x16x1x16_4x4x1_1x1_intrawave_v1,1.0,-1.0,-1.0
304,176,4608,7168,114,0,27.1771,a8w8_bpreshuffle_256x64x64x256_16x16_16x16_16x16x1_16x16x1_1x32x1x8_8x8x1_2x1_intrawave_v3,427.81,1321.47,0.0
304,176,5120,640,76,0,6.3009,a8w8_bpreshuffle_256x32x64x128_16x16_16x16_8x32x1_8x32x1_1x32x1x8_8x8x1_2x1_intrawave_v1,0.0,183.06,823.96
304,176,5120,2048,114,0,11.3045,a8w8_bpreshuffle_256x64x64x256_16x16_16x16_16x16x1_16x16x1_1x32x1x8_8x8x1_2x1_intrawave_v3,0.0,326.51,1118.89
304,176,6144,768,120,0,-1.0,a8w8_bpreshuffle_256x48x128x256_16x16_16x16_16x16x1_16x16x1_1x16x1x16_8x8x1_1x2_intrawave_v1,1.0,-1.0,-1.0
304,176,6144,1024,120,0,-1.0,a8w8_bpreshuffle_256x48x128x256_16x16_16x16_16x16x1_16x16x1_1x16x1x16_8x8x1_1x2_intrawave_v1,1.0,-1.0,-1.0
304,176,6144,1536,114,0,-1.0,a8w8_bpreshuffle_256x64x64x256_16x16_16x16_16x16x1_16x16x1_1x32x1x8_8x8x1_2x1_intrawave_v3,1.0,-1.0,-1.0
304,176,6144,2048,114,0,-1.0,a8w8_bpreshuffle_256x64x64x256_16x16_16x16_16x16x1_16x16x1_1x32x1x8_8x8x1_2x1_intrawave_v3,1.0,-1.0,-1.0
304,176,7168,256,75,0,-1.0,a8w8_bpreshuffle_128x16x256x64_16x16_16x16_4x16x1_4x32x1_1x16x1x8_8x8x1_1x2_intrawave_v1,1.0,-1.0,-1.0
304,176,7168,2048,120,0,13.972,a8w8_bpreshuffle_256x48x128x256_16x16_16x16_16x16x1_16x16x1_1x16x1x16_8x8x1_1x2_intrawave_v1,369.84,1257.06,0.0
304,176,7168,2304,120,0,-1.0,a8w8_bpreshuffle_256x48x128x256_16x16_16x16_16x16x1_16x16x1_1x16x1x16_8x8x1_1x2_intrawave_v1,1.0,-1.0,-1.0
304,184,192,7168,19,0,-1.0,a8w8_bpreshuffle_256x16x64x512_16x16_16x16_32x8x1_32x8x1_1x16x1x16_4x4x1_1x1_intrawave_v2,1.0,-1.0,-1.0
304,184,512,7168,5,0,-1.0,a8w8_bpreshuffle_256x16x64x512_16x16_16x16_32x8x1_32x8x1_1x16x1x16_4x4x1_1x1_intrawave_v1,1.0,-1.0,-1.0
304,184,576,7168,11,0,10.6221,a8w8_bpreshuffle_256x16x64x512_16x16_16x16_32x8x1_32x8x1_1x16x1x16_4x4x1_1x1_intrawave_v1,143.04,532.82,0.0
304,184,896,5120,11,0,-1.0,a8w8_bpreshuffle_256x16x64x512_16x16_16x16_32x8x1_32x8x1_1x16x1x16_4x4x1_1x1_intrawave_v1,1.0,-1.0,-1.0
304,184,1024,5632,11,0,-1.0,a8w8_bpreshuffle_256x16x64x512_16x16_16x16_32x8x1_32x8x1_1x16x1x16_4x4x1_1x1_intrawave_v1,1.0,-1.0,-1.0
304,184,1056,1408,9,0,-1.0,a8w8_bpreshuffle_128x16x32x128_16x16_16x16_8x16x1_8x16x1_1x16x1x8_4x4x1_1x1_intrawave_v1,1.0,-1.0,-1.0
304,184,1280,4096,11,0,-1.0,a8w8_bpreshuffle_256x16x64x512_16x16_16x16_32x8x1_32x8x1_1x16x1x16_4x4x1_1x1_intrawave_v1,1.0,-1.0,-1.0
304,184,1408,352,0,0,-1.0,a8w8_bpreshuffle_256x128x128x128_16x16_16x16_8x32x1_8x32x1_1x32x1x8_8x8x1_2x1_intrawave_v3,1.0,-1.0,-1.0
304,184,1408,1408,9,0,-1.0,a8w8_bpreshuffle_128x16x32x128_16x16_16x16_8x16x1_8x16x1_1x16x1x8_4x4x1_1x1_intrawave_v1,1.0,-1.0,-1.0
304,184,1536,2048,5,0,-1.0,a8w8_bpreshuffle_256x16x64x512_16x16_16x16_32x8x1_32x8x1_1x16x1x16_4x4x1_1x1_intrawave_v1,1.0,-1.0,-1.0
304,184,1536,7168,19,0,15.5689,a8w8_bpreshuffle_256x16x64x512_16x16_16x16_32x8x1_32x8x1_1x16x1x16_4x4x1_1x1_intrawave_v2,260.24,828.2,0.0
304,184,1792,6144,12,0,-1.0,a8w8_bpreshuffle_256x32x64x512_16x16_16x16_32x8x1_32x8x1_1x32x1x8_8x8x1_1x2_intrawave_v1,1.0,-1.0,-1.0
304,184,2048,1536,6,0,-1.0,a8w8_bpreshuffle_256x16x128x512_16x16_16x16_32x8x1_32x8x1_1x16x1x16_8x8x1_1x2_intrawave_v1,1.0,-1.0,-1.0
304,184,2048,6144,12,0,-1.0,a8w8_bpreshuffle_256x32x64x512_16x16_16x16_32x8x1_32x8x1_1x32x1x8_8x8x1_1x2_intrawave_v1,1.0,-1.0,-1.0
304,184,2112,7168,12,0,18.5679,a8w8_bpreshuffle_256x32x64x512_16x16_16x16_32x8x1_32x8x1_1x32x1x8_8x8x1_1x2_intrawave_v1,300.04,928.21,0.0
304,184,3072,1536,113,0,7.5164,a8w8_bpreshuffle_256x48x64x256_16x16_16x16_16x16x1_16x16x1_1x16x1x16_4x4x1_1x1_intrawave_v1,231.02,815.78,0.0
304,184,3072,4096,12,0,-1.0,a8w8_bpreshuffle_256x32x64x512_16x16_16x16_32x8x1_32x8x1_1x32x1x8_8x8x1_1x2_intrawave_v1,1.0,-1.0,-1.0
304,184,3584,6144,114,0,-1.0,a8w8_bpreshuffle_256x64x64x256_16x16_16x16_16x16x1_16x16x1_1x32x1x8_8x8x1_2x1_intrawave_v3,1.0,-1.0,-1.0
304,184,4096,512,9,0,5.7199,a8w8_bpreshuffle_128x16x32x128_16x16_16x16_8x16x1_8x16x1_1x16x1x8_4x4x1_1x1_intrawave_v1,134.92,646.64,0.0
304,184,4096,640,76,0,-1.0,a8w8_bpreshuffle_256x32x64x128_16x16_16x16_8x32x1_8x32x1_1x32x1x8_8x8x1_2x1_intrawave_v1,1.0,-1.0,-1.0
304,184,4096,1024,113,0,-1.0,a8w8_bpreshuffle_256x48x64x256_16x16_16x16_16x16x1_16x16x1_1x16x1x16_4x4x1_1x1_intrawave_v1,1.0,-1.0,-1.0
304,184,4096,3072,113,0,-1.0,a8w8_bpreshuffle_256x48x64x256_16x16_16x16_16x16x1_16x16x1_1x16x1x16_4x4x1_1x1_intrawave_v1,1.0,-1.0,-1.0
304,184,4608,7168,113,0,27.6516,a8w8_bpreshuffle_256x48x64x256_16x16_16x16_16x16x1_16x16x1_1x16x1x16_4x4x1_1x1_intrawave_v1,439.58,1303.53,0.0
304,184,5120,640,76,0,-1.0,a8w8_bpreshuffle_256x32x64x128_16x16_16x16_8x32x1_8x32x1_1x32x1x8_8x8x1_2x1_intrawave_v1,1.0,-1.0,-1.0
304,184,5120,2048,114,0,-1.0,a8w8_bpreshuffle_256x64x64x256_16x16_16x16_16x16x1_16x16x1_1x32x1x8_8x8x1_2x1_intrawave_v3,1.0,-1.0,-1.0
304,184,6144,768,120,0,-1.0,a8w8_bpreshuffle_256x48x128x256_16x16_16x16_16x16x1_16x16x1_1x16x1x16_8x8x1_1x2_intrawave_v1,1.0,-1.0,-1.0
304,184,6144,1024,120,0,-1.0,a8w8_bpreshuffle_256x48x128x256_16x16_16x16_16x16x1_16x16x1_1x16x1x16_8x8x1_1x2_intrawave_v1,1.0,-1.0,-1.0
304,184,6144,1536,114,0,-1.0,a8w8_bpreshuffle_256x64x64x256_16x16_16x16_16x16x1_16x16x1_1x32x1x8_8x8x1_2x1_intrawave_v3,1.0,-1.0,-1.0
304,184,6144,2048,114,0,-1.0,a8w8_bpreshuffle_256x64x64x256_16x16_16x16_16x16x1_16x16x1_1x32x1x8_8x8x1_2x1_intrawave_v3,1.0,-1.0,-1.0
304,184,7168,256,75,0,-1.0,a8w8_bpreshuffle_128x16x256x64_16x16_16x16_4x16x1_4x32x1_1x16x1x8_8x8x1_1x2_intrawave_v1,1.0,-1.0,-1.0
304,184,7168,2048,120,0,14.1652,a8w8_bpreshuffle_256x48x128x256_16x16_16x16_16x16x1_16x16x1_1x16x1x16_8x8x1_1x2_intrawave_v1,381.38,1249.17,0.0
304,184,7168,2304,120,0,-1.0,a8w8_bpreshuffle_256x48x128x256_16x16_16x16_16x16x1_16x16x1_1x16x1x16_8x8x1_1x2_intrawave_v1,1.0,-1.0,-1.0
304,192,192,7168,24,0,-1.0,a8w8_bpreshuffle_128x16x32x512_16x16_16x16_32x4x1_32x4x1_1x16x1x8_4x4x1_1x1_intrawave_v2,1.0,-1.0,-1.0
304,192,512,7168,10,0,-1.0,a8w8_bpreshuffle_128x16x32x512_16x16_16x16_32x4x1_32x4x1_1x16x1x8_4x4x1_1x1_intrawave_v1,1.0,-1.0,-1.0
304,192,576,7168,10,0,9.5481,a8w8_bpreshuffle_128x16x32x512_16x16_16x16_32x4x1_32x4x1_1x16x1x8_4x4x1_1x1_intrawave_v1,166.05,599.72,0.0
304,192,896,5120,11,0,-1.0,a8w8_bpreshuffle_256x16x64x512_16x16_16x16_32x8x1_32x8x1_1x16x1x16_4x4x1_1x1_intrawave_v1,1.0,-1.0,-1.0
304,192,1024,5632,11,0,-1.0,a8w8_bpreshuffle_256x16x64x512_16x16_16x16_32x8x1_32x8x1_1x16x1x16_4x4x1_1x1_intrawave_v1,1.0,-1.0,-1.0
304,192,1056,1408,9,0,-1.0,a8w8_bpreshuffle_128x16x32x128_16x16_16x16_8x16x1_8x16x1_1x16x1x8_4x4x1_1x1_intrawave_v1,1.0,-1.0,-1.0
304,192,1280,4096,5,0,-1.0,a8w8_bpreshuffle_256x16x64x512_16x16_16x16_32x8x1_32x8x1_1x16x1x16_4x4x1_1x1_intrawave_v1,1.0,-1.0,-1.0
304,192,1408,352,0,0,-1.0,a8w8_bpreshuffle_256x128x128x128_16x16_16x16_8x32x1_8x32x1_1x32x1x8_8x8x1_2x1_intrawave_v3,1.0,-1.0,-1.0
304,192,1408,1408,9,0,-1.0,a8w8_bpreshuffle_128x16x32x128_16x16_16x16_8x16x1_8x16x1_1x16x1x8_4x4x1_1x1_intrawave_v1,1.0,-1.0,-1.0
304,192,1536,2048,11,0,-1.0,a8w8_bpreshuffle_256x16x64x512_16x16_16x16_32x8x1_32x8x1_1x16x1x16_4x4x1_1x1_intrawave_v1,1.0,-1.0,-1.0
304,192,1536,7168,11,0,14.4322,a8w8_bpreshuffle_256x16x64x512_16x16_16x16_32x8x1_32x8x1_1x16x1x16_4x4x1_1x1_intrawave_v1,292.95,899.11,0.0
304,192,1792,6144,112,0,-1.0,a8w8_bpreshuffle_256x32x64x256_16x16_16x16_16x16x1_16x16x1_1x32x1x8_8x8x1_2x1_intrawave_v1,1.0,-1.0,-1.0
304,192,2048,1536,6,0,-1.0,a8w8_bpreshuffle_256x16x128x512_16x16_16x16_32x8x1_32x8x1_1x16x1x16_8x8x1_1x2_intrawave_v1,1.0,-1.0,-1.0
304,192,2048,6144,112,0,-1.0,a8w8_bpreshuffle_256x32x64x256_16x16_16x16_16x16x1_16x16x1_1x32x1x8_8x8x1_2x1_intrawave_v1,1.0,-1.0,-1.0
304,192,2112,7168,12,0,17.8771,a8w8_bpreshuffle_256x32x64x512_16x16_16x16_32x8x1_32x8x1_1x32x1x8_8x8x1_1x2_intrawave_v1,325.18,969.18,0.0
304,192,3072,1536,113,0,7.7362,a8w8_bpreshuffle_256x48x64x256_16x16_16x16_16x16x1_16x16x1_1x16x1x16_4x4x1_1x1_intrawave_v1,234.22,800.54,0.0
304,192,3072,4096,112,0,-1.0,a8w8_bpreshuffle_256x32x64x256_16x16_16x16_16x16x1_16x16x1_1x32x1x8_8x8x1_2x1_intrawave_v1,1.0,-1.0,-1.0
304,192,3584,6144,113,0,-1.0,a8w8_bpreshuffle_256x48x64x256_16x16_16x16_16x16x1_16x16x1_1x16x1x16_4x4x1_1x1_intrawave_v1,1.0,-1.0,-1.0
304,192,4096,512,9,0,5.2707,a8w8_bpreshuffle_128x16x32x128_16x16_16x16_8x16x1_8x16x1_1x16x1x8_4x4x1_1x1_intrawave_v1,152.79,714.96,0.0
304,192,4096,640,76,0,-1.0,a8w8_bpreshuffle_256x32x64x128_16x16_16x16_8x32x1_8x32x1_1x32x1x8_8x8x1_2x1_intrawave_v1,1.0,-1.0,-1.0
304,192,4096,1024,113,0,-1.0,a8w8_bpreshuffle_256x48x64x256_16x16_16x16_16x16x1_16x16x1_1x16x1x16_4x4x1_1x1_intrawave_v1,1.0,-1.0,-1.0
304,192,4096,3072,113,0,-1.0,a8w8_bpreshuffle_256x48x64x256_16x16_16x16_16x16x1_16x16x1_1x16x1x16_4x4x1_1x1_intrawave_v1,1.0,-1.0,-1.0
304,192,4608,7168,113,0,26.4079,a8w8_bpreshuffle_256x48x64x256_16x16_16x16_16x16x1_16x16x1_1x16x1x16_4x4x1_1x1_intrawave_v1,480.29,1369.89,0.0
304,192,5120,640,76,0,-1.0,a8w8_bpreshuffle_256x32x64x128_16x16_16x16_8x32x1_8x32x1_1x32x1x8_8x8x1_2x1_intrawave_v1,1.0,-1.0,-1.0
304,192,5120,2048,114,0,-1.0,a8w8_bpreshuffle_256x64x64x256_16x16_16x16_16x16x1_16x16x1_1x32x1x8_8x8x1_2x1_intrawave_v3,1.0,-1.0,-1.0
304,192,6144,768,120,0,-1.0,a8w8_bpreshuffle_256x48x128x256_16x16_16x16_16x16x1_16x16x1_1x16x1x16_8x8x1_1x2_intrawave_v1,1.0,-1.0,-1.0
304,192,6144,1024,120,0,-1.0,a8w8_bpreshuffle_256x48x128x256_16x16_16x16_16x16x1_16x16x1_1x16x1x16_8x8x1_1x2_intrawave_v1,1.0,-1.0,-1.0
304,192,6144,1536,114,0,-1.0,a8w8_bpreshuffle_256x64x64x256_16x16_16x16_16x16x1_16x16x1_1x32x1x8_8x8x1_2x1_intrawave_v3,1.0,-1.0,-1.0
304,192,6144,2048,114,0,-1.0,a8w8_bpreshuffle_256x64x64x256_16x16_16x16_16x16x1_16x16x1_1x32x1x8_8x8x1_2x1_intrawave_v3,1.0,-1.0,-1.0
304,192,7168,256,75,0,-1.0,a8w8_bpreshuffle_128x16x256x64_16x16_16x16_4x16x1_4x32x1_1x16x1x8_8x8x1_1x2_intrawave_v1,1.0,-1.0,-1.0
304,192,7168,2048,120,0,13.9289,a8w8_bpreshuffle_256x48x128x256_16x16_16x16_16x16x1_16x16x1_1x16x1x16_8x8x1_1x2_intrawave_v1,404.71,1279.77,0.0
304,192,7168,2304,120,0,-1.0,a8w8_bpreshuffle_256x48x128x256_16x16_16x16_16x16x1_16x16x1_1x16x1x16_8x8x1_1x2_intrawave_v1,1.0,-1.0,-1.0
304,200,192,7168,11,0,-1.0,a8w8_bpreshuffle_256x16x64x512_16x16_16x16_32x8x1_32x8x1_1x16x1x16_4x4x1_1x1_intrawave_v1,1.0,-1.0,-1.0
304,200,512,7168,11,0,-1.0,a8w8_bpreshuffle_256x16x64x512_16x16_16x16_32x8x1_32x8x1_1x16x1x16_4x4x1_1x1_intrawave_v1,1.0,-1.0,-1.0
304,200,576,7168,11,0,10.4496,a8w8_bpreshuffle_256x16x64x512_16x16_16x16_32x8x1_32x8x1_1x16x1x16_4x4x1_1x1_intrawave_v1,158.05,554.35,0.0
304,200,896,5120,5,0,-1.0,a8w8_bpreshuffle_256x16x64x512_16x16_16x16_32x8x1_32x8x1_1x16x1x16_4x4x1_1x1_intrawave_v1,1.0,-1.0,-1.0
304,200,1024,5632,11,0,-1.0,a8w8_bpreshuffle_256x16x64x512_16x16_16x16_32x8x1_32x8x1_1x16x1x16_4x4x1_1x1_intrawave_v1,1.0,-1.0,-1.0
304,200,1056,1408,23,0,-1.0,a8w8_bpreshuffle_128x16x32x128_16x16_16x16_8x16x1_8x16x1_1x16x1x8_4x4x1_1x1_intrawave_v2,1.0,-1.0,-1.0
304,200,1280,4096,11,0,-1.0,a8w8_bpreshuffle_256x16x64x512_16x16_16x16_32x8x1_32x8x1_1x16x1x16_4x4x1_1x1_intrawave_v1,1.0,-1.0,-1.0
304,200,1408,352,0,0,-1.0,a8w8_bpreshuffle_256x128x128x128_16x16_16x16_8x32x1_8x32x1_1x32x1x8_8x8x1_2x1_intrawave_v3,1.0,-1.0,-1.0
304,200,1408,1408,9,0,-1.0,a8w8_bpreshuffle_128x16x32x128_16x16_16x16_8x16x1_8x16x1_1x16x1x8_4x4x1_1x1_intrawave_v1,1.0,-1.0,-1.0
304,200,1536,2048,12,0,-1.0,a8w8_bpreshuffle_256x32x64x512_16x16_16x16_32x8x1_32x8x1_1x32x1x8_8x8x1_1x2_intrawave_v1,1.0,-1.0,-1.0
304,200,1536,7168,12,0,16.4003,a8w8_bpreshuffle_256x32x64x512_16x16_16x16_32x8x1_32x8x1_1x32x1x8_8x8x1_1x2_intrawave_v1,268.53,796.21,0.0
304,200,1792,6144,12,0,-1.0,a8w8_bpreshuffle_256x32x64x512_16x16_16x16_32x8x1_32x8x1_1x32x1x8_8x8x1_1x2_intrawave_v1,1.0,-1.0,-1.0
304,200,2048,1536,12,0,-1.0,a8w8_bpreshuffle_256x32x64x512_16x16_16x16_32x8x1_32x8x1_1x32x1x8_8x8x1_1x2_intrawave_v1,1.0,-1.0,-1.0
304,200,2048,6144,12,0,-1.0,a8w8_bpreshuffle_256x32x64x512_16x16_16x16_32x8x1_32x8x1_1x32x1x8_8x8x1_1x2_intrawave_v1,1.0,-1.0,-1.0
304,200,2112,7168,12,0,19.0927,a8w8_bpreshuffle_256x32x64x512_16x16_16x16_32x8x1_32x8x1_1x32x1x8_8x8x1_1x2_intrawave_v1,317.16,912.24,0.0
304,200,3072,1536,119,0,7.9596,a8w8_bpreshuffle_256x32x128x256_16x16_16x16_16x16x1_16x16x1_1x16x1x16_8x8x1_1x2_intrawave_v1,237.13,785.79,0.0
304,200,3072,4096,119,0,-1.0,a8w8_bpreshuffle_256x32x128x256_16x16_16x16_16x16x1_16x16x1_1x16x1x16_8x8x1_1x2_intrawave_v1,1.0,-1.0,-1.0
304,200,3584,6144,119,0,-1.0,a8w8_bpreshuffle_256x32x128x256_16x16_16x16_16x16x1_16x16x1_1x16x1x16_8x8x1_1x2_intrawave_v1,1.0,-1.0,-1.0
304,200,4096,512,76,0,5.7419,a8w8_bpreshuffle_256x32x64x128_16x16_16x16_8x32x1_8x32x1_1x32x1x8_8x8x1_2x1_intrawave_v1,146.09,668.41,0.0
304,200,4096,640,76,0,-1.0,a8w8_bpreshuffle_256x32x64x128_16x16_16x16_8x32x1_8x32x1_1x32x1x8_8x8x1_2x1_intrawave_v1,1.0,-1.0,-1.0
304,200,4096,1024,119,0,-1.0,a8w8_bpreshuffle_256x32x128x256_16x16_16x16_16x16x1_16x16x1_1x16x1x16_8x8x1_1x2_intrawave_v1,1.0,-1.0,-1.0
304,200,4096,3072,119,0,-1.0,a8w8_bpreshuffle_256x32x128x256_16x16_16x16_16x16x1_16x16x1_1x16x1x16_8x8x1_1x2_intrawave_v1,1.0,-1.0,-1.0
304,200,4608,7168,119,0,29.6481,a8w8_bpreshuffle_256x32x128x256_16x16_16x16_16x16x1_16x16x1_1x16x1x16_8x8x1_1x2_intrawave_v1,445.63,1224.6,0.0
304,200,5120,640,76,0,-1.0,a8w8_bpreshuffle_256x32x64x128_16x16_16x16_8x32x1_8x32x1_1x32x1x8_8x8x1_2x1_intrawave_v1,1.0,-1.0,-1.0
304,200,5120,2048,119,0,-1.0,a8w8_bpreshuffle_256x32x128x256_16x16_16x16_16x16x1_16x16x1_1x16x1x16_8x8x1_1x2_intrawave_v1,1.0,-1.0,-1.0
304,200,6144,768,120,0,-1.0,a8w8_bpreshuffle_256x48x128x256_16x16_16x16_16x16x1_16x16x1_1x16x1x16_8x8x1_1x2_intrawave_v1,1.0,-1.0,-1.0
304,200,6144,1024,115,0,-1.0,a8w8_bpreshuffle_256x80x64x256_16x16_16x16_16x16x1_16x16x1_1x16x1x16_4x4x1_1x1_intrawave_v3,1.0,-1.0,-1.0
304,200,6144,1536,115,0,-1.0,a8w8_bpreshuffle_256x80x64x256_16x16_16x16_16x16x1_16x16x1_1x16x1x16_4x4x1_1x1_intrawave_v3,1.0,-1.0,-1.0
304,200,6144,2048,115,0,-1.0,a8w8_bpreshuffle_256x80x64x256_16x16_16x16_16x16x1_16x16x1_1x16x1x16_4x4x1_1x1_intrawave_v3,1.0,-1.0,-1.0
304,200,7168,256,75,0,-1.0,a8w8_bpreshuffle_128x16x256x64_16x16_16x16_4x16x1_4x32x1_1x16x1x8_8x8x1_1x2_intrawave_v1,1.0,-1.0,-1.0
304,200,7168,2048,121,0,15.3856,a8w8_bpreshuffle_256x64x128x256_16x16_16x16_16x16x1_16x16x1_1x16x1x16_8x8x1_1x2_intrawave_v3,381.66,1167.12,0.0
304,200,7168,2304,121,0,-1.0,a8w8_bpreshuffle_256x64x128x256_16x16_16x16_16x16x1_16x16x1_1x16x1x16_8x8x1_1x2_intrawave_v3,1.0,-1.0,-1.0
304,208,192,7168,24,0,-1.0,a8w8_bpreshuffle_128x16x32x512_16x16_16x16_32x4x1_32x4x1_1x16x1x8_4x4x1_1x1_intrawave_v2,1.0,-1.0,-1.0
304,208,512,7168,10,0,-1.0,a8w8_bpreshuffle_128x16x32x512_16x16_16x16_32x4x1_32x4x1_1x16x1x8_4x4x1_1x1_intrawave_v1,1.0,-1.0,-1.0
304,208,576,7168,11,0,10.0777,a8w8_bpreshuffle_256x16x64x512_16x16_16x16_32x8x1_32x8x1_1x16x1x16_4x4x1_1x1_intrawave_v1,170.43,581.42,0.0
304,208,896,5120,5,0,9.7099,a8w8_bpreshuffle_256x16x64x512_16x16_16x16_32x8x1_32x8x1_1x16x1x16_4x4x1_1x1_intrawave_v1,0.0,196.54,620.52
304,208,1024,5632,19,0,10.9534,a8w8_bpreshuffle_256x16x64x512_16x16_16x16_32x8x1_32x8x1_1x16x1x16_4x4x1_1x1_intrawave_v2,0.0,219.03,672.36
304,208,1056,1408,23,0,6.5943,a8w8_bpreshuffle_128x16x32x128_16x16_16x16_8x16x1_8x16x1_1x16x1x8_4x4x1_1x1_intrawave_v2,0.0,93.8,336.5
304,208,1280,4096,12,0,10.0018,a8w8_bpreshuffle_256x32x64x512_16x16_16x16_32x8x1_32x8x1_1x32x1x8_8x8x1_1x2_intrawave_v1,0.0,218.06,662.61
304,208,1408,352,0,0,-1.0,a8w8_bpreshuffle_256x128x128x128_16x16_16x16_8x32x1_8x32x1_1x32x1x8_8x8x1_2x1_intrawave_v3,1.0,-1.0,-1.0
304,208,1408,1408,9,0,-1.0,a8w8_bpreshuffle_128x16x32x128_16x16_16x16_8x16x1_8x16x1_1x16x1x8_4x4x1_1x1_intrawave_v1,1.0,-1.0,-1.0
304,208,1536,2048,12,0,-1.0,a8w8_bpreshuffle_256x32x64x512_16x16_16x16_32x8x1_32x8x1_1x32x1x8_8x8x1_1x2_intrawave_v1,1.0,-1.0,-1.0
304,208,1536,7168,12,0,16.7039,a8w8_bpreshuffle_256x32x64x512_16x16_16x16_32x8x1_32x8x1_1x32x1x8_8x8x1_1x2_intrawave_v1,274.2,786.64,0.0
304,208,1792,6144,12,0,-1.0,a8w8_bpreshuffle_256x32x64x512_16x16_16x16_32x8x1_32x8x1_1x32x1x8_8x8x1_1x2_intrawave_v1,1.0,-1.0,-1.0
304,208,2048,1536,112,0,-1.0,a8w8_bpreshuffle_256x32x64x256_16x16_16x16_16x16x1_16x16x1_1x32x1x8_8x8x1_2x1_intrawave_v1,1.0,-1.0,-1.0
304,208,2048,6144,119,0,-1.0,a8w8_bpreshuffle_256x32x128x256_16x16_16x16_16x16x1_16x16x1_1x16x1x16_8x8x1_1x2_intrawave_v1,1.0,-1.0,-1.0
304,208,2112,7168,12,0,19.2365,a8w8_bpreshuffle_256x32x64x512_16x16_16x16_32x8x1_32x8x1_1x32x1x8_8x8x1_1x2_intrawave_v1,327.39,910.16,0.0
304,208,3072,1536,119,0,7.8564,a8w8_bpreshuffle_256x32x128x256_16x16_16x16_16x16x1_16x16x1_1x16x1x16_8x8x1_1x2_intrawave_v1,249.85,803.93,0.0
304,208,3072,4096,114,0,-1.0,a8w8_bpreshuffle_256x64x64x256_16x16_16x16_16x16x1_16x16x1_1x32x1x8_8x8x1_2x1_intrawave_v3,1.0,-1.0,-1.0
304,208,3584,6144,114,0,-1.0,a8w8_bpreshuffle_256x64x64x256_16x16_16x16_16x16x1_16x16x1_1x32x1x8_8x8x1_2x1_intrawave_v3,1.0,-1.0,-1.0
304,208,4096,512,76,0,5.5079,a8w8_bpreshuffle_256x32x64x128_16x16_16x16_8x32x1_8x32x1_1x32x1x8_8x8x1_2x1_intrawave_v1,158.39,709.45,0.0
304,208,4096,640,76,0,6.0231,a8w8_bpreshuffle_256x32x64x128_16x16_16x16_8x32x1_8x32x1_1x32x1x8_8x8x1_2x1_intrawave_v1,0.0,181.06,740.23
304,208,4096,1024,119,0,-1.0,a8w8_bpreshuffle_256x32x128x256_16x16_16x16_16x16x1_16x16x1_1x16x1x16_8x8x1_1x2_intrawave_v1,1.0,-1.0,-1.0
304,208,4096,3072,119,0,-1.0,a8w8_bpreshuffle_256x32x128x256_16x16_16x16_16x16x1_16x16x1_1x16x1x16_8x8x1_1x2_intrawave_v1,1.0,-1.0,-1.0
304,208,4608,7168,119,0,29.4629,a8w8_bpreshuffle_256x32x128x256_16x16_16x16_16x16x1_16x16x1_1x16x1x16_8x8x1_1x2_intrawave_v1,466.37,1236.74,0.0
304,208,5120,640,76,0,6.7979,a8w8_bpreshuffle_256x32x64x128_16x16_16x16_8x32x1_8x32x1_1x32x1x8_8x8x1_2x1_intrawave_v1,0.0,200.52,814.93
304,208,5120,2048,119,0,12.1294,a8w8_bpreshuffle_256x32x128x256_16x16_16x16_16x16x1_16x16x1_1x16x1x16_8x8x1_1x2_intrawave_v1,0.0,359.63,1075.21
304,208,6144,768,120,0,-1.0,a8w8_bpreshuffle_256x48x128x256_16x16_16x16_16x16x1_16x16x1_1x16x1x16_8x8x1_1x2_intrawave_v1,1.0,-1.0,-1.0
304,208,6144,1024,84,0,-1.0,a8w8_bpreshuffle_256x32x128x128_16x16_16x16_8x32x1_8x32x1_1x32x1x8_8x8x1_2x1_intrawave_v1,1.0,-1.0,-1.0
304,208,6144,1536,115,0,-1.0,a8w8_bpreshuffle_256x80x64x256_16x16_16x16_16x16x1_16x16x1_1x16x1x16_4x4x1_1x1_intrawave_v3,1.0,-1.0,-1.0
304,208,6144,2048,115,0,-1.0,a8w8_bpreshuffle_256x80x64x256_16x16_16x16_16x16x1_16x16x1_1x16x1x16_4x4x1_1x1_intrawave_v3,1.0,-1.0,-1.0
304,208,7168,256,75,0,-1.0,a8w8_bpreshuffle_128x16x256x64_16x16_16x16_4x16x1_4x32x1_1x16x1x8_8x8x1_1x2_intrawave_v1,1.0,-1.0,-1.0
304,208,7168,2048,121,0,15.4598,a8w8_bpreshuffle_256x64x128x256_16x16_16x16_16x16x1_16x16x1_1x16x1x16_8x8x1_1x2_intrawave_v3,395.02,1170.0,0.0
304,208,7168,2304,121,0,-1.0,a8w8_bpreshuffle_256x64x128x256_16x16_16x16_16x16x1_16x16x1_1x16x1x16_8x8x1_1x2_intrawave_v3,1.0,-1.0,-1.0
304,216,192,7168,5,0,-1.0,a8w8_bpreshuffle_256x16x64x512_16x16_16x16_32x8x1_32x8x1_1x16x1x16_4x4x1_1x1_intrawave_v1,1.0,-1.0,-1.0
304,216,512,7168,11,0,-1.0,a8w8_bpreshuffle_256x16x64x512_16x16_16x16_32x8x1_32x8x1_1x16x1x16_4x4x1_1x1_intrawave_v1,1.0,-1.0,-1.0
304,216,576,7168,11,0,10.6348,a8w8_bpreshuffle_256x16x64x512_16x16_16x16_32x8x1_32x8x1_1x16x1x16_4x4x1_1x1_intrawave_v1,167.72,557.22,0.0
304,216,896,5120,5,0,-1.0,a8w8_bpreshuffle_256x16x64x512_16x16_16x16_32x8x1_32x8x1_1x16x1x16_4x4x1_1x1_intrawave_v1,1.0,-1.0,-1.0
304,216,1024,5632,11,0,-1.0,a8w8_bpreshuffle_256x16x64x512_16x16_16x16_32x8x1_32x8x1_1x16x1x16_4x4x1_1x1_intrawave_v1,1.0,-1.0,-1.0
304,216,1056,1408,23,0,-1.0,a8w8_bpreshuffle_128x16x32x128_16x16_16x16_8x16x1_8x16x1_1x16x1x8_4x4x1_1x1_intrawave_v2,1.0,-1.0,-1.0
304,216,1280,4096,12,0,-1.0,a8w8_bpreshuffle_256x32x64x512_16x16_16x16_32x8x1_32x8x1_1x32x1x8_8x8x1_1x2_intrawave_v1,1.0,-1.0,-1.0
304,216,1408,352,0,0,-1.0,a8w8_bpreshuffle_256x128x128x128_16x16_16x16_8x32x1_8x32x1_1x32x1x8_8x8x1_2x1_intrawave_v3,1.0,-1.0,-1.0
304,216,1408,1408,23,0,-1.0,a8w8_bpreshuffle_128x16x32x128_16x16_16x16_8x16x1_8x16x1_1x16x1x8_4x4x1_1x1_intrawave_v2,1.0,-1.0,-1.0
304,216,1536,2048,12,0,-1.0,a8w8_bpreshuffle_256x32x64x512_16x16_16x16_32x8x1_32x8x1_1x32x1x8_8x8x1_1x2_intrawave_v1,1.0,-1.0,-1.0
304,216,1536,7168,12,0,16.7529,a8w8_bpreshuffle_256x32x64x512_16x16_16x16_32x8x1_32x8x1_1x32x1x8_8x8x1_1x2_intrawave_v1,283.91,789.23,0.0
304,216,1792,6144,12,0,-1.0,a8w8_bpreshuffle_256x32x64x512_16x16_16x16_32x8x1_32x8x1_1x32x1x8_8x8x1_1x2_intrawave_v1,1.0,-1.0,-1.0
304,216,2048,1536,112,0,-1.0,a8w8_bpreshuffle_256x32x64x256_16x16_16x16_16x16x1_16x16x1_1x32x1x8_8x8x1_2x1_intrawave_v1,1.0,-1.0,-1.0
304,216,2048,6144,12,0,-1.0,a8w8_bpreshuffle_256x32x64x512_16x16_16x16_32x8x1_32x8x1_1x32x1x8_8x8x1_1x2_intrawave_v1,1.0,-1.0,-1.0
304,216,2112,7168,12,0,19.3078,a8w8_bpreshuffle_256x32x64x512_16x16_16x16_32x8x1_32x8x1_1x32x1x8_8x8x1_1x2_intrawave_v1,338.72,911.52,0.0
304,216,3072,1536,119,0,8.1229,a8w8_bpreshuffle_256x32x128x256_16x16_16x16_16x16x1_16x16x1_1x16x1x16_8x8x1_1x2_intrawave_v1,250.95,785.12,0.0
304,216,3072,4096,119,0,-1.0,a8w8_bpreshuffle_256x32x128x256_16x16_16x16_16x16x1_16x16x1_1x16x1x16_8x8x1_1x2_intrawave_v1,1.0,-1.0,-1.0
304,216,3584,6144,114,0,-1.0,a8w8_bpreshuffle_256x64x64x256_16x16_16x16_16x16x1_16x16x1_1x32x1x8_8x8x1_2x1_intrawave_v3,1.0,-1.0,-1.0
304,216,4096,512,76,0,5.5714,a8w8_bpreshuffle_256x32x64x128_16x16_16x16_8x32x1_8x32x1_1x32x1x8_8x8x1_2x1_intrawave_v1,162.61,713.86,0.0
304,216,4096,640,76,0,-1.0,a8w8_bpreshuffle_256x32x64x128_16x16_16x16_8x32x1_8x32x1_1x32x1x8_8x8x1_2x1_intrawave_v1,1.0,-1.0,-1.0
304,216,4096,1024,119,0,-1.0,a8w8_bpreshuffle_256x32x128x256_16x16_16x16_16x16x1_16x16x1_1x16x1x16_8x8x1_1x2_intrawave_v1,1.0,-1.0,-1.0
304,216,4096,3072,119,0,-1.0,a8w8_bpreshuffle_256x32x128x256_16x16_16x16_16x16x1_16x16x1_1x16x1x16_8x8x1_1x2_intrawave_v1,1.0,-1.0,-1.0
304,216,4608,7168,119,0,30.0197,a8w8_bpreshuffle_256x32x128x256_16x16_16x16_16x16x1_16x16x1_1x16x1x16_8x8x1_1x2_intrawave_v1,475.32,1218.17,0.0
304,216,5120,640,76,0,-1.0,a8w8_bpreshuffle_256x32x64x128_16x16_16x16_8x32x1_8x32x1_1x32x1x8_8x8x1_2x1_intrawave_v1,1.0,-1.0,-1.0
304,216,5120,2048,119,0,-1.0,a8w8_bpreshuffle_256x32x128x256_16x16_16x16_16x16x1_16x16x1_1x16x1x16_8x8x1_1x2_intrawave_v1,1.0,-1.0,-1.0
304,216,6144,768,76,0,-1.0,a8w8_bpreshuffle_256x32x64x128_16x16_16x16_8x32x1_8x32x1_1x32x1x8_8x8x1_2x1_intrawave_v1,1.0,-1.0,-1.0
304,216,6144,1024,84,0,-1.0,a8w8_bpreshuffle_256x32x128x128_16x16_16x16_8x32x1_8x32x1_1x32x1x8_8x8x1_2x1_intrawave_v1,1.0,-1.0,-1.0
304,216,6144,1536,115,0,-1.0,a8w8_bpreshuffle_256x80x64x256_16x16_16x16_16x16x1_16x16x1_1x16x1x16_4x4x1_1x1_intrawave_v3,1.0,-1.0,-1.0
304,216,6144,2048,115,0,-1.0,a8w8_bpreshuffle_256x80x64x256_16x16_16x16_16x16x1_16x16x1_1x16x1x16_4x4x1_1x1_intrawave_v3,1.0,-1.0,-1.0
304,216,7168,256,75,0,-1.0,a8w8_bpreshuffle_128x16x256x64_16x16_16x16_4x16x1_4x32x1_1x16x1x8_8x8x1_1x2_intrawave_v1,1.0,-1.0,-1.0
304,216,7168,2048,121,0,15.614,a8w8_bpreshuffle_256x64x128x256_16x16_16x16_16x16x1_16x16x1_1x16x1x16_8x8x1_1x2_intrawave_v3,406.16,1166.84,0.0
304,216,7168,2304,121,0,-1.0,a8w8_bpreshuffle_256x64x128x256_16x16_16x16_16x16x1_16x16x1_1x16x1x16_8x8x1_1x2_intrawave_v3,1.0,-1.0,-1.0
304,224,192,7168,10,0,-1.0,a8w8_bpreshuffle_128x16x32x512_16x16_16x16_32x4x1_32x4x1_1x16x1x8_4x4x1_1x1_intrawave_v1,1.0,-1.0,-1.0
304,224,512,7168,10,0,-1.0,a8w8_bpreshuffle_128x16x32x512_16x16_16x16_32x4x1_32x4x1_1x16x1x8_4x4x1_1x1_intrawave_v1,1.0,-1.0,-1.0
304,224,576,7168,11,0,10.1485,a8w8_bpreshuffle_256x16x64x512_16x16_16x16_32x8x1_32x8x1_1x16x1x16_4x4x1_1x1_intrawave_v1,182.26,590.48,0.0
304,224,896,5120,11,0,-1.0,a8w8_bpreshuffle_256x16x64x512_16x16_16x16_32x8x1_32x8x1_1x16x1x16_4x4x1_1x1_intrawave_v1,1.0,-1.0,-1.0
304,224,1024,5632,5,0,-1.0,a8w8_bpreshuffle_256x16x64x512_16x16_16x16_32x8x1_32x8x1_1x16x1x16_4x4x1_1x1_intrawave_v1,1.0,-1.0,-1.0
304,224,1056,1408,23,0,-1.0,a8w8_bpreshuffle_128x16x32x128_16x16_16x16_8x16x1_8x16x1_1x16x1x8_4x4x1_1x1_intrawave_v2,1.0,-1.0,-1.0
304,224,1280,4096,12,0,-1.0,a8w8_bpreshuffle_256x32x64x512_16x16_16x16_32x8x1_32x8x1_1x32x1x8_8x8x1_1x2_intrawave_v1,1.0,-1.0,-1.0
304,224,1408,352,0,0,-1.0,a8w8_bpreshuffle_256x128x128x128_16x16_16x16_8x32x1_8x32x1_1x32x1x8_8x8x1_2x1_intrawave_v3,1.0,-1.0,-1.0
304,224,1408,1408,9,0,-1.0,a8w8_bpreshuffle_128x16x32x128_16x16_16x16_8x16x1_8x16x1_1x16x1x8_4x4x1_1x1_intrawave_v1,1.0,-1.0,-1.0
304,224,1536,2048,12,0,-1.0,a8w8_bpreshuffle_256x32x64x512_16x16_16x16_32x8x1_32x8x1_1x32x1x8_8x8x1_1x2_intrawave_v1,1.0,-1.0,-1.0
304,224,1536,7168,112,0,16.467,a8w8_bpreshuffle_256x32x64x256_16x16_16x16_16x16x1_16x16x1_1x32x1x8_8x8x1_2x1_intrawave_v1,299.54,807.91,0.0
304,224,1792,6144,112,0,-1.0,a8w8_bpreshuffle_256x32x64x256_16x16_16x16_16x16x1_16x16x1_1x32x1x8_8x8x1_2x1_intrawave_v1,1.0,-1.0,-1.0
304,224,2048,1536,112,0,-1.0,a8w8_bpreshuffle_256x32x64x256_16x16_16x16_16x16x1_16x16x1_1x32x1x8_8x8x1_2x1_intrawave_v1,1.0,-1.0,-1.0
304,224,2048,6144,112,0,-1.0,a8w8_bpreshuffle_256x32x64x256_16x16_16x16_16x16x1_16x16x1_1x32x1x8_8x8x1_2x1_intrawave_v1,1.0,-1.0,-1.0
304,224,2112,7168,12,0,18.8894,a8w8_bpreshuffle_256x32x64x512_16x16_16x16_32x8x1_32x8x1_1x32x1x8_8x8x1_1x2_intrawave_v1,359.05,936.54,0.0
304,224,3072,1536,119,0,8.0203,a8w8_bpreshuffle_256x32x128x256_16x16_16x16_16x16x1_16x16x1_1x16x1x16_8x8x1_1x2_intrawave_v1,263.57,802.83,0.0
304,224,3072,4096,119,0,-1.0,a8w8_bpreshuffle_256x32x128x256_16x16_16x16_16x16x1_16x16x1_1x16x1x16_8x8x1_1x2_intrawave_v1,1.0,-1.0,-1.0
304,224,3584,6144,119,0,-1.0,a8w8_bpreshuffle_256x32x128x256_16x16_16x16_16x16x1_16x16x1_1x16x1x16_8x8x1_1x2_intrawave_v1,1.0,-1.0,-1.0
304,224,4096,512,76,0,5.8781,a8w8_bpreshuffle_256x32x64x128_16x16_16x16_8x32x1_8x32x1_1x32x1x8_8x8x1_2x1_intrawave_v1,159.83,688.46,0.0
304,224,4096,640,76,0,-1.0,a8w8_bpreshuffle_256x32x64x128_16x16_16x16_8x32x1_8x32x1_1x32x1x8_8x8x1_2x1_intrawave_v1,1.0,-1.0,-1.0
304,224,4096,1024,119,0,-1.0,a8w8_bpreshuffle_256x32x128x256_16x16_16x16_16x16x1_16x16x1_1x16x1x16_8x8x1_1x2_intrawave_v1,1.0,-1.0,-1.0
304,224,4096,3072,119,0,-1.0,a8w8_bpreshuffle_256x32x128x256_16x16_16x16_16x16x1_16x16x1_1x16x1x16_8x8x1_1x2_intrawave_v1,1.0,-1.0,-1.0
304,224,4608,7168,119,0,29.3463,a8w8_bpreshuffle_256x32x128x256_16x16_16x16_16x16x1_16x16x1_1x16x1x16_8x8x1_1x2_intrawave_v1,504.24,1250.59,0.0
304,224,5120,640,76,0,-1.0,a8w8_bpreshuffle_256x32x64x128_16x16_16x16_8x32x1_8x32x1_1x32x1x8_8x8x1_2x1_intrawave_v1,1.0,-1.0,-1.0
304,224,5120,2048,119,0,-1.0,a8w8_bpreshuffle_256x32x128x256_16x16_16x16_16x16x1_16x16x1_1x16x1x16_8x8x1_1x2_intrawave_v1,1.0,-1.0,-1.0
304,224,6144,768,76,0,-1.0,a8w8_bpreshuffle_256x32x64x128_16x16_16x16_8x32x1_8x32x1_1x32x1x8_8x8x1_2x1_intrawave_v1,1.0,-1.0,-1.0
304,224,6144,1024,84,0,-1.0,a8w8_bpreshuffle_256x32x128x128_16x16_16x16_8x32x1_8x32x1_1x32x1x8_8x8x1_2x1_intrawave_v1,1.0,-1.0,-1.0
304,224,6144,1536,126,0,-1.0,a8w8_bpreshuffle_256x32x192x256_16x16_16x16_16x16x1_16x16x1_1x32x1x8_8x8x1_2x1_intrawave_v1,1.0,-1.0,-1.0
304,224,6144,2048,115,0,-1.0,a8w8_bpreshuffle_256x80x64x256_16x16_16x16_16x16x1_16x16x1_1x16x1x16_4x4x1_1x1_intrawave_v3,1.0,-1.0,-1.0
304,224,7168,256,75,0,-1.0,a8w8_bpreshuffle_128x16x256x64_16x16_16x16_4x16x1_4x32x1_1x16x1x8_8x8x1_1x2_intrawave_v1,1.0,-1.0,-1.0
304,224,7168,2048,114,0,16.2058,a8w8_bpreshuffle_256x64x64x256_16x16_16x16_16x16x1_16x16x1_1x32x1x8_8x8x1_2x1_intrawave_v3,405.82,1132.32,0.0
304,224,7168,2304,121,0,-1.0,a8w8_bpreshuffle_256x64x128x256_16x16_16x16_16x16x1_16x16x1_1x16x1x16_8x8x1_1x2_intrawave_v3,1.0,-1.0,-1.0
304,232,192,7168,11,0,-1.0,a8w8_bpreshuffle_256x16x64x512_16x16_16x16_32x8x1_32x8x1_1x16x1x16_4x4x1_1x1_intrawave_v1,1.0,-1.0,-1.0
304,232,512,7168,11,0,-1.0,a8w8_bpreshuffle_256x16x64x512_16x16_16x16_32x8x1_32x8x1_1x16x1x16_4x4x1_1x1_intrawave_v1,1.0,-1.0,-1.0
304,232,576,7168,11,0,10.9714,a8w8_bpreshuffle_256x16x64x512_16x16_16x16_32x8x1_32x8x1_1x16x1x16_4x4x1_1x1_intrawave_v1,174.61,552.25,0.0
304,232,896,5120,11,0,-1.0,a8w8_bpreshuffle_256x16x64x512_16x16_16x16_32x8x1_32x8x1_1x16x1x16_4x4x1_1x1_intrawave_v1,1.0,-1.0,-1.0
304,232,1024,5632,11,0,-1.0,a8w8_bpreshuffle_256x16x64x512_16x16_16x16_32x8x1_32x8x1_1x16x1x16_4x4x1_1x1_intrawave_v1,1.0,-1.0,-1.0
304,232,1056,1408,23,0,-1.0,a8w8_bpreshuffle_128x16x32x128_16x16_16x16_8x16x1_8x16x1_1x16x1x8_4x4x1_1x1_intrawave_v2,1.0,-1.0,-1.0
304,232,1280,4096,12,0,-1.0,a8w8_bpreshuffle_256x32x64x512_16x16_16x16_32x8x1_32x8x1_1x32x1x8_8x8x1_1x2_intrawave_v1,1.0,-1.0,-1.0
304,232,1408,352,0,0,-1.0,a8w8_bpreshuffle_256x128x128x128_16x16_16x16_8x32x1_8x32x1_1x32x1x8_8x8x1_2x1_intrawave_v3,1.0,-1.0,-1.0
304,232,1408,1408,9,0,-1.0,a8w8_bpreshuffle_128x16x32x128_16x16_16x16_8x16x1_8x16x1_1x16x1x8_4x4x1_1x1_intrawave_v1,1.0,-1.0,-1.0
304,232,1536,2048,12,0,-1.0,a8w8_bpreshuffle_256x32x64x512_16x16_16x16_32x8x1_32x8x1_1x32x1x8_8x8x1_1x2_intrawave_v1,1.0,-1.0,-1.0
304,232,1536,7168,12,0,17.3549,a8w8_bpreshuffle_256x32x64x512_16x16_16x16_32x8x1_32x8x1_1x32x1x8_8x8x1_1x2_intrawave_v1,294.36,771.29,0.0
304,232,1792,6144,12,0,-1.0,a8w8_bpreshuffle_256x32x64x512_16x16_16x16_32x8x1_32x8x1_1x32x1x8_8x8x1_1x2_intrawave_v1,1.0,-1.0,-1.0
304,232,2048,1536,112,0,-1.0,a8w8_bpreshuffle_256x32x64x256_16x16_16x16_16x16x1_16x16x1_1x32x1x8_8x8x1_2x1_intrawave_v1,1.0,-1.0,-1.0
304,232,2048,6144,114,0,-1.0,a8w8_bpreshuffle_256x64x64x256_16x16_16x16_16x16x1_16x16x1_1x32x1x8_8x8x1_2x1_intrawave_v3,1.0,-1.0,-1.0
304,232,2112,7168,12,0,20.0938,a8w8_bpreshuffle_256x32x64x512_16x16_16x16_32x8x1_32x8x1_1x32x1x8_8x8x1_1x2_intrawave_v1,349.58,884.94,0.0
304,232,3072,1536,119,0,8.4816,a8w8_bpreshuffle_256x32x128x256_16x16_16x16_16x16x1_16x16x1_1x16x1x16_8x8x1_1x2_intrawave_v1,258.14,766.41,0.0
304,232,3072,4096,119,0,-1.0,a8w8_bpreshuffle_256x32x128x256_16x16_16x16_16x16x1_16x16x1_1x16x1x16_8x8x1_1x2_intrawave_v1,1.0,-1.0,-1.0
304,232,3584,6144,114,0,-1.0,a8w8_bpreshuffle_256x64x64x256_16x16_16x16_16x16x1_16x16x1_1x32x1x8_8x8x1_2x1_intrawave_v3,1.0,-1.0,-1.0
304,232,4096,512,76,0,5.4454,a8w8_bpreshuffle_256x32x64x128_16x16_16x16_8x32x1_8x32x1_1x32x1x8_8x8x1_2x1_intrawave_v1,178.7,755.96,0.0
304,232,4096,640,76,0,-1.0,a8w8_bpreshuffle_256x32x64x128_16x16_16x16_8x32x1_8x32x1_1x32x1x8_8x8x1_2x1_intrawave_v1,1.0,-1.0,-1.0
304,232,4096,1024,120,0,-1.0,a8w8_bpreshuffle_256x48x128x256_16x16_16x16_16x16x1_16x16x1_1x16x1x16_8x8x1_1x2_intrawave_v1,1.0,-1.0,-1.0
304,232,4096,3072,119,0,-1.0,a8w8_bpreshuffle_256x32x128x256_16x16_16x16_16x16x1_16x16x1_1x16x1x16_8x8x1_1x2_intrawave_v1,1.0,-1.0,-1.0
304,232,4608,7168,114,0,30.7291,a8w8_bpreshuffle_256x64x64x256_16x16_16x16_16x16x1_16x16x1_1x32x1x8_8x8x1_2x1_intrawave_v3,498.75,1198.58,0.0
304,232,5120,640,84,0,-1.0,a8w8_bpreshuffle_256x32x128x128_16x16_16x16_8x32x1_8x32x1_1x32x1x8_8x8x1_2x1_intrawave_v1,1.0,-1.0,-1.0
304,232,5120,2048,115,0,-1.0,a8w8_bpreshuffle_256x80x64x256_16x16_16x16_16x16x1_16x16x1_1x16x1x16_4x4x1_1x1_intrawave_v3,1.0,-1.0,-1.0
304,232,6144,768,76,0,-1.0,a8w8_bpreshuffle_256x32x64x128_16x16_16x16_8x32x1_8x32x1_1x32x1x8_8x8x1_2x1_intrawave_v1,1.0,-1.0,-1.0
304,232,6144,1024,126,0,-1.0,a8w8_bpreshuffle_256x32x192x256_16x16_16x16_16x16x1_16x16x1_1x32x1x8_8x8x1_2x1_intrawave_v1,1.0,-1.0,-1.0
304,232,6144,1536,115,0,-1.0,a8w8_bpreshuffle_256x80x64x256_16x16_16x16_16x16x1_16x16x1_1x16x1x16_4x4x1_1x1_intrawave_v3,1.0,-1.0,-1.0
304,232,6144,2048,115,0,-1.0,a8w8_bpreshuffle_256x80x64x256_16x16_16x16_16x16x1_16x16x1_1x16x1x16_4x4x1_1x1_intrawave_v3,1.0,-1.0,-1.0
304,232,7168,256,75,0,-1.0,a8w8_bpreshuffle_128x16x256x64_16x16_16x16_4x16x1_4x32x1_1x16x1x8_8x8x1_1x2_intrawave_v1,1.0,-1.0,-1.0
304,232,7168,2048,121,0,15.7378,a8w8_bpreshuffle_256x64x128x256_16x16_16x16_16x16x1_16x16x1_1x16x1x16_8x8x1_1x2_intrawave_v3,432.81,1174.32,0.0
304,232,7168,2304,119,0,-1.0,a8w8_bpreshuffle_256x32x128x256_16x16_16x16_16x16x1_16x16x1_1x16x1x16_8x8x1_1x2_intrawave_v1,1.0,-1.0,-1.0
304,240,192,7168,24,0,-1.0,a8w8_bpreshuffle_128x16x32x512_16x16_16x16_32x4x1_32x4x1_1x16x1x8_4x4x1_1x1_intrawave_v2,1.0,-1.0,-1.0
304,240,512,7168,10,0,-1.0,a8w8_bpreshuffle_128x16x32x512_16x16_16x16_32x4x1_32x4x1_1x16x1x8_4x4x1_1x1_intrawave_v1,1.0,-1.0,-1.0
304,240,576,7168,10,0,10.213,a8w8_bpreshuffle_128x16x32x512_16x16_16x16_32x4x1_32x4x1_1x16x1x8_4x4x1_1x1_intrawave_v1,194.05,599.78,0.0
304,240,896,5120,5,0,9.6149,a8w8_bpreshuffle_256x16x64x512_16x16_16x16_32x8x1_32x8x1_1x16x1x16_4x4x1_1x1_intrawave_v1,0.0,229.02,649.66
304,240,1024,5632,5,0,11.4344,a8w8_bpreshuffle_256x16x64x512_16x16_16x16_32x8x1_32x8x1_1x16x1x16_4x4x1_1x1_intrawave_v1,0.0,242.1,665.57
304,240,1056,1408,23,0,6.7109,a8w8_bpreshuffle_128x16x32x128_16x16_16x16_8x16x1_8x16x1_1x16x1x8_4x4x1_1x1_intrawave_v2,0.0,106.35,347.44
304,240,1280,4096,5,0,10.284,a8w8_bpreshuffle_256x16x64x512_16x16_16x16_32x8x1_32x8x1_1x16x1x16_4x4x1_1x1_intrawave_v1,0.0,244.71,665.14
304,240,1408,352,0,0,-1.0,a8w8_bpreshuffle_256x128x128x128_16x16_16x16_8x32x1_8x32x1_1x32x1x8_8x8x1_2x1_intrawave_v3,1.0,-1.0,-1.0
304,240,1408,1408,9,0,-1.0,a8w8_bpreshuffle_128x16x32x128_16x16_16x16_8x16x1_8x16x1_1x16x1x8_4x4x1_1x1_intrawave_v1,1.0,-1.0,-1.0
304,240,1536,2048,12,0,-1.0,a8w8_bpreshuffle_256x32x64x512_16x16_16x16_32x8x1_32x8x1_1x32x1x8_8x8x1_1x2_intrawave_v1,1.0,-1.0,-1.0
304,240,1536,7168,12,0,17.9536,a8w8_bpreshuffle_256x32x64x512_16x16_16x16_32x8x1_32x8x1_1x32x1x8_8x8x1_1x2_intrawave_v1,294.36,750.14,0.0
304,240,1792,6144,12,0,-1.0,a8w8_bpreshuffle_256x32x64x512_16x16_16x16_32x8x1_32x8x1_1x32x1x8_8x8x1_1x2_intrawave_v1,1.0,-1.0,-1.0
304,240,2048,1536,112,0,-1.0,a8w8_bpreshuffle_256x32x64x256_16x16_16x16_16x16x1_16x16x1_1x32x1x8_8x8x1_2x1_intrawave_v1,1.0,-1.0,-1.0
304,240,2048,6144,12,0,-1.0,a8w8_bpreshuffle_256x32x64x512_16x16_16x16_32x8x1_32x8x1_1x32x1x8_8x8x1_1x2_intrawave_v1,1.0,-1.0,-1.0
304,240,2112,7168,12,0,20.0647,a8w8_bpreshuffle_256x32x64x512_16x16_16x16_32x8x1_32x8x1_1x32x1x8_8x8x1_1x2_intrawave_v1,362.16,890.76,0.0
304,240,3072,1536,119,0,8.4583,a8w8_bpreshuffle_256x32x128x256_16x16_16x16_16x16x1_16x16x1_1x16x1x16_8x8x1_1x2_intrawave_v1,267.78,775.78,0.0
304,240,3072,4096,119,0,-1.0,a8w8_bpreshuffle_256x32x128x256_16x16_16x16_16x16x1_16x16x1_1x16x1x16_8x8x1_1x2_intrawave_v1,1.0,-1.0,-1.0
304,240,3584,6144,114,0,-1.0,a8w8_bpreshuffle_256x64x64x256_16x16_16x16_16x16x1_16x16x1_1x32x1x8_8x8x1_2x1_intrawave_v3,1.0,-1.0,-1.0
304,240,4096,512,76,0,5.503,a8w8_bpreshuffle_256x32x64x128_16x16_16x16_8x32x1_8x32x1_1x32x1x8_8x8x1_2x1_intrawave_v1,182.92,760.7,0.0
304,240,4096,640,76,0,6.1269,a8w8_bpreshuffle_256x32x64x128_16x16_16x16_8x32x1_8x32x1_1x32x1x8_8x8x1_2x1_intrawave_v1,0.0,205.37,773.82
304,240,4096,1024,119,0,-1.0,a8w8_bpreshuffle_256x32x128x256_16x16_16x16_16x16x1_16x16x1_1x16x1x16_8x8x1_1x2_intrawave_v1,1.0,-1.0,-1.0
304,240,4096,3072,119,0,-1.0,a8w8_bpreshuffle_256x32x128x256_16x16_16x16_16x16x1_16x16x1_1x16x1x16_8x8x1_1x2_intrawave_v1,1.0,-1.0,-1.0
304,240,4608,7168,114,0,31.2643,a8w8_bpreshuffle_256x64x64x256_16x16_16x16_16x16x1_16x16x1_1x32x1x8_8x8x1_2x1_intrawave_v3,507.11,1182.25,0.0
304,240,5120,640,84,0,7.0115,a8w8_bpreshuffle_256x32x128x128_16x16_16x16_8x32x1_8x32x1_1x32x1x8_8x8x1_2x1_intrawave_v1,0.0,224.33,839.76
304,240,5120,2048,115,0,13.1315,a8w8_bpreshuffle_256x80x64x256_16x16_16x16_16x16x1_16x16x1_1x16x1x16_4x4x1_1x1_intrawave_v3,0.0,383.29,1023.1
304,240,6144,768,126,0,-1.0,a8w8_bpreshuffle_256x32x192x256_16x16_16x16_16x16x1_16x16x1_1x32x1x8_8x8x1_2x1_intrawave_v1,1.0,-1.0,-1.0
304,240,6144,1024,115,0,-1.0,a8w8_bpreshuffle_256x80x64x256_16x16_16x16_16x16x1_16x16x1_1x16x1x16_4x4x1_1x1_intrawave_v3,1.0,-1.0,-1.0
304,240,6144,1536,115,0,-1.0,a8w8_bpreshuffle_256x80x64x256_16x16_16x16_16x16x1_16x16x1_1x16x1x16_4x4x1_1x1_intrawave_v3,1.0,-1.0,-1.0
304,240,6144,2048,115,0,-1.0,a8w8_bpreshuffle_256x80x64x256_16x16_16x16_16x16x1_16x16x1_1x16x1x16_4x4x1_1x1_intrawave_v3,1.0,-1.0,-1.0
304,240,7168,256,75,0,-1.0,a8w8_bpreshuffle_128x16x256x64_16x16_16x16_4x16x1_4x32x1_1x16x1x8_8x8x1_1x2_intrawave_v1,1.0,-1.0,-1.0
304,240,7168,2048,121,0,15.8636,a8w8_bpreshuffle_256x64x128x256_16x16_16x16_16x16x1_16x16x1_1x16x1x16_8x8x1_1x2_intrawave_v3,444.19,1173.27,0.0
304,240,7168,2304,122,0,-1.0,a8w8_bpreshuffle_256x80x128x256_16x16_16x16_16x16x1_16x16x1_1x16x1x16_8x8x1_1x2_intrawave_v3,1.0,-1.0,-1.0
304,248,192,7168,11,0,-1.0,a8w8_bpreshuffle_256x16x64x512_16x16_16x16_32x8x1_32x8x1_1x16x1x16_4x4x1_1x1_intrawave_v1,1.0,-1.0,-1.0
304,248,512,7168,11,0,-1.0,a8w8_bpreshuffle_256x16x64x512_16x16_16x16_32x8x1_32x8x1_1x16x1x16_4x4x1_1x1_intrawave_v1,1.0,-1.0,-1.0
304,248,576,7168,11,0,10.9147,a8w8_bpreshuffle_256x16x64x512_16x16_16x16_32x8x1_32x8x1_1x16x1x16_4x4x1_1x1_intrawave_v1,187.62,567.32,0.0
304,248,896,5120,5,0,-1.0,a8w8_bpreshuffle_256x16x64x512_16x16_16x16_32x8x1_32x8x1_1x16x1x16_4x4x1_1x1_intrawave_v1,1.0,-1.0,-1.0
304,248,1024,5632,19,0,-1.0,a8w8_bpreshuffle_256x16x64x512_16x16_16x16_32x8x1_32x8x1_1x16x1x16_4x4x1_1x1_intrawave_v2,1.0,-1.0,-1.0
304,248,1056,1408,23,0,-1.0,a8w8_bpreshuffle_128x16x32x128_16x16_16x16_8x16x1_8x16x1_1x16x1x8_4x4x1_1x1_intrawave_v2,1.0,-1.0,-1.0
304,248,1280,4096,12,0,-1.0,a8w8_bpreshuffle_256x32x64x512_16x16_16x16_32x8x1_32x8x1_1x32x1x8_8x8x1_1x2_intrawave_v1,1.0,-1.0,-1.0
304,248,1408,352,0,0,-1.0,a8w8_bpreshuffle_256x128x128x128_16x16_16x16_8x32x1_8x32x1_1x32x1x8_8x8x1_2x1_intrawave_v3,1.0,-1.0,-1.0
304,248,1408,1408,76,0,-1.0,a8w8_bpreshuffle_256x32x64x128_16x16_16x16_8x32x1_8x32x1_1x32x1x8_8x8x1_2x1_intrawave_v1,1.0,-1.0,-1.0
304,248,1536,2048,12,0,-1.0,a8w8_bpreshuffle_256x32x64x512_16x16_16x16_32x8x1_32x8x1_1x32x1x8_8x8x1_1x2_intrawave_v1,1.0,-1.0,-1.0
304,248,1536,7168,12,0,17.8305,a8w8_bpreshuffle_256x32x64x512_16x16_16x16_32x8x1_32x8x1_1x32x1x8_8x8x1_1x2_intrawave_v1,306.27,759.91,0.0
304,248,1792,6144,12,0,-1.0,a8w8_bpreshuffle_256x32x64x512_16x16_16x16_32x8x1_32x8x1_1x32x1x8_8x8x1_1x2_intrawave_v1,1.0,-1.0,-1.0
304,248,2048,1536,112,0,-1.0,a8w8_bpreshuffle_256x32x64x256_16x16_16x16_16x16x1_16x16x1_1x32x1x8_8x8x1_2x1_intrawave_v1,1.0,-1.0,-1.0
304,248,2048,6144,12,0,-1.0,a8w8_bpreshuffle_256x32x64x512_16x16_16x16_32x8x1_32x8x1_1x32x1x8_8x8x1_1x2_intrawave_v1,1.0,-1.0,-1.0
304,248,2112,7168,12,0,20.1167,a8w8_bpreshuffle_256x32x64x512_16x16_16x16_32x8x1_32x8x1_1x32x1x8_8x8x1_1x2_intrawave_v1,373.26,892.99,0.0
304,248,3072,1536,119,0,8.4343,a8w8_bpreshuffle_256x32x128x256_16x16_16x16_16x16x1_16x16x1_1x16x1x16_8x8x1_1x2_intrawave_v1,277.49,785.27,0.0
304,248,3072,4096,119,0,-1.0,a8w8_bpreshuffle_256x32x128x256_16x16_16x16_16x16x1_16x16x1_1x16x1x16_8x8x1_1x2_intrawave_v1,1.0,-1.0,-1.0
304,248,3584,6144,114,0,-1.0,a8w8_bpreshuffle_256x64x64x256_16x16_16x16_16x16x1_16x16x1_1x32x1x8_8x8x1_2x1_intrawave_v3,1.0,-1.0,-1.0
304,248,4096,512,76,0,5.6131,a8w8_bpreshuffle_256x32x64x128_16x16_16x16_8x32x1_8x32x1_1x32x1x8_8x8x1_2x1_intrawave_v1,185.31,758.18,0.0
304,248,4096,640,76,0,-1.0,a8w8_bpreshuffle_256x32x64x128_16x16_16x16_8x32x1_8x32x1_1x32x1x8_8x8x1_2x1_intrawave_v1,1.0,-1.0,-1.0
304,248,4096,1024,119,0,-1.0,a8w8_bpreshuffle_256x32x128x256_16x16_16x16_16x16x1_16x16x1_1x16x1x16_8x8x1_1x2_intrawave_v1,1.0,-1.0,-1.0
304,248,4096,3072,119,0,-1.0,a8w8_bpreshuffle_256x32x128x256_16x16_16x16_16x16x1_16x16x1_1x16x1x16_8x8x1_1x2_intrawave_v1,1.0,-1.0,-1.0
304,248,4608,7168,114,0,31.4189,a8w8_bpreshuffle_256x64x64x256_16x16_16x16_16x16x1_16x16x1_1x32x1x8_8x8x1_2x1_intrawave_v3,521.44,1180.61,0.0
304,248,5120,640,84,0,-1.0,a8w8_bpreshuffle_256x32x128x128_16x16_16x16_8x32x1_8x32x1_1x32x1x8_8x8x1_2x1_intrawave_v1,1.0,-1.0,-1.0
304,248,5120,2048,120,0,-1.0,a8w8_bpreshuffle_256x48x128x256_16x16_16x16_16x16x1_16x16x1_1x16x1x16_8x8x1_1x2_intrawave_v1,1.0,-1.0,-1.0
304,248,6144,768,126,0,-1.0,a8w8_bpreshuffle_256x32x192x256_16x16_16x16_16x16x1_16x16x1_1x32x1x8_8x8x1_2x1_intrawave_v1,1.0,-1.0,-1.0
304,248,6144,1024,126,0,-1.0,a8w8_bpreshuffle_256x32x192x256_16x16_16x16_16x16x1_16x16x1_1x32x1x8_8x8x1_2x1_intrawave_v1,1.0,-1.0,-1.0
304,248,6144,1536,126,0,-1.0,a8w8_bpreshuffle_256x32x192x256_16x16_16x16_16x16x1_16x16x1_1x32x1x8_8x8x1_2x1_intrawave_v1,1.0,-1.0,-1.0
304,248,6144,2048,120,0,-1.0,a8w8_bpreshuffle_256x48x128x256_16x16_16x16_16x16x1_16x16x1_1x16x1x16_8x8x1_1x2_intrawave_v1,1.0,-1.0,-1.0
304,248,7168,256,75,0,-1.0,a8w8_bpreshuffle_128x16x256x64_16x16_16x16_4x16x1_4x32x1_1x16x1x8_8x8x1_1x2_intrawave_v1,1.0,-1.0,-1.0
304,248,7168,2048,121,0,15.8077,a8w8_bpreshuffle_256x64x128x256_16x16_16x16_16x16x1_16x16x1_1x16x1x16_8x8x1_1x2_intrawave_v3,460.62,1185.71,0.0
304,248,7168,2304,114,0,-1.0,a8w8_bpreshuffle_256x64x64x256_16x16_16x16_16x16x1_16x16x1_1x32x1x8_8x8x1_2x1_intrawave_v3,1.0,-1.0,-1.0
304,256,192,7168,24,0,-1.0,a8w8_bpreshuffle_128x16x32x512_16x16_16x16_32x4x1_32x4x1_1x16x1x8_4x4x1_1x1_intrawave_v2,1.0,-1.0,-1.0
304,256,512,7168,5,0,-1.0,a8w8_bpreshuffle_256x16x64x512_16x16_16x16_32x8x1_32x8x1_1x16x1x16_4x4x1_1x1_intrawave_v1,1.0,-1.0,-1.0
304,256,576,7168,10,0,10.5821,a8w8_bpreshuffle_128x16x32x512_16x16_16x16_32x4x1_32x4x1_1x16x1x8_4x4x1_1x1_intrawave_v1,199.76,591.44,0.0
304,256,896,5120,5,0,-1.0,a8w8_bpreshuffle_256x16x64x512_16x16_16x16_32x8x1_32x8x1_1x16x1x16_4x4x1_1x1_intrawave_v1,1.0,-1.0,-1.0
304,256,1024,5632,5,0,-1.0,a8w8_bpreshuffle_256x16x64x512_16x16_16x16_32x8x1_32x8x1_1x16x1x16_4x4x1_1x1_intrawave_v1,1.0,-1.0,-1.0
304,256,1056,1408,23,0,-1.0,a8w8_bpreshuffle_128x16x32x128_16x16_16x16_8x16x1_8x16x1_1x16x1x8_4x4x1_1x1_intrawave_v2,1.0,-1.0,-1.0
304,256,1280,4096,12,0,-1.0,a8w8_bpreshuffle_256x32x64x512_16x16_16x16_32x8x1_32x8x1_1x32x1x8_8x8x1_1x2_intrawave_v1,1.0,-1.0,-1.0
304,256,1408,352,0,0,-1.0,a8w8_bpreshuffle_256x128x128x128_16x16_16x16_8x32x1_8x32x1_1x32x1x8_8x8x1_2x1_intrawave_v3,1.0,-1.0,-1.0
304,256,1408,1408,76,0,-1.0,a8w8_bpreshuffle_256x32x64x128_16x16_16x16_8x32x1_8x32x1_1x32x1x8_8x8x1_2x1_intrawave_v1,1.0,-1.0,-1.0
304,256,1536,2048,12,0,-1.0,a8w8_bpreshuffle_256x32x64x512_16x16_16x16_32x8x1_32x8x1_1x32x1x8_8x8x1_1x2_intrawave_v1,1.0,-1.0,-1.0
304,256,1536,7168,112,0,17.2445,a8w8_bpreshuffle_256x32x64x256_16x16_16x16_16x16x1_16x16x1_1x32x1x8_8x8x1_2x1_intrawave_v1,326.9,790.48,0.0
304,256,1792,6144,12,0,-1.0,a8w8_bpreshuffle_256x32x64x512_16x16_16x16_32x8x1_32x8x1_1x32x1x8_8x8x1_1x2_intrawave_v1,1.0,-1.0,-1.0
304,256,2048,1536,112,0,-1.0,a8w8_bpreshuffle_256x32x64x256_16x16_16x16_16x16x1_16x16x1_1x32x1x8_8x8x1_2x1_intrawave_v1,1.0,-1.0,-1.0
304,256,2048,6144,114,0,-1.0,a8w8_bpreshuffle_256x64x64x256_16x16_16x16_16x16x1_16x16x1_1x32x1x8_8x8x1_2x1_intrawave_v3,1.0,-1.0,-1.0
304,256,2112,7168,12,0,19.8447,a8w8_bpreshuffle_256x32x64x512_16x16_16x16_32x8x1_32x8x1_1x32x1x8_8x8x1_1x2_intrawave_v1,390.59,909.82,0.0
304,256,3072,1536,119,0,8.5506,a8w8_bpreshuffle_256x32x128x256_16x16_16x16_16x16x1_16x16x1_1x16x1x16_8x8x1_1x2_intrawave_v1,282.54,781.78,0.0
304,256,3072,4096,114,0,-1.0,a8w8_bpreshuffle_256x64x64x256_16x16_16x16_16x16x1_16x16x1_1x32x1x8_8x8x1_2x1_intrawave_v3,1.0,-1.0,-1.0
304,256,3584,6144,114,0,-1.0,a8w8_bpreshuffle_256x64x64x256_16x16_16x16_16x16x1_16x16x1_1x32x1x8_8x8x1_2x1_intrawave_v3,1.0,-1.0,-1.0
304,256,4096,512,76,0,5.6674,a8w8_bpreshuffle_256x32x64x128_16x16_16x16_8x32x1_8x32x1_1x32x1x8_8x8x1_2x1_intrawave_v1,189.46,763.2,0.0
304,256,4096,640,76,0,-1.0,a8w8_bpreshuffle_256x32x64x128_16x16_16x16_8x32x1_8x32x1_1x32x1x8_8x8x1_2x1_intrawave_v1,1.0,-1.0,-1.0
304,256,4096,1024,119,0,-1.0,a8w8_bpreshuffle_256x32x128x256_16x16_16x16_16x16x1_16x16x1_1x16x1x16_8x8x1_1x2_intrawave_v1,1.0,-1.0,-1.0
304,256,4096,3072,119,0,-1.0,a8w8_bpreshuffle_256x32x128x256_16x16_16x16_16x16x1_16x16x1_1x16x1x16_8x8x1_1x2_intrawave_v1,1.0,-1.0,-1.0
304,256,4608,7168,114,0,30.0951,a8w8_bpreshuffle_256x64x64x256_16x16_16x16_16x16x1_16x16x1_1x32x1x8_8x8x1_2x1_intrawave_v3,561.93,1236.89,0.0
304,256,5120,640,84,0,-1.0,a8w8_bpreshuffle_256x32x128x128_16x16_16x16_8x32x1_8x32x1_1x32x1x8_8x8x1_2x1_intrawave_v1,1.0,-1.0,-1.0
304,256,5120,2048,120,0,-1.0,a8w8_bpreshuffle_256x48x128x256_16x16_16x16_16x16x1_16x16x1_1x16x1x16_8x8x1_1x2_intrawave_v1,1.0,-1.0,-1.0
304,256,6144,768,76,0,-1.0,a8w8_bpreshuffle_256x32x64x128_16x16_16x16_8x32x1_8x32x1_1x32x1x8_8x8x1_2x1_intrawave_v1,1.0,-1.0,-1.0
304,256,6144,1024,126,0,-1.0,a8w8_bpreshuffle_256x32x192x256_16x16_16x16_16x16x1_16x16x1_1x32x1x8_8x8x1_2x1_intrawave_v1,1.0,-1.0,-1.0
304,256,6144,1536,126,0,-1.0,a8w8_bpreshuffle_256x32x192x256_16x16_16x16_16x16x1_16x16x1_1x32x1x8_8x8x1_2x1_intrawave_v1,1.0,-1.0,-1.0
304,256,6144,2048,126,0,-1.0,a8w8_bpreshuffle_256x32x192x256_16x16_16x16_16x16x1_16x16x1_1x32x1x8_8x8x1_2x1_intrawave_v1,1.0,-1.0,-1.0
304,256,7168,256,75,0,-1.0,a8w8_bpreshuffle_128x16x256x64_16x16_16x16_4x16x1_4x32x1_1x16x1x8_8x8x1_1x2_intrawave_v1,1.0,-1.0,-1.0
304,256,7168,2048,121,0,15.9204,a8w8_bpreshuffle_256x64x128x256_16x16_16x16_16x16x1_16x16x1_1x16x1x16_8x8x1_1x2_intrawave_v3,472.11,1185.55,0.0
304,256,7168,2304,114,0,-1.0,a8w8_bpreshuffle_256x64x64x256_16x16_16x16_16x16x1_16x16x1_1x32x1x8_8x8x1_2x1_intrawave_v3,1.0,-1.0,-1.0
304,264,192,7168,11,0,-1.0,a8w8_bpreshuffle_256x16x64x512_16x16_16x16_32x8x1_32x8x1_1x16x1x16_4x4x1_1x1_intrawave_v1,1.0,-1.0,-1.0
304,264,512,7168,5,0,-1.0,a8w8_bpreshuffle_256x16x64x512_16x16_16x16_32x8x1_32x8x1_1x16x1x16_4x4x1_1x1_intrawave_v1,1.0,-1.0,-1.0
304,264,576,7168,11,0,11.1081,a8w8_bpreshuffle_256x16x64x512_16x16_16x16_32x8x1_32x8x1_1x16x1x16_4x4x1_1x1_intrawave_v1,196.25,569.43,0.0
304,264,896,5120,11,0,-1.0,a8w8_bpreshuffle_256x16x64x512_16x16_16x16_32x8x1_32x8x1_1x16x1x16_4x4x1_1x1_intrawave_v1,1.0,-1.0,-1.0
304,264,1024,5632,5,0,-1.0,a8w8_bpreshuffle_256x16x64x512_16x16_16x16_32x8x1_32x8x1_1x16x1x16_4x4x1_1x1_intrawave_v1,1.0,-1.0,-1.0
304,264,1056,1408,23,0,-1.0,a8w8_bpreshuffle_128x16x32x128_16x16_16x16_8x16x1_8x16x1_1x16x1x8_4x4x1_1x1_intrawave_v2,1.0,-1.0,-1.0
304,264,1280,4096,12,0,-1.0,a8w8_bpreshuffle_256x32x64x512_16x16_16x16_32x8x1_32x8x1_1x32x1x8_8x8x1_1x2_intrawave_v1,1.0,-1.0,-1.0
304,264,1408,352,0,0,-1.0,a8w8_bpreshuffle_256x128x128x128_16x16_16x16_8x32x1_8x32x1_1x32x1x8_8x8x1_2x1_intrawave_v3,1.0,-1.0,-1.0
304,264,1408,1408,9,0,-1.0,a8w8_bpreshuffle_128x16x32x128_16x16_16x16_8x16x1_8x16x1_1x16x1x8_4x4x1_1x1_intrawave_v1,1.0,-1.0,-1.0
304,264,1536,2048,112,0,-1.0,a8w8_bpreshuffle_256x32x64x256_16x16_16x16_16x16x1_16x16x1_1x32x1x8_8x8x1_2x1_intrawave_v1,1.0,-1.0,-1.0
304,264,1536,7168,12,0,19.3595,a8w8_bpreshuffle_256x32x64x512_16x16_16x16_32x8x1_32x8x1_1x32x1x8_8x8x1_1x2_intrawave_v1,300.28,708.36,0.0
304,264,1792,6144,12,0,-1.0,a8w8_bpreshuffle_256x32x64x512_16x16_16x16_32x8x1_32x8x1_1x32x1x8_8x8x1_1x2_intrawave_v1,1.0,-1.0,-1.0
304,264,2048,1536,119,0,-1.0,a8w8_bpreshuffle_256x32x128x256_16x16_16x16_16x16x1_16x16x1_1x16x1x16_8x8x1_1x2_intrawave_v1,1.0,-1.0,-1.0
304,264,2048,6144,12,0,-1.0,a8w8_bpreshuffle_256x32x64x512_16x16_16x16_32x8x1_32x8x1_1x32x1x8_8x8x1_1x2_intrawave_v1,1.0,-1.0,-1.0
304,264,2112,7168,113,0,22.7612,a8w8_bpreshuffle_256x48x64x256_16x16_16x16_16x16x1_16x16x1_1x16x1x16_4x4x1_1x1_intrawave_v1,351.18,797.25,0.0
304,264,3072,1536,113,0,8.9307,a8w8_bpreshuffle_256x48x64x256_16x16_16x16_16x16x1_16x16x1_1x16x1x16_4x4x1_1x1_intrawave_v1,278.97,755.38,0.0
304,264,3072,4096,116,0,-1.0,a8w8_bpreshuffle_256x96x64x256_16x16_16x16_16x16x1_16x16x1_1x32x1x8_8x8x1_2x1_intrawave_v3,1.0,-1.0,-1.0
304,264,3584,6144,120,0,-1.0,a8w8_bpreshuffle_256x48x128x256_16x16_16x16_16x16x1_16x16x1_1x16x1x16_8x8x1_1x2_intrawave_v1,1.0,-1.0,-1.0
304,264,4096,512,76,0,6.0075,a8w8_bpreshuffle_256x32x64x128_16x16_16x16_8x32x1_8x32x1_1x32x1x8_8x8x1_2x1_intrawave_v1,184.32,731.59,0.0
304,264,4096,640,84,0,-1.0,a8w8_bpreshuffle_256x32x128x128_16x16_16x16_8x32x1_8x32x1_1x32x1x8_8x8x1_2x1_intrawave_v1,1.0,-1.0,-1.0
304,264,4096,1024,120,0,-1.0,a8w8_bpreshuffle_256x48x128x256_16x16_16x16_16x16x1_16x16x1_1x16x1x16_8x8x1_1x2_intrawave_v1,1.0,-1.0,-1.0
304,264,4096,3072,120,0,-1.0,a8w8_bpreshuffle_256x48x128x256_16x16_16x16_16x16x1_16x16x1_1x16x1x16_8x8x1_1x2_intrawave_v1,1.0,-1.0,-1.0
304,264,4608,7168,120,0,35.2402,a8w8_bpreshuffle_256x48x128x256_16x16_16x16_16x16x1_16x16x1_1x16x1x16_8x8x1_1x2_intrawave_v1,494.89,1060.03,0.0
304,264,5120,640,78,0,-1.0,a8w8_bpreshuffle_256x96x64x128_16x16_16x16_8x32x1_8x32x1_1x32x1x8_8x8x1_2x1_intrawave_v3,1.0,-1.0,-1.0
304,264,5120,2048,120,0,-1.0,a8w8_bpreshuffle_256x48x128x256_16x16_16x16_16x16x1_16x16x1_1x16x1x16_8x8x1_1x2_intrawave_v1,1.0,-1.0,-1.0
304,264,6144,768,120,0,-1.0,a8w8_bpreshuffle_256x48x128x256_16x16_16x16_16x16x1_16x16x1_1x16x1x16_8x8x1_1x2_intrawave_v1,1.0,-1.0,-1.0
304,264,6144,1024,120,0,-1.0,a8w8_bpreshuffle_256x48x128x256_16x16_16x16_16x16x1_16x16x1_1x16x1x16_8x8x1_1x2_intrawave_v1,1.0,-1.0,-1.0
304,264,6144,1536,120,0,-1.0,a8w8_bpreshuffle_256x48x128x256_16x16_16x16_16x16x1_16x16x1_1x16x1x16_8x8x1_1x2_intrawave_v1,1.0,-1.0,-1.0
304,264,6144,2048,120,0,-1.0,a8w8_bpreshuffle_256x48x128x256_16x16_16x16_16x16x1_16x16x1_1x16x1x16_8x8x1_1x2_intrawave_v1,1.0,-1.0,-1.0
304,264,7168,256,75,0,-1.0,a8w8_bpreshuffle_128x16x256x64_16x16_16x16_4x16x1_4x32x1_1x16x1x8_8x8x1_1x2_intrawave_v1,1.0,-1.0,-1.0
304,264,7168,2048,122,0,18.5508,a8w8_bpreshuffle_256x80x128x256_16x16_16x16_16x16x1_16x16x1_1x16x1x16_8x8x1_1x2_intrawave_v3,417.83,1024.51,0.0
304,264,7168,2304,123,0,-1.0,a8w8_bpreshuffle_256x96x128x256_16x16_16x16_16x16x1_16x16x1_1x16x1x16_8x8x1_1x2_intrawave_v3,1.0,-1.0,-1.0
304,272,192,7168,24,0,-1.0,a8w8_bpreshuffle_128x16x32x512_16x16_16x16_32x4x1_32x4x1_1x16x1x8_4x4x1_1x1_intrawave_v2,1.0,-1.0,-1.0
304,272,512,7168,5,0,-1.0,a8w8_bpreshuffle_256x16x64x512_16x16_16x16_32x8x1_32x8x1_1x16x1x16_4x4x1_1x1_intrawave_v1,1.0,-1.0,-1.0
304,272,576,7168,10,0,10.9373,a8w8_bpreshuffle_128x16x32x512_16x16_16x16_32x4x1_32x4x1_1x16x1x8_4x4x1_1x1_intrawave_v1,205.36,584.4,0.0
304,272,896,5120,5,0,10.2858,a8w8_bpreshuffle_256x16x64x512_16x16_16x16_32x8x1_32x8x1_1x16x1x16_4x4x1_1x1_intrawave_v1,0.0,242.63,628.79
304,272,1024,5632,11,0,12.3907,a8w8_bpreshuffle_256x16x64x512_16x16_16x16_32x8x1_32x8x1_1x16x1x16_4x4x1_1x1_intrawave_v1,0.0,253.2,634.03
304,272,1056,1408,23,0,6.973,a8w8_bpreshuffle_128x16x32x128_16x16_16x16_8x16x1_8x16x1_1x16x1x8_4x4x1_1x1_intrawave_v2,0.0,116.0,350.54
304,272,1280,4096,12,0,11.4315,a8w8_bpreshuffle_256x32x64x512_16x16_16x16_32x8x1_32x8x1_1x32x1x8_8x8x1_1x2_intrawave_v1,0.0,249.5,617.01
304,272,1408,352,0,0,-1.0,a8w8_bpreshuffle_256x128x128x128_16x16_16x16_8x32x1_8x32x1_1x32x1x8_8x8x1_2x1_intrawave_v3,1.0,-1.0,-1.0
304,272,1408,1408,9,0,-1.0,a8w8_bpreshuffle_128x16x32x128_16x16_16x16_8x16x1_8x16x1_1x16x1x8_4x4x1_1x1_intrawave_v1,1.0,-1.0,-1.0
304,272,1536,2048,12,0,-1.0,a8w8_bpreshuffle_256x32x64x512_16x16_16x16_32x8x1_32x8x1_1x32x1x8_8x8x1_1x2_intrawave_v1,1.0,-1.0,-1.0
304,272,1536,7168,12,0,18.8173,a8w8_bpreshuffle_256x32x64x512_16x16_16x16_32x8x1_32x8x1_1x32x1x8_8x8x1_1x2_intrawave_v1,318.3,733.12,0.0
304,272,1792,6144,12,0,-1.0,a8w8_bpreshuffle_256x32x64x512_16x16_16x16_32x8x1_32x8x1_1x32x1x8_8x8x1_1x2_intrawave_v1,1.0,-1.0,-1.0
304,272,2048,1536,119,0,-1.0,a8w8_bpreshuffle_256x32x128x256_16x16_16x16_16x16x1_16x16x1_1x16x1x16_8x8x1_1x2_intrawave_v1,1.0,-1.0,-1.0
304,272,2048,6144,12,0,-1.0,a8w8_bpreshuffle_256x32x64x512_16x16_16x16_32x8x1_32x8x1_1x32x1x8_8x8x1_1x2_intrawave_v1,1.0,-1.0,-1.0
304,272,2112,7168,113,0,22.8725,a8w8_bpreshuffle_256x48x64x256_16x16_16x16_16x16x1_16x16x1_1x16x1x16_4x4x1_1x1_intrawave_v1,360.06,797.35,0.0
304,272,3072,1536,113,0,9.0711,a8w8_bpreshuffle_256x48x64x256_16x16_16x16_16x16x1_16x16x1_1x16x1x16_4x4x1_1x1_intrawave_v1,282.98,750.47,0.0
304,272,3072,4096,114,0,-1.0,a8w8_bpreshuffle_256x64x64x256_16x16_16x16_16x16x1_16x16x1_1x32x1x8_8x8x1_2x1_intrawave_v3,1.0,-1.0,-1.0
304,272,3584,6144,120,0,-1.0,a8w8_bpreshuffle_256x48x128x256_16x16_16x16_16x16x1_16x16x1_1x16x1x16_8x8x1_1x2_intrawave_v1,1.0,-1.0,-1.0
304,272,4096,512,76,0,6.0328,a8w8_bpreshuffle_256x32x64x128_16x16_16x16_8x32x1_8x32x1_1x32x1x8_8x8x1_2x1_intrawave_v1,189.11,740.06,0.0
304,272,4096,640,76,0,6.71,a8w8_bpreshuffle_256x32x64x128_16x16_16x16_8x32x1_8x32x1_1x32x1x8_8x8x1_2x1_intrawave_v1,0.0,212.53,748.7
304,272,4096,1024,120,0,-1.0,a8w8_bpreshuffle_256x48x128x256_16x16_16x16_16x16x1_16x16x1_1x16x1x16_8x8x1_1x2_intrawave_v1,1.0,-1.0,-1.0
304,272,4096,3072,120,0,-1.0,a8w8_bpreshuffle_256x48x128x256_16x16_16x16_16x16x1_16x16x1_1x16x1x16_8x8x1_1x2_intrawave_v1,1.0,-1.0,-1.0
304,272,4608,7168,120,0,34.7939,a8w8_bpreshuffle_256x48x128x256_16x16_16x16_16x16x1_16x16x1_1x16x1x16_8x8x1_1x2_intrawave_v1,516.42,1077.39,0.0
304,272,5120,640,78,0,7.797,a8w8_bpreshuffle_256x96x64x128_16x16_16x16_8x32x1_8x32x1_1x32x1x8_8x8x1_2x1_intrawave_v3,0.0,228.62,799.82
304,272,5120,2048,120,0,13.5295,a8w8_bpreshuffle_256x48x128x256_16x16_16x16_16x16x1_16x16x1_1x16x1x16_8x8x1_1x2_intrawave_v1,0.0,421.62,1022.07
304,272,6144,768,120,0,-1.0,a8w8_bpreshuffle_256x48x128x256_16x16_16x16_16x16x1_16x16x1_1x16x1x16_8x8x1_1x2_intrawave_v1,1.0,-1.0,-1.0
304,272,6144,1024,120,0,-1.0,a8w8_bpreshuffle_256x48x128x256_16x16_16x16_16x16x1_16x16x1_1x16x1x16_8x8x1_1x2_intrawave_v1,1.0,-1.0,-1.0
304,272,6144,1536,120,0,-1.0,a8w8_bpreshuffle_256x48x128x256_16x16_16x16_16x16x1_16x16x1_1x16x1x16_8x8x1_1x2_intrawave_v1,1.0,-1.0,-1.0
304,272,6144,2048,120,0,-1.0,a8w8_bpreshuffle_256x48x128x256_16x16_16x16_16x16x1_16x16x1_1x16x1x16_8x8x1_1x2_intrawave_v1,1.0,-1.0,-1.0
304,272,7168,256,75,0,-1.0,a8w8_bpreshuffle_128x16x256x64_16x16_16x16_4x16x1_4x32x1_1x16x1x8_8x8x1_1x2_intrawave_v1,1.0,-1.0,-1.0
304,272,7168,2048,122,0,18.8029,a8w8_bpreshuffle_256x80x128x256_16x16_16x16_16x16x1_16x16x1_1x16x1x16_8x8x1_1x2_intrawave_v3,424.72,1017.74,0.0
304,272,7168,2304,122,0,-1.0,a8w8_bpreshuffle_256x80x128x256_16x16_16x16_16x16x1_16x16x1_1x16x1x16_8x8x1_1x2_intrawave_v3,1.0,-1.0,-1.0
304,280,192,7168,5,0,-1.0,a8w8_bpreshuffle_256x16x64x512_16x16_16x16_32x8x1_32x8x1_1x16x1x16_4x4x1_1x1_intrawave_v1,1.0,-1.0,-1.0
304,280,512,7168,5,0,-1.0,a8w8_bpreshuffle_256x16x64x512_16x16_16x16_32x8x1_32x8x1_1x16x1x16_4x4x1_1x1_intrawave_v1,1.0,-1.0,-1.0
304,280,576,7168,11,0,11.6371,a8w8_bpreshuffle_256x16x64x512_16x16_16x16_32x8x1_32x8x1_1x16x1x16_4x4x1_1x1_intrawave_v1,198.68,554.98,0.0
304,280,896,5120,5,0,-1.0,a8w8_bpreshuffle_256x16x64x512_16x16_16x16_32x8x1_32x8x1_1x16x1x16_4x4x1_1x1_intrawave_v1,1.0,-1.0,-1.0
304,280,1024,5632,5,0,-1.0,a8w8_bpreshuffle_256x16x64x512_16x16_16x16_32x8x1_32x8x1_1x16x1x16_4x4x1_1x1_intrawave_v1,1.0,-1.0,-1.0
304,280,1056,1408,23,0,-1.0,a8w8_bpreshuffle_128x16x32x128_16x16_16x16_8x16x1_8x16x1_1x16x1x8_4x4x1_1x1_intrawave_v2,1.0,-1.0,-1.0
304,280,1280,4096,12,0,-1.0,a8w8_bpreshuffle_256x32x64x512_16x16_16x16_32x8x1_32x8x1_1x32x1x8_8x8x1_1x2_intrawave_v1,1.0,-1.0,-1.0
304,280,1408,352,0,0,-1.0,a8w8_bpreshuffle_256x128x128x128_16x16_16x16_8x32x1_8x32x1_1x32x1x8_8x8x1_2x1_intrawave_v3,1.0,-1.0,-1.0
304,280,1408,1408,9,0,-1.0,a8w8_bpreshuffle_128x16x32x128_16x16_16x16_8x16x1_8x16x1_1x16x1x8_4x4x1_1x1_intrawave_v1,1.0,-1.0,-1.0
304,280,1536,2048,12,0,-1.0,a8w8_bpreshuffle_256x32x64x512_16x16_16x16_32x8x1_32x8x1_1x32x1x8_8x8x1_1x2_intrawave_v1,1.0,-1.0,-1.0
304,280,1536,7168,12,0,19.0751,a8w8_bpreshuffle_256x32x64x512_16x16_16x16_32x8x1_32x8x1_1x32x1x8_8x8x1_1x2_intrawave_v1,323.23,727.51,0.0
304,280,1792,6144,12,0,-1.0,a8w8_bpreshuffle_256x32x64x512_16x16_16x16_32x8x1_32x8x1_1x32x1x8_8x8x1_1x2_intrawave_v1,1.0,-1.0,-1.0
304,280,2048,1536,113,0,-1.0,a8w8_bpreshuffle_256x48x64x256_16x16_16x16_16x16x1_16x16x1_1x16x1x16_4x4x1_1x1_intrawave_v1,1.0,-1.0,-1.0
304,280,2048,6144,12,0,-1.0,a8w8_bpreshuffle_256x32x64x512_16x16_16x16_32x8x1_32x8x1_1x32x1x8_8x8x1_1x2_intrawave_v1,1.0,-1.0,-1.0
304,280,2112,7168,113,0,22.6474,a8w8_bpreshuffle_256x48x64x256_16x16_16x16_16x16x1_16x16x1_1x16x1x16_4x4x1_1x1_intrawave_v1,374.34,809.3,0.0
304,280,3072,1536,113,0,9.0942,a8w8_bpreshuffle_256x48x64x256_16x16_16x16_16x16x1_16x16x1_1x16x1x16_4x4x1_1x1_intrawave_v1,290.56,755.32,0.0
304,280,3072,4096,113,0,-1.0,a8w8_bpreshuffle_256x48x64x256_16x16_16x16_16x16x1_16x16x1_1x16x1x16_4x4x1_1x1_intrawave_v1,1.0,-1.0,-1.0
304,280,3584,6144,120,0,-1.0,a8w8_bpreshuffle_256x48x128x256_16x16_16x16_16x16x1_16x16x1_1x16x1x16_8x8x1_1x2_intrawave_v1,1.0,-1.0,-1.0
304,280,4096,512,76,0,6.0012,a8w8_bpreshuffle_256x32x64x128_16x16_16x16_8x32x1_8x32x1_1x32x1x8_8x8x1_2x1_intrawave_v1,195.7,755.56,0.0
304,280,4096,640,84,0,-1.0,a8w8_bpreshuffle_256x32x128x128_16x16_16x16_8x32x1_8x32x1_1x32x1x8_8x8x1_2x1_intrawave_v1,1.0,-1.0,-1.0
304,280,4096,1024,120,0,-1.0,a8w8_bpreshuffle_256x48x128x256_16x16_16x16_16x16x1_16x16x1_1x16x1x16_8x8x1_1x2_intrawave_v1,1.0,-1.0,-1.0
304,280,4096,3072,120,0,-1.0,a8w8_bpreshuffle_256x48x128x256_16x16_16x16_16x16x1_16x16x1_1x16x1x16_8x8x1_1x2_intrawave_v1,1.0,-1.0,-1.0
304,280,4608,7168,120,0,34.6266,a8w8_bpreshuffle_256x48x128x256_16x16_16x16_16x16x1_16x16x1_1x16x1x16_8x8x1_1x2_intrawave_v1,534.18,1086.38,0.0
304,280,5120,640,78,0,-1.0,a8w8_bpreshuffle_256x96x64x128_16x16_16x16_8x32x1_8x32x1_1x32x1x8_8x8x1_2x1_intrawave_v3,1.0,-1.0,-1.0
304,280,5120,2048,120,0,-1.0,a8w8_bpreshuffle_256x48x128x256_16x16_16x16_16x16x1_16x16x1_1x16x1x16_8x8x1_1x2_intrawave_v1,1.0,-1.0,-1.0
304,280,6144,768,120,0,-1.0,a8w8_bpreshuffle_256x48x128x256_16x16_16x16_16x16x1_16x16x1_1x16x1x16_8x8x1_1x2_intrawave_v1,1.0,-1.0,-1.0
304,280,6144,1024,120,0,-1.0,a8w8_bpreshuffle_256x48x128x256_16x16_16x16_16x16x1_16x16x1_1x16x1x16_8x8x1_1x2_intrawave_v1,1.0,-1.0,-1.0
304,280,6144,1536,120,0,-1.0,a8w8_bpreshuffle_256x48x128x256_16x16_16x16_16x16x1_16x16x1_1x16x1x16_8x8x1_1x2_intrawave_v1,1.0,-1.0,-1.0
304,280,6144,2048,120,0,-1.0,a8w8_bpreshuffle_256x48x128x256_16x16_16x16_16x16x1_16x16x1_1x16x1x16_8x8x1_1x2_intrawave_v1,1.0,-1.0,-1.0
304,280,7168,256,75,0,-1.0,a8w8_bpreshuffle_128x16x256x64_16x16_16x16_4x16x1_4x32x1_1x16x1x8_8x8x1_1x2_intrawave_v1,1.0,-1.0,-1.0
304,280,7168,2048,122,0,18.8448,a8w8_bpreshuffle_256x80x128x256_16x16_16x16_16x16x1_16x16x1_1x16x1x16_8x8x1_1x2_intrawave_v3,436.24,1022.44,0.0
304,280,7168,2304,123,0,-1.0,a8w8_bpreshuffle_256x96x128x256_16x16_16x16_16x16x1_16x16x1_1x16x1x16_8x8x1_1x2_intrawave_v3,1.0,-1.0,-1.0
304,288,192,7168,24,0,-1.0,a8w8_bpreshuffle_128x16x32x512_16x16_16x16_32x4x1_32x4x1_1x16x1x8_4x4x1_1x1_intrawave_v2,1.0,-1.0,-1.0
304,288,512,7168,5,0,-1.0,a8w8_bpreshuffle_256x16x64x512_16x16_16x16_32x8x1_32x8x1_1x16x1x16_4x4x1_1x1_intrawave_v1,1.0,-1.0,-1.0
304,288,576,7168,11,0,10.9145,a8w8_bpreshuffle_256x16x64x512_16x16_16x16_32x8x1_32x8x1_1x16x1x16_4x4x1_1x1_intrawave_v1,217.89,597.82,0.0
304,288,896,5120,5,0,-1.0,a8w8_bpreshuffle_256x16x64x512_16x16_16x16_32x8x1_32x8x1_1x16x1x16_4x4x1_1x1_intrawave_v1,1.0,-1.0,-1.0
304,288,1024,5632,5,0,-1.0,a8w8_bpreshuffle_256x16x64x512_16x16_16x16_32x8x1_32x8x1_1x16x1x16_4x4x1_1x1_intrawave_v1,1.0,-1.0,-1.0
304,288,1056,1408,23,0,-1.0,a8w8_bpreshuffle_128x16x32x128_16x16_16x16_8x16x1_8x16x1_1x16x1x8_4x4x1_1x1_intrawave_v2,1.0,-1.0,-1.0
304,288,1280,4096,12,0,-1.0,a8w8_bpreshuffle_256x32x64x512_16x16_16x16_32x8x1_32x8x1_1x32x1x8_8x8x1_1x2_intrawave_v1,1.0,-1.0,-1.0
304,288,1408,352,0,0,-1.0,a8w8_bpreshuffle_256x128x128x128_16x16_16x16_8x32x1_8x32x1_1x32x1x8_8x8x1_2x1_intrawave_v3,1.0,-1.0,-1.0
304,288,1408,1408,9,0,-1.0,a8w8_bpreshuffle_128x16x32x128_16x16_16x16_8x16x1_8x16x1_1x16x1x8_4x4x1_1x1_intrawave_v1,1.0,-1.0,-1.0
304,288,1536,2048,12,0,-1.0,a8w8_bpreshuffle_256x32x64x512_16x16_16x16_32x8x1_32x8x1_1x32x1x8_8x8x1_1x2_intrawave_v1,1.0,-1.0,-1.0
304,288,1536,7168,12,0,18.8344,a8w8_bpreshuffle_256x32x64x512_16x16_16x16_32x8x1_32x8x1_1x32x1x8_8x8x1_1x2_intrawave_v1,336.71,741.15,0.0
304,288,1792,6144,113,0,-1.0,a8w8_bpreshuffle_256x48x64x256_16x16_16x16_16x16x1_16x16x1_1x16x1x16_4x4x1_1x1_intrawave_v1,1.0,-1.0,-1.0
304,288,2048,1536,113,0,-1.0,a8w8_bpreshuffle_256x48x64x256_16x16_16x16_16x16x1_16x16x1_1x16x1x16_4x4x1_1x1_intrawave_v1,1.0,-1.0,-1.0
304,288,2048,6144,113,0,-1.0,a8w8_bpreshuffle_256x48x64x256_16x16_16x16_16x16x1_16x16x1_1x16x1x16_4x4x1_1x1_intrawave_v1,1.0,-1.0,-1.0
304,288,2112,7168,113,0,21.9815,a8w8_bpreshuffle_256x48x64x256_16x16_16x16_16x16x1_16x16x1_1x16x1x16_4x4x1_1x1_intrawave_v1,396.7,837.96,0.0
304,288,3072,1536,113,0,8.836,a8w8_bpreshuffle_256x48x64x256_16x16_16x16_16x16x1_16x16x1_1x16x1x16_4x4x1_1x1_intrawave_v1,307.59,784.34,0.0
304,288,3072,4096,113,0,-1.0,a8w8_bpreshuffle_256x48x64x256_16x16_16x16_16x16x1_16x16x1_1x16x1x16_4x4x1_1x1_intrawave_v1,1.0,-1.0,-1.0
304,288,3584,6144,120,0,-1.0,a8w8_bpreshuffle_256x48x128x256_16x16_16x16_16x16x1_16x16x1_1x16x1x16_8x8x1_1x2_intrawave_v1,1.0,-1.0,-1.0
304,288,4096,512,76,0,6.0978,a8w8_bpreshuffle_256x32x64x128_16x16_16x16_8x32x1_8x32x1_1x32x1x8_8x8x1_2x1_intrawave_v1,198.1,755.01,0.0
304,288,4096,640,84,0,-1.0,a8w8_bpreshuffle_256x32x128x128_16x16_16x16_8x32x1_8x32x1_1x32x1x8_8x8x1_2x1_intrawave_v1,1.0,-1.0,-1.0
304,288,4096,1024,120,0,-1.0,a8w8_bpreshuffle_256x48x128x256_16x16_16x16_16x16x1_16x16x1_1x16x1x16_8x8x1_1x2_intrawave_v1,1.0,-1.0,-1.0
304,288,4096,3072,120,0,-1.0,a8w8_bpreshuffle_256x48x128x256_16x16_16x16_16x16x1_16x16x1_1x16x1x16_8x8x1_1x2_intrawave_v1,1.0,-1.0,-1.0
304,288,4608,7168,120,0,33.8779,a8w8_bpreshuffle_256x48x128x256_16x16_16x16_16x16x1_16x16x1_1x16x1x16_8x8x1_1x2_intrawave_v1,561.59,1114.26,0.0
304,288,5120,640,78,0,-1.0,a8w8_bpreshuffle_256x96x64x128_16x16_16x16_8x32x1_8x32x1_1x32x1x8_8x8x1_2x1_intrawave_v3,1.0,-1.0,-1.0
304,288,5120,2048,120,0,-1.0,a8w8_bpreshuffle_256x48x128x256_16x16_16x16_16x16x1_16x16x1_1x16x1x16_8x8x1_1x2_intrawave_v1,1.0,-1.0,-1.0
304,288,6144,768,120,0,-1.0,a8w8_bpreshuffle_256x48x128x256_16x16_16x16_16x16x1_16x16x1_1x16x1x16_8x8x1_1x2_intrawave_v1,1.0,-1.0,-1.0
304,288,6144,1024,120,0,-1.0,a8w8_bpreshuffle_256x48x128x256_16x16_16x16_16x16x1_16x16x1_1x16x1x16_8x8x1_1x2_intrawave_v1,1.0,-1.0,-1.0
304,288,6144,1536,120,0,-1.0,a8w8_bpreshuffle_256x48x128x256_16x16_16x16_16x16x1_16x16x1_1x16x1x16_8x8x1_1x2_intrawave_v1,1.0,-1.0,-1.0
304,288,6144,2048,116,0,-1.0,a8w8_bpreshuffle_256x96x64x256_16x16_16x16_16x16x1_16x16x1_1x32x1x8_8x8x1_2x1_intrawave_v3,1.0,-1.0,-1.0
304,288,7168,256,75,0,-1.0,a8w8_bpreshuffle_128x16x256x64_16x16_16x16_4x16x1_4x32x1_1x16x1x8_8x8x1_1x2_intrawave_v1,1.0,-1.0,-1.0
304,288,7168,2048,123,0,18.7106,a8w8_bpreshuffle_256x96x128x256_16x16_16x16_16x16x1_16x16x1_1x16x1x16_8x8x1_1x2_intrawave_v3,451.92,1036.77,0.0
304,288,7168,2304,123,0,-1.0,a8w8_bpreshuffle_256x96x128x256_16x16_16x16_16x16x1_16x16x1_1x16x1x16_8x8x1_1x2_intrawave_v3,1.0,-1.0,-1.0
304,296,192,7168,11,0,-1.0,a8w8_bpreshuffle_256x16x64x512_16x16_16x16_32x8x1_32x8x1_1x16x1x16_4x4x1_1x1_intrawave_v1,1.0,-1.0,-1.0
304,296,512,7168,5,0,-1.0,a8w8_bpreshuffle_256x16x64x512_16x16_16x16_32x8x1_32x8x1_1x16x1x16_4x4x1_1x1_intrawave_v1,1.0,-1.0,-1.0
304,296,576,7168,25,0,11.3884,a8w8_bpreshuffle_256x16x64x512_16x16_16x16_32x8x1_32x8x1_1x16x1x16_4x4x1_1x1_intrawave_v2,214.62,578.79,0.0
304,296,896,5120,5,0,-1.0,a8w8_bpreshuffle_256x16x64x512_16x16_16x16_32x8x1_32x8x1_1x16x1x16_4x4x1_1x1_intrawave_v1,1.0,-1.0,-1.0
304,296,1024,5632,11,0,-1.0,a8w8_bpreshuffle_256x16x64x512_16x16_16x16_32x8x1_32x8x1_1x16x1x16_4x4x1_1x1_intrawave_v1,1.0,-1.0,-1.0
304,296,1056,1408,23,0,-1.0,a8w8_bpreshuffle_128x16x32x128_16x16_16x16_8x16x1_8x16x1_1x16x1x8_4x4x1_1x1_intrawave_v2,1.0,-1.0,-1.0
304,296,1280,4096,12,0,-1.0,a8w8_bpreshuffle_256x32x64x512_16x16_16x16_32x8x1_32x8x1_1x32x1x8_8x8x1_1x2_intrawave_v1,1.0,-1.0,-1.0
304,296,1408,352,0,0,-1.0,a8w8_bpreshuffle_256x128x128x128_16x16_16x16_8x32x1_8x32x1_1x32x1x8_8x8x1_2x1_intrawave_v3,1.0,-1.0,-1.0
304,296,1408,1408,9,0,-1.0,a8w8_bpreshuffle_128x16x32x128_16x16_16x16_8x16x1_8x16x1_1x16x1x8_4x4x1_1x1_intrawave_v1,1.0,-1.0,-1.0
304,296,1536,2048,112,0,-1.0,a8w8_bpreshuffle_256x32x64x256_16x16_16x16_16x16x1_16x16x1_1x32x1x8_8x8x1_2x1_intrawave_v1,1.0,-1.0,-1.0
304,296,1536,7168,12,0,19.6632,a8w8_bpreshuffle_256x32x64x512_16x16_16x16_32x8x1_32x8x1_1x32x1x8_8x8x1_1x2_intrawave_v1,331.48,714.08,0.0
304,296,1792,6144,12,0,-1.0,a8w8_bpreshuffle_256x32x64x512_16x16_16x16_32x8x1_32x8x1_1x32x1x8_8x8x1_1x2_intrawave_v1,1.0,-1.0,-1.0
304,296,2048,1536,119,0,-1.0,a8w8_bpreshuffle_256x32x128x256_16x16_16x16_16x16x1_16x16x1_1x16x1x16_8x8x1_1x2_intrawave_v1,1.0,-1.0,-1.0
304,296,2048,6144,119,0,-1.0,a8w8_bpreshuffle_256x32x128x256_16x16_16x16_16x16x1_16x16x1_1x16x1x16_8x8x1_1x2_intrawave_v1,1.0,-1.0,-1.0
304,296,2112,7168,113,0,23.3415,a8w8_bpreshuffle_256x48x64x256_16x16_16x16_16x16x1_16x16x1_1x16x1x16_4x4x1_1x1_intrawave_v1,383.96,793.04,0.0
304,296,3072,1536,119,0,9.1122,a8w8_bpreshuffle_256x32x128x256_16x16_16x16_16x16x1_16x16x1_1x16x1x16_8x8x1_1x2_intrawave_v1,306.56,767.31,0.0
304,296,3072,4096,119,0,-1.0,a8w8_bpreshuffle_256x32x128x256_16x16_16x16_16x16x1_16x16x1_1x16x1x16_8x8x1_1x2_intrawave_v1,1.0,-1.0,-1.0
304,296,3584,6144,120,0,-1.0,a8w8_bpreshuffle_256x48x128x256_16x16_16x16_16x16x1_16x16x1_1x16x1x16_8x8x1_1x2_intrawave_v1,1.0,-1.0,-1.0
304,296,4096,512,84,0,6.3787,a8w8_bpreshuffle_256x32x128x128_16x16_16x16_8x32x1_8x32x1_1x32x1x8_8x8x1_2x1_intrawave_v1,194.63,732.68,0.0
304,296,4096,640,84,0,-1.0,a8w8_bpreshuffle_256x32x128x128_16x16_16x16_8x32x1_8x32x1_1x32x1x8_8x8x1_2x1_intrawave_v1,1.0,-1.0,-1.0
304,296,4096,1024,120,0,-1.0,a8w8_bpreshuffle_256x48x128x256_16x16_16x16_16x16x1_16x16x1_1x16x1x16_8x8x1_1x2_intrawave_v1,1.0,-1.0,-1.0
304,296,4096,3072,120,0,-1.0,a8w8_bpreshuffle_256x48x128x256_16x16_16x16_16x16x1_16x16x1_1x16x1x16_8x8x1_1x2_intrawave_v1,1.0,-1.0,-1.0
304,296,4608,7168,115,0,36.5439,a8w8_bpreshuffle_256x80x64x256_16x16_16x16_16x16x1_16x16x1_1x16x1x16_4x4x1_1x1_intrawave_v3,535.08,1036.56,0.0
304,296,5120,640,76,0,-1.0,a8w8_bpreshuffle_256x32x64x128_16x16_16x16_8x32x1_8x32x1_1x32x1x8_8x8x1_2x1_intrawave_v1,1.0,-1.0,-1.0
304,296,5120,2048,120,0,-1.0,a8w8_bpreshuffle_256x48x128x256_16x16_16x16_16x16x1_16x16x1_1x16x1x16_8x8x1_1x2_intrawave_v1,1.0,-1.0,-1.0
304,296,6144,768,84,0,-1.0,a8w8_bpreshuffle_256x32x128x128_16x16_16x16_8x32x1_8x32x1_1x32x1x8_8x8x1_2x1_intrawave_v1,1.0,-1.0,-1.0
304,296,6144,1024,122,0,-1.0,a8w8_bpreshuffle_256x80x128x256_16x16_16x16_16x16x1_16x16x1_1x16x1x16_8x8x1_1x2_intrawave_v3,1.0,-1.0,-1.0
304,296,6144,1536,114,0,-1.0,a8w8_bpreshuffle_256x64x64x256_16x16_16x16_16x16x1_16x16x1_1x32x1x8_8x8x1_2x1_intrawave_v3,1.0,-1.0,-1.0
304,296,6144,2048,85,0,-1.0,a8w8_bpreshuffle_256x64x128x128_16x16_16x16_8x32x1_8x32x1_1x32x1x8_8x8x1_2x1_intrawave_v3,1.0,-1.0,-1.0
304,296,7168,256,75,0,-1.0,a8w8_bpreshuffle_128x16x256x64_16x16_16x16_4x16x1_4x32x1_1x16x1x8_8x8x1_1x2_intrawave_v1,1.0,-1.0,-1.0
304,296,7168,2048,122,0,19.1964,a8w8_bpreshuffle_256x80x128x256_16x16_16x16_16x16x1_16x16x1_1x16x1x16_8x8x1_1x2_intrawave_v3,452.72,1017.36,0.0
304,296,7168,2304,122,0,-1.0,a8w8_bpreshuffle_256x80x128x256_16x16_16x16_16x16x1_16x16x1_1x16x1x16_8x8x1_1x2_intrawave_v3,1.0,-1.0,-1.0
304,304,192,7168,24,0,-1.0,a8w8_bpreshuffle_128x16x32x512_16x16_16x16_32x4x1_32x4x1_1x16x1x8_4x4x1_1x1_intrawave_v2,1.0,-1.0,-1.0
304,304,512,7168,10,0,-1.0,a8w8_bpreshuffle_128x16x32x512_16x16_16x16_32x4x1_32x4x1_1x16x1x8_4x4x1_1x1_intrawave_v1,1.0,-1.0,-1.0
304,304,576,7168,5,0,11.0503,a8w8_bpreshuffle_256x16x64x512_16x16_16x16_32x8x1_32x8x1_1x16x1x16_4x4x1_1x1_intrawave_v1,227.17,602.52,0.0
304,304,896,5120,5,0,10.9141,a8w8_bpreshuffle_256x16x64x512_16x16_16x16_32x8x1_32x8x1_1x16x1x16_4x4x1_1x1_intrawave_v1,0.0,255.56,612.86
304,304,1024,5632,11,0,12.8287,a8w8_bpreshuffle_256x16x64x512_16x16_16x16_32x8x1_32x8x1_1x16x1x16_4x4x1_1x1_intrawave_v1,0.0,273.33,631.54
304,304,1056,1408,23,0,7.0503,a8w8_bpreshuffle_128x16x32x128_16x16_16x16_8x16x1_8x16x1_1x16x1x8_4x4x1_1x1_intrawave_v2,0.0,128.22,362.67
304,304,1280,4096,12,0,11.6532,a8w8_bpreshuffle_256x32x64x512_16x16_16x16_32x8x1_32x8x1_1x32x1x8_8x8x1_1x2_intrawave_v1,0.0,273.54,623.55
304,304,1408,352,0,0,-1.0,a8w8_bpreshuffle_256x128x128x128_16x16_16x16_8x32x1_8x32x1_1x32x1x8_8x8x1_2x1_intrawave_v3,1.0,-1.0,-1.0
304,304,1408,1408,9,0,-1.0,a8w8_bpreshuffle_128x16x32x128_16x16_16x16_8x16x1_8x16x1_1x16x1x8_4x4x1_1x1_intrawave_v1,1.0,-1.0,-1.0
304,304,1536,2048,112,0,-1.0,a8w8_bpreshuffle_256x32x64x256_16x16_16x16_16x16x1_16x16x1_1x32x1x8_8x8x1_2x1_intrawave_v1,1.0,-1.0,-1.0
304,304,1536,7168,12,0,19.6474,a8w8_bpreshuffle_256x32x64x512_16x16_16x16_32x8x1_32x8x1_1x32x1x8_8x8x1_1x2_intrawave_v1,340.71,718.82,0.0
304,304,1792,6144,12,0,-1.0,a8w8_bpreshuffle_256x32x64x512_16x16_16x16_32x8x1_32x8x1_1x32x1x8_8x8x1_1x2_intrawave_v1,1.0,-1.0,-1.0
304,304,2048,1536,119,0,-1.0,a8w8_bpreshuffle_256x32x128x256_16x16_16x16_16x16x1_16x16x1_1x16x1x16_8x8x1_1x2_intrawave_v1,1.0,-1.0,-1.0
304,304,2048,6144,119,0,-1.0,a8w8_bpreshuffle_256x32x128x256_16x16_16x16_16x16x1_16x16x1_1x16x1x16_8x8x1_1x2_intrawave_v1,1.0,-1.0,-1.0
304,304,2112,7168,113,0,23.4464,a8w8_bpreshuffle_256x48x64x256_16x16_16x16_16x16x1_16x16x1_1x16x1x16_4x4x1_1x1_intrawave_v1,392.57,793.38,0.0
304,304,3072,1536,119,0,9.2841,a8w8_bpreshuffle_256x32x128x256_16x16_16x16_16x16x1_16x16x1_1x16x1x16_8x8x1_1x2_intrawave_v1,309.01,759.72,0.0
304,304,3072,4096,119,0,-1.0,a8w8_bpreshuffle_256x32x128x256_16x16_16x16_16x16x1_16x16x1_1x16x1x16_8x8x1_1x2_intrawave_v1,1.0,-1.0,-1.0
304,304,3584,6144,120,0,-1.0,a8w8_bpreshuffle_256x48x128x256_16x16_16x16_16x16x1_16x16x1_1x16x1x16_8x8x1_1x2_intrawave_v1,1.0,-1.0,-1.0
304,304,4096,512,84,0,6.4939,a8w8_bpreshuffle_256x32x128x128_16x16_16x16_8x32x1_8x32x1_1x32x1x8_8x8x1_2x1_intrawave_v1,196.35,730.4,0.0
304,304,4096,640,84,0,7.1985,a8w8_bpreshuffle_256x32x128x128_16x16_16x16_8x32x1_8x32x1_1x32x1x8_8x8x1_2x1_intrawave_v1,0.0,221.41,737.15
304,304,4096,1024,120,0,-1.0,a8w8_bpreshuffle_256x48x128x256_16x16_16x16_16x16x1_16x16x1_1x16x1x16_8x8x1_1x2_intrawave_v1,1.0,-1.0,-1.0
304,304,4096,3072,115,0,-1.0,a8w8_bpreshuffle_256x80x64x256_16x16_16x16_16x16x1_16x16x1_1x16x1x16_4x4x1_1x1_intrawave_v3,1.0,-1.0,-1.0
304,304,4608,7168,115,0,36.6416,a8w8_bpreshuffle_256x80x64x256_16x16_16x16_16x16x1_16x16x1_1x16x1x16_4x4x1_1x1_intrawave_v3,548.07,1037.37,0.0
304,304,5120,640,76,0,8.1483,a8w8_bpreshuffle_256x32x64x128_16x16_16x16_8x32x1_8x32x1_1x32x1x8_8x8x1_2x1_intrawave_v1,0.0,244.5,808.06
304,304,5120,2048,120,0,14.0284,a8w8_bpreshuffle_256x48x128x256_16x16_16x16_16x16x1_16x16x1_1x16x1x16_8x8x1_1x2_intrawave_v1,0.0,454.46,1013.75
304,304,6144,768,84,0,-1.0,a8w8_bpreshuffle_256x32x128x128_16x16_16x16_8x32x1_8x32x1_1x32x1x8_8x8x1_2x1_intrawave_v1,1.0,-1.0,-1.0
304,304,6144,1024,122,0,-1.0,a8w8_bpreshuffle_256x80x128x256_16x16_16x16_16x16x1_16x16x1_1x16x1x16_8x8x1_1x2_intrawave_v3,1.0,-1.0,-1.0
304,304,6144,1536,114,0,-1.0,a8w8_bpreshuffle_256x64x64x256_16x16_16x16_16x16x1_16x16x1_1x32x1x8_8x8x1_2x1_intrawave_v3,1.0,-1.0,-1.0
304,304,6144,2048,122,0,-1.0,a8w8_bpreshuffle_256x80x128x256_16x16_16x16_16x16x1_16x16x1_1x16x1x16_8x8x1_1x2_intrawave_v3,1.0,-1.0,-1.0
304,304,7168,256,75,0,-1.0,a8w8_bpreshuffle_128x16x256x64_16x16_16x16_4x16x1_4x32x1_1x16x1x8_8x8x1_1x2_intrawave_v1,1.0,-1.0,-1.0
304,304,7168,2048,122,0,19.1671,a8w8_bpreshuffle_256x80x128x256_16x16_16x16_16x16x1_16x16x1_1x16x1x16_8x8x1_1x2_intrawave_v3,465.67,1025.76,0.0
304,304,7168,2304,122,0,-1.0,a8w8_bpreshuffle_256x80x128x256_16x16_16x16_16x16x1_16x16x1_1x16x1x16_8x8x1_1x2_intrawave_v3,1.0,-1.0,-1.0
304,312,192,7168,10,0,-1.0,a8w8_bpreshuffle_128x16x32x512_16x16_16x16_32x4x1_32x4x1_1x16x1x8_4x4x1_1x1_intrawave_v1,1.0,-1.0,-1.0
304,312,512,7168,11,0,-1.0,a8w8_bpreshuffle_256x16x64x512_16x16_16x16_32x8x1_32x8x1_1x16x1x16_4x4x1_1x1_intrawave_v1,1.0,-1.0,-1.0
304,312,576,7168,11,0,11.6118,a8w8_bpreshuffle_256x16x64x512_16x16_16x16_32x8x1_32x8x1_1x16x1x16_4x4x1_1x1_intrawave_v1,221.87,579.12,0.0
304,312,896,5120,11,0,-1.0,a8w8_bpreshuffle_256x16x64x512_16x16_16x16_32x8x1_32x8x1_1x16x1x16_4x4x1_1x1_intrawave_v1,1.0,-1.0,-1.0
304,312,1024,5632,12,0,-1.0,a8w8_bpreshuffle_256x32x64x512_16x16_16x16_32x8x1_32x8x1_1x32x1x8_8x8x1_1x2_intrawave_v1,1.0,-1.0,-1.0
304,312,1056,1408,23,0,-1.0,a8w8_bpreshuffle_128x16x32x128_16x16_16x16_8x16x1_8x16x1_1x16x1x8_4x4x1_1x1_intrawave_v2,1.0,-1.0,-1.0
304,312,1280,4096,12,0,-1.0,a8w8_bpreshuffle_256x32x64x512_16x16_16x16_32x8x1_32x8x1_1x32x1x8_8x8x1_1x2_intrawave_v1,1.0,-1.0,-1.0
304,312,1408,352,0,0,-1.0,a8w8_bpreshuffle_256x128x128x128_16x16_16x16_8x32x1_8x32x1_1x32x1x8_8x8x1_2x1_intrawave_v3,1.0,-1.0,-1.0
304,312,1408,1408,9,0,-1.0,a8w8_bpreshuffle_128x16x32x128_16x16_16x16_8x16x1_8x16x1_1x16x1x8_4x4x1_1x1_intrawave_v1,1.0,-1.0,-1.0
304,312,1536,2048,112,0,-1.0,a8w8_bpreshuffle_256x32x64x256_16x16_16x16_16x16x1_16x16x1_1x32x1x8_8x8x1_2x1_intrawave_v1,1.0,-1.0,-1.0
304,312,1536,7168,12,0,19.8023,a8w8_bpreshuffle_256x32x64x512_16x16_16x16_32x8x1_32x8x1_1x32x1x8_8x8x1_1x2_intrawave_v1,346.94,717.34,0.0
304,312,1792,6144,12,0,-1.0,a8w8_bpreshuffle_256x32x64x512_16x16_16x16_32x8x1_32x8x1_1x32x1x8_8x8x1_1x2_intrawave_v1,1.0,-1.0,-1.0
304,312,2048,1536,119,0,-1.0,a8w8_bpreshuffle_256x32x128x256_16x16_16x16_16x16x1_16x16x1_1x16x1x16_8x8x1_1x2_intrawave_v1,1.0,-1.0,-1.0
304,312,2048,6144,119,0,-1.0,a8w8_bpreshuffle_256x32x128x256_16x16_16x16_16x16x1_16x16x1_1x16x1x16_8x8x1_1x2_intrawave_v1,1.0,-1.0,-1.0
304,312,2112,7168,113,0,24.1405,a8w8_bpreshuffle_256x48x64x256_16x16_16x16_16x16x1_16x16x1_1x16x1x16_4x4x1_1x1_intrawave_v1,391.32,774.35,0.0
304,312,3072,1536,119,0,9.3822,a8w8_bpreshuffle_256x32x128x256_16x16_16x16_16x16x1_16x16x1_1x16x1x16_8x8x1_1x2_intrawave_v1,313.83,758.32,0.0
304,312,3072,4096,119,0,-1.0,a8w8_bpreshuffle_256x32x128x256_16x16_16x16_16x16x1_16x16x1_1x16x1x16_8x8x1_1x2_intrawave_v1,1.0,-1.0,-1.0
304,312,3584,6144,114,0,-1.0,a8w8_bpreshuffle_256x64x64x256_16x16_16x16_16x16x1_16x16x1_1x32x1x8_8x8x1_2x1_intrawave_v3,1.0,-1.0,-1.0
304,312,4096,512,84,0,6.4268,a8w8_bpreshuffle_256x32x128x128_16x16_16x16_8x32x1_8x32x1_1x32x1x8_8x8x1_2x1_intrawave_v1,203.62,748.86,0.0
304,312,4096,640,84,0,-1.0,a8w8_bpreshuffle_256x32x128x128_16x16_16x16_8x32x1_8x32x1_1x32x1x8_8x8x1_2x1_intrawave_v1,1.0,-1.0,-1.0
304,312,4096,1024,120,0,-1.0,a8w8_bpreshuffle_256x48x128x256_16x16_16x16_16x16x1_16x16x1_1x16x1x16_8x8x1_1x2_intrawave_v1,1.0,-1.0,-1.0
304,312,4096,3072,115,0,-1.0,a8w8_bpreshuffle_256x80x64x256_16x16_16x16_16x16x1_16x16x1_1x16x1x16_4x4x1_1x1_intrawave_v3,1.0,-1.0,-1.0
304,312,4608,7168,120,0,36.892,a8w8_bpreshuffle_256x48x128x256_16x16_16x16_16x16x1_16x16x1_1x16x1x16_8x8x1_1x2_intrawave_v1,558.68,1033.88,0.0
304,312,5120,640,76,0,-1.0,a8w8_bpreshuffle_256x32x64x128_16x16_16x16_8x32x1_8x32x1_1x32x1x8_8x8x1_2x1_intrawave_v1,1.0,-1.0,-1.0
304,312,5120,2048,120,0,-1.0,a8w8_bpreshuffle_256x48x128x256_16x16_16x16_16x16x1_16x16x1_1x16x1x16_8x8x1_1x2_intrawave_v1,1.0,-1.0,-1.0
304,312,6144,768,84,0,-1.0,a8w8_bpreshuffle_256x32x128x128_16x16_16x16_8x32x1_8x32x1_1x32x1x8_8x8x1_2x1_intrawave_v1,1.0,-1.0,-1.0
304,312,6144,1024,122,0,-1.0,a8w8_bpreshuffle_256x80x128x256_16x16_16x16_16x16x1_16x16x1_1x16x1x16_8x8x1_1x2_intrawave_v3,1.0,-1.0,-1.0
304,312,6144,1536,114,0,-1.0,a8w8_bpreshuffle_256x64x64x256_16x16_16x16_16x16x1_16x16x1_1x32x1x8_8x8x1_2x1_intrawave_v3,1.0,-1.0,-1.0
304,312,6144,2048,122,0,-1.0,a8w8_bpreshuffle_256x80x128x256_16x16_16x16_16x16x1_16x16x1_1x16x1x16_8x8x1_1x2_intrawave_v3,1.0,-1.0,-1.0
304,312,7168,256,75,0,-1.0,a8w8_bpreshuffle_128x16x256x64_16x16_16x16_4x16x1_4x32x1_1x16x1x8_8x8x1_1x2_intrawave_v1,1.0,-1.0,-1.0
304,312,7168,2048,122,0,19.1137,a8w8_bpreshuffle_256x80x128x256_16x16_16x16_16x16x1_16x16x1_1x16x1x16_8x8x1_1x2_intrawave_v3,479.26,1035.48,0.0
304,312,7168,2304,122,0,-1.0,a8w8_bpreshuffle_256x80x128x256_16x16_16x16_16x16x1_16x16x1_1x16x1x16_8x8x1_1x2_intrawave_v3,1.0,-1.0,-1.0
304,320,192,7168,24,0,-1.0,a8w8_bpreshuffle_128x16x32x512_16x16_16x16_32x4x1_32x4x1_1x16x1x8_4x4x1_1x1_intrawave_v2,1.0,-1.0,-1.0
304,320,512,7168,11,0,-1.0,a8w8_bpreshuffle_256x16x64x512_16x16_16x16_32x8x1_32x8x1_1x16x1x16_4x4x1_1x1_intrawave_v1,1.0,-1.0,-1.0
304,320,576,7168,11,0,10.7645,a8w8_bpreshuffle_256x16x64x512_16x16_16x16_32x8x1_32x8x1_1x16x1x16_4x4x1_1x1_intrawave_v1,245.47,630.89,0.0
304,320,896,5120,5,0,-1.0,a8w8_bpreshuffle_256x16x64x512_16x16_16x16_32x8x1_32x8x1_1x16x1x16_4x4x1_1x1_intrawave_v1,1.0,-1.0,-1.0
304,320,1024,5632,6,0,-1.0,a8w8_bpreshuffle_256x16x128x512_16x16_16x16_32x8x1_32x8x1_1x16x1x16_8x8x1_1x2_intrawave_v1,1.0,-1.0,-1.0
304,320,1056,1408,23,0,-1.0,a8w8_bpreshuffle_128x16x32x128_16x16_16x16_8x16x1_8x16x1_1x16x1x8_4x4x1_1x1_intrawave_v2,1.0,-1.0,-1.0
304,320,1280,4096,12,0,-1.0,a8w8_bpreshuffle_256x32x64x512_16x16_16x16_32x8x1_32x8x1_1x32x1x8_8x8x1_1x2_intrawave_v1,1.0,-1.0,-1.0
304,320,1408,352,0,0,-1.0,a8w8_bpreshuffle_256x128x128x128_16x16_16x16_8x32x1_8x32x1_1x32x1x8_8x8x1_2x1_intrawave_v3,1.0,-1.0,-1.0
304,320,1408,1408,9,0,-1.0,a8w8_bpreshuffle_128x16x32x128_16x16_16x16_8x16x1_8x16x1_1x16x1x8_4x4x1_1x1_intrawave_v1,1.0,-1.0,-1.0
304,320,1536,2048,112,0,-1.0,a8w8_bpreshuffle_256x32x64x256_16x16_16x16_16x16x1_16x16x1_1x32x1x8_8x8x1_2x1_intrawave_v1,1.0,-1.0,-1.0
304,320,1536,7168,112,0,19.3624,a8w8_bpreshuffle_256x32x64x256_16x16_16x16_16x16x1_16x16x1_1x32x1x8_8x8x1_2x1_intrawave_v1,363.92,737.87,0.0
304,320,1792,6144,112,0,-1.0,a8w8_bpreshuffle_256x32x64x256_16x16_16x16_16x16x1_16x16x1_1x32x1x8_8x8x1_2x1_intrawave_v1,1.0,-1.0,-1.0
304,320,2048,1536,119,0,-1.0,a8w8_bpreshuffle_256x32x128x256_16x16_16x16_16x16x1_16x16x1_1x16x1x16_8x8x1_1x2_intrawave_v1,1.0,-1.0,-1.0
304,320,2048,6144,119,0,-1.0,a8w8_bpreshuffle_256x32x128x256_16x16_16x16_16x16x1_16x16x1_1x16x1x16_8x8x1_1x2_intrawave_v1,1.0,-1.0,-1.0
304,320,2112,7168,114,0,23.1682,a8w8_bpreshuffle_256x64x64x256_16x16_16x16_16x16x1_16x16x1_1x32x1x8_8x8x1_2x1_intrawave_v3,418.2,810.78,0.0
304,320,3072,1536,119,0,9.1939,a8w8_bpreshuffle_256x32x128x256_16x16_16x16_16x16x1_16x16x1_1x16x1x16_8x8x1_1x2_intrawave_v1,328.47,780.54,0.0
304,320,3072,4096,119,0,-1.0,a8w8_bpreshuffle_256x32x128x256_16x16_16x16_16x16x1_16x16x1_1x16x1x16_8x8x1_1x2_intrawave_v1,1.0,-1.0,-1.0
304,320,3584,6144,114,0,-1.0,a8w8_bpreshuffle_256x64x64x256_16x16_16x16_16x16x1_16x16x1_1x32x1x8_8x8x1_2x1_intrawave_v3,1.0,-1.0,-1.0
304,320,4096,512,84,0,6.6252,a8w8_bpreshuffle_256x32x128x128_16x16_16x16_8x32x1_8x32x1_1x32x1x8_8x8x1_2x1_intrawave_v1,202.59,736.95,0.0
304,320,4096,640,76,0,-1.0,a8w8_bpreshuffle_256x32x64x128_16x16_16x16_8x32x1_8x32x1_1x32x1x8_8x8x1_2x1_intrawave_v1,1.0,-1.0,-1.0
304,320,4096,1024,120,0,-1.0,a8w8_bpreshuffle_256x48x128x256_16x16_16x16_16x16x1_16x16x1_1x16x1x16_8x8x1_1x2_intrawave_v1,1.0,-1.0,-1.0
304,320,4096,3072,120,0,-1.0,a8w8_bpreshuffle_256x48x128x256_16x16_16x16_16x16x1_16x16x1_1x16x1x16_8x8x1_1x2_intrawave_v1,1.0,-1.0,-1.0
304,320,4608,7168,115,0,35.7946,a8w8_bpreshuffle_256x80x64x256_16x16_16x16_16x16x1_16x16x1_1x16x1x16_4x4x1_1x1_intrawave_v3,590.57,1069.24,0.0
304,320,5120,640,76,0,-1.0,a8w8_bpreshuffle_256x32x64x128_16x16_16x16_8x32x1_8x32x1_1x32x1x8_8x8x1_2x1_intrawave_v1,1.0,-1.0,-1.0
304,320,5120,2048,120,0,-1.0,a8w8_bpreshuffle_256x48x128x256_16x16_16x16_16x16x1_16x16x1_1x16x1x16_8x8x1_1x2_intrawave_v1,1.0,-1.0,-1.0
304,320,6144,768,84,0,-1.0,a8w8_bpreshuffle_256x32x128x128_16x16_16x16_8x32x1_8x32x1_1x32x1x8_8x8x1_2x1_intrawave_v1,1.0,-1.0,-1.0
304,320,6144,1024,122,0,-1.0,a8w8_bpreshuffle_256x80x128x256_16x16_16x16_16x16x1_16x16x1_1x16x1x16_8x8x1_1x2_intrawave_v3,1.0,-1.0,-1.0
304,320,6144,1536,114,0,-1.0,a8w8_bpreshuffle_256x64x64x256_16x16_16x16_16x16x1_16x16x1_1x32x1x8_8x8x1_2x1_intrawave_v3,1.0,-1.0,-1.0
304,320,6144,2048,122,0,-1.0,a8w8_bpreshuffle_256x80x128x256_16x16_16x16_16x16x1_16x16x1_1x16x1x16_8x8x1_1x2_intrawave_v3,1.0,-1.0,-1.0
304,320,7168,256,75,0,-1.0,a8w8_bpreshuffle_128x16x256x64_16x16_16x16_4x16x1_4x32x1_1x16x1x8_8x8x1_1x2_intrawave_v1,1.0,-1.0,-1.0
304,320,7168,2048,122,0,19.0021,a8w8_bpreshuffle_256x80x128x256_16x16_16x16_16x16x1_16x16x1_1x16x1x16_8x8x1_1x2_intrawave_v3,494.43,1048.46,0.0
304,320,7168,2304,122,0,-1.0,a8w8_bpreshuffle_256x80x128x256_16x16_16x16_16x16x1_16x16x1_1x16x1x16_8x8x1_1x2_intrawave_v3,1.0,-1.0,-1.0
304,328,192,7168,11,0,-1.0,a8w8_bpreshuffle_256x16x64x512_16x16_16x16_32x8x1_32x8x1_1x16x1x16_4x4x1_1x1_intrawave_v1,1.0,-1.0,-1.0
304,328,512,7168,11,0,-1.0,a8w8_bpreshuffle_256x16x64x512_16x16_16x16_32x8x1_32x8x1_1x16x1x16_4x4x1_1x1_intrawave_v1,1.0,-1.0,-1.0
304,328,576,7168,19,0,11.979,a8w8_bpreshuffle_256x16x64x512_16x16_16x16_32x8x1_32x8x1_1x16x1x16_4x4x1_1x1_intrawave_v2,226.1,572.48,0.0
304,328,896,5120,11,0,-1.0,a8w8_bpreshuffle_256x16x64x512_16x16_16x16_32x8x1_32x8x1_1x16x1x16_4x4x1_1x1_intrawave_v1,1.0,-1.0,-1.0
304,328,1024,5632,12,0,-1.0,a8w8_bpreshuffle_256x32x64x512_16x16_16x16_32x8x1_32x8x1_1x32x1x8_8x8x1_1x2_intrawave_v1,1.0,-1.0,-1.0
304,328,1056,1408,23,0,-1.0,a8w8_bpreshuffle_128x16x32x128_16x16_16x16_8x16x1_8x16x1_1x16x1x8_4x4x1_1x1_intrawave_v2,1.0,-1.0,-1.0
304,328,1280,4096,12,0,-1.0,a8w8_bpreshuffle_256x32x64x512_16x16_16x16_32x8x1_32x8x1_1x32x1x8_8x8x1_1x2_intrawave_v1,1.0,-1.0,-1.0
304,328,1408,352,0,0,-1.0,a8w8_bpreshuffle_256x128x128x128_16x16_16x16_8x32x1_8x32x1_1x32x1x8_8x8x1_2x1_intrawave_v3,1.0,-1.0,-1.0
304,328,1408,1408,76,0,-1.0,a8w8_bpreshuffle_256x32x64x128_16x16_16x16_8x32x1_8x32x1_1x32x1x8_8x8x1_2x1_intrawave_v1,1.0,-1.0,-1.0
304,328,1536,2048,119,0,-1.0,a8w8_bpreshuffle_256x32x128x256_16x16_16x16_16x16x1_16x16x1_1x16x1x16_8x8x1_1x2_intrawave_v1,1.0,-1.0,-1.0
304,328,1536,7168,12,0,20.067,a8w8_bpreshuffle_256x32x64x512_16x16_16x16_32x8x1_32x8x1_1x32x1x8_8x8x1_1x2_intrawave_v1,359.92,716.04,0.0
304,328,1792,6144,113,0,-1.0,a8w8_bpreshuffle_256x48x64x256_16x16_16x16_16x16x1_16x16x1_1x16x1x16_4x4x1_1x1_intrawave_v1,1.0,-1.0,-1.0
304,328,2048,1536,119,0,-1.0,a8w8_bpreshuffle_256x32x128x256_16x16_16x16_16x16x1_16x16x1_1x16x1x16_8x8x1_1x2_intrawave_v1,1.0,-1.0,-1.0
304,328,2048,6144,113,0,-1.0,a8w8_bpreshuffle_256x48x64x256_16x16_16x16_16x16x1_16x16x1_1x16x1x16_4x4x1_1x1_intrawave_v1,1.0,-1.0,-1.0
304,328,2112,7168,113,0,23.8526,a8w8_bpreshuffle_256x48x64x256_16x16_16x16_16x16x1_16x16x1_1x16x1x16_4x4x1_1x1_intrawave_v1,416.35,791.33,0.0
304,328,3072,1536,119,0,9.4839,a8w8_bpreshuffle_256x32x128x256_16x16_16x16_16x16x1_16x16x1_1x16x1x16_8x8x1_1x2_intrawave_v1,326.38,763.15,0.0
304,328,3072,4096,119,0,-1.0,a8w8_bpreshuffle_256x32x128x256_16x16_16x16_16x16x1_16x16x1_1x16x1x16_8x8x1_1x2_intrawave_v1,1.0,-1.0,-1.0
304,328,3584,6144,120,0,-1.0,a8w8_bpreshuffle_256x48x128x256_16x16_16x16_16x16x1_16x16x1_1x16x1x16_8x8x1_1x2_intrawave_v1,1.0,-1.0,-1.0
304,328,4096,512,84,0,6.683,a8w8_bpreshuffle_256x32x128x128_16x16_16x16_8x32x1_8x32x1_1x32x1x8_8x8x1_2x1_intrawave_v1,205.86,740.99,0.0
304,328,4096,640,84,0,-1.0,a8w8_bpreshuffle_256x32x128x128_16x16_16x16_8x32x1_8x32x1_1x32x1x8_8x8x1_2x1_intrawave_v1,1.0,-1.0,-1.0
304,328,4096,1024,120,0,-1.0,a8w8_bpreshuffle_256x48x128x256_16x16_16x16_16x16x1_16x16x1_1x16x1x16_8x8x1_1x2_intrawave_v1,1.0,-1.0,-1.0
304,328,4096,3072,120,0,-1.0,a8w8_bpreshuffle_256x48x128x256_16x16_16x16_16x16x1_16x16x1_1x16x1x16_8x8x1_1x2_intrawave_v1,1.0,-1.0,-1.0
304,328,4608,7168,120,0,37.9411,a8w8_bpreshuffle_256x48x128x256_16x16_16x16_16x16x1_16x16x1_1x16x1x16_8x8x1_1x2_intrawave_v1,571.09,1012.2,0.0
304,328,5120,640,76,0,-1.0,a8w8_bpreshuffle_256x32x64x128_16x16_16x16_8x32x1_8x32x1_1x32x1x8_8x8x1_2x1_intrawave_v1,1.0,-1.0,-1.0
304,328,5120,2048,120,0,-1.0,a8w8_bpreshuffle_256x48x128x256_16x16_16x16_16x16x1_16x16x1_1x16x1x16_8x8x1_1x2_intrawave_v1,1.0,-1.0,-1.0
304,328,6144,768,84,0,-1.0,a8w8_bpreshuffle_256x32x128x128_16x16_16x16_8x32x1_8x32x1_1x32x1x8_8x8x1_2x1_intrawave_v1,1.0,-1.0,-1.0
304,328,6144,1024,121,0,-1.0,a8w8_bpreshuffle_256x64x128x256_16x16_16x16_16x16x1_16x16x1_1x16x1x16_8x8x1_1x2_intrawave_v3,1.0,-1.0,-1.0
304,328,6144,1536,117,0,-1.0,a8w8_bpreshuffle_256x112x64x256_16x16_16x16_16x16x1_16x16x1_1x16x1x16_4x4x1_1x1_intrawave_v3,1.0,-1.0,-1.0
304,328,6144,2048,121,0,-1.0,a8w8_bpreshuffle_256x64x128x256_16x16_16x16_16x16x1_16x16x1_1x16x1x16_8x8x1_1x2_intrawave_v3,1.0,-1.0,-1.0
304,328,7168,256,73,0,-1.0,a8w8_bpreshuffle_256x32x256x64_16x16_16x16_4x32x1_4x64x1_1x32x1x8_8x8x1_2x1_intrawave_v1,1.0,-1.0,-1.0
304,328,7168,2048,123,0,20.9811,a8w8_bpreshuffle_256x96x128x256_16x16_16x16_16x16x1_16x16x1_1x16x1x16_8x8x1_1x2_intrawave_v3,458.99,955.81,0.0
304,328,7168,2304,123,0,-1.0,a8w8_bpreshuffle_256x96x128x256_16x16_16x16_16x16x1_16x16x1_1x16x1x16_8x8x1_1x2_intrawave_v3,1.0,-1.0,-1.0
304,336,192,7168,24,0,-1.0,a8w8_bpreshuffle_128x16x32x512_16x16_16x16_32x4x1_32x4x1_1x16x1x8_4x4x1_1x1_intrawave_v2,1.0,-1.0,-1.0
304,336,512,7168,5,0,-1.0,a8w8_bpreshuffle_256x16x64x512_16x16_16x16_32x8x1_32x8x1_1x16x1x16_4x4x1_1x1_intrawave_v1,1.0,-1.0,-1.0
304,336,576,7168,11,0,11.6712,a8w8_bpreshuffle_256x16x64x512_16x16_16x16_32x8x1_32x8x1_1x16x1x16_4x4x1_1x1_intrawave_v1,237.72,593.28,0.0
304,336,896,5120,5,0,11.9177,a8w8_bpreshuffle_256x16x64x512_16x16_16x16_32x8x1_32x8x1_1x16x1x16_4x4x1_1x1_intrawave_v1,0.0,258.68,579.81
304,336,1024,5632,12,0,14.0099,a8w8_bpreshuffle_256x32x64x512_16x16_16x16_32x8x1_32x8x1_1x32x1x8_8x8x1_1x2_intrawave_v1,0.0,276.63,595.84
304,336,1056,1408,23,0,7.3292,a8w8_bpreshuffle_128x16x32x128_16x16_16x16_8x16x1_8x16x1_1x16x1x8_4x4x1_1x1_intrawave_v2,0.0,136.33,364.24
304,336,1280,4096,12,0,12.0406,a8w8_bpreshuffle_256x32x64x512_16x16_16x16_32x8x1_32x8x1_1x32x1x8_8x8x1_1x2_intrawave_v1,0.0,292.61,621.17
304,336,1408,352,0,0,-1.0,a8w8_bpreshuffle_256x128x128x128_16x16_16x16_8x32x1_8x32x1_1x32x1x8_8x8x1_2x1_intrawave_v3,1.0,-1.0,-1.0
304,336,1408,1408,76,0,-1.0,a8w8_bpreshuffle_256x32x64x128_16x16_16x16_8x32x1_8x32x1_1x32x1x8_8x8x1_2x1_intrawave_v1,1.0,-1.0,-1.0
304,336,1536,2048,113,0,-1.0,a8w8_bpreshuffle_256x48x64x256_16x16_16x16_16x16x1_16x16x1_1x16x1x16_4x4x1_1x1_intrawave_v1,1.0,-1.0,-1.0
304,336,1536,7168,113,0,20.0393,a8w8_bpreshuffle_256x48x64x256_16x16_16x16_16x16x1_16x16x1_1x16x1x16_4x4x1_1x1_intrawave_v1,369.21,721.12,0.0
304,336,1792,6144,113,0,-1.0,a8w8_bpreshuffle_256x48x64x256_16x16_16x16_16x16x1_16x16x1_1x16x1x16_4x4x1_1x1_intrawave_v1,1.0,-1.0,-1.0
304,336,2048,1536,113,0,-1.0,a8w8_bpreshuffle_256x48x64x256_16x16_16x16_16x16x1_16x16x1_1x16x1x16_4x4x1_1x1_intrawave_v1,1.0,-1.0,-1.0
304,336,2048,6144,113,0,-1.0,a8w8_bpreshuffle_256x48x64x256_16x16_16x16_16x16x1_16x16x1_1x16x1x16_4x4x1_1x1_intrawave_v1,1.0,-1.0,-1.0
304,336,2112,7168,113,0,22.9909,a8w8_bpreshuffle_256x48x64x256_16x16_16x16_16x16x1_16x16x1_1x16x1x16_4x4x1_1x1_intrawave_v1,442.49,824.96,0.0
304,336,3072,1536,119,0,9.5598,a8w8_bpreshuffle_256x32x128x256_16x16_16x16_16x16x1_16x16x1_1x16x1x16_8x8x1_1x2_intrawave_v1,331.69,763.52,0.0
304,336,3072,4096,120,0,-1.0,a8w8_bpreshuffle_256x48x128x256_16x16_16x16_16x16x1_16x16x1_1x16x1x16_8x8x1_1x2_intrawave_v1,1.0,-1.0,-1.0
304,336,3584,6144,120,0,-1.0,a8w8_bpreshuffle_256x48x128x256_16x16_16x16_16x16x1_16x16x1_1x16x1x16_8x8x1_1x2_intrawave_v1,1.0,-1.0,-1.0
304,336,4096,512,84,0,6.993,a8w8_bpreshuffle_256x32x128x128_16x16_16x16_8x32x1_8x32x1_1x32x1x8_8x8x1_2x1_intrawave_v1,201.53,718.1,0.0
304,336,4096,640,84,0,7.6275,a8w8_bpreshuffle_256x32x128x128_16x16_16x16_8x32x1_8x32x1_1x32x1x8_8x8x1_2x1_intrawave_v1,0.0,230.95,732.74
304,336,4096,1024,120,0,-1.0,a8w8_bpreshuffle_256x48x128x256_16x16_16x16_16x16x1_16x16x1_1x16x1x16_8x8x1_1x2_intrawave_v1,1.0,-1.0,-1.0
304,336,4096,3072,120,0,-1.0,a8w8_bpreshuffle_256x48x128x256_16x16_16x16_16x16x1_16x16x1_1x16x1x16_8x8x1_1x2_intrawave_v1,1.0,-1.0,-1.0
304,336,4608,7168,120,0,36.3512,a8w8_bpreshuffle_256x48x128x256_16x16_16x16_16x16x1_16x16x1_1x16x1x16_8x8x1_1x2_intrawave_v1,610.61,1060.08,0.0
304,336,5120,640,76,0,8.432,a8w8_bpreshuffle_256x32x64x128_16x16_16x16_8x32x1_8x32x1_1x32x1x8_8x8x1_2x1_intrawave_v1,0.0,261.15,822.16
304,336,5120,2048,120,0,14.185,a8w8_bpreshuffle_256x48x128x256_16x16_16x16_16x16x1_16x16x1_1x16x1x16_8x8x1_1x2_intrawave_v1,0.0,496.75,1030.28
304,336,6144,768,84,0,-1.0,a8w8_bpreshuffle_256x32x128x128_16x16_16x16_8x32x1_8x32x1_1x32x1x8_8x8x1_2x1_intrawave_v1,1.0,-1.0,-1.0
304,336,6144,1024,121,0,-1.0,a8w8_bpreshuffle_256x64x128x256_16x16_16x16_16x16x1_16x16x1_1x16x1x16_8x8x1_1x2_intrawave_v3,1.0,-1.0,-1.0
304,336,6144,1536,117,0,-1.0,a8w8_bpreshuffle_256x112x64x256_16x16_16x16_16x16x1_16x16x1_1x16x1x16_4x4x1_1x1_intrawave_v3,1.0,-1.0,-1.0
304,336,6144,2048,117,0,-1.0,a8w8_bpreshuffle_256x112x64x256_16x16_16x16_16x16x1_16x16x1_1x16x1x16_4x4x1_1x1_intrawave_v3,1.0,-1.0,-1.0
304,336,7168,256,73,0,-1.0,a8w8_bpreshuffle_256x32x256x64_16x16_16x16_4x32x1_4x64x1_1x32x1x8_8x8x1_2x1_intrawave_v1,1.0,-1.0,-1.0
304,336,7168,2048,120,0,20.7124,a8w8_bpreshuffle_256x48x128x256_16x16_16x16_16x16x1_16x16x1_1x16x1x16_8x8x1_1x2_intrawave_v1,476.28,974.54,0.0
304,336,7168,2304,120,0,-1.0,a8w8_bpreshuffle_256x48x128x256_16x16_16x16_16x16x1_16x16x1_1x16x1x16_8x8x1_1x2_intrawave_v1,1.0,-1.0,-1.0
304,344,192,7168,11,0,-1.0,a8w8_bpreshuffle_256x16x64x512_16x16_16x16_32x8x1_32x8x1_1x16x1x16_4x4x1_1x1_intrawave_v1,1.0,-1.0,-1.0
304,344,512,7168,11,0,-1.0,a8w8_bpreshuffle_256x16x64x512_16x16_16x16_32x8x1_32x8x1_1x16x1x16_4x4x1_1x1_intrawave_v1,1.0,-1.0,-1.0
304,344,576,7168,11,0,12.7359,a8w8_bpreshuffle_256x16x64x512_16x16_16x16_32x8x1_32x8x1_1x16x1x16_4x4x1_1x1_intrawave_v1,223.04,548.91,0.0
304,344,896,5120,12,0,-1.0,a8w8_bpreshuffle_256x32x64x512_16x16_16x16_32x8x1_32x8x1_1x32x1x8_8x8x1_1x2_intrawave_v1,1.0,-1.0,-1.0
304,344,1024,5632,26,0,-1.0,a8w8_bpreshuffle_256x32x64x512_16x16_16x16_32x8x1_32x8x1_1x32x1x8_8x8x1_1x2_intrawave_v2,1.0,-1.0,-1.0
304,344,1056,1408,23,0,-1.0,a8w8_bpreshuffle_128x16x32x128_16x16_16x16_8x16x1_8x16x1_1x16x1x8_4x4x1_1x1_intrawave_v2,1.0,-1.0,-1.0
304,344,1280,4096,12,0,-1.0,a8w8_bpreshuffle_256x32x64x512_16x16_16x16_32x8x1_32x8x1_1x32x1x8_8x8x1_1x2_intrawave_v1,1.0,-1.0,-1.0
304,344,1408,352,0,0,-1.0,a8w8_bpreshuffle_256x128x128x128_16x16_16x16_8x32x1_8x32x1_1x32x1x8_8x8x1_2x1_intrawave_v3,1.0,-1.0,-1.0
304,344,1408,1408,76,0,-1.0,a8w8_bpreshuffle_256x32x64x128_16x16_16x16_8x32x1_8x32x1_1x32x1x8_8x8x1_2x1_intrawave_v1,1.0,-1.0,-1.0
304,344,1536,2048,119,0,-1.0,a8w8_bpreshuffle_256x32x128x256_16x16_16x16_16x16x1_16x16x1_1x16x1x16_8x8x1_1x2_intrawave_v1,1.0,-1.0,-1.0
304,344,1536,7168,12,0,20.2439,a8w8_bpreshuffle_256x32x64x512_16x16_16x16_32x8x1_32x8x1_1x32x1x8_8x8x1_1x2_intrawave_v1,374.18,717.88,0.0
304,344,1792,6144,119,0,-1.0,a8w8_bpreshuffle_256x32x128x256_16x16_16x16_16x16x1_16x16x1_1x16x1x16_8x8x1_1x2_intrawave_v1,1.0,-1.0,-1.0
304,344,2048,1536,119,0,-1.0,a8w8_bpreshuffle_256x32x128x256_16x16_16x16_16x16x1_16x16x1_1x16x1x16_8x8x1_1x2_intrawave_v1,1.0,-1.0,-1.0
304,344,2048,6144,119,0,-1.0,a8w8_bpreshuffle_256x32x128x256_16x16_16x16_16x16x1_16x16x1_1x16x1x16_8x8x1_1x2_intrawave_v1,1.0,-1.0,-1.0
304,344,2112,7168,113,0,25.4244,a8w8_bpreshuffle_256x48x64x256_16x16_16x16_16x16x1_16x16x1_1x16x1x16_4x4x1_1x1_intrawave_v1,409.67,749.58,0.0
304,344,3072,1536,119,0,9.5186,a8w8_bpreshuffle_256x32x128x256_16x16_16x16_16x16x1_16x16x1_1x16x1x16_8x8x1_1x2_intrawave_v1,341.06,773.28,0.0
304,344,3072,4096,120,0,-1.0,a8w8_bpreshuffle_256x48x128x256_16x16_16x16_16x16x1_16x16x1_1x16x1x16_8x8x1_1x2_intrawave_v1,1.0,-1.0,-1.0
304,344,3584,6144,120,0,-1.0,a8w8_bpreshuffle_256x48x128x256_16x16_16x16_16x16x1_16x16x1_1x16x1x16_8x8x1_1x2_intrawave_v1,1.0,-1.0,-1.0
304,344,4096,512,84,0,7.1657,a8w8_bpreshuffle_256x32x128x128_16x16_16x16_8x32x1_8x32x1_1x32x1x8_8x8x1_2x1_intrawave_v1,201.35,710.51,0.0
304,344,4096,640,84,0,-1.0,a8w8_bpreshuffle_256x32x128x128_16x16_16x16_8x32x1_8x32x1_1x32x1x8_8x8x1_2x1_intrawave_v1,1.0,-1.0,-1.0
304,344,4096,1024,120,0,-1.0,a8w8_bpreshuffle_256x48x128x256_16x16_16x16_16x16x1_16x16x1_1x16x1x16_8x8x1_1x2_intrawave_v1,1.0,-1.0,-1.0
304,344,4096,3072,120,0,-1.0,a8w8_bpreshuffle_256x48x128x256_16x16_16x16_16x16x1_16x16x1_1x16x1x16_8x8x1_1x2_intrawave_v1,1.0,-1.0,-1.0
304,344,4608,7168,120,0,40.0335,a8w8_bpreshuffle_256x48x128x256_16x16_16x16_16x16x1_16x16x1_1x16x1x16_8x8x1_1x2_intrawave_v1,567.64,965.85,0.0
304,344,5120,640,76,0,-1.0,a8w8_bpreshuffle_256x32x64x128_16x16_16x16_8x32x1_8x32x1_1x32x1x8_8x8x1_2x1_intrawave_v1,1.0,-1.0,-1.0
304,344,5120,2048,121,0,-1.0,a8w8_bpreshuffle_256x64x128x256_16x16_16x16_16x16x1_16x16x1_1x16x1x16_8x8x1_1x2_intrawave_v3,1.0,-1.0,-1.0
304,344,6144,768,84,0,-1.0,a8w8_bpreshuffle_256x32x128x128_16x16_16x16_8x32x1_8x32x1_1x32x1x8_8x8x1_2x1_intrawave_v1,1.0,-1.0,-1.0
304,344,6144,1024,121,0,-1.0,a8w8_bpreshuffle_256x64x128x256_16x16_16x16_16x16x1_16x16x1_1x16x1x16_8x8x1_1x2_intrawave_v3,1.0,-1.0,-1.0
304,344,6144,1536,127,0,-1.0,a8w8_bpreshuffle_256x48x192x256_16x16_16x16_16x16x1_16x16x1_1x16x1x16_4x4x1_1x1_intrawave_v1,1.0,-1.0,-1.0
304,344,6144,2048,121,0,-1.0,a8w8_bpreshuffle_256x64x128x256_16x16_16x16_16x16x1_16x16x1_1x16x1x16_8x8x1_1x2_intrawave_v3,1.0,-1.0,-1.0
304,344,7168,256,73,0,-1.0,a8w8_bpreshuffle_256x32x256x64_16x16_16x16_4x32x1_4x64x1_1x32x1x8_8x8x1_2x1_intrawave_v1,1.0,-1.0,-1.0
304,344,7168,2048,123,0,20.8405,a8w8_bpreshuffle_256x96x128x256_16x16_16x16_16x16x1_16x16x1_1x16x1x16_8x8x1_1x2_intrawave_v3,484.63,974.84,0.0
304,344,7168,2304,123,0,-1.0,a8w8_bpreshuffle_256x96x128x256_16x16_16x16_16x16x1_16x16x1_1x16x1x16_8x8x1_1x2_intrawave_v3,1.0,-1.0,-1.0
304,352,192,7168,24,0,-1.0,a8w8_bpreshuffle_128x16x32x512_16x16_16x16_32x4x1_32x4x1_1x16x1x8_4x4x1_1x1_intrawave_v2,1.0,-1.0,-1.0
304,352,512,7168,5,0,-1.0,a8w8_bpreshuffle_256x16x64x512_16x16_16x16_32x8x1_32x8x1_1x16x1x16_4x4x1_1x1_intrawave_v1,1.0,-1.0,-1.0
304,352,576,7168,11,0,11.9947,a8w8_bpreshuffle_256x16x64x512_16x16_16x16_32x8x1_32x8x1_1x16x1x16_4x4x1_1x1_intrawave_v1,242.33,588.38,0.0
304,352,896,5120,12,0,-1.0,a8w8_bpreshuffle_256x32x64x512_16x16_16x16_32x8x1_32x8x1_1x32x1x8_8x8x1_1x2_intrawave_v1,1.0,-1.0,-1.0
304,352,1024,5632,112,0,-1.0,a8w8_bpreshuffle_256x32x64x256_16x16_16x16_16x16x1_16x16x1_1x32x1x8_8x8x1_2x1_intrawave_v1,1.0,-1.0,-1.0
304,352,1056,1408,23,0,-1.0,a8w8_bpreshuffle_128x16x32x128_16x16_16x16_8x16x1_8x16x1_1x16x1x8_4x4x1_1x1_intrawave_v2,1.0,-1.0,-1.0
304,352,1280,4096,112,0,-1.0,a8w8_bpreshuffle_256x32x64x256_16x16_16x16_16x16x1_16x16x1_1x32x1x8_8x8x1_2x1_intrawave_v1,1.0,-1.0,-1.0
304,352,1408,352,0,0,-1.0,a8w8_bpreshuffle_256x128x128x128_16x16_16x16_8x32x1_8x32x1_1x32x1x8_8x8x1_2x1_intrawave_v3,1.0,-1.0,-1.0
304,352,1408,1408,76,0,-1.0,a8w8_bpreshuffle_256x32x64x128_16x16_16x16_8x32x1_8x32x1_1x32x1x8_8x8x1_2x1_intrawave_v1,1.0,-1.0,-1.0
304,352,1536,2048,119,0,-1.0,a8w8_bpreshuffle_256x32x128x256_16x16_16x16_16x16x1_16x16x1_1x16x1x16_8x8x1_1x2_intrawave_v1,1.0,-1.0,-1.0
304,352,1536,7168,112,0,20.1553,a8w8_bpreshuffle_256x32x64x256_16x16_16x16_16x16x1_16x16x1_1x32x1x8_8x8x1_2x1_intrawave_v1,384.57,725.1,0.0
304,352,1792,6144,119,0,-1.0,a8w8_bpreshuffle_256x32x128x256_16x16_16x16_16x16x1_16x16x1_1x16x1x16_8x8x1_1x2_intrawave_v1,1.0,-1.0,-1.0
304,352,2048,1536,119,0,-1.0,a8w8_bpreshuffle_256x32x128x256_16x16_16x16_16x16x1_16x16x1_1x16x1x16_8x8x1_1x2_intrawave_v1,1.0,-1.0,-1.0
304,352,2048,6144,119,0,-1.0,a8w8_bpreshuffle_256x32x128x256_16x16_16x16_16x16x1_16x16x1_1x16x1x16_8x8x1_1x2_intrawave_v1,1.0,-1.0,-1.0
304,352,2112,7168,113,0,24.888,a8w8_bpreshuffle_256x48x64x256_16x16_16x16_16x16x1_16x16x1_1x16x1x16_4x4x1_1x1_intrawave_v1,428.23,769.4,0.0
304,352,3072,1536,119,0,9.5518,a8w8_bpreshuffle_256x32x128x256_16x16_16x16_16x16x1_16x16x1_1x16x1x16_8x8x1_1x2_intrawave_v1,347.78,777.02,0.0
304,352,3072,4096,119,0,-1.0,a8w8_bpreshuffle_256x32x128x256_16x16_16x16_16x16x1_16x16x1_1x16x1x16_8x8x1_1x2_intrawave_v1,1.0,-1.0,-1.0
304,352,3584,6144,120,0,-1.0,a8w8_bpreshuffle_256x48x128x256_16x16_16x16_16x16x1_16x16x1_1x16x1x16_8x8x1_1x2_intrawave_v1,1.0,-1.0,-1.0
304,352,4096,512,84,0,6.8136,a8w8_bpreshuffle_256x32x128x128_16x16_16x16_8x32x1_8x32x1_1x32x1x8_8x8x1_2x1_intrawave_v1,216.68,757.45,0.0
304,352,4096,640,84,0,-1.0,a8w8_bpreshuffle_256x32x128x128_16x16_16x16_8x32x1_8x32x1_1x32x1x8_8x8x1_2x1_intrawave_v1,1.0,-1.0,-1.0
304,352,4096,1024,120,0,-1.0,a8w8_bpreshuffle_256x48x128x256_16x16_16x16_16x16x1_16x16x1_1x16x1x16_8x8x1_1x2_intrawave_v1,1.0,-1.0,-1.0
304,352,4096,3072,120,0,-1.0,a8w8_bpreshuffle_256x48x128x256_16x16_16x16_16x16x1_16x16x1_1x16x1x16_8x8x1_1x2_intrawave_v1,1.0,-1.0,-1.0
304,352,4608,7168,120,0,40.0996,a8w8_bpreshuffle_256x48x128x256_16x16_16x16_16x16x1_16x16x1_1x16x1x16_8x8x1_1x2_intrawave_v1,579.89,967.52,0.0
304,352,5120,640,76,0,-1.0,a8w8_bpreshuffle_256x32x64x128_16x16_16x16_8x32x1_8x32x1_1x32x1x8_8x8x1_2x1_intrawave_v1,1.0,-1.0,-1.0
304,352,5120,2048,121,0,-1.0,a8w8_bpreshuffle_256x64x128x256_16x16_16x16_16x16x1_16x16x1_1x16x1x16_8x8x1_1x2_intrawave_v3,1.0,-1.0,-1.0
304,352,6144,768,84,0,-1.0,a8w8_bpreshuffle_256x32x128x128_16x16_16x16_8x32x1_8x32x1_1x32x1x8_8x8x1_2x1_intrawave_v1,1.0,-1.0,-1.0
304,352,6144,1024,121,0,-1.0,a8w8_bpreshuffle_256x64x128x256_16x16_16x16_16x16x1_16x16x1_1x16x1x16_8x8x1_1x2_intrawave_v3,1.0,-1.0,-1.0
304,352,6144,1536,121,0,-1.0,a8w8_bpreshuffle_256x64x128x256_16x16_16x16_16x16x1_16x16x1_1x16x1x16_8x8x1_1x2_intrawave_v3,1.0,-1.0,-1.0
304,352,6144,2048,121,0,-1.0,a8w8_bpreshuffle_256x64x128x256_16x16_16x16_16x16x1_16x16x1_1x16x1x16_8x8x1_1x2_intrawave_v3,1.0,-1.0,-1.0
304,352,7168,256,73,0,-1.0,a8w8_bpreshuffle_256x32x256x64_16x16_16x16_4x32x1_4x64x1_1x32x1x8_8x8x1_2x1_intrawave_v1,1.0,-1.0,-1.0
304,352,7168,2048,123,0,21.1014,a8w8_bpreshuffle_256x96x128x256_16x16_16x16_16x16x1_16x16x1_1x16x1x16_8x8x1_1x2_intrawave_v3,489.77,969.0,0.0
304,352,7168,2304,123,0,-1.0,a8w8_bpreshuffle_256x96x128x256_16x16_16x16_16x16x1_16x16x1_1x16x1x16_8x8x1_1x2_intrawave_v3,1.0,-1.0,-1.0
304,360,192,7168,11,0,-1.0,a8w8_bpreshuffle_256x16x64x512_16x16_16x16_32x8x1_32x8x1_1x16x1x16_4x4x1_1x1_intrawave_v1,1.0,-1.0,-1.0
304,360,512,7168,11,0,-1.0,a8w8_bpreshuffle_256x16x64x512_16x16_16x16_32x8x1_32x8x1_1x16x1x16_4x4x1_1x1_intrawave_v1,1.0,-1.0,-1.0
304,360,576,7168,11,0,13.8473,a8w8_bpreshuffle_256x16x64x512_16x16_16x16_32x8x1_32x8x1_1x16x1x16_4x4x1_1x1_intrawave_v1,214.68,514.47,0.0
304,360,896,5120,12,0,-1.0,a8w8_bpreshuffle_256x32x64x512_16x16_16x16_32x8x1_32x8x1_1x32x1x8_8x8x1_1x2_intrawave_v1,1.0,-1.0,-1.0
304,360,1024,5632,26,0,-1.0,a8w8_bpreshuffle_256x32x64x512_16x16_16x16_32x8x1_32x8x1_1x32x1x8_8x8x1_1x2_intrawave_v2,1.0,-1.0,-1.0
304,360,1056,1408,23,0,-1.0,a8w8_bpreshuffle_128x16x32x128_16x16_16x16_8x16x1_8x16x1_1x16x1x8_4x4x1_1x1_intrawave_v2,1.0,-1.0,-1.0
304,360,1280,4096,12,0,-1.0,a8w8_bpreshuffle_256x32x64x512_16x16_16x16_32x8x1_32x8x1_1x32x1x8_8x8x1_1x2_intrawave_v1,1.0,-1.0,-1.0
304,360,1408,352,0,0,-1.0,a8w8_bpreshuffle_256x128x128x128_16x16_16x16_8x32x1_8x32x1_1x32x1x8_8x8x1_2x1_intrawave_v3,1.0,-1.0,-1.0
304,360,1408,1408,76,0,-1.0,a8w8_bpreshuffle_256x32x64x128_16x16_16x16_8x32x1_8x32x1_1x32x1x8_8x8x1_2x1_intrawave_v1,1.0,-1.0,-1.0
304,360,1536,2048,12,0,-1.0,a8w8_bpreshuffle_256x32x64x512_16x16_16x16_32x8x1_32x8x1_1x32x1x8_8x8x1_1x2_intrawave_v1,1.0,-1.0,-1.0
304,360,1536,7168,12,0,20.5308,a8w8_bpreshuffle_256x32x64x512_16x16_16x16_32x8x1_32x8x1_1x32x1x8_8x8x1_1x2_intrawave_v1,386.11,715.82,0.0
304,360,1792,6144,119,0,-1.0,a8w8_bpreshuffle_256x32x128x256_16x16_16x16_16x16x1_16x16x1_1x16x1x16_8x8x1_1x2_intrawave_v1,1.0,-1.0,-1.0
304,360,2048,1536,119,0,-1.0,a8w8_bpreshuffle_256x32x128x256_16x16_16x16_16x16x1_16x16x1_1x16x1x16_8x8x1_1x2_intrawave_v1,1.0,-1.0,-1.0
304,360,2048,6144,119,0,-1.0,a8w8_bpreshuffle_256x32x128x256_16x16_16x16_16x16x1_16x16x1_1x16x1x16_8x8x1_1x2_intrawave_v1,1.0,-1.0,-1.0
304,360,2112,7168,113,0,25.2944,a8w8_bpreshuffle_256x48x64x256_16x16_16x16_16x16x1_16x16x1_1x16x1x16_4x4x1_1x1_intrawave_v1,430.92,760.64,0.0
304,360,3072,1536,119,0,9.6959,a8w8_bpreshuffle_256x32x128x256_16x16_16x16_16x16x1_16x16x1_1x16x1x16_8x8x1_1x2_intrawave_v1,350.39,771.81,0.0
304,360,3072,4096,114,0,-1.0,a8w8_bpreshuffle_256x64x64x256_16x16_16x16_16x16x1_16x16x1_1x32x1x8_8x8x1_2x1_intrawave_v3,1.0,-1.0,-1.0
304,360,3584,6144,120,0,-1.0,a8w8_bpreshuffle_256x48x128x256_16x16_16x16_16x16x1_16x16x1_1x16x1x16_8x8x1_1x2_intrawave_v1,1.0,-1.0,-1.0
304,360,4096,512,84,0,7.364,a8w8_bpreshuffle_256x32x128x128_16x16_16x16_8x32x1_8x32x1_1x32x1x8_8x8x1_2x1_intrawave_v1,205.04,710.29,0.0
304,360,4096,640,84,0,-1.0,a8w8_bpreshuffle_256x32x128x128_16x16_16x16_8x32x1_8x32x1_1x32x1x8_8x8x1_2x1_intrawave_v1,1.0,-1.0,-1.0
304,360,4096,1024,120,0,-1.0,a8w8_bpreshuffle_256x48x128x256_16x16_16x16_16x16x1_16x16x1_1x16x1x16_8x8x1_1x2_intrawave_v1,1.0,-1.0,-1.0
304,360,4096,3072,120,0,-1.0,a8w8_bpreshuffle_256x48x128x256_16x16_16x16_16x16x1_16x16x1_1x16x1x16_8x8x1_1x2_intrawave_v1,1.0,-1.0,-1.0
304,360,4608,7168,120,0,40.0915,a8w8_bpreshuffle_256x48x128x256_16x16_16x16_16x16x1_16x16x1_1x16x1x16_8x8x1_1x2_intrawave_v1,593.19,970.99,0.0
304,360,5120,640,84,0,-1.0,a8w8_bpreshuffle_256x32x128x128_16x16_16x16_8x32x1_8x32x1_1x32x1x8_8x8x1_2x1_intrawave_v1,1.0,-1.0,-1.0
304,360,5120,2048,121,0,-1.0,a8w8_bpreshuffle_256x64x128x256_16x16_16x16_16x16x1_16x16x1_1x16x1x16_8x8x1_1x2_intrawave_v3,1.0,-1.0,-1.0
304,360,6144,768,77,0,-1.0,a8w8_bpreshuffle_256x64x64x128_16x16_16x16_8x32x1_8x32x1_1x32x1x8_8x8x1_2x1_intrawave_v3,1.0,-1.0,-1.0
304,360,6144,1024,121,0,-1.0,a8w8_bpreshuffle_256x64x128x256_16x16_16x16_16x16x1_16x16x1_1x16x1x16_8x8x1_1x2_intrawave_v3,1.0,-1.0,-1.0
304,360,6144,1536,121,0,-1.0,a8w8_bpreshuffle_256x64x128x256_16x16_16x16_16x16x1_16x16x1_1x16x1x16_8x8x1_1x2_intrawave_v3,1.0,-1.0,-1.0
304,360,6144,2048,121,0,-1.0,a8w8_bpreshuffle_256x64x128x256_16x16_16x16_16x16x1_16x16x1_1x16x1x16_8x8x1_1x2_intrawave_v3,1.0,-1.0,-1.0
304,360,7168,256,73,0,-1.0,a8w8_bpreshuffle_256x32x256x64_16x16_16x16_4x32x1_4x64x1_1x32x1x8_8x8x1_2x1_intrawave_v1,1.0,-1.0,-1.0
304,360,7168,2048,123,0,21.0492,a8w8_bpreshuffle_256x96x128x256_16x16_16x16_16x16x1_16x16x1_1x16x1x16_8x8x1_1x2_intrawave_v3,502.14,977.63,0.0
304,360,7168,2304,123,0,-1.0,a8w8_bpreshuffle_256x96x128x256_16x16_16x16_16x16x1_16x16x1_1x16x1x16_8x8x1_1x2_intrawave_v3,1.0,-1.0,-1.0
304,368,192,7168,24,0,-1.0,a8w8_bpreshuffle_128x16x32x512_16x16_16x16_32x4x1_32x4x1_1x16x1x8_4x4x1_1x1_intrawave_v2,1.0,-1.0,-1.0
304,368,512,7168,11,0,-1.0,a8w8_bpreshuffle_256x16x64x512_16x16_16x16_32x8x1_32x8x1_1x16x1x16_4x4x1_1x1_intrawave_v1,1.0,-1.0,-1.0
304,368,576,7168,19,0,12.5865,a8w8_bpreshuffle_256x16x64x512_16x16_16x16_32x8x1_32x8x1_1x16x1x16_4x4x1_1x1_intrawave_v2,241.43,571.29,0.0
304,368,896,5120,12,0,12.5335,a8w8_bpreshuffle_256x32x64x512_16x16_16x16_32x8x1_32x8x1_1x32x1x8_8x8x1_1x2_intrawave_v1,0.0,269.39,568.97
304,368,1024,5632,6,0,14.4413,a8w8_bpreshuffle_256x16x128x512_16x16_16x16_32x8x1_32x8x1_1x16x1x16_8x8x1_1x2_intrawave_v1,0.0,293.92,595.06
304,368,1056,1408,23,0,7.4361,a8w8_bpreshuffle_128x16x32x128_16x16_16x16_8x16x1_8x16x1_1x16x1x8_4x4x1_1x1_intrawave_v2,0.0,147.16,374.15
304,368,1280,4096,12,0,12.882,a8w8_bpreshuffle_256x32x64x512_16x16_16x16_32x8x1_32x8x1_1x32x1x8_8x8x1_1x2_intrawave_v1,0.0,299.55,597.13
304,368,1408,352,0,0,-1.0,a8w8_bpreshuffle_256x128x128x128_16x16_16x16_8x32x1_8x32x1_1x32x1x8_8x8x1_2x1_intrawave_v3,1.0,-1.0,-1.0
304,368,1408,1408,76,0,-1.0,a8w8_bpreshuffle_256x32x64x128_16x16_16x16_8x32x1_8x32x1_1x32x1x8_8x8x1_2x1_intrawave_v1,1.0,-1.0,-1.0
304,368,1536,2048,119,0,-1.0,a8w8_bpreshuffle_256x32x128x256_16x16_16x16_16x16x1_16x16x1_1x16x1x16_8x8x1_1x2_intrawave_v1,1.0,-1.0,-1.0
304,368,1536,7168,12,0,21.3104,a8w8_bpreshuffle_256x32x64x512_16x16_16x16_32x8x1_32x8x1_1x32x1x8_8x8x1_1x2_intrawave_v1,380.26,693.48,0.0
304,368,1792,6144,119,0,-1.0,a8w8_bpreshuffle_256x32x128x256_16x16_16x16_16x16x1_16x16x1_1x16x1x16_8x8x1_1x2_intrawave_v1,1.0,-1.0,-1.0
304,368,2048,1536,119,0,-1.0,a8w8_bpreshuffle_256x32x128x256_16x16_16x16_16x16x1_16x16x1_1x16x1x16_8x8x1_1x2_intrawave_v1,1.0,-1.0,-1.0
304,368,2048,6144,113,0,-1.0,a8w8_bpreshuffle_256x48x64x256_16x16_16x16_16x16x1_16x16x1_1x16x1x16_4x4x1_1x1_intrawave_v1,1.0,-1.0,-1.0
304,368,2112,7168,113,0,25.0196,a8w8_bpreshuffle_256x48x64x256_16x16_16x16_16x16x1_16x16x1_1x16x1x16_4x4x1_1x1_intrawave_v1,445.34,772.64,0.0
304,368,3072,1536,119,0,9.6983,a8w8_bpreshuffle_256x32x128x256_16x16_16x16_16x16x1_16x16x1_1x16x1x16_8x8x1_1x2_intrawave_v1,358.09,777.95,0.0
304,368,3072,4096,120,0,-1.0,a8w8_bpreshuffle_256x48x128x256_16x16_16x16_16x16x1_16x16x1_1x16x1x16_8x8x1_1x2_intrawave_v1,1.0,-1.0,-1.0
304,368,3584,6144,120,0,-1.0,a8w8_bpreshuffle_256x48x128x256_16x16_16x16_16x16x1_16x16x1_1x16x1x16_8x8x1_1x2_intrawave_v1,1.0,-1.0,-1.0
304,368,4096,512,84,0,7.1017,a8w8_bpreshuffle_256x32x128x128_16x16_16x16_8x32x1_8x32x1_1x32x1x8_8x8x1_2x1_intrawave_v1,217.34,746.33,0.0
304,368,4096,640,84,0,7.8243,a8w8_bpreshuffle_256x32x128x128_16x16_16x16_8x32x1_8x32x1_1x32x1x8_8x8x1_2x1_intrawave_v1,0.0,246.59,750.43
304,368,4096,1024,120,0,-1.0,a8w8_bpreshuffle_256x48x128x256_16x16_16x16_16x16x1_16x16x1_1x16x1x16_8x8x1_1x2_intrawave_v1,1.0,-1.0,-1.0
304,368,4096,3072,120,0,-1.0,a8w8_bpreshuffle_256x48x128x256_16x16_16x16_16x16x1_16x16x1_1x16x1x16_8x8x1_1x2_intrawave_v1,1.0,-1.0,-1.0
304,368,4608,7168,120,0,40.0041,a8w8_bpreshuffle_256x48x128x256_16x16_16x16_16x16x1_16x16x1_1x16x1x16_8x8x1_1x2_intrawave_v1,607.69,976.39,0.0
304,368,5120,640,84,0,8.7324,a8w8_bpreshuffle_256x32x128x128_16x16_16x16_8x32x1_8x32x1_1x32x1x8_8x8x1_2x1_intrawave_v1,0.0,276.18,833.75
304,368,5120,2048,121,0,16.913,a8w8_bpreshuffle_256x64x128x256_16x16_16x16_16x16x1_16x16x1_1x16x1x16_8x8x1_1x2_intrawave_v3,0.0,456.31,887.35
304,368,6144,768,84,0,-1.0,a8w8_bpreshuffle_256x32x128x128_16x16_16x16_8x32x1_8x32x1_1x32x1x8_8x8x1_2x1_intrawave_v1,1.0,-1.0,-1.0
304,368,6144,1024,121,0,-1.0,a8w8_bpreshuffle_256x64x128x256_16x16_16x16_16x16x1_16x16x1_1x16x1x16_8x8x1_1x2_intrawave_v3,1.0,-1.0,-1.0
304,368,6144,1536,121,0,-1.0,a8w8_bpreshuffle_256x64x128x256_16x16_16x16_16x16x1_16x16x1_1x16x1x16_8x8x1_1x2_intrawave_v3,1.0,-1.0,-1.0
304,368,6144,2048,121,0,-1.0,a8w8_bpreshuffle_256x64x128x256_16x16_16x16_16x16x1_16x16x1_1x16x1x16_8x8x1_1x2_intrawave_v3,1.0,-1.0,-1.0
304,368,7168,256,73,0,-1.0,a8w8_bpreshuffle_256x32x256x64_16x16_16x16_4x32x1_4x64x1_1x32x1x8_8x8x1_2x1_intrawave_v1,1.0,-1.0,-1.0
304,368,7168,2048,123,0,21.2412,a8w8_bpreshuffle_256x96x128x256_16x16_16x16_16x16x1_16x16x1_1x16x1x16_8x8x1_1x2_intrawave_v3,508.66,974.96,0.0
304,368,7168,2304,123,0,-1.0,a8w8_bpreshuffle_256x96x128x256_16x16_16x16_16x16x1_16x16x1_1x16x1x16_8x8x1_1x2_intrawave_v3,1.0,-1.0,-1.0
304,376,192,7168,11,0,-1.0,a8w8_bpreshuffle_256x16x64x512_16x16_16x16_32x8x1_32x8x1_1x16x1x16_4x4x1_1x1_intrawave_v1,1.0,-1.0,-1.0
304,376,512,7168,5,0,-1.0,a8w8_bpreshuffle_256x16x64x512_16x16_16x16_32x8x1_32x8x1_1x16x1x16_4x4x1_1x1_intrawave_v1,1.0,-1.0,-1.0
304,376,576,7168,11,0,13.667,a8w8_bpreshuffle_256x16x64x512_16x16_16x16_32x8x1_32x8x1_1x16x1x16_4x4x1_1x1_intrawave_v1,227.18,530.99,0.0
304,376,896,5120,12,0,-1.0,a8w8_bpreshuffle_256x32x64x512_16x16_16x16_32x8x1_32x8x1_1x32x1x8_8x8x1_1x2_intrawave_v1,1.0,-1.0,-1.0
304,376,1024,5632,26,0,-1.0,a8w8_bpreshuffle_256x32x64x512_16x16_16x16_32x8x1_32x8x1_1x32x1x8_8x8x1_1x2_intrawave_v2,1.0,-1.0,-1.0
304,376,1056,1408,23,0,-1.0,a8w8_bpreshuffle_128x16x32x128_16x16_16x16_8x16x1_8x16x1_1x16x1x8_4x4x1_1x1_intrawave_v2,1.0,-1.0,-1.0
304,376,1280,4096,12,0,-1.0,a8w8_bpreshuffle_256x32x64x512_16x16_16x16_32x8x1_32x8x1_1x32x1x8_8x8x1_1x2_intrawave_v1,1.0,-1.0,-1.0
304,376,1408,352,0,0,-1.0,a8w8_bpreshuffle_256x128x128x128_16x16_16x16_8x32x1_8x32x1_1x32x1x8_8x8x1_2x1_intrawave_v3,1.0,-1.0,-1.0
304,376,1408,1408,76,0,-1.0,a8w8_bpreshuffle_256x32x64x128_16x16_16x16_8x32x1_8x32x1_1x32x1x8_8x8x1_2x1_intrawave_v1,1.0,-1.0,-1.0
304,376,1536,2048,119,0,-1.0,a8w8_bpreshuffle_256x32x128x256_16x16_16x16_16x16x1_16x16x1_1x16x1x16_8x8x1_1x2_intrawave_v1,1.0,-1.0,-1.0
304,376,1536,7168,12,0,21.5605,a8w8_bpreshuffle_256x32x64x512_16x16_16x16_32x8x1_32x8x1_1x32x1x8_8x8x1_1x2_intrawave_v1,384.02,689.24,0.0
304,376,1792,6144,113,0,-1.0,a8w8_bpreshuffle_256x48x64x256_16x16_16x16_16x16x1_16x16x1_1x16x1x16_4x4x1_1x1_intrawave_v1,1.0,-1.0,-1.0
304,376,2048,1536,119,0,-1.0,a8w8_bpreshuffle_256x32x128x256_16x16_16x16_16x16x1_16x16x1_1x16x1x16_8x8x1_1x2_intrawave_v1,1.0,-1.0,-1.0
304,376,2048,6144,113,0,-1.0,a8w8_bpreshuffle_256x48x64x256_16x16_16x16_16x16x1_16x16x1_1x16x1x16_4x4x1_1x1_intrawave_v1,1.0,-1.0,-1.0
304,376,2112,7168,113,0,25.3883,a8w8_bpreshuffle_256x48x64x256_16x16_16x16_16x16x1_16x16x1_1x16x1x16_4x4x1_1x1_intrawave_v1,448.41,765.01,0.0
304,376,3072,1536,119,0,9.8004,a8w8_bpreshuffle_256x32x128x256_16x16_16x16_16x16x1_16x16x1_1x16x1x16_8x8x1_1x2_intrawave_v1,362.06,776.12,0.0
304,376,3072,4096,120,0,-1.0,a8w8_bpreshuffle_256x48x128x256_16x16_16x16_16x16x1_16x16x1_1x16x1x16_8x8x1_1x2_intrawave_v1,1.0,-1.0,-1.0
304,376,3584,6144,120,0,-1.0,a8w8_bpreshuffle_256x48x128x256_16x16_16x16_16x16x1_16x16x1_1x16x1x16_8x8x1_1x2_intrawave_v1,1.0,-1.0,-1.0
304,376,4096,512,84,0,7.0669,a8w8_bpreshuffle_256x32x128x128_16x16_16x16_8x32x1_8x32x1_1x32x1x8_8x8x1_2x1_intrawave_v1,223.16,759.86,0.0
304,376,4096,640,84,0,-1.0,a8w8_bpreshuffle_256x32x128x128_16x16_16x16_8x32x1_8x32x1_1x32x1x8_8x8x1_2x1_intrawave_v1,1.0,-1.0,-1.0
304,376,4096,1024,120,0,-1.0,a8w8_bpreshuffle_256x48x128x256_16x16_16x16_16x16x1_16x16x1_1x16x1x16_8x8x1_1x2_intrawave_v1,1.0,-1.0,-1.0
304,376,4096,3072,120,0,-1.0,a8w8_bpreshuffle_256x48x128x256_16x16_16x16_16x16x1_16x16x1_1x16x1x16_8x8x1_1x2_intrawave_v1,1.0,-1.0,-1.0
304,376,4608,7168,120,0,40.1886,a8w8_bpreshuffle_256x48x128x256_16x16_16x16_16x16x1_16x16x1_1x16x1x16_8x8x1_1x2_intrawave_v1,618.05,975.17,0.0
304,376,5120,640,84,0,-1.0,a8w8_bpreshuffle_256x32x128x128_16x16_16x16_8x32x1_8x32x1_1x32x1x8_8x8x1_2x1_intrawave_v1,1.0,-1.0,-1.0
304,376,5120,2048,121,0,-1.0,a8w8_bpreshuffle_256x64x128x256_16x16_16x16_16x16x1_16x16x1_1x16x1x16_8x8x1_1x2_intrawave_v3,1.0,-1.0,-1.0
304,376,6144,768,84,0,-1.0,a8w8_bpreshuffle_256x32x128x128_16x16_16x16_8x32x1_8x32x1_1x32x1x8_8x8x1_2x1_intrawave_v1,1.0,-1.0,-1.0
304,376,6144,1024,121,0,-1.0,a8w8_bpreshuffle_256x64x128x256_16x16_16x16_16x16x1_16x16x1_1x16x1x16_8x8x1_1x2_intrawave_v3,1.0,-1.0,-1.0
304,376,6144,1536,121,0,-1.0,a8w8_bpreshuffle_256x64x128x256_16x16_16x16_16x16x1_16x16x1_1x16x1x16_8x8x1_1x2_intrawave_v3,1.0,-1.0,-1.0
304,376,6144,2048,121,0,-1.0,a8w8_bpreshuffle_256x64x128x256_16x16_16x16_16x16x1_16x16x1_1x16x1x16_8x8x1_1x2_intrawave_v3,1.0,-1.0,-1.0
304,376,7168,256,73,0,-1.0,a8w8_bpreshuffle_256x32x256x64_16x16_16x16_4x32x1_4x64x1_1x32x1x8_8x8x1_2x1_intrawave_v1,1.0,-1.0,-1.0
304,376,7168,2048,123,0,21.2302,a8w8_bpreshuffle_256x96x128x256_16x16_16x16_16x16x1_16x16x1_1x16x1x16_8x8x1_1x2_intrawave_v3,519.99,981.64,0.0
304,376,7168,2304,123,0,-1.0,a8w8_bpreshuffle_256x96x128x256_16x16_16x16_16x16x1_16x16x1_1x16x1x16_8x8x1_1x2_intrawave_v3,1.0,-1.0,-1.0
304,384,192,7168,24,0,-1.0,a8w8_bpreshuffle_128x16x32x512_16x16_16x16_32x4x1_32x4x1_1x16x1x8_4x4x1_1x1_intrawave_v2,1.0,-1.0,-1.0
304,384,512,7168,5,0,-1.0,a8w8_bpreshuffle_256x16x64x512_16x16_16x16_32x8x1_32x8x1_1x16x1x16_4x4x1_1x1_intrawave_v1,1.0,-1.0,-1.0
304,384,576,7168,11,0,11.5615,a8w8_bpreshuffle_256x16x64x512_16x16_16x16_32x8x1_32x8x1_1x16x1x16_4x4x1_1x1_intrawave_v1,274.26,633.45,0.0
304,384,896,5120,12,0,-1.0,a8w8_bpreshuffle_256x32x64x512_16x16_16x16_32x8x1_32x8x1_1x32x1x8_8x8x1_1x2_intrawave_v1,1.0,-1.0,-1.0
304,384,1024,5632,112,0,-1.0,a8w8_bpreshuffle_256x32x64x256_16x16_16x16_16x16x1_16x16x1_1x32x1x8_8x8x1_2x1_intrawave_v1,1.0,-1.0,-1.0
304,384,1056,1408,23,0,-1.0,a8w8_bpreshuffle_128x16x32x128_16x16_16x16_8x16x1_8x16x1_1x16x1x8_4x4x1_1x1_intrawave_v2,1.0,-1.0,-1.0
304,384,1280,4096,112,0,-1.0,a8w8_bpreshuffle_256x32x64x256_16x16_16x16_16x16x1_16x16x1_1x32x1x8_8x8x1_2x1_intrawave_v1,1.0,-1.0,-1.0
304,384,1408,352,0,0,-1.0,a8w8_bpreshuffle_256x128x128x128_16x16_16x16_8x32x1_8x32x1_1x32x1x8_8x8x1_2x1_intrawave_v3,1.0,-1.0,-1.0
304,384,1408,1408,76,0,-1.0,a8w8_bpreshuffle_256x32x64x128_16x16_16x16_8x32x1_8x32x1_1x32x1x8_8x8x1_2x1_intrawave_v1,1.0,-1.0,-1.0
304,384,1536,2048,119,0,-1.0,a8w8_bpreshuffle_256x32x128x256_16x16_16x16_16x16x1_16x16x1_1x16x1x16_8x8x1_1x2_intrawave_v1,1.0,-1.0,-1.0
304,384,1536,7168,112,0,20.8291,a8w8_bpreshuffle_256x32x64x256_16x16_16x16_16x16x1_16x16x1_1x32x1x8_8x8x1_2x1_intrawave_v1,405.96,717.37,0.0
304,384,1792,6144,113,0,-1.0,a8w8_bpreshuffle_256x48x64x256_16x16_16x16_16x16x1_16x16x1_1x16x1x16_4x4x1_1x1_intrawave_v1,1.0,-1.0,-1.0
304,384,2048,1536,119,0,-1.0,a8w8_bpreshuffle_256x32x128x256_16x16_16x16_16x16x1_16x16x1_1x16x1x16_8x8x1_1x2_intrawave_v1,1.0,-1.0,-1.0
304,384,2048,6144,113,0,-1.0,a8w8_bpreshuffle_256x48x64x256_16x16_16x16_16x16x1_16x16x1_1x16x1x16_4x4x1_1x1_intrawave_v1,1.0,-1.0,-1.0
304,384,2112,7168,113,0,24.7194,a8w8_bpreshuffle_256x48x64x256_16x16_16x16_16x16x1_16x16x1_1x16x1x16_4x4x1_1x1_intrawave_v1,470.34,789.39,0.0
304,384,3072,1536,119,0,9.7034,a8w8_bpreshuffle_256x32x128x256_16x16_16x16_16x16x1_16x16x1_1x16x1x16_8x8x1_1x2_intrawave_v1,373.46,790.21,0.0
304,384,3072,4096,114,0,-1.0,a8w8_bpreshuffle_256x64x64x256_16x16_16x16_16x16x1_16x16x1_1x32x1x8_8x8x1_2x1_intrawave_v3,1.0,-1.0,-1.0
304,384,3584,6144,120,0,-1.0,a8w8_bpreshuffle_256x48x128x256_16x16_16x16_16x16x1_16x16x1_1x16x1x16_8x8x1_1x2_intrawave_v1,1.0,-1.0,-1.0
304,384,4096,512,84,0,7.4437,a8w8_bpreshuffle_256x32x128x128_16x16_16x16_8x32x1_8x32x1_1x32x1x8_8x8x1_2x1_intrawave_v1,216.37,730.75,0.0
304,384,4096,640,84,0,-1.0,a8w8_bpreshuffle_256x32x128x128_16x16_16x16_8x32x1_8x32x1_1x32x1x8_8x8x1_2x1_intrawave_v1,1.0,-1.0,-1.0
304,384,4096,1024,120,0,-1.0,a8w8_bpreshuffle_256x48x128x256_16x16_16x16_16x16x1_16x16x1_1x16x1x16_8x8x1_1x2_intrawave_v1,1.0,-1.0,-1.0
304,384,4096,3072,120,0,-1.0,a8w8_bpreshuffle_256x48x128x256_16x16_16x16_16x16x1_16x16x1_1x16x1x16_8x8x1_1x2_intrawave_v1,1.0,-1.0,-1.0
304,384,4608,7168,120,0,38.5145,a8w8_bpreshuffle_256x48x128x256_16x16_16x16_16x16x1_16x16x1_1x16x1x16_8x8x1_1x2_intrawave_v1,658.64,1020.96,0.0
304,384,5120,640,84,0,-1.0,a8w8_bpreshuffle_256x32x128x128_16x16_16x16_8x32x1_8x32x1_1x32x1x8_8x8x1_2x1_intrawave_v1,1.0,-1.0,-1.0
304,384,5120,2048,121,0,-1.0,a8w8_bpreshuffle_256x64x128x256_16x16_16x16_16x16x1_16x16x1_1x16x1x16_8x8x1_1x2_intrawave_v3,1.0,-1.0,-1.0
304,384,6144,768,84,0,-1.0,a8w8_bpreshuffle_256x32x128x128_16x16_16x16_8x32x1_8x32x1_1x32x1x8_8x8x1_2x1_intrawave_v1,1.0,-1.0,-1.0
304,384,6144,1024,121,0,-1.0,a8w8_bpreshuffle_256x64x128x256_16x16_16x16_16x16x1_16x16x1_1x16x1x16_8x8x1_1x2_intrawave_v3,1.0,-1.0,-1.0
304,384,6144,1536,121,0,-1.0,a8w8_bpreshuffle_256x64x128x256_16x16_16x16_16x16x1_16x16x1_1x16x1x16_8x8x1_1x2_intrawave_v3,1.0,-1.0,-1.0
304,384,6144,2048,121,0,-1.0,a8w8_bpreshuffle_256x64x128x256_16x16_16x16_16x16x1_16x16x1_1x16x1x16_8x8x1_1x2_intrawave_v3,1.0,-1.0,-1.0
304,384,7168,256,73,0,-1.0,a8w8_bpreshuffle_256x32x256x64_16x16_16x16_4x32x1_4x64x1_1x32x1x8_8x8x1_2x1_intrawave_v1,1.0,-1.0,-1.0
304,384,7168,2048,123,0,21.2024,a8w8_bpreshuffle_256x96x128x256_16x16_16x16_16x16x1_16x16x1_1x16x1x16_8x8x1_1x2_intrawave_v3,531.75,989.11,0.0
304,384,7168,2304,123,0,-1.0,a8w8_bpreshuffle_256x96x128x256_16x16_16x16_16x16x1_16x16x1_1x16x1x16_8x8x1_1x2_intrawave_v3,1.0,-1.0,-1.0
304,392,192,7168,10,0,-1.0,a8w8_bpreshuffle_128x16x32x512_16x16_16x16_32x4x1_32x4x1_1x16x1x8_4x4x1_1x1_intrawave_v1,1.0,-1.0,-1.0
304,392,512,7168,11,0,-1.0,a8w8_bpreshuffle_256x16x64x512_16x16_16x16_32x8x1_32x8x1_1x16x1x16_4x4x1_1x1_intrawave_v1,1.0,-1.0,-1.0
304,392,576,7168,11,0,14.2921,a8w8_bpreshuffle_256x16x64x512_16x16_16x16_32x8x1_32x8x1_1x16x1x16_4x4x1_1x1_intrawave_v1,226.49,517.08,0.0
304,392,896,5120,12,0,-1.0,a8w8_bpreshuffle_256x32x64x512_16x16_16x16_32x8x1_32x8x1_1x32x1x8_8x8x1_1x2_intrawave_v1,1.0,-1.0,-1.0
304,392,1024,5632,26,0,-1.0,a8w8_bpreshuffle_256x32x64x512_16x16_16x16_32x8x1_32x8x1_1x32x1x8_8x8x1_1x2_intrawave_v2,1.0,-1.0,-1.0
304,392,1056,1408,23,0,-1.0,a8w8_bpreshuffle_128x16x32x128_16x16_16x16_8x16x1_8x16x1_1x16x1x8_4x4x1_1x1_intrawave_v2,1.0,-1.0,-1.0
304,392,1280,4096,119,0,-1.0,a8w8_bpreshuffle_256x32x128x256_16x16_16x16_16x16x1_16x16x1_1x16x1x16_8x8x1_1x2_intrawave_v1,1.0,-1.0,-1.0
304,392,1408,352,0,0,-1.0,a8w8_bpreshuffle_256x128x128x128_16x16_16x16_8x32x1_8x32x1_1x32x1x8_8x8x1_2x1_intrawave_v3,1.0,-1.0,-1.0
304,392,1408,1408,76,0,-1.0,a8w8_bpreshuffle_256x32x64x128_16x16_16x16_8x32x1_8x32x1_1x32x1x8_8x8x1_2x1_intrawave_v1,1.0,-1.0,-1.0
304,392,1536,2048,119,0,-1.0,a8w8_bpreshuffle_256x32x128x256_16x16_16x16_16x16x1_16x16x1_1x16x1x16_8x8x1_1x2_intrawave_v1,1.0,-1.0,-1.0
304,392,1536,7168,119,0,23.3262,a8w8_bpreshuffle_256x32x128x256_16x16_16x16_16x16x1_16x16x1_1x16x1x16_8x8x1_1x2_intrawave_v1,370.05,644.09,0.0
304,392,1792,6144,119,0,-1.0,a8w8_bpreshuffle_256x32x128x256_16x16_16x16_16x16x1_16x16x1_1x16x1x16_8x8x1_1x2_intrawave_v1,1.0,-1.0,-1.0
304,392,2048,1536,119,0,-1.0,a8w8_bpreshuffle_256x32x128x256_16x16_16x16_16x16x1_16x16x1_1x16x1x16_8x8x1_1x2_intrawave_v1,1.0,-1.0,-1.0
304,392,2048,6144,119,0,-1.0,a8w8_bpreshuffle_256x32x128x256_16x16_16x16_16x16x1_16x16x1_1x16x1x16_8x8x1_1x2_intrawave_v1,1.0,-1.0,-1.0
304,392,2112,7168,114,0,27.4647,a8w8_bpreshuffle_256x64x64x256_16x16_16x16_16x16x1_16x16x1_1x32x1x8_8x8x1_2x1_intrawave_v3,432.15,713.81,0.0
304,392,3072,1536,126,0,10.4869,a8w8_bpreshuffle_256x32x192x256_16x16_16x16_16x16x1_16x16x1_1x32x1x8_8x8x1_2x1_intrawave_v1,352.76,737.03,0.0
304,392,3072,4096,120,0,-1.0,a8w8_bpreshuffle_256x48x128x256_16x16_16x16_16x16x1_16x16x1_1x16x1x16_8x8x1_1x2_intrawave_v1,1.0,-1.0,-1.0
304,392,3584,6144,120,0,-1.0,a8w8_bpreshuffle_256x48x128x256_16x16_16x16_16x16x1_16x16x1_1x16x1x16_8x8x1_1x2_intrawave_v1,1.0,-1.0,-1.0
304,392,4096,512,84,0,7.5314,a8w8_bpreshuffle_256x32x128x128_16x16_16x16_8x32x1_8x32x1_1x32x1x8_8x8x1_2x1_intrawave_v1,218.31,731.49,0.0
304,392,4096,640,84,0,-1.0,a8w8_bpreshuffle_256x32x128x128_16x16_16x16_8x32x1_8x32x1_1x32x1x8_8x8x1_2x1_intrawave_v1,1.0,-1.0,-1.0
304,392,4096,1024,120,0,-1.0,a8w8_bpreshuffle_256x48x128x256_16x16_16x16_16x16x1_16x16x1_1x16x1x16_8x8x1_1x2_intrawave_v1,1.0,-1.0,-1.0
304,392,4096,3072,120,0,-1.0,a8w8_bpreshuffle_256x48x128x256_16x16_16x16_16x16x1_16x16x1_1x16x1x16_8x8x1_1x2_intrawave_v1,1.0,-1.0,-1.0
304,392,4608,7168,121,0,45.7113,a8w8_bpreshuffle_256x64x128x256_16x16_16x16_16x16x1_16x16x1_1x16x1x16_8x8x1_1x2_intrawave_v3,566.5,863.08,0.0
304,392,5120,640,77,0,-1.0,a8w8_bpreshuffle_256x64x64x128_16x16_16x16_8x32x1_8x32x1_1x32x1x8_8x8x1_2x1_intrawave_v3,1.0,-1.0,-1.0
304,392,5120,2048,121,0,-1.0,a8w8_bpreshuffle_256x64x128x256_16x16_16x16_16x16x1_16x16x1_1x16x1x16_8x8x1_1x2_intrawave_v3,1.0,-1.0,-1.0
304,392,6144,768,92,0,-1.0,a8w8_bpreshuffle_256x32x192x128_16x16_16x16_8x32x1_8x32x1_1x32x1x8_8x8x1_2x1_intrawave_v1,1.0,-1.0,-1.0
304,392,6144,1024,128,0,-1.0,a8w8_bpreshuffle_256x64x192x256_16x16_16x16_16x16x1_16x16x1_1x32x1x8_8x8x1_2x1_intrawave_v3,1.0,-1.0,-1.0
304,392,6144,1536,128,0,-1.0,a8w8_bpreshuffle_256x64x192x256_16x16_16x16_16x16x1_16x16x1_1x32x1x8_8x8x1_2x1_intrawave_v3,1.0,-1.0,-1.0
304,392,6144,2048,128,0,-1.0,a8w8_bpreshuffle_256x64x192x256_16x16_16x16_16x16x1_16x16x1_1x32x1x8_8x8x1_2x1_intrawave_v3,1.0,-1.0,-1.0
304,392,7168,256,73,0,-1.0,a8w8_bpreshuffle_256x32x256x64_16x16_16x16_4x32x1_4x64x1_1x32x1x8_8x8x1_2x1_intrawave_v1,1.0,-1.0,-1.0
304,392,7168,2048,122,0,22.7088,a8w8_bpreshuffle_256x80x128x256_16x16_16x16_16x16x1_16x16x1_1x16x1x16_8x8x1_1x2_intrawave_v3,506.82,929.27,0.0
304,392,7168,2304,124,0,-1.0,a8w8_bpreshuffle_256x112x128x256_16x16_16x16_16x16x1_16x16x1_1x16x1x16_8x8x1_1x2_intrawave_v3,1.0,-1.0,-1.0
304,400,192,7168,24,0,-1.0,a8w8_bpreshuffle_128x16x32x512_16x16_16x16_32x4x1_32x4x1_1x16x1x8_4x4x1_1x1_intrawave_v2,1.0,-1.0,-1.0
304,400,512,7168,11,0,-1.0,a8w8_bpreshuffle_256x16x64x512_16x16_16x16_32x8x1_32x8x1_1x16x1x16_4x4x1_1x1_intrawave_v1,1.0,-1.0,-1.0
304,400,576,7168,11,0,13.1334,a8w8_bpreshuffle_256x16x64x512_16x16_16x16_32x8x1_32x8x1_1x16x1x16_4x4x1_1x1_intrawave_v1,251.5,567.77,0.0
304,400,896,5120,12,0,13.2347,a8w8_bpreshuffle_256x32x64x512_16x16_16x16_32x8x1_32x8x1_1x32x1x8_8x8x1_1x2_intrawave_v1,0.0,277.3,555.53
304,400,1024,5632,12,0,14.2748,a8w8_bpreshuffle_256x32x64x512_16x16_16x16_32x8x1_32x8x1_1x32x1x8_8x8x1_1x2_intrawave_v1,0.0,323.21,619.21
304,400,1056,1408,23,0,7.6596,a8w8_bpreshuffle_128x16x32x128_16x16_16x16_8x16x1_8x16x1_1x16x1x8_4x4x1_1x1_intrawave_v2,0.0,155.29,377.94
304,400,1280,4096,119,0,13.5485,a8w8_bpreshuffle_256x32x128x256_16x16_16x16_16x16x1_16x16x1_1x16x1x16_8x8x1_1x2_intrawave_v1,0.0,309.58,583.48
304,400,1408,352,0,0,-1.0,a8w8_bpreshuffle_256x128x128x128_16x16_16x16_8x32x1_8x32x1_1x32x1x8_8x8x1_2x1_intrawave_v3,1.0,-1.0,-1.0
304,400,1408,1408,76,0,-1.0,a8w8_bpreshuffle_256x32x64x128_16x16_16x16_8x32x1_8x32x1_1x32x1x8_8x8x1_2x1_intrawave_v1,1.0,-1.0,-1.0
304,400,1536,2048,119,0,-1.0,a8w8_bpreshuffle_256x32x128x256_16x16_16x16_16x16x1_16x16x1_1x16x1x16_8x8x1_1x2_intrawave_v1,1.0,-1.0,-1.0
304,400,1536,7168,119,0,23.4029,a8w8_bpreshuffle_256x32x128x256_16x16_16x16_16x16x1_16x16x1_1x16x1x16_8x8x1_1x2_intrawave_v1,376.37,645.48,0.0
304,400,1792,6144,119,0,-1.0,a8w8_bpreshuffle_256x32x128x256_16x16_16x16_16x16x1_16x16x1_1x16x1x16_8x8x1_1x2_intrawave_v1,1.0,-1.0,-1.0
304,400,2048,1536,119,0,-1.0,a8w8_bpreshuffle_256x32x128x256_16x16_16x16_16x16x1_16x16x1_1x16x1x16_8x8x1_1x2_intrawave_v1,1.0,-1.0,-1.0
304,400,2048,6144,119,0,-1.0,a8w8_bpreshuffle_256x32x128x256_16x16_16x16_16x16x1_16x16x1_1x16x1x16_8x8x1_1x2_intrawave_v1,1.0,-1.0,-1.0
304,400,2112,7168,114,0,27.1378,a8w8_bpreshuffle_256x64x64x256_16x16_16x16_16x16x1_16x16x1_1x32x1x8_8x8x1_2x1_intrawave_v3,446.28,725.76,0.0
304,400,3072,1536,120,0,10.8783,a8w8_bpreshuffle_256x48x128x256_16x16_16x16_16x16x1_16x16x1_1x16x1x16_8x8x1_1x2_intrawave_v1,347.01,716.16,0.0
304,400,3072,4096,120,0,-1.0,a8w8_bpreshuffle_256x48x128x256_16x16_16x16_16x16x1_16x16x1_1x16x1x16_8x8x1_1x2_intrawave_v1,1.0,-1.0,-1.0
304,400,3584,6144,115,0,-1.0,a8w8_bpreshuffle_256x80x64x256_16x16_16x16_16x16x1_16x16x1_1x16x1x16_4x4x1_1x1_intrawave_v3,1.0,-1.0,-1.0
304,400,4096,512,84,0,7.5185,a8w8_bpreshuffle_256x32x128x128_16x16_16x16_8x32x1_8x32x1_1x32x1x8_8x8x1_2x1_intrawave_v1,223.15,742.0,0.0
304,400,4096,640,84,0,8.2248,a8w8_bpreshuffle_256x32x128x128_16x16_16x16_8x32x1_8x32x1_1x32x1x8_8x8x1_2x1_intrawave_v1,0.0,254.98,748.25
304,400,4096,1024,120,0,-1.0,a8w8_bpreshuffle_256x48x128x256_16x16_16x16_16x16x1_16x16x1_1x16x1x16_8x8x1_1x2_intrawave_v1,1.0,-1.0,-1.0
304,400,4096,3072,120,0,-1.0,a8w8_bpreshuffle_256x48x128x256_16x16_16x16_16x16x1_16x16x1_1x16x1x16_8x8x1_1x2_intrawave_v1,1.0,-1.0,-1.0
304,400,4608,7168,117,0,46.7742,a8w8_bpreshuffle_256x112x64x256_16x16_16x16_16x16x1_16x16x1_1x16x1x16_4x4x1_1x1_intrawave_v3,564.93,846.27,0.0
304,400,5120,640,84,0,9.1346,a8w8_bpreshuffle_256x32x128x128_16x16_16x16_8x32x1_8x32x1_1x32x1x8_8x8x1_2x1_intrawave_v1,0.0,286.98,835.15
304,400,5120,2048,85,0,17.7945,a8w8_bpreshuffle_256x64x128x128_16x16_16x16_8x32x1_8x32x1_1x32x1x8_8x8x1_2x1_intrawave_v3,0.0,471.42,865.49
304,400,6144,768,120,0,-1.0,a8w8_bpreshuffle_256x48x128x256_16x16_16x16_16x16x1_16x16x1_1x16x1x16_8x8x1_1x2_intrawave_v1,1.0,-1.0,-1.0
304,400,6144,1024,128,0,-1.0,a8w8_bpreshuffle_256x64x192x256_16x16_16x16_16x16x1_16x16x1_1x32x1x8_8x8x1_2x1_intrawave_v3,1.0,-1.0,-1.0
304,400,6144,1536,128,0,-1.0,a8w8_bpreshuffle_256x64x192x256_16x16_16x16_16x16x1_16x16x1_1x32x1x8_8x8x1_2x1_intrawave_v3,1.0,-1.0,-1.0
304,400,6144,2048,122,0,-1.0,a8w8_bpreshuffle_256x80x128x256_16x16_16x16_16x16x1_16x16x1_1x16x1x16_8x8x1_1x2_intrawave_v3,1.0,-1.0,-1.0
304,400,7168,256,73,0,-1.0,a8w8_bpreshuffle_256x32x256x64_16x16_16x16_4x32x1_4x64x1_1x32x1x8_8x8x1_2x1_intrawave_v1,1.0,-1.0,-1.0
304,400,7168,2048,122,0,22.4094,a8w8_bpreshuffle_256x80x128x256_16x16_16x16_16x16x1_16x16x1_1x16x1x16_8x8x1_1x2_intrawave_v3,524.07,947.53,0.0
304,400,7168,2304,122,0,-1.0,a8w8_bpreshuffle_256x80x128x256_16x16_16x16_16x16x1_16x16x1_1x16x1x16_8x8x1_1x2_intrawave_v3,1.0,-1.0,-1.0
304,408,192,7168,11,0,-1.0,a8w8_bpreshuffle_256x16x64x512_16x16_16x16_32x8x1_32x8x1_1x16x1x16_4x4x1_1x1_intrawave_v1,1.0,-1.0,-1.0
304,408,512,7168,11,0,-1.0,a8w8_bpreshuffle_256x16x64x512_16x16_16x16_32x8x1_32x8x1_1x16x1x16_4x4x1_1x1_intrawave_v1,1.0,-1.0,-1.0
304,408,576,7168,5,0,13.536,a8w8_bpreshuffle_256x16x64x512_16x16_16x16_32x8x1_32x8x1_1x16x1x16_4x4x1_1x1_intrawave_v1,248.9,555.8,0.0
304,408,896,5120,12,0,-1.0,a8w8_bpreshuffle_256x32x64x512_16x16_16x16_32x8x1_32x8x1_1x32x1x8_8x8x1_1x2_intrawave_v1,1.0,-1.0,-1.0
304,408,1024,5632,12,0,-1.0,a8w8_bpreshuffle_256x32x64x512_16x16_16x16_32x8x1_32x8x1_1x32x1x8_8x8x1_1x2_intrawave_v1,1.0,-1.0,-1.0
304,408,1056,1408,23,0,-1.0,a8w8_bpreshuffle_128x16x32x128_16x16_16x16_8x16x1_8x16x1_1x16x1x8_4x4x1_1x1_intrawave_v2,1.0,-1.0,-1.0
304,408,1280,4096,119,0,-1.0,a8w8_bpreshuffle_256x32x128x256_16x16_16x16_16x16x1_16x16x1_1x16x1x16_8x8x1_1x2_intrawave_v1,1.0,-1.0,-1.0
304,408,1408,352,0,0,-1.0,a8w8_bpreshuffle_256x128x128x128_16x16_16x16_8x32x1_8x32x1_1x32x1x8_8x8x1_2x1_intrawave_v3,1.0,-1.0,-1.0
304,408,1408,1408,76,0,-1.0,a8w8_bpreshuffle_256x32x64x128_16x16_16x16_8x32x1_8x32x1_1x32x1x8_8x8x1_2x1_intrawave_v1,1.0,-1.0,-1.0
304,408,1536,2048,119,0,-1.0,a8w8_bpreshuffle_256x32x128x256_16x16_16x16_16x16x1_16x16x1_1x16x1x16_8x8x1_1x2_intrawave_v1,1.0,-1.0,-1.0
304,408,1536,7168,119,0,23.3369,a8w8_bpreshuffle_256x32x128x256_16x16_16x16_16x16x1_16x16x1_1x16x1x16_8x8x1_1x2_intrawave_v1,384.98,650.81,0.0
304,408,1792,6144,119,0,-1.0,a8w8_bpreshuffle_256x32x128x256_16x16_16x16_16x16x1_16x16x1_1x16x1x16_8x8x1_1x2_intrawave_v1,1.0,-1.0,-1.0
304,408,2048,1536,119,0,-1.0,a8w8_bpreshuffle_256x32x128x256_16x16_16x16_16x16x1_16x16x1_1x16x1x16_8x8x1_1x2_intrawave_v1,1.0,-1.0,-1.0
304,408,2048,6144,119,0,-1.0,a8w8_bpreshuffle_256x32x128x256_16x16_16x16_16x16x1_16x16x1_1x16x1x16_8x8x1_1x2_intrawave_v1,1.0,-1.0,-1.0
304,408,2112,7168,114,0,27.5497,a8w8_bpreshuffle_256x64x64x256_16x16_16x16_16x16x1_16x16x1_1x32x1x8_8x8x1_2x1_intrawave_v3,448.4,718.22,0.0
304,408,3072,1536,120,0,10.8809,a8w8_bpreshuffle_256x48x128x256_16x16_16x16_16x16x1_16x16x1_1x16x1x16_8x8x1_1x2_intrawave_v1,353.87,721.63,0.0
304,408,3072,4096,120,0,-1.0,a8w8_bpreshuffle_256x48x128x256_16x16_16x16_16x16x1_16x16x1_1x16x1x16_8x8x1_1x2_intrawave_v1,1.0,-1.0,-1.0
304,408,3584,6144,120,0,-1.0,a8w8_bpreshuffle_256x48x128x256_16x16_16x16_16x16x1_16x16x1_1x16x1x16_8x8x1_1x2_intrawave_v1,1.0,-1.0,-1.0
304,408,4096,512,84,0,7.95,a8w8_bpreshuffle_256x32x128x128_16x16_16x16_8x32x1_8x32x1_1x32x1x8_8x8x1_2x1_intrawave_v1,215.25,710.49,0.0
304,408,4096,640,84,0,-1.0,a8w8_bpreshuffle_256x32x128x128_16x16_16x16_8x32x1_8x32x1_1x32x1x8_8x8x1_2x1_intrawave_v1,1.0,-1.0,-1.0
304,408,4096,1024,120,0,-1.0,a8w8_bpreshuffle_256x48x128x256_16x16_16x16_16x16x1_16x16x1_1x16x1x16_8x8x1_1x2_intrawave_v1,1.0,-1.0,-1.0
304,408,4096,3072,120,0,-1.0,a8w8_bpreshuffle_256x48x128x256_16x16_16x16_16x16x1_16x16x1_1x16x1x16_8x8x1_1x2_intrawave_v1,1.0,-1.0,-1.0
304,408,4608,7168,85,0,47.1562,a8w8_bpreshuffle_256x64x128x128_16x16_16x16_8x32x1_8x32x1_1x32x1x8_8x8x1_2x1_intrawave_v3,571.56,842.2,0.0
304,408,5120,640,77,0,-1.0,a8w8_bpreshuffle_256x64x64x128_16x16_16x16_8x32x1_8x32x1_1x32x1x8_8x8x1_2x1_intrawave_v3,1.0,-1.0,-1.0
304,408,5120,2048,114,0,-1.0,a8w8_bpreshuffle_256x64x64x256_16x16_16x16_16x16x1_16x16x1_1x32x1x8_8x8x1_2x1_intrawave_v3,1.0,-1.0,-1.0
304,408,6144,768,120,0,-1.0,a8w8_bpreshuffle_256x48x128x256_16x16_16x16_16x16x1_16x16x1_1x16x1x16_8x8x1_1x2_intrawave_v1,1.0,-1.0,-1.0
304,408,6144,1024,128,0,-1.0,a8w8_bpreshuffle_256x64x192x256_16x16_16x16_16x16x1_16x16x1_1x32x1x8_8x8x1_2x1_intrawave_v3,1.0,-1.0,-1.0
304,408,6144,1536,128,0,-1.0,a8w8_bpreshuffle_256x64x192x256_16x16_16x16_16x16x1_16x16x1_1x32x1x8_8x8x1_2x1_intrawave_v3,1.0,-1.0,-1.0
304,408,6144,2048,128,0,-1.0,a8w8_bpreshuffle_256x64x192x256_16x16_16x16_16x16x1_16x16x1_1x32x1x8_8x8x1_2x1_intrawave_v3,1.0,-1.0,-1.0
304,408,7168,256,73,0,-1.0,a8w8_bpreshuffle_256x32x256x64_16x16_16x16_4x32x1_4x64x1_1x32x1x8_8x8x1_2x1_intrawave_v1,1.0,-1.0,-1.0
304,408,7168,2048,124,0,23.5536,a8w8_bpreshuffle_256x112x128x256_16x16_16x16_16x16x1_16x16x1_1x16x1x16_8x8x1_1x2_intrawave_v3,508.58,907.07,0.0
304,408,7168,2304,124,0,-1.0,a8w8_bpreshuffle_256x112x128x256_16x16_16x16_16x16x1_16x16x1_1x16x1x16_8x8x1_1x2_intrawave_v3,1.0,-1.0,-1.0
304,416,192,7168,10,0,-1.0,a8w8_bpreshuffle_128x16x32x512_16x16_16x16_32x4x1_32x4x1_1x16x1x8_4x4x1_1x1_intrawave_v1,1.0,-1.0,-1.0
304,416,512,7168,5,0,-1.0,a8w8_bpreshuffle_256x16x64x512_16x16_16x16_32x8x1_32x8x1_1x16x1x16_4x4x1_1x1_intrawave_v1,1.0,-1.0,-1.0
304,416,576,7168,11,0,12.6791,a8w8_bpreshuffle_256x16x64x512_16x16_16x16_32x8x1_32x8x1_1x16x1x16_4x4x1_1x1_intrawave_v1,270.93,598.61,0.0
304,416,896,5120,12,0,-1.0,a8w8_bpreshuffle_256x32x64x512_16x16_16x16_32x8x1_32x8x1_1x32x1x8_8x8x1_1x2_intrawave_v1,1.0,-1.0,-1.0
304,416,1024,5632,12,0,-1.0,a8w8_bpreshuffle_256x32x64x512_16x16_16x16_32x8x1_32x8x1_1x32x1x8_8x8x1_1x2_intrawave_v1,1.0,-1.0,-1.0
304,416,1056,1408,23,0,-1.0,a8w8_bpreshuffle_128x16x32x128_16x16_16x16_8x16x1_8x16x1_1x16x1x8_4x4x1_1x1_intrawave_v2,1.0,-1.0,-1.0
304,416,1280,4096,119,0,-1.0,a8w8_bpreshuffle_256x32x128x256_16x16_16x16_16x16x1_16x16x1_1x16x1x16_8x8x1_1x2_intrawave_v1,1.0,-1.0,-1.0
304,416,1408,352,0,0,-1.0,a8w8_bpreshuffle_256x128x128x128_16x16_16x16_8x32x1_8x32x1_1x32x1x8_8x8x1_2x1_intrawave_v3,1.0,-1.0,-1.0
304,416,1408,1408,76,0,-1.0,a8w8_bpreshuffle_256x32x64x128_16x16_16x16_8x32x1_8x32x1_1x32x1x8_8x8x1_2x1_intrawave_v1,1.0,-1.0,-1.0
304,416,1536,2048,119,0,-1.0,a8w8_bpreshuffle_256x32x128x256_16x16_16x16_16x16x1_16x16x1_1x16x1x16_8x8x1_1x2_intrawave_v1,1.0,-1.0,-1.0
304,416,1536,7168,119,0,22.8643,a8w8_bpreshuffle_256x32x128x256_16x16_16x16_16x16x1_16x16x1_1x16x1x16_8x8x1_1x2_intrawave_v1,400.64,667.85,0.0
304,416,1792,6144,119,0,-1.0,a8w8_bpreshuffle_256x32x128x256_16x16_16x16_16x16x1_16x16x1_1x16x1x16_8x8x1_1x2_intrawave_v1,1.0,-1.0,-1.0
304,416,2048,1536,119,0,-1.0,a8w8_bpreshuffle_256x32x128x256_16x16_16x16_16x16x1_16x16x1_1x16x1x16_8x8x1_1x2_intrawave_v1,1.0,-1.0,-1.0
304,416,2048,6144,119,0,-1.0,a8w8_bpreshuffle_256x32x128x256_16x16_16x16_16x16x1_16x16x1_1x16x1x16_8x8x1_1x2_intrawave_v1,1.0,-1.0,-1.0
304,416,2112,7168,114,0,27.7912,a8w8_bpreshuffle_256x64x64x256_16x16_16x16_16x16x1_16x16x1_1x32x1x8_8x8x1_2x1_intrawave_v3,453.22,715.26,0.0
304,416,3072,1536,120,0,10.6022,a8w8_bpreshuffle_256x48x128x256_16x16_16x16_16x16x1_16x16x1_1x16x1x16_8x8x1_1x2_intrawave_v1,370.29,746.4,0.0
304,416,3072,4096,120,0,-1.0,a8w8_bpreshuffle_256x48x128x256_16x16_16x16_16x16x1_16x16x1_1x16x1x16_8x8x1_1x2_intrawave_v1,1.0,-1.0,-1.0
304,416,3584,6144,120,0,-1.0,a8w8_bpreshuffle_256x48x128x256_16x16_16x16_16x16x1_16x16x1_1x16x1x16_8x8x1_1x2_intrawave_v1,1.0,-1.0,-1.0
304,416,4096,512,84,0,7.8677,a8w8_bpreshuffle_256x32x128x128_16x16_16x16_8x32x1_8x32x1_1x32x1x8_8x8x1_2x1_intrawave_v1,221.77,726.77,0.0
304,416,4096,640,76,0,-1.0,a8w8_bpreshuffle_256x32x64x128_16x16_16x16_8x32x1_8x32x1_1x32x1x8_8x8x1_2x1_intrawave_v1,1.0,-1.0,-1.0
304,416,4096,1024,120,0,-1.0,a8w8_bpreshuffle_256x48x128x256_16x16_16x16_16x16x1_16x16x1_1x16x1x16_8x8x1_1x2_intrawave_v1,1.0,-1.0,-1.0
304,416,4096,3072,120,0,-1.0,a8w8_bpreshuffle_256x48x128x256_16x16_16x16_16x16x1_16x16x1_1x16x1x16_8x8x1_1x2_intrawave_v1,1.0,-1.0,-1.0
304,416,4608,7168,121,0,46.3457,a8w8_bpreshuffle_256x64x128x256_16x16_16x16_16x16x1_16x16x1_1x16x1x16_8x8x1_1x2_intrawave_v3,592.96,859.75,0.0
304,416,5120,640,84,0,-1.0,a8w8_bpreshuffle_256x32x128x128_16x16_16x16_8x32x1_8x32x1_1x32x1x8_8x8x1_2x1_intrawave_v1,1.0,-1.0,-1.0
304,416,5120,2048,121,0,-1.0,a8w8_bpreshuffle_256x64x128x256_16x16_16x16_16x16x1_16x16x1_1x16x1x16_8x8x1_1x2_intrawave_v3,1.0,-1.0,-1.0
304,416,6144,768,120,0,-1.0,a8w8_bpreshuffle_256x48x128x256_16x16_16x16_16x16x1_16x16x1_1x16x1x16_8x8x1_1x2_intrawave_v1,1.0,-1.0,-1.0
304,416,6144,1024,122,0,-1.0,a8w8_bpreshuffle_256x80x128x256_16x16_16x16_16x16x1_16x16x1_1x16x1x16_8x8x1_1x2_intrawave_v3,1.0,-1.0,-1.0
304,416,6144,1536,128,0,-1.0,a8w8_bpreshuffle_256x64x192x256_16x16_16x16_16x16x1_16x16x1_1x32x1x8_8x8x1_2x1_intrawave_v3,1.0,-1.0,-1.0
304,416,6144,2048,128,0,-1.0,a8w8_bpreshuffle_256x64x192x256_16x16_16x16_16x16x1_16x16x1_1x32x1x8_8x8x1_2x1_intrawave_v3,1.0,-1.0,-1.0
304,416,7168,256,73,0,-1.0,a8w8_bpreshuffle_256x32x256x64_16x16_16x16_4x32x1_4x64x1_1x32x1x8_8x8x1_2x1_intrawave_v1,1.0,-1.0,-1.0
304,416,7168,2048,124,0,24.1864,a8w8_bpreshuffle_256x112x128x256_16x16_16x16_16x16x1_16x16x1_1x16x1x16_8x8x1_1x2_intrawave_v3,504.99,888.76,0.0
304,416,7168,2304,124,0,-1.0,a8w8_bpreshuffle_256x112x128x256_16x16_16x16_16x16x1_16x16x1_1x16x1x16_8x8x1_1x2_intrawave_v3,1.0,-1.0,-1.0
304,424,192,7168,11,0,-1.0,a8w8_bpreshuffle_256x16x64x512_16x16_16x16_32x8x1_32x8x1_1x16x1x16_4x4x1_1x1_intrawave_v1,1.0,-1.0,-1.0
304,424,512,7168,19,0,-1.0,a8w8_bpreshuffle_256x16x64x512_16x16_16x16_32x8x1_32x8x1_1x16x1x16_4x4x1_1x1_intrawave_v2,1.0,-1.0,-1.0
304,424,576,7168,19,0,14.2935,a8w8_bpreshuffle_256x16x64x512_16x16_16x16_32x8x1_32x8x1_1x16x1x16_4x4x1_1x1_intrawave_v2,244.95,535.66,0.0
304,424,896,5120,12,0,-1.0,a8w8_bpreshuffle_256x32x64x512_16x16_16x16_32x8x1_32x8x1_1x32x1x8_8x8x1_1x2_intrawave_v1,1.0,-1.0,-1.0
304,424,1024,5632,12,0,-1.0,a8w8_bpreshuffle_256x32x64x512_16x16_16x16_32x8x1_32x8x1_1x32x1x8_8x8x1_1x2_intrawave_v1,1.0,-1.0,-1.0
304,424,1056,1408,23,0,-1.0,a8w8_bpreshuffle_128x16x32x128_16x16_16x16_8x16x1_8x16x1_1x16x1x8_4x4x1_1x1_intrawave_v2,1.0,-1.0,-1.0
304,424,1280,4096,26,0,-1.0,a8w8_bpreshuffle_256x32x64x512_16x16_16x16_32x8x1_32x8x1_1x32x1x8_8x8x1_1x2_intrawave_v2,1.0,-1.0,-1.0
304,424,1408,352,0,0,-1.0,a8w8_bpreshuffle_256x128x128x128_16x16_16x16_8x32x1_8x32x1_1x32x1x8_8x8x1_2x1_intrawave_v3,1.0,-1.0,-1.0
304,424,1408,1408,76,0,-1.0,a8w8_bpreshuffle_256x32x64x128_16x16_16x16_8x32x1_8x32x1_1x32x1x8_8x8x1_2x1_intrawave_v1,1.0,-1.0,-1.0
304,424,1536,2048,119,0,-1.0,a8w8_bpreshuffle_256x32x128x256_16x16_16x16_16x16x1_16x16x1_1x16x1x16_8x8x1_1x2_intrawave_v1,1.0,-1.0,-1.0
304,424,1536,7168,114,0,24.1474,a8w8_bpreshuffle_256x64x64x256_16x16_16x16_16x16x1_16x16x1_1x32x1x8_8x8x1_2x1_intrawave_v3,386.65,635.75,0.0
304,424,1792,6144,114,0,-1.0,a8w8_bpreshuffle_256x64x64x256_16x16_16x16_16x16x1_16x16x1_1x32x1x8_8x8x1_2x1_intrawave_v3,1.0,-1.0,-1.0
304,424,2048,1536,119,0,-1.0,a8w8_bpreshuffle_256x32x128x256_16x16_16x16_16x16x1_16x16x1_1x16x1x16_8x8x1_1x2_intrawave_v1,1.0,-1.0,-1.0
304,424,2048,6144,114,0,-1.0,a8w8_bpreshuffle_256x64x64x256_16x16_16x16_16x16x1_16x16x1_1x32x1x8_8x8x1_2x1_intrawave_v3,1.0,-1.0,-1.0
304,424,2112,7168,114,0,27.8581,a8w8_bpreshuffle_256x64x64x256_16x16_16x16_16x16x1_16x16x1_1x32x1x8_8x8x1_2x1_intrawave_v3,460.83,716.81,0.0
304,424,3072,1536,120,0,11.2623,a8w8_bpreshuffle_256x48x128x256_16x16_16x16_16x16x1_16x16x1_1x16x1x16_8x8x1_1x2_intrawave_v1,355.29,708.11,0.0
304,424,3072,4096,120,0,-1.0,a8w8_bpreshuffle_256x48x128x256_16x16_16x16_16x16x1_16x16x1_1x16x1x16_8x8x1_1x2_intrawave_v1,1.0,-1.0,-1.0
304,424,3584,6144,120,0,-1.0,a8w8_bpreshuffle_256x48x128x256_16x16_16x16_16x16x1_16x16x1_1x16x1x16_8x8x1_1x2_intrawave_v1,1.0,-1.0,-1.0
304,424,4096,512,84,0,8.0438,a8w8_bpreshuffle_256x32x128x128_16x16_16x16_8x32x1_8x32x1_1x32x1x8_8x8x1_2x1_intrawave_v1,221.09,719.52,0.0
304,424,4096,640,76,0,-1.0,a8w8_bpreshuffle_256x32x64x128_16x16_16x16_8x32x1_8x32x1_1x32x1x8_8x8x1_2x1_intrawave_v1,1.0,-1.0,-1.0
304,424,4096,1024,113,0,-1.0,a8w8_bpreshuffle_256x48x64x256_16x16_16x16_16x16x1_16x16x1_1x16x1x16_4x4x1_1x1_intrawave_v1,1.0,-1.0,-1.0
304,424,4096,3072,120,0,-1.0,a8w8_bpreshuffle_256x48x128x256_16x16_16x16_16x16x1_16x16x1_1x16x1x16_8x8x1_1x2_intrawave_v1,1.0,-1.0,-1.0
304,424,4608,7168,117,0,47.493,a8w8_bpreshuffle_256x112x64x256_16x16_16x16_16x16x1_16x16x1_1x16x1x16_4x4x1_1x1_intrawave_v3,589.76,841.74,0.0
304,424,5120,640,77,0,-1.0,a8w8_bpreshuffle_256x64x64x128_16x16_16x16_8x32x1_8x32x1_1x32x1x8_8x8x1_2x1_intrawave_v3,1.0,-1.0,-1.0
304,424,5120,2048,121,0,-1.0,a8w8_bpreshuffle_256x64x128x256_16x16_16x16_16x16x1_16x16x1_1x16x1x16_8x8x1_1x2_intrawave_v3,1.0,-1.0,-1.0
304,424,6144,768,92,0,-1.0,a8w8_bpreshuffle_256x32x192x128_16x16_16x16_8x32x1_8x32x1_1x32x1x8_8x8x1_2x1_intrawave_v1,1.0,-1.0,-1.0
304,424,6144,1024,122,0,-1.0,a8w8_bpreshuffle_256x80x128x256_16x16_16x16_16x16x1_16x16x1_1x16x1x16_8x8x1_1x2_intrawave_v3,1.0,-1.0,-1.0
304,424,6144,1536,122,0,-1.0,a8w8_bpreshuffle_256x80x128x256_16x16_16x16_16x16x1_16x16x1_1x16x1x16_8x8x1_1x2_intrawave_v3,1.0,-1.0,-1.0
304,424,6144,2048,128,0,-1.0,a8w8_bpreshuffle_256x64x192x256_16x16_16x16_16x16x1_16x16x1_1x32x1x8_8x8x1_2x1_intrawave_v3,1.0,-1.0,-1.0
304,424,7168,256,73,0,-1.0,a8w8_bpreshuffle_256x32x256x64_16x16_16x16_4x32x1_4x64x1_1x32x1x8_8x8x1_2x1_intrawave_v1,1.0,-1.0,-1.0
304,424,7168,2048,124,0,24.1401,a8w8_bpreshuffle_256x112x128x256_16x16_16x16_16x16x1_16x16x1_1x16x1x16_8x8x1_1x2_intrawave_v3,515.69,895.89,0.0
304,424,7168,2304,124,0,-1.0,a8w8_bpreshuffle_256x112x128x256_16x16_16x16_16x16x1_16x16x1_1x16x1x16_8x8x1_1x2_intrawave_v3,1.0,-1.0,-1.0
304,432,192,7168,24,0,-1.0,a8w8_bpreshuffle_128x16x32x512_16x16_16x16_32x4x1_32x4x1_1x16x1x8_4x4x1_1x1_intrawave_v2,1.0,-1.0,-1.0
304,432,512,7168,11,0,-1.0,a8w8_bpreshuffle_256x16x64x512_16x16_16x16_32x8x1_32x8x1_1x16x1x16_4x4x1_1x1_intrawave_v1,1.0,-1.0,-1.0
304,432,576,7168,11,0,14.1797,a8w8_bpreshuffle_256x16x64x512_16x16_16x16_32x8x1_32x8x1_1x16x1x16_4x4x1_1x1_intrawave_v1,251.57,544.65,0.0
304,432,896,5120,113,0,13.6633,a8w8_bpreshuffle_256x48x64x256_16x16_16x16_16x16x1_16x16x1_1x16x1x16_4x4x1_1x1_intrawave_v1,0.0,290.09,554.3
304,432,1024,5632,12,0,14.9947,a8w8_bpreshuffle_256x32x64x512_16x16_16x16_32x8x1_32x8x1_1x32x1x8_8x8x1_1x2_intrawave_v1,0.0,332.31,605.88
304,432,1056,1408,23,0,7.8215,a8w8_bpreshuffle_128x16x32x128_16x16_16x16_8x16x1_8x16x1_1x16x1x8_4x4x1_1x1_intrawave_v2,0.0,164.24,384.52
304,432,1280,4096,119,0,13.4141,a8w8_bpreshuffle_256x32x128x256_16x16_16x16_16x16x1_16x16x1_1x16x1x16_8x8x1_1x2_intrawave_v1,0.0,337.69,605.2
304,432,1408,352,0,0,-1.0,a8w8_bpreshuffle_256x128x128x128_16x16_16x16_8x32x1_8x32x1_1x32x1x8_8x8x1_2x1_intrawave_v3,1.0,-1.0,-1.0
304,432,1408,1408,76,0,-1.0,a8w8_bpreshuffle_256x32x64x128_16x16_16x16_8x32x1_8x32x1_1x32x1x8_8x8x1_2x1_intrawave_v1,1.0,-1.0,-1.0
304,432,1536,2048,119,0,-1.0,a8w8_bpreshuffle_256x32x128x256_16x16_16x16_16x16x1_16x16x1_1x16x1x16_8x8x1_1x2_intrawave_v1,1.0,-1.0,-1.0
304,432,1536,7168,113,0,23.106,a8w8_bpreshuffle_256x48x64x256_16x16_16x16_16x16x1_16x16x1_1x16x1x16_4x4x1_1x1_intrawave_v1,411.7,667.95,0.0
304,432,1792,6144,113,0,-1.0,a8w8_bpreshuffle_256x48x64x256_16x16_16x16_16x16x1_16x16x1_1x16x1x16_4x4x1_1x1_intrawave_v1,1.0,-1.0,-1.0
304,432,2048,1536,119,0,-1.0,a8w8_bpreshuffle_256x32x128x256_16x16_16x16_16x16x1_16x16x1_1x16x1x16_8x8x1_1x2_intrawave_v1,1.0,-1.0,-1.0
304,432,2048,6144,114,0,-1.0,a8w8_bpreshuffle_256x64x64x256_16x16_16x16_16x16x1_16x16x1_1x32x1x8_8x8x1_2x1_intrawave_v3,1.0,-1.0,-1.0
304,432,2112,7168,113,0,27.5495,a8w8_bpreshuffle_256x48x64x256_16x16_16x16_16x16x1_16x16x1_1x16x1x16_4x4x1_1x1_intrawave_v1,474.78,728.15,0.0
304,432,3072,1536,120,0,11.4678,a8w8_bpreshuffle_256x48x128x256_16x16_16x16_16x16x1_16x16x1_1x16x1x16_8x8x1_1x2_intrawave_v1,355.51,700.78,0.0
304,432,3072,4096,120,0,-1.0,a8w8_bpreshuffle_256x48x128x256_16x16_16x16_16x16x1_16x16x1_1x16x1x16_8x8x1_1x2_intrawave_v1,1.0,-1.0,-1.0
304,432,3584,6144,120,0,-1.0,a8w8_bpreshuffle_256x48x128x256_16x16_16x16_16x16x1_16x16x1_1x16x1x16_8x8x1_1x2_intrawave_v1,1.0,-1.0,-1.0
304,432,4096,512,84,0,7.6819,a8w8_bpreshuffle_256x32x128x128_16x16_16x16_8x32x1_8x32x1_1x32x1x8_8x8x1_2x1_intrawave_v1,235.87,762.48,0.0
304,432,4096,640,76,0,8.4576,a8w8_bpreshuffle_256x32x64x128_16x16_16x16_8x32x1_8x32x1_1x32x1x8_8x8x1_2x1_intrawave_v1,0.0,267.8,761.07
304,432,4096,1024,113,0,-1.0,a8w8_bpreshuffle_256x48x64x256_16x16_16x16_16x16x1_16x16x1_1x16x1x16_4x4x1_1x1_intrawave_v1,1.0,-1.0,-1.0
304,432,4096,3072,120,0,-1.0,a8w8_bpreshuffle_256x48x128x256_16x16_16x16_16x16x1_16x16x1_1x16x1x16_8x8x1_1x2_intrawave_v1,1.0,-1.0,-1.0
304,432,4608,7168,121,0,45.8217,a8w8_bpreshuffle_256x64x128x256_16x16_16x16_16x16x1_16x16x1_1x16x1x16_8x8x1_1x2_intrawave_v3,622.81,875.31,0.0
304,432,5120,640,84,0,9.3122,a8w8_bpreshuffle_256x32x128x128_16x16_16x16_8x32x1_8x32x1_1x32x1x8_8x8x1_2x1_intrawave_v1,0.0,304.03,856.61
304,432,5120,2048,121,0,17.2708,a8w8_bpreshuffle_256x64x128x256_16x16_16x16_16x16x1_16x16x1_1x16x1x16_8x8x1_1x2_intrawave_v3,0.0,524.57,914.5
304,432,6144,768,92,0,-1.0,a8w8_bpreshuffle_256x32x192x128_16x16_16x16_8x32x1_8x32x1_1x32x1x8_8x8x1_2x1_intrawave_v1,1.0,-1.0,-1.0
304,432,6144,1024,122,0,-1.0,a8w8_bpreshuffle_256x80x128x256_16x16_16x16_16x16x1_16x16x1_1x16x1x16_8x8x1_1x2_intrawave_v3,1.0,-1.0,-1.0
304,432,6144,1536,127,0,-1.0,a8w8_bpreshuffle_256x48x192x256_16x16_16x16_16x16x1_16x16x1_1x16x1x16_4x4x1_1x1_intrawave_v1,1.0,-1.0,-1.0
304,432,6144,2048,128,0,-1.0,a8w8_bpreshuffle_256x64x192x256_16x16_16x16_16x16x1_16x16x1_1x32x1x8_8x8x1_2x1_intrawave_v3,1.0,-1.0,-1.0
304,432,7168,256,73,0,-1.0,a8w8_bpreshuffle_256x32x256x64_16x16_16x16_4x32x1_4x64x1_1x32x1x8_8x8x1_2x1_intrawave_v1,1.0,-1.0,-1.0
304,432,7168,2048,124,0,24.6087,a8w8_bpreshuffle_256x112x128x256_16x16_16x16_16x16x1_16x16x1_1x16x1x16_8x8x1_1x2_intrawave_v3,515.41,884.16,0.0
304,432,7168,2304,124,0,-1.0,a8w8_bpreshuffle_256x112x128x256_16x16_16x16_16x16x1_16x16x1_1x16x1x16_8x8x1_1x2_intrawave_v3,1.0,-1.0,-1.0
304,440,192,7168,11,0,-1.0,a8w8_bpreshuffle_256x16x64x512_16x16_16x16_32x8x1_32x8x1_1x16x1x16_4x4x1_1x1_intrawave_v1,1.0,-1.0,-1.0
304,440,512,7168,11,0,-1.0,a8w8_bpreshuffle_256x16x64x512_16x16_16x16_32x8x1_32x8x1_1x16x1x16_4x4x1_1x1_intrawave_v1,1.0,-1.0,-1.0
304,440,576,7168,5,0,13.6859,a8w8_bpreshuffle_256x16x64x512_16x16_16x16_32x8x1_32x8x1_1x16x1x16_4x4x1_1x1_intrawave_v1,265.48,569.17,0.0
304,440,896,5120,12,0,-1.0,a8w8_bpreshuffle_256x32x64x512_16x16_16x16_32x8x1_32x8x1_1x32x1x8_8x8x1_1x2_intrawave_v1,1.0,-1.0,-1.0
304,440,1024,5632,12,0,-1.0,a8w8_bpreshuffle_256x32x64x512_16x16_16x16_32x8x1_32x8x1_1x32x1x8_8x8x1_1x2_intrawave_v1,1.0,-1.0,-1.0
304,440,1056,1408,23,0,-1.0,a8w8_bpreshuffle_128x16x32x128_16x16_16x16_8x16x1_8x16x1_1x16x1x8_4x4x1_1x1_intrawave_v2,1.0,-1.0,-1.0
304,440,1280,4096,12,0,-1.0,a8w8_bpreshuffle_256x32x64x512_16x16_16x16_32x8x1_32x8x1_1x32x1x8_8x8x1_1x2_intrawave_v1,1.0,-1.0,-1.0
304,440,1408,352,0,0,-1.0,a8w8_bpreshuffle_256x128x128x128_16x16_16x16_8x32x1_8x32x1_1x32x1x8_8x8x1_2x1_intrawave_v3,1.0,-1.0,-1.0
304,440,1408,1408,76,0,-1.0,a8w8_bpreshuffle_256x32x64x128_16x16_16x16_8x32x1_8x32x1_1x32x1x8_8x8x1_2x1_intrawave_v1,1.0,-1.0,-1.0
304,440,1536,2048,119,0,-1.0,a8w8_bpreshuffle_256x32x128x256_16x16_16x16_16x16x1_16x16x1_1x16x1x16_8x8x1_1x2_intrawave_v1,1.0,-1.0,-1.0
304,440,1536,7168,113,0,24.2581,a8w8_bpreshuffle_256x48x64x256_16x16_16x16_16x16x1_16x16x1_1x16x1x16_4x4x1_1x1_intrawave_v1,399.41,639.61,0.0
304,440,1792,6144,114,0,-1.0,a8w8_bpreshuffle_256x64x64x256_16x16_16x16_16x16x1_16x16x1_1x32x1x8_8x8x1_2x1_intrawave_v3,1.0,-1.0,-1.0
304,440,2048,1536,119,0,-1.0,a8w8_bpreshuffle_256x32x128x256_16x16_16x16_16x16x1_16x16x1_1x16x1x16_8x8x1_1x2_intrawave_v1,1.0,-1.0,-1.0
304,440,2048,6144,114,0,-1.0,a8w8_bpreshuffle_256x64x64x256_16x16_16x16_16x16x1_16x16x1_1x32x1x8_8x8x1_2x1_intrawave_v3,1.0,-1.0,-1.0
304,440,2112,7168,114,0,27.5881,a8w8_bpreshuffle_256x64x64x256_16x16_16x16_16x16x1_16x16x1_1x32x1x8_8x8x1_2x1_intrawave_v3,482.9,730.43,0.0
304,440,3072,1536,120,0,10.8728,a8w8_bpreshuffle_256x48x128x256_16x16_16x16_16x16x1_16x16x1_1x16x1x16_8x8x1_1x2_intrawave_v1,381.9,744.78,0.0
304,440,3072,4096,120,0,-1.0,a8w8_bpreshuffle_256x48x128x256_16x16_16x16_16x16x1_16x16x1_1x16x1x16_8x8x1_1x2_intrawave_v1,1.0,-1.0,-1.0
304,440,3584,6144,120,0,-1.0,a8w8_bpreshuffle_256x48x128x256_16x16_16x16_16x16x1_16x16x1_1x16x1x16_8x8x1_1x2_intrawave_v1,1.0,-1.0,-1.0
304,440,4096,512,84,0,8.1291,a8w8_bpreshuffle_256x32x128x128_16x16_16x16_8x32x1_8x32x1_1x32x1x8_8x8x1_2x1_intrawave_v1,227.02,729.1,0.0
304,440,4096,640,85,0,-1.0,a8w8_bpreshuffle_256x64x128x128_16x16_16x16_8x32x1_8x32x1_1x32x1x8_8x8x1_2x1_intrawave_v3,1.0,-1.0,-1.0
304,440,4096,1024,121,0,-1.0,a8w8_bpreshuffle_256x64x128x256_16x16_16x16_16x16x1_16x16x1_1x16x1x16_8x8x1_1x2_intrawave_v3,1.0,-1.0,-1.0
304,440,4096,3072,121,0,-1.0,a8w8_bpreshuffle_256x64x128x256_16x16_16x16_16x16x1_16x16x1_1x16x1x16_8x8x1_1x2_intrawave_v3,1.0,-1.0,-1.0
304,440,4608,7168,85,0,48.0139,a8w8_bpreshuffle_256x64x128x128_16x16_16x16_8x32x1_8x32x1_1x32x1x8_8x8x1_2x1_intrawave_v3,605.38,838.07,0.0
304,440,5120,640,77,0,-1.0,a8w8_bpreshuffle_256x64x64x128_16x16_16x16_8x32x1_8x32x1_1x32x1x8_8x8x1_2x1_intrawave_v3,1.0,-1.0,-1.0
304,440,5120,2048,121,0,-1.0,a8w8_bpreshuffle_256x64x128x256_16x16_16x16_16x16x1_16x16x1_1x16x1x16_8x8x1_1x2_intrawave_v3,1.0,-1.0,-1.0
304,440,6144,768,122,0,-1.0,a8w8_bpreshuffle_256x80x128x256_16x16_16x16_16x16x1_16x16x1_1x16x1x16_8x8x1_1x2_intrawave_v3,1.0,-1.0,-1.0
304,440,6144,1024,122,0,-1.0,a8w8_bpreshuffle_256x80x128x256_16x16_16x16_16x16x1_16x16x1_1x16x1x16_8x8x1_1x2_intrawave_v3,1.0,-1.0,-1.0
304,440,6144,1536,122,0,-1.0,a8w8_bpreshuffle_256x80x128x256_16x16_16x16_16x16x1_16x16x1_1x16x1x16_8x8x1_1x2_intrawave_v3,1.0,-1.0,-1.0
304,440,6144,2048,128,0,-1.0,a8w8_bpreshuffle_256x64x192x256_16x16_16x16_16x16x1_16x16x1_1x32x1x8_8x8x1_2x1_intrawave_v3,1.0,-1.0,-1.0
304,440,7168,256,73,0,-1.0,a8w8_bpreshuffle_256x32x256x64_16x16_16x16_4x32x1_4x64x1_1x32x1x8_8x8x1_2x1_intrawave_v1,1.0,-1.0,-1.0
304,440,7168,2048,124,0,24.7534,a8w8_bpreshuffle_256x112x128x256_16x16_16x16_16x16x1_16x16x1_1x16x1x16_8x8x1_1x2_intrawave_v3,521.89,884.28,0.0
304,440,7168,2304,124,0,-1.0,a8w8_bpreshuffle_256x112x128x256_16x16_16x16_16x16x1_16x16x1_1x16x1x16_8x8x1_1x2_intrawave_v3,1.0,-1.0,-1.0
304,448,192,7168,24,0,-1.0,a8w8_bpreshuffle_128x16x32x512_16x16_16x16_32x4x1_32x4x1_1x16x1x8_4x4x1_1x1_intrawave_v2,1.0,-1.0,-1.0
304,448,512,7168,11,0,-1.0,a8w8_bpreshuffle_256x16x64x512_16x16_16x16_32x8x1_32x8x1_1x16x1x16_4x4x1_1x1_intrawave_v1,1.0,-1.0,-1.0
304,448,576,7168,11,0,13.5632,a8w8_bpreshuffle_256x16x64x512_16x16_16x16_32x8x1_32x8x1_1x16x1x16_4x4x1_1x1_intrawave_v1,272.75,579.22,0.0
304,448,896,5120,112,0,-1.0,a8w8_bpreshuffle_256x32x64x256_16x16_16x16_16x16x1_16x16x1_1x32x1x8_8x8x1_2x1_intrawave_v1,1.0,-1.0,-1.0
304,448,1024,5632,112,0,-1.0,a8w8_bpreshuffle_256x32x64x256_16x16_16x16_16x16x1_16x16x1_1x32x1x8_8x8x1_2x1_intrawave_v1,1.0,-1.0,-1.0
304,448,1056,1408,23,0,-1.0,a8w8_bpreshuffle_128x16x32x128_16x16_16x16_8x16x1_8x16x1_1x16x1x8_4x4x1_1x1_intrawave_v2,1.0,-1.0,-1.0
304,448,1280,4096,112,0,-1.0,a8w8_bpreshuffle_256x32x64x256_16x16_16x16_16x16x1_16x16x1_1x32x1x8_8x8x1_2x1_intrawave_v1,1.0,-1.0,-1.0
304,448,1408,352,0,0,-1.0,a8w8_bpreshuffle_256x128x128x128_16x16_16x16_8x32x1_8x32x1_1x32x1x8_8x8x1_2x1_intrawave_v3,1.0,-1.0,-1.0
304,448,1408,1408,76,0,-1.0,a8w8_bpreshuffle_256x32x64x128_16x16_16x16_8x32x1_8x32x1_1x32x1x8_8x8x1_2x1_intrawave_v1,1.0,-1.0,-1.0
304,448,1536,2048,114,0,-1.0,a8w8_bpreshuffle_256x64x64x256_16x16_16x16_16x16x1_16x16x1_1x32x1x8_8x8x1_2x1_intrawave_v3,1.0,-1.0,-1.0
304,448,1536,7168,114,0,23.5457,a8w8_bpreshuffle_256x64x64x256_16x16_16x16_16x16x1_16x16x1_1x32x1x8_8x8x1_2x1_intrawave_v3,418.97,662.44,0.0
304,448,1792,6144,114,0,-1.0,a8w8_bpreshuffle_256x64x64x256_16x16_16x16_16x16x1_16x16x1_1x32x1x8_8x8x1_2x1_intrawave_v3,1.0,-1.0,-1.0
304,448,2048,1536,119,0,-1.0,a8w8_bpreshuffle_256x32x128x256_16x16_16x16_16x16x1_16x16x1_1x16x1x16_8x8x1_1x2_intrawave_v1,1.0,-1.0,-1.0
304,448,2048,6144,114,0,-1.0,a8w8_bpreshuffle_256x64x64x256_16x16_16x16_16x16x1_16x16x1_1x32x1x8_8x8x1_2x1_intrawave_v3,1.0,-1.0,-1.0
304,448,2112,7168,114,0,27.043,a8w8_bpreshuffle_256x64x64x256_16x16_16x16_16x16x1_16x16x1_1x32x1x8_8x8x1_2x1_intrawave_v3,501.59,748.53,0.0
304,448,3072,1536,120,0,10.624,a8w8_bpreshuffle_256x48x128x256_16x16_16x16_16x16x1_16x16x1_1x16x1x16_8x8x1_1x2_intrawave_v1,397.95,768.0,0.0
304,448,3072,4096,120,0,-1.0,a8w8_bpreshuffle_256x48x128x256_16x16_16x16_16x16x1_16x16x1_1x16x1x16_8x8x1_1x2_intrawave_v1,1.0,-1.0,-1.0
304,448,3584,6144,120,0,-1.0,a8w8_bpreshuffle_256x48x128x256_16x16_16x16_16x16x1_16x16x1_1x16x1x16_8x8x1_1x2_intrawave_v1,1.0,-1.0,-1.0
304,448,4096,512,84,0,8.0582,a8w8_bpreshuffle_256x32x128x128_16x16_16x16_8x32x1_8x32x1_1x32x1x8_8x8x1_2x1_intrawave_v1,233.18,744.15,0.0
304,448,4096,640,76,0,-1.0,a8w8_bpreshuffle_256x32x64x128_16x16_16x16_8x32x1_8x32x1_1x32x1x8_8x8x1_2x1_intrawave_v1,1.0,-1.0,-1.0
304,448,4096,1024,121,0,-1.0,a8w8_bpreshuffle_256x64x128x256_16x16_16x16_16x16x1_16x16x1_1x16x1x16_8x8x1_1x2_intrawave_v3,1.0,-1.0,-1.0
304,448,4096,3072,121,0,-1.0,a8w8_bpreshuffle_256x64x128x256_16x16_16x16_16x16x1_16x16x1_1x16x1x16_8x8x1_1x2_intrawave_v3,1.0,-1.0,-1.0
304,448,4608,7168,121,0,46.5208,a8w8_bpreshuffle_256x64x128x256_16x16_16x16_16x16x1_16x16x1_1x16x1x16_8x8x1_1x2_intrawave_v3,636.17,867.79,0.0
304,448,5120,640,77,0,-1.0,a8w8_bpreshuffle_256x64x64x128_16x16_16x16_8x32x1_8x32x1_1x32x1x8_8x8x1_2x1_intrawave_v3,1.0,-1.0,-1.0
304,448,5120,2048,121,0,-1.0,a8w8_bpreshuffle_256x64x128x256_16x16_16x16_16x16x1_16x16x1_1x16x1x16_8x8x1_1x2_intrawave_v3,1.0,-1.0,-1.0
304,448,6144,768,122,0,-1.0,a8w8_bpreshuffle_256x80x128x256_16x16_16x16_16x16x1_16x16x1_1x16x1x16_8x8x1_1x2_intrawave_v3,1.0,-1.0,-1.0
304,448,6144,1024,122,0,-1.0,a8w8_bpreshuffle_256x80x128x256_16x16_16x16_16x16x1_16x16x1_1x16x1x16_8x8x1_1x2_intrawave_v3,1.0,-1.0,-1.0
304,448,6144,1536,128,0,-1.0,a8w8_bpreshuffle_256x64x192x256_16x16_16x16_16x16x1_16x16x1_1x32x1x8_8x8x1_2x1_intrawave_v3,1.0,-1.0,-1.0
304,448,6144,2048,122,0,-1.0,a8w8_bpreshuffle_256x80x128x256_16x16_16x16_16x16x1_16x16x1_1x16x1x16_8x8x1_1x2_intrawave_v3,1.0,-1.0,-1.0
304,448,7168,256,73,0,-1.0,a8w8_bpreshuffle_256x32x256x64_16x16_16x16_4x32x1_4x64x1_1x32x1x8_8x8x1_2x1_intrawave_v1,1.0,-1.0,-1.0
304,448,7168,2048,124,0,24.0949,a8w8_bpreshuffle_256x112x128x256_16x16_16x16_16x16x1_16x16x1_1x16x1x16_8x8x1_1x2_intrawave_v3,545.9,913.89,0.0
304,448,7168,2304,124,0,-1.0,a8w8_bpreshuffle_256x112x128x256_16x16_16x16_16x16x1_16x16x1_1x16x1x16_8x8x1_1x2_intrawave_v3,1.0,-1.0,-1.0
304,456,192,7168,11,0,-1.0,a8w8_bpreshuffle_256x16x64x512_16x16_16x16_32x8x1_32x8x1_1x16x1x16_4x4x1_1x1_intrawave_v1,1.0,-1.0,-1.0
304,456,512,7168,5,0,-1.0,a8w8_bpreshuffle_256x16x64x512_16x16_16x16_32x8x1_32x8x1_1x16x1x16_4x4x1_1x1_intrawave_v1,1.0,-1.0,-1.0
304,456,576,7168,25,0,14.7098,a8w8_bpreshuffle_256x16x64x512_16x16_16x16_32x8x1_32x8x1_1x16x1x16_4x4x1_1x1_intrawave_v2,255.98,538.6,0.0
304,456,896,5120,12,0,-1.0,a8w8_bpreshuffle_256x32x64x512_16x16_16x16_32x8x1_32x8x1_1x32x1x8_8x8x1_1x2_intrawave_v1,1.0,-1.0,-1.0
304,456,1024,5632,12,0,-1.0,a8w8_bpreshuffle_256x32x64x512_16x16_16x16_32x8x1_32x8x1_1x32x1x8_8x8x1_1x2_intrawave_v1,1.0,-1.0,-1.0
304,456,1056,1408,23,0,-1.0,a8w8_bpreshuffle_128x16x32x128_16x16_16x16_8x16x1_8x16x1_1x16x1x8_4x4x1_1x1_intrawave_v2,1.0,-1.0,-1.0
304,456,1280,4096,12,0,-1.0,a8w8_bpreshuffle_256x32x64x512_16x16_16x16_32x8x1_32x8x1_1x32x1x8_8x8x1_1x2_intrawave_v1,1.0,-1.0,-1.0
304,456,1408,352,0,0,-1.0,a8w8_bpreshuffle_256x128x128x128_16x16_16x16_8x32x1_8x32x1_1x32x1x8_8x8x1_2x1_intrawave_v3,1.0,-1.0,-1.0
304,456,1408,1408,76,0,-1.0,a8w8_bpreshuffle_256x32x64x128_16x16_16x16_8x32x1_8x32x1_1x32x1x8_8x8x1_2x1_intrawave_v1,1.0,-1.0,-1.0
304,456,1536,2048,119,0,-1.0,a8w8_bpreshuffle_256x32x128x256_16x16_16x16_16x16x1_16x16x1_1x16x1x16_8x8x1_1x2_intrawave_v1,1.0,-1.0,-1.0
304,456,1536,7168,113,0,24.0523,a8w8_bpreshuffle_256x48x64x256_16x16_16x16_16x16x1_16x16x1_1x16x1x16_4x4x1_1x1_intrawave_v1,417.47,651.89,0.0
304,456,1792,6144,113,0,-1.0,a8w8_bpreshuffle_256x48x64x256_16x16_16x16_16x16x1_16x16x1_1x16x1x16_4x4x1_1x1_intrawave_v1,1.0,-1.0,-1.0
304,456,2048,1536,119,0,-1.0,a8w8_bpreshuffle_256x32x128x256_16x16_16x16_16x16x1_16x16x1_1x16x1x16_8x8x1_1x2_intrawave_v1,1.0,-1.0,-1.0
304,456,2048,6144,114,0,-1.0,a8w8_bpreshuffle_256x64x64x256_16x16_16x16_16x16x1_16x16x1_1x32x1x8_8x8x1_2x1_intrawave_v3,1.0,-1.0,-1.0
304,456,2112,7168,114,0,29.2033,a8w8_bpreshuffle_256x64x64x256_16x16_16x16_16x16x1_16x16x1_1x32x1x8_8x8x1_2x1_intrawave_v3,472.78,696.28,0.0
304,456,3072,1536,126,0,10.9323,a8w8_bpreshuffle_256x32x192x256_16x16_16x16_16x16x1_16x16x1_1x32x1x8_8x8x1_2x1_intrawave_v1,393.64,751.96,0.0
304,456,3072,4096,120,0,-1.0,a8w8_bpreshuffle_256x48x128x256_16x16_16x16_16x16x1_16x16x1_1x16x1x16_8x8x1_1x2_intrawave_v1,1.0,-1.0,-1.0
304,456,3584,6144,120,0,-1.0,a8w8_bpreshuffle_256x48x128x256_16x16_16x16_16x16x1_16x16x1_1x16x1x16_8x8x1_1x2_intrawave_v1,1.0,-1.0,-1.0
304,456,4096,512,84,0,8.382,a8w8_bpreshuffle_256x32x128x128_16x16_16x16_8x32x1_8x32x1_1x32x1x8_8x8x1_2x1_intrawave_v1,228.18,723.71,0.0
304,456,4096,640,77,0,-1.0,a8w8_bpreshuffle_256x64x64x128_16x16_16x16_8x32x1_8x32x1_1x32x1x8_8x8x1_2x1_intrawave_v3,1.0,-1.0,-1.0
304,456,4096,1024,114,0,-1.0,a8w8_bpreshuffle_256x64x64x256_16x16_16x16_16x16x1_16x16x1_1x32x1x8_8x8x1_2x1_intrawave_v3,1.0,-1.0,-1.0
304,456,4096,3072,121,0,-1.0,a8w8_bpreshuffle_256x64x128x256_16x16_16x16_16x16x1_16x16x1_1x16x1x16_8x8x1_1x2_intrawave_v3,1.0,-1.0,-1.0
