kernels/blockscalegemm/mi300xtunedconfig/a8w8_blockscale_tuned_gemm.csv
cu_num,M,N,K,kernelId,splitK,us,kernelName,tflops,bw,errRatio
80,16,512,7168,8,0,23.3487,a8w8_blockscale_1x128x128_256x16x64x256_16x16_16x16_16x16x1_16x16x1_1x16x1x16_4_1x1_intrawave_v1,5.03,162.8,0.0
80,16,576,7168,8,0,23.4551,a8w8_blockscale_1x128x128_256x16x64x256_16x16_16x16_16x16x1_16x16x1_1x16x1x16_4_1x1_intrawave_v1,5.63,181.7,0.0
80,16,1536,7168,8,0,23.9251,a8w8_blockscale_1x128x128_256x16x64x256_16x16_16x16_16x16x1_16x16x1_1x16x1x16_4_1x1_intrawave_v1,14.73,467.04,0.0
80,16,3072,1536,8,0,8.4118,a8w8_blockscale_1x128x128_256x16x64x256_16x16_16x16_16x16x1_16x16x1_1x16x1x16_4_1x1_intrawave_v1,17.95,575.56,0.0
80,16,4096,512,8,0,4.2662,a8w8_blockscale_1x128x128_256x16x64x256_16x16_16x16_16x16x1_16x16x1_1x16x1x16_4_1x1_intrawave_v1,15.73,524.22,0.0
80,16,4608,7168,8,0,24.6427,a8w8_blockscale_1x128x128_256x16x64x256_16x16_16x16_16x16x1_16x16x1_1x16x1x16_4_1x1_intrawave_v1,42.89,1351.0,0.0
80,16,7168,256,8,0,4.0534,a8w8_blockscale_1x128x128_256x16x64x256_16x16_16x16_16x16x1_16x16x1_1x16x1x16_4_1x1_intrawave_v1,14.49,510.31,0.0
80,16,7168,2048,8,0,12.9347,a8w8_blockscale_1x128x128_256x16x64x256_16x16_16x16_16x16x1_16x16x1_1x16x1x16_4_1x1_intrawave_v1,36.32,1155.2,0.0
80,16,7168,2304,7,0,12.2382,a8w8_blockscale_1x128x128_256x16x128x256_16x16_16x16_16x16x1_16x16x1_1x16x1x16_8_1x2_intrawave_v1,43.18,1371.22,0.0
80,32,512,7168,8,0,23.3303,a8w8_blockscale_1x128x128_256x16x64x256_16x16_16x16_16x16x1_16x16x1_1x16x1x16_4_1x1_intrawave_v1,10.07,168.54,0.0
80,32,576,7168,8,0,23.4111,a8w8_blockscale_1x128x128_256x16x64x256_16x16_16x16_16x16x1_16x16x1_1x16x1x16_4_1x1_intrawave_v1,11.29,187.73,0.0
80,32,1536,7168,8,0,23.8595,a8w8_blockscale_1x128x128_256x16x64x256_16x16_16x16_16x16x1_16x16x1_1x16x1x16_4_1x1_intrawave_v1,29.53,475.19,0.0
80,32,3072,1536,8,0,10.1678,a8w8_blockscale_1x128x128_256x16x64x256_16x16_16x16_16x16x1_16x16x1_1x16x1x16_4_1x1_intrawave_v1,29.7,488.24,0.0
80,32,4096,512,13,0,4.8618,a8w8_blockscale_1x128x128_256x32x64x256_16x16_16x16_16x16x1_16x16x1_1x32x1x8_8_2x1_intrawave_v1,27.61,488.64,0.0
80,32,4608,7168,7,0,32.9403,a8w8_blockscale_1x128x128_256x16x128x256_16x16_16x16_16x16x1_16x16x1_1x16x1x16_8_1x2_intrawave_v1,64.17,1018.64,0.0
80,32,7168,256,11,0,4.8618,a8w8_blockscale_1x128x128_256x32x64x128_16x16_16x16_8x32x1_8x32x1_1x32x1x8_8_2x1_intrawave_v1,24.16,473.48,0.0
80,32,7168,2048,12,0,15.0959,a8w8_blockscale_1x128x128_256x32x128x256_16x16_32x32_16x16x1_16x16x1_1x32x1x8_8_1x1_intrawave_v1,62.24,1007.18,0.0
80,32,7168,2304,12,0,14.9967,a8w8_blockscale_1x128x128_256x32x128x256_16x16_32x32_16x16x1_16x16x1_1x32x1x8_8_1x1_intrawave_v1,70.48,1136.75,0.0
80,64,512,7168,8,0,23.1571,a8w8_blockscale_1x128x128_256x16x64x256_16x16_16x16_16x16x1_16x16x1_1x16x1x16_4_1x1_intrawave_v1,20.29,181.12,0.0
80,64,576,7168,8,0,23.0827,a8w8_blockscale_1x128x128_256x16x64x256_16x16_16x16_16x16x1_16x16x1_1x16x1x16_4_1x1_intrawave_v1,22.9,201.94,0.0
80,64,1536,7168,8,0,27.2559,a8w8_blockscale_1x128x128_256x16x64x256_16x16_16x16_16x16x1_16x16x1_1x16x1x16_4_1x1_intrawave_v1,51.71,428.0,0.0
80,64,3072,1536,18,0,10.6566,a8w8_blockscale_1x128x128_256x64x64x256_16x16_32x32_16x16x1_16x16x1_1x32x1x8_8_1x1_intrawave_v1,56.68,488.91,0.0
80,64,4096,512,18,0,6.7134,a8w8_blockscale_1x128x128_256x64x64x256_16x16_32x32_16x16x1_16x16x1_1x32x1x8_8_1x1_intrawave_v1,39.99,395.36,0.0
80,64,4608,7168,18,0,33.4247,a8w8_blockscale_1x128x128_256x64x64x256_16x16_32x32_16x16x1_16x16x1_1x32x1x8_8_1x1_intrawave_v1,126.49,1019.57,0.0
80,64,7168,256,11,0,7.015,a8w8_blockscale_1x128x128_256x32x64x128_16x16_16x16_8x32x1_8x32x1_1x32x1x8_8_2x1_intrawave_v1,33.48,394.71,0.0
80,64,7168,2048,18,0,21.5203,a8w8_blockscale_1x128x128_256x64x64x256_16x16_32x32_16x16x1_16x16x1_1x32x1x8_8_1x1_intrawave_v1,87.32,730.87,0.0
80,64,7168,2304,18,0,20.1871,a8w8_blockscale_1x128x128_256x64x64x256_16x16_32x32_16x16x1_16x16x1_1x32x1x8_8_1x1_intrawave_v1,104.72,870.85,0.0
80,128,512,7168,8,0,23.0299,a8w8_blockscale_1x128x128_256x16x64x256_16x16_16x16_16x16x1_16x16x1_1x16x1x16_4_1x1_intrawave_v1,40.8,204.89,0.0
80,128,576,7168,8,0,22.7915,a8w8_blockscale_1x128x128_256x16x64x256_16x16_16x16_16x16x1_16x16x1_1x16x1x16_4_1x1_intrawave_v1,46.38,227.88,0.0
80,128,1536,7168,18,0,32.4591,a8w8_blockscale_1x128x128_256x64x64x256_16x16_32x32_16x16x1_16x16x1_1x32x1x8_8_1x1_intrawave_v1,86.83,379.58,0.0
80,128,3072,1536,18,0,16.6331,a8w8_blockscale_1x128x128_256x64x64x256_16x16_32x32_16x16x1_16x16x1_1x32x1x8_8_1x1_intrawave_v1,72.62,342.79,0.0
80,128,4096,512,18,0,9.695,a8w8_blockscale_1x128x128_256x64x64x256_16x16_32x32_16x16x1_16x16x1_1x32x1x8_8_1x1_intrawave_v1,55.38,331.23,0.0
80,128,4608,7168,18,0,52.1776,a8w8_blockscale_1x128x128_256x64x64x256_16x16_32x32_16x16x1_16x16x1_1x32x1x8_8_1x1_intrawave_v1,162.06,673.23,0.0
80,128,7168,256,16,0,9.5886,a8w8_blockscale_1x128x128_256x64x64x128_16x16_32x32_8x32x1_8x32x1_1x32x1x8_8_1x1_intrawave_v1,48.99,386.17,0.0
80,128,7168,2048,18,0,29.8219,a8w8_blockscale_1x128x128_256x64x64x256_16x16_32x32_16x16x1_16x16x1_1x32x1x8_8_1x1_intrawave_v1,126.02,562.58,0.0
80,128,7168,2304,18,0,30.3515,a8w8_blockscale_1x128x128_256x64x64x256_16x16_32x32_16x16x1_16x16x1_1x32x1x8_8_1x1_intrawave_v1,139.3,614.3,0.0
80,256,512,7168,8,0,28.7031,a8w8_blockscale_1x128x128_256x16x64x256_16x16_16x16_16x16x1_16x16x1_1x16x1x16_4_1x1_intrawave_v1,65.46,200.92,0.0
80,256,576,7168,8,0,29.3363,a8w8_blockscale_1x128x128_256x16x64x256_16x16_16x16_16x16x1_16x16x1_1x16x1x16_4_1x1_intrawave_v1,72.06,213.34,0.0
80,256,1536,7168,18,0,48.3696,a8w8_blockscale_1x128x128_256x64x64x256_16x16_32x32_16x16x1_16x16x1_1x32x1x8_8_1x1_intrawave_v1,116.54,281.82,0.0
80,256,3072,1536,18,0,23.6371,a8w8_blockscale_1x128x128_256x64x64x256_16x16_32x32_16x16x1_16x16x1_1x32x1x8_8_1x1_intrawave_v1,102.21,282.8,0.0
80,256,4096,512,16,0,15.7294,a8w8_blockscale_1x128x128_256x64x64x128_16x16_32x32_8x32x1_8x32x1_1x32x1x8_8_1x1_intrawave_v1,68.26,274.99,0.0
80,256,4608,7168,18,0,97.8358,a8w8_blockscale_1x128x128_256x64x64x256_16x16_32x32_16x16x1_16x16x1_1x32x1x8_8_1x1_intrawave_v1,172.86,380.48,0.0
80,256,7168,256,16,0,14.5362,a8w8_blockscale_1x128x128_256x64x64x128_16x16_32x32_8x32x1_8x32x1_1x32x1x8_8_1x1_intrawave_v1,64.63,383.22,0.0
80,256,7168,2048,18,0,53.1296,a8w8_blockscale_1x128x128_256x64x64x256_16x16_32x32_16x16x1_16x16x1_1x32x1x8_8_1x1_intrawave_v1,141.47,355.25,0.0
80,256,7168,2304,18,0,55.3696,a8w8_blockscale_1x128x128_256x64x64x256_16x16_32x32_16x16x1_16x16x1_1x32x1x8_8_1x1_intrawave_v1,152.71,375.2,0.0
80,512,512,7168,18,0,32.1923,a8w8_blockscale_1x128x128_256x64x64x256_16x16_32x32_16x16x1_16x16x1_1x32x1x8_8_1x1_intrawave_v1,116.74,244.29,0.0
80,512,576,7168,18,0,32.2327,a8w8_blockscale_1x128x128_256x64x64x256_16x16_32x32_16x16x1_16x16x1_1x32x1x8_8_1x1_intrawave_v1,131.17,260.25,0.0
80,512,1536,7168,18,0,78.2381,a8w8_blockscale_1x128x128_256x64x64x256_16x16_32x32_16x16x1_16x16x1_1x32x1x8_8_1x1_intrawave_v1,144.1,207.74,0.0
80,512,3072,1536,18,0,36.9459,a8w8_blockscale_1x128x128_256x64x64x256_16x16_32x32_16x16x1_16x16x1_1x32x1x8_8_1x1_intrawave_v1,130.78,234.15,0.0
80,512,4096,512,16,0,24.0675,a8w8_blockscale_1x128x128_256x64x64x128_16x16_32x32_8x32x1_8x32x1_1x32x1x8_8_1x1_intrawave_v1,89.23,272.3,0.0
80,512,4608,7168,18,0,188.8186,a8w8_blockscale_1x128x128_256x64x64x256_16x16_32x32_16x16x1_16x16x1_1x32x1x8_8_1x1_intrawave_v1,179.13,219.36,0.0
80,512,7168,256,16,0,24.5763,a8w8_blockscale_1x128x128_256x64x64x128_16x16_32x32_8x32x1_8x32x1_1x32x1x8_8_1x1_intrawave_v1,76.46,378.66,0.0
80,512,7168,2048,18,0,100.9298,a8w8_blockscale_1x128x128_256x64x64x256_16x16_32x32_16x16x1_16x16x1_1x32x1x8_8_1x1_intrawave_v1,148.94,228.56,0.0
80,512,7168,2304,3,0,101.0378,a8w8_blockscale_1x128x128_256x64x64x128_16x16_32x32_8x32x1_8x32x1_1x32x1x8_8_1x1_intrawave_v3,167.38,247.78,0.0
80,1024,512,7168,18,0,49.1544,a8w8_blockscale_1x128x128_256x64x64x256_16x16_32x32_16x16x1_16x16x1_1x32x1x8_8_1x1_intrawave_v1,152.91,245.32,0.0
80,1024,576,7168,18,0,49.8928,a8w8_blockscale_1x128x128_256x64x64x256_16x16_32x32_16x16x1_16x16x1_1x32x1x8_8_1x1_intrawave_v1,169.48,253.51,0.0
80,1024,1536,7168,18,0,123.7307,a8w8_blockscale_1x128x128_256x64x64x256_16x16_32x32_16x16x1_16x16x1_1x32x1x8_8_1x1_intrawave_v1,182.24,173.73,0.0
80,1024,3072,1536,16,0,65.0637,a8w8_blockscale_1x128x128_256x64x64x128_16x16_32x32_8x32x1_8x32x1_1x32x1x8_8_1x1_intrawave_v1,148.53,193.39,0.0
80,1024,4096,512,16,0,39.5012,a8w8_blockscale_1x128x128_256x64x64x128_16x16_32x32_8x32x1_8x32x1_1x32x1x8_8_1x1_intrawave_v1,108.73,278.73,0.0
80,1024,4608,7168,18,0,350.2185,a8w8_blockscale_1x128x128_256x64x64x256_16x16_32x32_16x16x1_16x16x1_1x32x1x8_8_1x1_intrawave_v1,193.15,142.22,0.0
80,1024,7168,256,16,0,42.6144,a8w8_blockscale_1x128x128_256x64x64x128_16x16_32x32_8x32x1_8x32x1_1x32x1x8_8_1x1_intrawave_v1,88.19,393.7,0.0
80,1024,7168,2048,18,0,188.3418,a8w8_blockscale_1x128x128_256x64x64x256_16x16_32x32_16x16x1_16x16x1_1x32x1x8_8_1x1_intrawave_v1,159.63,167.02,0.0
80,1024,7168,2304,3,0,183.7845,a8w8_blockscale_1x128x128_256x64x64x128_16x16_32x32_8x32x1_8x32x1_1x32x1x8_8_1x1_intrawave_v3,184.04,182.57,0.0
80,1536,512,7168,18,0,78.5197,a8w8_blockscale_1x128x128_256x64x64x256_16x16_32x32_16x16x1_16x16x1_1x32x1x8_8_1x1_intrawave_v1,143.59,206.99,0.0
80,1536,576,7168,18,0,78.9361,a8w8_blockscale_1x128x128_256x64x64x256_16x16_32x32_16x16x1_16x16x1_1x32x1x8_8_1x1_intrawave_v1,160.68,214.2,0.0
80,1536,1536,7168,18,0,189.361,a8w8_blockscale_1x128x128_256x64x64x256_16x16_32x32_16x16x1_16x16x1_1x32x1x8_8_1x1_intrawave_v1,178.62,141.2,0.0
80,1536,3072,1536,16,0,92.7146,a8w8_blockscale_1x128x128_256x64x64x128_16x16_32x32_8x32x1_8x32x1_1x32x1x8_8_1x1_intrawave_v1,156.35,178.13,0.0
80,1536,4096,512,16,0,56.6284,a8w8_blockscale_1x128x128_256x64x64x128_16x16_32x32_8x32x1_8x32x1_1x32x1x8_8_1x1_intrawave_v1,113.77,273.12,0.0
80,1536,4608,7168,18,0,510.7043,a8w8_blockscale_1x128x128_256x64x64x256_16x16_32x32_16x16x1_16x16x1_1x32x1x8_8_1x1_intrawave_v1,198.68,113.95,0.0
80,1536,7168,256,16,0,60.2732,a8w8_blockscale_1x128x128_256x64x64x128_16x16_32x32_8x32x1_8x32x1_1x32x1x8_8_1x1_intrawave_v1,93.53,402.31,0.0
80,1536,7168,2048,2,0,264.6833,a8w8_blockscale_1x128x128_256x64x128x128_16x16_32x32_8x32x1_8x32x1_1x32x1x8_8_1x1_intrawave_v3,170.38,150.54,0.0
80,1536,7168,2304,3,0,265.1321,a8w8_blockscale_1x128x128_256x64x64x128_16x16_32x32_8x32x1_8x32x1_1x32x1x8_8_1x1_intrawave_v3,191.35,158.69,0.0
80,2048,512,7168,18,0,96.7626,a8w8_blockscale_1x128x128_256x64x64x256_16x16_32x32_16x16x1_16x16x1_1x32x1x8_8_1x1_intrawave_v1,155.35,211.31,0.0
80,2048,576,7168,18,0,97.8062,a8w8_blockscale_1x128x128_256x64x64x256_16x16_32x32_16x16x1_16x16x1_1x32x1x8_8_1x1_intrawave_v1,172.91,216.43,0.0
80,2048,1536,7168,18,0,235.344,a8w8_blockscale_1x128x128_256x64x64x256_16x16_32x32_16x16x1_16x16x1_1x32x1x8_8_1x1_intrawave_v1,191.62,135.89,0.0
80,2048,3072,1536,16,0,120.9511,a8w8_blockscale_1x128x128_256x64x64x128_16x16_32x32_8x32x1_8x32x1_1x32x1x8_8_1x1_intrawave_v1,159.79,169.05,0.0
80,2048,4096,512,16,0,71.9193,a8w8_blockscale_1x128x128_256x64x64x128_16x16_32x32_8x32x1_8x32x1_1x32x1x8_8_1x1_intrawave_v1,119.44,277.02,0.0
80,2048,4608,7168,18,0,668.9049,a8w8_blockscale_1x128x128_256x64x64x256_16x16_32x32_16x16x1_16x16x1_1x32x1x8_8_1x1_intrawave_v1,202.26,99.54,0.0
80,2048,7168,256,16,0,77.9877,a8w8_blockscale_1x128x128_256x64x64x128_16x16_32x32_8x32x1_8x32x1_1x32x1x8_8_1x1_intrawave_v1,96.38,406.72,0.0
80,2048,7168,2048,2,0,352.5768,a8w8_blockscale_1x128x128_256x64x128x128_16x16_32x32_8x32x1_8x32x1_1x32x1x8_8_1x1_intrawave_v3,170.54,136.81,0.0
80,2048,7168,2304,3,0,347.5556,a8w8_blockscale_1x128x128_256x64x64x128_16x16_32x32_8x32x1_8x32x1_1x32x1x8_8_1x1_intrawave_v3,194.63,145.57,0.0
80,4096,512,7168,18,0,170.3257,a8w8_blockscale_1x128x128_256x64x64x256_16x16_32x32_16x16x1_16x16x1_1x32x1x8_8_1x1_intrawave_v1,176.51,218.55,0.0
80,4096,576,7168,18,0,188.7622,a8w8_blockscale_1x128x128_256x64x64x256_16x16_32x32_16x16x1_16x16x1_1x32x1x8_8_1x1_intrawave_v1,179.18,202.41,0.0
80,4096,1536,7168,18,0,463.9265,a8w8_blockscale_1x128x128_256x64x64x256_16x16_32x32_16x16x1_16x16x1_1x32x1x8_8_1x1_intrawave_v1,194.42,114.14,0.0
80,4096,3072,1536,16,0,226.6147,a8w8_blockscale_1x128x128_256x64x64x128_16x16_32x32_8x32x1_8x32x1_1x32x1x8_8_1x1_intrawave_v1,170.57,159.64,0.0
80,4096,4096,512,16,0,135.4396,a8w8_blockscale_1x128x128_256x64x64x128_16x16_32x32_8x32x1_8x32x1_1x32x1x8_8_1x1_intrawave_v1,126.85,278.71,0.0
80,4096,4608,7168,2,0,1326.7729,a8w8_blockscale_1x128x128_256x64x128x128_16x16_32x32_8x32x1_8x32x1_1x32x1x8_8_1x1_intrawave_v3,203.94,75.48,0.0
80,4096,7168,256,16,0,149.8256,a8w8_blockscale_1x128x128_256x64x64x128_16x16_32x32_8x32x1_8x32x1_1x32x1x8_8_1x1_intrawave_v1,100.33,411.17,0.0
80,4096,7168,2048,2,0,677.8042,a8w8_blockscale_1x128x128_256x64x128x128_16x16_32x32_8x32x1_8x32x1_1x32x1x8_8_1x1_intrawave_v3,177.42,120.67,0.0
80,4096,7168,2304,3,0,680.0186,a8w8_blockscale_1x128x128_256x64x64x128_16x16_32x32_8x32x1_8x32x1_1x32x1x8_8_1x1_intrawave_v3,198.95,124.51,0.0
80,8192,512,7168,18,0,312.3499,a8w8_blockscale_1x128x128_256x64x64x256_16x16_32x32_16x16x1_16x16x1_1x32x1x8_8_1x1_intrawave_v1,192.51,226.6,0.0
80,8192,576,7168,18,0,353.3597,a8w8_blockscale_1x128x128_256x64x64x256_16x16_32x32_16x16x1_16x16x1_1x32x1x8_8_1x1_intrawave_v1,191.44,204.57,0.0
80,8192,1536,7168,18,0,900.4323,a8w8_blockscale_1x128x128_256x64x64x256_16x16_32x32_16x16x1_16x16x1_1x32x1x8_8_1x1_intrawave_v1,200.34,105.39,0.0
80,8192,3072,1536,16,0,438.686,a8w8_blockscale_1x128x128_256x64x64x128_16x16_32x32_8x32x1_8x32x1_1x32x1x8_8_1x1_intrawave_v1,176.23,154.17,0.0
80,8192,4096,512,16,0,262.4441,a8w8_blockscale_1x128x128_256x64x64x128_16x16_32x32_8x32x1_8x32x1_1x32x1x8_8_1x1_intrawave_v1,130.92,279.68,0.0
80,8192,4608,7168,2,0,2612.1569,a8w8_blockscale_1x128x128_256x64x128x128_16x16_32x32_8x32x1_8x32x1_1x32x1x8_8_1x1_intrawave_v3,207.17,64.03,0.0
80,8192,7168,256,16,0,293.267,a8w8_blockscale_1x128x128_256x64x64x128_16x16_32x32_8x32x1_8x32x1_1x32x1x8_8_1x1_intrawave_v1,102.52,413.86,0.0
80,8192,7168,2048,0,0,1332.8349,a8w8_blockscale_1x128x128_256x128x128x128_16x16_32x32_8x32x1_8x32x1_1x32x1x8_8_1x1_intrawave_v3,180.46,111.72,0.0
80,8192,7168,2304,3,0,1342.3805,a8w8_blockscale_1x128x128_256x64x64x128_16x16_32x32_8x32x1_8x32x1_1x32x1x8_8_1x1_intrawave_v3,201.57,113.85,0.0
80,16384,512,7168,18,0,612.0559,a8w8_blockscale_1x128x128_256x64x64x256_16x16_32x32_16x16x1_16x16x1_1x32x1x8_8_1x1_intrawave_v1,196.48,225.29,0.0
80,16384,576,7168,18,0,679.861,a8w8_blockscale_1x128x128_256x64x64x256_16x16_32x32_16x16x1_16x16x1_1x32x1x8_8_1x1_intrawave_v1,199.0,206.58,0.0
80,16384,1536,7168,18,0,1774.7531,a8w8_blockscale_1x128x128_256x64x64x256_16x16_32x32_16x16x1_16x16x1_1x32x1x8_8_1x1_intrawave_v1,203.28,100.74,0.0
80,16384,3072,1536,16,0,862.8613,a8w8_blockscale_1x128x128_256x64x64x128_16x16_32x32_8x32x1_8x32x1_1x32x1x8_8_1x1_intrawave_v1,179.19,151.3,0.0
80,16384,4096,512,16,0,517.0127,a8w8_blockscale_1x128x128_256x64x64x128_16x16_32x32_8x32x1_8x32x1_1x32x1x8_8_1x1_intrawave_v1,132.92,279.88,0.0
80,16384,4608,7168,2,0,5184.7895,a8w8_blockscale_1x128x128_256x64x128x128_16x16_32x32_8x32x1_8x32x1_1x32x1x8_8_1x1_intrawave_v3,208.75,58.14,0.0
80,16384,7168,256,16,0,579.5334,a8w8_blockscale_1x128x128_256x64x64x128_16x16_32x32_8x32x1_8x32x1_1x32x1x8_8_1x1_intrawave_v1,103.76,415.7,0.0
80,16384,7168,2048,0,0,2650.6467,a8w8_blockscale_1x128x128_256x128x128x128_16x16_32x32_8x32x1_8x32x1_1x32x1x8_8_1x1_intrawave_v3,181.48,106.81,0.0
80,16384,7168,2304,3,0,2670.4624,a8w8_blockscale_1x128x128_256x64x64x128_16x16_32x32_8x32x1_8x32x1_1x32x1x8_8_1x1_intrawave_v3,202.65,108.28,0.0
80,20480,512,7168,18,0,758.3905,a8w8_blockscale_1x128x128_256x64x64x256_16x16_32x32_16x16x1_16x16x1_1x32x1x8_8_1x1_intrawave_v1,198.21,226.06,0.0
80,20480,576,7168,18,0,844.2841,a8w8_blockscale_1x128x128_256x64x64x256_16x16_32x32_16x16x1_16x16x1_1x32x1x8_8_1x1_intrawave_v1,200.31,206.71,0.0
80,20480,1536,7168,2,0,2192.846,a8w8_blockscale_1x128x128_256x64x128x128_16x16_32x32_8x32x1_8x32x1_1x32x1x8_8_1x1_intrawave_v3,205.66,100.66,0.0
80,20480,3072,1536,16,0,1076.861,a8w8_blockscale_1x128x128_256x64x64x128_16x16_32x32_8x32x1_8x32x1_1x32x1x8_8_1x1_intrawave_v1,179.48,150.44,0.0
80,20480,4096,512,16,0,643.2625,a8w8_blockscale_1x128x128_256x64x64x128_16x16_32x32_8x32x1_8x32x1_1x32x1x8_8_1x1_intrawave_v1,133.54,280.38,0.0
80,20480,4608,7168,2,0,6440.0431,a8w8_blockscale_1x128x128_256x64x128x128_16x16_32x32_8x32x1_8x32x1_1x32x1x8_8_1x1_intrawave_v3,210.08,57.23,0.0
80,20480,7168,256,16,0,723.218,a8w8_blockscale_1x128x128_256x64x64x128_16x16_32x32_8x32x1_8x32x1_1x32x1x8_8_1x1_intrawave_v1,103.93,415.75,0.0
80,20480,7168,2048,0,0,3312.2434,a8w8_blockscale_1x128x128_256x128x128x128_16x16_32x32_8x32x1_8x32x1_1x32x1x8_8_1x1_intrawave_v3,181.54,105.74,0.0
80,20480,7168,2304,3,0,3334.2791,a8w8_blockscale_1x128x128_256x64x64x128_16x16_32x32_8x32x1_8x32x1_1x32x1x8_8_1x1_intrawave_v3,202.88,107.16,0.0
256,1,100,5120,8,0,20.5629,a8w8_blockscale_1x128x128_256x16x64x256_16x16_16x16_16x16x1_16x16x1_1x16x1x16_4_1x1_intrawave_v1,0.05,25.16,0.0
256,1,200,5120,8,0,20.7831,a8w8_blockscale_1x128x128_256x16x64x256_16x16_16x16_16x16x1_16x16x1_1x16x1x16_4_1x1_intrawave_v1,0.1,49.54,0.0
256,1,800,5120,8,0,26.6635,a8w8_blockscale_1x128x128_256x16x64x256_16x16_16x16_16x16x1_16x16x1_1x16x1x16_4_1x1_intrawave_v1,0.31,153.87,0.0
256,1,1280,8192,8,0,26.7354,a8w8_blockscale_1x128x128_256x16x64x256_16x16_16x16_16x16x1_16x16x1_1x16x1x16_4_1x1_intrawave_v1,0.78,392.61,0.0
256,1,2304,16384,8,0,77.0527,a8w8_blockscale_1x128x128_256x16x64x256_16x16_16x16_16x16x1_16x16x1_1x16x1x16_4_1x1_intrawave_v1,0.98,490.18,0.0
256,1,2560,8192,8,0,26.3795,a8w8_blockscale_1x128x128_256x16x64x256_16x16_16x16_16x16x1_16x16x1_1x16x1x16_4_1x1_intrawave_v1,1.59,795.5,0.0
256,1,4608,16384,8,0,78.2532,a8w8_blockscale_1x128x128_256x16x64x256_16x16_16x16_16x16x1_16x16x1_1x16x1x16_4_1x1_intrawave_v1,1.93,965.11,0.0
256,1,5120,640,8,0,6.0162,a8w8_blockscale_1x128x128_256x16x64x256_16x16_16x16_16x16x1_16x16x1_1x16x1x16_4_1x1_intrawave_v1,1.09,546.47,0.0
256,1,5120,1280,8,0,7.7009,a8w8_blockscale_1x128x128_256x16x64x256_16x16_16x16_16x16x1_16x16x1_1x16x1x16_4_1x1_intrawave_v1,1.7,852.51,0.0
256,1,5120,3200,8,0,16.4917,a8w8_blockscale_1x128x128_256x16x64x256_16x16_16x16_16x16x1_16x16x1_1x16x1x16_4_1x1_intrawave_v1,1.99,994.28,0.0
256,1,5120,5120,8,0,26.9254,a8w8_blockscale_1x128x128_256x16x64x256_16x16_16x16_16x16x1_16x16x1_1x16x1x16_4_1x1_intrawave_v1,1.95,974.16,0.0
256,1,5120,6400,8,0,29.5876,a8w8_blockscale_1x128x128_256x16x64x256_16x16_16x16_16x16x1_16x16x1_1x16x1x16_4_1x1_intrawave_v1,2.21,1108.05,0.0
256,1,5120,25600,8,0,127.0431,a8w8_blockscale_1x128x128_256x16x64x256_16x16_16x16_16x16x1_16x16x1_1x16x1x16_4_1x1_intrawave_v1,2.06,1031.99,0.0
256,1,6400,5120,8,0,27.1669,a8w8_blockscale_1x128x128_256x16x64x256_16x16_16x16_16x16x1_16x16x1_1x16x1x16_4_1x1_intrawave_v1,2.41,1206.83,0.0
256,1,7168,8192,8,0,27.4028,a8w8_blockscale_1x128x128_256x16x64x256_16x16_16x16_16x16x1_16x16x1_1x16x1x16_4_1x1_intrawave_v1,4.29,2143.68,0.0
256,1,8192,1024,8,0,6.0794,a8w8_blockscale_1x128x128_256x16x64x256_16x16_16x16_16x16x1_16x16x1_1x16x1x16_4_1x1_intrawave_v1,2.76,1382.7,0.0
256,1,8192,2048,18,0,9.7005,a8w8_blockscale_1x128x128_256x64x64x256_16x16_32x32_16x16x1_16x16x1_1x32x1x8_8_1x1_intrawave_v1,3.46,1731.42,0.0
256,1,8192,3584,8,0,13.1,a8w8_blockscale_1x128x128_256x16x64x256_16x16_16x16_16x16x1_16x16x1_1x16x1x16_4_1x1_intrawave_v1,4.48,2242.76,0.0
256,1,8192,7168,8,0,24.4903,a8w8_blockscale_1x128x128_256x16x64x256_16x16_16x16_16x16x1_16x16x1_1x16x1x16_4_1x1_intrawave_v1,4.8,2398.66,0.0
256,1,8192,8192,8,0,27.8749,a8w8_blockscale_1x128x128_256x16x64x256_16x16_16x16_16x16x1_16x16x1_1x16x1x16_4_1x1_intrawave_v1,4.82,2408.38,0.0
256,1,8192,28672,8,0,94.1079,a8w8_blockscale_1x128x128_256x16x64x256_16x16_16x16_16x16x1_16x16x1_1x16x1x16_4_1x1_intrawave_v1,4.99,2496.35,0.0
256,1,9216,16384,8,0,81.7874,a8w8_blockscale_1x128x128_256x16x64x256_16x16_16x16_16x16x1_16x16x1_1x16x1x16_4_1x1_intrawave_v1,3.69,1846.61,0.0
256,1,10240,8192,8,0,29.3514,a8w8_blockscale_1x128x128_256x16x64x256_16x16_16x16_16x16x1_16x16x1_1x16x1x16_4_1x1_intrawave_v1,5.72,2858.97,0.0
256,1,12800,5120,8,0,28.404,a8w8_blockscale_1x128x128_256x16x64x256_16x16_16x16_16x16x1_16x16x1_1x16x1x16_4_1x1_intrawave_v1,4.61,2308.36,0.0
256,1,13312,16384,8,0,86.7313,a8w8_blockscale_1x128x128_256x16x64x256_16x16_16x16_16x16x1_16x16x1_1x16x1x16_4_1x1_intrawave_v1,5.03,2515.2,0.0
256,1,14336,8192,18,0,32.645,a8w8_blockscale_1x128x128_256x64x64x256_16x16_32x32_16x16x1_16x16x1_1x32x1x8_8_1x1_intrawave_v1,7.2,3598.63,0.0
256,1,16384,2048,8,0,12.7222,a8w8_blockscale_1x128x128_256x16x64x256_16x16_16x16_16x16x1_16x16x1_1x16x1x16_4_1x1_intrawave_v1,5.27,2640.21,0.0
256,1,16384,4096,8,0,24.3487,a8w8_blockscale_1x128x128_256x16x64x256_16x16_16x16_16x16x1_16x16x1_1x16x1x16_4_1x1_intrawave_v1,5.51,2757.67,0.0
256,1,16384,6656,8,0,36.8308,a8w8_blockscale_1x128x128_256x16x64x256_16x16_16x16_16x16x1_16x16x1_1x16x1x16_4_1x1_intrawave_v1,5.92,2961.96,0.0
256,1,16384,8192,8,0,46.9462,a8w8_blockscale_1x128x128_256x16x64x256_16x16_16x16_16x16x1_16x16x1_1x16x1x16_4_1x1_intrawave_v1,5.72,2859.84,0.0
256,1,16384,13312,8,0,71.4701,a8w8_blockscale_1x128x128_256x16x64x256_16x16_16x16_16x16x1_16x16x1_1x16x1x16_4_1x1_intrawave_v1,6.1,3052.32,0.0
256,1,16384,26624,8,0,139.8338,a8w8_blockscale_1x128x128_256x16x64x256_16x16_16x16_16x16x1_16x16x1_1x16x1x16_4_1x1_intrawave_v1,6.24,3119.9,0.0
256,1,26624,16384,8,0,109.776,a8w8_blockscale_1x128x128_256x16x64x256_16x16_16x16_16x16x1_16x16x1_1x16x1x16_4_1x1_intrawave_v1,7.95,3974.25,0.0
256,1,51200,5120,7,0,59.3032,a8w8_blockscale_1x128x128_256x16x128x256_16x16_16x16_16x16x1_16x16x1_1x16x1x16_8_1x2_intrawave_v1,8.84,4422.22,0.0
256,1,53248,16384,7,0,177.261,a8w8_blockscale_1x128x128_256x16x128x256_16x16_16x16_16x16x1_16x16x1_1x16x1x16_8_1x2_intrawave_v1,9.84,4922.34,0.0
256,1,57344,8192,7,0,95.7067,a8w8_blockscale_1x128x128_256x16x128x256_16x16_16x16_16x16x1_16x16x1_1x16x1x16_8_1x2_intrawave_v1,9.82,4909.63,0.0
256,16,100,5120,8,0,21.0887,a8w8_blockscale_1x128x128_256x16x64x256_16x16_16x16_16x16x1_16x16x1_1x16x1x16_4_1x1_intrawave_v1,0.78,28.31,0.0
256,16,200,5120,8,0,21.2891,a8w8_blockscale_1x128x128_256x16x64x256_16x16_16x16_16x16x1_16x16x1_1x16x1x16_4_1x1_intrawave_v1,1.54,52.25,0.0
256,16,512,7168,8,0,19.9419,a8w8_blockscale_1x128x128_256x16x64x256_16x16_16x16_16x16x1_16x16x1_1x16x1x16_4_1x1_intrawave_v1,5.89,190.61,0.0
256,16,576,7168,8,0,19.9031,a8w8_blockscale_1x128x128_256x16x64x256_16x16_16x16_16x16x1_16x16x1_1x16x1x16_4_1x1_intrawave_v1,6.64,214.13,0.0
256,16,800,5120,8,0,28.2821,a8w8_blockscale_1x128x128_256x16x64x256_16x16_16x16_16x16x1_16x16x1_1x16x1x16_4_1x1_intrawave_v1,4.63,148.63,0.0
256,16,1280,8192,8,0,23.8049,a8w8_blockscale_1x128x128_256x16x64x256_16x16_16x16_16x16x1_16x16x1_1x16x1x16_4_1x1_intrawave_v1,14.1,447.71,0.0
256,16,1536,7168,8,0,20.8535,a8w8_blockscale_1x128x128_256x16x64x256_16x16_16x16_16x16x1_16x16x1_1x16x1x16_4_1x1_intrawave_v1,16.9,535.83,0.0
256,16,2304,16384,8,0,59.0958,a8w8_blockscale_1x128x128_256x16x64x256_16x16_16x16_16x16x1_16x16x1_1x16x1x16_4_1x1_intrawave_v1,20.44,644.46,0.0
256,16,2560,8192,8,0,23.2359,a8w8_blockscale_1x128x128_256x16x64x256_16x16_16x16_16x16x1_16x16x1_1x16x1x16_4_1x1_intrawave_v1,28.88,911.71,0.0
256,16,3072,1536,8,0,7.66,a8w8_blockscale_1x128x128_256x16x64x256_16x16_16x16_16x16x1_16x16x1_1x16x1x16_4_1x1_intrawave_v1,19.71,632.05,0.0
256,16,4096,512,13,0,3.5903,a8w8_blockscale_1x128x128_256x32x64x256_16x16_16x16_16x16x1_16x16x1_1x32x1x8_8_2x1_intrawave_v1,18.69,622.91,0.0
256,16,4608,7168,8,0,21.2231,a8w8_blockscale_1x128x128_256x16x64x256_16x16_16x16_16x16x1_16x16x1_1x16x1x16_4_1x1_intrawave_v1,49.8,1568.68,0.0
256,16,4608,16384,8,0,60.6736,a8w8_blockscale_1x128x128_256x16x64x256_16x16_16x16_16x16x1_16x16x1_1x16x1x16_4_1x1_intrawave_v1,39.82,1251.07,0.0
256,16,5120,640,8,0,5.5586,a8w8_blockscale_1x128x128_256x16x64x256_16x16_16x16_16x16x1_16x16x1_1x16x1x16_4_1x1_intrawave_v1,18.86,620.82,0.0
256,16,5120,1280,8,0,7.5523,a8w8_blockscale_1x128x128_256x16x64x256_16x16_16x16_16x16x1_16x16x1_1x16x1x16_4_1x1_intrawave_v1,27.77,892.17,0.0
256,16,5120,3200,8,0,16.619,a8w8_blockscale_1x128x128_256x16x64x256_16x16_16x16_16x16x1_16x16x1_1x16x1x16_4_1x1_intrawave_v1,31.55,998.8,0.0
256,16,5120,5120,8,0,20.9939,a8w8_blockscale_1x128x128_256x16x64x256_16x16_16x16_16x16x1_16x16x1_1x16x1x16_4_1x1_intrawave_v1,39.96,1260.37,0.0
256,16,5120,6400,8,0,24.7474,a8w8_blockscale_1x128x128_256x16x64x256_16x16_16x16_16x16x1_16x16x1_1x16x1x16_4_1x1_intrawave_v1,42.37,1334.86,0.0
256,16,5120,25600,8,0,94.3261,a8w8_blockscale_1x128x128_256x16x64x256_16x16_16x16_16x16x1_16x16x1_1x16x1x16_4_1x1_intrawave_v1,44.47,1395.64,0.0
256,16,6400,5120,8,0,21.19,a8w8_blockscale_1x128x128_256x16x64x256_16x16_16x16_16x16x1_16x16x1_1x16x1x16_4_1x1_intrawave_v1,49.48,1559.92,0.0
256,16,7168,256,8,0,3.6287,a8w8_blockscale_1x128x128_256x16x64x256_16x16_16x16_16x16x1_16x16x1_1x16x1x16_4_1x1_intrawave_v1,16.18,570.03,0.0
256,16,7168,2048,8,0,8.0688,a8w8_blockscale_1x128x128_256x16x64x256_16x16_16x16_16x16x1_16x16x1_1x16x1x16_4_1x1_intrawave_v1,58.22,1851.85,0.0
256,16,7168,2304,8,0,8.6748,a8w8_blockscale_1x128x128_256x16x64x256_16x16_16x16_16x16x1_16x16x1_1x16x1x16_4_1x1_intrawave_v1,60.92,1934.49,0.0
256,16,7168,8192,8,0,24.927,a8w8_blockscale_1x128x128_256x16x64x256_16x16_16x16_16x16x1_16x16x1_1x16x1x16_4_1x1_intrawave_v1,75.38,2370.15,0.0
256,16,8192,1024,8,0,5.8893,a8w8_blockscale_1x128x128_256x16x64x256_16x16_16x16_16x16x1_16x16x1_1x16x1x16_4_1x1_intrawave_v1,45.58,1471.68,0.0
256,16,8192,2048,8,0,7.6546,a8w8_blockscale_1x128x128_256x16x64x256_16x16_16x16_16x16x1_16x16x1_1x16x1x16_4_1x1_intrawave_v1,70.14,2230.31,0.0
256,16,8192,3584,8,0,11.5088,a8w8_blockscale_1x128x128_256x16x64x256_16x16_16x16_16x16x1_16x16x1_1x16x1x16_4_1x1_intrawave_v1,81.64,2578.86,0.0
256,16,8192,7168,8,0,21.0912,a8w8_blockscale_1x128x128_256x16x64x256_16x16_16x16_16x16x1_16x16x1_1x16x1x16_4_1x1_intrawave_v1,89.09,2801.98,0.0
256,16,8192,8192,8,0,25.3059,a8w8_blockscale_1x128x128_256x16x64x256_16x16_16x16_16x16x1_16x16x1_1x16x1x16_4_1x1_intrawave_v1,84.86,2667.44,0.0
256,16,8192,28672,8,0,84.9003,a8w8_blockscale_1x128x128_256x16x64x256_16x16_16x16_16x16x1_16x16x1_1x16x1x16_4_1x1_intrawave_v1,88.53,2775.04,0.0
256,16,9216,16384,8,0,63.6471,a8w8_blockscale_1x128x128_256x16x64x256_16x16_16x16_16x16x1_16x16x1_1x16x1x16_4_1x1_intrawave_v1,75.92,2381.13,0.0
256,16,10240,8192,8,0,26.7988,a8w8_blockscale_1x128x128_256x16x64x256_16x16_16x16_16x16x1_16x16x1_1x16x1x16_4_1x1_intrawave_v1,100.17,3147.34,0.0
256,16,12800,5120,8,0,22.8893,a8w8_blockscale_1x128x128_256x16x64x256_16x16_16x16_16x16x1_16x16x1_1x16x1x16_4_1x1_intrawave_v1,91.62,2884.65,0.0
256,16,13312,16384,8,0,68.6268,a8w8_blockscale_1x128x128_256x16x64x256_16x16_16x16_16x16x1_16x16x1_1x16x1x16_4_1x1_intrawave_v1,101.7,3188.14,0.0
256,16,14336,8192,8,0,29.5335,a8w8_blockscale_1x128x128_256x16x64x256_16x16_16x16_16x16x1_16x16x1_1x16x1x16_4_1x1_intrawave_v1,127.25,3996.49,0.0
256,16,16384,2048,8,0,11.5848,a8w8_blockscale_1x128x128_256x16x64x256_16x16_16x16_16x16x1_16x16x1_1x16x1x16_4_1x1_intrawave_v1,92.69,2944.5,0.0
256,16,16384,4096,8,0,19.8194,a8w8_blockscale_1x128x128_256x16x64x256_16x16_16x16_16x16x1_16x16x1_1x16x1x16_4_1x1_intrawave_v1,108.35,3415.78,0.0
256,16,16384,6656,8,0,28.9746,a8w8_blockscale_1x128x128_256x16x64x256_16x16_16x16_16x16x1_16x16x1_1x16x1x16_4_1x1_intrawave_v1,120.44,3785.48,0.0
256,16,16384,8192,8,0,37.1133,a8w8_blockscale_1x128x128_256x16x64x256_16x16_16x16_16x16x1_16x16x1_1x16x1x16_4_1x1_intrawave_v1,115.73,3634.09,0.0
256,16,16384,13312,8,0,55.1626,a8w8_blockscale_1x128x128_256x16x64x256_16x16_16x16_16x16x1_16x16x1_1x16x1x16_4_1x1_intrawave_v1,126.52,3967.2,0.0
256,16,16384,26624,8,0,106.3298,a8w8_blockscale_1x128x128_256x16x64x256_16x16_16x16_16x16x1_16x16x1_1x16x1x16_4_1x1_intrawave_v1,131.28,4111.34,0.0
256,16,26624,16384,7,0,106.6492,a8w8_blockscale_1x128x128_256x16x128x256_16x16_16x16_16x16x1_16x16x1_1x16x1x16_8_1x2_intrawave_v1,130.88,4100.56,0.0
256,16,51200,5120,7,0,59.4032,a8w8_blockscale_1x128x128_256x16x128x256_16x16_16x16_16x16x1_16x16x1_1x16x1x16_8_1x2_intrawave_v1,141.21,4441.92,0.0
256,16,53248,16384,7,0,194.6868,a8w8_blockscale_1x128x128_256x16x128x256_16x16_16x16_16x16x1_16x16x1_1x16x1x16_8_1x2_intrawave_v1,143.4,4491.22,0.0
256,16,57344,8192,8,0,94.9502,a8w8_blockscale_1x128x128_256x16x64x256_16x16_16x16_16x16x1_16x16x1_1x16x1x16_4_1x1_intrawave_v1,158.32,4968.16,0.0
256,32,100,5120,8,0,21.2636,a8w8_blockscale_1x128x128_256x16x64x256_16x16_16x16_16x16x1_16x16x1_1x16x1x16_4_1x1_intrawave_v1,1.54,32.08,0.0
256,32,200,5120,8,0,21.6456,a8w8_blockscale_1x128x128_256x16x64x256_16x16_16x16_16x16x1_16x16x1_1x16x1x16_4_1x1_intrawave_v1,3.03,55.47,0.0
256,32,512,7168,8,0,19.9219,a8w8_blockscale_1x128x128_256x16x64x256_16x16_16x16_16x16x1_16x16x1_1x16x1x16_4_1x1_intrawave_v1,11.79,197.38,0.0
256,32,576,7168,8,0,19.9519,a8w8_blockscale_1x128x128_256x16x64x256_16x16_16x16_16x16x1_16x16x1_1x16x1x16_4_1x1_intrawave_v1,13.24,220.28,0.0
256,32,800,5120,8,0,27.4697,a8w8_blockscale_1x128x128_256x16x64x256_16x16_16x16_16x16x1_16x16x1_1x16x1x16_4_1x1_intrawave_v1,9.54,156.94,0.0
256,32,1280,8192,8,0,23.3176,a8w8_blockscale_1x128x128_256x16x64x256_16x16_16x16_16x16x1_16x16x1_1x16x1x16_4_1x1_intrawave_v1,28.78,464.45,0.0
256,32,1536,7168,8,0,20.7843,a8w8_blockscale_1x128x128_256x16x64x256_16x16_16x16_16x16x1_16x16x1_1x16x1x16_4_1x1_intrawave_v1,33.9,545.49,0.0
256,32,2304,16384,8,0,57.5331,a8w8_blockscale_1x128x128_256x16x64x256_16x16_16x16_16x16x1_16x16x1_1x16x1x16_4_1x1_intrawave_v1,41.99,667.8,0.0
256,32,2560,8192,8,0,22.6875,a8w8_blockscale_1x128x128_256x16x64x256_16x16_16x16_16x16x1_16x16x1_1x16x1x16_4_1x1_intrawave_v1,59.16,943.14,0.0
256,32,3072,1536,8,0,7.8864,a8w8_blockscale_1x128x128_256x16x64x256_16x16_16x16_16x16x1_16x16x1_1x16x1x16_4_1x1_intrawave_v1,38.29,629.48,0.0
256,32,4096,512,7,0,3.8435,a8w8_blockscale_1x128x128_256x16x128x256_16x16_16x16_16x16x1_16x16x1_1x16x1x16_8_1x2_intrawave_v1,34.92,618.1,0.0
256,32,4608,7168,8,0,21.1971,a8w8_blockscale_1x128x128_256x16x64x256_16x16_16x16_16x16x1_16x16x1_1x16x1x16_4_1x1_intrawave_v1,99.73,1582.97,0.0
256,32,4608,16384,8,0,59.2848,a8w8_blockscale_1x128x128_256x16x64x256_16x16_16x16_16x16x1_16x16x1_1x16x1x16_4_1x1_intrawave_v1,81.5,1287.29,0.0
256,32,5120,640,8,0,6.2607,a8w8_blockscale_1x128x128_256x16x64x256_16x16_16x16_16x16x1_16x16x1_1x16x1x16_4_1x1_intrawave_v1,33.5,579.0,0.0
256,32,5120,1280,8,0,6.5883,a8w8_blockscale_1x128x128_256x16x64x256_16x16_16x16_16x16x1_16x16x1_1x16x1x16_4_1x1_intrawave_v1,63.66,1050.69,0.0
256,32,5120,3200,8,0,16.91,a8w8_blockscale_1x128x128_256x16x64x256_16x16_16x16_16x16x1_16x16x1_1x16x1x16_4_1x1_intrawave_v1,62.01,994.33,0.0
256,32,5120,5120,8,0,20.9363,a8w8_blockscale_1x128x128_256x16x64x256_16x16_16x16_16x16x1_16x16x1_1x16x1x16_4_1x1_intrawave_v1,80.13,1275.58,0.0
256,32,5120,6400,8,0,25.0483,a8w8_blockscale_1x128x128_256x16x64x256_16x16_16x16_16x16x1_16x16x1_1x16x1x16_4_1x1_intrawave_v1,83.72,1329.45,0.0
256,32,5120,25600,8,0,92.4611,a8w8_blockscale_1x128x128_256x16x64x256_16x16_16x16_16x16x1_16x16x1_1x16x1x16_4_1x1_intrawave_v1,90.73,1429.99,0.0
256,32,6400,5120,8,0,21.2077,a8w8_blockscale_1x128x128_256x16x64x256_16x16_16x16_16x16x1_16x16x1_1x16x1x16_4_1x1_intrawave_v1,98.89,1572.14,0.0
256,32,7168,256,7,0,3.6839,a8w8_blockscale_1x128x128_256x16x128x256_16x16_16x16_16x16x1_16x16x1_1x16x1x16_8_1x2_intrawave_v1,31.88,624.87,0.0
256,32,7168,2048,8,0,8.2088,a8w8_blockscale_1x128x128_256x16x64x256_16x16_16x16_16x16x1_16x16x1_1x16x1x16_4_1x1_intrawave_v1,114.45,1852.2,0.0
256,32,7168,2304,8,0,8.942,a8w8_blockscale_1x128x128_256x16x64x256_16x16_16x16_16x16x1_16x16x1_1x16x1x16_4_1x1_intrawave_v1,118.2,1906.46,0.0
256,32,7168,8192,8,0,24.416,a8w8_blockscale_1x128x128_256x16x64x256_16x16_16x16_16x16x1_16x16x1_1x16x1x16_4_1x1_intrawave_v1,153.92,2434.52,0.0
256,32,8192,1024,8,0,5.9191,a8w8_blockscale_1x128x128_256x16x64x256_16x16_16x16_16x16x1_16x16x1_1x16x1x16_4_1x1_intrawave_v1,90.7,1511.32,0.0
256,32,8192,2048,8,0,9.2363,a8w8_blockscale_1x128x128_256x16x64x256_16x16_16x16_16x16x1_16x16x1_1x16x1x16_4_1x1_intrawave_v1,116.25,1880.3,0.0
256,32,8192,3584,8,0,11.7168,a8w8_blockscale_1x128x128_256x16x64x256_16x16_16x16_16x16x1_16x16x1_1x16x1x16_4_1x1_intrawave_v1,160.37,2560.35,0.0
256,32,8192,7168,8,0,21.1742,a8w8_blockscale_1x128x128_256x16x64x256_16x16_16x16_16x16x1_16x16x1_1x16x1x16_4_1x1_intrawave_v1,177.48,2808.79,0.0
256,32,8192,8192,8,0,24.6599,a8w8_blockscale_1x128x128_256x16x64x256_16x16_16x16_16x16x1_16x16x1_1x16x1x16_4_1x1_intrawave_v1,174.17,2753.27,0.0
256,32,8192,28672,8,0,84.347,a8w8_blockscale_1x128x128_256x16x64x256_16x16_16x16_16x16x1_16x16x1_1x16x1x16_4_1x1_intrawave_v1,178.22,2801.79,0.0
256,32,9216,16384,7,0,87.5136,a8w8_blockscale_1x128x128_256x16x128x256_16x16_16x16_16x16x1_16x16x1_1x16x1x16_8_1x2_intrawave_v1,110.42,1738.12,0.0
256,32,10240,8192,7,0,28.6534,a8w8_blockscale_1x128x128_256x16x128x256_16x16_16x16_16x16x1_16x16x1_1x16x1x16_8_1x2_intrawave_v1,187.37,2959.63,0.0
256,32,12800,5120,7,0,30.5797,a8w8_blockscale_1x128x128_256x16x128x256_16x16_16x16_16x16x1_16x16x1_1x16x1x16_8_1x2_intrawave_v1,137.16,2175.27,0.0
256,32,13312,16384,7,0,89.7303,a8w8_blockscale_1x128x128_256x16x128x256_16x16_16x16_16x16x1_16x16x1_1x16x1x16_8_1x2_intrawave_v1,155.56,2446.0,0.0
256,32,14336,8192,7,0,31.8955,a8w8_blockscale_1x128x128_256x16x128x256_16x16_16x16_16x16x1_16x16x1_1x16x1x16_8_1x2_intrawave_v1,235.65,3719.02,0.0
256,32,16384,2048,7,0,14.3547,a8w8_blockscale_1x128x128_256x16x128x256_16x16_16x16_16x16x1_16x16x1_1x16x1x16_8_1x2_intrawave_v1,149.6,2415.14,0.0
256,32,16384,4096,7,0,26.4375,a8w8_blockscale_1x128x128_256x16x128x256_16x16_16x16_16x16x1_16x16x1_1x16x1x16_8_1x2_intrawave_v1,162.46,2583.02,0.0
256,32,16384,6656,7,0,39.3427,a8w8_blockscale_1x128x128_256x16x128x256_16x16_16x16_16x16x1_16x16x1_1x16x1x16_8_1x2_intrawave_v1,177.4,2803.91,0.0
256,32,16384,8192,7,0,48.81,a8w8_blockscale_1x128x128_256x16x128x256_16x16_16x16_16x16x1_16x16x1_1x16x1x16_8_1x2_intrawave_v1,175.99,2776.65,0.0
256,32,16384,13312,7,0,74.6893,a8w8_blockscale_1x128x128_256x16x128x256_16x16_16x16_16x16x1_16x16x1_1x16x1x16_8_1x2_intrawave_v1,186.89,2939.89,0.0
256,32,16384,26624,7,0,144.185,a8w8_blockscale_1x128x128_256x16x128x256_16x16_16x16_16x16x1_16x16x1_1x16x1x16_8_1x2_intrawave_v1,193.62,3038.51,0.0
256,32,26624,16384,13,0,141.4403,a8w8_blockscale_1x128x128_256x32x64x256_16x16_16x16_16x16x1_16x16x1_1x32x1x8_8_2x1_intrawave_v1,197.38,3099.79,0.0
256,32,51200,5120,13,0,86.9684,a8w8_blockscale_1x128x128_256x32x64x256_16x16_16x16_16x16x1_16x16x1_1x32x1x8_8_2x1_intrawave_v1,192.91,3053.81,0.0
256,32,53248,16384,13,0,274.8867,a8w8_blockscale_1x128x128_256x32x64x256_16x16_16x16_16x16x1_16x16x1_1x32x1x8_8_2x1_intrawave_v1,203.12,3188.03,0.0
256,32,57344,8192,12,0,98.0583,a8w8_blockscale_1x128x128_256x32x128x256_16x16_32x32_16x16x1_16x16x1_1x32x1x8_8_1x1_intrawave_v1,306.6,4830.74,0.0
256,64,100,5120,8,0,21.5586,a8w8_blockscale_1x128x128_256x16x64x256_16x16_16x16_16x16x1_16x16x1_1x16x1x16_4_1x1_intrawave_v1,3.04,39.54,0.0
256,64,192,1024,8,0,4.6632,a8w8_blockscale_1x128x128_256x16x64x256_16x16_16x16_16x16x1_16x16x1_1x16x1x16_4_1x1_intrawave_v1,5.4,61.49,0.0
256,64,200,5120,8,0,21.5216,a8w8_blockscale_1x128x128_256x16x64x256_16x16_16x16_16x16x1_16x16x1_1x16x1x16_4_1x1_intrawave_v1,6.09,64.0,0.0
256,64,512,7168,8,0,19.6915,a8w8_blockscale_1x128x128_256x16x64x256_16x16_16x16_16x16x1_16x16x1_1x16x1x16_4_1x1_intrawave_v1,23.86,213.0,0.0
256,64,576,7168,8,0,19.7455,a8w8_blockscale_1x128x128_256x16x64x256_16x16_16x16_16x16x1_16x16x1_1x16x1x16_4_1x1_intrawave_v1,26.76,236.07,0.0
256,64,800,5120,8,0,26.3125,a8w8_blockscale_1x128x128_256x16x64x256_16x16_16x16_16x16x1_16x16x1_1x16x1x16_4_1x1_intrawave_v1,19.93,172.01,0.0
256,64,1280,8192,8,0,22.7332,a8w8_blockscale_1x128x128_256x16x64x256_16x16_16x16_16x16x1_16x16x1_1x16x1x16_4_1x1_intrawave_v1,59.04,491.52,0.0
256,64,1536,7168,8,0,20.5651,a8w8_blockscale_1x128x128_256x16x64x256_16x16_16x16_16x16x1_16x16x1_1x16x1x16_4_1x1_intrawave_v1,68.53,567.24,0.0
256,64,2304,16384,8,0,57.1536,a8w8_blockscale_1x128x128_256x16x64x256_16x16_16x16_16x16x1_16x16x1_1x16x1x16_4_1x1_intrawave_v1,84.54,683.99,0.0
256,64,2560,8192,8,0,22.2378,a8w8_blockscale_1x128x128_256x16x64x256_16x16_16x16_16x16x1_16x16x1_1x16x1x16_4_1x1_intrawave_v1,120.71,981.37,0.0
256,64,3072,1536,18,0,8.078,a8w8_blockscale_1x128x128_256x64x64x256_16x16_32x32_16x16x1_16x16x1_1x32x1x8_8_1x1_intrawave_v1,74.77,644.98,0.0
256,64,4096,512,13,0,4.0395,a8w8_blockscale_1x128x128_256x32x64x256_16x16_16x16_16x16x1_16x16x1_1x32x1x8_8_2x1_intrawave_v1,66.45,657.06,0.0
256,64,4608,7168,7,0,24.0952,a8w8_blockscale_1x128x128_256x16x128x256_16x16_16x16_16x16x1_16x16x1_1x16x1x16_8_1x2_intrawave_v1,175.46,1414.34,0.0
256,64,4608,16384,7,0,85.9235,a8w8_blockscale_1x128x128_256x16x128x256_16x16_16x16_16x16x1_16x16x1_1x16x1x16_8_1x2_intrawave_v1,112.47,897.73,0.0
256,64,5120,640,8,0,6.5358,a8w8_blockscale_1x128x128_256x16x64x256_16x16_16x16_16x16x1_16x16x1_1x16x1x16_4_1x1_intrawave_v1,64.17,607.9,0.0
256,64,5120,1280,7,0,9.0439,a8w8_blockscale_1x128x128_256x16x128x256_16x16_16x16_16x16x1_16x16x1_1x16x1x16_8_1x2_intrawave_v1,92.75,806.17,0.0
256,64,5120,3200,8,0,21.0938,a8w8_blockscale_1x128x128_256x16x64x256_16x16_16x16_16x16x1_16x16x1_1x16x1x16_4_1x1_intrawave_v1,99.42,817.5,0.0
256,64,5120,5120,8,0,29.1849,a8w8_blockscale_1x128x128_256x16x64x256_16x16_16x16_16x16x1_16x16x1_1x16x1x16_4_1x1_intrawave_v1,114.97,931.9,0.0
256,64,5120,6400,7,0,32.2352,a8w8_blockscale_1x128x128_256x16x128x256_16x16_16x16_16x16x1_16x16x1_1x16x1x16_8_1x2_intrawave_v1,130.12,1049.57,0.0
256,64,5120,25600,8,0,131.7158,a8w8_blockscale_1x128x128_256x16x64x256_16x16_16x16_16x16x1_16x16x1_1x16x1x16_4_1x1_intrawave_v1,127.37,1012.53,0.0
256,64,6400,5120,8,0,29.7697,a8w8_blockscale_1x128x128_256x16x64x256_16x16_16x16_16x16x1_16x16x1_1x16x1x16_4_1x1_intrawave_v1,140.89,1139.24,0.0
256,64,7168,256,11,0,3.7547,a8w8_blockscale_1x128x128_256x32x64x128_16x16_16x16_8x32x1_8x32x1_1x32x1x8_8_2x1_intrawave_v1,62.56,737.45,0.0
256,64,7168,2048,7,0,9.2928,a8w8_blockscale_1x128x128_256x16x128x256_16x16_16x16_16x16x1_16x16x1_1x16x1x16_8_1x2_intrawave_v1,202.2,1692.56,0.0
256,64,7168,2304,7,0,10.0892,a8w8_blockscale_1x128x128_256x16x128x256_16x16_16x16_16x16x1_16x16x1_1x16x1x16_8_1x2_intrawave_v1,209.52,1742.46,0.0
256,64,7168,8192,7,0,26.7943,a8w8_blockscale_1x128x128_256x16x128x256_16x16_16x16_16x16x1_16x16x1_1x16x1x16_8_1x2_intrawave_v1,280.51,2245.33,0.0
256,64,8192,2048,7,0,9.9235,a8w8_blockscale_1x128x128_256x16x128x256_16x16_16x16_16x16x1_16x16x1_1x16x1x16_8_1x2_intrawave_v1,216.4,1809.53,0.0
256,64,8192,3584,7,0,13.3348,a8w8_blockscale_1x128x128_256x16x128x256_16x16_16x16_16x16x1_16x16x1_1x16x1x16_8_1x2_intrawave_v1,281.83,2297.6,0.0
256,64,8192,7168,7,0,23.6118,a8w8_blockscale_1x128x128_256x16x128x256_16x16_16x16_16x16x1_16x16x1_1x16x1x16_8_1x2_intrawave_v1,318.32,2550.74,0.0
256,64,8192,8192,7,0,27.0402,a8w8_blockscale_1x128x128_256x16x128x256_16x16_16x16_16x16x1_16x16x1_1x16x1x16_8_1x2_intrawave_v1,317.67,2539.99,0.0
256,64,8192,28672,7,0,92.4831,a8w8_blockscale_1x128x128_256x16x128x256_16x16_16x16_16x16x1_16x16x1_1x16x1x16_8_1x2_intrawave_v1,325.08,2570.9,0.0
256,64,9216,16384,8,0,118.2638,a8w8_blockscale_1x128x128_256x16x64x256_16x16_16x16_16x16x1_16x16x1_1x16x1x16_4_1x1_intrawave_v1,163.43,1295.6,0.0
256,64,10240,8192,18,0,28.8785,a8w8_blockscale_1x128x128_256x64x64x256_16x16_32x32_16x16x1_16x16x1_1x32x1x8_8_1x1_intrawave_v1,371.81,2968.34,0.0
256,64,12800,5120,3,0,41.7304,a8w8_blockscale_1x128x128_256x64x64x128_16x16_32x32_8x32x1_8x32x1_1x32x1x8_8_1x1_intrawave_v3,201.02,1617.58,0.0
256,64,13312,16384,3,0,130.4823,a8w8_blockscale_1x128x128_256x64x64x128_16x16_32x32_8x32x1_8x32x1_1x32x1x8_8_1x1_intrawave_v3,213.95,1692.62,0.0
256,64,14336,8192,18,0,32.3867,a8w8_blockscale_1x128x128_256x64x64x256_16x16_32x32_16x16x1_16x16x1_1x32x1x8_8_1x1_intrawave_v1,464.15,3699.04,0.0
256,64,16384,2048,3,0,19.2527,a8w8_blockscale_1x128x128_256x64x64x128_16x16_32x32_8x32x1_8x32x1_1x32x1x8_8_1x1_intrawave_v3,223.08,1858.58,0.0
256,64,16384,4096,3,0,35.4139,a8w8_blockscale_1x128x128_256x64x64x128_16x16_32x32_8x32x1_8x32x1_1x32x1x8_8_1x1_intrawave_v3,242.56,1961.61,0.0
256,64,16384,6656,3,0,52.5466,a8w8_blockscale_1x128x128_256x64x64x128_16x16_32x32_8x32x1_8x32x1_1x32x1x8_8_1x1_intrawave_v3,265.64,2123.35,0.0
256,64,16384,8192,3,0,67.5044,a8w8_blockscale_1x128x128_256x64x64x128_16x16_32x32_8x32x1_8x32x1_1x32x1x8_8_1x1_intrawave_v3,254.5,2027.11,0.0
256,64,16384,13312,3,0,103.4736,a8w8_blockscale_1x128x128_256x64x64x128_16x16_32x32_8x32x1_8x32x1_1x32x1x8_8_1x1_intrawave_v3,269.8,2136.32,0.0
256,64,16384,26624,3,0,203.0101,a8w8_blockscale_1x128x128_256x64x64x128_16x16_32x32_8x32x1_8x32x1_1x32x1x8_8_1x1_intrawave_v3,275.03,2167.42,0.0
256,64,26624,16384,2,0,200.5333,a8w8_blockscale_1x128x128_256x64x128x128_16x16_32x32_8x32x1_8x32x1_1x32x1x8_8_1x1_intrawave_v3,278.43,2197.46,0.0
256,64,51200,5120,2,0,112.2017,a8w8_blockscale_1x128x128_256x64x128x128_16x16_32x32_8x32x1_8x32x1_1x32x1x8_8_1x1_intrawave_v3,299.05,2397.69,0.0
256,64,53248,16384,2,0,359.5623,a8w8_blockscale_1x128x128_256x64x128x128_16x16_32x32_8x32x1_8x32x1_1x32x1x8_8_1x1_intrawave_v3,310.57,2448.2,0.0
256,64,57344,8192,2,0,106.5436,a8w8_blockscale_1x128x128_256x64x128x128_16x16_32x32_8x32x1_8x32x1_1x32x1x8_8_1x1_intrawave_v3,564.37,4482.92,0.0
256,128,100,5120,8,0,21.4894,a8w8_blockscale_1x128x128_256x16x64x256_16x16_16x16_16x16x1_16x16x1_1x16x1x16_4_1x1_intrawave_v1,6.1,55.51,0.0
256,128,200,5120,8,0,21.3961,a8w8_blockscale_1x128x128_256x16x64x256_16x16_16x16_16x16x1_16x16x1_1x16x1x16_4_1x1_intrawave_v1,12.25,80.88,0.0
256,128,512,7168,8,0,19.0891,a8w8_blockscale_1x128x128_256x16x64x256_16x16_16x16_16x16x1_16x16x1_1x16x1x16_4_1x1_intrawave_v1,49.22,247.19,0.0
256,128,576,7168,8,0,19.3303,a8w8_blockscale_1x128x128_256x16x64x256_16x16_16x16_16x16x1_16x16x1_1x16x1x16_4_1x1_intrawave_v1,54.68,268.68,0.0
256,128,800,5120,8,0,24.7395,a8w8_blockscale_1x128x128_256x16x64x256_16x16_16x16_16x16x1_16x16x1_1x16x1x16_4_1x1_intrawave_v1,42.38,200.33,0.0
256,128,1280,8192,8,0,21.6838,a8w8_blockscale_1x128x128_256x16x64x256_16x16_16x16_16x16x1_16x16x1_1x16x1x16_4_1x1_intrawave_v1,123.8,547.05,0.0
256,128,1536,7168,8,0,20.1019,a8w8_blockscale_1x128x128_256x16x64x256_16x16_16x16_16x16x1_16x16x1_1x16x1x16_4_1x1_intrawave_v1,140.21,612.92,0.0
256,128,2304,16384,8,0,83.6532,a8w8_blockscale_1x128x128_256x16x64x256_16x16_16x16_16x16x1_16x16x1_1x16x1x16_4_1x1_intrawave_v1,115.52,483.37,0.0
256,128,2560,8192,7,0,24.6373,a8w8_blockscale_1x128x128_256x16x128x256_16x16_16x16_16x16x1_16x16x1_1x16x1x16_8_1x2_intrawave_v1,217.91,920.37,0.0
256,128,3072,1536,7,0,7.8296,a8w8_blockscale_1x128x128_256x16x128x256_16x16_16x16_16x16x1_16x16x1_1x16x1x16_8_1x2_intrawave_v1,154.28,728.21,0.0
256,128,4096,512,8,0,4.3587,a8w8_blockscale_1x128x128_256x16x64x256_16x16_16x16_16x16x1_16x16x1_1x16x1x16_4_1x1_intrawave_v1,123.17,736.75,0.0
256,128,4608,7168,18,0,24.7832,a8w8_blockscale_1x128x128_256x64x64x256_16x16_32x32_16x16x1_16x16x1_1x32x1x8_8_1x1_intrawave_v1,341.19,1417.38,0.0
256,128,4608,16384,8,0,114.253,a8w8_blockscale_1x128x128_256x16x64x256_16x16_16x16_16x16x1_16x16x1_1x16x1x16_4_1x1_intrawave_v1,169.16,689.47,0.0
256,128,5120,640,3,0,7.825,a8w8_blockscale_1x128x128_256x64x64x128_16x16_32x32_8x32x1_8x32x1_1x32x1x8_8_1x1_intrawave_v3,107.2,596.73,0.0
256,128,5120,1280,8,0,11.0552,a8w8_blockscale_1x128x128_256x16x64x256_16x16_16x16_16x16x1_16x16x1_1x16x1x16_4_1x1_intrawave_v1,151.76,726.19,0.0
256,128,5120,3200,3,0,24.8519,a8w8_blockscale_1x128x128_256x64x64x128_16x16_32x32_8x32x1_8x32x1_1x32x1x8_8_1x1_intrawave_v3,168.77,728.49,0.0
256,128,5120,5120,8,0,38.6334,a8w8_blockscale_1x128x128_256x16x64x256_16x16_16x16_16x16x1_16x16x1_1x16x1x16_4_1x1_intrawave_v1,173.71,729.43,0.0
256,128,5120,6400,8,0,45.7789,a8w8_blockscale_1x128x128_256x16x64x256_16x16_16x16_16x16x1_16x16x1_1x16x1x16_4_1x1_intrawave_v1,183.24,762.31,0.0
256,128,5120,25600,8,0,174.3467,a8w8_blockscale_1x128x128_256x16x64x256_16x16_16x16_16x16x1_16x16x1_1x16x1x16_4_1x1_intrawave_v1,192.46,778.1,0.0
256,128,6400,5120,3,0,41.0637,a8w8_blockscale_1x128x128_256x64x64x128_16x16_32x32_8x32x1_8x32x1_1x32x1x8_8_1x1_intrawave_v3,204.28,853.84,0.0
256,128,7168,256,7,0,3.9827,a8w8_blockscale_1x128x128_256x16x128x256_16x16_16x16_16x16x1_16x16x1_1x16x1x16_8_1x2_intrawave_v1,117.95,929.72,0.0
256,128,7168,2048,18,0,10.1248,a8w8_blockscale_1x128x128_256x64x64x256_16x16_32x32_16x16x1_16x16x1_1x32x1x8_8_1x1_intrawave_v1,371.18,1657.04,0.0
256,128,7168,2304,18,0,11.0009,a8w8_blockscale_1x128x128_256x64x64x256_16x16_32x32_16x16x1_16x16x1_1x32x1x8_8_1x1_intrawave_v1,384.32,1694.86,0.0
256,128,7168,8192,18,0,27.4045,a8w8_blockscale_1x128x128_256x64x64x256_16x16_32x32_16x16x1_16x16x1_1x32x1x8_8_1x1_intrawave_v1,548.54,2247.95,0.0
256,128,8192,1024,18,0,7.1878,a8w8_blockscale_1x128x128_256x64x64x256_16x16_32x32_16x16x1_16x16x1_1x32x1x8_8_1x1_intrawave_v1,298.77,1477.06,0.0
256,128,8192,2048,18,0,9.8229,a8w8_blockscale_1x128x128_256x64x64x256_16x16_32x32_16x16x1_16x16x1_1x32x1x8_8_1x1_intrawave_v1,437.24,1948.15,0.0
256,128,8192,3584,18,0,13.8161,a8w8_blockscale_1x128x128_256x64x64x256_16x16_32x32_16x16x1_16x16x1_1x32x1x8_8_1x1_intrawave_v1,544.02,2310.06,0.0
256,128,8192,7168,18,0,24.4428,a8w8_blockscale_1x128x128_256x64x64x256_16x16_32x32_16x16x1_16x16x1_1x32x1x8_8_1x1_intrawave_v1,615.0,2525.69,0.0
256,128,8192,8192,18,0,27.847,a8w8_blockscale_1x128x128_256x64x64x256_16x16_32x32_16x16x1_16x16x1_1x32x1x8_8_1x1_intrawave_v1,616.94,2522.88,0.0
256,128,8192,28672,18,0,91.9528,a8w8_blockscale_1x128x128_256x64x64x256_16x16_32x32_16x16x1_16x16x1_1x32x1x8_8_1x1_intrawave_v1,653.92,2617.08,0.0
256,128,9216,16384,2,0,170.0953,a8w8_blockscale_1x128x128_256x64x128x128_16x16_32x32_8x32x1_8x32x1_1x32x1x8_8_1x1_intrawave_v3,227.25,913.91,0.0
256,128,10240,8192,18,0,44.2706,a8w8_blockscale_1x128x128_256x64x64x256_16x16_32x32_16x16x1_16x16x1_1x32x1x8_8_1x1_intrawave_v1,485.08,1977.75,0.0
256,128,12800,5120,2,0,56.6862,a8w8_blockscale_1x128x128_256x64x128x128_16x16_32x32_8x32x1_8x32x1_1x32x1x8_8_1x1_intrawave_v3,295.97,1225.49,0.0
256,128,13312,16384,2,0,173.0875,a8w8_blockscale_1x128x128_256x64x128x128_16x16_32x32_8x32x1_8x32x1_1x32x1x8_8_1x1_intrawave_v3,322.58,1291.88,0.0
256,128,14336,8192,18,0,47.1874,a8w8_blockscale_1x128x128_256x64x64x256_16x16_32x32_16x16x1_16x16x1_1x32x1x8_8_1x1_intrawave_v1,637.14,2588.81,0.0
256,128,16384,2048,2,0,26.8383,a8w8_blockscale_1x128x128_256x64x128x128_16x16_32x32_8x32x1_8x32x1_1x32x1x8_8_1x1_intrawave_v3,320.06,1416.29,0.0
256,128,16384,4096,2,0,47.0259,a8w8_blockscale_1x128x128_256x64x128x128_16x16_32x32_8x32x1_8x32x1_1x32x1x8_8_1x1_intrawave_v3,365.33,1527.4,0.0
256,128,16384,6656,2,0,70.6311,a8w8_blockscale_1x128x128_256x64x128x128_16x16_32x32_8x32x1_8x32x1_1x32x1x8_8_1x1_intrawave_v3,395.25,1615.41,0.0
256,128,16384,8192,2,0,87.5234,a8w8_blockscale_1x128x128_256x64x128x128_16x16_32x32_8x32x1_8x32x1_1x32x1x8_8_1x1_intrawave_v3,392.58,1593.41,0.0
256,128,16384,13312,2,0,136.0439,a8w8_blockscale_1x128x128_256x64x128x128_16x16_32x32_8x32x1_8x32x1_1x32x1x8_8_1x1_intrawave_v3,410.42,1646.54,0.0
256,128,16384,26624,2,0,263.2419,a8w8_blockscale_1x128x128_256x64x128x128_16x16_32x32_8x32x1_8x32x1_1x32x1x8_8_1x1_intrawave_v3,424.21,1685.94,0.0
256,128,26624,16384,2,0,287.2185,a8w8_blockscale_1x128x128_256x64x128x128_16x16_32x32_8x32x1_8x32x1_1x32x1x8_8_1x1_intrawave_v3,388.8,1549.76,0.0
256,128,51200,5120,2,0,175.747,a8w8_blockscale_1x128x128_256x64x128x128_16x16_32x32_8x32x1_8x32x1_1x32x1x8_8_1x1_intrawave_v3,381.85,1569.91,0.0
256,128,53248,16384,2,0,553.4942,a8w8_blockscale_1x128x128_256x64x128x128_16x16_32x32_8x32x1_8x32x1_1x32x1x8_8_1x1_intrawave_v3,403.51,1604.61,0.0
256,128,57344,8192,0,0,130.9154,a8w8_blockscale_1x128x128_256x128x128x128_16x16_32x32_8x32x1_8x32x1_1x32x1x8_8_1x1_intrawave_v3,918.6,3708.43,0.0
256,256,100,5120,8,0,21.3834,a8w8_blockscale_1x128x128_256x16x64x256_16x16_16x16_16x16x1_16x16x1_1x16x1x16_4_1x1_intrawave_v1,12.26,87.63,0.0
256,256,200,5120,8,0,22.2314,a8w8_blockscale_1x128x128_256x16x64x256_16x16_16x16_16x16x1_16x16x1_1x16x1x16_4_1x1_intrawave_v1,23.58,109.63,0.0
256,256,512,7168,8,0,19.4919,a8w8_blockscale_1x128x128_256x16x64x256_16x16_16x16_16x16x1_16x16x1_1x16x1x16_4_1x1_intrawave_v1,96.4,295.88,0.0
256,256,576,7168,8,0,19.6847,a8w8_blockscale_1x128x128_256x16x64x256_16x16_16x16_16x16x1_16x16x1_1x16x1x16_4_1x1_intrawave_v1,107.39,317.95,0.0
256,256,800,5120,8,0,24.7957,a8w8_blockscale_1x128x128_256x16x64x256_16x16_16x16_16x16x1_16x16x1_1x16x1x16_4_1x1_intrawave_v1,84.58,234.57,0.0
256,256,1280,8192,7,0,25.0054,a8w8_blockscale_1x128x128_256x16x128x256_16x16_16x16_16x16x1_16x16x1_1x16x1x16_8_1x2_intrawave_v1,214.7,529.42,0.0
256,256,1536,7168,7,0,23.4904,a8w8_blockscale_1x128x128_256x16x128x256_16x16_16x16_16x16x1_16x16x1_1x16x1x16_8_1x2_intrawave_v1,239.98,580.3,0.0
256,256,2304,16384,8,0,113.4368,a8w8_blockscale_1x128x128_256x16x64x256_16x16_16x16_16x16x1_16x16x1_1x16x1x16_4_1x1_intrawave_v1,170.38,380.15,0.0
256,256,2560,8192,18,0,25.4684,a8w8_blockscale_1x128x128_256x64x64x256_16x16_32x32_16x16x1_16x16x1_1x32x1x8_8_1x1_intrawave_v1,421.6,957.24,0.0
256,256,3072,1536,12,0,8.9712,a8w8_blockscale_1x128x128_256x32x128x256_16x16_32x32_16x16x1_16x16x1_1x32x1x8_8_1x1_intrawave_v1,269.3,745.13,0.0
256,256,4096,512,13,0,5.096,a8w8_blockscale_1x128x128_256x32x64x256_16x16_16x16_16x16x1_16x16x1_1x32x1x8_8_2x1_intrawave_v1,210.7,848.78,0.0
256,256,4608,7168,18,0,36.4007,a8w8_blockscale_1x128x128_256x64x64x256_16x16_32x32_16x16x1_16x16x1_1x32x1x8_8_1x1_intrawave_v1,464.59,1022.63,0.0
256,256,4608,16384,2,0,162.736,a8w8_blockscale_1x128x128_256x64x128x128_16x16_32x32_8x32x1_8x32x1_1x32x1x8_8_1x1_intrawave_v3,237.53,504.2,0.0
256,256,5120,640,15,0,10.3325,a8w8_blockscale_1x128x128_256x64x128x128_16x16_32x32_8x32x1_8x32x1_1x32x1x8_8_1x1_intrawave_v1,162.37,586.7,0.0
256,256,5120,1280,11,0,17.1324,a8w8_blockscale_1x128x128_256x32x64x128_16x16_16x16_8x32x1_8x32x1_1x32x1x8_8_2x1_intrawave_v1,195.85,554.66,0.0
256,256,5120,3200,15,0,33.7649,a8w8_blockscale_1x128x128_256x64x128x128_16x16_32x32_8x32x1_8x32x1_1x32x1x8_8_1x1_intrawave_v1,248.44,587.14,0.0
256,256,5120,5120,2,0,55.12,a8w8_blockscale_1x128x128_256x64x128x128_16x16_32x32_8x32x1_8x32x1_1x32x1x8_8_1x1_intrawave_v3,243.5,546.93,0.0
256,256,5120,6400,2,0,63.9744,a8w8_blockscale_1x128x128_256x64x128x128_16x16_32x32_8x32x1_8x32x1_1x32x1x8_8_1x1_intrawave_v3,262.25,578.79,0.0
256,256,5120,25600,2,0,248.4276,a8w8_blockscale_1x128x128_256x64x128x128_16x16_32x32_8x32x1_8x32x1_1x32x1x8_8_1x1_intrawave_v3,270.13,564.54,0.0
256,256,6400,5120,2,0,55.9002,a8w8_blockscale_1x128x128_256x64x128x128_16x16_32x32_8x32x1_8x32x1_1x32x1x8_8_1x1_intrawave_v3,300.13,668.25,0.0
256,256,7168,256,18,0,5.6643,a8w8_blockscale_1x128x128_256x64x64x256_16x16_32x32_16x16x1_16x16x1_1x32x1x8_8_1x1_intrawave_v1,165.87,983.45,0.0
256,256,7168,2048,18,0,14.8749,a8w8_blockscale_1x128x128_256x64x64x256_16x16_32x32_16x16x1_16x16x1_1x32x1x8_8_1x1_intrawave_v1,505.29,1268.87,0.0
256,256,7168,2304,18,0,15.9582,a8w8_blockscale_1x128x128_256x64x64x256_16x16_32x32_16x16x1_16x16x1_1x32x1x8_8_1x1_intrawave_v1,529.87,1301.83,0.0
256,256,7168,8192,18,0,42.4071,a8w8_blockscale_1x128x128_256x64x64x256_16x16_32x32_16x16x1_16x16x1_1x32x1x8_8_1x1_intrawave_v1,708.96,1520.68,0.0
256,256,8192,1024,18,0,9.7812,a8w8_blockscale_1x128x128_256x64x64x256_16x16_32x32_16x16x1_16x16x1_1x32x1x8_8_1x1_intrawave_v1,439.1,1313.24,0.0
256,256,8192,2048,18,0,13.445,a8w8_blockscale_1x128x128_256x64x64x256_16x16_32x32_16x16x1_16x16x1_1x32x1x8_8_1x1_intrawave_v1,638.89,1598.8,0.0
256,256,8192,3584,18,0,21.1007,a8w8_blockscale_1x128x128_256x64x64x256_16x16_32x32_16x16x1_16x16x1_1x32x1x8_8_1x1_intrawave_v1,712.41,1633.69,0.0
256,256,8192,7168,18,0,37.9087,a8w8_blockscale_1x128x128_256x64x64x256_16x16_32x32_16x16x1_16x16x1_1x32x1x8_8_1x1_intrawave_v1,793.08,1708.04,0.0
256,256,8192,8192,18,0,43.9693,a8w8_blockscale_1x128x128_256x64x64x256_16x16_32x32_16x16x1_16x16x1_1x32x1x8_8_1x1_intrawave_v1,781.45,1669.35,0.0
256,256,8192,28672,18,0,141.1654,a8w8_blockscale_1x128x128_256x64x64x256_16x16_32x32_16x16x1_16x16x1_1x32x1x8_8_1x1_intrawave_v1,851.9,1745.58,0.0
256,256,9216,16384,3,0,265.5334,a8w8_blockscale_1x128x128_256x64x64x128_16x16_32x32_8x32x1_8x32x1_1x32x1x8_8_1x1_intrawave_v3,291.15,602.21,0.0
256,256,10240,8192,18,0,59.4072,a8w8_blockscale_1x128x128_256x64x64x256_16x16_32x32_16x16x1_16x16x1_1x32x1x8_8_1x1_intrawave_v1,722.97,1535.61,0.0
256,256,12800,5120,2,0,88.329,a8w8_blockscale_1x128x128_256x64x128x128_16x16_32x32_8x32x1_8x32x1_1x32x1x8_8_1x1_intrawave_v3,379.88,830.99,0.0
256,256,13312,16384,2,0,267.7684,a8w8_blockscale_1x128x128_256x64x128x128_16x16_32x32_8x32x1_8x32x1_1x32x1x8_8_1x1_intrawave_v3,417.04,855.64,0.0
256,256,14336,8192,0,0,63.0915,a8w8_blockscale_1x128x128_256x128x128x128_16x16_32x32_8x32x1_8x32x1_1x32x1x8_8_1x1_intrawave_v3,953.05,2011.01,0.0
256,256,16384,2048,2,0,42.7868,a8w8_blockscale_1x128x128_256x64x128x128_16x16_32x32_8x32x1_8x32x1_1x32x1x8_8_1x1_intrawave_v3,401.52,992.53,0.0
256,256,16384,4096,2,0,76.8915,a8w8_blockscale_1x128x128_256x64x128x128_16x16_32x32_8x32x1_8x32x1_1x32x1x8_8_1x1_intrawave_v3,446.86,995.51,0.0
256,256,16384,6656,2,0,114.9487,a8w8_blockscale_1x128x128_256x64x128x128_16x16_32x32_8x32x1_8x32x1_1x32x1x8_8_1x1_intrawave_v3,485.73,1036.5,0.0
256,256,16384,8192,2,0,143.0835,a8w8_blockscale_1x128x128_256x64x128x128_16x16_32x32_8x32x1_8x32x1_1x32x1x8_8_1x1_intrawave_v3,480.28,1011.32,0.0
256,256,16384,13312,2,0,219.0848,a8w8_blockscale_1x128x128_256x64x128x128_16x16_32x32_8x32x1_8x32x1_1x32x1x8_8_1x1_intrawave_v3,509.71,1049.37,0.0
256,256,16384,26624,2,0,429.0916,a8w8_blockscale_1x128x128_256x64x128x128_16x16_32x32_8x32x1_8x32x1_1x32x1x8_8_1x1_intrawave_v3,520.49,1052.02,0.0
256,256,26624,16384,2,0,511.6655,a8w8_blockscale_1x128x128_256x64x128x128_16x16_32x32_8x32x1_8x32x1_1x32x1x8_8_1x1_intrawave_v3,436.49,887.36,0.0
256,256,51200,5120,2,0,280.5719,a8w8_blockscale_1x128x128_256x64x128x128_16x16_32x32_8x32x1_8x32x1_1x32x1x8_8_1x1_intrawave_v3,478.37,1032.42,0.0
256,256,53248,16384,2,0,871.2213,a8w8_blockscale_1x128x128_256x64x128x128_16x16_32x32_8x32x1_8x32x1_1x32x1x8_8_1x1_intrawave_v3,512.7,1037.48,0.0
256,256,57344,8192,0,0,211.2697,a8w8_blockscale_1x128x128_256x128x128x128_16x16_32x32_8x32x1_8x32x1_1x32x1x8_8_1x1_intrawave_v3,1138.44,2372.41,0.0
256,512,100,5120,8,0,22.856,a8w8_blockscale_1x128x128_256x16x64x256_16x16_16x16_16x16x1_16x16x1_1x16x1x16_4_1x1_intrawave_v1,22.94,141.58,0.0
256,512,200,5120,8,0,23.748,a8w8_blockscale_1x128x128_256x16x64x256_16x16_16x16_16x16x1_16x16x1_1x16x1x16_4_1x1_intrawave_v1,44.15,162.13,0.0
256,512,512,7168,8,0,20.1543,a8w8_blockscale_1x128x128_256x16x64x256_16x16_16x16_16x16x1_16x16x1_1x16x1x16_4_1x1_intrawave_v1,186.47,390.21,0.0
256,512,576,7168,18,0,23.3536,a8w8_blockscale_1x128x128_256x64x64x256_16x16_32x32_16x16x1_16x16x1_1x32x1x8_8_1x1_intrawave_v1,181.04,359.2,0.0
256,512,800,5120,8,0,31.1327,a8w8_blockscale_1x128x128_256x16x64x256_16x16_16x16_16x16x1_16x16x1_1x16x1x16_4_1x1_intrawave_v1,134.72,242.08,0.0
256,512,1280,8192,18,0,24.7188,a8w8_blockscale_1x128x128_256x64x64x256_16x16_32x32_16x16x1_16x16x1_1x32x1x8_8_1x1_intrawave_v1,434.38,646.91,0.0
256,512,1536,7168,18,0,24.5324,a8w8_blockscale_1x128x128_256x64x64x256_16x16_32x32_16x16x1_16x16x1_1x32x1x8_8_1x1_intrawave_v1,459.57,662.51,0.0
256,512,2304,16384,2,0,160.372,a8w8_blockscale_1x128x128_256x64x128x128_16x16_32x32_8x32x1_8x32x1_1x32x1x8_8_1x1_intrawave_v3,241.03,302.4,0.0
256,512,2560,8192,18,0,38.4771,a8w8_blockscale_1x128x128_256x64x64x256_16x16_32x32_16x16x1_16x16x1_1x32x1x8_8_1x1_intrawave_v1,558.12,722.18,0.0
256,512,3072,1536,18,0,11.8645,a8w8_blockscale_1x128x128_256x64x64x256_16x16_32x32_16x16x1_16x16x1_1x32x1x8_8_1x1_intrawave_v1,407.25,729.13,0.0
256,512,4096,512,3,0,8.2148,a8w8_blockscale_1x128x128_256x64x64x128_16x16_32x32_8x32x1_8x32x1_1x32x1x8_8_1x1_intrawave_v3,261.42,797.78,0.0
256,512,4608,7168,18,0,58.822,a8w8_blockscale_1x128x128_256x64x64x256_16x16_32x32_16x16x1_16x16x1_1x32x1x8_8_1x1_intrawave_v1,575.0,704.14,0.0
256,512,4608,16384,2,0,259.0482,a8w8_blockscale_1x128x128_256x64x128x128_16x16_32x32_8x32x1_8x32x1_1x32x1x8_8_1x1_intrawave_v3,298.44,342.04,0.0
256,512,5120,640,16,0,13.5819,a8w8_blockscale_1x128x128_256x64x64x128_16x16_32x32_8x32x1_8x32x1_1x32x1x8_8_1x1_intrawave_v1,247.05,651.41,0.0
256,512,5120,1280,16,0,23.49,a8w8_blockscale_1x128x128_256x64x64x128_16x16_32x32_8x32x1_8x32x1_1x32x1x8_8_1x1_intrawave_v1,285.69,530.09,0.0
256,512,5120,3200,16,0,50.3003,a8w8_blockscale_1x128x128_256x64x64x128_16x16_32x32_8x32x1_8x32x1_1x32x1x8_8_1x1_intrawave_v1,333.54,462.53,0.0
256,512,5120,5120,16,0,81.6994,a8w8_blockscale_1x128x128_256x64x64x128_16x16_32x32_8x32x1_8x32x1_1x32x1x8_8_1x1_intrawave_v1,328.56,417.12,0.0
256,512,5120,6400,16,0,95.3073,a8w8_blockscale_1x128x128_256x64x64x128_16x16_32x32_8x32x1_8x32x1_1x32x1x8_8_1x1_intrawave_v1,352.07,433.21,0.0
256,512,5120,25600,16,0,393.0973,a8w8_blockscale_1x128x128_256x64x64x128_16x16_32x32_8x32x1_8x32x1_1x32x1x8_8_1x1_intrawave_v1,341.44,380.11,0.0
256,512,6400,5120,2,0,87.2911,a8w8_blockscale_1x128x128_256x64x128x128_16x16_32x32_8x32x1_8x32x1_1x32x1x8_8_1x1_intrawave_v3,384.4,480.5,0.0
256,512,7168,256,13,0,8.214,a8w8_blockscale_1x128x128_256x32x64x256_16x16_16x16_16x16x1_16x16x1_1x32x1x8_8_2x1_intrawave_v1,228.76,1132.96,0.0
256,512,7168,2048,18,0,25.7748,a8w8_blockscale_1x128x128_256x64x64x256_16x16_32x32_16x16x1_16x16x1_1x32x1x8_8_1x1_intrawave_v1,583.22,895.01,0.0
256,512,7168,2304,18,0,28.4393,a8w8_blockscale_1x128x128_256x64x64x256_16x16_32x32_16x16x1_16x16x1_1x32x1x8_8_1x1_intrawave_v1,594.65,880.29,0.0
256,512,7168,8192,0,0,58.7208,a8w8_blockscale_1x128x128_256x128x128x128_16x16_32x32_8x32x1_8x32x1_1x32x1x8_8_1x1_intrawave_v3,1023.99,1196.42,0.0
256,512,8192,1024,0,0,13.3266,a8w8_blockscale_1x128x128_256x128x128x128_16x16_32x32_8x32x1_8x32x1_1x32x1x8_8_1x1_intrawave_v3,644.57,1298.27,0.0
256,512,8192,2048,0,0,19.9322,a8w8_blockscale_1x128x128_256x128x128x128_16x16_32x32_8x32x1_8x32x1_1x32x1x8_8_1x1_intrawave_v3,861.92,1315.18,0.0
256,512,8192,3584,0,0,29.6451,a8w8_blockscale_1x128x128_256x128x128x128_16x16_32x32_8x32x1_8x32x1_1x32x1x8_8_1x1_intrawave_v3,1014.16,1335.25,0.0
256,512,8192,7168,0,0,55.2843,a8w8_blockscale_1x128x128_256x128x128x128_16x16_32x32_8x32x1_8x32x1_1x32x1x8_8_1x1_intrawave_v3,1087.64,1280.27,0.0
256,512,8192,8192,0,0,60.5112,a8w8_blockscale_1x128x128_256x128x128x128_16x16_32x32_8x32x1_8x32x1_1x32x1x8_8_1x1_intrawave_v3,1135.65,1316.98,0.0
256,512,8192,28672,0,0,194.8237,a8w8_blockscale_1x128x128_256x128x128x128_16x16_32x32_8x32x1_8x32x1_1x32x1x8_8_1x1_intrawave_v3,1234.54,1324.02,0.0
256,512,9216,16384,2,0,382.4099,a8w8_blockscale_1x128x128_256x64x128x128_16x16_32x32_8x32x1_8x32x1_1x32x1x8_8_1x1_intrawave_v3,404.33,441.47,0.0
256,512,10240,8192,2,0,91.3121,a8w8_blockscale_1x128x128_256x64x128x128_16x16_32x32_8x32x1_8x32x1_1x32x1x8_8_1x1_intrawave_v3,940.72,1079.44,0.0
256,512,12800,5120,2,0,163.752,a8w8_blockscale_1x128x128_256x64x128x128_16x16_32x32_8x32x1_8x32x1_1x32x1x8_8_1x1_intrawave_v3,409.82,496.27,0.0
256,512,13312,16384,2,0,488.7956,a8w8_blockscale_1x128x128_256x64x128x128_16x16_32x32_8x32x1_8x32x1_1x32x1x8_8_1x1_intrawave_v3,456.92,491.26,0.0
256,512,14336,8192,0,0,104.0816,a8w8_blockscale_1x128x128_256x128x128x128_16x16_32x32_8x32x1_8x32x1_1x32x1x8_8_1x1_intrawave_v3,1155.43,1309.69,0.0
256,512,16384,2048,2,0,75.7869,a8w8_blockscale_1x128x128_256x64x128x128_16x16_32x32_8x32x1_8x32x1_1x32x1x8_8_1x1_intrawave_v3,453.37,677.96,0.0
256,512,16384,4096,2,0,137.2325,a8w8_blockscale_1x128x128_256x64x128x128_16x16_32x32_8x32x1_8x32x1_1x32x1x8_8_1x1_intrawave_v3,500.75,626.55,0.0
256,512,16384,6656,2,0,208.4561,a8w8_blockscale_1x128x128_256x64x128x128_16x16_32x32_8x32x1_8x32x1_1x32x1x8_8_1x1_intrawave_v3,535.7,619.97,0.0
256,512,16384,8192,2,0,258.1492,a8w8_blockscale_1x128x128_256x64x128x128_16x16_32x32_8x32x1_8x32x1_1x32x1x8_8_1x1_intrawave_v3,532.4,601.16,0.0
256,512,16384,13312,2,0,403.9264,a8w8_blockscale_1x128x128_256x64x128x128_16x16_32x32_8x32x1_8x32x1_1x32x1x8_8_1x1_intrawave_v3,552.92,598.37,0.0
256,512,16384,26624,2,0,797.4435,a8w8_blockscale_1x128x128_256x64x128x128_16x16_32x32_8x32x1_8x32x1_1x32x1x8_8_1x1_intrawave_v3,560.14,585.14,0.0
256,512,26624,16384,2,0,830.0664,a8w8_blockscale_1x128x128_256x64x128x128_16x16_32x32_8x32x1_8x32x1_1x32x1x8_8_1x1_intrawave_v3,538.12,568.46,0.0
256,512,51200,5120,2,0,493.7976,a8w8_blockscale_1x128x128_256x64x128x128_16x16_32x32_8x32x1_8x32x1_1x32x1x8_8_1x1_intrawave_v3,543.61,642.36,0.0
256,512,53248,16384,2,0,1515.567,a8w8_blockscale_1x128x128_256x64x128x128_16x16_32x32_8x32x1_8x32x1_1x32x1x8_8_1x1_intrawave_v3,589.45,617.15,0.0
256,512,57344,8192,0,0,349.1385,a8w8_blockscale_1x128x128_256x128x128x128_16x16_32x32_8x32x1_8x32x1_1x32x1x8_8_1x1_intrawave_v3,1377.78,1525.69,0.0
256,1024,100,5120,8,0,23.5129,a8w8_blockscale_1x128x128_256x16x64x256_16x16_16x16_16x16x1_16x16x1_1x16x1x16_4_1x1_intrawave_v1,44.6,253.46,0.0
256,1024,200,5120,8,0,23.9853,a8w8_blockscale_1x128x128_256x16x64x256_16x16_16x16_16x16x1_16x16x1_1x16x1x16_4_1x1_intrawave_v1,87.43,278.36,0.0
256,1024,512,7168,7,0,23.5068,a8w8_blockscale_1x128x128_256x16x128x256_16x16_16x16_16x16x1_16x16x1_1x16x1x16_8_1x2_intrawave_v1,319.75,512.98,0.0
256,1024,576,7168,18,0,23.9404,a8w8_blockscale_1x128x128_256x64x64x256_16x16_32x32_16x16x1_16x16x1_1x32x1x8_8_1x1_intrawave_v1,353.2,528.33,0.0
256,1024,800,5120,13,0,44.1947,a8w8_blockscale_1x128x128_256x32x64x256_16x16_16x16_16x16x1_16x16x1_1x32x1x8_8_2x1_intrawave_v1,189.81,248.38,0.0
256,1024,1280,8192,18,0,38.1989,a8w8_blockscale_1x128x128_256x64x64x256_16x16_32x32_16x16x1_16x16x1_1x32x1x8_8_1x1_intrawave_v1,562.18,562.73,0.0
256,1024,1536,7168,18,0,36.4647,a8w8_blockscale_1x128x128_256x64x64x256_16x16_32x32_16x16x1_16x16x1_1x32x1x8_8_1x1_intrawave_v1,618.37,589.5,0.0
256,1024,2304,16384,2,0,252.8342,a8w8_blockscale_1x128x128_256x64x128x128_16x16_32x32_8x32x1_8x32x1_1x32x1x8_8_1x1_intrawave_v3,305.77,234.32,0.0
256,1024,2560,8192,18,0,55.7473,a8w8_blockscale_1x128x128_256x64x64x256_16x16_32x32_16x16x1_16x16x1_1x32x1x8_8_1x1_intrawave_v1,770.44,620.71,0.0
256,1024,3072,1536,18,0,17.5794,a8w8_blockscale_1x128x128_256x64x64x256_16x16_32x32_16x16x1_16x16x1_1x32x1x8_8_1x1_intrawave_v1,549.72,715.78,0.0
256,1024,4096,512,18,0,11.0785,a8w8_blockscale_1x128x128_256x64x64x256_16x16_32x32_16x16x1_16x16x1_1x32x1x8_8_1x1_intrawave_v1,387.68,993.82,0.0
256,1024,4608,7168,18,0,99.4691,a8w8_blockscale_1x128x128_256x64x64x256_16x16_32x32_16x16x1_16x16x1_1x32x1x8_8_1x1_intrawave_v1,680.07,500.73,0.0
256,1024,4608,16384,2,0,375.0407,a8w8_blockscale_1x128x128_256x64x128x128_16x16_32x32_8x32x1_8x32x1_1x32x1x8_8_1x1_intrawave_v3,412.27,271.2,0.0
256,1024,5120,640,16,0,20.858,a8w8_blockscale_1x128x128_256x64x64x128_16x16_32x32_8x32x1_8x32x1_1x32x1x8_8_1x1_intrawave_v1,321.74,691.24,0.0
256,1024,5120,1280,16,0,36.2504,a8w8_blockscale_1x128x128_256x64x64x128_16x16_32x32_8x32x1_8x32x1_1x32x1x8_8_1x1_intrawave_v1,370.25,506.2,0.0
256,1024,5120,3200,15,0,77.3328,a8w8_blockscale_1x128x128_256x64x128x128_16x16_32x32_8x32x1_8x32x1_1x32x1x8_8_1x1_intrawave_v1,433.9,389.83,0.0
256,1024,5120,5120,2,0,126.0599,a8w8_blockscale_1x128x128_256x64x128x128_16x16_32x32_8x32x1_8x32x1_1x32x1x8_8_1x1_intrawave_v3,425.89,332.72,0.0
256,1024,5120,6400,2,0,146.6741,a8w8_blockscale_1x128x128_256x64x128x128_16x16_32x32_8x32x1_8x32x1_1x32x1x8_8_1x1_intrawave_v3,457.54,339.58,0.0
256,1024,5120,25600,2,0,577.2693,a8w8_blockscale_1x128x128_256x64x128x128_16x16_32x32_8x32x1_8x32x1_1x32x1x8_8_1x1_intrawave_v3,465.01,290.63,0.0
256,1024,6400,5120,2,0,161.8853,a8w8_blockscale_1x128x128_256x64x128x128_16x16_32x32_8x32x1_8x32x1_1x32x1x8_8_1x1_intrawave_v3,414.55,315.77,0.0
256,1024,7168,256,16,0,12.6589,a8w8_blockscale_1x128x128_256x64x64x128_16x16_32x32_8x32x1_8x32x1_1x32x1x8_8_1x1_intrawave_v1,296.87,1325.33,0.0
256,1024,7168,2048,0,0,46.861,a8w8_blockscale_1x128x128_256x128x128x128_16x16_32x32_8x32x1_8x32x1_1x32x1x8_8_1x1_intrawave_v3,641.57,671.29,0.0
256,1024,7168,2304,0,0,49.965,a8w8_blockscale_1x128x128_256x128x128x128_16x16_32x32_8x32x1_8x32x1_1x32x1x8_8_1x1_intrawave_v3,676.93,671.56,0.0
256,1024,7168,8192,0,0,101.4492,a8w8_blockscale_1x128x128_256x128x128x128_16x16_32x32_8x32x1_8x32x1_1x32x1x8_8_1x1_intrawave_v3,1185.41,806.21,0.0
256,1024,8192,1024,0,0,21.7234,a8w8_blockscale_1x128x128_256x128x128x128_16x16_32x32_8x32x1_8x32x1_1x32x1x8_8_1x1_intrawave_v3,790.85,1206.74,0.0
256,1024,8192,2048,0,0,32.4622,a8w8_blockscale_1x128x128_256x128x128x128_16x16_32x32_8x32x1_8x32x1_1x32x1x8_8_1x1_intrawave_v3,1058.45,1098.25,0.0
256,1024,8192,3584,0,0,49.8102,a8w8_blockscale_1x128x128_256x128x128x128_16x16_32x32_8x32x1_8x32x1_1x32x1x8_8_1x1_intrawave_v3,1207.17,999.94,0.0
256,1024,8192,7168,0,0,96.6608,a8w8_blockscale_1x128x128_256x128x128x128_16x16_32x32_8x32x1_8x32x1_1x32x1x8_8_1x1_intrawave_v3,1244.13,856.99,0.0
256,1024,8192,8192,0,0,104.9196,a8w8_blockscale_1x128x128_256x128x128x128_16x16_32x32_8x32x1_8x32x1_1x32x1x8_8_1x1_intrawave_v3,1309.95,879.48,0.0
256,1024,8192,28672,0,0,346.9324,a8w8_blockscale_1x128x128_256x128x128x128_16x16_32x32_8x32x1_8x32x1_1x32x1x8_8_1x1_intrawave_v3,1386.54,810.01,0.0
256,1024,9216,16384,2,0,596.4194,a8w8_blockscale_1x128x128_256x64x128x128_16x16_32x32_8x32x1_8x32x1_1x32x1x8_8_1x1_intrawave_v3,518.49,312.95,0.0
256,1024,10240,8192,0,0,143.3004,a8w8_blockscale_1x128x128_256x128x128x128_16x16_32x32_8x32x1_8x32x1_1x32x1x8_8_1x1_intrawave_v3,1198.87,790.27,0.0
256,1024,12800,5120,2,0,270.1974,a8w8_blockscale_1x128x128_256x64x128x128_16x16_32x32_8x32x1_8x32x1_1x32x1x8_8_1x1_intrawave_v3,496.74,358.97,0.0
256,1024,13312,16384,2,0,814.9574,a8w8_blockscale_1x128x128_256x64x128x128_16x16_32x32_8x32x1_8x32x1_1x32x1x8_8_1x1_intrawave_v3,548.1,321.67,0.0
256,1024,14336,8192,0,0,187.2939,a8w8_blockscale_1x128x128_256x128x128x128_16x16_32x32_8x32x1_8x32x1_1x32x1x8_8_1x1_intrawave_v3,1284.18,828.59,0.0
256,1024,16384,2048,2,0,138.6722,a8w8_blockscale_1x128x128_256x64x128x128_16x16_32x32_8x32x1_8x32x1_1x32x1x8_8_1x1_intrawave_v3,495.55,499.06,0.0
256,1024,16384,4096,2,0,254.119,a8w8_blockscale_1x128x128_256x64x128x128_16x16_32x32_8x32x1_8x32x1_1x32x1x8_8_1x1_intrawave_v3,540.84,412.63,0.0
256,1024,16384,6656,2,0,392.1357,a8w8_blockscale_1x128x128_256x64x128x128_16x16_32x32_8x32x1_8x32x1_1x32x1x8_8_1x1_intrawave_v3,569.54,381.05,0.0
256,1024,16384,8192,2,0,482.6855,a8w8_blockscale_1x128x128_256x64x128x128_16x16_32x32_8x32x1_8x32x1_1x32x1x8_8_1x1_intrawave_v3,569.48,364.96,0.0
256,1024,16384,13312,2,0,765.738,a8w8_blockscale_1x128x128_256x64x128x128_16x16_32x32_8x32x1_8x32x1_1x32x1x8_8_1x1_intrawave_v3,583.33,346.45,0.0
256,1024,16384,26624,2,0,1506.4402,a8w8_blockscale_1x128x128_256x64x128x128_16x16_32x32_8x32x1_8x32x1_1x32x1x8_8_1x1_intrawave_v3,593.02,329.93,0.0
256,1024,26624,16384,2,0,1486.4757,a8w8_blockscale_1x128x128_256x64x128x128_16x16_32x32_8x32x1_8x32x1_1x32x1x8_8_1x1_intrawave_v3,600.99,341.42,0.0
256,1024,51200,5120,2,0,930.5477,a8w8_blockscale_1x128x128_256x64x128x128_16x16_32x32_8x32x1_8x32x1_1x32x1x8_8_1x1_intrawave_v3,576.94,400.03,0.0
256,1024,53248,16384,2,0,2928.9446,a8w8_blockscale_1x128x128_256x64x128x128_16x16_32x32_8x32x1_8x32x1_1x32x1x8_8_1x1_intrawave_v3,610.02,340.82,0.0
256,1024,57344,8192,0,0,653.3808,a8w8_blockscale_1x128x128_256x128x128x128_16x16_32x32_8x32x1_8x32x1_1x32x1x8_8_1x1_intrawave_v3,1472.45,911.55,0.0
256,1536,512,7168,18,0,24.7692,a8w8_blockscale_1x128x128_256x64x64x256_16x16_32x32_16x16x1_16x16x1_1x32x1x8_8_1x1_intrawave_v1,455.17,656.17,0.0
256,1536,576,7168,18,0,25.1476,a8w8_blockscale_1x128x128_256x64x64x256_16x16_32x32_16x16x1_16x16x1_1x32x1x8_8_1x1_intrawave_v1,504.37,672.36,0.0
256,1536,1536,7168,18,0,58.096,a8w8_blockscale_1x128x128_256x64x64x256_16x16_32x32_16x16x1_16x16x1_1x32x1x8_8_1x1_intrawave_v1,582.19,460.25,0.0
256,1536,3072,1536,18,0,25.5804,a8w8_blockscale_1x128x128_256x64x64x256_16x16_32x32_16x16x1_16x16x1_1x32x1x8_8_1x1_intrawave_v1,566.66,645.61,0.0
256,1536,4096,512,18,0,14.5922,a8w8_blockscale_1x128x128_256x64x64x256_16x16_32x32_16x16x1_16x16x1_1x32x1x8_8_1x1_intrawave_v1,441.5,1059.92,0.0
256,1536,4608,7168,18,0,139.826,a8w8_blockscale_1x128x128_256x64x64x256_16x16_32x32_16x16x1_16x16x1_1x32x1x8_8_1x1_intrawave_v1,725.68,416.2,0.0
256,1536,7168,256,18,0,16.5106,a8w8_blockscale_1x128x128_256x64x64x256_16x16_32x32_16x16x1_16x16x1_1x32x1x8_8_1x1_intrawave_v1,341.43,1468.65,0.0
256,1536,7168,2048,0,0,66.7266,a8w8_blockscale_1x128x128_256x128x128x128_16x16_32x32_8x32x1_8x32x1_1x32x1x8_8_1x1_intrawave_v3,675.85,597.15,0.0
256,1536,7168,2304,0,0,73.8284,a8w8_blockscale_1x128x128_256x128x128x128_16x16_32x32_8x32x1_8x32x1_1x32x1x8_8_1x1_intrawave_v3,687.19,569.89,0.0
256,2048,100,5120,8,0,23.9096,a8w8_blockscale_1x128x128_256x16x64x256_16x16_16x16_16x16x1_16x16x1_1x16x1x16_4_1x1_intrawave_v1,87.71,477.1,0.0
256,2048,200,5120,13,0,31.3445,a8w8_blockscale_1x128x128_256x32x64x256_16x16_16x16_16x16x1_16x16x1_1x32x1x8_8_2x1_intrawave_v1,133.81,393.34,0.0
256,2048,512,7168,18,0,25.826,a8w8_blockscale_1x128x128_256x64x64x256_16x16_32x32_16x16x1_16x16x1_1x32x1x8_8_1x1_intrawave_v1,582.06,791.73,0.0
256,2048,576,7168,18,0,35.1627,a8w8_blockscale_1x128x128_256x64x64x256_16x16_32x32_16x16x1_16x16x1_1x32x1x8_8_1x1_intrawave_v1,480.95,602.01,0.0
256,2048,800,5120,10,0,64.8436,a8w8_blockscale_1x128x128_256x32x128x128_16x16_32x32_8x32x1_8x32x1_1x32x1x8_8_1x1_intrawave_v1,258.73,275.41,0.0
256,2048,1280,8192,18,0,55.6189,a8w8_blockscale_1x128x128_256x64x64x256_16x16_32x32_16x16x1_16x16x1_1x32x1x8_8_1x1_intrawave_v1,772.21,584.44,0.0
256,2048,1536,7168,18,0,64.5154,a8w8_blockscale_1x128x128_256x64x64x256_16x16_32x32_16x16x1_16x16x1_1x32x1x8_8_1x1_intrawave_v1,699.01,495.72,0.0
256,2048,2304,16384,2,0,373.898,a8w8_blockscale_1x128x128_256x64x128x128_16x16_32x32_8x32x1_8x32x1_1x32x1x8_8_1x1_intrawave_v3,413.53,215.94,0.0
256,2048,2560,8192,2,0,88.0894,a8w8_blockscale_1x128x128_256x64x128x128_16x16_32x32_8x32x1_8x32x1_1x32x1x8_8_1x1_intrawave_v3,975.14,547.56,0.0
256,2048,3072,1536,2,0,31.1726,a8w8_blockscale_1x128x128_256x64x128x128_16x16_32x32_8x32x1_8x32x1_1x32x1x8_8_1x1_intrawave_v3,620.01,655.94,0.0
256,2048,4096,512,18,0,18.1866,a8w8_blockscale_1x128x128_256x64x64x256_16x16_32x32_16x16x1_16x16x1_1x32x1x8_8_1x1_intrawave_v1,472.32,1095.47,0.0
256,2048,4608,7168,18,0,180.0698,a8w8_blockscale_1x128x128_256x64x64x256_16x16_32x32_16x16x1_16x16x1_1x32x1x8_8_1x1_intrawave_v1,751.33,369.77,0.0
256,2048,4608,16384,2,0,590.7175,a8w8_blockscale_1x128x128_256x64x128x128_16x16_32x32_8x32x1_8x32x1_1x32x1x8_8_1x1_intrawave_v3,523.49,216.56,0.0
256,2048,5120,640,15,0,33.357,a8w8_blockscale_1x128x128_256x64x128x128_16x16_32x32_8x32x1_8x32x1_1x32x1x8_8_1x1_intrawave_v1,402.37,766.23,0.0
256,2048,5120,1280,15,0,57.1651,a8w8_blockscale_1x128x128_256x64x128x128_16x16_32x32_8x32x1_8x32x1_1x32x1x8_8_1x1_intrawave_v1,469.58,527.36,0.0
256,2048,5120,3200,15,0,121.9973,a8w8_blockscale_1x128x128_256x64x128x128_16x16_32x32_8x32x1_8x32x1_1x32x1x8_8_1x1_intrawave_v1,550.08,359.92,0.0
256,2048,5120,5120,2,0,200.5041,a8w8_blockscale_1x128x128_256x64x128x128_16x16_32x32_8x32x1_8x32x1_1x32x1x8_8_1x1_intrawave_v3,535.52,287.63,0.0
256,2048,5120,6400,2,0,230.6187,a8w8_blockscale_1x128x128_256x64x128x128_16x16_32x32_8x32x1_8x32x1_1x32x1x8_8_1x1_intrawave_v3,581.99,289.86,0.0
256,2048,5120,25600,2,0,929.0202,a8w8_blockscale_1x128x128_256x64x128x128_16x16_32x32_8x32x1_8x32x1_1x32x1x8_8_1x1_intrawave_v3,577.89,220.09,0.0
256,2048,6400,5120,2,0,268.5865,a8w8_blockscale_1x128x128_256x64x128x128_16x16_32x32_8x32x1_8x32x1_1x32x1x8_8_1x1_intrawave_v3,499.72,258.64,0.0
256,2048,7168,256,11,0,21.3779,a8w8_blockscale_1x128x128_256x32x64x128_16x16_16x16_8x32x1_8x32x1_1x32x1x8_8_2x1_intrawave_v1,351.59,1483.75,0.0
256,2048,7168,2048,0,0,84.8351,a8w8_blockscale_1x128x128_256x128x128x128_16x16_32x32_8x32x1_8x32x1_1x32x1x8_8_1x1_intrawave_v3,708.78,568.57,0.0
256,2048,7168,2304,0,0,92.2125,a8w8_blockscale_1x128x128_256x128x128x128_16x16_32x32_8x32x1_8x32x1_1x32x1x8_8_1x1_intrawave_v3,733.59,548.67,0.0
256,2048,7168,8192,0,0,183.187,a8w8_blockscale_1x128x128_256x128x128x128_16x16_32x32_8x32x1_8x32x1_1x32x1x8_8_1x1_intrawave_v3,1312.97,572.41,0.0
256,2048,8192,1024,0,0,39.4439,a8w8_blockscale_1x128x128_256x128x128x128_16x16_32x32_8x32x1_8x32x1_1x32x1x8_8_1x1_intrawave_v3,871.1,1116.53,0.0
256,2048,8192,2048,0,0,60.0751,a8w8_blockscale_1x128x128_256x128x128x128_16x16_32x32_8x32x1_8x32x1_1x32x1x8_8_1x1_intrawave_v3,1143.89,907.63,0.0
256,2048,8192,3584,0,0,92.397,a8w8_blockscale_1x128x128_256x128x128x128_16x16_32x32_8x32x1_8x32x1_1x32x1x8_8_1x1_intrawave_v3,1301.55,760.36,0.0
256,2048,8192,7168,0,0,179.3602,a8w8_blockscale_1x128x128_256x128x128x128_16x16_32x32_8x32x1_8x32x1_1x32x1x8_8_1x1_intrawave_v3,1340.98,596.31,0.0
256,2048,8192,8192,0,0,194.4158,a8w8_blockscale_1x128x128_256x128x128x128_16x16_32x32_8x32x1_8x32x1_1x32x1x8_8_1x1_intrawave_v3,1413.87,604.07,0.0
256,2048,8192,28672,0,0,653.5844,a8w8_blockscale_1x128x128_256x128x128x128_16x16_32x32_8x32x1_8x32x1_1x32x1x8_8_1x1_intrawave_v3,1471.99,500.56,0.0
256,2048,9216,16384,2,0,1035.1456,a8w8_blockscale_1x128x128_256x64x128x128_16x16_32x32_8x32x1_8x32x1_1x32x1x8_8_1x1_intrawave_v3,597.48,214.75,0.0
256,2048,10240,8192,0,0,243.7723,a8w8_blockscale_1x128x128_256x128x128x128_16x16_32x32_8x32x1_8x32x1_1x32x1x8_8_1x1_intrawave_v3,1409.5,585.0,0.0
256,2048,12800,5120,2,0,488.1405,a8w8_blockscale_1x128x128_256x64x128x128_16x16_32x32_8x32x1_8x32x1_1x32x1x8_8_1x1_intrawave_v3,549.91,263.14,0.0
256,2048,13312,16384,2,0,1474.9458,a8w8_blockscale_1x128x128_256x64x128x128_16x16_32x32_8x32x1_8x32x1_1x32x1x8_8_1x1_intrawave_v3,605.69,207.59,0.0
256,2048,14336,8192,0,0,329.061,a8w8_blockscale_1x128x128_256x128x128x128_16x16_32x32_8x32x1_8x32x1_1x32x1x8_8_1x1_intrawave_v3,1461.85,586.33,0.0
256,2048,16384,2048,2,0,260.6436,a8w8_blockscale_1x128x128_256x64x128x128_16x16_32x32_8x32x1_8x32x1_1x32x1x8_8_1x1_intrawave_v3,527.31,402.3,0.0
256,2048,16384,4096,2,0,488.3099,a8w8_blockscale_1x128x128_256x64x128x128_16x16_32x32_8x32x1_8x32x1_1x32x1x8_8_1x1_intrawave_v3,562.92,292.04,0.0
256,2048,16384,6656,2,0,759.1475,a8w8_blockscale_1x128x128_256x64x128x128_16x16_32x32_8x32x1_8x32x1_1x32x1x8_8_1x1_intrawave_v3,588.39,250.01,0.0
256,2048,16384,8192,2,0,928.8231,a8w8_blockscale_1x128x128_256x64x128x128_16x16_32x32_8x32x1_8x32x1_1x32x1x8_8_1x1_intrawave_v3,591.88,234.82,0.0
256,2048,16384,13312,2,0,1484.2395,a8w8_blockscale_1x128x128_256x64x128x128_16x16_32x32_8x32x1_8x32x1_1x32x1x8_8_1x1_intrawave_v3,601.89,210.53,0.0
256,2048,16384,26624,2,0,2921.171,a8w8_blockscale_1x128x128_256x64x128x128_16x16_32x32_8x32x1_8x32x1_1x32x1x8_8_1x1_intrawave_v3,611.64,190.97,0.0
256,2048,26624,16384,2,0,2903.558,a8w8_blockscale_1x128x128_256x64x128x128_16x16_32x32_8x32x1_8x32x1_1x32x1x8_8_1x1_intrawave_v3,615.35,199.35,0.0
256,2048,51200,5120,2,0,1829.8348,a8w8_blockscale_1x128x128_256x64x128x128_16x16_32x32_8x32x1_8x32x1_1x32x1x8_8_1x1_intrawave_v3,586.8,263.6,0.0
256,2048,53248,16384,2,0,5762.4219,a8w8_blockscale_1x128x128_256x64x128x128_16x16_32x32_8x32x1_8x32x1_1x32x1x8_8_1x1_intrawave_v3,620.12,195.07,0.0
256,2048,57344,8192,0,0,1248.0414,a8w8_blockscale_1x128x128_256x128x128x128_16x16_32x32_8x32x1_8x32x1_1x32x1x8_8_1x1_intrawave_v3,1541.73,578.04,0.0
256,4096,100,5120,8,0,31.9893,a8w8_blockscale_1x128x128_256x16x64x256_16x16_16x16_16x16x1_16x16x1_1x16x1x16_4_1x1_intrawave_v1,131.12,697.19,0.0
256,4096,200,5120,13,0,45.1923,a8w8_blockscale_1x128x128_256x32x64x256_16x16_16x16_16x16x1_16x16x1_1x32x1x8_8_2x1_intrawave_v1,185.62,522.96,0.0
256,4096,512,7168,18,0,44.5137,a8w8_blockscale_1x128x128_256x64x64x256_16x16_32x32_16x16x1_16x16x1_1x32x1x8_8_1x1_intrawave_v1,675.4,836.25,0.0
256,4096,576,7168,18,0,57.2232,a8w8_blockscale_1x128x128_256x64x64x256_16x16_32x32_16x16x1_16x16x1_1x32x1x8_8_1x1_intrawave_v1,591.07,667.69,0.0
256,4096,800,5120,15,0,101.8224,a8w8_blockscale_1x128x128_256x64x128x128_16x16_32x32_8x32x1_8x32x1_1x32x1x8_8_1x1_intrawave_v1,329.54,310.55,0.0
256,4096,1280,8192,14,0,86.4331,a8w8_blockscale_1x128x128_256x64x256x128_16x16_32x32_8x32x1_8x32x1_1x32x1x8_8_1x1_intrawave_v1,993.82,630.85,0.0
256,4096,1536,7168,18,0,124.0493,a8w8_blockscale_1x128x128_256x64x64x256_16x16_32x32_16x16x1_16x16x1_1x32x1x8_8_1x1_intrawave_v1,727.08,426.87,0.0
256,4096,2304,16384,2,0,596.2252,a8w8_blockscale_1x128x128_256x64x128x128_16x16_32x32_8x32x1_8x32x1_1x32x1x8_8_1x1_intrawave_v3,518.66,207.53,0.0
256,4096,2560,8192,0,0,139.0304,a8w8_blockscale_1x128x128_256x128x128x128_16x16_32x32_8x32x1_8x32x1_1x32x1x8_8_1x1_intrawave_v3,1235.69,543.03,0.0
256,4096,3072,1536,0,0,56.5736,a8w8_blockscale_1x128x128_256x128x128x128_16x16_32x32_8x32x1_8x32x1_1x32x1x8_8_1x1_intrawave_v3,683.26,639.45,0.0
256,4096,4096,512,18,0,31.979,a8w8_blockscale_1x128x128_256x64x64x256_16x16_32x32_16x16x1_16x16x1_1x32x1x8_8_1x1_intrawave_v1,537.22,1180.42,0.0
256,4096,4608,7168,0,0,310.9487,a8w8_blockscale_1x128x128_256x128x128x128_16x16_32x32_8x32x1_8x32x1_1x32x1x8_8_1x1_intrawave_v3,870.19,322.04,0.0
256,4096,4608,16384,2,0,1034.0419,a8w8_blockscale_1x128x128_256x64x128x128_16x16_32x32_8x32x1_8x32x1_1x32x1x8_8_1x1_intrawave_v3,598.11,174.42,0.0
256,4096,5120,640,15,0,59.2604,a8w8_blockscale_1x128x128_256x64x128x128_16x16_32x32_8x32x1_8x32x1_1x32x1x8_8_1x1_intrawave_v1,452.98,807.31,0.0
256,4096,5120,1280,15,0,104.6033,a8w8_blockscale_1x128x128_256x64x128x128_16x16_32x32_8x32x1_8x32x1_1x32x1x8_8_1x1_intrawave_v1,513.24,513.75,0.0
256,4096,5120,3200,15,0,227.0492,a8w8_blockscale_1x128x128_256x64x128x128_16x16_32x32_8x32x1_8x32x1_1x32x1x8_8_1x1_intrawave_v1,591.14,314.62,0.0
256,4096,5120,5120,2,0,375.2221,a8w8_blockscale_1x128x128_256x64x128x128_16x16_32x32_8x32x1_8x32x1_1x32x1x8_8_1x1_intrawave_v3,572.32,237.54,0.0
256,4096,5120,6400,2,0,441.2723,a8w8_blockscale_1x128x128_256x64x128x128_16x16_32x32_8x32x1_8x32x1_1x32x1x8_8_1x1_intrawave_v3,608.32,228.71,0.0
256,4096,5120,25600,2,0,1772.5774,a8w8_blockscale_1x128x128_256x64x128x128_16x16_32x32_8x32x1_8x32x1_1x32x1x8_8_1x1_intrawave_v3,605.75,156.76,0.0
256,4096,6400,5120,2,0,479.6073,a8w8_blockscale_1x128x128_256x64x128x128_16x16_32x32_8x32x1_8x32x1_1x32x1x8_8_1x1_intrawave_v3,559.7,221.37,0.0
256,4096,7168,256,18,0,37.2575,a8w8_blockscale_1x128x128_256x64x64x256_16x16_32x32_16x16x1_16x16x1_1x32x1x8_8_1x1_intrawave_v1,403.47,1653.46,0.0
256,4096,7168,2048,0,0,150.9763,a8w8_blockscale_1x128x128_256x128x128x128_16x16_32x32_8x32x1_8x32x1_1x32x1x8_8_1x1_intrawave_v3,796.54,541.73,0.0
256,4096,7168,2304,0,0,161.8222,a8w8_blockscale_1x128x128_256x128x128x128_16x16_32x32_8x32x1_8x32x1_1x32x1x8_8_1x1_intrawave_v3,836.05,523.24,0.0
256,4096,7168,8192,0,0,324.97,a8w8_blockscale_1x128x128_256x128x128x128_16x16_32x32_8x32x1_8x32x1_1x32x1x8_8_1x1_intrawave_v3,1480.25,464.64,0.0
256,4096,8192,1024,0,0,71.6327,a8w8_blockscale_1x128x128_256x128x128x128_16x16_32x32_8x32x1_8x32x1_1x32x1x8_8_1x1_intrawave_v3,959.33,1112.51,0.0
256,4096,8192,2048,0,0,112.5789,a8w8_blockscale_1x128x128_256x128x128x128_16x16_32x32_8x32x1_8x32x1_1x32x1x8_8_1x1_intrawave_v3,1220.82,819.64,0.0
256,4096,8192,3584,0,0,168.6553,a8w8_blockscale_1x128x128_256x128x128x128_16x16_32x32_8x32x1_8x32x1_1x32x1x8_8_1x1_intrawave_v3,1426.09,659.03,0.0
256,4096,8192,7168,0,0,324.0622,a8w8_blockscale_1x128x128_256x128x128x128_16x16_32x32_8x32x1_8x32x1_1x32x1x8_8_1x1_intrawave_v3,1484.4,478.89,0.0
256,4096,8192,8192,0,0,359.2549,a8w8_blockscale_1x128x128_256x128x128x128_16x16_32x32_8x32x1_8x32x1_1x32x1x8_8_1x1_intrawave_v3,1530.27,467.0,0.0
256,4096,8192,28672,0,0,1321.9845,a8w8_blockscale_1x128x128_256x128x128x128_16x16_32x32_8x32x1_8x32x1_1x32x1x8_8_1x1_intrawave_v3,1455.5,317.27,0.0
256,4096,9216,16384,2,0,2012.0609,a8w8_blockscale_1x128x128_256x64x128x128_16x16_32x32_8x32x1_8x32x1_1x32x1x8_8_1x1_intrawave_v3,614.77,145.92,0.0
256,4096,10240,8192,0,0,442.7455,a8w8_blockscale_1x128x128_256x128x128x128_16x16_32x32_8x32x1_8x32x1_1x32x1x8_8_1x1_intrawave_v3,1552.12,454.72,0.0
256,4096,12800,5120,2,0,905.9733,a8w8_blockscale_1x128x128_256x64x128x128_16x16_32x32_8x32x1_8x32x1_1x32x1x8_8_1x1_intrawave_v3,592.59,211.23,0.0
256,4096,13312,16384,2,0,2908.028,a8w8_blockscale_1x128x128_256x64x128x128_16x16_32x32_8x32x1_8x32x1_1x32x1x8_8_1x1_intrawave_v3,614.4,135.58,0.0
256,4096,14336,8192,0,0,611.4359,a8w8_blockscale_1x128x128_256x128x128x128_16x16_32x32_8x32x1_8x32x1_1x32x1x8_8_1x1_intrawave_v3,1573.46,439.02,0.0
256,4096,16384,2048,2,0,500.5023,a8w8_blockscale_1x128x128_256x64x128x128_16x16_32x32_8x32x1_8x32x1_1x32x1x8_8_1x1_intrawave_v3,549.2,351.97,0.0
256,4096,16384,4096,2,0,947.3225,a8w8_blockscale_1x128x128_256x64x128x128_16x16_32x32_8x32x1_8x32x1_1x32x1x8_8_1x1_intrawave_v3,580.33,230.23,0.0
256,4096,16384,6656,2,0,1477.0741,a8w8_blockscale_1x128x128_256x64x128x128_16x16_32x32_8x32x1_8x32x1_1x32x1x8_8_1x1_intrawave_v3,604.81,183.15,0.0
256,4096,16384,8192,2,0,1811.2412,a8w8_blockscale_1x128x128_256x64x128x128_16x16_32x32_8x32x1_8x32x1_1x32x1x8_8_1x1_intrawave_v3,607.05,166.73,0.0
256,4096,16384,13312,2,0,2942.4425,a8w8_blockscale_1x128x128_256x64x128x128_16x16_32x32_8x32x1_8x32x1_1x32x1x8_8_1x1_intrawave_v3,607.22,138.27,0.0
256,4096,16384,26624,2,0,5781.3289,a8w8_blockscale_1x128x128_256x64x128x128_16x16_32x32_8x32x1_8x32x1_1x32x1x8_8_1x1_intrawave_v3,618.1,117.53,0.0
256,4096,26624,16384,2,0,5779.1042,a8w8_blockscale_1x128x128_256x64x128x128_16x16_32x32_8x32x1_8x32x1_1x32x1x8_8_1x1_intrawave_v3,618.33,124.83,0.0
256,4096,51200,5120,2,0,3639.3281,a8w8_blockscale_1x128x128_256x64x128x128_16x16_32x32_8x32x1_8x32x1_1x32x1x8_8_1x1_intrawave_v3,590.08,193.04,0.0
256,4096,53248,16384,2,0,11486.1149,a8w8_blockscale_1x128x128_256x64x128x128_16x16_32x32_8x32x1_8x32x1_1x32x1x8_8_1x1_intrawave_v3,622.21,119.77,0.0
256,4096,57344,8192,0,0,2541.7726,a8w8_blockscale_1x128x128_256x128x128x128_16x16_32x32_8x32x1_8x32x1_1x32x1x8_8_1x1_intrawave_v3,1514.02,382.83,0.0
256,8192,100,5120,8,0,60.0787,a8w8_blockscale_1x128x128_256x16x64x256_16x16_16x16_16x16x1_16x16x1_1x16x1x16_4_1x1_intrawave_v1,139.63,733.93,0.0
256,8192,200,5120,3,0,68.3504,a8w8_blockscale_1x128x128_256x64x64x128_16x16_32x32_8x32x1_8x32x1_1x32x1x8_8_1x1_intrawave_v3,245.46,676.57,0.0
256,8192,512,7168,18,0,86.0755,a8w8_blockscale_1x128x128_256x64x64x256_16x16_32x32_16x16x1_16x16x1_1x32x1x8_8_1x1_intrawave_v1,698.57,822.29,0.0
256,8192,576,7168,18,0,101.6527,a8w8_blockscale_1x128x128_256x64x64x256_16x16_32x32_16x16x1_16x16x1_1x32x1x8_8_1x1_intrawave_v1,665.46,711.11,0.0
256,8192,800,5120,16,0,175.2122,a8w8_blockscale_1x128x128_256x64x64x128_16x16_32x32_8x32x1_8x32x1_1x32x1x8_8_1x1_intrawave_v1,383.01,337.57,0.0
256,8192,1280,8192,0,0,141.5584,a8w8_blockscale_1x128x128_256x128x128x128_16x16_32x32_8x32x1_8x32x1_1x32x1x8_8_1x1_intrawave_v3,1213.62,696.29,0.0
256,8192,1536,7168,0,0,210.661,a8w8_blockscale_1x128x128_256x128x128x128_16x16_32x32_8x32x1_8x32x1_1x32x1x8_8_1x1_intrawave_v3,856.3,450.47,0.0
256,8192,2304,16384,2,0,1056.8417,a8w8_blockscale_1x128x128_256x64x128x128_16x16_32x32_8x32x1_8x32x1_1x32x1x8_8_1x1_intrawave_v3,585.21,198.44,0.0
256,8192,2560,8192,0,0,237.3844,a8w8_blockscale_1x128x128_256x128x128x128_16x16_32x32_8x32x1_8x32x1_1x32x1x8_8_1x1_intrawave_v3,1447.43,547.73,0.0
256,8192,3072,1536,0,0,103.7592,a8w8_blockscale_1x128x128_256x128x128x128_16x16_32x32_8x32x1_8x32x1_1x32x1x8_8_1x1_intrawave_v3,745.08,651.83,0.0
256,8192,4096,512,18,0,63.5698,a8w8_blockscale_1x128x128_256x64x64x256_16x16_32x32_16x16x1_16x16x1_1x32x1x8_8_1x1_intrawave_v1,540.5,1154.64,0.0
256,8192,4608,7168,0,0,539.5795,a8w8_blockscale_1x128x128_256x128x128x128_16x16_32x32_8x32x1_8x32x1_1x32x1x8_8_1x1_intrawave_v3,1002.94,309.96,0.0
256,8192,4608,16384,2,0,2008.6271,a8w8_blockscale_1x128x128_256x64x128x128_16x16_32x32_8x32x1_8x32x1_1x32x1x8_8_1x1_intrawave_v3,615.82,141.99,0.0
256,8192,5120,640,15,0,110.1889,a8w8_blockscale_1x128x128_256x64x128x128_16x16_32x32_8x32x1_8x32x1_1x32x1x8_8_1x1_intrawave_v1,487.23,838.61,0.0
256,8192,5120,1280,15,0,196.6701,a8w8_blockscale_1x128x128_256x64x128x128_16x16_32x32_8x32x1_8x32x1_1x32x1x8_8_1x1_intrawave_v1,545.96,513.17,0.0
256,8192,5120,3200,15,0,439.1323,a8w8_blockscale_1x128x128_256x64x128x128_16x16_32x32_8x32x1_8x32x1_1x32x1x8_8_1x1_intrawave_v1,611.29,288.03,0.0
256,8192,5120,5120,2,0,727.8325,a8w8_blockscale_1x128x128_256x64x128x128_16x16_32x32_8x32x1_8x32x1_1x32x1x8_8_1x1_intrawave_v3,590.1,208.9,0.0
256,8192,5120,6400,2,0,863.2461,a8w8_blockscale_1x128x128_256x64x128x128_16x16_32x32_8x32x1_8x32x1_1x32x1x8_8_1x1_intrawave_v3,621.92,195.87,0.0
256,8192,5120,25600,2,0,3468.7676,a8w8_blockscale_1x128x128_256x64x128x128_16x16_32x32_8x32x1_8x32x1_1x32x1x8_8_1x1_intrawave_v3,619.09,122.43,0.0
256,8192,6400,5120,2,0,903.7238,a8w8_blockscale_1x128x128_256x64x128x128_16x16_32x32_8x32x1_8x32x1_1x32x1x8_8_1x1_intrawave_v3,594.07,198.7,0.0
256,8192,7168,256,17,0,73.9508,a8w8_blockscale_1x128x128_256x64x128x256_16x16_32x32_16x16x1_16x16x1_1x32x1x8_8_1x1_intrawave_v1,406.55,1641.26,0.0
256,8192,7168,2048,0,0,269.0296,a8w8_blockscale_1x128x128_256x128x128x128_16x16_32x32_8x32x1_8x32x1_1x32x1x8_8_1x1_intrawave_v3,894.02,553.46,0.0
256,8192,7168,2304,0,0,285.6152,a8w8_blockscale_1x128x128_256x128x128x128_16x16_32x32_8x32x1_8x32x1_1x32x1x8_8_1x1_intrawave_v3,947.37,535.09,0.0
256,8192,7168,8192,0,0,617.808,a8w8_blockscale_1x128x128_256x128x128x128_16x16_32x32_8x32x1_8x32x1_1x32x1x8_8_1x1_intrawave_v3,1557.24,393.76,0.0
256,8192,8192,1024,0,0,129.7768,a8w8_blockscale_1x128x128_256x128x128x128_16x16_32x32_8x32x1_8x32x1_1x32x1x8_8_1x1_intrawave_v3,1059.04,1163.5,0.0
256,8192,8192,2048,0,0,210.461,a8w8_blockscale_1x128x128_256x128x128x128_16x16_32x32_8x32x1_8x32x1_1x32x1x8_8_1x1_intrawave_v3,1306.08,797.17,0.0
256,8192,8192,3584,0,0,316.7246,a8w8_blockscale_1x128x128_256x128x128x128_16x16_32x32_8x32x1_8x32x1_1x32x1x8_8_1x1_intrawave_v3,1518.78,609.17,0.0
256,8192,8192,7168,0,0,619.8681,a8w8_blockscale_1x128x128_256x128x128x128_16x16_32x32_8x32x1_8x32x1_1x32x1x8_8_1x1_intrawave_v3,1552.06,405.99,0.0
256,8192,8192,8192,0,0,701.7376,a8w8_blockscale_1x128x128_256x128x128x128_16x16_32x32_8x32x1_8x32x1_1x32x1x8_8_1x1_intrawave_v3,1566.84,382.53,0.0
256,8192,8192,28672,0,0,2719.7599,a8w8_blockscale_1x128x128_256x128x128x128_16x16_32x32_8x32x1_8x32x1_1x32x1x8_8_1x1_intrawave_v3,1414.94,222.07,0.0
256,8192,9216,16384,2,0,3963.6781,a8w8_blockscale_1x128x128_256x64x128x128_16x16_32x32_8x32x1_8x32x1_1x32x1x8_8_1x1_intrawave_v3,624.14,110.05,0.0
256,8192,10240,8192,0,0,871.5554,a8w8_blockscale_1x128x128_256x128x128x128_16x16_32x32_8x32x1_8x32x1_1x32x1x8_8_1x1_intrawave_v3,1576.94,365.75,0.0
256,8192,12800,5120,2,0,1779.8827,a8w8_blockscale_1x128x128_256x64x128x128_16x16_32x32_8x32x1_8x32x1_1x32x1x8_8_1x1_intrawave_v3,603.27,178.21,0.0
256,8192,13312,16384,2,0,5793.2738,a8w8_blockscale_1x128x128_256x64x128x128_16x16_32x32_8x32x1_8x32x1_1x32x1x8_8_1x1_intrawave_v3,616.82,98.46,0.0
256,8192,14336,8192,0,0,1212.4023,a8w8_blockscale_1x128x128_256x128x128x128_16x16_32x32_8x32x1_8x32x1_1x32x1x8_8_1x1_intrawave_v3,1587.05,345.95,0.0
256,8192,16384,2048,2,0,981.2869,a8w8_blockscale_1x128x128_256x64x128x128_16x16_32x32_8x32x1_8x32x1_1x32x1x8_8_1x1_intrawave_v3,560.24,324.85,0.0
256,8192,16384,4096,2,0,1859.5258,a8w8_blockscale_1x128x128_256x64x128x128_16x16_32x32_8x32x1_8x32x1_1x32x1x8_8_1x1_intrawave_v3,591.29,198.49,0.0
256,8192,16384,6656,2,0,2915.9543,a8w8_blockscale_1x128x128_256x64x128x128_16x16_32x32_8x32x1_8x32x1_1x32x1x8_8_1x1_intrawave_v3,612.73,148.16,0.0
256,8192,16384,8192,2,0,3555.2418,a8w8_blockscale_1x128x128_256x64x128x128_16x16_32x32_8x32x1_8x32x1_1x32x1x8_8_1x1_intrawave_v3,618.53,132.13,0.0
256,8192,16384,13312,2,0,5848.5652,a8w8_blockscale_1x128x128_256x64x128x128_16x16_32x32_8x32x1_8x32x1_1x32x1x8_8_1x1_intrawave_v3,610.99,101.84,0.0
256,8192,16384,26624,2,0,11503.3184,a8w8_blockscale_1x128x128_256x64x128x128_16x16_32x32_8x32x1_8x32x1_1x32x1x8_8_1x1_intrawave_v3,621.28,80.22,0.0
256,8192,26624,16384,2,0,11516.6936,a8w8_blockscale_1x128x128_256x64x128x128_16x16_32x32_8x32x1_8x32x1_1x32x1x8_8_1x1_intrawave_v3,620.56,87.41,0.0
256,8192,51200,5120,2,0,7245.9382,a8w8_blockscale_1x128x128_256x64x128x128_16x16_32x32_8x32x1_8x32x1_1x32x1x8_8_1x1_intrawave_v3,592.74,157.74,0.0
256,8192,53248,16384,2,0,22939.5454,a8w8_blockscale_1x128x128_256x64x128x128_16x16_32x32_8x32x1_8x32x1_1x32x1x8_8_1x1_intrawave_v3,623.1,81.91,0.0
256,8192,57344,8192,0,0,5023.1032,a8w8_blockscale_1x128x128_256x128x128x128_16x16_32x32_8x32x1_8x32x1_1x32x1x8_8_1x1_intrawave_v3,1532.24,293.92,0.0
256,16384,100,5120,8,0,111.1281,a8w8_blockscale_1x128x128_256x16x64x256_16x16_16x16_16x16x1_16x16x1_1x16x1x16_4_1x1_intrawave_v1,150.97,788.95,0.0
256,16384,200,5120,15,0,102.1366,a8w8_blockscale_1x128x128_256x64x128x128_16x16_32x32_8x32x1_8x32x1_1x32x1x8_8_1x1_intrawave_v1,328.53,895.5,0.0
256,16384,512,7168,0,0,143.7706,a8w8_blockscale_1x128x128_256x128x128x128_16x16_32x32_8x32x1_8x32x1_1x32x1x8_8_1x1_intrawave_v3,836.47,959.08,0.0
256,16384,576,7168,18,0,186.7632,a8w8_blockscale_1x128x128_256x64x64x256_16x16_32x32_16x16x1_16x16x1_1x32x1x8_8_1x1_intrawave_v1,724.4,751.99,0.0
256,16384,800,5120,16,0,316.1007,a8w8_blockscale_1x128x128_256x64x64x128_16x16_32x32_8x32x1_8x32x1_1x32x1x8_8_1x1_intrawave_v1,424.6,361.27,0.0
256,16384,1280,8192,0,0,242.865,a8w8_blockscale_1x128x128_256x128x128x128_16x16_32x32_8x32x1_8x32x1_1x32x1x8_8_1x1_intrawave_v3,1414.77,768.52,0.0
256,16384,1536,7168,0,0,371.4478,a8w8_blockscale_1x128x128_256x128x128x128_16x16_32x32_8x32x1_8x32x1_1x32x1x8_8_1x1_intrawave_v3,971.27,481.31,0.0
256,16384,2304,16384,2,0,2048.4719,a8w8_blockscale_1x128x128_256x64x128x128_16x16_32x32_8x32x1_8x32x1_1x32x1x8_8_1x1_intrawave_v3,603.84,186.33,0.0
256,16384,2560,8192,0,0,449.1566,a8w8_blockscale_1x128x128_256x128x128x128_16x16_32x32_8x32x1_8x32x1_1x32x1x8_8_1x1_intrawave_v3,1529.97,532.28,0.0
256,16384,3072,1536,0,0,186.8656,a8w8_blockscale_1x128x128_256x128x128x128_16x16_32x32_8x32x1_8x32x1_1x32x1x8_8_1x1_intrawave_v3,827.43,698.62,0.0
256,16384,4096,512,0,0,119.5724,a8w8_blockscale_1x128x128_256x128x128x128_16x16_32x32_8x32x1_8x32x1_1x32x1x8_8_1x1_intrawave_v3,574.71,1210.17,0.0
256,16384,4608,7168,0,0,1046.6928,a8w8_blockscale_1x128x128_256x128x128x128_16x16_32x32_8x32x1_8x32x1_1x32x1x8_8_1x1_intrawave_v3,1034.05,288.02,0.0
256,16384,4608,16384,2,0,3961.2624,a8w8_blockscale_1x128x128_256x64x128x128_16x16_32x32_8x32x1_8x32x1_1x32x1x8_8_1x1_intrawave_v3,624.52,124.94,0.0
256,16384,5120,640,15,0,207.3893,a8w8_blockscale_1x128x128_256x64x128x128_16x16_32x32_8x32x1_8x32x1_1x32x1x8_8_1x1_intrawave_v1,517.74,875.33,0.0
256,16384,5120,1280,15,0,381.6221,a8w8_blockscale_1x128x128_256x64x128x128_16x16_32x32_8x32x1_8x32x1_1x32x1x8_8_1x1_intrawave_v1,562.73,511.76,0.0
256,16384,5120,3200,15,0,865.8813,a8w8_blockscale_1x128x128_256x64x128x128_16x16_32x32_8x32x1_8x32x1_1x32x1x8_8_1x1_intrawave_v1,620.03,273.23,0.0
256,16384,5120,5120,2,0,1431.2397,a8w8_blockscale_1x128x128_256x64x128x128_16x16_32x32_8x32x1_8x32x1_1x32x1x8_8_1x1_intrawave_v3,600.17,194.15,0.0
256,16384,5120,6400,2,0,1711.1912,a8w8_blockscale_1x128x128_256x64x128x128_16x16_32x32_8x32x1_8x32x1_1x32x1x8_8_1x1_intrawave_v3,627.48,178.47,0.0
256,16384,5120,25600,2,0,6828.9694,a8w8_blockscale_1x128x128_256x64x128x128_16x16_32x32_8x32x1_8x32x1_1x32x1x8_8_1x1_intrawave_v3,628.93,105.18,0.0
256,16384,6400,5120,2,0,1776.6961,a8w8_blockscale_1x128x128_256x64x128x128_16x16_32x32_8x32x1_8x32x1_1x32x1x8_8_1x1_intrawave_v3,604.35,183.69,0.0
256,16384,7168,256,17,0,141.6637,a8w8_blockscale_1x128x128_256x64x128x256_16x16_32x32_16x16x1_16x16x1_1x32x1x8_8_1x1_intrawave_v1,424.45,1700.58,0.0
256,16384,7168,2048,0,0,508.5984,a8w8_blockscale_1x128x128_256x128x128x128_16x16_32x32_8x32x1_8x32x1_1x32x1x8_8_1x1_intrawave_v3,945.81,556.66,0.0
256,16384,7168,2304,0,0,539.2895,a8w8_blockscale_1x128x128_256x128x128x128_16x16_32x32_8x32x1_8x32x1_1x32x1x8_8_1x1_intrawave_v3,1003.48,536.16,0.0
256,16384,7168,8192,0,0,1213.2002,a8w8_blockscale_1x128x128_256x128x128x128_16x16_32x32_8x32x1_8x32x1_1x32x1x8_8_1x1_intrawave_v3,1586.01,352.64,0.0
256,16384,8192,1024,0,0,242.172,a8w8_blockscale_1x128x128_256x128x128x128_16x16_32x32_8x32x1_8x32x1_1x32x1x8_8_1x1_intrawave_v3,1135.05,1212.37,0.0
256,16384,8192,2048,0,0,387.6755,a8w8_blockscale_1x128x128_256x128x128x128_16x16_32x32_8x32x1_8x32x1_1x32x1x8_8_1x1_intrawave_v3,1418.08,822.25,0.0
256,16384,8192,3584,0,0,609.2243,a8w8_blockscale_1x128x128_256x128x128x128_16x16_32x32_8x32x1_8x32x1_1x32x1x8_8_1x1_intrawave_v3,1579.18,585.2,0.0
256,16384,8192,7168,0,0,1238.5961,a8w8_blockscale_1x128x128_256x128x128x128_16x16_32x32_8x32x1_8x32x1_1x32x1x8_8_1x1_intrawave_v3,1553.49,358.95,0.0
256,16384,8192,8192,0,0,1425.7696,a8w8_blockscale_1x128x128_256x128x128x128_16x16_32x32_8x32x1_8x32x1_1x32x1x8_8_1x1_intrawave_v3,1542.34,329.48,0.0
256,16384,8192,28672,0,0,5548.0298,a8w8_blockscale_1x128x128_256x128x128x128_16x16_32x32_8x32x1_8x32x1_1x32x1x8_8_1x1_intrawave_v3,1387.26,175.39,0.0
256,16384,9216,16384,2,0,7859.9981,a8w8_blockscale_1x128x128_256x64x128x128_16x16_32x32_8x32x1_8x32x1_1x32x1x8_8_1x1_intrawave_v3,629.49,91.78,0.0
256,16384,10240,8192,0,0,1780.9915,a8w8_blockscale_1x128x128_256x128x128x128_16x16_32x32_8x32x1_8x32x1_1x32x1x8_8_1x1_intrawave_v3,1543.4,310.87,0.0
256,16384,12800,5120,2,0,3524.9994,a8w8_blockscale_1x128x128_256x64x128x128_16x16_32x32_8x32x1_8x32x1_1x32x1x8_8_1x1_intrawave_v3,609.22,161.38,0.0
256,16384,13312,16384,2,0,11553.8542,a8w8_blockscale_1x128x128_256x64x128x128_16x16_32x32_8x32x1_8x32x1_1x32x1x8_8_1x1_intrawave_v3,618.57,79.86,0.0
256,16384,14336,8192,0,0,2528.4664,a8w8_blockscale_1x128x128_256x128x128x128_16x16_32x32_8x32x1_8x32x1_1x32x1x8_8_1x1_intrawave_v3,1521.99,285.32,0.0
256,16384,16384,2048,15,0,1933.1538,a8w8_blockscale_1x128x128_256x64x128x128_16x16_32x32_8x32x1_8x32x1_1x32x1x8_8_1x1_intrawave_v1,568.77,312.43,0.0
256,16384,16384,4096,2,0,3670.041,a8w8_blockscale_1x128x128_256x64x128x128_16x16_32x32_8x32x1_8x32x1_1x32x1x8_8_1x1_intrawave_v3,599.18,182.86,0.0
256,16384,16384,6656,2,0,5783.0273,a8w8_blockscale_1x128x128_256x64x128x128_16x16_32x32_8x32x1_8x32x1_1x32x1x8_8_1x1_intrawave_v3,617.91,130.55,0.0
256,16384,16384,8192,2,0,7072.6134,a8w8_blockscale_1x128x128_256x64x128x128_16x16_32x32_8x32x1_8x32x1_1x32x1x8_8_1x1_intrawave_v3,621.84,113.86,0.0
256,16384,16384,13312,2,0,11555.9374,a8w8_blockscale_1x128x128_256x64x128x128_16x16_32x32_8x32x1_8x32x1_1x32x1x8_8_1x1_intrawave_v3,618.45,84.21,0.0
256,16384,16384,26624,2,0,22955.2402,a8w8_blockscale_1x128x128_256x64x128x128_16x16_32x32_8x32x1_8x32x1_1x32x1x8_8_1x1_intrawave_v3,622.67,61.39,0.0
256,16384,26624,16384,2,0,22929.2293,a8w8_blockscale_1x128x128_256x64x128x128_16x16_32x32_8x32x1_8x32x1_1x32x1x8_8_1x1_intrawave_v3,623.38,68.78,0.0
256,16384,51200,5120,2,0,14551.6538,a8w8_blockscale_1x128x128_256x64x128x128_16x16_32x32_8x32x1_8x32x1_1x32x1x8_8_1x1_intrawave_v3,590.31,139.07,0.0
256,16384,53248,16384,2,0,45925.9862,a8w8_blockscale_1x128x128_256x64x128x128_16x16_32x32_8x32x1_8x32x1_1x32x1x8_8_1x1_intrawave_v3,622.46,62.83,0.0
256,16384,57344,8192,0,0,9916.7065,a8w8_blockscale_1x128x128_256x128x128x128_16x16_32x32_8x32x1_8x32x1_1x32x1x8_8_1x1_intrawave_v3,1552.25,250.39,0.0
256,20480,512,7168,2,0,193.5078,a8w8_blockscale_1x128x128_256x64x128x128_16x16_32x32_8x32x1_8x32x1_1x32x1x8_8_1x1_intrawave_v3,776.84,885.97,0.0
256,20480,576,7168,18,0,230.9895,a8w8_blockscale_1x128x128_256x64x64x256_16x16_32x32_16x16x1_16x16x1_1x32x1x8_8_1x1_intrawave_v1,732.13,755.54,0.0
256,20480,1536,7168,0,0,464.4401,a8w8_blockscale_1x128x128_256x128x128x128_16x16_32x32_8x32x1_8x32x1_1x32x1x8_8_1x1_intrawave_v3,971.0,475.25,0.0
256,20480,3072,1536,0,0,223.3253,a8w8_blockscale_1x128x128_256x128x128x128_16x16_32x32_8x32x1_8x32x1_1x32x1x8_8_1x1_intrawave_v3,865.43,725.42,0.0
256,20480,4096,512,18,0,144.807,a8w8_blockscale_1x128x128_256x64x64x256_16x16_32x32_16x16x1_16x16x1_1x32x1x8_8_1x1_intrawave_v1,593.2,1245.49,0.0
256,20480,4608,7168,0,0,1309.3769,a8w8_blockscale_1x128x128_256x128x128x128_16x16_32x32_8x32x1_8x32x1_1x32x1x8_8_1x1_intrawave_v3,1033.25,281.49,0.0
256,20480,7168,256,18,0,167.1547,a8w8_blockscale_1x128x128_256x64x64x256_16x16_32x32_16x16x1_16x16x1_1x32x1x8_8_1x1_intrawave_v1,449.65,1798.81,0.0
256,20480,7168,2048,0,0,630.5854,a8w8_blockscale_1x128x128_256x128x128x128_16x16_32x32_8x32x1_8x32x1_1x32x1x8_8_1x1_intrawave_v3,953.55,555.4,0.0
256,20480,7168,2304,0,0,670.7196,a8w8_blockscale_1x128x128_256x128x128x128_16x16_32x32_8x32x1_8x32x1_1x32x1x8_8_1x1_intrawave_v3,1008.55,532.71,0.0
256,32768,100,5120,8,0,211.0462,a8w8_blockscale_1x128x128_256x16x64x256_16x16_16x16_16x16x1_16x16x1_1x16x1x16_4_1x1_intrawave_v1,158.99,828.43,0.0
256,32768,200,5120,15,0,195.2361,a8w8_blockscale_1x128x128_256x64x128x128_16x16_32x32_8x32x1_8x32x1_1x32x1x8_8_1x1_intrawave_v1,343.73,931.71,0.0
256,32768,800,5120,16,0,602.666,a8w8_blockscale_1x128x128_256x64x64x128_16x16_32x32_8x32x1_8x32x1_1x32x1x8_8_1x1_intrawave_v1,445.41,372.17,0.0
256,32768,1280,8192,0,0,465.5363,a8w8_blockscale_1x128x128_256x128x128x128_16x16_32x32_8x32x1_8x32x1_1x32x1x8_8_1x1_intrawave_v3,1476.14,779.33,0.0
256,32768,2304,16384,2,0,4039.709,a8w8_blockscale_1x128x128_256x64x128x128_16x16_32x32_8x32x1_8x32x1_1x32x1x8_8_1x1_intrawave_v3,612.4,179.62,0.0
256,32768,2560,8192,0,0,897.4122,a8w8_blockscale_1x128x128_256x128x128x128_16x16_32x32_8x32x1_8x32x1_1x32x1x8_8_1x1_intrawave_v3,1531.5,509.44,0.0
256,32768,4608,16384,2,0,7894.1957,a8w8_blockscale_1x128x128_256x64x128x128_16x16_32x32_8x32x1_8x32x1_1x32x1x8_8_1x1_intrawave_v3,626.76,115.83,0.0
256,32768,5120,640,15,0,406.4901,a8w8_blockscale_1x128x128_256x64x128x128_16x16_32x32_8x32x1_8x32x1_1x32x1x8_8_1x1_intrawave_v1,528.3,885.12,0.0
256,32768,5120,1280,15,0,751.9418,a8w8_blockscale_1x128x128_256x64x128x128_16x16_32x32_8x32x1_8x32x1_1x32x1x8_8_1x1_intrawave_v1,571.18,510.73,0.0
256,32768,5120,3200,15,0,1723.7148,a8w8_blockscale_1x128x128_256x64x128x128_16x16_32x32_8x32x1_8x32x1_1x32x1x8_8_1x1_intrawave_v1,622.92,265.0,0.0
256,32768,5120,5120,2,0,2838.2733,a8w8_blockscale_1x128x128_256x64x128x128_16x16_32x32_8x32x1_8x32x1_1x32x1x8_8_1x1_intrawave_v3,605.29,186.57,0.0
256,32768,5120,6400,2,0,3403.6121,a8w8_blockscale_1x128x128_256x64x128x128_16x16_32x32_8x32x1_8x32x1_1x32x1x8_8_1x1_intrawave_v3,630.94,169.83,0.0
256,32768,5120,25600,2,0,13642.3261,a8w8_blockscale_1x128x128_256x64x128x128_16x16_32x32_8x32x1_8x32x1_1x32x1x8_8_1x1_intrawave_v3,629.65,95.69,0.0
256,32768,6400,5120,2,0,3525.4628,a8w8_blockscale_1x128x128_256x64x128x128_16x16_32x32_8x32x1_8x32x1_1x32x1x8_8_1x1_intrawave_v3,609.14,175.86,0.0
256,32768,7168,8192,0,0,2556.5477,a8w8_blockscale_1x128x128_256x128x128x128_16x16_32x32_8x32x1_8x32x1_1x32x1x8_8_1x1_intrawave_v3,1505.27,311.72,0.0
256,32768,8192,1024,0,0,459.5829,a8w8_blockscale_1x128x128_256x128x128x128_16x16_32x32_8x32x1_8x32x1_1x32x1x8_8_1x1_intrawave_v3,1196.21,1259.43,0.0
256,32768,8192,2048,0,0,749.1456,a8w8_blockscale_1x128x128_256x128x128x128_16x16_32x32_8x32x1_8x32x1_1x32x1x8_8_1x1_intrawave_v3,1467.69,828.62,0.0
256,32768,8192,3584,0,0,1251.717,a8w8_blockscale_1x128x128_256x128x128x128_16x16_32x32_8x32x1_8x32x1_1x32x1x8_8_1x1_intrawave_v3,1537.2,546.19,0.0
256,32768,8192,7168,0,0,2579.4122,a8w8_blockscale_1x128x128_256x128x128x128_16x16_32x32_8x32x1_8x32x1_1x32x1x8_8_1x1_intrawave_v3,1491.93,321.96,0.0
256,32768,8192,8192,0,0,2911.5823,a8w8_blockscale_1x128x128_256x128x128x128_16x16_32x32_8x32x1_8x32x1_1x32x1x8_8_1x1_intrawave_v3,1510.53,299.64,0.0
256,32768,8192,28672,14,0,11156.1826,a8w8_blockscale_1x128x128_256x64x256x128_16x16_32x32_8x32x1_8x32x1_1x32x1x8_8_1x1_intrawave_v1,1379.79,153.39,0.0
256,32768,9216,16384,2,0,15626.4597,a8w8_blockscale_1x128x128_256x64x128x128_16x16_32x32_8x32x1_8x32x1_1x32x1x8_8_1x1_intrawave_v3,633.26,82.67,0.0
256,32768,10240,8192,0,0,3612.3136,a8w8_blockscale_1x128x128_256x128x128x128_16x16_32x32_8x32x1_8x32x1_1x32x1x8_8_1x1_intrawave_v3,1521.89,283.31,0.0
256,32768,12800,5120,2,0,7008.7606,a8w8_blockscale_1x128x128_256x64x128x128_16x16_32x32_8x32x1_8x32x1_1x32x1x8_8_1x1_intrawave_v3,612.8,152.98,0.0
256,32768,13312,16384,2,0,22806.0507,a8w8_blockscale_1x128x128_256x64x128x128_16x16_32x32_8x32x1_8x32x1_1x32x1x8_8_1x1_intrawave_v3,626.75,71.36,0.0
256,32768,14336,8192,0,0,5078.737,a8w8_blockscale_1x128x128_256x128x128x128_16x16_32x32_8x32x1_8x32x1_1x32x1x8_8_1x1_intrawave_v3,1515.45,260.97,0.0
256,32768,16384,2048,15,0,3841.5937,a8w8_blockscale_1x128x128_256x64x128x128_16x16_32x32_8x32x1_8x32x1_1x32x1x8_8_1x1_intrawave_v1,572.42,305.71,0.0
256,32768,16384,4096,2,0,7267.8026,a8w8_blockscale_1x128x128_256x64x128x128_16x16_32x32_8x32x1_8x32x1_1x32x1x8_8_1x1_intrawave_v3,605.14,175.44,0.0
256,32768,16384,6656,2,0,11525.2583,a8w8_blockscale_1x128x128_256x64x128x128_16x16_32x32_8x32x1_8x32x1_1x32x1x8_8_1x1_intrawave_v3,620.1,121.55,0.0
256,32768,16384,8192,2,0,14093.7868,a8w8_blockscale_1x128x128_256x64x128x128_16x16_32x32_8x32x1_8x32x1_1x32x1x8_8_1x1_intrawave_v3,624.11,104.76,0.0
256,32768,16384,13312,2,0,23101.7896,a8w8_blockscale_1x128x128_256x64x128x128_16x16_32x32_8x32x1_8x32x1_1x32x1x8_8_1x1_intrawave_v3,618.72,74.8,0.0
256,32768,16384,26624,2,0,45893.4625,a8w8_blockscale_1x128x128_256x64x128x128_16x16_32x32_8x32x1_8x32x1_1x32x1x8_8_1x1_intrawave_v3,622.91,51.91,0.0
256,32768,26624,16384,2,0,46011.2885,a8w8_blockscale_1x128x128_256x64x128x128_16x16_32x32_8x32x1_8x32x1_1x32x1x8_8_1x1_intrawave_v3,621.31,59.07,0.0
256,32768,51200,5120,2,0,29030.5493,a8w8_blockscale_1x128x128_256x64x128x128_16x16_32x32_8x32x1_8x32x1_1x32x1x8_8_1x1_intrawave_v3,591.79,130.39,0.0
256,32768,53248,16384,2,0,91708.7147,a8w8_blockscale_1x128x128_256x64x128x128_16x16_32x32_8x32x1_8x32x1_1x32x1x8_8_1x1_intrawave_v3,623.44,53.42,0.0
256,32768,57344,8192,0,0,19837.1258,a8w8_blockscale_1x128x128_256x128x128x128_16x16_32x32_8x32x1_8x32x1_1x32x1x8_8_1x1_intrawave_v3,1551.95,226.66,0.0
304,1,512,7168,18,0,24.2806,a8w8_blockscale_1x128x128_256x64x64x256_16x16_32x32_16x16x1_16x16x1_1x32x1x8_8_1x1_intrawave_v1,0.3,151.49,0.0
304,1,576,7168,18,0,24.3853,a8w8_blockscale_1x128x128_256x64x64x256_16x16_32x32_16x16x1_16x16x1_1x32x1x8_8_1x1_intrawave_v1,0.34,169.65,0.0
304,1,1280,4096,8,0,14.8239,a8w8_blockscale_1x128x128_256x16x64x256_16x16_16x16_16x16x1_16x16x1_1x16x1x16_4_1x1_intrawave_v1,0.71,354.13,0.0
304,1,1536,7168,18,0,24.5063,a8w8_blockscale_1x128x128_256x64x64x256_16x16_32x32_16x16x1_16x16x1_1x32x1x8_8_1x1_intrawave_v1,0.9,449.69,0.0
304,1,1792,6144,18,0,21.0461,a8w8_blockscale_1x128x128_256x64x64x256_16x16_32x32_16x16x1_16x16x1_1x32x1x8_8_1x1_intrawave_v1,1.05,523.6,0.0
304,1,2112,7168,18,0,24.5804,a8w8_blockscale_1x128x128_256x64x64x256_16x16_32x32_16x16x1_16x16x1_1x32x1x8_8_1x1_intrawave_v1,1.23,616.35,0.0
304,1,2304,4096,8,0,15.1059,a8w8_blockscale_1x128x128_256x16x64x256_16x16_16x16_16x16x1_16x16x1_1x16x1x16_4_1x1_intrawave_v1,1.25,625.31,0.0
304,1,3072,1536,8,0,7.2944,a8w8_blockscale_1x128x128_256x16x64x256_16x16_16x16_16x16x1_16x16x1_1x16x1x16_4_1x1_intrawave_v1,1.29,647.93,0.0
304,1,3584,6144,18,0,21.8423,a8w8_blockscale_1x128x128_256x64x64x256_16x16_32x32_16x16x1_16x16x1_1x32x1x8_8_1x1_intrawave_v1,2.02,1008.75,0.0
304,1,4096,512,8,0,3.5375,a8w8_blockscale_1x128x128_256x16x64x256_16x16_16x16_16x16x1_16x16x1_1x16x1x16_4_1x1_intrawave_v1,1.19,595.29,0.0
304,1,4096,1024,8,0,5.6702,a8w8_blockscale_1x128x128_256x16x64x256_16x16_16x16_16x16x1_16x16x1_1x16x1x16_4_1x1_intrawave_v1,1.48,741.34,0.0
304,1,4096,2048,8,0,8.828,a8w8_blockscale_1x128x128_256x16x64x256_16x16_16x16_16x16x1_16x16x1_1x16x1x16_4_1x1_intrawave_v1,1.9,951.39,0.0
304,1,4608,7168,18,0,25.15,a8w8_blockscale_1x128x128_256x64x64x256_16x16_32x32_16x16x1_16x16x1_1x32x1x8_8_1x1_intrawave_v1,2.63,1313.98,0.0
304,1,6144,1536,8,0,7.8391,a8w8_blockscale_1x128x128_256x16x64x256_16x16_16x16_16x16x1_16x16x1_1x16x1x16_4_1x1_intrawave_v1,2.41,1205.62,0.0
304,1,6144,3072,8,0,12.8591,a8w8_blockscale_1x128x128_256x16x64x256_16x16_16x16_16x16x1_16x16x1_1x16x1x16_4_1x1_intrawave_v1,2.94,1468.98,0.0
304,1,7168,256,8,0,3.1433,a8w8_blockscale_1x128x128_256x16x64x256_16x16_16x16_16x16x1_16x16x1_1x16x1x16_4_1x1_intrawave_v1,1.17,588.43,0.0
304,1,7168,2048,8,0,9.0358,a8w8_blockscale_1x128x128_256x16x64x256_16x16_16x16_16x16x1_16x16x1_1x16x1x16_4_1x1_intrawave_v1,3.25,1626.47,0.0
304,1,7168,2304,8,0,8.7305,a8w8_blockscale_1x128x128_256x16x64x256_16x16_16x16_16x16x1_16x16x1_1x16x1x16_4_1x1_intrawave_v1,3.78,1893.56,0.0
304,2,512,7168,18,0,24.2839,a8w8_blockscale_1x128x128_256x64x64x256_16x16_32x32_16x16x1_16x16x1_1x32x1x8_8_1x1_intrawave_v1,0.6,151.8,0.0
304,2,576,7168,18,0,24.3724,a8w8_blockscale_1x128x128_256x64x64x256_16x16_32x32_16x16x1_16x16x1_1x32x1x8_8_1x1_intrawave_v1,0.68,170.09,0.0
304,2,1280,4096,8,0,14.8732,a8w8_blockscale_1x128x128_256x16x64x256_16x16_16x16_16x16x1_16x16x1_1x16x1x16_4_1x1_intrawave_v1,1.41,353.4,0.0
304,2,1536,7168,18,0,24.4976,a8w8_blockscale_1x128x128_256x64x64x256_16x16_32x32_16x16x1_16x16x1_1x32x1x8_8_1x1_intrawave_v1,1.8,450.27,0.0
304,2,1792,6144,18,0,21.2197,a8w8_blockscale_1x128x128_256x64x64x256_16x16_32x32_16x16x1_16x16x1_1x32x1x8_8_1x1_intrawave_v1,2.08,519.78,0.0
304,2,2112,7168,18,0,24.6868,a8w8_blockscale_1x128x128_256x64x64x256_16x16_32x32_16x16x1_16x16x1_1x32x1x8_8_1x1_intrawave_v1,2.45,614.16,0.0
304,2,2304,4096,8,0,15.2357,a8w8_blockscale_1x128x128_256x16x64x256_16x16_16x16_16x16x1_16x16x1_1x16x1x16_4_1x1_intrawave_v1,2.48,620.56,0.0
304,2,3072,1536,8,0,7.3818,a8w8_blockscale_1x128x128_256x16x64x256_16x16_16x16_16x16x1_16x16x1_1x16x1x16_4_1x1_intrawave_v1,2.56,641.3,0.0
304,2,3584,6144,18,0,21.8972,a8w8_blockscale_1x128x128_256x64x64x256_16x16_32x32_16x16x1_16x16x1_1x32x1x8_8_1x1_intrawave_v1,4.02,1006.83,0.0
304,2,4096,512,8,0,3.5436,a8w8_blockscale_1x128x128_256x16x64x256_16x16_16x16_16x16x1_16x16x1_1x16x1x16_4_1x1_intrawave_v1,2.37,596.73,0.0
304,2,4096,1024,8,0,5.6931,a8w8_blockscale_1x128x128_256x16x64x256_16x16_16x16_16x16x1_16x16x1_1x16x1x16_4_1x1_intrawave_v1,2.95,739.97,0.0
304,2,4096,2048,8,0,8.9087,a8w8_blockscale_1x128x128_256x16x64x256_16x16_16x16_16x16x1_16x16x1_1x16x1x16_4_1x1_intrawave_v1,3.77,943.92,0.0
304,2,4608,7168,18,0,25.1852,a8w8_blockscale_1x128x128_256x64x64x256_16x16_32x32_16x16x1_16x16x1_1x32x1x8_8_1x1_intrawave_v1,5.25,1312.79,0.0
304,2,6144,1536,8,0,7.8174,a8w8_blockscale_1x128x128_256x16x64x256_16x16_16x16_16x16x1_16x16x1_1x16x1x16_4_1x1_intrawave_v1,4.83,1210.74,0.0
304,2,6144,3072,8,0,12.4585,a8w8_blockscale_1x128x128_256x16x64x256_16x16_16x16_16x16x1_16x16x1_1x16x1x16_4_1x1_intrawave_v1,6.06,1517.44,0.0
304,2,7168,256,8,0,3.1509,a8w8_blockscale_1x128x128_256x16x64x256_16x16_16x16_16x16x1_16x16x1_1x16x1x16_4_1x1_intrawave_v1,2.33,591.64,0.0
304,2,7168,2048,8,0,9.1026,a8w8_blockscale_1x128x128_256x16x64x256_16x16_16x16_16x16x1_16x16x1_1x16x1x16_4_1x1_intrawave_v1,6.45,1616.33,0.0
304,2,7168,2304,8,0,8.8977,a8w8_blockscale_1x128x128_256x16x64x256_16x16_16x16_16x16x1_16x16x1_1x16x1x16_4_1x1_intrawave_v1,7.42,1859.85,0.0
304,4,512,7168,18,0,24.3481,a8w8_blockscale_1x128x128_256x64x64x256_16x16_32x32_16x16x1_16x16x1_1x32x1x8_8_1x1_intrawave_v1,1.21,152.08,0.0
304,4,576,7168,18,0,24.4341,a8w8_blockscale_1x128x128_256x64x64x256_16x16_32x32_16x16x1_16x16x1_1x32x1x8_8_1x1_intrawave_v1,1.35,170.34,0.0
304,4,1280,4096,18,0,15.2738,a8w8_blockscale_1x128x128_256x64x64x256_16x16_32x32_16x16x1_16x16x1_1x32x1x8_8_1x1_intrawave_v1,2.75,345.0,0.0
304,4,1536,7168,18,0,24.5536,a8w8_blockscale_1x128x128_256x64x64x256_16x16_32x32_16x16x1_16x16x1_1x32x1x8_8_1x1_intrawave_v1,3.59,450.08,0.0
304,4,1792,6144,18,0,21.2972,a8w8_blockscale_1x128x128_256x64x64x256_16x16_32x32_16x16x1_16x16x1_1x32x1x8_8_1x1_intrawave_v1,4.14,518.8,0.0
304,4,2112,7168,18,0,24.7354,a8w8_blockscale_1x128x128_256x64x64x256_16x16_32x32_16x16x1_16x16x1_1x32x1x8_8_1x1_intrawave_v1,4.9,613.87,0.0
304,4,2304,4096,8,0,15.5634,a8w8_blockscale_1x128x128_256x16x64x256_16x16_16x16_16x16x1_16x16x1_1x16x1x16_4_1x1_intrawave_v1,4.85,608.61,0.0
304,4,3072,1536,8,0,7.4661,a8w8_blockscale_1x128x128_256x16x64x256_16x16_16x16_16x16x1_16x16x1_1x16x1x16_4_1x1_intrawave_v1,5.06,636.12,0.0
304,4,3584,6144,18,0,21.9031,a8w8_blockscale_1x128x128_256x64x64x256_16x16_32x32_16x16x1_16x16x1_1x32x1x8_8_1x1_intrawave_v1,8.04,1007.77,0.0
304,4,4096,512,8,0,3.6052,a8w8_blockscale_1x128x128_256x16x64x256_16x16_16x16_16x16x1_16x16x1_1x16x1x16_4_1x1_intrawave_v1,4.65,591.36,0.0
304,4,4096,1024,8,0,5.7339,a8w8_blockscale_1x128x128_256x16x64x256_16x16_16x16_16x16x1_16x16x1_1x16x1x16_4_1x1_intrawave_v1,5.85,737.92,0.0
304,4,4096,2048,8,0,9.1956,a8w8_blockscale_1x128x128_256x16x64x256_16x16_16x16_16x16x1_16x16x1_1x16x1x16_4_1x1_intrawave_v1,7.3,916.7,0.0
304,4,4608,7168,18,0,25.1543,a8w8_blockscale_1x128x128_256x64x64x256_16x16_32x32_16x16x1_16x16x1_1x32x1x8_8_1x1_intrawave_v1,10.5,1315.71,0.0
304,4,6144,1536,8,0,8.0006,a8w8_blockscale_1x128x128_256x16x64x256_16x16_16x16_16x16x1_16x16x1_1x16x1x16_4_1x1_intrawave_v1,9.44,1186.47,0.0
304,4,6144,3072,8,0,12.6597,a8w8_blockscale_1x128x128_256x16x64x256_16x16_16x16_16x16x1_16x16x1_1x16x1x16_4_1x1_intrawave_v1,11.93,1495.75,0.0
304,4,7168,256,8,0,3.1134,a8w8_blockscale_1x128x128_256x16x64x256_16x16_16x16_16x16x1_16x16x1_1x16x1x16_4_1x1_intrawave_v1,4.72,608.14,0.0
304,4,7168,2048,8,0,9.3497,a8w8_blockscale_1x128x128_256x16x64x256_16x16_16x16_16x16x1_16x16x1_1x16x1x16_4_1x1_intrawave_v1,12.56,1577.12,0.0
304,4,7168,2304,8,0,8.9452,a8w8_blockscale_1x128x128_256x16x64x256_16x16_16x16_16x16x1_16x16x1_1x16x1x16_4_1x1_intrawave_v1,14.77,1853.69,0.0
304,8,512,7168,18,0,24.3641,a8w8_blockscale_1x128x128_256x64x64x256_16x16_32x32_16x16x1_16x16x1_1x32x1x8_8_1x1_intrawave_v1,2.41,153.32,0.0
304,8,576,7168,18,0,24.5019,a8w8_blockscale_1x128x128_256x64x64x256_16x16_32x32_16x16x1_16x16x1_1x32x1x8_8_1x1_intrawave_v1,2.7,171.22,0.0
304,8,1280,4096,18,0,15.1672,a8w8_blockscale_1x128x128_256x64x64x256_16x16_32x32_16x16x1_16x16x1_1x32x1x8_8_1x1_intrawave_v1,5.53,349.18,0.0
304,8,1536,7168,18,0,24.7384,a8w8_blockscale_1x128x128_256x64x64x256_16x16_32x32_16x16x1_16x16x1_1x32x1x8_8_1x1_intrawave_v1,7.12,448.37,0.0
304,8,1792,6144,18,0,21.4283,a8w8_blockscale_1x128x128_256x64x64x256_16x16_32x32_16x16x1_16x16x1_1x32x1x8_8_1x1_intrawave_v1,8.22,517.44,0.0
304,8,2112,7168,18,0,24.7278,a8w8_blockscale_1x128x128_256x64x64x256_16x16_32x32_16x16x1_16x16x1_1x32x1x8_8_1x1_intrawave_v1,9.8,615.9,0.0
304,8,2304,4096,18,0,15.8546,a8w8_blockscale_1x128x128_256x64x64x256_16x16_32x32_16x16x1_16x16x1_1x32x1x8_8_1x1_intrawave_v1,9.52,599.63,0.0
304,8,3072,1536,8,0,7.5635,a8w8_blockscale_1x128x128_256x16x64x256_16x16_16x16_16x16x1_16x16x1_1x16x1x16_4_1x1_intrawave_v1,9.98,631.99,0.0
304,8,3584,6144,18,0,21.9994,a8w8_blockscale_1x128x128_256x64x64x256_16x16_32x32_16x16x1_16x16x1_1x32x1x8_8_1x1_intrawave_v1,16.02,1005.78,0.0
304,8,4096,512,8,0,3.5578,a8w8_blockscale_1x128x128_256x16x64x256_16x16_16x16_16x16x1_16x16x1_1x16x1x16_4_1x1_intrawave_v1,9.43,609.02,0.0
304,8,4096,1024,8,0,5.7996,a8w8_blockscale_1x128x128_256x16x64x256_16x16_16x16_16x16x1_16x16x1_1x16x1x16_4_1x1_intrawave_v1,11.57,735.92,0.0
304,8,4096,2048,8,0,9.5673,a8w8_blockscale_1x128x128_256x16x64x256_16x16_16x16_16x16x1_16x16x1_1x16x1x16_4_1x1_intrawave_v1,14.03,885.36,0.0
304,8,4608,7168,18,0,25.2843,a8w8_blockscale_1x128x128_256x64x64x256_16x16_32x32_16x16x1_16x16x1_1x32x1x8_8_1x1_intrawave_v1,20.9,1311.53,0.0
304,8,6144,1536,8,0,8.0826,a8w8_blockscale_1x128x128_256x16x64x256_16x16_16x16_16x16x1_16x16x1_1x16x1x16_4_1x1_intrawave_v1,18.68,1181.28,0.0
304,8,6144,3072,8,0,12.8513,a8w8_blockscale_1x128x128_256x16x64x256_16x16_16x16_16x16x1_16x16x1_1x16x1x16_4_1x1_intrawave_v1,23.5,1478.24,0.0
304,8,7168,256,8,0,3.2018,a8w8_blockscale_1x128x128_256x16x64x256_16x16_16x16_16x16x1_16x16x1_1x16x1x16_4_1x1_intrawave_v1,9.17,609.58,0.0
304,8,7168,2048,8,0,9.302,a8w8_blockscale_1x128x128_256x16x64x256_16x16_16x16_16x16x1_16x16x1_1x16x1x16_4_1x1_intrawave_v1,25.25,1592.25,0.0
304,8,7168,2304,8,0,8.9653,a8w8_blockscale_1x128x128_256x16x64x256_16x16_16x16_16x16x1_16x16x1_1x16x1x16_4_1x1_intrawave_v1,29.47,1856.96,0.0
304,16,512,7168,8,0,18.3741,a8w8_blockscale_1x128x128_256x16x64x256_16x16_16x16_16x16x1_16x16x1_1x16x1x16_4_1x1_intrawave_v1,6.39,206.87,0.0
304,16,576,7168,8,0,18.445,a8w8_blockscale_1x128x128_256x16x64x256_16x16_16x16_16x16x1_16x16x1_1x16x1x16_4_1x1_intrawave_v1,7.16,231.06,0.0
304,16,1280,4096,8,0,12.754,a8w8_blockscale_1x128x128_256x16x64x256_16x16_16x16_16x16x1_16x16x1_1x16x1x16_4_1x1_intrawave_v1,13.15,419.43,0.0
304,16,1536,7168,8,0,19.3027,a8w8_blockscale_1x128x128_256x16x64x256_16x16_16x16_16x16x1_16x16x1_1x16x1x16_4_1x1_intrawave_v1,18.25,578.88,0.0
304,16,1792,6144,8,0,17.3194,a8w8_blockscale_1x128x128_256x16x64x256_16x16_16x16_16x16x1_16x16x1_1x16x1x16_4_1x1_intrawave_v1,20.34,644.69,0.0
304,16,2112,7168,8,0,19.8416,a8w8_blockscale_1x128x128_256x16x64x256_16x16_16x16_16x16x1_16x16x1_1x16x1x16_4_1x1_intrawave_v1,24.42,772.17,0.0
304,16,2304,4096,8,0,12.9755,a8w8_blockscale_1x128x128_256x16x64x256_16x16_16x16_16x16x1_16x16x1_1x16x1x16_4_1x1_intrawave_v1,23.27,738.04,0.0
304,16,3072,1536,8,0,6.3665,a8w8_blockscale_1x128x128_256x16x64x256_16x16_16x16_16x16x1_16x16x1_1x16x1x16_4_1x1_intrawave_v1,23.72,760.46,0.0
304,16,3584,6144,8,0,18.1177,a8w8_blockscale_1x128x128_256x16x64x256_16x16_16x16_16x16x1_16x16x1_1x16x1x16_4_1x1_intrawave_v1,38.89,1227.15,0.0
304,16,4096,512,8,0,3.5722,a8w8_blockscale_1x128x128_256x16x64x256_16x16_16x16_16x16x1_16x16x1_1x16x1x16_4_1x1_intrawave_v1,18.79,626.06,0.0
304,16,4096,1024,8,0,5.3116,a8w8_blockscale_1x128x128_256x16x64x256_16x16_16x16_16x16x1_16x16x1_1x16x1x16_4_1x1_intrawave_v1,25.27,817.41,0.0
304,16,4096,2048,8,0,8.3633,a8w8_blockscale_1x128x128_256x16x64x256_16x16_16x16_16x16x1_16x16x1_1x16x1x16_4_1x1_intrawave_v1,32.1,1022.62,0.0
304,16,4608,7168,8,0,20.1448,a8w8_blockscale_1x128x128_256x16x64x256_16x16_16x16_16x16x1_16x16x1_1x16x1x16_4_1x1_intrawave_v1,52.47,1652.65,0.0
304,16,6144,1536,8,0,7.1777,a8w8_blockscale_1x128x128_256x16x64x256_16x16_16x16_16x16x1_16x16x1_1x16x1x16_4_1x1_intrawave_v1,42.07,1345.61,0.0
304,16,6144,3072,8,0,10.7671,a8w8_blockscale_1x128x128_256x16x64x256_16x16_16x16_16x16x1_16x16x1_1x16x1x16_4_1x1_intrawave_v1,56.09,1775.79,0.0
304,16,7168,256,8,0,3.1241,a8w8_blockscale_1x128x128_256x16x64x256_16x16_16x16_16x16x1_16x16x1_1x16x1x16_4_1x1_intrawave_v1,18.8,662.1,0.0
304,16,7168,2048,8,0,8.331,a8w8_blockscale_1x128x128_256x16x64x256_16x16_16x16_16x16x1_16x16x1_1x16x1x16_4_1x1_intrawave_v1,56.39,1793.57,0.0
304,16,7168,2304,8,0,8.1794,a8w8_blockscale_1x128x128_256x16x64x256_16x16_16x16_16x16x1_16x16x1_1x16x1x16_4_1x1_intrawave_v1,64.61,2051.66,0.0
304,24,512,7168,18,0,24.6568,a8w8_blockscale_1x128x128_256x64x64x256_16x16_32x32_16x16x1_16x16x1_1x32x1x8_8_1x1_intrawave_v1,7.14,156.82,0.0
304,24,576,7168,18,0,24.637,a8w8_blockscale_1x128x128_256x64x64x256_16x16_32x32_16x16x1_16x16x1_1x32x1x8_8_1x1_intrawave_v1,8.04,175.69,0.0
304,24,1280,4096,8,0,15.6131,a8w8_blockscale_1x128x128_256x16x64x256_16x16_16x16_16x16x1_16x16x1_1x16x1x16_4_1x1_intrawave_v1,16.12,346.03,0.0
304,24,1536,7168,18,0,24.9202,a8w8_blockscale_1x128x128_256x64x64x256_16x16_32x32_16x16x1_16x16x1_1x32x1x8_8_1x1_intrawave_v1,21.21,451.67,0.0
304,24,1792,6144,18,0,21.8418,a8w8_blockscale_1x128x128_256x64x64x256_16x16_32x32_16x16x1_16x16x1_1x32x1x8_8_1x1_intrawave_v1,24.2,514.77,0.0
304,24,2112,7168,18,0,25.0439,a8w8_blockscale_1x128x128_256x64x64x256_16x16_32x32_16x16x1_16x16x1_1x32x1x8_8_1x1_intrawave_v1,29.02,615.41,0.0
304,24,2304,4096,8,0,16.0769,a8w8_blockscale_1x128x128_256x16x64x256_16x16_16x16_16x16x1_16x16x1_1x16x1x16_4_1x1_intrawave_v1,28.18,600.0,0.0
304,24,3072,1536,8,0,7.6532,a8w8_blockscale_1x128x128_256x16x64x256_16x16_16x16_16x16x1_16x16x1_1x16x1x16_4_1x1_intrawave_v1,29.59,640.64,0.0
304,24,3584,6144,18,0,22.49,a8w8_blockscale_1x128x128_256x64x64x256_16x16_32x32_16x16x1_16x16x1_1x32x1x8_8_1x1_intrawave_v1,47.0,993.31,0.0
304,24,4096,512,8,0,3.7528,a8w8_blockscale_1x128x128_256x16x64x256_16x16_16x16_16x16x1_16x16x1_1x16x1x16_4_1x1_intrawave_v1,26.82,614.49,0.0
304,24,4096,1024,8,0,5.8865,a8w8_blockscale_1x128x128_256x16x64x256_16x16_16x16_16x16x1_16x16x1_1x16x1x16_4_1x1_intrawave_v1,34.2,750.1,0.0
304,24,4096,2048,8,0,9.2276,a8w8_blockscale_1x128x128_256x16x64x256_16x16_16x16_16x16x1_16x16x1_1x16x1x16_4_1x1_intrawave_v1,43.64,935.71,0.0
304,24,4608,7168,18,0,25.6195,a8w8_blockscale_1x128x128_256x64x64x256_16x16_32x32_16x16x1_16x16x1_1x32x1x8_8_1x1_intrawave_v1,61.88,1304.61,0.0
304,24,6144,1536,8,0,7.9623,a8w8_blockscale_1x128x128_256x16x64x256_16x16_16x16_16x16x1_16x16x1_1x16x1x16_4_1x1_intrawave_v1,56.89,1226.9,0.0
304,24,6144,3072,8,0,12.921,a8w8_blockscale_1x128x128_256x16x64x256_16x16_16x16_16x16x1_16x16x1_1x16x1x16_4_1x1_intrawave_v1,70.12,1489.28,0.0
304,24,7168,256,8,0,3.4584,a8w8_blockscale_1x128x128_256x16x64x256_16x16_16x16_16x16x1_16x16x1_1x16x1x16_4_1x1_intrawave_v1,25.47,631.86,0.0
304,24,7168,2048,8,0,9.3024,a8w8_blockscale_1x128x128_256x16x64x256_16x16_16x16_16x16x1_16x16x1_1x16x1x16_4_1x1_intrawave_v1,75.75,1620.36,0.0
304,24,7168,2304,8,0,9.0078,a8w8_blockscale_1x128x128_256x16x64x256_16x16_16x16_16x16x1_16x16x1_1x16x1x16_4_1x1_intrawave_v1,88.0,1877.75,0.0
304,32,512,7168,8,0,18.2864,a8w8_blockscale_1x128x128_256x16x64x256_16x16_16x16_16x16x1_16x16x1_1x16x1x16_4_1x1_intrawave_v1,12.84,215.03,0.0
304,32,576,7168,8,0,18.3357,a8w8_blockscale_1x128x128_256x16x64x256_16x16_16x16_16x16x1_16x16x1_1x16x1x16_4_1x1_intrawave_v1,14.41,239.7,0.0
304,32,1280,4096,8,0,12.7344,a8w8_blockscale_1x128x128_256x16x64x256_16x16_16x16_16x16x1_16x16x1_1x16x1x16_4_1x1_intrawave_v1,26.35,428.44,0.0
304,32,1536,7168,8,0,19.3628,a8w8_blockscale_1x128x128_256x16x64x256_16x16_16x16_16x16x1_16x16x1_1x16x1x16_4_1x1_intrawave_v1,36.39,585.54,0.0
304,32,1792,6144,8,0,17.1836,a8w8_blockscale_1x128x128_256x16x64x256_16x16_16x16_16x16x1_16x16x1_1x16x1x16_4_1x1_intrawave_v1,41.01,658.85,0.0
304,32,2112,7168,8,0,19.8285,a8w8_blockscale_1x128x128_256x16x64x256_16x16_16x16_16x16x1_16x16x1_1x16x1x16_4_1x1_intrawave_v1,48.86,781.87,0.0
304,32,2304,4096,8,0,13.0334,a8w8_blockscale_1x128x128_256x16x64x256_16x16_16x16_16x16x1_16x16x1_1x16x1x16_4_1x1_intrawave_v1,46.34,745.45,0.0
304,32,3072,1536,8,0,6.7229,a8w8_blockscale_1x128x128_256x16x64x256_16x16_16x16_16x16x1_16x16x1_1x16x1x16_4_1x1_intrawave_v1,44.92,738.42,0.0
304,32,3584,6144,8,0,17.8642,a8w8_blockscale_1x128x128_256x16x64x256_16x16_16x16_16x16x1_16x16x1_1x16x1x16_4_1x1_intrawave_v1,78.89,1256.48,0.0
304,32,4096,512,8,0,3.7103,a8w8_blockscale_1x128x128_256x16x64x256_16x16_16x16_16x16x1_16x16x1_1x16x1x16_4_1x1_intrawave_v1,36.17,640.29,0.0
304,32,4096,1024,8,0,5.8866,a8w8_blockscale_1x128x128_256x16x64x256_16x16_16x16_16x16x1_16x16x1_1x16x1x16_4_1x1_intrawave_v1,45.6,762.62,0.0
304,32,4096,2048,8,0,8.5722,a8w8_blockscale_1x128x128_256x16x64x256_16x16_16x16_16x16x1_16x16x1_1x16x1x16_4_1x1_intrawave_v1,62.63,1016.81,0.0
304,32,4608,7168,8,0,20.0214,a8w8_blockscale_1x128x128_256x16x64x256_16x16_16x16_16x16x1_16x16x1_1x16x1x16_4_1x1_intrawave_v1,105.58,1675.93,0.0
304,32,6144,1536,8,0,7.7541,a8w8_blockscale_1x128x128_256x16x64x256_16x16_16x16_16x16x1_16x16x1_1x16x1x16_4_1x1_intrawave_v1,77.89,1274.11,0.0
304,32,6144,3072,8,0,10.8685,a8w8_blockscale_1x128x128_256x16x64x256_16x16_16x16_16x16x1_16x16x1_1x16x1x16_4_1x1_intrawave_v1,111.14,1781.84,0.0
304,32,7168,256,8,0,3.3976,a8w8_blockscale_1x128x128_256x16x64x256_16x16_16x16_16x16x1_16x16x1_1x16x1x16_4_1x1_intrawave_v1,34.57,677.52,0.0
304,32,7168,2048,8,0,8.2533,a8w8_blockscale_1x128x128_256x16x64x256_16x16_16x16_16x16x1_16x16x1_1x16x1x16_4_1x1_intrawave_v1,113.84,1842.21,0.0
304,32,7168,2304,8,0,8.7193,a8w8_blockscale_1x128x128_256x16x64x256_16x16_16x16_16x16x1_16x16x1_1x16x1x16_4_1x1_intrawave_v1,121.22,1955.15,0.0
304,40,512,7168,8,0,24.8929,a8w8_blockscale_1x128x128_256x16x64x256_16x16_16x16_16x16x1_16x16x1_1x16x1x16_4_1x1_intrawave_v1,11.79,160.6,0.0
304,40,576,7168,8,0,24.7189,a8w8_blockscale_1x128x128_256x16x64x256_16x16_16x16_16x16x1_16x16x1_1x16x1x16_4_1x1_intrawave_v1,13.36,180.49,0.0
304,40,1280,4096,8,0,15.5313,a8w8_blockscale_1x128x128_256x16x64x256_16x16_16x16_16x16x1_16x16x1_1x16x1x16_4_1x1_intrawave_v1,27.01,354.71,0.0
304,40,1536,7168,18,0,25.2946,a8w8_blockscale_1x128x128_256x64x64x256_16x16_32x32_16x16x1_16x16x1_1x32x1x8_8_1x1_intrawave_v1,34.82,451.47,0.0
304,40,1792,6144,18,0,22.2815,a8w8_blockscale_1x128x128_256x64x64x256_16x16_32x32_16x16x1_16x16x1_1x32x1x8_8_1x1_intrawave_v1,39.53,511.6,0.0
304,40,2112,7168,18,0,25.3333,a8w8_blockscale_1x128x128_256x64x64x256_16x16_32x32_16x16x1_16x16x1_1x32x1x8_8_1x1_intrawave_v1,47.81,615.57,0.0
304,40,2304,4096,8,0,15.6808,a8w8_blockscale_1x128x128_256x16x64x256_16x16_16x16_16x16x1_16x16x1_1x16x1x16_4_1x1_intrawave_v1,48.15,624.03,0.0
304,40,3072,1536,8,0,7.9668,a8w8_blockscale_1x128x128_256x16x64x256_16x16_16x16_16x16x1_16x16x1_1x16x1x16_4_1x1_intrawave_v1,47.38,630.84,0.0
304,40,3584,6144,18,0,22.9942,a8w8_blockscale_1x128x128_256x64x64x256_16x16_32x32_16x16x1_16x16x1_1x32x1x8_8_1x1_intrawave_v1,76.61,980.79,0.0
304,40,4096,512,8,0,4.4006,a8w8_blockscale_1x128x128_256x16x64x256_16x16_16x16_16x16x1_16x16x1_1x16x1x16_4_1x1_intrawave_v1,38.12,555.68,0.0
304,40,4096,1024,8,0,6.3673,a8w8_blockscale_1x128x128_256x16x64x256_16x16_16x16_16x16x1_16x16x1_1x16x1x16_4_1x1_intrawave_v1,52.7,716.62,0.0
304,40,4096,2048,8,0,9.5871,a8w8_blockscale_1x128x128_256x16x64x256_16x16_16x16_16x16x1_16x16x1_1x16x1x16_4_1x1_intrawave_v1,70.0,917.71,0.0
304,40,4608,7168,18,0,25.8122,a8w8_blockscale_1x128x128_256x64x64x256_16x16_32x32_16x16x1_16x16x1_1x32x1x8_8_1x1_intrawave_v1,102.37,1305.02,0.0
304,40,6144,1536,8,0,8.5245,a8w8_blockscale_1x128x128_256x16x64x256_16x16_16x16_16x16x1_16x16x1_1x16x1x16_4_1x1_intrawave_v1,88.57,1171.93,0.0
304,40,6144,3072,8,0,14.154,a8w8_blockscale_1x128x128_256x16x64x256_16x16_16x16_16x16x1_16x16x1_1x16x1x16_4_1x1_intrawave_v1,106.68,1376.91,0.0
304,40,7168,256,11,0,4.4028,a8w8_blockscale_1x128x128_256x32x64x128_16x16_16x16_8x32x1_8x32x1_1x32x1x8_8_2x1_intrawave_v1,33.34,549.35,0.0
304,40,7168,2048,18,0,10.8236,a8w8_blockscale_1x128x128_256x64x64x256_16x16_32x32_16x16x1_16x16x1_1x32x1x8_8_1x1_intrawave_v1,108.5,1416.85,0.0
304,40,7168,2304,18,0,11.0138,a8w8_blockscale_1x128x128_256x64x64x256_16x16_32x32_16x16x1_16x16x1_1x32x1x8_8_1x1_intrawave_v1,119.96,1559.92,0.0
304,48,512,7168,8,0,18.8072,a8w8_blockscale_1x128x128_256x16x64x256_16x16_16x16_16x16x1_16x16x1_1x16x1x16_4_1x1_intrawave_v1,18.73,216.05,0.0
304,48,576,7168,8,0,19.0369,a8w8_blockscale_1x128x128_256x16x64x256_16x16_16x16_16x16x1_16x16x1_1x16x1x16_4_1x1_intrawave_v1,20.82,237.86,0.0
304,48,1280,4096,8,0,12.8433,a8w8_blockscale_1x128x128_256x16x64x256_16x16_16x16_16x16x1_16x16x1_1x16x1x16_4_1x1_intrawave_v1,39.19,433.09,0.0
304,48,1536,7168,8,0,19.289,a8w8_blockscale_1x128x128_256x16x64x256_16x16_16x16_16x16x1_16x16x1_1x16x1x16_4_1x1_intrawave_v1,54.8,596.28,0.0
304,48,1792,6144,8,0,16.898,a8w8_blockscale_1x128x128_256x16x64x256_16x16_16x16_16x16x1_16x16x1_1x16x1x16_4_1x1_intrawave_v1,62.55,679.19,0.0
304,48,2112,7168,8,0,19.5481,a8w8_blockscale_1x128x128_256x16x64x256_16x16_16x16_16x16x1_16x16x1_1x16x1x16_4_1x1_intrawave_v1,74.35,802.41,0.0
304,48,2304,4096,8,0,12.8294,a8w8_blockscale_1x128x128_256x16x64x256_16x16_16x16_16x16x1_16x16x1_1x16x1x16_4_1x1_intrawave_v1,70.62,768.16,0.0
304,48,3072,1536,8,0,7.0426,a8w8_blockscale_1x128x128_256x16x64x256_16x16_16x16_16x16x1_16x16x1_1x16x1x16_4_1x1_intrawave_v1,64.32,722.35,0.0
304,48,3584,6144,8,0,17.716,a8w8_blockscale_1x128x128_256x16x64x256_16x16_16x16_16x16x1_16x16x1_1x16x1x16_4_1x1_intrawave_v1,119.32,1279.02,0.0
304,48,4096,512,8,0,4.3779,a8w8_blockscale_1x128x128_256x16x64x256_16x16_16x16_16x16x1_16x16x1_1x16x1x16_4_1x1_intrawave_v1,45.99,574.46,0.0
304,48,4096,1024,8,0,5.8938,a8w8_blockscale_1x128x128_256x16x64x256_16x16_16x16_16x16x1_16x16x1_1x16x1x16_4_1x1_intrawave_v1,68.32,786.7,0.0
304,48,4096,2048,8,0,8.2667,a8w8_blockscale_1x128x128_256x16x64x256_16x16_16x16_16x16x1_16x16x1_1x16x1x16_4_1x1_intrawave_v1,97.42,1074.2,0.0
304,48,4608,7168,8,0,20.2048,a8w8_blockscale_1x128x128_256x16x64x256_16x16_16x16_16x16x1_16x16x1_1x16x1x16_4_1x1_intrawave_v1,156.94,1673.69,0.0
304,48,6144,1536,8,0,7.7987,a8w8_blockscale_1x128x128_256x16x64x256_16x16_16x16_16x16x1_16x16x1_1x16x1x16_4_1x1_intrawave_v1,116.17,1295.18,0.0
304,48,6144,3072,8,0,12.0958,a8w8_blockscale_1x128x128_256x16x64x256_16x16_16x16_16x16x1_16x16x1_1x16x1x16_4_1x1_intrawave_v1,149.8,1621.36,0.0
304,48,7168,256,8,0,4.3291,a8w8_blockscale_1x128x128_256x16x64x256_16x16_16x16_16x16x1_16x16x1_1x16x1x16_4_1x1_intrawave_v1,40.69,585.67,0.0
304,48,7168,2048,7,0,10.7247,a8w8_blockscale_1x128x128_256x16x128x256_16x16_16x16_16x16x1_16x16x1_1x16x1x16_8_1x2_intrawave_v1,131.41,1442.14,0.0
304,48,7168,2304,7,0,10.6998,a8w8_blockscale_1x128x128_256x16x128x256_16x16_16x16_16x16x1_16x16x1_1x16x1x16_8_1x2_intrawave_v1,148.18,1618.14,0.0
304,56,512,7168,8,0,23.9607,a8w8_blockscale_1x128x128_256x16x64x256_16x16_16x16_16x16x1_16x16x1_1x16x1x16_4_1x1_intrawave_v1,17.15,172.31,0.0
304,56,576,7168,8,0,24.5241,a8w8_blockscale_1x128x128_256x16x64x256_16x16_16x16_16x16x1_16x16x1_1x16x1x16_4_1x1_intrawave_v1,18.86,187.35,0.0
304,56,1280,4096,8,0,15.0606,a8w8_blockscale_1x128x128_256x16x64x256_16x16_16x16_16x16x1_16x16x1_1x16x1x16_4_1x1_intrawave_v1,38.99,372.87,0.0
304,56,1536,7168,8,0,25.1465,a8w8_blockscale_1x128x128_256x16x64x256_16x16_16x16_16x16x1_16x16x1_1x16x1x16_4_1x1_intrawave_v1,49.04,460.64,0.0
304,56,1792,6144,8,0,21.9198,a8w8_blockscale_1x128x128_256x16x64x256_16x16_16x16_16x16x1_16x16x1_1x16x1x16_4_1x1_intrawave_v1,56.26,527.14,0.0
304,56,2112,7168,8,0,25.3505,a8w8_blockscale_1x128x128_256x16x64x256_16x16_16x16_16x16x1_16x16x1_1x16x1x16_4_1x1_intrawave_v1,66.88,622.35,0.0
304,56,2304,4096,8,0,15.5229,a8w8_blockscale_1x128x128_256x16x64x256_16x16_16x16_16x16x1_16x16x1_1x16x1x16_4_1x1_intrawave_v1,68.09,639.35,0.0
304,56,3072,1536,8,0,7.8123,a8w8_blockscale_1x128x128_256x16x64x256_16x16_16x16_16x16x1_16x16x1_1x16x1x16_4_1x1_intrawave_v1,67.65,659.05,0.0
304,56,3584,6144,8,0,22.391,a8w8_blockscale_1x128x128_256x16x64x256_16x16_16x16_16x16x1_16x16x1_1x16x1x16_4_1x1_intrawave_v1,110.14,1016.73,0.0
304,56,4096,512,8,0,4.5067,a8w8_blockscale_1x128x128_256x16x64x256_16x16_16x16_16x16x1_16x16x1_1x16x1x16_4_1x1_intrawave_v1,52.12,573.5,0.0
304,56,4096,1024,8,0,6.3851,a8w8_blockscale_1x128x128_256x16x64x256_16x16_16x16_16x16x1_16x16x1_1x16x1x16_4_1x1_intrawave_v1,73.57,737.72,0.0
304,56,4096,2048,8,0,9.1369,a8w8_blockscale_1x128x128_256x16x64x256_16x16_16x16_16x16x1_16x16x1_1x16x1x16_4_1x1_intrawave_v1,102.83,980.86,0.0
304,56,4608,7168,8,0,26.6839,a8w8_blockscale_1x128x128_256x16x64x256_16x16_16x16_16x16x1_16x16x1_1x16x1x16_4_1x1_intrawave_v1,138.64,1272.21,0.0
304,56,6144,1536,8,0,9.5858,a8w8_blockscale_1x128x128_256x16x64x256_16x16_16x16_16x16x1_16x16x1_1x16x1x16_4_1x1_intrawave_v1,110.26,1065.26,0.0
304,56,6144,3072,18,0,14.4942,a8w8_blockscale_1x128x128_256x64x64x256_16x16_32x32_16x16x1_16x16x1_1x32x1x8_8_1x1_intrawave_v1,145.85,1361.55,0.0
304,56,7168,256,11,0,4.4965,a8w8_blockscale_1x128x128_256x32x64x128_16x16_16x16_8x32x1_8x32x1_1x32x1x8_8_2x1_intrawave_v1,45.71,589.83,0.0
304,56,7168,2048,18,0,11.3532,a8w8_blockscale_1x128x128_256x64x64x256_16x16_32x32_16x16x1_16x16x1_1x32x1x8_8_1x1_intrawave_v1,144.82,1373.85,0.0
304,56,7168,2304,18,0,10.7625,a8w8_blockscale_1x128x128_256x64x64x256_16x16_32x32_16x16x1_16x16x1_1x32x1x8_8_1x1_intrawave_v1,171.86,1621.08,0.0
304,64,512,7168,8,0,17.8974,a8w8_blockscale_1x128x128_256x16x64x256_16x16_16x16_16x16x1_16x16x1_1x16x1x16_4_1x1_intrawave_v1,26.25,234.35,0.0
304,64,576,7168,8,0,17.8133,a8w8_blockscale_1x128x128_256x16x64x256_16x16_16x16_16x16x1_16x16x1_1x16x1x16_4_1x1_intrawave_v1,29.67,261.67,0.0
304,64,1280,4096,8,0,12.9579,a8w8_blockscale_1x128x128_256x16x64x256_16x16_16x16_16x16x1_16x16x1_1x16x1x16_4_1x1_intrawave_v1,51.79,437.48,0.0
304,64,1536,7168,8,0,18.7255,a8w8_blockscale_1x128x128_256x16x64x256_16x16_16x16_16x16x1_16x16x1_1x16x1x16_4_1x1_intrawave_v1,75.26,622.97,0.0
304,64,1792,6144,8,0,16.7716,a8w8_blockscale_1x128x128_256x16x64x256_16x16_16x16_16x16x1_16x16x1_1x16x1x16_4_1x1_intrawave_v1,84.03,693.59,0.0
304,64,2112,7168,8,0,19.115,a8w8_blockscale_1x128x128_256x16x64x256_16x16_16x16_16x16x1_16x16x1_1x16x1x16_4_1x1_intrawave_v1,101.37,830.13,0.0
304,64,2304,4096,8,0,12.5667,a8w8_blockscale_1x128x128_256x16x64x256_16x16_16x16_16x16x1_16x16x1_1x16x1x16_4_1x1_intrawave_v1,96.12,795.3,0.0
304,64,3072,1536,8,0,7.0735,a8w8_blockscale_1x128x128_256x16x64x256_16x16_16x16_16x16x1_16x16x1_1x16x1x16_4_1x1_intrawave_v1,85.39,736.57,0.0
304,64,3584,6144,8,0,17.5074,a8w8_blockscale_1x128x128_256x16x64x256_16x16_16x16_16x16x1_16x16x1_1x16x1x16_4_1x1_intrawave_v1,160.99,1306.42,0.0
304,64,4096,512,13,0,4.2947,a8w8_blockscale_1x128x128_256x32x64x256_16x16_16x16_16x16x1_16x16x1_1x32x1x8_8_2x1_intrawave_v1,62.5,618.02,0.0
304,64,4096,1024,8,0,5.8461,a8w8_blockscale_1x128x128_256x16x64x256_16x16_16x16_16x16x1_16x16x1_1x16x1x16_4_1x1_intrawave_v1,91.83,818.35,0.0
304,64,4096,2048,8,0,8.4098,a8w8_blockscale_1x128x128_256x16x64x256_16x16_16x16_16x16x1_16x16x1_1x16x1x16_4_1x1_intrawave_v1,127.68,1075.41,0.0
304,64,4608,7168,8,0,21.9147,a8w8_blockscale_1x128x128_256x16x64x256_16x16_16x16_16x16x1_16x16x1_1x16x1x16_4_1x1_intrawave_v1,192.92,1555.06,0.0
304,64,6144,1536,13,0,9.2573,a8w8_blockscale_1x128x128_256x32x64x256_16x16_16x16_16x16x1_16x16x1_1x32x1x8_8_2x1_intrawave_v1,130.49,1115.0,0.0
304,64,6144,3072,8,0,14.4552,a8w8_blockscale_1x128x128_256x16x64x256_16x16_16x16_16x16x1_16x16x1_1x16x1x16_4_1x1_intrawave_v1,167.13,1373.72,0.0
304,64,7168,256,13,0,4.0987,a8w8_blockscale_1x128x128_256x32x64x256_16x16_16x16_16x16x1_16x16x1_1x32x1x8_8_2x1_intrawave_v1,57.31,675.55,0.0
304,64,7168,2048,18,0,11.203,a8w8_blockscale_1x128x128_256x64x64x256_16x16_32x32_16x16x1_16x16x1_1x32x1x8_8_1x1_intrawave_v1,167.73,1403.97,0.0
304,64,7168,2304,18,0,10.5805,a8w8_blockscale_1x128x128_256x64x64x256_16x16_32x32_16x16x1_16x16x1_1x32x1x8_8_1x1_intrawave_v1,199.79,1661.55,0.0
304,72,512,7168,8,0,23.6619,a8w8_blockscale_1x128x128_256x16x64x256_16x16_16x16_16x16x1_16x16x1_1x16x1x16_4_1x1_intrawave_v1,22.33,180.03,0.0
304,72,576,7168,8,0,23.9908,a8w8_blockscale_1x128x128_256x16x64x256_16x16_16x16_16x16x1_16x16x1_1x16x1x16_4_1x1_intrawave_v1,24.78,197.07,0.0
304,72,1280,4096,8,0,14.7874,a8w8_blockscale_1x128x128_256x16x64x256_16x16_16x16_16x16x1_16x16x1_1x16x1x16_4_1x1_intrawave_v1,51.06,386.96,0.0
304,72,1536,7168,18,0,24.7615,a8w8_blockscale_1x128x128_256x64x64x256_16x16_32x32_16x16x1_16x16x1_1x32x1x8_8_1x1_intrawave_v1,64.03,474.42,0.0
304,72,1792,6144,8,0,21.4568,a8w8_blockscale_1x128x128_256x16x64x256_16x16_16x16_16x16x1_16x16x1_1x16x1x16_4_1x1_intrawave_v1,73.89,545.77,0.0
304,72,2112,7168,18,0,24.8241,a8w8_blockscale_1x128x128_256x64x64x256_16x16_32x32_16x16x1_16x16x1_1x32x1x8_8_1x1_intrawave_v1,87.82,642.88,0.0
304,72,2304,4096,8,0,15.2337,a8w8_blockscale_1x128x128_256x16x64x256_16x16_16x16_16x16x1_16x16x1_1x16x1x16_4_1x1_intrawave_v1,89.21,660.63,0.0
304,72,3072,1536,8,0,7.8482,a8w8_blockscale_1x128x128_256x16x64x256_16x16_16x16_16x16x1_16x16x1_1x16x1x16_4_1x1_intrawave_v1,86.58,671.69,0.0
304,72,3584,6144,18,0,22.5205,a8w8_blockscale_1x128x128_256x64x64x256_16x16_32x32_16x16x1_16x16x1_1x32x1x8_8_1x1_intrawave_v1,140.8,1020.34,0.0
304,72,4096,512,13,0,5.1053,a8w8_blockscale_1x128x128_256x32x64x256_16x16_16x16_16x16x1_16x16x1_1x32x1x8_8_2x1_intrawave_v1,59.15,533.53,0.0
304,72,4096,1024,13,0,7.3489,a8w8_blockscale_1x128x128_256x32x64x256_16x16_16x16_16x16x1_16x16x1_1x32x1x8_8_2x1_intrawave_v1,82.19,661.03,0.0
304,72,4096,2048,18,0,10.5452,a8w8_blockscale_1x128x128_256x64x64x256_16x16_32x32_16x16x1_16x16x1_1x32x1x8_8_1x1_intrawave_v1,114.55,865.41,0.0
304,72,4608,7168,18,0,25.9308,a8w8_blockscale_1x128x128_256x64x64x256_16x16_32x32_16x16x1_16x16x1_1x32x1x8_8_1x1_intrawave_v1,183.42,1319.27,0.0
304,72,6144,1536,13,0,9.9205,a8w8_blockscale_1x128x128_256x32x64x256_16x16_16x16_16x16x1_16x16x1_1x32x1x8_8_2x1_intrawave_v1,136.98,1051.61,0.0
304,72,6144,3072,18,0,15.3318,a8w8_blockscale_1x128x128_256x64x64x256_16x16_32x32_16x16x1_16x16x1_1x32x1x8_8_1x1_intrawave_v1,177.27,1303.19,0.0
304,72,7168,256,8,0,4.7697,a8w8_blockscale_1x128x128_256x16x64x256_16x16_16x16_16x16x1_16x16x1_1x16x1x16_4_1x1_intrawave_v1,55.4,604.99,0.0
304,72,7168,2048,18,0,12.5637,a8w8_blockscale_1x128x128_256x64x64x256_16x16_32x32_16x16x1_16x16x1_1x32x1x8_8_1x1_intrawave_v1,168.26,1262.34,0.0
304,72,7168,2304,18,0,13.6707,a8w8_blockscale_1x128x128_256x64x64x256_16x16_32x32_16x16x1_16x16x1_1x32x1x8_8_1x1_intrawave_v1,173.96,1295.7,0.0
304,80,512,7168,8,0,18.3237,a8w8_blockscale_1x128x128_256x16x64x256_16x16_16x16_16x16x1_16x16x1_1x16x1x16_4_1x1_intrawave_v1,32.05,236.05,0.0
304,80,576,7168,8,0,18.5767,a8w8_blockscale_1x128x128_256x16x64x256_16x16_16x16_16x16x1_16x16x1_1x16x1x16_4_1x1_intrawave_v1,35.56,258.09,0.0
304,80,1280,4096,8,0,13.0147,a8w8_blockscale_1x128x128_256x16x64x256_16x16_16x16_16x16x1_16x16x1_1x16x1x16_4_1x1_intrawave_v1,64.45,443.76,0.0
304,80,1536,7168,8,0,18.6552,a8w8_blockscale_1x128x128_256x16x64x256_16x16_16x16_16x16x1_16x16x1_1x16x1x16_4_1x1_intrawave_v1,94.43,634.1,0.0
304,80,1792,6144,8,0,16.4323,a8w8_blockscale_1x128x128_256x16x64x256_16x16_16x16_16x16x1_16x16x1_1x16x1x16_4_1x1_intrawave_v1,107.2,717.39,0.0
304,80,2112,7168,8,0,18.9239,a8w8_blockscale_1x128x128_256x16x64x256_16x16_16x16_16x16x1_16x16x1_1x16x1x16_4_1x1_intrawave_v1,128.0,848.14,0.0
304,80,2304,4096,8,0,12.6821,a8w8_blockscale_1x128x128_256x16x64x256_16x16_16x16_16x16x1_16x16x1_1x16x1x16_4_1x1_intrawave_v1,119.06,799.04,0.0
304,80,3072,1536,8,0,7.1025,a8w8_blockscale_1x128x128_256x16x64x256_16x16_16x16_16x16x1_16x16x1_1x16x1x16_4_1x1_intrawave_v1,106.3,750.86,0.0
304,80,3584,6144,8,0,19.7848,a8w8_blockscale_1x128x128_256x16x64x256_16x16_16x16_16x16x1_16x16x1_1x16x1x16_4_1x1_intrawave_v1,178.08,1166.81,0.0
304,80,4096,512,13,0,5.0971,a8w8_blockscale_1x128x128_256x32x64x256_16x16_16x16_16x16x1_16x16x1_1x32x1x8_8_2x1_intrawave_v1,65.83,548.05,0.0
304,80,4096,1024,8,0,7.264,a8w8_blockscale_1x128x128_256x16x64x256_16x16_16x16_16x16x1_16x16x1_1x16x1x16_4_1x1_intrawave_v1,92.39,678.91,0.0
304,80,4096,2048,7,0,10.6609,a8w8_blockscale_1x128x128_256x16x128x256_16x16_16x16_16x16x1_16x16x1_1x16x1x16_8_1x2_intrawave_v1,125.9,863.7,0.0
304,80,4608,7168,18,0,26.3321,a8w8_blockscale_1x128x128_256x64x64x256_16x16_32x32_16x16x1_16x16x1_1x32x1x8_8_1x1_intrawave_v1,200.7,1304.14,0.0
304,80,6144,1536,13,0,10.0443,a8w8_blockscale_1x128x128_256x32x64x256_16x16_16x16_16x16x1_16x16x1_1x32x1x8_8_2x1_intrawave_v1,150.33,1049.66,0.0
304,80,6144,3072,18,0,15.6833,a8w8_blockscale_1x128x128_256x64x64x256_16x16_32x32_16x16x1_16x16x1_1x32x1x8_8_1x1_intrawave_v1,192.56,1281.82,0.0
304,80,7168,256,8,0,4.7358,a8w8_blockscale_1x128x128_256x16x64x256_16x16_16x16_16x16x1_16x16x1_1x16x1x16_4_1x1_intrawave_v1,62.0,633.97,0.0
304,80,7168,2048,18,0,12.9956,a8w8_blockscale_1x128x128_256x64x64x256_16x16_32x32_16x16x1_16x16x1_1x32x1x8_8_1x1_intrawave_v1,180.74,1230.48,0.0
304,80,7168,2304,12,0,14.0857,a8w8_blockscale_1x128x128_256x32x128x256_16x16_32x32_16x16x1_16x16x1_1x32x1x8_8_1x1_intrawave_v1,187.6,1266.98,0.0
304,88,512,7168,8,0,23.1804,a8w8_blockscale_1x128x128_256x16x64x256_16x16_16x16_16x16x1_16x16x1_1x16x1x16_4_1x1_intrawave_v1,27.87,189.42,0.0
304,88,576,7168,8,0,23.4123,a8w8_blockscale_1x128x128_256x16x64x256_16x16_16x16_16x16x1_16x16x1_1x16x1x16_4_1x1_intrawave_v1,31.04,207.62,0.0
304,88,1280,4096,8,0,14.338,a8w8_blockscale_1x128x128_256x16x64x256_16x16_16x16_16x16x1_16x16x1_1x16x1x16_4_1x1_intrawave_v1,64.36,406.51,0.0
304,88,1536,7168,8,0,24.1242,a8w8_blockscale_1x128x128_256x16x64x256_16x16_16x16_16x16x1_16x16x1_1x16x1x16_4_1x1_intrawave_v1,80.32,493.74,0.0
304,88,1792,6144,8,0,20.965,a8w8_blockscale_1x128x128_256x16x64x256_16x16_16x16_16x16x1_16x16x1_1x16x1x16_4_1x1_intrawave_v1,92.43,566.0,0.0
304,88,2112,7168,8,0,24.4554,a8w8_blockscale_1x128x128_256x16x64x256_16x16_16x16_16x16x1_16x16x1_1x16x1x16_4_1x1_intrawave_v1,108.95,660.03,0.0
304,88,2304,4096,8,0,15.0829,a8w8_blockscale_1x128x128_256x16x64x256_16x16_16x16_16x16x1_16x16x1_1x16x1x16_4_1x1_intrawave_v1,110.12,676.47,0.0
304,88,3072,1536,8,0,7.5867,a8w8_blockscale_1x128x128_256x16x64x256_16x16_16x16_16x16x1_16x16x1_1x16x1x16_4_1x1_intrawave_v1,109.46,711.04,0.0
304,88,3584,6144,18,0,23.0097,a8w8_blockscale_1x128x128_256x64x64x256_16x16_32x32_16x16x1_16x16x1_1x32x1x8_8_1x1_intrawave_v1,168.43,1007.9,0.0
304,88,4096,512,13,0,4.6328,a8w8_blockscale_1x128x128_256x32x64x256_16x16_16x16_16x16x1_16x16x1_1x32x1x8_8_2x1_intrawave_v1,79.67,618.01,0.0
304,88,4096,1024,8,0,6.8889,a8w8_blockscale_1x128x128_256x16x64x256_16x16_16x16_16x16x1_16x16x1_1x16x1x16_4_1x1_intrawave_v1,107.16,726.58,0.0
304,88,4096,2048,8,0,11.3656,a8w8_blockscale_1x128x128_256x16x64x256_16x16_16x16_16x16x1_16x16x1_1x16x1x16_4_1x1_intrawave_v1,129.9,817.35,0.0
304,88,4608,7168,18,0,26.2449,a8w8_blockscale_1x128x128_256x64x64x256_16x16_32x32_16x16x1_16x16x1_1x32x1x8_8_1x1_intrawave_v1,221.5,1313.47,0.0
304,88,6144,1536,18,0,9.0931,a8w8_blockscale_1x128x128_256x64x64x256_16x16_32x32_16x16x1_16x16x1_1x32x1x8_8_1x1_intrawave_v1,182.66,1171.62,0.0
304,88,6144,3072,18,0,15.5504,a8w8_blockscale_1x128x128_256x64x64x256_16x16_32x32_16x16x1_16x16x1_1x32x1x8_8_1x1_intrawave_v1,213.62,1300.68,0.0
304,88,7168,256,8,0,5.0565,a8w8_blockscale_1x128x128_256x16x64x256_16x16_16x16_16x16x1_16x16x1_1x16x1x16_4_1x1_intrawave_v1,63.87,616.85,0.0
304,88,7168,2048,18,0,13.181,a8w8_blockscale_1x128x128_256x64x64x256_16x16_32x32_16x16x1_16x16x1_1x32x1x8_8_1x1_intrawave_v1,196.02,1223.11,0.0
304,88,7168,2304,12,0,13.1244,a8w8_blockscale_1x128x128_256x32x128x256_16x16_32x32_16x16x1_16x16x1_1x32x1x8_8_1x1_intrawave_v1,221.47,1369.92,0.0
304,96,512,7168,8,0,18.0737,a8w8_blockscale_1x128x128_256x16x64x256_16x16_16x16_16x16x1_16x16x1_1x16x1x16_4_1x1_intrawave_v1,38.99,246.57,0.0
304,96,576,7168,8,0,17.9623,a8w8_blockscale_1x128x128_256x16x64x256_16x16_16x16_16x16x1_16x16x1_1x16x1x16_4_1x1_intrawave_v1,44.13,274.32,0.0
304,96,1280,4096,8,0,12.5818,a8w8_blockscale_1x128x128_256x16x64x256_16x16_16x16_16x16x1_16x16x1_1x16x1x16_4_1x1_intrawave_v1,80.01,467.49,0.0
304,96,1536,7168,8,0,18.6655,a8w8_blockscale_1x128x128_256x16x64x256_16x16_16x16_16x16x1_16x16x1_1x16x1x16_4_1x1_intrawave_v1,113.25,642.53,0.0
304,96,1792,6144,8,0,16.3142,a8w8_blockscale_1x128x128_256x16x64x256_16x16_16x16_16x16x1_16x16x1_1x16x1x16_4_1x1_intrawave_v1,129.58,732.12,0.0
304,96,2112,7168,8,0,18.6287,a8w8_blockscale_1x128x128_256x16x64x256_16x16_16x16_16x16x1_16x16x1_1x16x1x16_4_1x1_intrawave_v1,156.03,871.37,0.0
304,96,2304,4096,8,0,12.3841,a8w8_blockscale_1x128x128_256x16x64x256_16x16_16x16_16x16x1_16x16x1_1x16x1x16_4_1x1_intrawave_v1,146.31,829.51,0.0
304,96,3072,1536,8,0,6.5655,a8w8_blockscale_1x128x128_256x16x64x256_16x16_16x16_16x16x1_16x16x1_1x16x1x16_4_1x1_intrawave_v1,137.99,830.99,0.0
304,96,3584,6144,18,0,23.1335,a8w8_blockscale_1x128x128_256x64x64x256_16x16_32x32_16x16x1_16x16x1_1x32x1x8_8_1x1_intrawave_v1,182.76,1007.11,0.0
304,96,4096,512,13,0,4.6115,a8w8_blockscale_1x128x128_256x32x64x256_16x16_16x16_16x16x1_16x16x1_1x32x1x8_8_2x1_intrawave_v1,87.32,635.96,0.0
304,96,4096,1024,8,0,6.6286,a8w8_blockscale_1x128x128_256x16x64x256_16x16_16x16_16x16x1_16x16x1_1x16x1x16_4_1x1_intrawave_v1,121.49,766.23,0.0
304,96,4096,2048,7,0,10.614,a8w8_blockscale_1x128x128_256x16x128x256_16x16_16x16_16x16x1_16x16x1_1x16x1x16_8_1x2_intrawave_v1,151.74,882.95,0.0
304,96,4608,7168,18,0,26.5833,a8w8_blockscale_1x128x128_256x64x64x256_16x16_32x32_16x16x1_16x16x1_1x32x1x8_8_1x1_intrawave_v1,238.56,1301.68,0.0
304,96,6144,1536,13,0,8.8349,a8w8_blockscale_1x128x128_256x32x64x256_16x16_16x16_16x16x1_16x16x1_1x32x1x8_8_2x1_intrawave_v1,205.09,1218.38,0.0
304,96,6144,3072,13,0,15.4841,a8w8_blockscale_1x128x128_256x32x64x256_16x16_16x16_16x16x1_16x16x1_1x32x1x8_8_2x1_intrawave_v1,234.04,1314.18,0.0
304,96,7168,256,8,0,4.4336,a8w8_blockscale_1x128x128_256x16x64x256_16x16_16x16_16x16x1_16x16x1_1x16x1x16_4_1x1_intrawave_v1,79.47,729.84,0.0
304,96,7168,2048,18,0,12.3512,a8w8_blockscale_1x128x128_256x64x64x256_16x16_32x32_16x16x1_16x16x1_1x32x1x8_8_1x1_intrawave_v1,228.2,1315.9,0.0
304,96,7168,2304,12,0,13.1554,a8w8_blockscale_1x128x128_256x32x128x256_16x16_32x32_16x16x1_16x16x1_1x32x1x8_8_1x1_intrawave_v1,241.03,1376.81,0.0
304,104,512,7168,8,0,22.3251,a8w8_blockscale_1x128x128_256x16x64x256_16x16_16x16_16x16x1_16x16x1_1x16x1x16_4_1x1_intrawave_v1,34.19,202.55,0.0
304,104,576,7168,8,0,22.3161,a8w8_blockscale_1x128x128_256x16x64x256_16x16_16x16_16x16x1_16x16x1_1x16x1x16_4_1x1_intrawave_v1,38.48,223.79,0.0
304,104,1280,4096,8,0,14.1805,a8w8_blockscale_1x128x128_256x16x64x256_16x16_16x16_16x16x1_16x16x1_1x16x1x16_4_1x1_intrawave_v1,76.9,418.54,0.0
304,104,1536,7168,8,0,23.4656,a8w8_blockscale_1x128x128_256x16x64x256_16x16_16x16_16x16x1_16x16x1_1x16x1x16_4_1x1_intrawave_v1,97.59,514.58,0.0
304,104,1792,6144,8,0,20.2852,a8w8_blockscale_1x128x128_256x16x64x256_16x16_16x16_16x16x1_16x16x1_1x16x1x16_4_1x1_intrawave_v1,112.89,592.64,0.0
304,104,2112,7168,8,0,23.899,a8w8_blockscale_1x128x128_256x16x64x256_16x16_16x16_16x16x1_16x16x1_1x16x1x16_4_1x1_intrawave_v1,131.76,683.02,0.0
304,104,2304,4096,8,0,14.8575,a8w8_blockscale_1x128x128_256x16x64x256_16x16_16x16_16x16x1_16x16x1_1x16x1x16_4_1x1_intrawave_v1,132.12,696.11,0.0
304,104,3072,1536,8,0,8.2917,a8w8_blockscale_1x128x128_256x16x64x256_16x16_16x16_16x16x1_16x16x1_1x16x1x16_4_1x1_intrawave_v1,118.37,665.4,0.0
304,104,3584,6144,18,0,23.4028,a8w8_blockscale_1x128x128_256x64x64x256_16x16_32x32_16x16x1_16x16x1_1x32x1x8_8_1x1_intrawave_v1,195.71,1000.07,0.0
304,104,4096,512,13,0,4.7129,a8w8_blockscale_1x128x128_256x32x64x256_16x16_16x16_16x16x1_16x16x1_1x32x1x8_8_2x1_intrawave_v1,92.56,637.05,0.0
304,104,4096,1024,13,0,6.9322,a8w8_blockscale_1x128x128_256x32x64x256_16x16_16x16_16x16x1_16x16x1_1x32x1x8_8_2x1_intrawave_v1,125.85,743.31,0.0
304,104,4096,2048,8,0,11.201,a8w8_blockscale_1x128x128_256x16x64x256_16x16_16x16_16x16x1_16x16x1_1x16x1x16_4_1x1_intrawave_v1,155.77,843.99,0.0
304,104,4608,7168,18,0,26.6314,a8w8_blockscale_1x128x128_256x64x64x256_16x16_32x32_16x16x1_16x16x1_1x32x1x8_8_1x1_intrawave_v1,257.98,1304.25,0.0
304,104,6144,1536,18,0,10.0548,a8w8_blockscale_1x128x128_256x64x64x256_16x16_32x32_16x16x1_16x16x1_1x32x1x8_8_1x1_intrawave_v1,195.22,1081.56,0.0
304,104,6144,3072,18,0,15.897,a8w8_blockscale_1x128x128_256x64x64x256_16x16_32x32_16x16x1_16x16x1_1x32x1x8_8_1x1_intrawave_v1,246.96,1287.78,0.0
304,104,7168,256,8,0,4.6864,a8w8_blockscale_1x128x128_256x16x64x256_16x16_16x16_16x16x1_16x16x1_1x16x1x16_4_1x1_intrawave_v1,81.44,715.38,0.0
304,104,7168,2048,18,0,12.653,a8w8_blockscale_1x128x128_256x64x64x256_16x16_32x32_16x16x1_16x16x1_1x32x1x8_8_1x1_intrawave_v1,241.32,1294.87,0.0
304,104,7168,2304,18,0,13.4648,a8w8_blockscale_1x128x128_256x64x64x256_16x16_32x32_16x16x1_16x16x1_1x32x1x8_8_1x1_intrawave_v1,255.12,1355.06,0.0
304,112,512,7168,8,0,18.3095,a8w8_blockscale_1x128x128_256x16x64x256_16x16_16x16_16x16x1_16x16x1_1x16x1x16_4_1x1_intrawave_v1,44.9,250.55,0.0
304,112,576,7168,8,0,18.1192,a8w8_blockscale_1x128x128_256x16x64x256_16x16_16x16_16x16x1_16x16x1_1x16x1x16_4_1x1_intrawave_v1,51.04,279.3,0.0
304,112,1280,4096,8,0,12.6627,a8w8_blockscale_1x128x128_256x16x64x256_16x16_16x16_16x16x1_16x16x1_1x16x1x16_4_1x1_intrawave_v1,92.75,472.91,0.0
304,112,1536,7168,8,0,18.3591,a8w8_blockscale_1x128x128_256x16x64x256_16x16_16x16_16x16x1_16x16x1_1x16x1x16_4_1x1_intrawave_v1,134.33,662.17,0.0
304,112,1792,6144,8,0,16.3694,a8w8_blockscale_1x128x128_256x16x64x256_16x16_16x16_16x16x1_16x16x1_1x16x1x16_4_1x1_intrawave_v1,150.66,739.16,0.0
304,112,2112,7168,8,0,18.6433,a8w8_blockscale_1x128x128_256x16x64x256_16x16_16x16_16x16x1_16x16x1_1x16x1x16_4_1x1_intrawave_v1,181.89,880.46,0.0
304,112,2304,4096,8,0,12.3632,a8w8_blockscale_1x128x128_256x16x64x256_16x16_16x16_16x16x1_16x16x1_1x16x1x16_4_1x1_intrawave_v1,170.99,842.18,0.0
304,112,3072,1536,8,0,7.7926,a8w8_blockscale_1x128x128_256x16x64x256_16x16_16x16_16x16x1_16x16x1_1x16x1x16_4_1x1_intrawave_v1,135.64,715.9,0.0
304,112,3584,6144,18,0,23.4992,a8w8_blockscale_1x128x128_256x64x64x256_16x16_32x32_16x16x1_16x16x1_1x32x1x8_8_1x1_intrawave_v1,209.9,1000.5,0.0
304,112,4096,512,13,0,4.7324,a8w8_blockscale_1x128x128_256x32x64x256_16x16_16x16_16x16x1_16x16x1_1x32x1x8_8_2x1_intrawave_v1,99.27,649.14,0.0
304,112,4096,1024,8,0,6.6461,a8w8_blockscale_1x128x128_256x16x64x256_16x16_16x16_16x16x1_16x16x1_1x16x1x16_4_1x1_intrawave_v1,141.36,786.4,0.0
304,112,4096,2048,7,0,11.1821,a8w8_blockscale_1x128x128_256x16x128x256_16x16_16x16_16x16x1_16x16x1_1x16x1x16_8_1x2_intrawave_v1,168.04,852.75,0.0
304,112,4608,7168,18,0,27.754,a8w8_blockscale_1x128x128_256x64x64x256_16x16_32x32_16x16x1_16x16x1_1x32x1x8_8_1x1_intrawave_v1,266.58,1256.22,0.0
304,112,6144,1536,18,0,10.4959,a8w8_blockscale_1x128x128_256x64x64x256_16x16_32x32_16x16x1_16x16x1_1x32x1x8_8_1x1_intrawave_v1,201.41,1046.64,0.0
304,112,6144,3072,18,0,16.2048,a8w8_blockscale_1x128x128_256x64x64x256_16x16_32x32_16x16x1_16x16x1_1x32x1x8_8_1x1_intrawave_v1,260.9,1270.9,0.0
304,112,7168,256,8,0,4.585,a8w8_blockscale_1x128x128_256x16x64x256_16x16_16x16_16x16x1_16x16x1_1x16x1x16_4_1x1_intrawave_v1,89.65,756.67,0.0
304,112,7168,2048,18,0,12.9896,a8w8_blockscale_1x128x128_256x64x64x256_16x16_32x32_16x16x1_16x16x1_1x32x1x8_8_1x1_intrawave_v1,253.15,1271.41,0.0
304,112,7168,2304,18,0,13.6906,a8w8_blockscale_1x128x128_256x64x64x256_16x16_32x32_16x16x1_16x16x1_1x32x1x8_8_1x1_intrawave_v1,270.21,1342.44,0.0
304,120,512,7168,8,0,22.2536,a8w8_blockscale_1x128x128_256x16x64x256_16x16_16x16_16x16x1_16x16x1_1x16x1x16_4_1x1_intrawave_v1,39.58,209.09,0.0
304,120,576,7168,8,0,22.1695,a8w8_blockscale_1x128x128_256x16x64x256_16x16_16x16_16x16x1_16x16x1_1x16x1x16_4_1x1_intrawave_v1,44.7,231.27,0.0
304,120,1280,4096,8,0,14.0339,a8w8_blockscale_1x128x128_256x16x64x256_16x16_16x16_16x16x1_16x16x1_1x16x1x16_4_1x1_intrawave_v1,89.66,430.5,0.0
304,120,1536,7168,8,0,22.8718,a8w8_blockscale_1x128x128_256x16x64x256_16x16_16x16_16x16x1_16x16x1_1x16x1x16_4_1x1_intrawave_v1,115.53,535.11,0.0
304,120,1792,6144,8,0,19.6014,a8w8_blockscale_1x128x128_256x16x64x256_16x16_16x16_16x16x1_16x16x1_1x16x1x16_4_1x1_intrawave_v1,134.81,621.25,0.0
304,120,2112,7168,8,0,23.3688,a8w8_blockscale_1x128x128_256x16x64x256_16x16_16x16_16x16x1_16x16x1_1x16x1x16_4_1x1_intrawave_v1,155.48,706.32,0.0
304,120,2304,4096,8,0,14.1057,a8w8_blockscale_1x128x128_256x16x64x256_16x16_16x16_16x16x1_16x16x1_1x16x1x16_4_1x1_intrawave_v1,160.57,743.08,0.0
304,120,3072,1536,8,0,8.4556,a8w8_blockscale_1x128x128_256x16x64x256_16x16_16x16_16x16x1_16x16x1_1x16x1x16_4_1x1_intrawave_v1,133.93,667.04,0.0
304,120,3584,6144,18,0,24.1145,a8w8_blockscale_1x128x128_256x64x64x256_16x16_32x32_16x16x1_16x16x1_1x32x1x8_8_1x1_intrawave_v1,219.16,979.39,0.0
304,120,4096,512,13,0,4.7576,a8w8_blockscale_1x128x128_256x32x64x256_16x16_16x16_16x16x1_16x16x1_1x32x1x8_8_2x1_intrawave_v1,105.79,660.34,0.0
304,120,4096,1024,8,0,6.9152,a8w8_blockscale_1x128x128_256x16x64x256_16x16_16x16_16x16x1_16x16x1_1x16x1x16_4_1x1_intrawave_v1,145.57,766.46,0.0
304,120,4096,2048,18,0,11.0491,a8w8_blockscale_1x128x128_256x64x64x256_16x16_32x32_16x16x1_16x16x1_1x32x1x8_8_1x1_intrawave_v1,182.21,870.42,0.0
304,120,4608,7168,18,0,28.4802,a8w8_blockscale_1x128x128_256x64x64x256_16x16_32x32_16x16x1_16x16x1_1x32x1x8_8_1x1_intrawave_v1,278.34,1228.79,0.0
304,120,6144,1536,18,0,10.2279,a8w8_blockscale_1x128x128_256x64x64x256_16x16_32x32_16x16x1_16x16x1_1x32x1x8_8_1x1_intrawave_v1,221.45,1084.88,0.0
304,120,6144,3072,18,0,16.3593,a8w8_blockscale_1x128x128_256x64x64x256_16x16_32x32_16x16x1_16x16x1_1x32x1x8_8_1x1_intrawave_v1,276.9,1266.41,0.0
304,120,7168,256,8,0,4.5492,a8w8_blockscale_1x128x128_256x16x64x256_16x16_16x16_16x16x1_16x16x1_1x16x1x16_4_1x1_intrawave_v1,96.81,788.28,0.0
304,120,7168,2048,18,0,13.0825,a8w8_blockscale_1x128x128_256x64x64x256_16x16_32x32_16x16x1_16x16x1_1x32x1x8_8_1x1_intrawave_v1,269.31,1272.4,0.0
304,120,7168,2304,18,0,13.7042,a8w8_blockscale_1x128x128_256x64x64x256_16x16_32x32_16x16x1_16x16x1_1x32x1x8_8_1x1_intrawave_v1,289.23,1350.82,0.0
304,128,512,7168,8,0,17.3418,a8w8_blockscale_1x128x128_256x16x64x256_16x16_16x16_16x16x1_16x16x1_1x16x1x16_4_1x1_intrawave_v1,54.18,272.09,0.0
304,128,576,7168,8,0,17.3911,a8w8_blockscale_1x128x128_256x16x64x256_16x16_16x16_16x16x1_16x16x1_1x16x1x16_4_1x1_intrawave_v1,60.78,298.64,0.0
304,128,1280,4096,8,0,12.5519,a8w8_blockscale_1x128x128_256x16x64x256_16x16_16x16_16x16x1_16x16x1_1x16x1x16_4_1x1_intrawave_v1,106.93,485.57,0.0
304,128,1536,7168,8,0,18.2772,a8w8_blockscale_1x128x128_256x16x64x256_16x16_16x16_16x16x1_16x16x1_1x16x1x16_4_1x1_intrawave_v1,154.21,674.11,0.0
304,128,1792,6144,8,0,16.3473,a8w8_blockscale_1x128x128_256x16x64x256_16x16_16x16_16x16x1_16x16x1_1x16x1x16_4_1x1_intrawave_v1,172.42,749.68,0.0
304,128,2112,7168,8,0,19.074,a8w8_blockscale_1x128x128_256x16x64x256_16x16_16x16_16x16x1_16x16x1_1x16x1x16_4_1x1_intrawave_v1,203.18,870.14,0.0
304,128,2304,4096,8,0,12.8129,a8w8_blockscale_1x128x128_256x16x64x256_16x16_16x16_16x16x1_16x16x1_1x16x1x16_4_1x1_intrawave_v1,188.55,823.49,0.0
304,128,3072,1536,8,0,8.0923,a8w8_blockscale_1x128x128_256x16x64x256_16x16_16x16_16x16x1_16x16x1_1x16x1x16_4_1x1_intrawave_v1,149.27,704.57,0.0
304,128,3584,6144,7,0,24.2954,a8w8_blockscale_1x128x128_256x16x128x256_16x16_16x16_16x16x1_16x16x1_1x16x1x16_8_1x2_intrawave_v1,232.03,976.48,0.0
304,128,4096,512,13,0,4.0266,a8w8_blockscale_1x128x128_256x32x64x256_16x16_16x16_16x16x1_16x16x1_1x32x1x8_8_2x1_intrawave_v1,133.33,797.51,0.0
304,128,4096,1024,7,0,6.7186,a8w8_blockscale_1x128x128_256x16x128x256_16x16_16x16_16x16x1_16x16x1_1x16x1x16_8_1x2_intrawave_v1,159.82,799.86,0.0
304,128,4096,2048,7,0,11.0049,a8w8_blockscale_1x128x128_256x16x128x256_16x16_16x16_16x16x1_16x16x1_1x16x1x16_8_1x2_intrawave_v1,195.14,881.36,0.0
304,128,4608,7168,18,0,28.1499,a8w8_blockscale_1x128x128_256x64x64x256_16x16_32x32_16x16x1_16x16x1_1x32x1x8_8_1x1_intrawave_v1,300.38,1247.87,0.0
304,128,6144,1536,18,0,9.8162,a8w8_blockscale_1x128x128_256x64x64x256_16x16_32x32_16x16x1_16x16x1_1x32x1x8_8_1x1_intrawave_v1,246.12,1141.65,0.0
304,128,6144,3072,18,0,15.8922,a8w8_blockscale_1x128x128_256x64x64x256_16x16_32x32_16x16x1_16x16x1_1x32x1x8_8_1x1_intrawave_v1,304.04,1311.36,0.0
304,128,7168,256,13,0,4.2878,a8w8_blockscale_1x128x128_256x32x64x256_16x16_16x16_16x16x1_16x16x1_1x32x1x8_8_2x1_intrawave_v1,109.56,863.56,0.0
304,128,7168,2048,18,0,13.2588,a8w8_blockscale_1x128x128_256x64x64x256_16x16_32x32_16x16x1_16x16x1_1x32x1x8_8_1x1_intrawave_v1,283.44,1265.36,0.0
304,128,7168,2304,18,0,13.0594,a8w8_blockscale_1x128x128_256x64x64x256_16x16_32x32_16x16x1_16x16x1_1x32x1x8_8_1x1_intrawave_v1,323.74,1427.71,0.0
304,136,512,7168,8,0,22.4037,a8w8_blockscale_1x128x128_256x16x64x256_16x16_16x16_16x16x1_16x16x1_1x16x1x16_4_1x1_intrawave_v1,44.56,213.54,0.0
304,136,576,7168,8,0,22.4407,a8w8_blockscale_1x128x128_256x16x64x256_16x16_16x16_16x16x1_16x16x1_1x16x1x16_4_1x1_intrawave_v1,50.04,234.41,0.0
304,136,1280,4096,8,0,14.223,a8w8_blockscale_1x128x128_256x16x64x256_16x16_16x16_16x16x1_16x16x1_1x16x1x16_4_1x1_intrawave_v1,100.26,432.26,0.0
304,136,1536,7168,8,0,22.858,a8w8_blockscale_1x128x128_256x16x64x256_16x16_16x16_16x16x1_16x16x1_1x16x1x16_4_1x1_intrawave_v1,131.01,542.6,0.0
304,136,1792,6144,8,0,20.9694,a8w8_blockscale_1x128x128_256x16x64x256_16x16_16x16_16x16x1_16x16x1_1x16x1x16_4_1x1_intrawave_v1,142.81,588.15,0.0
304,136,2112,7168,8,0,24.842,a8w8_blockscale_1x128x128_256x16x64x256_16x16_16x16_16x16x1_16x16x1_1x16x1x16_4_1x1_intrawave_v1,165.76,671.77,0.0
304,136,2304,4096,18,0,15.7112,a8w8_blockscale_1x128x128_256x64x64x256_16x16_32x32_16x16x1_16x16x1_1x32x1x8_8_1x1_intrawave_v1,163.38,676.01,0.0
304,136,3072,1536,18,0,8.8306,a8w8_blockscale_1x128x128_256x64x64x256_16x16_32x32_16x16x1_16x16x1_1x32x1x8_8_1x1_intrawave_v1,145.34,652.63,0.0
304,136,3584,6144,18,0,23.3748,a8w8_blockscale_1x128x128_256x64x64x256_16x16_32x32_16x16x1_16x16x1_1x32x1x8_8_1x1_intrawave_v1,256.24,1019.5,0.0
304,136,4096,512,8,0,5.1344,a8w8_blockscale_1x128x128_256x16x64x256_16x16_16x16_16x16x1_16x16x1_1x16x1x16_4_1x1_intrawave_v1,111.1,639.0,0.0
304,136,4096,1024,18,0,7.4172,a8w8_blockscale_1x128x128_256x64x64x256_16x16_32x32_16x16x1_16x16x1_1x32x1x8_8_1x1_intrawave_v1,153.81,734.47,0.0
304,136,4096,2048,18,0,11.4706,a8w8_blockscale_1x128x128_256x64x64x256_16x16_32x32_16x16x1_16x16x1_1x32x1x8_8_1x1_intrawave_v1,198.92,852.72,0.0
304,136,4608,7168,18,0,31.2737,a8w8_blockscale_1x128x128_256x64x64x256_16x16_32x32_16x16x1_16x16x1_1x32x1x8_8_1x1_intrawave_v1,287.28,1127.41,0.0
304,136,6144,1536,18,0,11.2445,a8w8_blockscale_1x128x128_256x64x64x256_16x16_32x32_16x16x1_16x16x1_1x32x1x8_8_1x1_intrawave_v1,228.28,1006.47,0.0
304,136,6144,3072,18,0,17.9919,a8w8_blockscale_1x128x128_256x64x64x256_16x16_32x32_16x16x1_16x16x1_1x32x1x8_8_1x1_intrawave_v1,285.34,1165.15,0.0
304,136,7168,256,11,0,5.1109,a8w8_blockscale_1x128x128_256x32x64x128_16x16_16x16_8x32x1_8x32x1_1x32x1x8_8_2x1_intrawave_v1,97.66,747.33,0.0
304,136,7168,2048,12,0,16.792,a8w8_blockscale_1x128x128_256x32x128x256_16x16_32x32_16x16x1_16x16x1_1x32x1x8_8_1x1_intrawave_v1,237.79,1006.93,0.0
304,136,7168,2304,13,0,18.2874,a8w8_blockscale_1x128x128_256x32x64x256_16x16_16x16_16x16x1_16x16x1_1x32x1x8_8_2x1_intrawave_v1,245.64,1026.83,0.0
304,144,512,7168,8,0,17.9551,a8w8_blockscale_1x128x128_256x16x64x256_16x16_16x16_16x16x1_16x16x1_1x16x1x16_4_1x1_intrawave_v1,58.87,270.1,0.0
304,144,576,7168,8,0,17.8973,a8w8_blockscale_1x128x128_256x16x64x256_16x16_16x16_16x16x1_16x16x1_1x16x1x16_4_1x1_intrawave_v1,66.44,297.63,0.0
304,144,1280,4096,8,0,12.6844,a8w8_blockscale_1x128x128_256x16x64x256_16x16_16x16_16x16x1_16x16x1_1x16x1x16_4_1x1_intrawave_v1,119.04,488.9,0.0
304,144,1536,7168,8,0,18.3943,a8w8_blockscale_1x128x128_256x16x64x256_16x16_16x16_16x16x1_16x16x1_1x16x1x16_4_1x1_intrawave_v1,172.38,678.72,0.0
304,144,1792,6144,8,0,16.9907,a8w8_blockscale_1x128x128_256x16x64x256_16x16_16x16_16x16x1_16x16x1_1x16x1x16_4_1x1_intrawave_v1,186.63,730.45,0.0
304,144,2112,7168,8,0,21.0604,a8w8_blockscale_1x128x128_256x16x64x256_16x16_16x16_16x16x1_16x16x1_1x16x1x16_4_1x1_intrawave_v1,207.02,796.72,0.0
304,144,2304,4096,18,0,15.9848,a8w8_blockscale_1x128x128_256x64x64x256_16x16_32x32_16x16x1_16x16x1_1x32x1x8_8_1x1_intrawave_v1,170.03,668.8,0.0
304,144,3072,1536,7,0,8.4312,a8w8_blockscale_1x128x128_256x16x128x256_16x16_16x16_16x16x1_16x16x1_1x16x1x16_8_1x2_intrawave_v1,161.18,690.83,0.0
304,144,3584,6144,18,0,24.4746,a8w8_blockscale_1x128x128_256x64x64x256_16x16_32x32_16x16x1_16x16x1_1x32x1x8_8_1x1_intrawave_v1,259.12,978.04,0.0
304,144,4096,512,8,0,5.1663,a8w8_blockscale_1x128x128_256x16x64x256_16x16_16x16_16x16x1_16x16x1_1x16x1x16_4_1x1_intrawave_v1,116.91,648.54,0.0
304,144,4096,1024,18,0,7.388,a8w8_blockscale_1x128x128_256x64x64x256_16x16_32x32_16x16x1_16x16x1_1x32x1x8_8_1x1_intrawave_v1,163.5,747.35,0.0
304,144,4096,2048,18,0,11.7732,a8w8_blockscale_1x128x128_256x64x64x256_16x16_32x32_16x16x1_16x16x1_1x32x1x8_8_1x1_intrawave_v1,205.2,837.76,0.0
304,144,4608,7168,18,0,31.6113,a8w8_blockscale_1x128x128_256x64x64x256_16x16_32x32_16x16x1_16x16x1_1x32x1x8_8_1x1_intrawave_v1,300.93,1119.52,0.0
304,144,6144,1536,18,0,11.2033,a8w8_blockscale_1x128x128_256x64x64x256_16x16_32x32_16x16x1_16x16x1_1x32x1x8_8_1x1_intrawave_v1,242.6,1020.04,0.0
304,144,6144,3072,18,0,18.3547,a8w8_blockscale_1x128x128_256x64x64x256_16x16_32x32_16x16x1_16x16x1_1x32x1x8_8_1x1_intrawave_v1,296.15,1148.82,0.0
304,144,7168,256,11,0,5.0793,a8w8_blockscale_1x128x128_256x32x64x128_16x16_16x16_8x32x1_8x32x1_1x32x1x8_8_2x1_intrawave_v1,104.05,774.96,0.0
304,144,7168,2048,12,0,16.9227,a8w8_blockscale_1x128x128_256x32x128x256_16x16_32x32_16x16x1_16x16x1_1x32x1x8_8_1x1_intrawave_v1,249.83,1006.89,0.0
304,144,7168,2304,12,0,18.2406,a8w8_blockscale_1x128x128_256x32x128x256_16x16_32x32_16x16x1_16x16x1_1x32x1x8_8_1x1_intrawave_v1,260.76,1036.77,0.0
304,152,512,7168,8,0,22.1077,a8w8_blockscale_1x128x128_256x16x64x256_16x16_16x16_16x16x1_16x16x1_1x16x1x16_4_1x1_intrawave_v1,50.47,222.33,0.0
304,152,576,7168,8,0,22.2575,a8w8_blockscale_1x128x128_256x16x64x256_16x16_16x16_16x16x1_16x16x1_1x16x1x16_4_1x1_intrawave_v1,56.39,242.32,0.0
304,152,1280,4096,8,0,14.274,a8w8_blockscale_1x128x128_256x16x64x256_16x16_16x16_16x16x1_16x16x1_1x16x1x16_4_1x1_intrawave_v1,111.66,438.18,0.0
304,152,1536,7168,8,0,23.3481,a8w8_blockscale_1x128x128_256x16x64x256_16x16_16x16_16x16x1_16x16x1_1x16x1x16_4_1x1_intrawave_v1,143.35,538.22,0.0
304,152,1792,6144,8,0,20.2108,a8w8_blockscale_1x128x128_256x16x64x256_16x16_16x16_16x16x1_16x16x1_1x16x1x16_4_1x1_intrawave_v1,165.61,617.92,0.0
304,152,2112,7168,18,0,25.3462,a8w8_blockscale_1x128x128_256x64x64x256_16x16_32x32_16x16x1_16x16x1_1x32x1x8_8_1x1_intrawave_v1,181.57,665.6,0.0
304,152,2304,4096,18,0,16.0372,a8w8_blockscale_1x128x128_256x64x64x256_16x16_32x32_16x16x1_16x16x1_1x32x1x8_8_1x1_intrawave_v1,178.89,670.95,0.0
304,152,3072,1536,18,0,8.8995,a8w8_blockscale_1x128x128_256x64x64x256_16x16_32x32_16x16x1_16x16x1_1x32x1x8_8_1x1_intrawave_v1,161.18,661.38,0.0
304,152,3584,6144,18,0,23.9798,a8w8_blockscale_1x128x128_256x64x64x256_16x16_32x32_16x16x1_16x16x1_1x32x1x8_8_1x1_intrawave_v1,279.16,1002.66,0.0
304,152,4096,512,18,0,5.6207,a8w8_blockscale_1x128x128_256x64x64x256_16x16_32x32_16x16x1_16x16x1_1x32x1x8_8_1x1_intrawave_v1,113.43,608.49,0.0
304,152,4096,1024,18,0,7.4862,a8w8_blockscale_1x128x128_256x64x64x256_16x16_32x32_16x16x1_16x16x1_1x32x1x8_8_1x1_intrawave_v1,170.32,747.39,0.0
304,152,4096,2048,18,0,11.3681,a8w8_blockscale_1x128x128_256x64x64x256_16x16_32x32_16x16x1_16x16x1_1x32x1x8_8_1x1_intrawave_v1,224.32,874.82,0.0
304,152,4608,7168,18,0,31.266,a8w8_blockscale_1x128x128_256x64x64x256_16x16_32x32_16x16x1_16x16x1_1x32x1x8_8_1x1_intrawave_v1,321.15,1136.07,0.0
304,152,6144,1536,18,0,11.058,a8w8_blockscale_1x128x128_256x64x64x256_16x16_32x32_16x16x1_16x16x1_1x32x1x8_8_1x1_intrawave_v1,259.44,1043.45,0.0
304,152,6144,3072,18,0,18.2914,a8w8_blockscale_1x128x128_256x64x64x256_16x16_32x32_16x16x1_16x16x1_1x32x1x8_8_1x1_intrawave_v1,313.69,1159.51,0.0
304,152,7168,256,11,0,5.1206,a8w8_blockscale_1x128x128_256x32x64x128_16x16_16x16_8x32x1_8x32x1_1x32x1x8_8_2x1_intrawave_v1,108.94,791.51,0.0
304,152,7168,2048,12,0,16.9572,a8w8_blockscale_1x128x128_256x32x128x256_16x16_32x32_16x16x1_16x16x1_1x32x1x8_8_1x1_intrawave_v1,263.18,1012.57,0.0
304,152,7168,2304,13,0,18.4062,a8w8_blockscale_1x128x128_256x32x64x256_16x16_16x16_16x16x1_16x16x1_1x32x1x8_8_2x1_intrawave_v1,272.77,1034.67,0.0
304,160,512,7168,8,0,17.9571,a8w8_blockscale_1x128x128_256x16x64x256_16x16_16x16_16x16x1_16x16x1_1x16x1x16_4_1x1_intrawave_v1,65.4,277.37,0.0
304,160,576,7168,8,0,18.2191,a8w8_blockscale_1x128x128_256x16x64x256_16x16_16x16_16x16x1_16x16x1_1x16x1x16_4_1x1_intrawave_v1,72.52,299.68,0.0
304,160,1280,4096,8,0,12.6819,a8w8_blockscale_1x128x128_256x16x64x256_16x16_16x16_16x16x1_16x16x1_1x16x1x16_4_1x1_intrawave_v1,132.29,497.39,0.0
304,160,1536,7168,8,0,18.8636,a8w8_blockscale_1x128x128_256x16x64x256_16x16_16x16_16x16x1_16x16x1_1x16x1x16_4_1x1_intrawave_v1,186.77,670.52,0.0
304,160,1792,6144,8,0,17.4522,a8w8_blockscale_1x128x128_256x16x64x256_16x16_16x16_16x16x1_16x16x1_1x16x1x16_4_1x1_intrawave_v1,201.88,720.05,0.0
304,160,2112,7168,18,0,25.4434,a8w8_blockscale_1x128x128_256x64x64x256_16x16_32x32_16x16x1_16x16x1_1x32x1x8_8_1x1_intrawave_v1,190.4,666.64,0.0
304,160,2304,4096,18,0,16.1932,a8w8_blockscale_1x128x128_256x64x64x256_16x16_32x32_16x16x1_16x16x1_1x32x1x8_8_1x1_intrawave_v1,186.49,668.79,0.0
304,160,3072,1536,7,0,8.4508,a8w8_blockscale_1x128x128_256x16x128x256_16x16_16x16_16x16x1_16x16x1_1x16x1x16_8_1x2_intrawave_v1,178.68,703.77,0.0
304,160,3584,6144,18,0,24.4314,a8w8_blockscale_1x128x128_256x64x64x256_16x16_32x32_16x16x1_16x16x1_1x32x1x8_8_1x1_intrawave_v1,288.42,988.48,0.0
304,160,4096,512,8,0,5.6534,a8w8_blockscale_1x128x128_256x16x64x256_16x16_16x16_16x16x1_16x16x1_1x16x1x16_4_1x1_intrawave_v1,118.71,617.29,0.0
304,160,4096,1024,18,0,7.5719,a8w8_blockscale_1x128x128_256x64x64x256_16x16_32x32_16x16x1_16x16x1_1x32x1x8_8_1x1_intrawave_v1,177.26,748.67,0.0
304,160,4096,2048,18,0,11.5587,a8w8_blockscale_1x128x128_256x64x64x256_16x16_32x32_16x16x1_16x16x1_1x32x1x8_8_1x1_intrawave_v1,232.24,867.49,0.0
304,160,4608,7168,18,0,31.9157,a8w8_blockscale_1x128x128_256x64x64x256_16x16_32x32_16x16x1_16x16x1_1x32x1x8_8_1x1_intrawave_v1,331.17,1117.05,0.0
304,160,6144,1536,18,0,10.613,a8w8_blockscale_1x128x128_256x64x64x256_16x16_32x32_16x16x1_16x16x1_1x32x1x8_8_1x1_intrawave_v1,284.55,1097.62,0.0
304,160,6144,3072,18,0,18.3779,a8w8_blockscale_1x128x128_256x64x64x256_16x16_32x32_16x16x1_16x16x1_1x32x1x8_8_1x1_intrawave_v1,328.64,1160.74,0.0
304,160,7168,256,11,0,5.1483,a8w8_blockscale_1x128x128_256x32x64x128_16x16_16x16_8x32x1_8x32x1_1x32x1x8_8_2x1_intrawave_v1,114.06,809.92,0.0
304,160,7168,2048,12,0,16.3834,a8w8_blockscale_1x128x128_256x32x128x256_16x16_32x32_16x16x1_16x16x1_1x32x1x8_8_1x1_intrawave_v1,286.73,1056.04,0.0
304,160,7168,2304,12,0,17.4783,a8w8_blockscale_1x128x128_256x32x128x256_16x16_32x32_16x16x1_16x16x1_1x32x1x8_8_1x1_intrawave_v1,302.36,1097.22,0.0
304,168,512,7168,8,0,22.0472,a8w8_blockscale_1x128x128_256x16x64x256_16x16_16x16_16x16x1_16x16x1_1x16x1x16_4_1x1_intrawave_v1,55.93,228.88,0.0
304,168,576,7168,8,0,21.9885,a8w8_blockscale_1x128x128_256x16x64x256_16x16_16x16_16x16x1_16x16x1_1x16x1x16_4_1x1_intrawave_v1,63.09,251.34,0.0
304,168,1280,4096,8,0,14.6048,a8w8_blockscale_1x128x128_256x16x64x256_16x16_16x16_16x16x1_16x16x1_1x16x1x16_4_1x1_intrawave_v1,120.62,435.55,0.0
304,168,1536,7168,8,0,22.8226,a8w8_blockscale_1x128x128_256x16x64x256_16x16_16x16_16x16x1_16x16x1_1x16x1x16_4_1x1_intrawave_v1,162.09,557.8,0.0
304,168,1792,6144,8,0,22.2375,a8w8_blockscale_1x128x128_256x16x64x256_16x16_16x16_16x16x1_16x16x1_1x16x1x16_4_1x1_intrawave_v1,166.36,568.6,0.0
304,168,2112,7168,18,0,25.8186,a8w8_blockscale_1x128x128_256x64x64x256_16x16_32x32_16x16x1_16x16x1_1x32x1x8_8_1x1_intrawave_v1,197.01,660.48,0.0
304,168,2304,4096,18,0,16.5548,a8w8_blockscale_1x128x128_256x64x64x256_16x16_32x32_16x16x1_16x16x1_1x32x1x8_8_1x1_intrawave_v1,191.54,658.39,0.0
304,168,3072,1536,13,0,8.9086,a8w8_blockscale_1x128x128_256x32x64x256_16x16_16x16_16x16x1_16x16x1_1x32x1x8_8_2x1_intrawave_v1,177.97,674.5,0.0
304,168,3584,6144,18,0,25.1155,a8w8_blockscale_1x128x128_256x64x64x256_16x16_32x32_16x16x1_16x16x1_1x32x1x8_8_1x1_intrawave_v1,294.59,965.8,0.0
304,168,4096,512,18,0,5.6611,a8w8_blockscale_1x128x128_256x64x64x256_16x16_32x32_16x16x1_16x16x1_1x32x1x8_8_1x1_intrawave_v1,124.47,628.75,0.0
304,168,4096,1024,18,0,7.6399,a8w8_blockscale_1x128x128_256x64x64x256_16x16_32x32_16x16x1_16x16x1_1x32x1x8_8_1x1_intrawave_v1,184.46,751.66,0.0
304,168,4096,2048,18,0,11.9156,a8w8_blockscale_1x128x128_256x64x64x256_16x16_32x32_16x16x1_16x16x1_1x32x1x8_8_1x1_intrawave_v1,236.54,848.38,0.0
304,168,4608,7168,18,0,31.7775,a8w8_blockscale_1x128x128_256x64x64x256_16x16_32x32_16x16x1_16x16x1_1x32x1x8_8_1x1_intrawave_v1,349.24,1126.04,0.0
304,168,6144,1536,18,0,11.0607,a8w8_blockscale_1x128x128_256x64x64x256_16x16_32x32_16x16x1_16x16x1_1x32x1x8_8_1x1_intrawave_v1,286.68,1063.19,0.0
304,168,6144,3072,18,0,18.8918,a8w8_blockscale_1x128x128_256x64x64x256_16x16_32x32_16x16x1_16x16x1_1x32x1x8_8_1x1_intrawave_v1,335.69,1135.67,0.0
304,168,7168,256,11,0,5.6502,a8w8_blockscale_1x128x128_256x32x64x128_16x16_16x16_8x32x1_8x32x1_1x32x1x8_8_2x1_intrawave_v1,109.12,758.64,0.0
304,168,7168,2048,18,0,18.3931,a8w8_blockscale_1x128x128_256x64x64x256_16x16_32x32_16x16x1_16x16x1_1x32x1x8_8_1x1_intrawave_v1,268.17,947.78,0.0
304,168,7168,2304,18,0,19.5507,a8w8_blockscale_1x128x128_256x64x64x256_16x16_32x32_16x16x1_16x16x1_1x32x1x8_8_1x1_intrawave_v1,283.83,987.72,0.0
304,176,512,7168,8,0,17.9874,a8w8_blockscale_1x128x128_256x16x64x256_16x16_16x16_16x16x1_16x16x1_1x16x1x16_4_1x1_intrawave_v1,71.82,284.19,0.0
304,176,576,7168,8,0,18.0603,a8w8_blockscale_1x128x128_256x16x64x256_16x16_16x16_16x16x1_16x16x1_1x16x1x16_4_1x1_intrawave_v1,80.47,309.69,0.0
304,176,1280,4096,8,0,12.4103,a8w8_blockscale_1x128x128_256x16x64x256_16x16_16x16_16x16x1_16x16x1_1x16x1x16_4_1x1_intrawave_v1,148.71,516.86,0.0
304,176,1536,7168,8,0,19.0752,a8w8_blockscale_1x128x128_256x16x64x256_16x16_16x16_16x16x1_16x16x1_1x16x1x16_4_1x1_intrawave_v1,203.17,671.67,0.0
304,176,1792,6144,8,0,21.8348,a8w8_blockscale_1x128x128_256x16x64x256_16x16_16x16_16x16x1_16x16x1_1x16x1x16_4_1x1_intrawave_v1,177.49,582.66,0.0
304,176,2112,7168,8,0,26.0255,a8w8_blockscale_1x128x128_256x16x64x256_16x16_16x16_16x16x1_16x16x1_1x16x1x16_4_1x1_intrawave_v1,204.76,658.73,0.0
304,176,2304,4096,18,0,16.7136,a8w8_blockscale_1x128x128_256x64x64x256_16x16_32x32_16x16x1_16x16x1_1x32x1x8_8_1x1_intrawave_v1,198.75,656.3,0.0
304,176,3072,1536,7,0,8.6932,a8w8_blockscale_1x128x128_256x16x128x256_16x16_16x16_16x16x1_16x16x1_1x16x1x16_8_1x2_intrawave_v1,191.06,698.28,0.0
304,176,3584,6144,18,0,25.5896,a8w8_blockscale_1x128x128_256x64x64x256_16x16_32x32_16x16x1_16x16x1_1x32x1x8_8_1x1_intrawave_v1,302.9,952.07,0.0
304,176,4096,512,8,0,5.6429,a8w8_blockscale_1x128x128_256x16x64x256_16x16_16x16_16x16x1_16x16x1_1x16x1x16_4_1x1_intrawave_v1,130.82,643.12,0.0
304,176,4096,1024,18,0,7.7022,a8w8_blockscale_1x128x128_256x64x64x256_16x16_32x32_16x16x1_16x16x1_1x32x1x8_8_1x1_intrawave_v1,191.68,755.15,0.0
304,176,4096,2048,18,0,11.8886,a8w8_blockscale_1x128x128_256x64x64x256_16x16_32x32_16x16x1_16x16x1_1x32x1x8_8_1x1_intrawave_v1,248.37,857.19,0.0
304,176,4608,7168,18,0,32.9782,a8w8_blockscale_1x128x128_256x64x64x256_16x16_32x32_16x16x1_16x16x1_1x32x1x8_8_1x1_intrawave_v1,352.55,1089.01,0.0
304,176,6144,1536,18,0,11.4973,a8w8_blockscale_1x128x128_256x64x64x256_16x16_32x32_16x16x1_16x16x1_1x32x1x8_8_1x1_intrawave_v1,288.93,1032.43,0.0
304,176,6144,3072,18,0,18.9611,a8w8_blockscale_1x128x128_256x64x64x256_16x16_32x32_16x16x1_16x16x1_1x32x1x8_8_1x1_intrawave_v1,350.39,1138.0,0.0
304,176,7168,256,11,0,5.6611,a8w8_blockscale_1x128x128_256x32x64x128_16x16_16x16_8x32x1_8x32x1_1x32x1x8_8_2x1_intrawave_v1,114.1,777.8,0.0
304,176,7168,2048,18,0,18.6707,a8w8_blockscale_1x128x128_256x64x64x256_16x16_32x32_16x16x1_16x16x1_1x32x1x8_8_1x1_intrawave_v1,276.76,940.71,0.0
304,176,7168,2304,2,0,19.7232,a8w8_blockscale_1x128x128_256x64x128x128_16x16_32x32_8x32x1_8x32x1_1x32x1x8_8_1x1_intrawave_v3,294.74,985.83,0.0
304,184,512,7168,8,0,21.8073,a8w8_blockscale_1x128x128_256x16x64x256_16x16_16x16_16x16x1_16x16x1_1x16x1x16_4_1x1_intrawave_v1,61.93,237.41,0.0
304,184,576,7168,8,0,21.91,a8w8_blockscale_1x128x128_256x16x64x256_16x16_16x16_16x16x1_16x16x1_1x16x1x16_4_1x1_intrawave_v1,69.35,258.31,0.0
304,184,1280,4096,8,0,14.2164,a8w8_blockscale_1x128x128_256x16x64x256_16x16_16x16_16x16x1_16x16x1_1x16x1x16_4_1x1_intrawave_v1,135.72,454.94,0.0
304,184,1536,7168,8,0,23.486,a8w8_blockscale_1x128x128_256x16x64x256_16x16_16x16_16x16x1_16x16x1_1x16x1x16_4_1x1_intrawave_v1,172.52,549.02,0.0
304,184,1792,6144,8,0,22.9465,a8w8_blockscale_1x128x128_256x16x64x256_16x16_16x16_16x16x1_16x16x1_1x16x1x16_4_1x1_intrawave_v1,176.57,557.82,0.0
304,184,2112,7168,18,0,26.3136,a8w8_blockscale_1x128x128_256x64x64x256_16x16_32x32_16x16x1_16x16x1_1x32x1x8_8_1x1_intrawave_v1,211.72,654.98,0.0
304,184,2304,4096,18,0,16.9879,a8w8_blockscale_1x128x128_256x64x64x256_16x16_32x32_16x16x1_16x16x1_1x32x1x8_8_1x1_intrawave_v1,204.43,649.8,0.0
304,184,3072,1536,13,0,9.0177,a8w8_blockscale_1x128x128_256x32x64x256_16x16_16x16_16x16x1_16x16x1_1x32x1x8_8_2x1_intrawave_v1,192.56,679.96,0.0
304,184,3584,6144,18,0,25.6495,a8w8_blockscale_1x128x128_256x64x64x256_16x16_32x32_16x16x1_16x16x1_1x32x1x8_8_1x1_intrawave_v1,315.93,954.0,0.0
304,184,4096,512,18,0,5.6903,a8w8_blockscale_1x128x128_256x64x64x256_16x16_32x32_16x16x1_16x16x1_1x32x1x8_8_1x1_intrawave_v1,135.63,650.0,0.0
304,184,4096,1024,18,0,7.7702,a8w8_blockscale_1x128x128_256x64x64x256_16x16_32x32_16x16x1_16x16x1_1x32x1x8_8_1x1_intrawave_v1,198.64,758.03,0.0
304,184,4096,2048,18,0,11.9113,a8w8_blockscale_1x128x128_256x64x64x256_16x16_32x32_16x16x1_16x16x1_1x32x1x8_8_1x1_intrawave_v1,259.17,862.44,0.0
304,184,4608,7168,18,0,33.0977,a8w8_blockscale_1x128x128_256x64x64x256_16x16_32x32_16x16x1_16x16x1_1x32x1x8_8_1x1_intrawave_v1,367.25,1089.04,0.0
304,184,6144,1536,18,0,11.8082,a8w8_blockscale_1x128x128_256x64x64x256_16x16_32x32_16x16x1_16x16x1_1x32x1x8_8_1x1_intrawave_v1,294.11,1014.62,0.0
304,184,6144,3072,18,0,19.2326,a8w8_blockscale_1x128x128_256x64x64x256_16x16_32x32_16x16x1_16x16x1_1x32x1x8_8_1x1_intrawave_v1,361.15,1128.32,0.0
304,184,7168,256,11,0,5.6985,a8w8_blockscale_1x128x128_256x32x64x128_16x16_16x16_8x32x1_8x32x1_1x32x1x8_8_2x1_intrawave_v1,118.5,793.18,0.0
304,184,7168,2048,18,0,19.0861,a8w8_blockscale_1x128x128_256x64x64x256_16x16_32x32_16x16x1_16x16x1_1x32x1x8_8_1x1_intrawave_v1,283.05,927.1,0.0
304,184,7168,2304,18,0,19.5525,a8w8_blockscale_1x128x128_256x64x64x256_16x16_32x32_16x16x1_16x16x1_1x32x1x8_8_1x1_intrawave_v1,310.83,1001.24,0.0
304,192,512,7168,8,0,17.6888,a8w8_blockscale_1x128x128_256x16x64x256_16x16_16x16_16x16x1_16x16x1_1x16x1x16_4_1x1_intrawave_v1,79.67,296.4,0.0
304,192,576,7168,8,0,17.7729,a8w8_blockscale_1x128x128_256x16x64x256_16x16_16x16_16x16x1_16x16x1_1x16x1x16_4_1x1_intrawave_v1,89.21,322.19,0.0
304,192,1280,4096,8,0,12.5693,a8w8_blockscale_1x128x128_256x16x64x256_16x16_16x16_16x16x1_16x16x1_1x16x1x16_4_1x1_intrawave_v1,160.17,518.79,0.0
304,192,1536,7168,8,0,19.6815,a8w8_blockscale_1x128x128_256x16x64x256_16x16_16x16_16x16x1_16x16x1_1x16x1x16_4_1x1_intrawave_v1,214.81,659.31,0.0
304,192,1792,6144,8,0,22.2554,a8w8_blockscale_1x128x128_256x16x64x256_16x16_16x16_16x16x1_16x16x1_1x16x1x16_4_1x1_intrawave_v1,189.97,578.64,0.0
304,192,2112,7168,18,0,26.4496,a8w8_blockscale_1x128x128_256x64x64x256_16x16_32x32_16x16x1_16x16x1_1x32x1x8_8_1x1_intrawave_v1,219.79,655.06,0.0
304,192,2304,4096,18,0,16.777,a8w8_blockscale_1x128x128_256x64x64x256_16x16_32x32_16x16x1_16x16x1_1x32x1x8_8_1x1_intrawave_v1,216.0,662.12,0.0
304,192,3072,1536,13,0,8.811,a8w8_blockscale_1x128x128_256x32x64x256_16x16_16x16_16x16x1_16x16x1_1x32x1x8_8_2x1_intrawave_v1,205.65,702.89,0.0
304,192,3584,6144,18,0,25.4,a8w8_blockscale_1x128x128_256x64x64x256_16x16_32x32_16x16x1_16x16x1_1x32x1x8_8_1x1_intrawave_v1,332.9,967.56,0.0
304,192,4096,512,18,0,5.7548,a8w8_blockscale_1x128x128_256x64x64x256_16x16_32x32_16x16x1_16x16x1_1x32x1x8_8_1x1_intrawave_v1,139.94,654.81,0.0
304,192,4096,1024,18,0,7.8668,a8w8_blockscale_1x128x128_256x64x64x256_16x16_32x32_16x16x1_16x16x1_1x32x1x8_8_1x1_intrawave_v1,204.74,758.09,0.0
304,192,4096,2048,18,0,11.5204,a8w8_blockscale_1x128x128_256x64x64x256_16x16_32x32_16x16x1_16x16x1_1x32x1x8_8_1x1_intrawave_v1,279.61,898.81,0.0
304,192,4608,7168,18,0,31.3877,a8w8_blockscale_1x128x128_256x64x64x256_16x16_32x32_16x16x1_16x16x1_1x32x1x8_8_1x1_intrawave_v1,404.09,1152.55,0.0
304,192,6144,1536,18,0,11.0567,a8w8_blockscale_1x128x128_256x64x64x256_16x16_32x32_16x16x1_16x16x1_1x32x1x8_8_1x1_intrawave_v1,327.75,1093.58,0.0
304,192,6144,3072,18,0,18.3821,a8w8_blockscale_1x128x128_256x64x64x256_16x16_32x32_16x16x1_16x16x1_1x32x1x8_8_1x1_intrawave_v1,394.28,1187.21,0.0
304,192,7168,256,11,0,5.7458,a8w8_blockscale_1x128x128_256x32x64x128_16x16_16x16_8x32x1_8x32x1_1x32x1x8_8_2x1_intrawave_v1,122.64,806.97,0.0
304,192,7168,2048,18,0,18.5167,a8w8_blockscale_1x128x128_256x64x64x256_16x16_32x32_16x16x1_16x16x1_1x32x1x8_8_1x1_intrawave_v1,304.44,962.69,0.0
304,192,7168,2304,2,0,18.5103,a8w8_blockscale_1x128x128_256x64x128x128_16x16_32x32_8x32x1_8x32x1_1x32x1x8_8_1x1_intrawave_v3,342.61,1064.81,0.0
304,200,512,7168,8,0,22.0375,a8w8_blockscale_1x128x128_256x16x64x256_16x16_16x16_16x16x1_16x16x1_1x16x1x16_4_1x1_intrawave_v1,66.61,240.88,0.0
304,200,576,7168,8,0,22.142,a8w8_blockscale_1x128x128_256x16x64x256_16x16_16x16_16x16x1_16x16x1_1x16x1x16_4_1x1_intrawave_v1,74.59,261.62,0.0
304,200,1280,4096,8,0,14.131,a8w8_blockscale_1x128x128_256x16x64x256_16x16_16x16_16x16x1_16x16x1_1x16x1x16_4_1x1_intrawave_v1,148.41,465.22,0.0
304,200,1536,7168,18,0,25.0877,a8w8_blockscale_1x128x128_256x64x64x256_16x16_32x32_16x16x1_16x16x1_1x32x1x8_8_1x1_intrawave_v1,175.54,520.5,0.0
304,200,1792,6144,18,0,21.9121,a8w8_blockscale_1x128x128_256x64x64x256_16x16_32x32_16x16x1_16x16x1_1x32x1x8_8_1x1_intrawave_v1,200.99,591.26,0.0
304,200,2112,7168,18,0,25.8968,a8w8_blockscale_1x128x128_256x64x64x256_16x16_32x32_16x16x1_16x16x1_1x32x1x8_8_1x1_intrawave_v1,233.83,672.56,0.0
304,200,2304,4096,18,0,15.9721,a8w8_blockscale_1x128x128_256x64x64x256_16x16_32x32_16x16x1_16x16x1_1x32x1x8_8_1x1_intrawave_v1,236.34,699.84,0.0
304,200,3072,1536,18,0,9.3253,a8w8_blockscale_1x128x128_256x64x64x256_16x16_32x32_16x16x1_16x16x1_1x32x1x8_8_1x1_intrawave_v1,202.4,670.71,0.0
304,200,3584,6144,18,0,27.3089,a8w8_blockscale_1x128x128_256x64x64x256_16x16_32x32_16x16x1_16x16x1_1x32x1x8_8_1x1_intrawave_v1,322.53,903.83,0.0
304,200,4096,512,18,0,6.2483,a8w8_blockscale_1x128x128_256x64x64x256_16x16_32x32_16x16x1_16x16x1_1x32x1x8_8_1x1_intrawave_v1,134.25,614.24,0.0
304,200,4096,1024,18,0,8.831,a8w8_blockscale_1x128x128_256x64x64x256_16x16_32x32_16x16x1_16x16x1_1x32x1x8_8_1x1_intrawave_v1,189.98,683.67,0.0
304,200,4096,2048,18,0,12.6104,a8w8_blockscale_1x128x128_256x64x64x256_16x16_32x32_16x16x1_16x16x1_1x32x1x8_8_1x1_intrawave_v1,266.09,827.62,0.0
304,200,4608,7168,18,0,34.6599,a8w8_blockscale_1x128x128_256x64x64x256_16x16_32x32_16x16x1_16x16x1_1x32x1x8_8_1x1_intrawave_v1,381.19,1047.52,0.0
304,200,6144,1536,18,0,15.2439,a8w8_blockscale_1x128x128_256x64x64x256_16x16_32x32_16x16x1_16x16x1_1x32x1x8_8_1x1_intrawave_v1,247.63,800.45,0.0
304,200,6144,3072,18,0,25.211,a8w8_blockscale_1x128x128_256x64x64x256_16x16_32x32_16x16x1_16x16x1_1x32x1x8_8_1x1_intrawave_v1,299.46,870.51,0.0
304,200,7168,256,11,0,6.1547,a8w8_blockscale_1x128x128_256x32x64x128_16x16_16x16_8x32x1_8x32x1_1x32x1x8_8_2x1_intrawave_v1,119.26,772.32,0.0
304,200,7168,2048,18,0,19.2893,a8w8_blockscale_1x128x128_256x64x64x256_16x16_32x32_16x16x1_16x16x1_1x32x1x8_8_1x1_intrawave_v1,304.42,930.92,0.0
304,200,7168,2304,18,0,20.3889,a8w8_blockscale_1x128x128_256x64x64x256_16x16_32x32_16x16x1_16x16x1_1x32x1x8_8_1x1_intrawave_v1,324.0,973.23,0.0
304,208,512,7168,8,0,17.902,a8w8_blockscale_1x128x128_256x16x64x256_16x16_16x16_16x16x1_16x16x1_1x16x1x16_4_1x1_intrawave_v1,85.28,300.19,0.0
304,208,576,7168,8,0,17.9567,a8w8_blockscale_1x128x128_256x16x64x256_16x16_16x16_16x16x1_16x16x1_1x16x1x16_4_1x1_intrawave_v1,95.65,326.3,0.0
304,208,1280,4096,8,0,13.3645,a8w8_blockscale_1x128x128_256x16x64x256_16x16_16x16_16x16x1_16x16x1_1x16x1x16_4_1x1_intrawave_v1,163.2,495.89,0.0
304,208,1536,7168,8,0,25.0411,a8w8_blockscale_1x128x128_256x16x64x256_16x16_16x16_16x16x1_16x16x1_1x16x1x16_4_1x1_intrawave_v1,182.91,524.74,0.0
304,208,1792,6144,18,0,21.9698,a8w8_blockscale_1x128x128_256x64x64x256_16x16_32x32_16x16x1_16x16x1_1x32x1x8_8_1x1_intrawave_v1,208.48,593.24,0.0
304,208,2112,7168,18,0,26.1408,a8w8_blockscale_1x128x128_256x64x64x256_16x16_32x32_16x16x1_16x16x1_1x32x1x8_8_1x1_intrawave_v1,240.92,669.77,0.0
304,208,2304,4096,18,0,15.9309,a8w8_blockscale_1x128x128_256x64x64x256_16x16_32x32_16x16x1_16x16x1_1x32x1x8_8_1x1_intrawave_v1,246.43,706.03,0.0
304,208,3072,1536,18,0,9.4654,a8w8_blockscale_1x128x128_256x64x64x256_16x16_32x32_16x16x1_16x16x1_1x32x1x8_8_1x1_intrawave_v1,207.38,667.28,0.0
304,208,3584,6144,18,0,27.783,a8w8_blockscale_1x128x128_256x64x64x256_16x16_32x32_16x16x1_16x16x1_1x32x1x8_8_1x1_intrawave_v1,329.71,892.24,0.0
304,208,4096,512,18,0,6.2772,a8w8_blockscale_1x128x128_256x64x64x256_16x16_32x32_16x16x1_16x16x1_1x32x1x8_8_1x1_intrawave_v1,138.98,622.5,0.0
304,208,4096,1024,18,0,8.865,a8w8_blockscale_1x128x128_256x64x64x256_16x16_32x32_16x16x1_16x16x1_1x32x1x8_8_1x1_intrawave_v1,196.82,689.37,0.0
304,208,4096,2048,18,0,12.8715,a8w8_blockscale_1x128x128_256x64x64x256_16x16_32x32_16x16x1_16x16x1_1x32x1x8_8_1x1_intrawave_v1,271.12,817.2,0.0
304,208,4608,7168,18,0,34.759,a8w8_blockscale_1x128x128_256x64x64x256_16x16_32x32_16x16x1_16x16x1_1x32x1x8_8_1x1_intrawave_v1,395.31,1048.3,0.0
304,208,6144,1536,18,0,15.3182,a8w8_blockscale_1x128x128_256x64x64x256_16x16_32x32_16x16x1_16x16x1_1x32x1x8_8_1x1_intrawave_v1,256.29,803.79,0.0
304,208,6144,3072,18,0,25.354,a8w8_blockscale_1x128x128_256x64x64x256_16x16_32x32_16x16x1_16x16x1_1x32x1x8_8_1x1_intrawave_v1,309.68,870.44,0.0
304,208,7168,256,11,0,6.1719,a8w8_blockscale_1x128x128_256x32x64x128_16x16_16x16_8x32x1_8x32x1_1x32x1x8_8_2x1_intrawave_v1,123.68,789.08,0.0
304,208,7168,2048,18,0,19.3879,a8w8_blockscale_1x128x128_256x64x64x256_16x16_32x32_16x16x1_16x16x1_1x32x1x8_8_1x1_intrawave_v1,314.99,932.95,0.0
304,208,7168,2304,18,0,20.5627,a8w8_blockscale_1x128x128_256x64x64x256_16x16_32x32_16x16x1_16x16x1_1x32x1x8_8_1x1_intrawave_v1,334.11,971.48,0.0
304,216,512,7168,8,0,21.9024,a8w8_blockscale_1x128x128_256x16x64x256_16x16_16x16_16x16x1_16x16x1_1x16x1x16_4_1x1_intrawave_v1,72.39,248.35,0.0
304,216,576,7168,8,0,21.8591,a8w8_blockscale_1x128x128_256x16x64x256_16x16_16x16_16x16x1_16x16x1_1x16x1x16_4_1x1_intrawave_v1,81.6,271.09,0.0
304,216,1280,4096,8,0,14.1938,a8w8_blockscale_1x128x128_256x16x64x256_16x16_16x16_16x16x1_16x16x1_1x16x1x16_4_1x1_intrawave_v1,159.57,470.67,0.0
304,216,1536,7168,18,0,25.3791,a8w8_blockscale_1x128x128_256x64x64x256_16x16_32x32_16x16x1_16x16x1_1x32x1x8_8_1x1_intrawave_v1,187.41,520.98,0.0
304,216,1792,6144,18,0,22.3181,a8w8_blockscale_1x128x128_256x64x64x256_16x16_32x32_16x16x1_16x16x1_1x32x1x8_8_1x1_intrawave_v1,213.12,587.47,0.0
304,216,2112,7168,18,0,26.4853,a8w8_blockscale_1x128x128_256x64x64x256_16x16_32x32_16x16x1_16x16x1_1x32x1x8_8_1x1_intrawave_v1,246.93,664.5,0.0
304,216,2304,4096,18,0,16.0949,a8w8_blockscale_1x128x128_256x64x64x256_16x16_32x32_16x16x1_16x16x1_1x32x1x8_8_1x1_intrawave_v1,253.3,703.16,0.0
304,216,3072,1536,18,0,9.4213,a8w8_blockscale_1x128x128_256x64x64x256_16x16_32x32_16x16x1_16x16x1_1x32x1x8_8_1x1_intrawave_v1,216.36,676.92,0.0
304,216,3584,6144,18,0,27.5873,a8w8_blockscale_1x128x128_256x64x64x256_16x16_32x32_16x16x1_16x16x1_1x32x1x8_8_1x1_intrawave_v1,344.82,902.43,0.0
304,216,4096,512,18,0,6.2593,a8w8_blockscale_1x128x128_256x64x64x256_16x16_32x32_16x16x1_16x16x1_1x32x1x8_8_1x1_intrawave_v1,144.74,635.41,0.0
304,216,4096,1024,18,0,8.9223,a8w8_blockscale_1x128x128_256x64x64x256_16x16_32x32_16x16x1_16x16x1_1x32x1x8_8_1x1_intrawave_v1,203.08,693.2,0.0
304,216,4096,2048,18,0,12.9047,a8w8_blockscale_1x128x128_256x64x64x256_16x16_32x32_16x16x1_16x16x1_1x32x1x8_8_1x1_intrawave_v1,280.82,821.44,0.0
304,216,4608,7168,18,0,35.7358,a8w8_blockscale_1x128x128_256x64x64x256_16x16_32x32_16x16x1_16x16x1_1x32x1x8_8_1x1_intrawave_v1,399.29,1023.32,0.0
304,216,6144,1536,18,0,15.5336,a8w8_blockscale_1x128x128_256x64x64x256_16x16_32x32_16x16x1_16x16x1_1x32x1x8_8_1x1_intrawave_v1,262.45,799.76,0.0
304,216,6144,3072,18,0,25.5366,a8w8_blockscale_1x128x128_256x64x64x256_16x16_32x32_16x16x1_16x16x1_1x32x1x8_8_1x1_intrawave_v1,319.3,869.03,0.0
304,216,7168,256,11,0,6.2164,a8w8_blockscale_1x128x128_256x32x64x128_16x16_16x16_8x32x1_8x32x1_1x32x1x8_8_2x1_intrawave_v1,127.52,802.21,0.0
304,216,7168,2048,18,0,19.5959,a8w8_blockscale_1x128x128_256x64x64x256_16x16_32x32_16x16x1_16x16x1_1x32x1x8_8_1x1_intrawave_v1,323.63,929.74,0.0
304,216,7168,2304,18,0,20.6731,a8w8_blockscale_1x128x128_256x64x64x256_16x16_32x32_16x16x1_16x16x1_1x32x1x8_8_1x1_intrawave_v1,345.11,972.73,0.0
304,224,512,7168,8,0,17.8125,a8w8_blockscale_1x128x128_256x16x64x256_16x16_16x16_16x16x1_16x16x1_1x16x1x16_4_1x1_intrawave_v1,92.3,309.05,0.0
304,224,576,7168,8,0,17.9874,a8w8_blockscale_1x128x128_256x16x64x256_16x16_16x16_16x16x1_16x16x1_1x16x1x16_4_1x1_intrawave_v1,102.83,333.15,0.0
304,224,1280,4096,8,0,13.1307,a8w8_blockscale_1x128x128_256x16x64x256_16x16_16x16_16x16x1_16x16x1_1x16x1x16_4_1x1_intrawave_v1,178.88,512.83,0.0
304,224,1536,7168,8,0,25.1423,a8w8_blockscale_1x128x128_256x16x64x256_16x16_16x16_16x16x1_16x16x1_1x16x1x16_4_1x1_intrawave_v1,196.18,529.14,0.0
304,224,1792,6144,7,0,22.7399,a8w8_blockscale_1x128x128_256x16x128x256_16x16_16x16_16x16x1_16x16x1_1x16x1x16_8_1x2_intrawave_v1,216.91,580.0,0.0
304,224,2112,7168,18,0,26.5382,a8w8_blockscale_1x128x128_256x64x64x256_16x16_32x32_16x16x1_16x16x1_1x32x1x8_8_1x1_intrawave_v1,255.56,666.61,0.0
304,224,2304,4096,18,0,16.4086,a8w8_blockscale_1x128x128_256x64x64x256_16x16_32x32_16x16x1_16x16x1_1x32x1x8_8_1x1_intrawave_v1,257.66,693.96,0.0
304,224,3072,1536,18,0,9.458,a8w8_blockscale_1x128x128_256x64x64x256_16x16_32x32_16x16x1_16x16x1_1x32x1x8_8_1x1_intrawave_v1,223.51,680.79,0.0
304,224,3584,6144,18,0,28.0881,a8w8_blockscale_1x128x128_256x64x64x256_16x16_32x32_16x16x1_16x16x1_1x32x1x8_8_1x1_intrawave_v1,351.22,890.13,0.0
304,224,4096,512,18,0,6.3117,a8w8_blockscale_1x128x128_256x64x64x256_16x16_32x32_16x16x1_16x16x1_1x32x1x8_8_1x1_intrawave_v1,148.85,641.17,0.0
304,224,4096,1024,12,0,8.8292,a8w8_blockscale_1x128x128_256x32x128x256_16x16_32x32_16x16x1_16x16x1_1x32x1x8_8_1x1_intrawave_v1,212.82,708.86,0.0
304,224,4096,2048,18,0,13.0709,a8w8_blockscale_1x128x128_256x64x64x256_16x16_32x32_16x16x1_16x16x1_1x32x1x8_8_1x1_intrawave_v1,287.52,817.26,0.0
304,224,4608,7168,18,0,35.615,a8w8_blockscale_1x128x128_256x64x64x256_16x16_32x32_16x16x1_16x16x1_1x32x1x8_8_1x1_intrawave_v1,415.49,1030.47,0.0
304,224,6144,1536,18,0,15.4088,a8w8_blockscale_1x128x128_256x64x64x256_16x16_32x32_16x16x1_16x16x1_1x32x1x8_8_1x1_intrawave_v1,274.38,813.42,0.0
304,224,6144,3072,18,0,25.5528,a8w8_blockscale_1x128x128_256x64x64x256_16x16_32x32_16x16x1_16x16x1_1x32x1x8_8_1x1_intrawave_v1,330.91,873.29,0.0
304,224,7168,256,11,0,6.2404,a8w8_blockscale_1x128x128_256x32x64x128_16x16_16x16_8x32x1_8x32x1_1x32x1x8_8_2x1_intrawave_v1,131.74,817.83,0.0
304,224,7168,2048,18,0,19.6617,a8w8_blockscale_1x128x128_256x64x64x256_16x16_32x32_16x16x1_16x16x1_1x32x1x8_8_1x1_intrawave_v1,334.49,933.29,0.0
304,224,7168,2304,18,0,20.6116,a8w8_blockscale_1x128x128_256x64x64x256_16x16_32x32_16x16x1_16x16x1_1x32x1x8_8_1x1_intrawave_v1,358.96,982.09,0.0
304,232,512,7168,8,0,21.9125,a8w8_blockscale_1x128x128_256x16x64x256_16x16_16x16_16x16x1_16x16x1_1x16x1x16_4_1x1_intrawave_v1,77.71,254.22,0.0
304,232,576,7168,8,0,22.1718,a8w8_blockscale_1x128x128_256x16x64x256_16x16_16x16_16x16x1_16x16x1_1x16x1x16_4_1x1_intrawave_v1,86.4,273.28,0.0
304,232,1280,4096,8,0,14.3186,a8w8_blockscale_1x128x128_256x16x64x256_16x16_16x16_16x16x1_16x16x1_1x16x1x16_4_1x1_intrawave_v1,169.9,474.0,0.0
304,232,1536,7168,18,0,26.2886,a8w8_blockscale_1x128x128_256x64x64x256_16x16_32x32_16x16x1_16x16x1_1x32x1x8_8_1x1_intrawave_v1,194.33,509.18,0.0
304,232,1792,6144,18,0,22.9707,a8w8_blockscale_1x128x128_256x64x64x256_16x16_32x32_16x16x1_16x16x1_1x32x1x8_8_1x1_intrawave_v1,222.4,577.56,0.0
304,232,2112,7168,18,0,26.7485,a8w8_blockscale_1x128x128_256x64x64x256_16x16_32x32_16x16x1_16x16x1_1x32x1x8_8_1x1_intrawave_v1,262.61,664.78,0.0
304,232,2304,4096,18,0,16.6859,a8w8_blockscale_1x128x128_256x64x64x256_16x16_32x32_16x16x1_16x16x1_1x32x1x8_8_1x1_intrawave_v1,262.43,686.6,0.0
304,232,3072,1536,18,0,9.8329,a8w8_blockscale_1x128x128_256x64x64x256_16x16_32x32_16x16x1_16x16x1_1x32x1x8_8_1x1_intrawave_v1,222.66,661.08,0.0
304,232,3584,6144,18,0,28.4494,a8w8_blockscale_1x128x128_256x64x64x256_16x16_32x32_16x16x1_16x16x1_1x32x1x8_8_1x1_intrawave_v1,359.14,882.57,0.0
304,232,4096,512,18,0,6.3681,a8w8_blockscale_1x128x128_256x64x64x256_16x16_32x32_16x16x1_16x16x1_1x32x1x8_8_1x1_intrawave_v1,152.81,646.42,0.0
304,232,4096,1024,18,0,9.053,a8w8_blockscale_1x128x128_256x64x64x256_16x16_32x32_16x16x1_16x16x1_1x32x1x8_8_1x1_intrawave_v1,214.97,699.48,0.0
304,232,4096,2048,18,0,13.2592,a8w8_blockscale_1x128x128_256x64x64x256_16x16_32x32_16x16x1_16x16x1_1x32x1x8_8_1x1_intrawave_v1,293.56,811.84,0.0
304,232,4608,7168,18,0,35.5592,a8w8_blockscale_1x128x128_256x64x64x256_16x16_32x32_16x16x1_16x16x1_1x32x1x8_8_1x1_intrawave_v1,431.0,1035.77,0.0
304,232,6144,1536,18,0,15.8609,a8w8_blockscale_1x128x128_256x64x64x256_16x16_32x32_16x16x1_16x16x1_1x32x1x8_8_1x1_intrawave_v1,276.08,797.2,0.0
304,232,6144,3072,18,0,25.8833,a8w8_blockscale_1x128x128_256x64x64x256_16x16_32x32_16x16x1_16x16x1_1x32x1x8_8_1x1_intrawave_v1,338.35,866.89,0.0
304,232,7168,256,11,0,6.1694,a8w8_blockscale_1x128x128_256x32x64x128_16x16_16x16_8x32x1_8x32x1_1x32x1x8_8_2x1_intrawave_v1,138.01,846.17,0.0
304,232,7168,2048,18,0,19.8921,a8w8_blockscale_1x128x128_256x64x64x256_16x16_32x32_16x16x1_16x16x1_1x32x1x8_8_1x1_intrawave_v1,342.42,929.07,0.0
304,232,7168,2304,18,0,20.7796,a8w8_blockscale_1x128x128_256x64x64x256_16x16_32x32_16x16x1_16x16x1_1x32x1x8_8_1x1_intrawave_v1,368.77,980.56,0.0
304,240,512,7168,8,0,18.0028,a8w8_blockscale_1x128x128_256x16x64x256_16x16_16x16_16x16x1_16x16x1_1x16x1x16_4_1x1_intrawave_v1,97.85,313.07,0.0
304,240,576,7168,8,0,18.1645,a8w8_blockscale_1x128x128_256x16x64x256_16x16_16x16_16x16x1_16x16x1_1x16x1x16_4_1x1_intrawave_v1,109.1,337.23,0.0
304,240,1280,4096,8,0,12.9571,a8w8_blockscale_1x128x128_256x16x64x256_16x16_16x16_16x16x1_16x16x1_1x16x1x16_4_1x1_intrawave_v1,194.22,527.92,0.0
304,240,1536,7168,8,0,25.611,a8w8_blockscale_1x128x128_256x16x64x256_16x16_16x16_16x16x1_16x16x1_1x16x1x16_4_1x1_intrawave_v1,206.35,525.85,0.0
304,240,1792,6144,18,0,23.0333,a8w8_blockscale_1x128x128_256x64x64x256_16x16_32x32_16x16x1_16x16x1_1x32x1x8_8_1x1_intrawave_v1,229.44,579.37,0.0
304,240,2112,7168,18,0,26.8654,a8w8_blockscale_1x128x128_256x64x64x256_16x16_32x32_16x16x1_16x16x1_1x32x1x8_8_1x1_intrawave_v1,270.48,665.28,0.0
304,240,2304,4096,18,0,17.2216,a8w8_blockscale_1x128x128_256x64x64x256_16x16_32x32_16x16x1_16x16x1_1x32x1x8_8_1x1_intrawave_v1,263.03,669.28,0.0
304,240,3072,1536,18,0,9.4559,a8w8_blockscale_1x128x128_256x64x64x256_16x16_32x32_16x16x1_16x16x1_1x32x1x8_8_1x1_intrawave_v1,239.52,693.94,0.0
304,240,3584,6144,18,0,28.7863,a8w8_blockscale_1x128x128_256x64x64x256_16x16_32x32_16x16x1_16x16x1_1x32x1x8_8_1x1_intrawave_v1,367.18,875.94,0.0
304,240,4096,512,18,0,6.3866,a8w8_blockscale_1x128x128_256x64x64x256_16x16_32x32_16x16x1_16x16x1_1x32x1x8_8_1x1_intrawave_v1,157.62,655.45,0.0
304,240,4096,1024,18,0,9.064,a8w8_blockscale_1x128x128_256x64x64x256_16x16_32x32_16x16x1_16x16x1_1x32x1x8_8_1x1_intrawave_v1,222.12,706.77,0.0
304,240,4096,2048,18,0,13.4663,a8w8_blockscale_1x128x128_256x64x64x256_16x16_32x32_16x16x1_16x16x1_1x32x1x8_8_1x1_intrawave_v1,299.01,805.43,0.0
304,240,4608,7168,18,0,36.771,a8w8_blockscale_1x128x128_256x64x64x256_16x16_32x32_16x16x1_16x16x1_1x32x1x8_8_1x1_intrawave_v1,431.17,1005.2,0.0
304,240,6144,1536,18,0,15.8428,a8w8_blockscale_1x128x128_256x64x64x256_16x16_32x32_16x16x1_16x16x1_1x32x1x8_8_1x1_intrawave_v1,285.92,805.09,0.0
304,240,6144,3072,18,0,26.2605,a8w8_blockscale_1x128x128_256x64x64x256_16x16_32x32_16x16x1_16x16x1_1x32x1x8_8_1x1_intrawave_v1,344.99,859.11,0.0
304,240,7168,256,11,0,6.205,a8w8_blockscale_1x128x128_256x32x64x128_16x16_16x16_8x32x1_8x32x1_1x32x1x8_8_2x1_intrawave_v1,141.95,860.13,0.0
304,240,7168,2048,18,0,20.0885,a8w8_blockscale_1x128x128_256x64x64x256_16x16_32x32_16x16x1_16x16x1_1x32x1x8_8_1x1_intrawave_v1,350.77,926.51,0.0
304,240,7168,2304,18,0,20.9932,a8w8_blockscale_1x128x128_256x64x64x256_16x16_32x32_16x16x1_16x16x1_1x32x1x8_8_1x1_intrawave_v1,377.61,976.92,0.0
304,248,512,7168,8,0,21.6713,a8w8_blockscale_1x128x128_256x16x64x256_16x16_16x16_16x16x1_16x16x1_1x16x1x16_4_1x1_intrawave_v1,84.0,263.1,0.0
304,248,576,7168,8,0,22.0363,a8w8_blockscale_1x128x128_256x16x64x256_16x16_16x16_16x16x1_16x16x1_1x16x1x16_4_1x1_intrawave_v1,92.93,281.0,0.0
304,248,1280,4096,8,0,15.5115,a8w8_blockscale_1x128x128_256x16x64x256_16x16_16x16_16x16x1_16x16x1_1x16x1x16_4_1x1_intrawave_v1,167.65,444.42,0.0
304,248,1536,7168,18,0,26.6373,a8w8_blockscale_1x128x128_256x64x64x256_16x16_32x32_16x16x1_16x16x1_1x32x1x8_8_1x1_intrawave_v1,205.01,508.67,0.0
304,248,1792,6144,18,0,23.7281,a8w8_blockscale_1x128x128_256x64x64x256_16x16_32x32_16x16x1_16x16x1_1x32x1x8_8_1x1_intrawave_v1,230.15,565.68,0.0
304,248,2112,7168,18,0,27.1587,a8w8_blockscale_1x128x128_256x64x64x256_16x16_32x32_16x16x1_16x16x1_1x32x1x8_8_1x1_intrawave_v1,276.48,661.45,0.0
304,248,2304,4096,18,0,17.6104,a8w8_blockscale_1x128x128_256x64x64x256_16x16_32x32_16x16x1_16x16x1_1x32x1x8_8_1x1_intrawave_v1,265.8,658.46,0.0
304,248,3072,1536,18,0,9.4568,a8w8_blockscale_1x128x128_256x64x64x256_16x16_32x32_16x16x1_16x16x1_1x32x1x8_8_1x1_intrawave_v1,247.49,700.37,0.0
304,248,3584,6144,18,0,29.0158,a8w8_blockscale_1x128x128_256x64x64x256_16x16_32x32_16x16x1_16x16x1_1x32x1x8_8_1x1_intrawave_v1,376.41,872.68,0.0
304,248,4096,512,18,0,6.3544,a8w8_blockscale_1x128x128_256x64x64x256_16x16_32x32_16x16x1_16x16x1_1x32x1x8_8_1x1_intrawave_v1,163.7,669.73,0.0
304,248,4096,1024,18,0,9.1347,a8w8_blockscale_1x128x128_256x64x64x256_16x16_32x32_16x16x1_16x16x1_1x32x1x8_8_1x1_intrawave_v1,227.74,709.37,0.0
304,248,4096,2048,18,0,13.5047,a8w8_blockscale_1x128x128_256x64x64x256_16x16_32x32_16x16x1_16x16x1_1x32x1x8_8_1x1_intrawave_v1,308.1,809.21,0.0
304,248,4608,7168,18,0,36.745,a8w8_blockscale_1x128x128_256x64x64x256_16x16_32x32_16x16x1_16x16x1_1x32x1x8_8_1x1_intrawave_v1,445.86,1009.48,0.0
304,248,6144,1536,18,0,15.8671,a8w8_blockscale_1x128x128_256x64x64x256_16x16_32x32_16x16x1_16x16x1_1x32x1x8_8_1x1_intrawave_v1,295.0,810.83,0.0
304,248,6144,3072,18,0,26.3134,a8w8_blockscale_1x128x128_256x64x64x256_16x16_32x32_16x16x1_16x16x1_1x32x1x8_8_1x1_intrawave_v1,355.78,862.06,0.0
304,248,7168,256,11,0,6.2467,a8w8_blockscale_1x128x128_256x32x64x128_16x16_16x16_8x32x1_8x32x1_1x32x1x8_8_2x1_intrawave_v1,145.7,873.07,0.0
304,248,7168,2048,18,0,20.1184,a8w8_blockscale_1x128x128_256x64x64x256_16x16_32x32_16x16x1_16x16x1_1x32x1x8_8_1x1_intrawave_v1,361.92,931.65,0.0
304,248,7168,2304,18,0,21.1087,a8w8_blockscale_1x128x128_256x64x64x256_16x16_32x32_16x16x1_16x16x1_1x32x1x8_8_1x1_intrawave_v1,388.06,977.88,0.0
304,256,512,7168,8,0,17.3458,a8w8_blockscale_1x128x128_256x16x64x256_16x16_16x16_16x16x1_16x16x1_1x16x1x16_4_1x1_intrawave_v1,108.33,332.48,0.0
304,256,576,7168,8,0,17.5869,a8w8_blockscale_1x128x128_256x16x64x256_16x16_16x16_16x16x1_16x16x1_1x16x1x16_4_1x1_intrawave_v1,120.2,355.87,0.0
304,256,1280,4096,8,0,15.2051,a8w8_blockscale_1x128x128_256x16x64x256_16x16_16x16_16x16x1_16x16x1_1x16x1x16_4_1x1_intrawave_v1,176.54,456.87,0.0
304,256,1536,7168,18,0,26.0363,a8w8_blockscale_1x128x128_256x64x64x256_16x16_32x32_16x16x1_16x16x1_1x32x1x8_8_1x1_intrawave_v1,216.51,523.56,0.0
304,256,1792,6144,18,0,23.015,a8w8_blockscale_1x128x128_256x64x64x256_16x16_32x32_16x16x1_16x16x1_1x32x1x8_8_1x1_intrawave_v1,244.93,586.59,0.0
304,256,2112,7168,18,0,26.6665,a8w8_blockscale_1x128x128_256x64x64x256_16x16_32x32_16x16x1_16x16x1_1x32x1x8_8_1x1_intrawave_v1,290.67,677.07,0.0
304,256,2304,4096,18,0,16.5382,a8w8_blockscale_1x128x128_256x64x64x256_16x16_32x32_16x16x1_16x16x1_1x32x1x8_8_1x1_intrawave_v1,292.16,705.36,0.0
304,256,3072,1536,18,0,9.313,a8w8_blockscale_1x128x128_256x64x64x256_16x16_32x32_16x16x1_16x16x1_1x32x1x8_8_1x1_intrawave_v1,259.41,717.78,0.0
304,256,3584,6144,18,0,28.0469,a8w8_blockscale_1x128x128_256x64x64x256_16x16_32x32_16x16x1_16x16x1_1x32x1x8_8_1x1_intrawave_v1,401.98,906.62,0.0
304,256,4096,512,13,0,5.527,a8w8_blockscale_1x128x128_256x32x64x256_16x16_16x16_16x16x1_16x16x1_1x32x1x8_8_2x1_intrawave_v1,194.27,782.59,0.0
304,256,4096,1024,18,0,8.2869,a8w8_blockscale_1x128x128_256x64x64x256_16x16_32x32_16x16x1_16x16x1_1x32x1x8_8_1x1_intrawave_v1,259.14,790.84,0.0
304,256,4096,2048,18,0,12.8738,a8w8_blockscale_1x128x128_256x64x64x256_16x16_32x32_16x16x1_16x16x1_1x32x1x8_8_1x1_intrawave_v1,333.62,855.23,0.0
304,256,4608,7168,18,0,34.387,a8w8_blockscale_1x128x128_256x64x64x256_16x16_32x32_16x16x1_16x16x1_1x32x1x8_8_1x1_intrawave_v1,491.8,1082.52,0.0
304,256,6144,1536,18,0,15.504,a8w8_blockscale_1x128x128_256x64x64x256_16x16_32x32_16x16x1_16x16x1_1x32x1x8_8_1x1_intrawave_v1,311.65,836.95,0.0
304,256,6144,3072,18,0,25.7832,a8w8_blockscale_1x128x128_256x64x64x256_16x16_32x32_16x16x1_16x16x1_1x32x1x8_8_1x1_intrawave_v1,374.81,884.55,0.0
304,256,7168,256,11,0,5.4367,a8w8_blockscale_1x128x128_256x32x64x128_16x16_16x16_8x32x1_8x32x1_1x32x1x8_8_2x1_intrawave_v1,172.81,1024.62,0.0
304,256,7168,2048,18,0,19.4616,a8w8_blockscale_1x128x128_256x64x64x256_16x16_32x32_16x16x1_16x16x1_1x32x1x8_8_1x1_intrawave_v1,386.21,969.83,0.0
304,256,7168,2304,18,0,20.5096,a8w8_blockscale_1x128x128_256x64x64x256_16x16_32x32_16x16x1_16x16x1_1x32x1x8_8_1x1_intrawave_v1,412.28,1012.94,0.0
304,264,512,7168,8,0,22.025,a8w8_blockscale_1x128x128_256x16x64x256_16x16_16x16_16x16x1_16x16x1_1x16x1x16_4_1x1_intrawave_v1,87.98,264.82,0.0
304,264,576,7168,8,0,22.0744,a8w8_blockscale_1x128x128_256x16x64x256_16x16_16x16_16x16x1_16x16x1_1x16x1x16_4_1x1_intrawave_v1,98.76,286.54,0.0
304,264,1280,4096,18,0,15.7397,a8w8_blockscale_1x128x128_256x64x64x256_16x16_32x32_16x16x1_16x16x1_1x32x1x8_8_1x1_intrawave_v1,175.88,444.74,0.0
304,264,1536,7168,18,0,25.7946,a8w8_blockscale_1x128x128_256x64x64x256_16x16_32x32_16x16x1_16x16x1_1x32x1x8_8_1x1_intrawave_v1,225.37,531.64,0.0
304,264,1792,6144,18,0,22.7521,a8w8_blockscale_1x128x128_256x64x64x256_16x16_32x32_16x16x1_16x16x1_1x32x1x8_8_1x1_intrawave_v1,255.51,596.79,0.0
304,264,2112,7168,18,0,27.0769,a8w8_blockscale_1x128x128_256x64x64x256_16x16_32x32_16x16x1_16x16x1_1x32x1x8_8_1x1_intrawave_v1,295.21,670.18,0.0
304,264,2304,4096,18,0,17.964,a8w8_blockscale_1x128x128_256x64x64x256_16x16_32x32_16x16x1_16x16x1_1x32x1x8_8_1x1_intrawave_v1,277.38,653.25,0.0
304,264,3072,1536,18,0,10.2299,a8w8_blockscale_1x128x128_256x64x64x256_16x16_32x32_16x16x1_16x16x1_1x32x1x8_8_1x1_intrawave_v1,243.54,659.45,0.0
304,264,3584,6144,18,0,31.4811,a8w8_blockscale_1x128x128_256x64x64x256_16x16_32x32_16x16x1_16x16x1_1x32x1x8_8_1x1_intrawave_v1,369.32,811.1,0.0
304,264,4096,512,13,0,6.7489,a8w8_blockscale_1x128x128_256x32x64x256_16x16_16x16_16x16x1_16x16x1_1x32x1x8_8_2x1_intrawave_v1,164.07,651.22,0.0
304,264,4096,1024,13,0,9.8958,a8w8_blockscale_1x128x128_256x32x64x256_16x16_16x16_16x16x1_16x16x1_1x32x1x8_8_2x1_intrawave_v1,223.79,669.71,0.0
304,264,4096,2048,12,0,15.9281,a8w8_blockscale_1x128x128_256x32x128x256_16x16_32x32_16x16x1_16x16x1_1x32x1x8_8_1x1_intrawave_v1,278.07,696.38,0.0
304,264,4608,7168,18,0,52.0908,a8w8_blockscale_1x128x128_256x64x64x256_16x16_32x32_16x16x1_16x16x1_1x32x1x8_8_1x1_intrawave_v1,334.8,717.12,0.0
304,264,6144,1536,18,0,16.3268,a8w8_blockscale_1x128x128_256x64x64x256_16x16_32x32_16x16x1_16x16x1_1x32x1x8_8_1x1_intrawave_v1,305.19,801.55,0.0
304,264,6144,3072,18,0,27.8557,a8w8_blockscale_1x128x128_256x64x64x256_16x16_32x32_16x16x1_16x16x1_1x32x1x8_8_1x1_intrawave_v1,357.76,823.15,0.0
304,264,7168,256,11,0,7.043,a8w8_blockscale_1x128x128_256x32x64x128_16x16_16x16_8x32x1_8x32x1_1x32x1x8_8_2x1_intrawave_v1,137.57,807.51,0.0
304,264,7168,2048,18,0,22.6846,a8w8_blockscale_1x128x128_256x64x64x256_16x16_32x32_16x16x1_16x16x1_1x32x1x8_8_1x1_intrawave_v1,341.69,837.81,0.0
304,264,7168,2304,2,0,23.7561,a8w8_blockscale_1x128x128_256x64x128x128_16x16_32x32_8x32x1_8x32x1_1x32x1x8_8_1x1_intrawave_v3,367.06,880.11,0.0
304,272,512,7168,8,0,18.1117,a8w8_blockscale_1x128x128_256x16x64x256_16x16_16x16_16x16x1_16x16x1_1x16x1x16_4_1x1_intrawave_v1,110.23,325.66,0.0
304,272,576,7168,8,0,18.2338,a8w8_blockscale_1x128x128_256x16x64x256_16x16_16x16_16x16x1_16x16x1_1x16x1x16_4_1x1_intrawave_v1,123.18,350.55,0.0
304,272,1280,4096,7,0,15.5677,a8w8_blockscale_1x128x128_256x16x128x256_16x16_16x16_16x16x1_16x16x1_1x16x1x16_8_1x2_intrawave_v1,183.21,453.07,0.0
304,272,1536,7168,18,0,26.1912,a8w8_blockscale_1x128x128_256x64x64x256_16x16_32x32_16x16x1_16x16x1_1x32x1x8_8_1x1_intrawave_v1,228.68,526.72,0.0
304,272,1792,6144,18,0,22.99,a8w8_blockscale_1x128x128_256x64x64x256_16x16_32x32_16x16x1_16x16x1_1x32x1x8_8_1x1_intrawave_v1,260.52,594.0,0.0
304,272,2112,7168,18,0,27.2339,a8w8_blockscale_1x128x128_256x64x64x256_16x16_32x32_16x16x1_16x16x1_1x32x1x8_8_1x1_intrawave_v1,302.4,669.66,0.0
304,272,2304,4096,18,0,18.323,a8w8_blockscale_1x128x128_256x64x64x256_16x16_32x32_16x16x1_16x16x1_1x32x1x8_8_1x1_intrawave_v1,280.18,644.25,0.0
304,272,3072,1536,18,0,10.0957,a8w8_blockscale_1x128x128_256x64x64x256_16x16_32x32_16x16x1_16x16x1_1x32x1x8_8_1x1_intrawave_v1,254.26,674.3,0.0
304,272,3584,6144,18,0,31.554,a8w8_blockscale_1x128x128_256x64x64x256_16x16_32x32_16x16x1_16x16x1_1x32x1x8_8_1x1_intrawave_v1,379.63,812.61,0.0
304,272,4096,512,13,0,6.8265,a8w8_blockscale_1x128x128_256x32x64x256_16x16_16x16_16x16x1_16x16x1_1x32x1x8_8_2x1_intrawave_v1,167.12,654.02,0.0
304,272,4096,1024,13,0,9.5737,a8w8_blockscale_1x128x128_256x32x64x256_16x16_16x16_16x16x1_16x16x1_1x32x1x8_8_2x1_intrawave_v1,238.33,699.94,0.0
304,272,4096,2048,12,0,15.9993,a8w8_blockscale_1x128x128_256x32x128x256_16x16_32x32_16x16x1_16x16x1_1x32x1x8_8_1x1_intrawave_v1,285.23,698.4,0.0
304,272,4608,7168,18,0,51.2509,a8w8_blockscale_1x128x128_256x64x64x256_16x16_32x32_16x16x1_16x16x1_1x32x1x8_8_1x1_intrawave_v1,350.6,731.43,0.0
304,272,6144,1536,18,0,16.626,a8w8_blockscale_1x128x128_256x64x64x256_16x16_32x32_16x16x1_16x16x1_1x32x1x8_8_1x1_intrawave_v1,308.78,793.78,0.0
304,272,6144,3072,18,0,27.8446,a8w8_blockscale_1x128x128_256x64x64x256_16x16_32x32_16x16x1_16x16x1_1x32x1x8_8_1x1_intrawave_v1,368.75,827.89,0.0
304,272,7168,256,11,0,7.0763,a8w8_blockscale_1x128x128_256x32x64x128_16x16_16x16_8x32x1_8x32x1_1x32x1x8_8_2x1_intrawave_v1,141.07,820.21,0.0
304,272,7168,2048,18,0,22.8415,a8w8_blockscale_1x128x128_256x64x64x256_16x16_32x32_16x16x1_16x16x1_1x32x1x8_8_1x1_intrawave_v1,349.62,837.8,0.0
304,272,7168,2304,2,0,24.1176,a8w8_blockscale_1x128x128_256x64x128x128_16x16_32x32_8x32x1_8x32x1_1x32x1x8_8_1x1_intrawave_v3,372.52,872.44,0.0
304,280,512,7168,8,0,22.141,a8w8_blockscale_1x128x128_256x16x64x256_16x16_16x16_16x16x1_16x16x1_1x16x1x16_4_1x1_intrawave_v1,92.82,269.35,0.0
304,280,576,7168,8,0,22.2866,a8w8_blockscale_1x128x128_256x16x64x256_16x16_16x16_16x16x1_16x16x1_1x16x1x16_4_1x1_intrawave_v1,103.74,289.79,0.0
304,280,1280,4096,18,0,15.9929,a8w8_blockscale_1x128x128_256x64x64x256_16x16_32x32_16x16x1_16x16x1_1x32x1x8_8_1x1_intrawave_v1,183.58,444.36,0.0
304,280,1536,7168,18,0,26.1988,a8w8_blockscale_1x128x128_256x64x64x256_16x16_32x32_16x16x1_16x16x1_1x32x1x8_8_1x1_intrawave_v1,235.34,529.69,0.0
304,280,1792,6144,18,0,23.2953,a8w8_blockscale_1x128x128_256x64x64x256_16x16_32x32_16x16x1_16x16x1_1x32x1x8_8_1x1_intrawave_v1,264.67,589.56,0.0
304,280,2112,7168,18,0,28.2872,a8w8_blockscale_1x128x128_256x64x64x256_16x16_32x32_16x16x1_16x16x1_1x32x1x8_8_1x1_intrawave_v1,299.7,647.95,0.0
304,280,2304,4096,18,0,18.5679,a8w8_blockscale_1x128x128_256x64x64x256_16x16_32x32_16x16x1_16x16x1_1x32x1x8_8_1x1_intrawave_v1,284.62,639.51,0.0
304,280,3072,1536,18,0,9.8356,a8w8_blockscale_1x128x128_256x64x64x256_16x16_32x32_16x16x1_16x16x1_1x32x1x8_8_1x1_intrawave_v1,268.66,698.38,0.0
304,280,3584,6144,18,0,31.7868,a8w8_blockscale_1x128x128_256x64x64x256_16x16_32x32_16x16x1_16x16x1_1x32x1x8_8_1x1_intrawave_v1,387.94,810.0,0.0
304,280,4096,512,13,0,6.8104,a8w8_blockscale_1x128x128_256x32x64x256_16x16_16x16_16x16x1_16x16x1_1x32x1x8_8_2x1_intrawave_v1,172.44,665.79,0.0
304,280,4096,1024,13,0,9.8516,a8w8_blockscale_1x128x128_256x32x64x256_16x16_16x16_16x16x1_16x16x1_1x32x1x8_8_2x1_intrawave_v1,238.42,687.68,0.0
304,280,4096,2048,12,0,16.3132,a8w8_blockscale_1x128x128_256x32x128x256_16x16_32x32_16x16x1_16x16x1_1x32x1x8_8_1x1_intrawave_v1,287.96,689.98,0.0
304,280,4608,7168,18,0,53.2367,a8w8_blockscale_1x128x128_256x64x64x256_16x16_32x32_16x16x1_16x16x1_1x32x1x8_8_1x1_intrawave_v1,347.45,706.61,0.0
304,280,6144,1536,18,0,16.5092,a8w8_blockscale_1x128x128_256x64x64x256_16x16_32x32_16x16x1_16x16x1_1x32x1x8_8_1x1_intrawave_v1,320.11,806.09,0.0
304,280,6144,3072,18,0,28.1115,a8w8_blockscale_1x128x128_256x64x64x256_16x16_32x32_16x16x1_16x16x1_1x32x1x8_8_1x1_intrawave_v1,375.99,824.4,0.0
304,280,7168,256,11,0,7.0165,a8w8_blockscale_1x128x128_256x32x64x128_16x16_16x16_8x32x1_8x32x1_1x32x1x8_8_2x1_intrawave_v1,146.46,843.83,0.0
304,280,7168,2048,18,0,22.5342,a8w8_blockscale_1x128x128_256x64x64x256_16x16_32x32_16x16x1_16x16x1_1x32x1x8_8_1x1_intrawave_v1,364.82,855.04,0.0
304,280,7168,2304,2,0,23.8618,a8w8_blockscale_1x128x128_256x64x128x128_16x16_32x32_8x32x1_8x32x1_1x32x1x8_8_1x1_intrawave_v3,387.58,887.37,0.0
304,288,512,7168,8,0,18.0333,a8w8_blockscale_1x128x128_256x16x64x256_16x16_16x16_16x16x1_16x16x1_1x16x1x16_4_1x1_intrawave_v1,117.22,334.34,0.0
304,288,576,7168,8,0,18.1574,a8w8_blockscale_1x128x128_256x16x64x256_16x16_16x16_16x16x1_16x16x1_1x16x1x16_4_1x1_intrawave_v1,130.98,359.35,0.0
304,288,1280,4096,7,0,15.9119,a8w8_blockscale_1x128x128_256x16x128x256_16x16_16x16_16x16x1_16x16x1_1x16x1x16_8_1x2_intrawave_v1,189.79,449.97,0.0
304,288,1536,7168,18,0,26.5369,a8w8_blockscale_1x128x128_256x64x64x256_16x16_32x32_16x16x1_16x16x1_1x32x1x8_8_1x1_intrawave_v1,238.98,526.03,0.0
304,288,1792,6144,18,0,23.4015,a8w8_blockscale_1x128x128_256x64x64x256_16x16_32x32_16x16x1_16x16x1_1x32x1x8_8_1x1_intrawave_v1,271.0,590.21,0.0
304,288,2112,7168,18,0,28.161,a8w8_blockscale_1x128x128_256x64x64x256_16x16_32x32_16x16x1_16x16x1_1x32x1x8_8_1x1_intrawave_v1,309.65,654.09,0.0
304,288,2304,4096,18,0,18.5022,a8w8_blockscale_1x128x128_256x64x64x256_16x16_32x32_16x16x1_16x16x1_1x32x1x8_8_1x1_intrawave_v1,293.79,645.54,0.0
304,288,3072,1536,18,0,10.2959,a8w8_blockscale_1x128x128_256x64x64x256_16x16_32x32_16x16x1_16x16x1_1x32x1x8_8_1x1_intrawave_v1,263.98,673.13,0.0
304,288,3584,6144,18,0,31.9691,a8w8_blockscale_1x128x128_256x64x64x256_16x16_32x32_16x16x1_16x16x1_1x32x1x8_8_1x1_intrawave_v1,396.74,808.72,0.0
304,288,4096,512,13,0,6.5784,a8w8_blockscale_1x128x128_256x32x64x256_16x16_16x16_16x16x1_16x16x1_1x32x1x8_8_2x1_intrawave_v1,183.63,699.85,0.0
304,288,4096,1024,12,0,10.3373,a8w8_blockscale_1x128x128_256x32x128x256_16x16_32x32_16x16x1_16x16x1_1x32x1x8_8_1x1_intrawave_v1,233.71,662.5,0.0
304,288,4096,2048,12,0,15.9671,a8w8_blockscale_1x128x128_256x32x128x256_16x16_32x32_16x16x1_16x16x1_1x32x1x8_8_1x1_intrawave_v1,302.61,710.07,0.0
304,288,4608,7168,18,0,52.4231,a8w8_blockscale_1x128x128_256x64x64x256_16x16_32x32_16x16x1_16x16x1_1x32x1x8_8_1x1_intrawave_v1,362.92,720.08,0.0
304,288,6144,1536,18,0,16.4967,a8w8_blockscale_1x128x128_256x64x64x256_16x16_32x32_16x16x1_16x16x1_1x32x1x8_8_1x1_intrawave_v1,329.51,813.4,0.0
304,288,6144,3072,18,0,28.2402,a8w8_blockscale_1x128x128_256x64x64x256_16x16_32x32_16x16x1_16x16x1_1x32x1x8_8_1x1_intrawave_v1,384.97,825.0,0.0
304,288,7168,256,11,0,7.0299,a8w8_blockscale_1x128x128_256x32x64x128_16x16_16x16_8x32x1_8x32x1_1x32x1x8_8_2x1_intrawave_v1,150.35,858.83,0.0
304,288,7168,2048,18,0,22.277,a8w8_blockscale_1x128x128_256x64x64x256_16x16_32x32_16x16x1_16x16x1_1x32x1x8_8_1x1_intrawave_v1,379.57,870.79,0.0
304,288,7168,2304,18,0,24.1954,a8w8_blockscale_1x128x128_256x64x64x256_16x16_32x32_16x16x1_16x16x1_1x32x1x8_8_1x1_intrawave_v1,393.16,880.64,0.0
304,296,512,7168,8,0,21.8845,a8w8_blockscale_1x128x128_256x16x64x256_16x16_16x16_16x16x1_16x16x1_1x16x1x16_4_1x1_intrawave_v1,99.28,278.5,0.0
304,296,576,7168,8,0,22.1783,a8w8_blockscale_1x128x128_256x16x64x256_16x16_16x16_16x16x1_16x16x1_1x16x1x16_4_1x1_intrawave_v1,110.21,297.2,0.0
304,296,1280,4096,18,0,16.4755,a8w8_blockscale_1x128x128_256x64x64x256_16x16_32x32_16x16x1_16x16x1_1x32x1x8_8_1x1_intrawave_v1,188.39,437.8,0.0
304,296,1536,7168,18,0,26.4584,a8w8_blockscale_1x128x128_256x64x64x256_16x16_32x32_16x16x1_16x16x1_1x32x1x8_8_1x1_intrawave_v1,246.35,530.69,0.0
304,296,1792,6144,18,0,23.7905,a8w8_blockscale_1x128x128_256x64x64x256_16x16_32x32_16x16x1_16x16x1_1x32x1x8_8_1x1_intrawave_v1,273.97,583.83,0.0
304,296,2112,7168,18,0,28.6546,a8w8_blockscale_1x128x128_256x64x64x256_16x16_32x32_16x16x1_16x16x1_1x32x1x8_8_1x1_intrawave_v1,312.77,646.0,0.0
304,296,2304,4096,18,0,18.7798,a8w8_blockscale_1x128x128_256x64x64x256_16x16_32x32_16x16x1_16x16x1_1x32x1x8_8_1x1_intrawave_v1,297.49,639.71,0.0
304,296,3072,1536,18,0,10.3625,a8w8_blockscale_1x128x128_256x64x64x256_16x16_32x32_16x16x1_16x16x1_1x32x1x8_8_1x1_intrawave_v1,269.57,674.73,0.0
304,296,3584,6144,18,0,32.0436,a8w8_blockscale_1x128x128_256x64x64x256_16x16_32x32_16x16x1_16x16x1_1x32x1x8_8_1x1_intrawave_v1,406.82,810.16,0.0
304,296,4096,512,18,0,8.062,a8w8_blockscale_1x128x128_256x64x64x256_16x16_32x32_16x16x1_16x16x1_1x32x1x8_8_1x1_intrawave_v1,154.0,579.7,0.0
304,296,4096,1024,3,0,11.8037,a8w8_blockscale_1x128x128_256x64x64x128_16x16_32x32_8x32x1_8x32x1_1x32x1x8_8_1x1_intrawave_v3,210.36,586.45,0.0
304,296,4096,2048,18,0,18.5295,a8w8_blockscale_1x128x128_256x64x64x256_16x16_32x32_16x16x1_16x16x1_1x32x1x8_8_1x1_intrawave_v1,268.01,616.3,0.0
304,296,4608,7168,18,0,53.5147,a8w8_blockscale_1x128x128_256x64x64x256_16x16_32x32_16x16x1_16x16x1_1x32x1x8_8_1x1_intrawave_v1,365.39,707.84,0.0
304,296,6144,1536,18,0,16.6017,a8w8_blockscale_1x128x128_256x64x64x256_16x16_32x32_16x16x1_16x16x1_1x32x1x8_8_1x1_intrawave_v1,336.52,814.92,0.0
304,296,6144,3072,18,0,28.2167,a8w8_blockscale_1x128x128_256x64x64x256_16x16_32x32_16x16x1_16x16x1_1x32x1x8_8_1x1_intrawave_v1,395.99,830.04,0.0
304,296,7168,256,16,0,7.1669,a8w8_blockscale_1x128x128_256x64x64x128_16x16_32x32_8x32x1_8x32x1_1x32x1x8_8_1x1_intrawave_v1,151.58,858.7,0.0
304,296,7168,2048,18,0,22.6652,a8w8_blockscale_1x128x128_256x64x64x256_16x16_32x32_16x16x1_16x16x1_1x32x1x8_8_1x1_intrawave_v1,383.43,861.66,0.0
304,296,7168,2304,2,0,24.2674,a8w8_blockscale_1x128x128_256x64x128x128_16x16_32x32_8x32x1_8x32x1_1x32x1x8_8_1x1_intrawave_v3,402.88,883.51,0.0
304,304,512,7168,8,0,18.3632,a8w8_blockscale_1x128x128_256x16x64x256_16x16_16x16_16x16x1_16x16x1_1x16x1x16_4_1x1_intrawave_v1,121.51,335.47,0.0
304,304,576,7168,8,0,18.5132,a8w8_blockscale_1x128x128_256x16x64x256_16x16_16x16_16x16x1_16x16x1_1x16x1x16_4_1x1_intrawave_v1,135.59,359.64,0.0
304,304,1280,4096,7,0,16.088,a8w8_blockscale_1x128x128_256x16x128x256_16x16_16x16_16x16x1_16x16x1_1x16x1x16_8_1x2_intrawave_v1,198.14,451.66,0.0
304,304,1536,7168,18,0,26.9175,a8w8_blockscale_1x128x128_256x64x64x256_16x16_32x32_16x16x1_16x16x1_1x32x1x8_8_1x1_intrawave_v1,248.69,524.68,0.0
304,304,1792,6144,18,0,24.0372,a8w8_blockscale_1x128x128_256x64x64x256_16x16_32x32_16x16x1_16x16x1_1x32x1x8_8_1x1_intrawave_v1,278.49,581.07,0.0
304,304,2112,7168,18,0,28.4951,a8w8_blockscale_1x128x128_256x64x64x256_16x16_32x32_16x16x1_16x16x1_1x32x1x8_8_1x1_intrawave_v1,323.02,652.81,0.0
304,304,2304,4096,18,0,19.1806,a8w8_blockscale_1x128x128_256x64x64x256_16x16_32x32_16x16x1_16x16x1_1x32x1x8_8_1x1_intrawave_v1,299.15,629.97,0.0
304,304,3072,1536,18,0,10.2209,a8w8_blockscale_1x128x128_256x64x64x256_16x16_32x32_16x16x1_16x16x1_1x32x1x8_8_1x1_intrawave_v1,280.69,690.09,0.0
304,304,3584,6144,18,0,32.4029,a8w8_blockscale_1x128x128_256x64x64x256_16x16_32x32_16x16x1_16x16x1_1x32x1x8_8_1x1_intrawave_v1,413.18,804.46,0.0
304,304,4096,512,3,0,7.8849,a8w8_blockscale_1x128x128_256x64x64x128_16x16_32x32_8x32x1_8x32x1_1x32x1x8_8_1x1_intrawave_v3,161.71,601.55,0.0
304,304,4096,1024,18,0,12.5301,a8w8_blockscale_1x128x128_256x64x64x256_16x16_32x32_16x16x1_16x16x1_1x32x1x8_8_1x1_intrawave_v1,203.52,558.33,0.0
304,304,4096,2048,18,0,18.7604,a8w8_blockscale_1x128x128_256x64x64x256_16x16_32x32_16x16x1_16x16x1_1x32x1x8_8_1x1_intrawave_v1,271.86,613.08,0.0
304,304,4608,7168,18,0,54.0027,a8w8_blockscale_1x128x128_256x64x64x256_16x16_32x32_16x16x1_16x16x1_1x32x1x8_8_1x1_intrawave_v1,371.88,703.87,0.0
304,304,6144,1536,18,0,16.9401,a8w8_blockscale_1x128x128_256x64x64x256_16x16_32x32_16x16x1_16x16x1_1x32x1x8_8_1x1_intrawave_v1,338.71,805.17,0.0
304,304,6144,3072,18,0,28.4987,a8w8_blockscale_1x128x128_256x64x64x256_16x16_32x32_16x16x1_16x16x1_1x32x1x8_8_1x1_intrawave_v1,402.67,826.14,0.0
304,304,7168,256,16,0,6.7814,a8w8_blockscale_1x128x128_256x64x64x128_16x16_32x32_8x32x1_8x32x1_1x32x1x8_8_1x1_intrawave_v1,164.52,924.73,0.0
304,304,7168,2048,18,0,23.0212,a8w8_blockscale_1x128x128_256x64x64x256_16x16_32x32_16x16x1_16x16x1_1x32x1x8_8_1x1_intrawave_v1,387.71,854.03,0.0
304,304,7168,2304,2,0,24.3156,a8w8_blockscale_1x128x128_256x64x128x128_16x16_32x32_8x32x1_8x32x1_1x32x1x8_8_1x1_intrawave_v3,412.95,887.23,0.0
304,312,512,7168,8,0,22.0027,a8w8_blockscale_1x128x128_256x16x64x256_16x16_16x16_16x16x1_16x16x1_1x16x1x16_4_1x1_intrawave_v1,104.08,282.96,0.0
304,312,576,7168,8,0,22.3531,a8w8_blockscale_1x128x128_256x16x64x256_16x16_16x16_16x16x1_16x16x1_1x16x1x16_4_1x1_intrawave_v1,115.26,300.84,0.0
304,312,1280,4096,18,0,16.9954,a8w8_blockscale_1x128x128_256x64x64x256_16x16_32x32_16x16x1_16x16x1_1x32x1x8_8_1x1_intrawave_v1,192.5,430.68,0.0
304,312,1536,7168,18,0,27.4523,a8w8_blockscale_1x128x128_256x64x64x256_16x16_32x32_16x16x1_16x16x1_1x32x1x8_8_1x1_intrawave_v1,250.26,517.44,0.0
304,312,1792,6144,18,0,24.2622,a8w8_blockscale_1x128x128_256x64x64x256_16x16_32x32_16x16x1_16x16x1_1x32x1x8_8_1x1_intrawave_v1,283.17,578.89,0.0
304,312,2112,7168,18,0,28.7727,a8w8_blockscale_1x128x128_256x64x64x256_16x16_32x32_16x16x1_16x16x1_1x32x1x8_8_1x1_intrawave_v1,328.32,649.68,0.0
304,312,2304,4096,18,0,19.1826,a8w8_blockscale_1x128x128_256x64x64x256_16x16_32x32_16x16x1_16x16x1_1x32x1x8_8_1x1_intrawave_v1,306.99,633.53,0.0
304,312,3072,1536,18,0,10.5986,a8w8_blockscale_1x128x128_256x64x64x256_16x16_32x32_16x16x1_16x16x1_1x32x1x8_8_1x1_intrawave_v1,277.81,671.29,0.0
304,312,3584,6144,18,0,32.463,a8w8_blockscale_1x128x128_256x64x64x256_16x16_32x32_16x16x1_16x16x1_1x32x1x8_8_1x1_intrawave_v1,423.27,806.25,0.0
304,312,4096,512,3,0,8.0059,a8w8_blockscale_1x128x128_256x64x64x128_16x16_32x32_8x32x1_8x32x1_1x32x1x8_8_1x1_intrawave_v3,163.46,601.16,0.0
304,312,4096,1024,18,0,12.2212,a8w8_blockscale_1x128x128_256x64x64x256_16x16_32x32_16x16x1_16x16x1_1x32x1x8_8_1x1_intrawave_v1,214.16,578.48,0.0
304,312,4096,2048,18,0,18.8311,a8w8_blockscale_1x128x128_256x64x64x256_16x16_32x32_16x16x1_16x16x1_1x32x1x8_8_1x1_intrawave_v1,277.97,615.13,0.0
304,312,4608,7168,18,0,54.8629,a8w8_blockscale_1x128x128_256x64x64x256_16x16_32x32_16x16x1_16x16x1_1x32x1x8_8_1x1_intrawave_v1,375.68,695.22,0.0
304,312,6144,1536,18,0,17.0085,a8w8_blockscale_1x128x128_256x64x64x256_16x16_32x32_16x16x1_16x16x1_1x32x1x8_8_1x1_intrawave_v1,346.23,808.44,0.0
304,312,6144,3072,18,0,28.6707,a8w8_blockscale_1x128x128_256x64x64x256_16x16_32x32_16x16x1_16x16x1_1x32x1x8_8_1x1_intrawave_v1,410.79,825.47,0.0
304,312,7168,256,16,0,6.8104,a8w8_blockscale_1x128x128_256x64x64x128_16x16_32x32_8x32x1_8x32x1_1x32x1x8_8_1x1_intrawave_v1,168.13,937.93,0.0
304,312,7168,2048,18,0,22.7597,a8w8_blockscale_1x128x128_256x64x64x256_16x16_32x32_16x16x1_16x16x1_1x32x1x8_8_1x1_intrawave_v1,402.48,869.6,0.0
304,312,7168,2304,2,0,24.3661,a8w8_blockscale_1x128x128_256x64x128x128_16x16_32x32_8x32x1_8x32x1_1x32x1x8_8_1x1_intrawave_v3,422.94,890.86,0.0
304,320,512,7168,8,0,18.2228,a8w8_blockscale_1x128x128_256x16x64x256_16x16_16x16_16x16x1_16x16x1_1x16x1x16_4_1x1_intrawave_v1,128.89,345.25,0.0
304,320,576,7168,8,0,18.5523,a8w8_blockscale_1x128x128_256x16x64x256_16x16_16x16_16x16x1_16x16x1_1x16x1x16_4_1x1_intrawave_v1,142.43,366.06,0.0
304,320,1280,4096,7,0,16.2013,a8w8_blockscale_1x128x128_256x16x128x256_16x16_16x16_16x16x1_16x16x1_1x16x1x16_8_1x2_intrawave_v1,207.11,455.07,0.0
304,320,1536,7168,18,0,26.1438,a8w8_blockscale_1x128x128_256x64x64x256_16x16_32x32_16x16x1_16x16x1_1x32x1x8_8_1x1_intrawave_v1,269.53,546.47,0.0
304,320,1792,6144,18,0,23.4043,a8w8_blockscale_1x128x128_256x64x64x256_16x16_32x32_16x16x1_16x16x1_1x32x1x8_8_1x1_intrawave_v1,301.07,603.44,0.0
304,320,2112,7168,18,0,27.5305,a8w8_blockscale_1x128x128_256x64x64x256_16x16_32x32_16x16x1_16x16x1_1x32x1x8_8_1x1_intrawave_v1,351.93,682.31,0.0
304,320,2304,4096,18,0,18.2375,a8w8_blockscale_1x128x128_256x64x64x256_16x16_32x32_16x16x1_16x16x1_1x32x1x8_8_1x1_intrawave_v1,331.17,670.18,0.0
304,320,3072,1536,18,0,10.0968,a8w8_blockscale_1x128x128_256x64x64x256_16x16_32x32_16x16x1_16x16x1_1x32x1x8_8_1x1_intrawave_v1,299.09,710.74,0.0
304,320,3584,6144,18,0,30.746,a8w8_blockscale_1x128x128_256x64x64x256_16x16_32x32_16x16x1_16x16x1_1x32x1x8_8_1x1_intrawave_v1,458.36,854.74,0.0
304,320,4096,512,18,0,7.9761,a8w8_blockscale_1x128x128_256x64x64x256_16x16_32x32_16x16x1_16x16x1_1x32x1x8_8_1x1_intrawave_v1,168.27,612.13,0.0
304,320,4096,1024,3,0,12.6512,a8w8_blockscale_1x128x128_256x64x64x128_16x16_32x32_8x32x1_8x32x1_1x32x1x8_8_1x1_intrawave_v3,212.18,564.64,0.0
304,320,4096,2048,18,0,18.9012,a8w8_blockscale_1x128x128_256x64x64x256_16x16_32x32_16x16x1_16x16x1_1x32x1x8_8_1x1_intrawave_v1,284.04,617.18,0.0
304,320,4608,7168,18,0,55.2984,a8w8_blockscale_1x128x128_256x64x64x256_16x16_32x32_16x16x1_16x16x1_1x32x1x8_8_1x1_intrawave_v1,382.28,692.12,0.0
304,320,6144,1536,18,0,17.064,a8w8_blockscale_1x128x128_256x64x64x256_16x16_32x32_16x16x1_16x16x1_1x32x1x8_8_1x1_intrawave_v1,353.95,812.29,0.0
304,320,6144,3072,18,0,28.2496,a8w8_blockscale_1x128x128_256x64x64x256_16x16_32x32_16x16x1_16x16x1_1x32x1x8_8_1x1_intrawave_v1,427.6,842.12,0.0
304,320,7168,256,18,0,6.7642,a8w8_blockscale_1x128x128_256x64x64x256_16x16_32x32_16x16x1_16x16x1_1x32x1x8_8_1x1_intrawave_v1,173.62,961.6,0.0
304,320,7168,2048,18,0,22.9945,a8w8_blockscale_1x128x128_256x64x64x256_16x16_32x32_16x16x1_16x16x1_1x32x1x8_8_1x1_intrawave_v1,408.59,866.42,0.0
304,320,7168,2304,2,0,23.2656,a8w8_blockscale_1x128x128_256x64x128x128_16x16_32x32_8x32x1_8x32x1_1x32x1x8_8_1x1_intrawave_v3,454.3,938.72,0.0
304,328,512,7168,8,0,22.279,a8w8_blockscale_1x128x128_256x16x64x256_16x16_16x16_16x16x1_16x16x1_1x16x1x16_4_1x1_intrawave_v1,108.06,285.34,0.0
304,328,576,7168,8,0,22.4798,a8w8_blockscale_1x128x128_256x16x64x256_16x16_16x16_16x16x1_16x16x1_1x16x1x16_4_1x1_intrawave_v1,120.48,305.06,0.0
304,328,1280,4096,18,0,15.9764,a8w8_blockscale_1x128x128_256x64x64x256_16x16_32x32_16x16x1_16x16x1_1x32x1x8_8_1x1_intrawave_v1,215.28,464.81,0.0
304,328,1536,7168,18,0,26.4813,a8w8_blockscale_1x128x128_256x64x64x256_16x16_32x32_16x16x1_16x16x1_1x32x1x8_8_1x1_intrawave_v1,272.74,542.6,0.0
304,328,1792,6144,18,0,23.5348,a8w8_blockscale_1x128x128_256x64x64x256_16x16_32x32_16x16x1_16x16x1_1x32x1x8_8_1x1_intrawave_v1,306.89,603.4,0.0
304,328,2112,7168,18,0,29.3708,a8w8_blockscale_1x128x128_256x64x64x256_16x16_32x32_16x16x1_16x16x1_1x32x1x8_8_1x1_intrawave_v1,338.13,642.66,0.0
304,328,2304,4096,18,0,19.8806,a8w8_blockscale_1x128x128_256x64x64x256_16x16_32x32_16x16x1_16x16x1_1x32x1x8_8_1x1_intrawave_v1,311.4,618.3,0.0
304,328,3072,1536,18,0,10.6853,a8w8_blockscale_1x128x128_256x64x64x256_16x16_32x32_16x16x1_16x16x1_1x32x1x8_8_1x1_intrawave_v1,289.69,677.34,0.0
304,328,3584,6144,18,0,44.8197,a8w8_blockscale_1x128x128_256x64x64x256_16x16_32x32_16x16x1_16x16x1_1x32x1x8_8_1x1_intrawave_v1,322.3,588.72,0.0
304,328,4096,512,3,0,8.2868,a8w8_blockscale_1x128x128_256x64x64x128_16x16_32x32_8x32x1_8x32x1_1x32x1x8_8_1x1_intrawave_v3,166.01,597.58,0.0
304,328,4096,1024,18,0,12.3804,a8w8_blockscale_1x128x128_256x64x64x256_16x16_32x32_16x16x1_16x16x1_1x32x1x8_8_1x1_intrawave_v1,222.24,582.95,0.0
304,328,4096,2048,18,0,18.6732,a8w8_blockscale_1x128x128_256x64x64x256_16x16_32x32_16x16x1_16x16x1_1x32x1x8_8_1x1_intrawave_v1,294.7,629.1,0.0
304,328,4608,7168,18,0,56.5268,a8w8_blockscale_1x128x128_256x64x64x256_16x16_32x32_16x16x1_16x16x1_1x32x1x8_8_1x1_intrawave_v1,383.32,679.4,0.0
304,328,6144,1536,18,0,18.0191,a8w8_blockscale_1x128x128_256x64x64x256_16x16_32x32_16x16x1_16x16x1_1x32x1x8_8_1x1_intrawave_v1,343.57,775.37,0.0
304,328,6144,3072,18,0,30.9431,a8w8_blockscale_1x128x128_256x64x64x256_16x16_32x32_16x16x1_16x16x1_1x32x1x8_8_1x1_intrawave_v1,400.14,772.79,0.0
304,328,7168,256,16,0,7.7005,a8w8_blockscale_1x128x128_256x64x64x128_16x16_32x32_8x32x1_8x32x1_1x32x1x8_8_1x1_intrawave_v1,156.32,859.84,0.0
304,328,7168,2048,18,0,29.187,a8w8_blockscale_1x128x128_256x64x64x256_16x16_32x32_16x16x1_16x16x1_1x32x1x8_8_1x1_intrawave_v1,329.95,687.09,0.0
304,328,7168,2304,3,0,30.1166,a8w8_blockscale_1x128x128_256x64x64x128_16x16_32x32_8x32x1_8x32x1_1x32x1x8_8_1x1_intrawave_v3,359.73,729.6,0.0
304,336,512,7168,8,0,18.5034,a8w8_blockscale_1x128x128_256x16x64x256_16x16_16x16_16x16x1_16x16x1_1x16x1x16_4_1x1_intrawave_v1,133.29,347.1,0.0
304,336,576,7168,8,0,18.5252,a8w8_blockscale_1x128x128_256x16x64x256_16x16_16x16_16x16x1_16x16x1_1x16x1x16_4_1x1_intrawave_v1,149.77,373.78,0.0
304,336,1280,4096,18,0,16.0601,a8w8_blockscale_1x128x128_256x64x64x256_16x16_32x32_16x16x1_16x16x1_1x32x1x8_8_1x1_intrawave_v1,219.38,465.71,0.0
304,336,1536,7168,18,0,25.9501,a8w8_blockscale_1x128x128_256x64x64x256_16x16_32x32_16x16x1_16x16x1_1x32x1x8_8_1x1_intrawave_v1,285.11,556.86,0.0
304,336,1792,6144,18,0,24.0444,a8w8_blockscale_1x128x128_256x64x64x256_16x16_32x32_16x16x1_16x16x1_1x32x1x8_8_1x1_intrawave_v1,307.71,593.85,0.0
304,336,2112,7168,18,0,29.6648,a8w8_blockscale_1x128x128_256x64x64x256_16x16_32x32_16x16x1_16x16x1_1x32x1x8_8_1x1_intrawave_v1,342.94,639.36,0.0
304,336,2304,4096,18,0,20.2115,a8w8_blockscale_1x128x128_256x64x64x256_16x16_32x32_16x16x1_16x16x1_1x32x1x8_8_1x1_intrawave_v1,313.77,611.62,0.0
304,336,3072,1536,18,0,10.3674,a8w8_blockscale_1x128x128_256x64x64x256_16x16_32x32_16x16x1_16x16x1_1x32x1x8_8_1x1_intrawave_v1,305.85,704.04,0.0
304,336,3584,6144,18,0,43.3756,a8w8_blockscale_1x128x128_256x64x64x256_16x16_32x32_16x16x1_16x16x1_1x32x1x8_8_1x1_intrawave_v1,341.15,610.78,0.0
304,336,4096,512,18,0,8.3427,a8w8_blockscale_1x128x128_256x64x64x256_16x16_32x32_16x16x1_16x16x1_1x32x1x8_8_1x1_intrawave_v1,168.92,601.93,0.0
304,336,4096,1024,18,0,12.3387,a8w8_blockscale_1x128x128_256x64x64x256_16x16_32x32_16x16x1_16x16x1_1x32x1x8_8_1x1_intrawave_v1,228.43,590.9,0.0
304,336,4096,2048,18,0,18.9591,a8w8_blockscale_1x128x128_256x64x64x256_16x16_32x32_16x16x1_16x16x1_1x32x1x8_8_1x1_intrawave_v1,297.33,623.94,0.0
304,336,4608,7168,18,0,55.5229,a8w8_blockscale_1x128x128_256x64x64x256_16x16_32x32_16x16x1_16x16x1_1x32x1x8_8_1x1_intrawave_v1,399.77,694.04,0.0
304,336,6144,1536,18,0,18.1447,a8w8_blockscale_1x128x128_256x64x64x256_16x16_32x32_16x16x1_16x16x1_1x32x1x8_8_1x1_intrawave_v1,349.51,776.1,0.0
304,336,6144,3072,18,0,31.0184,a8w8_blockscale_1x128x128_256x64x64x256_16x16_32x32_16x16x1_16x16x1_1x32x1x8_8_1x1_intrawave_v1,408.9,774.87,0.0
304,336,7168,256,16,0,7.7466,a8w8_blockscale_1x128x128_256x64x64x128_16x16_32x32_8x32x1_8x32x1_1x32x1x8_8_1x1_intrawave_v1,159.18,869.79,0.0
304,336,7168,2048,18,0,29.1067,a8w8_blockscale_1x128x128_256x64x64x256_16x16_32x32_16x16x1_16x16x1_1x32x1x8_8_1x1_intrawave_v1,338.93,693.49,0.0
304,336,7168,2304,3,0,30.1873,a8w8_blockscale_1x128x128_256x64x64x128_16x16_32x32_8x32x1_8x32x1_1x32x1x8_8_1x1_intrawave_v3,367.64,732.3,0.0
304,344,512,7168,8,0,22.4555,a8w8_blockscale_1x128x128_256x16x64x256_16x16_16x16_16x16x1_16x16x1_1x16x1x16_4_1x1_intrawave_v1,112.44,288.93,0.0
304,344,576,7168,8,0,22.4124,a8w8_blockscale_1x128x128_256x16x64x256_16x16_16x16_16x16x1_16x16x1_1x16x1x16_4_1x1_intrawave_v1,126.74,311.92,0.0
304,344,1280,4096,18,0,16.1318,a8w8_blockscale_1x128x128_256x64x64x256_16x16_32x32_16x16x1_16x16x1_1x32x1x8_8_1x1_intrawave_v1,223.6,466.94,0.0
304,344,1536,7168,18,0,26.2653,a8w8_blockscale_1x128x128_256x64x64x256_16x16_32x32_16x16x1_16x16x1_1x32x1x8_8_1x1_intrawave_v1,288.4,553.3,0.0
304,344,1792,6144,18,0,24.5015,a8w8_blockscale_1x128x128_256x64x64x256_16x16_32x32_16x16x1_16x16x1_1x32x1x8_8_1x1_intrawave_v1,309.16,585.94,0.0
304,344,2112,7168,18,0,30.7576,a8w8_blockscale_1x128x128_256x64x64x256_16x16_32x32_16x16x1_16x16x1_1x32x1x8_8_1x1_intrawave_v1,338.63,619.61,0.0
304,344,2304,4096,18,0,20.2478,a8w8_blockscale_1x128x128_256x64x64x256_16x16_32x32_16x16x1_16x16x1_1x32x1x8_8_1x1_intrawave_v1,320.67,613.96,0.0
304,344,3072,1536,18,0,10.8468,a8w8_blockscale_1x128x128_256x64x64x256_16x16_32x32_16x16x1_16x16x1_1x32x1x8_8_1x1_intrawave_v1,299.29,678.59,0.0
304,344,3584,6144,18,0,45.5105,a8w8_blockscale_1x128x128_256x64x64x256_16x16_32x32_16x16x1_16x16x1_1x32x1x8_8_1x1_intrawave_v1,332.89,584.47,0.0
304,344,4096,512,18,0,8.3627,a8w8_blockscale_1x128x128_256x64x64x256_16x16_32x32_16x16x1_16x16x1_1x32x1x8_8_1x1_intrawave_v1,172.53,608.81,0.0
304,344,4096,1024,18,0,11.7982,a8w8_blockscale_1x128x128_256x64x64x256_16x16_32x32_16x16x1_16x16x1_1x32x1x8_8_1x1_intrawave_v1,244.59,624.21,0.0
304,344,4096,2048,18,0,18.8244,a8w8_blockscale_1x128x128_256x64x64x256_16x16_32x32_16x16x1_16x16x1_1x32x1x8_8_1x1_intrawave_v1,306.59,632.75,0.0
304,344,4608,7168,18,0,55.0637,a8w8_blockscale_1x128x128_256x64x64x256_16x16_32x32_16x16x1_16x16x1_1x32x1x8_8_1x1_intrawave_v1,412.7,702.21,0.0
304,344,6144,1536,18,0,18.1619,a8w8_blockscale_1x128x128_256x64x64x256_16x16_32x32_16x16x1_16x16x1_1x32x1x8_8_1x1_intrawave_v1,357.49,781.45,0.0
304,344,6144,3072,18,0,30.8578,a8w8_blockscale_1x128x128_256x64x64x256_16x16_32x32_16x16x1_16x16x1_1x32x1x8_8_1x1_intrawave_v1,420.82,782.89,0.0
304,344,7168,256,16,0,7.7304,a8w8_blockscale_1x128x128_256x64x64x128_16x16_32x32_8x32x1_8x32x1_1x32x1x8_8_1x1_intrawave_v1,163.31,886.71,0.0
304,344,7168,2048,18,0,29.3414,a8w8_blockscale_1x128x128_256x64x64x256_16x16_32x32_16x16x1_16x16x1_1x32x1x8_8_1x1_intrawave_v1,344.22,692.41,0.0
304,344,7168,2304,3,0,30.223,a8w8_blockscale_1x128x128_256x64x64x128_16x16_32x32_8x32x1_8x32x1_1x32x1x8_8_1x1_intrawave_v3,375.95,735.84,0.0
304,352,512,7168,8,0,18.3684,a8w8_blockscale_1x128x128_256x16x64x256_16x16_16x16_16x16x1_16x16x1_1x16x1x16_4_1x1_intrawave_v1,140.66,356.79,0.0
304,352,576,7168,8,0,18.6276,a8w8_blockscale_1x128x128_256x16x64x256_16x16_16x16_16x16x1_16x16x1_1x16x1x16_4_1x1_intrawave_v1,156.04,378.87,0.0
304,352,1280,4096,18,0,16.4513,a8w8_blockscale_1x128x128_256x64x64x256_16x16_32x32_16x16x1_16x16x1_1x32x1x8_8_1x1_intrawave_v1,224.36,461.11,0.0
304,352,1536,7168,18,0,26.4946,a8w8_blockscale_1x128x128_256x64x64x256_16x16_32x32_16x16x1_16x16x1_1x32x1x8_8_1x1_intrawave_v1,292.55,551.6,0.0
304,352,1792,6144,18,0,24.663,a8w8_blockscale_1x128x128_256x64x64x256_16x16_32x32_16x16x1_16x16x1_1x32x1x8_8_1x1_intrawave_v1,314.28,585.26,0.0
304,352,2112,7168,18,0,30.1608,a8w8_blockscale_1x128x128_256x64x64x256_16x16_32x32_16x16x1_16x16x1_1x32x1x8_8_1x1_intrawave_v1,353.36,634.89,0.0
304,352,2304,4096,18,0,20.1229,a8w8_blockscale_1x128x128_256x64x64x256_16x16_32x32_16x16x1_16x16x1_1x32x1x8_8_1x1_intrawave_v1,330.16,621.23,0.0
304,352,3072,1536,18,0,10.683,a8w8_blockscale_1x128x128_256x64x64x256_16x16_32x32_16x16x1_16x16x1_1x32x1x8_8_1x1_intrawave_v1,310.95,694.74,0.0
304,352,3584,6144,18,0,46.1494,a8w8_blockscale_1x128x128_256x64x64x256_16x16_32x32_16x16x1_16x16x1_1x32x1x8_8_1x1_intrawave_v1,335.91,578.68,0.0
304,352,4096,512,13,0,8.2729,a8w8_blockscale_1x128x128_256x32x64x256_16x16_16x16_16x16x1_16x16x1_1x32x1x8_8_2x1_intrawave_v1,178.46,623.84,0.0
304,352,4096,1024,18,0,13.0325,a8w8_blockscale_1x128x128_256x64x64x256_16x16_32x32_16x16x1_16x16x1_1x32x1x8_8_1x1_intrawave_v1,226.57,570.75,0.0
304,352,4096,2048,18,0,19.029,a8w8_blockscale_1x128x128_256x64x64x256_16x16_32x32_16x16x1_16x16x1_1x32x1x8_8_1x1_intrawave_v1,310.35,630.25,0.0
304,352,4608,7168,18,0,55.8791,a8w8_blockscale_1x128x128_256x64x64x256_16x16_32x32_16x16x1_16x16x1_1x32x1x8_8_1x1_intrawave_v1,416.13,694.31,0.0
304,352,6144,1536,18,0,18.2975,a8w8_blockscale_1x128x128_256x64x64x256_16x16_32x32_16x16x1_16x16x1_1x32x1x8_8_1x1_intrawave_v1,363.1,781.7,0.0
304,352,6144,3072,18,0,30.7913,a8w8_blockscale_1x128x128_256x64x64x256_16x16_32x32_16x16x1_16x16x1_1x32x1x8_8_1x1_intrawave_v1,431.54,788.57,0.0
304,352,7168,256,16,0,7.7871,a8w8_blockscale_1x128x128_256x64x64x128_16x16_32x32_8x32x1_8x32x1_1x32x1x8_8_1x1_intrawave_v1,165.9,895.25,0.0
304,352,7168,2048,18,0,29.5729,a8w8_blockscale_1x128x128_256x64x64x256_16x16_32x32_16x16x1_16x16x1_1x32x1x8_8_1x1_intrawave_v1,349.47,691.42,0.0
304,352,7168,2304,3,0,30.2811,a8w8_blockscale_1x128x128_256x64x64x128_16x16_32x32_8x32x1_8x32x1_1x32x1x8_8_1x1_intrawave_v3,383.96,738.82,0.0
304,360,512,7168,8,0,22.3297,a8w8_blockscale_1x128x128_256x16x64x256_16x16_16x16_16x16x1_16x16x1_1x16x1x16_4_1x1_intrawave_v1,118.34,296.43,0.0
304,360,576,7168,8,0,22.309,a8w8_blockscale_1x128x128_256x16x64x256_16x16_16x16_16x16x1_16x16x1_1x16x1x16_4_1x1_intrawave_v1,133.25,319.33,0.0
304,360,1280,4096,18,0,16.4792,a8w8_blockscale_1x128x128_256x64x64x256_16x16_32x32_16x16x1_16x16x1_1x32x1x8_8_1x1_intrawave_v1,229.07,463.56,0.0
304,360,1536,7168,18,0,27.0249,a8w8_blockscale_1x128x128_256x64x64x256_16x16_32x32_16x16x1_16x16x1_1x32x1x8_8_1x1_intrawave_v1,293.33,543.81,0.0
304,360,1792,6144,18,0,24.5952,a8w8_blockscale_1x128x128_256x64x64x256_16x16_32x32_16x16x1_16x16x1_1x32x1x8_8_1x1_intrawave_v1,322.31,590.04,0.0
304,360,2112,7168,18,0,30.43,a8w8_blockscale_1x128x128_256x64x64x256_16x16_32x32_16x16x1_16x16x1_1x32x1x8_8_1x1_intrawave_v1,358.2,632.27,0.0
304,360,2304,4096,18,0,20.3898,a8w8_blockscale_1x128x128_256x64x64x256_16x16_32x32_16x16x1_16x16x1_1x32x1x8_8_1x1_intrawave_v1,333.24,616.52,0.0
304,360,3072,1536,18,0,10.7891,a8w8_blockscale_1x128x128_256x64x64x256_16x16_32x32_16x16x1_16x16x1_1x32x1x8_8_1x1_intrawave_v1,314.89,693.61,0.0
304,360,3584,6144,18,0,45.2885,a8w8_blockscale_1x128x128_256x64x64x256_16x16_32x32_16x16x1_16x16x1_1x32x1x8_8_1x1_intrawave_v1,350.08,592.04,0.0
304,360,4096,512,18,0,8.3375,a8w8_blockscale_1x128x128_256x64x64x256_16x16_32x32_16x16x1_16x16x1_1x32x1x8_8_1x1_intrawave_v1,181.1,627.36,0.0
304,360,4096,1024,18,0,12.8687,a8w8_blockscale_1x128x128_256x64x64x256_16x16_32x32_16x16x1_16x16x1_1x32x1x8_8_1x1_intrawave_v1,234.67,583.75,0.0
304,360,4096,2048,18,0,18.9761,a8w8_blockscale_1x128x128_256x64x64x256_16x16_32x32_16x16x1_16x16x1_1x32x1x8_8_1x1_intrawave_v1,318.28,636.33,0.0
304,360,4608,7168,18,0,57.6728,a8w8_blockscale_1x128x128_256x64x64x256_16x16_32x32_16x16x1_16x16x1_1x32x1x8_8_1x1_intrawave_v1,412.36,674.99,0.0
304,360,6144,1536,18,0,18.4432,a8w8_blockscale_1x128x128_256x64x64x256_16x16_32x32_16x16x1_16x16x1_1x32x1x8_8_1x1_intrawave_v1,368.42,781.53,0.0
304,360,6144,3072,18,0,31.2904,a8w8_blockscale_1x128x128_256x64x64x256_16x16_32x32_16x16x1_16x16x1_1x32x1x8_8_1x1_intrawave_v1,434.3,779.92,0.0
304,360,7168,256,16,0,8.3186,a8w8_blockscale_1x128x128_256x64x64x128_16x16_32x32_8x32x1_8x32x1_1x32x1x8_8_1x1_intrawave_v1,158.83,852.08,0.0
304,360,7168,2048,18,0,29.5567,a8w8_blockscale_1x128x128_256x64x64x256_16x16_32x32_16x16x1_16x16x1_1x32x1x8_8_1x1_intrawave_v1,357.61,696.23,0.0
304,360,7168,2304,3,0,30.5047,a8w8_blockscale_1x128x128_256x64x64x128_16x16_32x32_8x32x1_8x32x1_1x32x1x8_8_1x1_intrawave_v3,389.8,737.77,0.0
304,368,512,7168,8,0,18.3196,a8w8_blockscale_1x128x128_256x16x64x256_16x16_16x16_16x16x1_16x16x1_1x16x1x16_4_1x1_intrawave_v1,147.44,364.89,0.0
304,368,576,7168,8,0,18.4155,a8w8_blockscale_1x128x128_256x16x64x256_16x16_16x16_16x16x1_16x16x1_1x16x1x16_4_1x1_intrawave_v1,165.01,390.46,0.0
304,368,1280,4096,18,0,16.6622,a8w8_blockscale_1x128x128_256x64x64x256_16x16_32x32_16x16x1_16x16x1_1x32x1x8_8_1x1_intrawave_v1,231.59,461.66,0.0
304,368,1536,7168,18,0,27.4439,a8w8_blockscale_1x128x128_256x64x64x256_16x16_32x32_16x16x1_16x16x1_1x32x1x8_8_1x1_intrawave_v1,295.27,538.49,0.0
304,368,1792,6144,18,0,25.6675,a8w8_blockscale_1x128x128_256x64x64x256_16x16_32x32_16x16x1_16x16x1_1x32x1x8_8_1x1_intrawave_v1,315.71,568.42,0.0
304,368,2112,7168,18,0,30.623,a8w8_blockscale_1x128x128_256x64x64x256_16x16_32x32_16x16x1_16x16x1_1x32x1x8_8_1x1_intrawave_v1,363.85,631.26,0.0
304,368,2304,4096,18,0,20.7115,a8w8_blockscale_1x128x128_256x64x64x256_16x16_32x32_16x16x1_16x16x1_1x32x1x8_8_1x1_intrawave_v1,335.36,610.3,0.0
304,368,3072,1536,18,0,10.8636,a8w8_blockscale_1x128x128_256x64x64x256_16x16_32x32_16x16x1_16x16x1_1x32x1x8_8_1x1_intrawave_v1,319.68,694.51,0.0
304,368,3584,6144,18,0,45.1835,a8w8_blockscale_1x128x128_256x64x64x256_16x16_32x32_16x16x1_16x16x1_1x32x1x8_8_1x1_intrawave_v1,358.69,595.77,0.0
304,368,4096,512,18,0,8.3572,a8w8_blockscale_1x128x128_256x64x64x256_16x16_32x32_16x16x1_16x16x1_1x32x1x8_8_1x1_intrawave_v1,184.69,634.21,0.0
304,368,4096,1024,2,0,13.1539,a8w8_blockscale_1x128x128_256x64x128x128_16x16_32x32_8x32x1_8x32x1_1x32x1x8_8_1x1_intrawave_v3,234.68,576.7,0.0
304,368,4096,2048,18,0,19.1576,a8w8_blockscale_1x128x128_256x64x64x256_16x16_32x32_16x16x1_16x16x1_1x32x1x8_8_1x1_intrawave_v1,322.27,634.57,0.0
304,368,4608,7168,18,0,56.0357,a8w8_blockscale_1x128x128_256x64x64x256_16x16_32x32_16x16x1_16x16x1_1x32x1x8_8_1x1_intrawave_v1,433.83,697.05,0.0
304,368,6144,1536,18,0,18.5763,a8w8_blockscale_1x128x128_256x64x64x256_16x16_32x32_16x16x1_16x16x1_1x32x1x8_8_1x1_intrawave_v1,373.9,781.88,0.0
304,368,6144,3072,18,0,31.4675,a8w8_blockscale_1x128x128_256x64x64x256_16x16_32x32_16x16x1_16x16x1_1x32x1x8_8_1x1_intrawave_v1,441.46,779.43,0.0
304,368,7168,256,16,0,8.3626,a8w8_blockscale_1x128x128_256x64x64x128_16x16_32x32_8x32x1_8x32x1_1x32x1x8_8_1x1_intrawave_v1,161.5,861.56,0.0
304,368,7168,2048,18,0,29.821,a8w8_blockscale_1x128x128_256x64x64x256_16x16_32x32_16x16x1_16x16x1_1x32x1x8_8_1x1_intrawave_v1,362.31,694.46,0.0
304,368,7168,2304,3,0,30.5501,a8w8_blockscale_1x128x128_256x64x64x128_16x16_32x32_8x32x1_8x32x1_1x32x1x8_8_1x1_intrawave_v3,397.87,741.03,0.0
304,376,512,7168,8,0,22.1136,a8w8_blockscale_1x128x128_256x16x64x256_16x16_16x16_16x16x1_16x16x1_1x16x1x16_4_1x1_intrawave_v1,124.8,305.25,0.0
304,376,576,7168,8,0,22.2199,a8w8_blockscale_1x128x128_256x16x64x256_16x16_16x16_16x16x1_16x16x1_1x16x1x16_4_1x1_intrawave_v1,139.73,326.6,0.0
304,376,1280,4096,18,0,16.8427,a8w8_blockscale_1x128x128_256x64x64x256_16x16_32x32_16x16x1_16x16x1_1x32x1x8_8_1x1_intrawave_v1,234.09,459.87,0.0
304,376,1536,7168,18,0,27.3341,a8w8_blockscale_1x128x128_256x64x64x256_16x16_32x32_16x16x1_16x16x1_1x32x1x8_8_1x1_intrawave_v1,302.9,543.65,0.0
304,376,1792,6144,18,0,24.9441,a8w8_blockscale_1x128x128_256x64x64x256_16x16_32x32_16x16x1_16x16x1_1x32x1x8_8_1x1_intrawave_v1,331.92,588.03,0.0
304,376,2112,7168,18,0,31.0332,a8w8_blockscale_1x128x128_256x64x64x256_16x16_32x32_16x16x1_16x16x1_1x32x1x8_8_1x1_intrawave_v1,366.85,625.85,0.0
304,376,2304,4096,18,0,20.8709,a8w8_blockscale_1x128x128_256x64x64x256_16x16_32x32_16x16x1_16x16x1_1x32x1x8_8_1x1_intrawave_v1,340.03,608.98,0.0
304,376,3072,1536,18,0,11.8198,a8w8_blockscale_1x128x128_256x64x64x256_16x16_32x32_16x16x1_16x16x1_1x32x1x8_8_1x1_intrawave_v1,300.21,643.52,0.0
304,376,3584,6144,18,0,44.0068,a8w8_blockscale_1x128x128_256x64x64x256_16x16_32x32_16x16x1_16x16x1_1x32x1x8_8_1x1_intrawave_v1,376.29,614.12,0.0
304,376,4096,512,18,0,8.3231,a8w8_blockscale_1x128x128_256x64x64x256_16x16_32x32_16x16x1_16x16x1_1x32x1x8_8_1x1_intrawave_v1,189.48,645.17,0.0
304,376,4096,1024,18,0,13.0253,a8w8_blockscale_1x128x128_256x64x64x256_16x16_32x32_16x16x1_16x16x1_1x32x1x8_8_1x1_intrawave_v1,242.15,588.05,0.0
304,376,4096,2048,18,0,19.1731,a8w8_blockscale_1x128x128_256x64x64x256_16x16_32x32_16x16x1_16x16x1_1x32x1x8_8_1x1_intrawave_v1,329.01,638.33,0.0
304,376,4608,7168,18,0,56.7025,a8w8_blockscale_1x128x128_256x64x64x256_16x16_32x32_16x16x1_16x16x1_1x32x1x8_8_1x1_intrawave_v1,438.05,691.16,0.0
304,376,6144,1536,18,0,18.6751,a8w8_blockscale_1x128x128_256x64x64x256_16x16_32x32_16x16x1_16x16x1_1x32x1x8_8_1x1_intrawave_v1,380.01,783.66,0.0
304,376,6144,3072,18,0,31.2844,a8w8_blockscale_1x128x128_256x64x64x256_16x16_32x32_16x16x1_16x16x1_1x32x1x8_8_1x1_intrawave_v1,453.69,787.92,0.0
304,376,7168,256,16,0,8.3665,a8w8_blockscale_1x128x128_256x64x64x128_16x16_32x32_8x32x1_8x32x1_1x32x1x8_8_1x1_intrawave_v1,164.93,875.11,0.0
304,376,7168,2048,18,0,29.755,a8w8_blockscale_1x128x128_256x64x64x256_16x16_32x32_16x16x1_16x16x1_1x32x1x8_8_1x1_intrawave_v1,371.01,700.4,0.0
304,376,7168,2304,3,0,30.7455,a8w8_blockscale_1x128x128_256x64x64x128_16x16_32x32_8x32x1_8x32x1_1x32x1x8_8_1x1_intrawave_v3,403.94,740.65,0.0
304,384,512,7168,8,0,18.246,a8w8_blockscale_1x128x128_256x16x64x256_16x16_16x16_16x16x1_16x16x1_1x16x1x16_4_1x1_intrawave_v1,154.48,373.55,0.0
304,384,576,7168,8,0,18.2398,a8w8_blockscale_1x128x128_256x16x64x256_16x16_16x16_16x16x1_16x16x1_1x16x1x16_4_1x1_intrawave_v1,173.84,401.52,0.0
304,384,1280,4096,18,0,16.1674,a8w8_blockscale_1x128x128_256x64x64x256_16x16_32x32_16x16x1_16x16x1_1x32x1x8_8_1x1_intrawave_v1,249.05,482.38,0.0
304,384,1536,7168,18,0,26.2422,a8w8_blockscale_1x128x128_256x64x64x256_16x16_32x32_16x16x1_16x16x1_1x32x1x8_8_1x1_intrawave_v1,322.22,569.4,0.0
304,384,1792,6144,18,0,24.1506,a8w8_blockscale_1x128x128_256x64x64x256_16x16_32x32_16x16x1_16x16x1_1x32x1x8_8_1x1_intrawave_v1,350.12,610.57,0.0
304,384,2112,7168,18,0,29.1548,a8w8_blockscale_1x128x128_256x64x64x256_16x16_32x32_16x16x1_16x16x1_1x32x1x8_8_1x1_intrawave_v1,398.79,669.3,0.0
304,384,2304,4096,18,0,19.4785,a8w8_blockscale_1x128x128_256x64x64x256_16x16_32x32_16x16x1_16x16x1_1x32x1x8_8_1x1_intrawave_v1,372.09,656.08,0.0
304,384,3072,1536,18,0,10.7138,a8w8_blockscale_1x128x128_256x64x64x256_16x16_32x32_16x16x1_16x16x1_1x32x1x8_8_1x1_intrawave_v1,338.24,715.69,0.0
304,384,3584,6144,18,0,43.7323,a8w8_blockscale_1x128x128_256x64x64x256_16x16_32x32_16x16x1_16x16x1_1x32x1x8_8_1x1_intrawave_v1,386.7,620.41,0.0
304,384,4096,512,18,0,8.3771,a8w8_blockscale_1x128x128_256x64x64x256_16x16_32x32_16x16x1_16x16x1_1x32x1x8_8_1x1_intrawave_v1,192.26,649.33,0.0
304,384,4096,1024,18,0,13.0931,a8w8_blockscale_1x128x128_256x64x64x256_16x16_32x32_16x16x1_16x16x1_1x32x1x8_8_1x1_intrawave_v1,246.02,590.64,0.0
304,384,4096,2048,18,0,18.7561,a8w8_blockscale_1x128x128_256x64x64x256_16x16_32x32_16x16x1_16x16x1_1x32x1x8_8_1x1_intrawave_v1,343.49,656.89,0.0
304,384,4608,7168,18,0,53.9466,a8w8_blockscale_1x128x128_256x64x64x256_16x16_32x32_16x16x1_16x16x1_1x32x1x8_8_1x1_intrawave_v1,470.23,728.9,0.0
304,384,6144,1536,18,0,18.3886,a8w8_blockscale_1x128x128_256x64x64x256_16x16_32x32_16x16x1_16x16x1_1x32x1x8_8_1x1_intrawave_v1,394.14,801.89,0.0
304,384,6144,3072,18,0,30.0478,a8w8_blockscale_1x128x128_256x64x64x256_16x16_32x32_16x16x1_16x16x1_1x32x1x8_8_1x1_intrawave_v1,482.42,824.44,0.0
304,384,7168,256,16,0,8.2429,a8w8_blockscale_1x128x128_256x64x64x128_16x16_32x32_8x32x1_8x32x1_1x32x1x8_8_1x1_intrawave_v1,170.97,902.39,0.0
304,384,7168,2048,18,0,28.6934,a8w8_blockscale_1x128x128_256x64x64x256_16x16_32x32_16x16x1_16x16x1_1x32x1x8_8_1x1_intrawave_v1,392.92,730.88,0.0
304,384,7168,2304,0,0,29.0572,a8w8_blockscale_1x128x128_256x128x128x128_16x16_32x32_8x32x1_8x32x1_1x32x1x8_8_1x1_intrawave_v3,436.5,788.27,0.0
304,392,512,7168,8,0,22.3486,a8w8_blockscale_1x128x128_256x16x64x256_16x16_16x16_16x16x1_16x16x1_1x16x1x16_4_1x1_intrawave_v1,128.75,307.91,0.0
304,392,576,7168,8,0,22.3615,a8w8_blockscale_1x128x128_256x16x64x256_16x16_16x16_16x16x1_16x16x1_1x16x1x16_4_1x1_intrawave_v1,144.76,330.49,0.0
304,392,1280,4096,18,0,15.7897,a8w8_blockscale_1x128x128_256x64x64x256_16x16_32x32_16x16x1_16x16x1_1x32x1x8_8_1x1_intrawave_v1,260.32,497.29,0.0
304,392,1536,7168,18,0,27.2344,a8w8_blockscale_1x128x128_256x64x64x256_16x16_32x32_16x16x1_16x16x1_1x32x1x8_8_1x1_intrawave_v1,316.95,551.66,0.0
304,392,1792,6144,18,0,25.6032,a8w8_blockscale_1x128x128_256x64x64x256_16x16_32x32_16x16x1_16x16x1_1x32x1x8_8_1x1_intrawave_v1,337.14,578.97,0.0
304,392,2112,7168,18,0,31.3417,a8w8_blockscale_1x128x128_256x64x64x256_16x16_32x32_16x16x1_16x16x1_1x32x1x8_8_1x1_intrawave_v1,378.69,625.51,0.0
304,392,2304,4096,18,0,20.8835,a8w8_blockscale_1x128x128_256x64x64x256_16x16_32x32_16x16x1_16x16x1_1x32x1x8_8_1x1_intrawave_v1,354.29,615.28,0.0
304,392,3072,1536,3,0,14.6253,a8w8_blockscale_1x128x128_256x64x64x128_16x16_32x32_8x32x1_8x32x1_1x32x1x8_8_1x1_intrawave_v3,252.94,528.48,0.0
304,392,3584,6144,18,0,45.9179,a8w8_blockscale_1x128x128_256x64x64x256_16x16_32x32_16x16x1_16x16x1_1x32x1x8_8_1x1_intrawave_v1,375.97,593.2,0.0
304,392,4096,512,18,0,8.853,a8w8_blockscale_1x128x128_256x64x64x256_16x16_32x32_16x16x1_16x16x1_1x32x1x8_8_1x1_intrawave_v1,185.72,622.29,0.0
304,392,4096,1024,18,0,12.652,a8w8_blockscale_1x128x128_256x64x64x256_16x16_32x32_16x16x1_16x16x1_1x32x1x8_8_1x1_intrawave_v1,259.91,617.05,0.0
304,392,4096,2048,18,0,19.4,a8w8_blockscale_1x128x128_256x64x64x256_16x16_32x32_16x16x1_16x16x1_1x32x1x8_8_1x1_intrawave_v1,339.0,639.31,0.0
304,392,4608,7168,18,0,59.1568,a8w8_blockscale_1x128x128_256x64x64x256_16x16_32x32_16x16x1_16x16x1_1x32x1x8_8_1x1_intrawave_v1,437.75,666.92,0.0
304,392,6144,1536,3,0,23.2415,a8w8_blockscale_1x128x128_256x64x64x128_16x16_32x32_8x32x1_8x32x1_1x32x1x8_8_1x1_intrawave_v3,318.34,639.21,0.0
304,392,6144,3072,3,0,42.8396,a8w8_blockscale_1x128x128_256x64x64x128_16x16_32x32_8x32x1_8x32x1_1x32x1x8_8_1x1_intrawave_v3,345.42,581.13,0.0
304,392,7168,256,16,0,8.643,a8w8_blockscale_1x128x128_256x64x64x128_16x16_32x32_8x32x1_8x32x1_1x32x1x8_8_1x1_intrawave_v1,166.45,874.13,0.0
304,392,7168,2048,18,0,29.7329,a8w8_blockscale_1x128x128_256x64x64x256_16x16_32x32_16x16x1_16x16x1_1x32x1x8_8_1x1_intrawave_v1,387.09,709.74,0.0
304,392,7168,2304,18,0,31.7272,a8w8_blockscale_1x128x128_256x64x64x256_16x16_32x32_16x16x1_16x16x1_1x32x1x8_8_1x1_intrawave_v1,408.1,726.13,0.0
304,400,512,7168,8,0,18.4954,a8w8_blockscale_1x128x128_256x16x64x256_16x16_16x16_16x16x1_16x16x1_1x16x1x16_4_1x1_intrawave_v1,158.74,375.6,0.0
304,400,576,7168,8,0,18.5661,a8w8_blockscale_1x128x128_256x16x64x256_16x16_16x16_16x16x1_16x16x1_1x16x1x16_4_1x1_intrawave_v1,177.91,401.63,0.0
304,400,1280,4096,18,0,16.0486,a8w8_blockscale_1x128x128_256x64x64x256_16x16_32x32_16x16x1_16x16x1_1x32x1x8_8_1x1_intrawave_v1,261.35,492.58,0.0
304,400,1536,7168,18,0,27.7874,a8w8_blockscale_1x128x128_256x64x64x256_16x16_32x32_16x16x1_16x16x1_1x32x1x8_8_1x1_intrawave_v1,316.98,543.63,0.0
304,400,1792,6144,18,0,25.6292,a8w8_blockscale_1x128x128_256x64x64x256_16x16_32x32_16x16x1_16x16x1_1x32x1x8_8_1x1_intrawave_v1,343.67,581.42,0.0
304,400,2112,7168,18,0,31.9331,a8w8_blockscale_1x128x128_256x64x64x256_16x16_32x32_16x16x1_16x16x1_1x32x1x8_8_1x1_intrawave_v1,379.26,616.78,0.0
304,400,2304,4096,18,0,20.9811,a8w8_blockscale_1x128x128_256x64x64x256_16x16_32x32_16x16x1_16x16x1_1x32x1x8_8_1x1_intrawave_v1,359.84,615.73,0.0
304,400,3072,1536,3,0,14.5864,a8w8_blockscale_1x128x128_256x64x64x128_16x16_32x32_8x32x1_8x32x1_1x32x1x8_8_1x1_intrawave_v3,258.79,534.1,0.0
304,400,3584,6144,18,0,47.4584,a8w8_blockscale_1x128x128_256x64x64x256_16x16_32x32_16x16x1_16x16x1_1x32x1x8_8_1x1_intrawave_v1,371.19,576.19,0.0
304,400,4096,512,18,0,8.9081,a8w8_blockscale_1x128x128_256x64x64x256_16x16_32x32_16x16x1_16x16x1_1x32x1x8_8_1x1_intrawave_v1,188.34,626.26,0.0
304,400,4096,1024,18,0,12.9735,a8w8_blockscale_1x128x128_256x64x64x256_16x16_32x32_16x16x1_16x16x1_1x32x1x8_8_1x1_intrawave_v1,258.64,607.45,0.0
304,400,4096,2048,18,0,19.4892,a8w8_blockscale_1x128x128_256x64x64x256_16x16_32x32_16x16x1_16x16x1_1x32x1x8_8_1x1_intrawave_v1,344.34,640.59,0.0
304,400,4608,7168,18,0,59.883,a8w8_blockscale_1x128x128_256x64x64x256_16x16_32x32_16x16x1_16x16x1_1x32x1x8_8_1x1_intrawave_v1,441.26,661.02,0.0
304,400,6144,1536,3,0,23.5347,a8w8_blockscale_1x128x128_256x64x64x128_16x16_32x32_8x32x1_8x32x1_1x32x1x8_8_1x1_intrawave_v3,320.79,635.95,0.0
304,400,6144,3072,18,0,40.9384,a8w8_blockscale_1x128x128_256x64x64x256_16x16_32x32_16x16x1_16x16x1_1x32x1x8_8_1x1_intrawave_v1,368.83,611.12,0.0
304,400,7168,256,16,0,8.7445,a8w8_blockscale_1x128x128_256x64x64x128_16x16_32x32_8x32x1_8x32x1_1x32x1x8_8_1x1_intrawave_v1,167.88,877.33,0.0
304,400,7168,2048,18,0,30.2028,a8w8_blockscale_1x128x128_256x64x64x256_16x16_32x32_16x16x1_16x16x1_1x32x1x8_8_1x1_intrawave_v1,388.84,703.04,0.0
304,400,7168,2304,18,0,31.8621,a8w8_blockscale_1x128x128_256x64x64x256_16x16_32x32_16x16x1_16x16x1_1x32x1x8_8_1x1_intrawave_v1,414.66,727.23,0.0
304,408,512,7168,8,0,22.7305,a8w8_blockscale_1x128x128_256x16x64x256_16x16_16x16_16x16x1_16x16x1_1x16x1x16_4_1x1_intrawave_v1,131.75,308.5,0.0
304,408,576,7168,8,0,22.6395,a8w8_blockscale_1x128x128_256x16x64x256_16x16_16x16_16x16x1_16x16x1_1x16x1x16_4_1x1_intrawave_v1,148.81,332.31,0.0
304,408,1280,4096,18,0,16.3004,a8w8_blockscale_1x128x128_256x64x64x256_16x16_32x32_16x16x1_16x16x1_1x32x1x8_8_1x1_intrawave_v1,262.46,488.24,0.0
304,408,1536,7168,18,0,27.8749,a8w8_blockscale_1x128x128_256x64x64x256_16x16_32x32_16x16x1_16x16x1_1x32x1x8_8_1x1_intrawave_v1,322.3,544.86,0.0
304,408,1792,6144,18,0,25.9889,a8w8_blockscale_1x128x128_256x64x64x256_16x16_32x32_16x16x1_16x16x1_1x32x1x8_8_1x1_intrawave_v1,345.69,576.36,0.0
304,408,2112,7168,18,0,31.8941,a8w8_blockscale_1x128x128_256x64x64x256_16x16_32x32_16x16x1_16x16x1_1x32x1x8_8_1x1_intrawave_v1,387.32,620.39,0.0
304,408,2304,4096,18,0,21.2749,a8w8_blockscale_1x128x128_256x64x64x256_16x16_32x32_16x16x1_16x16x1_1x32x1x8_8_1x1_intrawave_v1,361.96,610.5,0.0
304,408,3072,1536,18,0,14.6675,a8w8_blockscale_1x128x128_256x64x64x256_16x16_32x32_16x16x1_16x16x1_1x32x1x8_8_1x1_intrawave_v1,262.51,535.34,0.0
304,408,3584,6144,18,0,45.429,a8w8_blockscale_1x128x128_256x64x64x256_16x16_32x32_16x16x1_16x16x1_1x32x1x8_8_1x1_intrawave_v1,395.53,604.27,0.0
304,408,4096,512,17,0,8.8559,a8w8_blockscale_1x128x128_256x64x128x256_16x16_32x32_16x16x1_16x16x1_1x32x1x8_8_1x1_intrawave_v1,193.24,637.81,0.0
304,408,4096,1024,18,0,12.9924,a8w8_blockscale_1x128x128_256x64x64x256_16x16_32x32_16x16x1_16x16x1_1x32x1x8_8_1x1_intrawave_v1,263.43,612.24,0.0
304,408,4096,2048,18,0,19.6635,a8w8_blockscale_1x128x128_256x64x64x256_16x16_32x32_16x16x1_16x16x1_1x32x1x8_8_1x1_intrawave_v1,348.11,639.08,0.0
304,408,4608,7168,18,0,59.5185,a8w8_blockscale_1x128x128_256x64x64x256_16x16_32x32_16x16x1_16x16x1_1x32x1x8_8_1x1_intrawave_v1,452.84,667.27,0.0
304,408,6144,1536,3,0,23.6338,a8w8_blockscale_1x128x128_256x64x64x128_16x16_32x32_8x32x1_8x32x1_1x32x1x8_8_1x1_intrawave_v3,325.84,637.96,0.0
304,408,6144,3072,18,0,41.4842,a8w8_blockscale_1x128x128_256x64x64x256_16x16_32x32_16x16x1_16x16x1_1x32x1x8_8_1x1_intrawave_v1,371.26,606.04,0.0
304,408,7168,256,16,0,8.7601,a8w8_blockscale_1x128x128_256x64x64x128_16x16_32x32_8x32x1_8x32x1_1x32x1x8_8_1x1_intrawave_v1,170.93,889.09,0.0
304,408,7168,2048,18,0,29.8629,a8w8_blockscale_1x128x128_256x64x64x256_16x16_32x32_16x16x1_16x16x1_1x32x1x8_8_1x1_intrawave_v1,401.13,715.43,0.0
304,408,7168,2304,3,0,31.7904,a8w8_blockscale_1x128x128_256x64x64x128_16x16_32x32_8x32x1_8x32x1_1x32x1x8_8_1x1_intrawave_v3,423.91,733.06,0.0
304,416,512,7168,8,0,18.4277,a8w8_blockscale_1x128x128_256x16x64x256_16x16_16x16_16x16x1_16x16x1_1x16x1x16_4_1x1_intrawave_v1,165.7,384.09,0.0
304,416,576,7168,8,0,18.6385,a8w8_blockscale_1x128x128_256x16x64x256_16x16_16x16_16x16x1_16x16x1_1x16x1x16_4_1x1_intrawave_v1,184.3,407.22,0.0
304,416,1280,4096,18,0,16.3276,a8w8_blockscale_1x128x128_256x64x64x256_16x16_32x32_16x16x1_16x16x1_1x32x1x8_8_1x1_intrawave_v1,267.16,490.69,0.0
304,416,1536,7168,18,0,27.3007,a8w8_blockscale_1x128x128_256x64x64x256_16x16_32x32_16x16x1_16x16x1_1x32x1x8_8_1x1_intrawave_v1,335.54,559.32,0.0
304,416,1792,6144,18,0,26.0698,a8w8_blockscale_1x128x128_256x64x64x256_16x16_32x32_16x16x1_16x16x1_1x32x1x8_8_1x1_intrawave_v1,351.38,577.56,0.0
304,416,2112,7168,18,0,31.8689,a8w8_blockscale_1x128x128_256x64x64x256_16x16_32x32_16x16x1_16x16x1_1x32x1x8_8_1x1_intrawave_v1,395.23,623.74,0.0
304,416,2304,4096,18,0,21.4857,a8w8_blockscale_1x128x128_256x64x64x256_16x16_32x32_16x16x1_16x16x1_1x32x1x8_8_1x1_intrawave_v1,365.44,607.76,0.0
304,416,3072,1536,18,0,14.6967,a8w8_blockscale_1x128x128_256x64x64x256_16x16_32x32_16x16x1_16x16x1_1x32x1x8_8_1x1_intrawave_v1,267.13,538.45,0.0
304,416,3584,6144,18,0,45.6979,a8w8_blockscale_1x128x128_256x64x64x256_16x16_32x32_16x16x1_16x16x1_1x32x1x8_8_1x1_intrawave_v1,400.91,603.04,0.0
304,416,4096,512,13,0,8.774,a8w8_blockscale_1x128x128_256x32x64x256_16x16_16x16_16x16x1_16x16x1_1x32x1x8_8_2x1_intrawave_v1,198.86,651.7,0.0
304,416,4096,1024,3,0,12.9596,a8w8_blockscale_1x128x128_256x64x64x128_16x16_32x32_8x32x1_8x32x1_1x32x1x8_8_1x1_intrawave_v3,269.27,619.48,0.0
304,416,4096,2048,18,0,19.6098,a8w8_blockscale_1x128x128_256x64x64x256_16x16_32x32_16x16x1_16x16x1_1x32x1x8_8_1x1_intrawave_v1,355.91,645.01,0.0
304,416,4608,7168,18,0,61.107,a8w8_blockscale_1x128x128_256x64x64x256_16x16_32x32_16x16x1_16x16x1_1x32x1x8_8_1x1_intrawave_v1,449.72,652.07,0.0
304,416,6144,1536,3,0,23.6197,a8w8_blockscale_1x128x128_256x64x64x128_16x16_32x32_8x32x1_8x32x1_1x32x1x8_8_1x1_intrawave_v3,332.42,643.02,0.0
304,416,6144,3072,18,0,41.3204,a8w8_blockscale_1x128x128_256x64x64x256_16x16_32x32_16x16x1_16x16x1_1x32x1x8_8_1x1_intrawave_v1,380.04,611.42,0.0
304,416,7168,256,16,0,8.8539,a8w8_blockscale_1x128x128_256x64x64x128_16x16_32x32_8x32x1_8x32x1_1x32x1x8_8_1x1_intrawave_v1,172.44,892.86,0.0
304,416,7168,2048,18,0,29.9624,a8w8_blockscale_1x128x128_256x64x64x256_16x16_32x32_16x16x1_16x16x1_1x32x1x8_8_1x1_intrawave_v1,407.64,717.43,0.0
304,416,7168,2304,3,0,32.372,a8w8_blockscale_1x128x128_256x64x64x128_16x16_32x32_8x32x1_8x32x1_1x32x1x8_8_1x1_intrawave_v3,424.46,724.0,0.0
304,424,512,7168,8,0,22.3054,a8w8_blockscale_1x128x128_256x16x64x256_16x16_16x16_16x16x1_16x16x1_1x16x1x16_4_1x1_intrawave_v1,139.53,320.26,0.0
304,424,576,7168,8,0,22.9039,a8w8_blockscale_1x128x128_256x16x64x256_16x16_16x16_16x16x1_16x16x1_1x16x1x16_4_1x1_intrawave_v1,152.86,334.29,0.0
304,424,1280,4096,18,0,16.4477,a8w8_blockscale_1x128x128_256x64x64x256_16x16_32x32_16x16x1_16x16x1_1x32x1x8_8_1x1_intrawave_v1,270.31,490.34,0.0
304,424,1536,7168,18,0,28.3471,a8w8_blockscale_1x128x128_256x64x64x256_16x16_32x32_16x16x1_16x16x1_1x32x1x8_8_1x1_intrawave_v1,329.36,541.57,0.0
304,424,1792,6144,18,0,26.5531,a8w8_blockscale_1x128x128_256x64x64x256_16x16_32x32_16x16x1_16x16x1_1x32x1x8_8_1x1_intrawave_v1,351.62,569.98,0.0
304,424,2112,7168,18,0,32.5727,a8w8_blockscale_1x128x128_256x64x64x256_16x16_32x32_16x16x1_16x16x1_1x32x1x8_8_1x1_intrawave_v1,394.13,613.06,0.0
304,424,2304,4096,18,0,21.5475,a8w8_blockscale_1x128x128_256x64x64x256_16x16_32x32_16x16x1_16x16x1_1x32x1x8_8_1x1_intrawave_v1,371.4,609.24,0.0
304,424,3072,1536,18,0,14.7957,a8w8_blockscale_1x128x128_256x64x64x256_16x16_32x32_16x16x1_16x16x1_1x32x1x8_8_1x1_intrawave_v1,270.44,539.0,0.0
304,424,3584,6144,18,0,45.9379,a8w8_blockscale_1x128x128_256x64x64x256_16x16_32x32_16x16x1_16x16x1_1x32x1x8_8_1x1_intrawave_v1,406.48,602.21,0.0
304,424,4096,512,18,0,9.035,a8w8_blockscale_1x128x128_256x64x64x256_16x16_32x32_16x16x1_16x16x1_1x32x1x8_8_1x1_intrawave_v1,196.83,640.58,0.0
304,424,4096,1024,18,0,12.8396,a8w8_blockscale_1x128x128_256x64x64x256_16x16_32x32_16x16x1_16x16x1_1x32x1x8_8_1x1_intrawave_v1,277.02,631.01,0.0
304,424,4096,2048,18,0,19.7532,a8w8_blockscale_1x128x128_256x64x64x256_16x16_32x32_16x16x1_16x16x1_1x32x1x8_8_1x1_intrawave_v1,360.12,644.47,0.0
304,424,4608,7168,18,0,60.9646,a8w8_blockscale_1x128x128_256x64x64x256_16x16_32x32_16x16x1_16x16x1_1x32x1x8_8_1x1_intrawave_v1,459.44,655.74,0.0
304,424,6144,1536,3,0,23.6477,a8w8_blockscale_1x128x128_256x64x64x128_16x16_32x32_8x32x1_8x32x1_1x32x1x8_8_1x1_intrawave_v3,338.41,646.94,0.0
304,424,6144,3072,18,0,40.5347,a8w8_blockscale_1x128x128_256x64x64x256_16x16_32x32_16x16x1_16x16x1_1x32x1x8_8_1x1_intrawave_v1,394.86,626.3,0.0
304,424,7168,256,16,0,8.9226,a8w8_blockscale_1x128x128_256x64x64x128_16x16_32x32_8x32x1_8x32x1_1x32x1x8_8_1x1_intrawave_v1,174.4,899.07,0.0
304,424,7168,2048,18,0,29.8232,a8w8_blockscale_1x128x128_256x64x64x256_16x16_32x32_16x16x1_16x16x1_1x32x1x8_8_1x1_intrawave_v1,417.42,725.17,0.0
304,424,7168,2304,18,0,32.1416,a8w8_blockscale_1x128x128_256x64x64x256_16x16_32x32_16x16x1_16x16x1_1x32x1x8_8_1x1_intrawave_v1,435.72,733.33,0.0
304,432,512,7168,8,0,18.6006,a8w8_blockscale_1x128x128_256x16x64x256_16x16_16x16_16x16x1_16x16x1_1x16x1x16_4_1x1_intrawave_v1,170.47,387.57,0.0
304,432,576,7168,8,0,18.7048,a8w8_blockscale_1x128x128_256x16x64x256_16x16_16x16_16x16x1_16x16x1_1x16x1x16_4_1x1_intrawave_v1,190.71,412.89,0.0
304,432,1280,4096,18,0,16.7542,a8w8_blockscale_1x128x128_256x64x64x256_16x16_32x32_16x16x1_16x16x1_1x32x1x8_8_1x1_intrawave_v1,270.37,484.55,0.0
304,432,1536,7168,18,0,28.5648,a8w8_blockscale_1x128x128_256x64x64x256_16x16_32x32_16x16x1_16x16x1_1x32x1x8_8_1x1_intrawave_v1,333.02,540.31,0.0
304,432,1792,6144,18,0,26.6491,a8w8_blockscale_1x128x128_256x64x64x256_16x16_32x32_16x16x1_16x16x1_1x32x1x8_8_1x1_intrawave_v1,356.96,570.85,0.0
304,432,2112,7168,18,0,32.495,a8w8_blockscale_1x128x128_256x64x64x256_16x16_32x32_16x16x1_16x16x1_1x32x1x8_8_1x1_intrawave_v1,402.52,617.33,0.0
304,432,2304,4096,18,0,22.1124,a8w8_blockscale_1x128x128_256x64x64x256_16x16_32x32_16x16x1_16x16x1_1x32x1x8_8_1x1_intrawave_v1,368.74,596.83,0.0
304,432,3072,1536,18,0,14.8934,a8w8_blockscale_1x128x128_256x64x64x256_16x16_32x32_16x16x1_16x16x1_1x32x1x8_8_1x1_intrawave_v1,273.74,539.59,0.0
304,432,3584,6144,18,0,46.1805,a8w8_blockscale_1x128x128_256x64x64x256_16x16_32x32_16x16x1_16x16x1_1x32x1x8_8_1x1_intrawave_v1,411.98,601.36,0.0
304,432,4096,512,18,0,8.3859,a8w8_blockscale_1x128x128_256x64x64x256_16x16_32x32_16x16x1_16x16x1_1x32x1x8_8_1x1_intrawave_v1,216.07,698.47,0.0
304,432,4096,1024,18,0,13.0581,a8w8_blockscale_1x128x128_256x64x64x256_16x16_32x32_16x16x1_16x16x1_1x32x1x8_8_1x1_intrawave_v1,277.52,626.1,0.0
304,432,4096,2048,18,0,19.9936,a8w8_blockscale_1x128x128_256x64x64x256_16x16_32x32_16x16x1_16x16x1_1x32x1x8_8_1x1_intrawave_v1,362.5,640.82,0.0
304,432,4608,7168,18,0,61.2394,a8w8_blockscale_1x128x128_256x64x64x256_16x16_32x32_16x16x1_16x16x1_1x32x1x8_8_1x1_intrawave_v1,466.01,654.94,0.0
304,432,6144,1536,3,0,23.9564,a8w8_blockscale_1x128x128_256x64x64x128_16x16_32x32_8x32x1_8x32x1_1x32x1x8_8_1x1_intrawave_v3,340.36,643.22,0.0
304,432,6144,3072,18,0,41.4816,a8w8_blockscale_1x128x128_256x64x64x256_16x16_32x32_16x16x1_16x16x1_1x32x1x8_8_1x1_intrawave_v1,393.12,614.97,0.0
304,432,7168,256,16,0,8.9453,a8w8_blockscale_1x128x128_256x64x64x128_16x16_32x32_8x32x1_8x32x1_1x32x1x8_8_1x1_intrawave_v1,177.24,909.84,0.0
304,432,7168,2048,18,0,30.5877,a8w8_blockscale_1x128x128_256x64x64x256_16x16_32x32_16x16x1_16x16x1_1x32x1x8_8_1x1_intrawave_v1,414.66,711.33,0.0
304,432,7168,2304,3,0,32.461,a8w8_blockscale_1x128x128_256x64x64x128_16x16_32x32_8x32x1_8x32x1_1x32x1x8_8_1x1_intrawave_v3,439.57,730.22,0.0
304,440,512,7168,8,0,22.2399,a8w8_blockscale_1x128x128_256x16x64x256_16x16_16x16_16x16x1_16x16x1_1x16x1x16_4_1x1_intrawave_v1,145.22,327.09,0.0
304,440,576,7168,8,0,22.7008,a8w8_blockscale_1x128x128_256x16x64x256_16x16_16x16_16x16x1_16x16x1_1x16x1x16_4_1x1_intrawave_v1,160.05,343.14,0.0
304,440,1280,4096,18,0,16.9347,a8w8_blockscale_1x128x128_256x64x64x256_16x16_32x32_16x16x1_16x16x1_1x32x1x8_8_1x1_intrawave_v1,272.44,482.53,0.0
304,440,1536,7168,18,0,28.4486,a8w8_blockscale_1x128x128_256x64x64x256_16x16_32x32_16x16x1_16x16x1_1x32x1x8_8_1x1_intrawave_v1,340.57,545.39,0.0
304,440,1792,6144,18,0,26.9459,a8w8_blockscale_1x128x128_256x64x64x256_16x16_32x32_16x16x1_16x16x1_1x32x1x8_8_1x1_intrawave_v1,359.57,567.45,0.0
304,440,2112,7168,18,0,32.5106,a8w8_blockscale_1x128x128_256x64x64x256_16x16_32x32_16x16x1_16x16x1_1x32x1x8_8_1x1_intrawave_v1,409.78,619.84,0.0
304,440,2304,4096,18,0,22.0366,a8w8_blockscale_1x128x128_256x64x64x256_16x16_32x32_16x16x1_16x16x1_1x32x1x8_8_1x1_intrawave_v1,376.86,602.04,0.0
304,440,3072,1536,18,0,14.87,a8w8_blockscale_1x128x128_256x64x64x256_16x16_32x32_16x16x1_16x16x1_1x32x1x8_8_1x1_intrawave_v1,279.24,544.57,0.0
304,440,3584,6144,18,0,47.4669,a8w8_blockscale_1x128x128_256x64x64x256_16x16_32x32_16x16x1_16x16x1_1x32x1x8_8_1x1_intrawave_v1,408.24,587.3,0.0
304,440,4096,512,18,0,8.9912,a8w8_blockscale_1x128x128_256x64x64x256_16x16_32x32_16x16x1_16x16x1_1x32x1x8_8_1x1_intrawave_v1,205.26,659.19,0.0
304,440,4096,1024,18,0,12.6882,a8w8_blockscale_1x128x128_256x64x64x256_16x16_32x32_16x16x1_16x16x1_1x32x1x8_8_1x1_intrawave_v1,290.9,650.16,0.0
304,440,4096,2048,18,0,19.9796,a8w8_blockscale_1x128x128_256x64x64x256_16x16_32x32_16x16x1_16x16x1_1x32x1x8_8_1x1_intrawave_v1,369.48,645.37,0.0
304,440,4608,7168,18,0,60.6211,a8w8_blockscale_1x128x128_256x64x64x256_16x16_32x32_16x16x1_16x16x1_1x32x1x8_8_1x1_intrawave_v1,479.48,663.78,0.0
304,440,6144,1536,3,0,23.8808,a8w8_blockscale_1x128x128_256x64x64x128_16x16_32x32_8x32x1_8x32x1_1x32x1x8_8_1x1_intrawave_v3,347.76,649.88,0.0
304,440,6144,3072,18,0,41.1059,a8w8_blockscale_1x128x128_256x64x64x256_16x16_32x32_16x16x1_16x16x1_1x32x1x8_8_1x1_intrawave_v1,404.06,623.58,0.0
304,440,7168,256,16,0,8.9901,a8w8_blockscale_1x128x128_256x64x64x128_16x16_32x32_8x32x1_8x32x1_1x32x1x8_8_1x1_intrawave_v1,179.62,918.29,0.0
304,440,7168,2048,18,0,30.0868,a8w8_blockscale_1x128x128_256x64x64x256_16x16_32x32_16x16x1_16x16x1_1x32x1x8_8_1x1_intrawave_v1,429.37,727.53,0.0
304,440,7168,2304,18,0,32.8611,a8w8_blockscale_1x128x128_256x64x64x256_16x16_32x32_16x16x1_16x16x1_1x32x1x8_8_1x1_intrawave_v1,442.26,725.38,0.0
304,448,512,7168,8,0,18.5082,a8w8_blockscale_1x128x128_256x16x64x256_16x16_16x16_16x16x1_16x16x1_1x16x1x16_4_1x1_intrawave_v1,177.67,396.58,0.0
304,448,576,7168,8,0,18.8016,a8w8_blockscale_1x128x128_256x16x64x256_16x16_16x16_16x16x1_16x16x1_1x16x1x16_4_1x1_intrawave_v1,196.76,417.84,0.0
304,448,1280,4096,18,0,16.1066,a8w8_blockscale_1x128x128_256x64x64x256_16x16_32x32_16x16x1_16x16x1_1x32x1x8_8_1x1_intrawave_v1,291.66,510.65,0.0
304,448,1536,7168,18,0,27.3106,a8w8_blockscale_1x128x128_256x64x64x256_16x16_32x32_16x16x1_16x16x1_1x32x1x8_8_1x1_intrawave_v1,361.22,571.12,0.0
304,448,1792,6144,18,0,25.8939,a8w8_blockscale_1x128x128_256x64x64x256_16x16_32x32_16x16x1_16x16x1_1x32x1x8_8_1x1_intrawave_v1,380.98,593.51,0.0
304,448,2112,7168,18,0,31.0661,a8w8_blockscale_1x128x128_256x64x64x256_16x16_32x32_16x16x1_16x16x1_1x32x1x8_8_1x1_intrawave_v1,436.63,651.59,0.0
304,448,2304,4096,18,0,20.7535,a8w8_blockscale_1x128x128_256x64x64x256_16x16_32x32_16x16x1_16x16x1_1x32x1x8_8_1x1_intrawave_v1,407.44,642.62,0.0
304,448,3072,1536,18,0,14.5671,a8w8_blockscale_1x128x128_256x64x64x256_16x16_32x32_16x16x1_16x16x1_1x32x1x8_8_1x1_intrawave_v1,290.23,560.11,0.0
304,448,3584,6144,18,0,45.1233,a8w8_blockscale_1x128x128_256x64x64x256_16x16_32x32_16x16x1_16x16x1_1x32x1x8_8_1x1_intrawave_v1,437.25,620.16,0.0
304,448,4096,512,13,0,8.8571,a8w8_blockscale_1x128x128_256x32x64x256_16x16_16x16_16x16x1_16x16x1_1x32x1x8_8_2x1_intrawave_v1,212.15,677.03,0.0
304,448,4096,1024,18,0,12.5748,a8w8_blockscale_1x128x128_256x64x64x256_16x16_32x32_16x16x1_16x16x1_1x32x1x8_8_1x1_intrawave_v1,298.86,661.89,0.0
304,448,4096,2048,18,0,19.5322,a8w8_blockscale_1x128x128_256x64x64x256_16x16_32x32_16x16x1_16x16x1_1x32x1x8_8_1x1_intrawave_v1,384.81,664.35,0.0
304,448,4608,7168,18,0,58.2646,a8w8_blockscale_1x128x128_256x64x64x256_16x16_32x32_16x16x1_16x16x1_1x32x1x8_8_1x1_intrawave_v1,507.94,692.88,0.0
304,448,6144,1536,18,0,23.3117,a8w8_blockscale_1x128x128_256x64x64x256_16x16_32x32_16x16x1_16x16x1_1x32x1x8_8_1x1_intrawave_v1,362.72,670.49,0.0
304,448,6144,3072,18,0,40.13,a8w8_blockscale_1x128x128_256x64x64x256_16x16_32x32_16x16x1_16x16x1_1x32x1x8_8_1x1_intrawave_v1,421.42,641.81,0.0
304,448,7168,256,16,0,8.7969,a8w8_blockscale_1x128x128_256x64x64x128_16x16_32x32_8x32x1_8x32x1_1x32x1x8_8_1x1_intrawave_v1,186.9,951.72,0.0
304,448,7168,2048,18,0,29.652,a8w8_blockscale_1x128x128_256x64x64x256_16x16_32x32_16x16x1_16x16x1_1x32x1x8_8_1x1_intrawave_v1,443.59,742.62,0.0
304,448,7168,2304,18,0,31.1402,a8w8_blockscale_1x128x128_256x64x64x256_16x16_32x32_16x16x1_16x16x1_1x32x1x8_8_1x1_intrawave_v1,475.19,769.74,0.0
304,456,512,7168,8,0,22.414,a8w8_blockscale_1x128x128_256x16x64x256_16x16_16x16_16x16x1_16x16x1_1x16x1x16_4_1x1_intrawave_v1,149.33,330.4,0.0
304,456,576,7168,8,0,22.7293,a8w8_blockscale_1x128x128_256x16x64x256_16x16_16x16_16x16x1_16x16x1_1x16x1x16_4_1x1_intrawave_v1,165.66,348.57,0.0
304,456,1280,4096,18,0,16.4627,a8w8_blockscale_1x128x128_256x64x64x256_16x16_32x32_16x16x1_16x16x1_1x32x1x8_8_1x1_intrawave_v1,290.44,502.83,0.0
304,456,1536,7168,18,0,28.87,a8w8_blockscale_1x128x128_256x64x64x256_16x16_32x32_16x16x1_16x16x1_1x32x1x8_8_1x1_intrawave_v1,347.81,543.11,0.0
304,456,1792,6144,18,0,27.0809,a8w8_blockscale_1x128x128_256x64x64x256_16x16_32x32_16x16x1_16x16x1_1x32x1x8_8_1x1_intrawave_v1,370.78,570.37,0.0
304,456,2112,7168,18,0,33.0683,a8w8_blockscale_1x128x128_256x64x64x256_16x16_32x32_16x16x1_16x16x1_1x32x1x8_8_1x1_intrawave_v1,417.52,614.9,0.0
304,456,2304,4096,18,0,22.2932,a8w8_blockscale_1x128x128_256x64x64x256_16x16_32x32_16x16x1_16x16x1_1x32x1x8_8_1x1_intrawave_v1,386.07,601.36,0.0
304,456,3072,1536,18,0,15.2086,a8w8_blockscale_1x128x128_256x64x64x256_16x16_32x32_16x16x1_16x16x1_1x32x1x8_8_1x1_intrawave_v1,282.96,540.53,0.0
304,456,3584,6144,18,0,47.0144,a8w8_blockscale_1x128x128_256x64x64x256_16x16_32x32_16x16x1_16x16x1_1x32x1x8_8_1x1_intrawave_v1,427.15,597.48,0.0
304,456,4096,512,16,0,8.976,a8w8_blockscale_1x128x128_256x64x64x128_16x16_32x32_8x32x1_8x32x1_1x32x1x8_8_1x1_intrawave_v1,213.08,675.82,0.0
304,456,4096,1024,18,0,12.8012,a8w8_blockscale_1x128x128_256x64x64x256_16x16_32x32_16x16x1_16x16x1_1x32x1x8_8_1x1_intrawave_v1,298.82,655.94,0.0
