kernels/fusedmoe/devperfmi300xconfig/profile_fmoe.csv
stage,cu_num,token,model_dim,inter_dim,expert,topk,act_type,dtype,q_dtype_a,q_dtype_w,q_type,use_g1u1,doweight_stage1,block_m,ksplit,us,kernelName,err,tflops,bw
stage1,304,1024,6144,320,160,8,ActivationType.Silu,torch.bfloat16,torch.float8_e4m3fnuz,torch.float8_e4m3fnuz,QuantType.per_Token,1,0,32,0,inf,_ZN5aiter48fmoe_stage1_bf16_pertokenFp8_g1u1_32x128_3tg_pf2E,100.0%,0.0,0.0
stage1,304,1024,6144,320,160,8,ActivationType.Silu,torch.bfloat16,torch.float8_e4m3fnuz,torch.float8_e4m3fnuz,QuantType.per_Token,1,0,32,0,inf,_ZN5aiter48fmoe_stage1_bf16_pertokenFp8_g1u1_32x128_3tg_pf3E,100.0%,0.0,0.0
stage1,304,1024,6144,320,160,8,ActivationType.Silu,torch.bfloat16,torch.float8_e4m3fnuz,torch.float8_e4m3fnuz,QuantType.per_Token,1,0,32,0,inf,_ZN5aiter48fmoe_stage1_bf16_pertokenFp8_g1u1_32x256_2tg_pf2E,100.0%,0.0,0.0
stage1,304,1024,6144,320,160,8,ActivationType.Silu,torch.bfloat16,torch.float8_e4m3fnuz,torch.float8_e4m3fnuz,QuantType.per_Token,1,0,32,0,inf,_ZN5aiter48fmoe_stage1_bf16_pertokenFp8_g1u1_32x256_2tg_pf3E,100.0%,0.0,0.0
stage1,304,1024,6144,320,160,8,ActivationType.Silu,torch.bfloat16,torch.float8_e4m3fnuz,torch.float8_e4m3fnuz,QuantType.per_Token,1,0,32,0,inf,_ZN5aiter44fmoe_stage1_bf16_pertokenFp8_g1u1_32x512_pf2E,100.0%,0.0,0.0
stage1,304,1024,6144,320,160,8,ActivationType.Silu,torch.bfloat16,torch.float8_e4m3fnuz,torch.float8_e4m3fnuz,QuantType.per_Token,1,0,32,0,inf,_ZN5aiter44fmoe_stage1_bf16_pertokenFp8_g1u1_32x512_pf3E,100.0%,0.0,0.0
stage1,304,1024,6144,320,160,8,ActivationType.Silu,torch.bfloat16,torch.float8_e4m3fnuz,torch.float8_e4m3fnuz,QuantType.per_Token,1,0,32,0,300.9642,_ZN5aiter47fmoe_stage1_bf16_pertokenFp8_g1u1_32x64_4tg_pf2E,0.0%,321.09,3198.36
stage1,304,1024,6144,320,160,8,ActivationType.Silu,torch.bfloat16,torch.float8_e4m3fnuz,torch.float8_e4m3fnuz,QuantType.per_Token,1,0,32,0,330.3126,_ZN5aiter47fmoe_stage1_bf16_pertokenFp8_g1u1_32x64_4tg_pf3E,0.1%,292.56,2914.19
stage1,304,1024,6144,320,160,8,ActivationType.Silu,torch.bfloat16,torch.float8_e4m3fnuz,torch.float8_e4m3fnuz,QuantType.per_Token,1,0,64,0,inf,_ZN5aiter48fmoe_stage1_bf16_pertokenFp8_g1u1_64x128_2tg_pf2E,100.0%,0.0,0.0
stage1,304,1024,6144,320,160,8,ActivationType.Silu,torch.bfloat16,torch.float8_e4m3fnuz,torch.float8_e4m3fnuz,QuantType.per_Token,1,0,64,0,inf,_ZN5aiter48fmoe_stage1_bf16_pertokenFp8_g1u1_64x128_2tg_pf3E,100.0%,0.0,0.0
stage1,304,1024,6144,320,160,8,ActivationType.Silu,torch.bfloat16,torch.float8_e4m3fnuz,torch.float8_e4m3fnuz,QuantType.per_Token,1,0,64,0,inf,_ZN5aiter44fmoe_stage1_bf16_pertokenFp8_g1u1_64x256_pf2E,100.0%,0.0,0.0
stage1,304,1024,6144,320,160,8,ActivationType.Silu,torch.bfloat16,torch.float8_e4m3fnuz,torch.float8_e4m3fnuz,QuantType.per_Token,1,0,64,0,inf,_ZN5aiter44fmoe_stage1_bf16_pertokenFp8_g1u1_64x256_pf3E,100.0%,0.0,0.0
stage1,304,1024,6144,320,160,8,ActivationType.Silu,torch.bfloat16,torch.float8_e4m3fnuz,torch.float8_e4m3fnuz,QuantType.per_Token,1,0,64,0,188.7129,_ZN5aiter47fmoe_stage1_bf16_pertokenFp8_g1u1_64x64_3tg_pf2E,0.0%,512.08,5100.83
stage1,304,1024,6144,320,160,8,ActivationType.Silu,torch.bfloat16,torch.float8_e4m3fnuz,torch.float8_e4m3fnuz,QuantType.per_Token,1,0,64,0,205.7274,_ZN5aiter47fmoe_stage1_bf16_pertokenFp8_g1u1_64x64_2tg_pf3E,0.0%,469.73,4678.97
stage1,304,1024,6144,320,160,8,ActivationType.Silu,torch.bfloat16,torch.float8_e4m3fnuz,torch.float8_e4m3fnuz,QuantType.per_Token,1,0,128,0,inf,_ZN5aiter45fmoe_stage1_bf16_pertokenFp8_g1u1_128x128_pf2E,100.0%,0.0,0.0
stage1,304,1024,6144,320,160,8,ActivationType.Silu,torch.bfloat16,torch.float8_e4m3fnuz,torch.float8_e4m3fnuz,QuantType.per_Token,1,0,128,0,inf,_ZN5aiter45fmoe_stage1_bf16_pertokenFp8_g1u1_128x128_pf3E,100.0%,0.0,0.0
stage1,304,1024,6144,320,160,8,ActivationType.Silu,torch.bfloat16,torch.float8_e4m3fnuz,torch.float8_e4m3fnuz,QuantType.per_Token,1,0,128,0,235.4318,_ZN5aiter44fmoe_stage1_bf16_pertokenFp8_g1u1_128x64_pf2E,0.0%,410.47,4088.63
stage1,304,1024,6144,320,160,8,ActivationType.Silu,torch.bfloat16,torch.float8_e4m3fnuz,torch.float8_e4m3fnuz,QuantType.per_Token,1,0,128,0,225.0834,_ZN5aiter44fmoe_stage1_bf16_pertokenFp8_g1u1_128x64_pf3E,0.0%,429.34,4276.6
stage1,304,1024,6144,320,160,8,ActivationType.Silu,torch.bfloat16,torch.float8_e4m3fnuz,torch.float8_e4m3fnuz,QuantType.per_Token,1,0,32,0,323.8512,moe_ck2stages_gemm1_256x32x64x256_1x4_MulABScale_v1_Nswizzle0_Quant2_MulRoutedWeight0_silu_F8_F8_B16,0.0%,298.4,2972.33
stage1,304,1024,6144,320,160,8,ActivationType.Silu,torch.bfloat16,torch.float8_e4m3fnuz,torch.float8_e4m3fnuz,QuantType.per_Token,1,0,32,0,311.715,moe_ck2stages_gemm1_256x32x64x128_1x4_MulABScale_v1_Nswizzle0_Quant2_MulRoutedWeight0_silu_F8_F8_B16,0.0%,310.02,3088.05
stage2,304,1024,6144,320,160,8,ActivationType.Silu,torch.bfloat16,torch.float8_e4m3fnuz,torch.float8_e4m3fnuz,QuantType.per_Token,1,0,32,0,inf,moe_ck2stages_gemm2_256x32x64x256_1x4_MulABScaleExpertWeight_v1_Nswizzle0_Quant2_MulRoutedWeight1_F8_F8_B16,100.0%,0.0,0.0
stage2,304,1024,6144,320,160,8,ActivationType.Silu,torch.bfloat16,torch.float8_e4m3fnuz,torch.float8_e4m3fnuz,QuantType.per_Token,1,0,32,0,inf,moe_ck2stages_gemm2_256x32x64x128_1x4_MulABScaleExpertWeight_v1_Nswizzle0_Quant2_MulRoutedWeight1_F8_F8_B16,100.0%,0.0,0.0
stage1,304,1024,6144,320,160,8,ActivationType.Silu,torch.bfloat16,torch.float8_e4m3fnuz,torch.float8_e4m3fnuz,QuantType.per_Token,1,0,64,0,201.472,moe_ck2stages_gemm1_256x64x64x256_1x4_MulABScale_v1_Nswizzle0_Quant2_MulRoutedWeight0_silu_F8_F8_B16,0.0%,479.65,4777.8
stage1,304,1024,6144,320,160,8,ActivationType.Silu,torch.bfloat16,torch.float8_e4m3fnuz,torch.float8_e4m3fnuz,QuantType.per_Token,1,0,64,0,201.2876,moe_ck2stages_gemm1_256x64x64x128_1x4_MulABScale_v1_Nswizzle0_Quant2_MulRoutedWeight0_silu_F8_F8_B16,0.0%,480.09,4782.18
stage1,304,1024,6144,320,160,8,ActivationType.Silu,torch.bfloat16,torch.float8_e4m3fnuz,torch.float8_e4m3fnuz,QuantType.per_Token,1,0,64,0,inf,moe_ck2stages_gemm1_256x64x128x256_1x4_MulABScale_v3_Nswizzle0_Quant2_MulRoutedWeight0_silu_F8_F8_B16,100.0%,0.0,0.0
stage1,304,1024,6144,320,160,8,ActivationType.Silu,torch.bfloat16,torch.float8_e4m3fnuz,torch.float8_e4m3fnuz,QuantType.per_Token,1,0,64,0,inf,moe_ck2stages_gemm1_256x64x128x128_1x4_MulABScale_v3_Nswizzle0_Quant2_MulRoutedWeight0_silu_F8_F8_B16,100.0%,0.0,0.0
stage2,304,1024,6144,320,160,8,ActivationType.Silu,torch.bfloat16,torch.float8_e4m3fnuz,torch.float8_e4m3fnuz,QuantType.per_Token,1,0,64,0,inf,moe_ck2stages_gemm2_256x64x64x256_1x4_MulABScaleExpertWeight_v1_Nswizzle0_Quant2_MulRoutedWeight1_F8_F8_B16,100.0%,0.0,0.0
stage2,304,1024,6144,320,160,8,ActivationType.Silu,torch.bfloat16,torch.float8_e4m3fnuz,torch.float8_e4m3fnuz,QuantType.per_Token,1,0,64,0,inf,moe_ck2stages_gemm2_256x64x128x256_1x4_MulABScaleExpertWeight_v3_Nswizzle0_Quant2_MulRoutedWeight1_F8_F8_B16,100.0%,0.0,0.0
stage2,304,1024,6144,320,160,8,ActivationType.Silu,torch.bfloat16,torch.float8_e4m3fnuz,torch.float8_e4m3fnuz,QuantType.per_Token,1,0,64,0,inf,moe_ck2stages_gemm2_256x64x128x128_1x4_MulABScaleExpertWeight_v3_Nswizzle0_Quant2_MulRoutedWeight1_F8_F8_B16,100.0%,0.0,0.0
stage1,304,1024,6144,320,160,8,ActivationType.Silu,torch.bfloat16,torch.float8_e4m3fnuz,torch.float8_e4m3fnuz,QuantType.per_Token,1,0,128,0,220.9024,moe_ck2stages_gemm1_256x128x64x128_1x4_MulABScale_v1_Nswizzle0_Quant2_MulRoutedWeight0_silu_F8_F8_B16,0.0%,437.46,4357.55
stage1,304,1024,6144,320,160,8,ActivationType.Silu,torch.bfloat16,torch.float8_e4m3fnuz,torch.float8_e4m3fnuz,QuantType.per_Token,1,0,128,0,inf,moe_ck2stages_gemm1_256x128x128x256_1x4_MulABScale_v3_Nswizzle0_Quant2_MulRoutedWeight0_silu_F8_F8_B16,100.0%,0.0,0.0
stage1,304,1024,6144,320,160,8,ActivationType.Silu,torch.bfloat16,torch.float8_e4m3fnuz,torch.float8_e4m3fnuz,QuantType.per_Token,1,0,128,0,inf,moe_ck2stages_gemm1_256x128x128x128_1x4_MulABScale_v3_Nswizzle0_Quant2_MulRoutedWeight0_silu_F8_F8_B16,100.0%,0.0,0.0
stage2,304,1024,6144,320,160,8,ActivationType.Silu,torch.bfloat16,torch.float8_e4m3fnuz,torch.float8_e4m3fnuz,QuantType.per_Token,1,0,128,0,inf,moe_ck2stages_gemm2_256x128x64x128_1x4_MulABScaleExpertWeight_v1_Nswizzle0_Quant2_MulRoutedWeight1_F8_F8_B16,100.0%,0.0,0.0
stage2,304,1024,6144,320,160,8,ActivationType.Silu,torch.bfloat16,torch.float8_e4m3fnuz,torch.float8_e4m3fnuz,QuantType.per_Token,1,0,128,0,inf,moe_ck2stages_gemm2_256x128x128x128_1x4_MulABScaleExpertWeight_v3_Nswizzle0_Quant2_MulRoutedWeight1_F8_F8_B16,100.0%,0.0,0.0
asm_1stage,304,1024,6144,320,160,8,ActivationType.Silu,torch.bfloat16,torch.float8_e4m3fnuz,torch.float8_e4m3fnuz,QuantType.per_Token,1,0,32,0,490.8907,_ZN5aiter45fmoe_bf16_pertokenFp8_g1u1_vs_silu_1tg_32x320E,0.0%,196.86,1960.91
asm_1stage,304,1024,6144,320,160,8,ActivationType.Silu,torch.bfloat16,torch.float8_e4m3fnuz,torch.float8_e4m3fnuz,QuantType.per_Token,1,0,32,0,493.2201,_ZN5aiter48fmoe_bf16_pertokenFp8_g1u1_vs_silu_1tg_ps_32x320E,0.0%,195.93,1951.65
stage1,304,512,6144,320,160,8,ActivationType.Silu,torch.bfloat16,torch.float8_e4m3fnuz,torch.float8_e4m3fnuz,QuantType.per_Token,1,0,32,0,inf,_ZN5aiter48fmoe_stage1_bf16_pertokenFp8_g1u1_32x128_3tg_pf2E,100.0%,0.0,0.0
stage1,304,512,6144,320,160,8,ActivationType.Silu,torch.bfloat16,torch.float8_e4m3fnuz,torch.float8_e4m3fnuz,QuantType.per_Token,1,0,32,0,inf,_ZN5aiter48fmoe_stage1_bf16_pertokenFp8_g1u1_32x128_3tg_pf3E,100.0%,0.0,0.0
stage1,304,512,6144,320,160,8,ActivationType.Silu,torch.bfloat16,torch.float8_e4m3fnuz,torch.float8_e4m3fnuz,QuantType.per_Token,1,0,32,0,inf,_ZN5aiter48fmoe_stage1_bf16_pertokenFp8_g1u1_32x256_2tg_pf2E,100.0%,0.0,0.0
stage1,304,512,6144,320,160,8,ActivationType.Silu,torch.bfloat16,torch.float8_e4m3fnuz,torch.float8_e4m3fnuz,QuantType.per_Token,1,0,32,0,inf,_ZN5aiter48fmoe_stage1_bf16_pertokenFp8_g1u1_32x256_2tg_pf3E,100.0%,0.0,0.0
stage1,304,512,6144,320,160,8,ActivationType.Silu,torch.bfloat16,torch.float8_e4m3fnuz,torch.float8_e4m3fnuz,QuantType.per_Token,1,0,32,0,inf,_ZN5aiter44fmoe_stage1_bf16_pertokenFp8_g1u1_32x512_pf2E,100.0%,0.0,0.0
stage1,304,512,6144,320,160,8,ActivationType.Silu,torch.bfloat16,torch.float8_e4m3fnuz,torch.float8_e4m3fnuz,QuantType.per_Token,1,0,32,0,inf,_ZN5aiter44fmoe_stage1_bf16_pertokenFp8_g1u1_32x512_pf3E,100.0%,0.0,0.0
stage1,304,512,6144,320,160,8,ActivationType.Silu,torch.bfloat16,torch.float8_e4m3fnuz,torch.float8_e4m3fnuz,QuantType.per_Token,1,0,32,0,182.5806,_ZN5aiter47fmoe_stage1_bf16_pertokenFp8_g1u1_32x64_4tg_pf2E,0.0%,264.64,5220.46
stage1,304,512,6144,320,160,8,ActivationType.Silu,torch.bfloat16,torch.float8_e4m3fnuz,torch.float8_e4m3fnuz,QuantType.per_Token,1,0,32,0,192.1814,_ZN5aiter47fmoe_stage1_bf16_pertokenFp8_g1u1_32x64_4tg_pf3E,0.1%,251.42,4959.67
stage1,304,512,6144,320,160,8,ActivationType.Silu,torch.bfloat16,torch.float8_e4m3fnuz,torch.float8_e4m3fnuz,QuantType.per_Token,1,0,64,0,inf,_ZN5aiter48fmoe_stage1_bf16_pertokenFp8_g1u1_64x128_2tg_pf2E,100.0%,0.0,0.0
stage1,304,512,6144,320,160,8,ActivationType.Silu,torch.bfloat16,torch.float8_e4m3fnuz,torch.float8_e4m3fnuz,QuantType.per_Token,1,0,64,0,inf,_ZN5aiter48fmoe_stage1_bf16_pertokenFp8_g1u1_64x128_2tg_pf3E,100.0%,0.0,0.0
stage1,304,512,6144,320,160,8,ActivationType.Silu,torch.bfloat16,torch.float8_e4m3fnuz,torch.float8_e4m3fnuz,QuantType.per_Token,1,0,64,0,inf,_ZN5aiter44fmoe_stage1_bf16_pertokenFp8_g1u1_64x256_pf2E,100.0%,0.0,0.0
stage1,304,512,6144,320,160,8,ActivationType.Silu,torch.bfloat16,torch.float8_e4m3fnuz,torch.float8_e4m3fnuz,QuantType.per_Token,1,0,64,0,inf,_ZN5aiter44fmoe_stage1_bf16_pertokenFp8_g1u1_64x256_pf3E,100.0%,0.0,0.0
stage1,304,512,6144,320,160,8,ActivationType.Silu,torch.bfloat16,torch.float8_e4m3fnuz,torch.float8_e4m3fnuz,QuantType.per_Token,1,0,64,0,180.4413,_ZN5aiter47fmoe_stage1_bf16_pertokenFp8_g1u1_64x64_3tg_pf2E,0.0%,267.78,5282.36
stage1,304,512,6144,320,160,8,ActivationType.Silu,torch.bfloat16,torch.float8_e4m3fnuz,torch.float8_e4m3fnuz,QuantType.per_Token,1,0,64,0,192.9868,_ZN5aiter47fmoe_stage1_bf16_pertokenFp8_g1u1_64x64_2tg_pf3E,0.0%,250.37,4938.97
stage1,304,512,6144,320,160,8,ActivationType.Silu,torch.bfloat16,torch.float8_e4m3fnuz,torch.float8_e4m3fnuz,QuantType.per_Token,1,0,128,0,inf,_ZN5aiter45fmoe_stage1_bf16_pertokenFp8_g1u1_128x128_pf2E,100.0%,0.0,0.0
stage1,304,512,6144,320,160,8,ActivationType.Silu,torch.bfloat16,torch.float8_e4m3fnuz,torch.float8_e4m3fnuz,QuantType.per_Token,1,0,128,0,inf,_ZN5aiter45fmoe_stage1_bf16_pertokenFp8_g1u1_128x128_pf3E,100.0%,0.0,0.0
stage1,304,512,6144,320,160,8,ActivationType.Silu,torch.bfloat16,torch.float8_e4m3fnuz,torch.float8_e4m3fnuz,QuantType.per_Token,1,0,128,0,222.4963,_ZN5aiter44fmoe_stage1_bf16_pertokenFp8_g1u1_128x64_pf2E,0.0%,217.16,4283.92
stage1,304,512,6144,320,160,8,ActivationType.Silu,torch.bfloat16,torch.float8_e4m3fnuz,torch.float8_e4m3fnuz,QuantType.per_Token,1,0,128,0,203.9388,_ZN5aiter44fmoe_stage1_bf16_pertokenFp8_g1u1_128x64_pf3E,0.0%,236.93,4673.73
stage1,304,512,6144,320,160,8,ActivationType.Silu,torch.bfloat16,torch.float8_e4m3fnuz,torch.float8_e4m3fnuz,QuantType.per_Token,1,0,32,0,188.5148,moe_ck2stages_gemm1_256x32x64x256_1x4_MulABScale_v1_Nswizzle0_Quant2_MulRoutedWeight0_silu_F8_F8_B16,0.0%,256.31,5056.13
stage1,304,512,6144,320,160,8,ActivationType.Silu,torch.bfloat16,torch.float8_e4m3fnuz,torch.float8_e4m3fnuz,QuantType.per_Token,1,0,32,0,180.4064,moe_ck2stages_gemm1_256x32x64x128_1x4_MulABScale_v1_Nswizzle0_Quant2_MulRoutedWeight0_silu_F8_F8_B16,0.0%,267.83,5283.38
stage2,304,512,6144,320,160,8,ActivationType.Silu,torch.bfloat16,torch.float8_e4m3fnuz,torch.float8_e4m3fnuz,QuantType.per_Token,1,0,32,0,inf,moe_ck2stages_gemm2_256x32x64x256_1x4_MulABScaleExpertWeight_v1_Nswizzle0_Quant2_MulRoutedWeight1_F8_F8_B16,100.0%,0.0,0.0
stage2,304,512,6144,320,160,8,ActivationType.Silu,torch.bfloat16,torch.float8_e4m3fnuz,torch.float8_e4m3fnuz,QuantType.per_Token,1,0,32,0,inf,moe_ck2stages_gemm2_256x32x64x128_1x4_MulABScaleExpertWeight_v1_Nswizzle0_Quant2_MulRoutedWeight1_F8_F8_B16,100.0%,0.0,0.0
stage1,304,512,6144,320,160,8,ActivationType.Silu,torch.bfloat16,torch.float8_e4m3fnuz,torch.float8_e4m3fnuz,QuantType.per_Token,1,0,64,0,194.7892,moe_ck2stages_gemm1_256x64x64x256_1x4_MulABScale_v1_Nswizzle0_Quant2_MulRoutedWeight0_silu_F8_F8_B16,0.0%,248.05,4893.27
stage1,304,512,6144,320,160,8,ActivationType.Silu,torch.bfloat16,torch.float8_e4m3fnuz,torch.float8_e4m3fnuz,QuantType.per_Token,1,0,64,0,192.2037,moe_ck2stages_gemm1_256x64x64x128_1x4_MulABScale_v1_Nswizzle0_Quant2_MulRoutedWeight0_silu_F8_F8_B16,0.0%,251.39,4959.09
stage1,304,512,6144,320,160,8,ActivationType.Silu,torch.bfloat16,torch.float8_e4m3fnuz,torch.float8_e4m3fnuz,QuantType.per_Token,1,0,64,0,inf,moe_ck2stages_gemm1_256x64x128x256_1x4_MulABScale_v3_Nswizzle0_Quant2_MulRoutedWeight0_silu_F8_F8_B16,100.0%,0.0,0.0
stage1,304,512,6144,320,160,8,ActivationType.Silu,torch.bfloat16,torch.float8_e4m3fnuz,torch.float8_e4m3fnuz,QuantType.per_Token,1,0,64,0,inf,moe_ck2stages_gemm1_256x64x128x128_1x4_MulABScale_v3_Nswizzle0_Quant2_MulRoutedWeight0_silu_F8_F8_B16,100.0%,0.0,0.0
stage2,304,512,6144,320,160,8,ActivationType.Silu,torch.bfloat16,torch.float8_e4m3fnuz,torch.float8_e4m3fnuz,QuantType.per_Token,1,0,64,0,inf,moe_ck2stages_gemm2_256x64x64x256_1x4_MulABScaleExpertWeight_v1_Nswizzle0_Quant2_MulRoutedWeight1_F8_F8_B16,100.0%,0.0,0.0
stage2,304,512,6144,320,160,8,ActivationType.Silu,torch.bfloat16,torch.float8_e4m3fnuz,torch.float8_e4m3fnuz,QuantType.per_Token,1,0,64,0,inf,moe_ck2stages_gemm2_256x64x128x256_1x4_MulABScaleExpertWeight_v3_Nswizzle0_Quant2_MulRoutedWeight1_F8_F8_B16,100.0%,0.0,0.0
stage2,304,512,6144,320,160,8,ActivationType.Silu,torch.bfloat16,torch.float8_e4m3fnuz,torch.float8_e4m3fnuz,QuantType.per_Token,1,0,64,0,inf,moe_ck2stages_gemm2_256x64x128x128_1x4_MulABScaleExpertWeight_v3_Nswizzle0_Quant2_MulRoutedWeight1_F8_F8_B16,100.0%,0.0,0.0
stage1,304,512,6144,320,160,8,ActivationType.Silu,torch.bfloat16,torch.float8_e4m3fnuz,torch.float8_e4m3fnuz,QuantType.per_Token,1,0,128,0,226.3354,moe_ck2stages_gemm1_256x128x64x128_1x4_MulABScale_v1_Nswizzle0_Quant2_MulRoutedWeight0_silu_F8_F8_B16,0.0%,213.48,4211.25
stage1,304,512,6144,320,160,8,ActivationType.Silu,torch.bfloat16,torch.float8_e4m3fnuz,torch.float8_e4m3fnuz,QuantType.per_Token,1,0,128,0,inf,moe_ck2stages_gemm1_256x128x128x256_1x4_MulABScale_v3_Nswizzle0_Quant2_MulRoutedWeight0_silu_F8_F8_B16,100.0%,0.0,0.0
stage1,304,512,6144,320,160,8,ActivationType.Silu,torch.bfloat16,torch.float8_e4m3fnuz,torch.float8_e4m3fnuz,QuantType.per_Token,1,0,128,0,inf,moe_ck2stages_gemm1_256x128x128x128_1x4_MulABScale_v3_Nswizzle0_Quant2_MulRoutedWeight0_silu_F8_F8_B16,100.0%,0.0,0.0
stage2,304,512,6144,320,160,8,ActivationType.Silu,torch.bfloat16,torch.float8_e4m3fnuz,torch.float8_e4m3fnuz,QuantType.per_Token,1,0,128,0,inf,moe_ck2stages_gemm2_256x128x64x128_1x4_MulABScaleExpertWeight_v1_Nswizzle0_Quant2_MulRoutedWeight1_F8_F8_B16,100.0%,0.0,0.0
stage2,304,512,6144,320,160,8,ActivationType.Silu,torch.bfloat16,torch.float8_e4m3fnuz,torch.float8_e4m3fnuz,QuantType.per_Token,1,0,128,0,inf,moe_ck2stages_gemm2_256x128x128x128_1x4_MulABScaleExpertWeight_v3_Nswizzle0_Quant2_MulRoutedWeight1_F8_F8_B16,100.0%,0.0,0.0
asm_1stage,304,512,6144,320,160,8,ActivationType.Silu,torch.bfloat16,torch.float8_e4m3fnuz,torch.float8_e4m3fnuz,QuantType.per_Token,1,0,32,0,291.4703,_ZN5aiter45fmoe_bf16_pertokenFp8_g1u1_vs_silu_1tg_32x320E,0.0%,165.77,3270.16
asm_1stage,304,512,6144,320,160,8,ActivationType.Silu,torch.bfloat16,torch.float8_e4m3fnuz,torch.float8_e4m3fnuz,QuantType.per_Token,1,0,32,0,293.3143,_ZN5aiter48fmoe_bf16_pertokenFp8_g1u1_vs_silu_1tg_ps_32x320E,0.0%,164.73,3249.6
stage1,304,256,6144,320,160,8,ActivationType.Silu,torch.bfloat16,torch.float8_e4m3fnuz,torch.float8_e4m3fnuz,QuantType.per_Token,1,0,32,0,inf,_ZN5aiter48fmoe_stage1_bf16_pertokenFp8_g1u1_32x128_3tg_pf2E,100.0%,0.0,0.0
stage1,304,256,6144,320,160,8,ActivationType.Silu,torch.bfloat16,torch.float8_e4m3fnuz,torch.float8_e4m3fnuz,QuantType.per_Token,1,0,32,0,inf,_ZN5aiter48fmoe_stage1_bf16_pertokenFp8_g1u1_32x128_3tg_pf3E,100.0%,0.0,0.0
stage1,304,256,6144,320,160,8,ActivationType.Silu,torch.bfloat16,torch.float8_e4m3fnuz,torch.float8_e4m3fnuz,QuantType.per_Token,1,0,32,0,inf,_ZN5aiter48fmoe_stage1_bf16_pertokenFp8_g1u1_32x256_2tg_pf2E,100.0%,0.0,0.0
stage1,304,256,6144,320,160,8,ActivationType.Silu,torch.bfloat16,torch.float8_e4m3fnuz,torch.float8_e4m3fnuz,QuantType.per_Token,1,0,32,0,inf,_ZN5aiter48fmoe_stage1_bf16_pertokenFp8_g1u1_32x256_2tg_pf3E,100.0%,0.0,0.0
stage1,304,256,6144,320,160,8,ActivationType.Silu,torch.bfloat16,torch.float8_e4m3fnuz,torch.float8_e4m3fnuz,QuantType.per_Token,1,0,32,0,inf,_ZN5aiter44fmoe_stage1_bf16_pertokenFp8_g1u1_32x512_pf2E,100.0%,0.0,0.0
stage1,304,256,6144,320,160,8,ActivationType.Silu,torch.bfloat16,torch.float8_e4m3fnuz,torch.float8_e4m3fnuz,QuantType.per_Token,1,0,32,0,inf,_ZN5aiter44fmoe_stage1_bf16_pertokenFp8_g1u1_32x512_pf3E,100.0%,0.0,0.0
stage1,304,256,6144,320,160,8,ActivationType.Silu,torch.bfloat16,torch.float8_e4m3fnuz,torch.float8_e4m3fnuz,QuantType.per_Token,1,0,32,0,174.4296,_ZN5aiter47fmoe_stage1_bf16_pertokenFp8_g1u1_32x64_4tg_pf2E,0.0%,138.5,5437.36
stage1,304,256,6144,320,160,8,ActivationType.Silu,torch.bfloat16,torch.float8_e4m3fnuz,torch.float8_e4m3fnuz,QuantType.per_Token,1,0,32,0,178.6679,_ZN5aiter47fmoe_stage1_bf16_pertokenFp8_g1u1_32x64_4tg_pf3E,0.0%,135.22,5308.38
stage1,304,256,6144,320,160,8,ActivationType.Silu,torch.bfloat16,torch.float8_e4m3fnuz,torch.float8_e4m3fnuz,QuantType.per_Token,1,0,64,0,inf,_ZN5aiter48fmoe_stage1_bf16_pertokenFp8_g1u1_64x128_2tg_pf2E,100.0%,0.0,0.0
stage1,304,256,6144,320,160,8,ActivationType.Silu,torch.bfloat16,torch.float8_e4m3fnuz,torch.float8_e4m3fnuz,QuantType.per_Token,1,0,64,0,inf,_ZN5aiter48fmoe_stage1_bf16_pertokenFp8_g1u1_64x128_2tg_pf3E,100.0%,0.0,0.0
stage1,304,256,6144,320,160,8,ActivationType.Silu,torch.bfloat16,torch.float8_e4m3fnuz,torch.float8_e4m3fnuz,QuantType.per_Token,1,0,64,0,inf,_ZN5aiter44fmoe_stage1_bf16_pertokenFp8_g1u1_64x256_pf2E,100.0%,0.0,0.0
stage1,304,256,6144,320,160,8,ActivationType.Silu,torch.bfloat16,torch.float8_e4m3fnuz,torch.float8_e4m3fnuz,QuantType.per_Token,1,0,64,0,inf,_ZN5aiter44fmoe_stage1_bf16_pertokenFp8_g1u1_64x256_pf3E,100.0%,0.0,0.0
stage1,304,256,6144,320,160,8,ActivationType.Silu,torch.bfloat16,torch.float8_e4m3fnuz,torch.float8_e4m3fnuz,QuantType.per_Token,1,0,64,0,171.8146,_ZN5aiter47fmoe_stage1_bf16_pertokenFp8_g1u1_64x64_3tg_pf2E,0.0%,140.61,5520.12
stage1,304,256,6144,320,160,8,ActivationType.Silu,torch.bfloat16,torch.float8_e4m3fnuz,torch.float8_e4m3fnuz,QuantType.per_Token,1,0,64,0,188.2019,_ZN5aiter47fmoe_stage1_bf16_pertokenFp8_g1u1_64x64_2tg_pf3E,0.0%,128.37,5039.47
stage1,304,256,6144,320,160,8,ActivationType.Silu,torch.bfloat16,torch.float8_e4m3fnuz,torch.float8_e4m3fnuz,QuantType.per_Token,1,0,128,0,inf,_ZN5aiter45fmoe_stage1_bf16_pertokenFp8_g1u1_128x128_pf2E,100.0%,0.0,0.0
stage1,304,256,6144,320,160,8,ActivationType.Silu,torch.bfloat16,torch.float8_e4m3fnuz,torch.float8_e4m3fnuz,QuantType.per_Token,1,0,128,0,inf,_ZN5aiter45fmoe_stage1_bf16_pertokenFp8_g1u1_128x128_pf3E,100.0%,0.0,0.0
stage1,304,256,6144,320,160,8,ActivationType.Silu,torch.bfloat16,torch.float8_e4m3fnuz,torch.float8_e4m3fnuz,QuantType.per_Token,1,0,128,0,222.0334,_ZN5aiter44fmoe_stage1_bf16_pertokenFp8_g1u1_128x64_pf2E,0.0%,108.81,4271.6
stage1,304,256,6144,320,160,8,ActivationType.Silu,torch.bfloat16,torch.float8_e4m3fnuz,torch.float8_e4m3fnuz,QuantType.per_Token,1,0,128,0,204.032,_ZN5aiter44fmoe_stage1_bf16_pertokenFp8_g1u1_128x64_pf3E,0.0%,118.41,4648.47
stage1,304,256,6144,320,160,8,ActivationType.Silu,torch.bfloat16,torch.float8_e4m3fnuz,torch.float8_e4m3fnuz,QuantType.per_Token,1,0,32,0,175.2978,moe_ck2stages_gemm1_256x32x64x256_1x4_MulABScale_v1_Nswizzle0_Quant2_MulRoutedWeight0_silu_F8_F8_B16,0.0%,137.82,5410.43
stage1,304,256,6144,320,160,8,ActivationType.Silu,torch.bfloat16,torch.float8_e4m3fnuz,torch.float8_e4m3fnuz,QuantType.per_Token,1,0,32,0,170.3822,moe_ck2stages_gemm1_256x32x64x128_1x4_MulABScale_v1_Nswizzle0_Quant2_MulRoutedWeight0_silu_F8_F8_B16,0.0%,141.79,5566.53
stage2,304,256,6144,320,160,8,ActivationType.Silu,torch.bfloat16,torch.float8_e4m3fnuz,torch.float8_e4m3fnuz,QuantType.per_Token,1,0,32,0,inf,moe_ck2stages_gemm2_256x32x64x256_1x4_MulABScaleExpertWeight_v1_Nswizzle0_Quant2_MulRoutedWeight1_F8_F8_B16,100.0%,0.0,0.0
stage2,304,256,6144,320,160,8,ActivationType.Silu,torch.bfloat16,torch.float8_e4m3fnuz,torch.float8_e4m3fnuz,QuantType.per_Token,1,0,32,0,inf,moe_ck2stages_gemm2_256x32x64x128_1x4_MulABScaleExpertWeight_v1_Nswizzle0_Quant2_MulRoutedWeight1_F8_F8_B16,100.0%,0.0,0.0
stage1,304,256,6144,320,160,8,ActivationType.Silu,torch.bfloat16,torch.float8_e4m3fnuz,torch.float8_e4m3fnuz,QuantType.per_Token,1,0,64,0,183.1997,moe_ck2stages_gemm1_256x64x64x256_1x4_MulABScale_v1_Nswizzle0_Quant2_MulRoutedWeight0_silu_F8_F8_B16,0.0%,131.87,5177.07
stage1,304,256,6144,320,160,8,ActivationType.Silu,torch.bfloat16,torch.float8_e4m3fnuz,torch.float8_e4m3fnuz,QuantType.per_Token,1,0,64,0,187.9719,moe_ck2stages_gemm1_256x64x64x128_1x4_MulABScale_v1_Nswizzle0_Quant2_MulRoutedWeight0_silu_F8_F8_B16,0.0%,128.53,5045.63
stage1,304,256,6144,320,160,8,ActivationType.Silu,torch.bfloat16,torch.float8_e4m3fnuz,torch.float8_e4m3fnuz,QuantType.per_Token,1,0,64,0,inf,moe_ck2stages_gemm1_256x64x128x256_1x4_MulABScale_v3_Nswizzle0_Quant2_MulRoutedWeight0_silu_F8_F8_B16,100.0%,0.0,0.0
stage1,304,256,6144,320,160,8,ActivationType.Silu,torch.bfloat16,torch.float8_e4m3fnuz,torch.float8_e4m3fnuz,QuantType.per_Token,1,0,64,0,inf,moe_ck2stages_gemm1_256x64x128x128_1x4_MulABScale_v3_Nswizzle0_Quant2_MulRoutedWeight0_silu_F8_F8_B16,100.0%,0.0,0.0
stage2,304,256,6144,320,160,8,ActivationType.Silu,torch.bfloat16,torch.float8_e4m3fnuz,torch.float8_e4m3fnuz,QuantType.per_Token,1,0,64,0,inf,moe_ck2stages_gemm2_256x64x64x256_1x4_MulABScaleExpertWeight_v1_Nswizzle0_Quant2_MulRoutedWeight1_F8_F8_B16,100.0%,0.0,0.0
stage2,304,256,6144,320,160,8,ActivationType.Silu,torch.bfloat16,torch.float8_e4m3fnuz,torch.float8_e4m3fnuz,QuantType.per_Token,1,0,64,0,inf,moe_ck2stages_gemm2_256x64x128x256_1x4_MulABScaleExpertWeight_v3_Nswizzle0_Quant2_MulRoutedWeight1_F8_F8_B16,100.0%,0.0,0.0
stage2,304,256,6144,320,160,8,ActivationType.Silu,torch.bfloat16,torch.float8_e4m3fnuz,torch.float8_e4m3fnuz,QuantType.per_Token,1,0,64,0,inf,moe_ck2stages_gemm2_256x64x128x128_1x4_MulABScaleExpertWeight_v3_Nswizzle0_Quant2_MulRoutedWeight1_F8_F8_B16,100.0%,0.0,0.0
stage1,304,256,6144,320,160,8,ActivationType.Silu,torch.bfloat16,torch.float8_e4m3fnuz,torch.float8_e4m3fnuz,QuantType.per_Token,1,0,128,0,214.8841,moe_ck2stages_gemm1_256x128x64x128_1x4_MulABScale_v1_Nswizzle0_Quant2_MulRoutedWeight0_silu_F8_F8_B16,0.0%,112.43,4413.71
stage1,304,256,6144,320,160,8,ActivationType.Silu,torch.bfloat16,torch.float8_e4m3fnuz,torch.float8_e4m3fnuz,QuantType.per_Token,1,0,128,0,inf,moe_ck2stages_gemm1_256x128x128x256_1x4_MulABScale_v3_Nswizzle0_Quant2_MulRoutedWeight0_silu_F8_F8_B16,100.0%,0.0,0.0
stage1,304,256,6144,320,160,8,ActivationType.Silu,torch.bfloat16,torch.float8_e4m3fnuz,torch.float8_e4m3fnuz,QuantType.per_Token,1,0,128,0,inf,moe_ck2stages_gemm1_256x128x128x128_1x4_MulABScale_v3_Nswizzle0_Quant2_MulRoutedWeight0_silu_F8_F8_B16,100.0%,0.0,0.0
stage2,304,256,6144,320,160,8,ActivationType.Silu,torch.bfloat16,torch.float8_e4m3fnuz,torch.float8_e4m3fnuz,QuantType.per_Token,1,0,128,0,inf,moe_ck2stages_gemm2_256x128x64x128_1x4_MulABScaleExpertWeight_v1_Nswizzle0_Quant2_MulRoutedWeight1_F8_F8_B16,100.0%,0.0,0.0
stage2,304,256,6144,320,160,8,ActivationType.Silu,torch.bfloat16,torch.float8_e4m3fnuz,torch.float8_e4m3fnuz,QuantType.per_Token,1,0,128,0,inf,moe_ck2stages_gemm2_256x128x128x128_1x4_MulABScaleExpertWeight_v3_Nswizzle0_Quant2_MulRoutedWeight1_F8_F8_B16,100.0%,0.0,0.0
asm_1stage,304,256,6144,320,160,8,ActivationType.Silu,torch.bfloat16,torch.float8_e4m3fnuz,torch.float8_e4m3fnuz,QuantType.per_Token,1,0,32,0,267.0451,_ZN5aiter45fmoe_bf16_pertokenFp8_g1u1_vs_silu_1tg_32x320E,0.0%,90.47,3551.6
asm_1stage,304,256,6144,320,160,8,ActivationType.Silu,torch.bfloat16,torch.float8_e4m3fnuz,torch.float8_e4m3fnuz,QuantType.per_Token,1,0,32,0,266.5856,_ZN5aiter48fmoe_bf16_pertokenFp8_g1u1_vs_silu_1tg_ps_32x320E,0.0%,90.62,3557.72
stage1,304,128,6144,320,160,8,ActivationType.Silu,torch.bfloat16,torch.float8_e4m3fnuz,torch.float8_e4m3fnuz,QuantType.per_Token,1,0,32,0,inf,_ZN5aiter48fmoe_stage1_bf16_pertokenFp8_g1u1_32x128_3tg_pf2E,100.0%,0.0,0.0
stage1,304,128,6144,320,160,8,ActivationType.Silu,torch.bfloat16,torch.float8_e4m3fnuz,torch.float8_e4m3fnuz,QuantType.per_Token,1,0,32,0,inf,_ZN5aiter48fmoe_stage1_bf16_pertokenFp8_g1u1_32x128_3tg_pf3E,100.0%,0.0,0.0
stage1,304,128,6144,320,160,8,ActivationType.Silu,torch.bfloat16,torch.float8_e4m3fnuz,torch.float8_e4m3fnuz,QuantType.per_Token,1,0,32,0,inf,_ZN5aiter48fmoe_stage1_bf16_pertokenFp8_g1u1_32x256_2tg_pf2E,100.0%,0.0,0.0
stage1,304,128,6144,320,160,8,ActivationType.Silu,torch.bfloat16,torch.float8_e4m3fnuz,torch.float8_e4m3fnuz,QuantType.per_Token,1,0,32,0,inf,_ZN5aiter48fmoe_stage1_bf16_pertokenFp8_g1u1_32x256_2tg_pf3E,100.0%,0.0,0.0
stage1,304,128,6144,320,160,8,ActivationType.Silu,torch.bfloat16,torch.float8_e4m3fnuz,torch.float8_e4m3fnuz,QuantType.per_Token,1,0,32,0,inf,_ZN5aiter44fmoe_stage1_bf16_pertokenFp8_g1u1_32x512_pf2E,100.0%,0.0,0.0
stage1,304,128,6144,320,160,8,ActivationType.Silu,torch.bfloat16,torch.float8_e4m3fnuz,torch.float8_e4m3fnuz,QuantType.per_Token,1,0,32,0,inf,_ZN5aiter44fmoe_stage1_bf16_pertokenFp8_g1u1_32x512_pf3E,100.0%,0.0,0.0
stage1,304,128,6144,320,160,8,ActivationType.Silu,torch.bfloat16,torch.float8_e4m3fnuz,torch.float8_e4m3fnuz,QuantType.per_Token,1,0,32,0,172.212,_ZN5aiter47fmoe_stage1_bf16_pertokenFp8_g1u1_32x64_4tg_pf2E,0.0%,70.14,5493.68
stage1,304,128,6144,320,160,8,ActivationType.Silu,torch.bfloat16,torch.float8_e4m3fnuz,torch.float8_e4m3fnuz,QuantType.per_Token,1,0,32,0,177.2579,_ZN5aiter47fmoe_stage1_bf16_pertokenFp8_g1u1_32x64_4tg_pf3E,0.0%,68.15,5337.29
stage1,304,128,6144,320,160,8,ActivationType.Silu,torch.bfloat16,torch.float8_e4m3fnuz,torch.float8_e4m3fnuz,QuantType.per_Token,1,0,64,0,inf,_ZN5aiter48fmoe_stage1_bf16_pertokenFp8_g1u1_64x128_2tg_pf2E,100.0%,0.0,0.0
stage1,304,128,6144,320,160,8,ActivationType.Silu,torch.bfloat16,torch.float8_e4m3fnuz,torch.float8_e4m3fnuz,QuantType.per_Token,1,0,64,0,inf,_ZN5aiter48fmoe_stage1_bf16_pertokenFp8_g1u1_64x128_2tg_pf3E,100.0%,0.0,0.0
stage1,304,128,6144,320,160,8,ActivationType.Silu,torch.bfloat16,torch.float8_e4m3fnuz,torch.float8_e4m3fnuz,QuantType.per_Token,1,0,64,0,inf,_ZN5aiter44fmoe_stage1_bf16_pertokenFp8_g1u1_64x256_pf2E,100.0%,0.0,0.0
stage1,304,128,6144,320,160,8,ActivationType.Silu,torch.bfloat16,torch.float8_e4m3fnuz,torch.float8_e4m3fnuz,QuantType.per_Token,1,0,64,0,inf,_ZN5aiter44fmoe_stage1_bf16_pertokenFp8_g1u1_64x256_pf3E,100.0%,0.0,0.0
stage1,304,128,6144,320,160,8,ActivationType.Silu,torch.bfloat16,torch.float8_e4m3fnuz,torch.float8_e4m3fnuz,QuantType.per_Token,1,0,64,0,169.755,_ZN5aiter47fmoe_stage1_bf16_pertokenFp8_g1u1_64x64_3tg_pf2E,0.0%,71.16,5573.19
stage1,304,128,6144,320,160,8,ActivationType.Silu,torch.bfloat16,torch.float8_e4m3fnuz,torch.float8_e4m3fnuz,QuantType.per_Token,1,0,64,0,175.1649,_ZN5aiter47fmoe_stage1_bf16_pertokenFp8_g1u1_64x64_2tg_pf3E,0.0%,68.96,5401.07
stage1,304,128,6144,320,160,8,ActivationType.Silu,torch.bfloat16,torch.float8_e4m3fnuz,torch.float8_e4m3fnuz,QuantType.per_Token,1,0,128,0,inf,_ZN5aiter45fmoe_stage1_bf16_pertokenFp8_g1u1_128x128_pf2E,100.0%,0.0,0.0
stage1,304,128,6144,320,160,8,ActivationType.Silu,torch.bfloat16,torch.float8_e4m3fnuz,torch.float8_e4m3fnuz,QuantType.per_Token,1,0,128,0,inf,_ZN5aiter45fmoe_stage1_bf16_pertokenFp8_g1u1_128x128_pf3E,100.0%,0.0,0.0
stage1,304,128,6144,320,160,8,ActivationType.Silu,torch.bfloat16,torch.float8_e4m3fnuz,torch.float8_e4m3fnuz,QuantType.per_Token,1,0,128,0,219.6647,_ZN5aiter44fmoe_stage1_bf16_pertokenFp8_g1u1_128x64_pf2E,0.0%,54.99,4306.92
stage1,304,128,6144,320,160,8,ActivationType.Silu,torch.bfloat16,torch.float8_e4m3fnuz,torch.float8_e4m3fnuz,QuantType.per_Token,1,0,128,0,207.1833,_ZN5aiter44fmoe_stage1_bf16_pertokenFp8_g1u1_128x64_pf3E,0.0%,58.3,4566.38
stage1,304,128,6144,320,160,8,ActivationType.Silu,torch.bfloat16,torch.float8_e4m3fnuz,torch.float8_e4m3fnuz,QuantType.per_Token,1,0,32,0,168.452,moe_ck2stages_gemm1_256x32x64x256_1x4_MulABScale_v1_Nswizzle0_Quant2_MulRoutedWeight0_silu_F8_F8_B16,0.0%,71.71,5616.3
stage1,304,128,6144,320,160,8,ActivationType.Silu,torch.bfloat16,torch.float8_e4m3fnuz,torch.float8_e4m3fnuz,QuantType.per_Token,1,0,32,0,167.8471,moe_ck2stages_gemm1_256x32x64x128_1x4_MulABScale_v1_Nswizzle0_Quant2_MulRoutedWeight0_silu_F8_F8_B16,0.0%,71.97,5636.54
stage2,304,128,6144,320,160,8,ActivationType.Silu,torch.bfloat16,torch.float8_e4m3fnuz,torch.float8_e4m3fnuz,QuantType.per_Token,1,0,32,0,inf,moe_ck2stages_gemm2_256x32x64x256_1x4_MulABScaleExpertWeight_v1_Nswizzle0_Quant2_MulRoutedWeight1_F8_F8_B16,100.0%,0.0,0.0
stage2,304,128,6144,320,160,8,ActivationType.Silu,torch.bfloat16,torch.float8_e4m3fnuz,torch.float8_e4m3fnuz,QuantType.per_Token,1,0,32,0,inf,moe_ck2stages_gemm2_256x32x64x128_1x4_MulABScaleExpertWeight_v1_Nswizzle0_Quant2_MulRoutedWeight1_F8_F8_B16,100.0%,0.0,0.0
stage1,304,128,6144,320,160,8,ActivationType.Silu,torch.bfloat16,torch.float8_e4m3fnuz,torch.float8_e4m3fnuz,QuantType.per_Token,1,0,64,0,179.5445,moe_ck2stages_gemm1_256x64x64x256_1x4_MulABScale_v1_Nswizzle0_Quant2_MulRoutedWeight0_silu_F8_F8_B16,0.0%,67.28,5269.32
stage1,304,128,6144,320,160,8,ActivationType.Silu,torch.bfloat16,torch.float8_e4m3fnuz,torch.float8_e4m3fnuz,QuantType.per_Token,1,0,64,0,181.6312,moe_ck2stages_gemm1_256x64x64x128_1x4_MulABScale_v1_Nswizzle0_Quant2_MulRoutedWeight0_silu_F8_F8_B16,0.0%,66.51,5208.78
stage1,304,128,6144,320,160,8,ActivationType.Silu,torch.bfloat16,torch.float8_e4m3fnuz,torch.float8_e4m3fnuz,QuantType.per_Token,1,0,64,0,inf,moe_ck2stages_gemm1_256x64x128x256_1x4_MulABScale_v3_Nswizzle0_Quant2_MulRoutedWeight0_silu_F8_F8_B16,100.0%,0.0,0.0
stage1,304,128,6144,320,160,8,ActivationType.Silu,torch.bfloat16,torch.float8_e4m3fnuz,torch.float8_e4m3fnuz,QuantType.per_Token,1,0,64,0,inf,moe_ck2stages_gemm1_256x64x128x128_1x4_MulABScale_v3_Nswizzle0_Quant2_MulRoutedWeight0_silu_F8_F8_B16,100.0%,0.0,0.0
stage2,304,128,6144,320,160,8,ActivationType.Silu,torch.bfloat16,torch.float8_e4m3fnuz,torch.float8_e4m3fnuz,QuantType.per_Token,1,0,64,0,inf,moe_ck2stages_gemm2_256x64x64x256_1x4_MulABScaleExpertWeight_v1_Nswizzle0_Quant2_MulRoutedWeight1_F8_F8_B16,100.0%,0.0,0.0
stage2,304,128,6144,320,160,8,ActivationType.Silu,torch.bfloat16,torch.float8_e4m3fnuz,torch.float8_e4m3fnuz,QuantType.per_Token,1,0,64,0,inf,moe_ck2stages_gemm2_256x64x128x256_1x4_MulABScaleExpertWeight_v3_Nswizzle0_Quant2_MulRoutedWeight1_F8_F8_B16,100.0%,0.0,0.0
stage2,304,128,6144,320,160,8,ActivationType.Silu,torch.bfloat16,torch.float8_e4m3fnuz,torch.float8_e4m3fnuz,QuantType.per_Token,1,0,64,0,inf,moe_ck2stages_gemm2_256x64x128x128_1x4_MulABScaleExpertWeight_v3_Nswizzle0_Quant2_MulRoutedWeight1_F8_F8_B16,100.0%,0.0,0.0
stage1,304,128,6144,320,160,8,ActivationType.Silu,torch.bfloat16,torch.float8_e4m3fnuz,torch.float8_e4m3fnuz,QuantType.per_Token,1,0,128,0,215.1516,moe_ck2stages_gemm1_256x128x64x128_1x4_MulABScale_v1_Nswizzle0_Quant2_MulRoutedWeight0_silu_F8_F8_B16,0.0%,56.14,4397.26
stage1,304,128,6144,320,160,8,ActivationType.Silu,torch.bfloat16,torch.float8_e4m3fnuz,torch.float8_e4m3fnuz,QuantType.per_Token,1,0,128,0,inf,moe_ck2stages_gemm1_256x128x128x256_1x4_MulABScale_v3_Nswizzle0_Quant2_MulRoutedWeight0_silu_F8_F8_B16,100.0%,0.0,0.0
stage1,304,128,6144,320,160,8,ActivationType.Silu,torch.bfloat16,torch.float8_e4m3fnuz,torch.float8_e4m3fnuz,QuantType.per_Token,1,0,128,0,inf,moe_ck2stages_gemm1_256x128x128x128_1x4_MulABScale_v3_Nswizzle0_Quant2_MulRoutedWeight0_silu_F8_F8_B16,100.0%,0.0,0.0
stage2,304,128,6144,320,160,8,ActivationType.Silu,torch.bfloat16,torch.float8_e4m3fnuz,torch.float8_e4m3fnuz,QuantType.per_Token,1,0,128,0,inf,moe_ck2stages_gemm2_256x128x64x128_1x4_MulABScaleExpertWeight_v1_Nswizzle0_Quant2_MulRoutedWeight1_F8_F8_B16,100.0%,0.0,0.0
stage2,304,128,6144,320,160,8,ActivationType.Silu,torch.bfloat16,torch.float8_e4m3fnuz,torch.float8_e4m3fnuz,QuantType.per_Token,1,0,128,0,inf,moe_ck2stages_gemm2_256x128x128x128_1x4_MulABScaleExpertWeight_v3_Nswizzle0_Quant2_MulRoutedWeight1_F8_F8_B16,100.0%,0.0,0.0
asm_1stage,304,128,6144,320,160,8,ActivationType.Silu,torch.bfloat16,torch.float8_e4m3fnuz,torch.float8_e4m3fnuz,QuantType.per_Token,1,0,32,0,259.2767,_ZN5aiter45fmoe_bf16_pertokenFp8_g1u1_vs_silu_1tg_32x320E,0.0%,46.59,3648.91
asm_1stage,304,128,6144,320,160,8,ActivationType.Silu,torch.bfloat16,torch.float8_e4m3fnuz,torch.float8_e4m3fnuz,QuantType.per_Token,1,0,32,0,254.3379,_ZN5aiter48fmoe_bf16_pertokenFp8_g1u1_vs_silu_1tg_ps_32x320E,0.0%,47.49,3719.77
stage1,304,64,6144,320,160,8,ActivationType.Silu,torch.bfloat16,torch.float8_e4m3fnuz,torch.float8_e4m3fnuz,QuantType.per_Token,1,0,32,0,inf,_ZN5aiter48fmoe_stage1_bf16_pertokenFp8_g1u1_32x128_3tg_pf2E,100.0%,0.0,0.0
stage1,304,64,6144,320,160,8,ActivationType.Silu,torch.bfloat16,torch.float8_e4m3fnuz,torch.float8_e4m3fnuz,QuantType.per_Token,1,0,32,0,inf,_ZN5aiter48fmoe_stage1_bf16_pertokenFp8_g1u1_32x128_3tg_pf3E,100.0%,0.0,0.0
stage1,304,64,6144,320,160,8,ActivationType.Silu,torch.bfloat16,torch.float8_e4m3fnuz,torch.float8_e4m3fnuz,QuantType.per_Token,1,0,32,0,inf,_ZN5aiter48fmoe_stage1_bf16_pertokenFp8_g1u1_32x256_2tg_pf2E,100.0%,0.0,0.0
stage1,304,64,6144,320,160,8,ActivationType.Silu,torch.bfloat16,torch.float8_e4m3fnuz,torch.float8_e4m3fnuz,QuantType.per_Token,1,0,32,0,inf,_ZN5aiter48fmoe_stage1_bf16_pertokenFp8_g1u1_32x256_2tg_pf3E,100.0%,0.0,0.0
stage1,304,64,6144,320,160,8,ActivationType.Silu,torch.bfloat16,torch.float8_e4m3fnuz,torch.float8_e4m3fnuz,QuantType.per_Token,1,0,32,0,inf,_ZN5aiter44fmoe_stage1_bf16_pertokenFp8_g1u1_32x512_pf2E,100.0%,0.0,0.0
stage1,304,64,6144,320,160,8,ActivationType.Silu,torch.bfloat16,torch.float8_e4m3fnuz,torch.float8_e4m3fnuz,QuantType.per_Token,1,0,32,0,inf,_ZN5aiter44fmoe_stage1_bf16_pertokenFp8_g1u1_32x512_pf3E,100.0%,0.0,0.0
stage1,304,64,6144,320,160,8,ActivationType.Silu,torch.bfloat16,torch.float8_e4m3fnuz,torch.float8_e4m3fnuz,QuantType.per_Token,1,0,32,0,158.7097,_ZN5aiter47fmoe_stage1_bf16_pertokenFp8_g1u1_32x64_4tg_pf2E,0.0%,38.06,5953.63
stage1,304,64,6144,320,160,8,ActivationType.Silu,torch.bfloat16,torch.float8_e4m3fnuz,torch.float8_e4m3fnuz,QuantType.per_Token,1,0,32,0,165.2963,_ZN5aiter47fmoe_stage1_bf16_pertokenFp8_g1u1_32x64_4tg_pf3E,0.0%,36.54,5716.39
stage1,304,64,6144,320,160,8,ActivationType.Silu,torch.bfloat16,torch.float8_e4m3fnuz,torch.float8_e4m3fnuz,QuantType.per_Token,1,0,64,0,inf,_ZN5aiter48fmoe_stage1_bf16_pertokenFp8_g1u1_64x128_2tg_pf2E,100.0%,0.0,0.0
stage1,304,64,6144,320,160,8,ActivationType.Silu,torch.bfloat16,torch.float8_e4m3fnuz,torch.float8_e4m3fnuz,QuantType.per_Token,1,0,64,0,inf,_ZN5aiter48fmoe_stage1_bf16_pertokenFp8_g1u1_64x128_2tg_pf3E,100.0%,0.0,0.0
stage1,304,64,6144,320,160,8,ActivationType.Silu,torch.bfloat16,torch.float8_e4m3fnuz,torch.float8_e4m3fnuz,QuantType.per_Token,1,0,64,0,inf,_ZN5aiter44fmoe_stage1_bf16_pertokenFp8_g1u1_64x256_pf2E,100.0%,0.0,0.0
stage1,304,64,6144,320,160,8,ActivationType.Silu,torch.bfloat16,torch.float8_e4m3fnuz,torch.float8_e4m3fnuz,QuantType.per_Token,1,0,64,0,inf,_ZN5aiter44fmoe_stage1_bf16_pertokenFp8_g1u1_64x256_pf3E,100.0%,0.0,0.0
stage1,304,64,6144,320,160,8,ActivationType.Silu,torch.bfloat16,torch.float8_e4m3fnuz,torch.float8_e4m3fnuz,QuantType.per_Token,1,0,64,0,159.0113,_ZN5aiter47fmoe_stage1_bf16_pertokenFp8_g1u1_64x64_3tg_pf2E,0.0%,37.98,5942.33
stage1,304,64,6144,320,160,8,ActivationType.Silu,torch.bfloat16,torch.float8_e4m3fnuz,torch.float8_e4m3fnuz,QuantType.per_Token,1,0,64,0,175.1897,_ZN5aiter47fmoe_stage1_bf16_pertokenFp8_g1u1_64x64_2tg_pf3E,0.0%,34.48,5393.57
stage1,304,64,6144,320,160,8,ActivationType.Silu,torch.bfloat16,torch.float8_e4m3fnuz,torch.float8_e4m3fnuz,QuantType.per_Token,1,0,128,0,inf,_ZN5aiter45fmoe_stage1_bf16_pertokenFp8_g1u1_128x128_pf2E,100.0%,0.0,0.0
stage1,304,64,6144,320,160,8,ActivationType.Silu,torch.bfloat16,torch.float8_e4m3fnuz,torch.float8_e4m3fnuz,QuantType.per_Token,1,0,128,0,inf,_ZN5aiter45fmoe_stage1_bf16_pertokenFp8_g1u1_128x128_pf3E,100.0%,0.0,0.0
stage1,304,64,6144,320,160,8,ActivationType.Silu,torch.bfloat16,torch.float8_e4m3fnuz,torch.float8_e4m3fnuz,QuantType.per_Token,1,0,128,0,213.4828,_ZN5aiter44fmoe_stage1_bf16_pertokenFp8_g1u1_128x64_pf2E,0.0%,28.29,4426.11
stage1,304,64,6144,320,160,8,ActivationType.Silu,torch.bfloat16,torch.float8_e4m3fnuz,torch.float8_e4m3fnuz,QuantType.per_Token,1,0,128,0,195.9543,_ZN5aiter44fmoe_stage1_bf16_pertokenFp8_g1u1_128x64_pf3E,0.0%,30.82,4822.03
stage1,304,64,6144,320,160,8,ActivationType.Silu,torch.bfloat16,torch.float8_e4m3fnuz,torch.float8_e4m3fnuz,QuantType.per_Token,1,0,32,0,161.1856,moe_ck2stages_gemm1_256x32x64x256_1x4_MulABScale_v1_Nswizzle0_Quant2_MulRoutedWeight0_silu_F8_F8_B16,0.0%,37.47,5862.17
stage1,304,64,6144,320,160,8,ActivationType.Silu,torch.bfloat16,torch.float8_e4m3fnuz,torch.float8_e4m3fnuz,QuantType.per_Token,1,0,32,0,161.9191,moe_ck2stages_gemm1_256x32x64x128_1x4_MulABScale_v1_Nswizzle0_Quant2_MulRoutedWeight0_silu_F8_F8_B16,0.0%,37.3,5835.62
stage2,304,64,6144,320,160,8,ActivationType.Silu,torch.bfloat16,torch.float8_e4m3fnuz,torch.float8_e4m3fnuz,QuantType.per_Token,1,0,32,0,inf,moe_ck2stages_gemm2_256x32x64x256_1x4_MulABScaleExpertWeight_v1_Nswizzle0_Quant2_MulRoutedWeight1_F8_F8_B16,100.0%,0.0,0.0
stage2,304,64,6144,320,160,8,ActivationType.Silu,torch.bfloat16,torch.float8_e4m3fnuz,torch.float8_e4m3fnuz,QuantType.per_Token,1,0,32,0,inf,moe_ck2stages_gemm2_256x32x64x128_1x4_MulABScaleExpertWeight_v1_Nswizzle0_Quant2_MulRoutedWeight1_F8_F8_B16,100.0%,0.0,0.0
stage1,304,64,6144,320,160,8,ActivationType.Silu,torch.bfloat16,torch.float8_e4m3fnuz,torch.float8_e4m3fnuz,QuantType.per_Token,1,0,64,0,172.7967,moe_ck2stages_gemm1_256x64x64x256_1x4_MulABScale_v1_Nswizzle0_Quant2_MulRoutedWeight0_silu_F8_F8_B16,0.0%,34.95,5468.26
stage1,304,64,6144,320,160,8,ActivationType.Silu,torch.bfloat16,torch.float8_e4m3fnuz,torch.float8_e4m3fnuz,QuantType.per_Token,1,0,64,0,167.5307,moe_ck2stages_gemm1_256x64x64x128_1x4_MulABScale_v1_Nswizzle0_Quant2_MulRoutedWeight0_silu_F8_F8_B16,0.0%,36.05,5640.15
stage1,304,64,6144,320,160,8,ActivationType.Silu,torch.bfloat16,torch.float8_e4m3fnuz,torch.float8_e4m3fnuz,QuantType.per_Token,1,0,64,0,inf,moe_ck2stages_gemm1_256x64x128x256_1x4_MulABScale_v3_Nswizzle0_Quant2_MulRoutedWeight0_silu_F8_F8_B16,100.0%,0.0,0.0
stage1,304,64,6144,320,160,8,ActivationType.Silu,torch.bfloat16,torch.float8_e4m3fnuz,torch.float8_e4m3fnuz,QuantType.per_Token,1,0,64,0,inf,moe_ck2stages_gemm1_256x64x128x128_1x4_MulABScale_v3_Nswizzle0_Quant2_MulRoutedWeight0_silu_F8_F8_B16,100.0%,0.0,0.0
stage2,304,64,6144,320,160,8,ActivationType.Silu,torch.bfloat16,torch.float8_e4m3fnuz,torch.float8_e4m3fnuz,QuantType.per_Token,1,0,64,0,inf,moe_ck2stages_gemm2_256x64x64x256_1x4_MulABScaleExpertWeight_v1_Nswizzle0_Quant2_MulRoutedWeight1_F8_F8_B16,100.0%,0.0,0.0
stage2,304,64,6144,320,160,8,ActivationType.Silu,torch.bfloat16,torch.float8_e4m3fnuz,torch.float8_e4m3fnuz,QuantType.per_Token,1,0,64,0,inf,moe_ck2stages_gemm2_256x64x128x256_1x4_MulABScaleExpertWeight_v3_Nswizzle0_Quant2_MulRoutedWeight1_F8_F8_B16,100.0%,0.0,0.0
stage2,304,64,6144,320,160,8,ActivationType.Silu,torch.bfloat16,torch.float8_e4m3fnuz,torch.float8_e4m3fnuz,QuantType.per_Token,1,0,64,0,inf,moe_ck2stages_gemm2_256x64x128x128_1x4_MulABScaleExpertWeight_v3_Nswizzle0_Quant2_MulRoutedWeight1_F8_F8_B16,100.0%,0.0,0.0
stage1,304,64,6144,320,160,8,ActivationType.Silu,torch.bfloat16,torch.float8_e4m3fnuz,torch.float8_e4m3fnuz,QuantType.per_Token,1,0,128,0,207.1324,moe_ck2stages_gemm1_256x128x64x128_1x4_MulABScale_v1_Nswizzle0_Quant2_MulRoutedWeight0_silu_F8_F8_B16,0.0%,29.16,4561.81
stage1,304,64,6144,320,160,8,ActivationType.Silu,torch.bfloat16,torch.float8_e4m3fnuz,torch.float8_e4m3fnuz,QuantType.per_Token,1,0,128,0,inf,moe_ck2stages_gemm1_256x128x128x256_1x4_MulABScale_v3_Nswizzle0_Quant2_MulRoutedWeight0_silu_F8_F8_B16,100.0%,0.0,0.0
stage1,304,64,6144,320,160,8,ActivationType.Silu,torch.bfloat16,torch.float8_e4m3fnuz,torch.float8_e4m3fnuz,QuantType.per_Token,1,0,128,0,inf,moe_ck2stages_gemm1_256x128x128x128_1x4_MulABScale_v3_Nswizzle0_Quant2_MulRoutedWeight0_silu_F8_F8_B16,100.0%,0.0,0.0
stage2,304,64,6144,320,160,8,ActivationType.Silu,torch.bfloat16,torch.float8_e4m3fnuz,torch.float8_e4m3fnuz,QuantType.per_Token,1,0,128,0,inf,moe_ck2stages_gemm2_256x128x64x128_1x4_MulABScaleExpertWeight_v1_Nswizzle0_Quant2_MulRoutedWeight1_F8_F8_B16,100.0%,0.0,0.0
stage2,304,64,6144,320,160,8,ActivationType.Silu,torch.bfloat16,torch.float8_e4m3fnuz,torch.float8_e4m3fnuz,QuantType.per_Token,1,0,128,0,inf,moe_ck2stages_gemm2_256x128x128x128_1x4_MulABScaleExpertWeight_v3_Nswizzle0_Quant2_MulRoutedWeight1_F8_F8_B16,100.0%,0.0,0.0
asm_1stage,304,64,6144,320,160,8,ActivationType.Silu,torch.bfloat16,torch.float8_e4m3fnuz,torch.float8_e4m3fnuz,QuantType.per_Token,1,0,32,0,244.808,_ZN5aiter45fmoe_bf16_pertokenFp8_g1u1_vs_silu_1tg_32x320E,0.0%,24.67,3859.75
asm_1stage,304,64,6144,320,160,8,ActivationType.Silu,torch.bfloat16,torch.float8_e4m3fnuz,torch.float8_e4m3fnuz,QuantType.per_Token,1,0,32,0,248.2558,_ZN5aiter48fmoe_bf16_pertokenFp8_g1u1_vs_silu_1tg_ps_32x320E,0.0%,24.33,3806.15
stage1,304,32,6144,320,160,8,ActivationType.Silu,torch.bfloat16,torch.float8_e4m3fnuz,torch.float8_e4m3fnuz,QuantType.per_Token,1,0,32,0,inf,_ZN5aiter48fmoe_stage1_bf16_pertokenFp8_g1u1_32x128_3tg_pf2E,100.0%,0.0,0.0
stage1,304,32,6144,320,160,8,ActivationType.Silu,torch.bfloat16,torch.float8_e4m3fnuz,torch.float8_e4m3fnuz,QuantType.per_Token,1,0,32,0,inf,_ZN5aiter48fmoe_stage1_bf16_pertokenFp8_g1u1_32x128_3tg_pf3E,100.0%,0.0,0.0
stage1,304,32,6144,320,160,8,ActivationType.Silu,torch.bfloat16,torch.float8_e4m3fnuz,torch.float8_e4m3fnuz,QuantType.per_Token,1,0,32,0,inf,_ZN5aiter48fmoe_stage1_bf16_pertokenFp8_g1u1_32x256_2tg_pf2E,100.0%,0.0,0.0
stage1,304,32,6144,320,160,8,ActivationType.Silu,torch.bfloat16,torch.float8_e4m3fnuz,torch.float8_e4m3fnuz,QuantType.per_Token,1,0,32,0,inf,_ZN5aiter48fmoe_stage1_bf16_pertokenFp8_g1u1_32x256_2tg_pf3E,100.0%,0.0,0.0
stage1,304,32,6144,320,160,8,ActivationType.Silu,torch.bfloat16,torch.float8_e4m3fnuz,torch.float8_e4m3fnuz,QuantType.per_Token,1,0,32,0,inf,_ZN5aiter44fmoe_stage1_bf16_pertokenFp8_g1u1_32x512_pf2E,100.0%,0.0,0.0
stage1,304,32,6144,320,160,8,ActivationType.Silu,torch.bfloat16,torch.float8_e4m3fnuz,torch.float8_e4m3fnuz,QuantType.per_Token,1,0,32,0,inf,_ZN5aiter44fmoe_stage1_bf16_pertokenFp8_g1u1_32x512_pf3E,100.0%,0.0,0.0
stage1,304,32,6144,320,160,8,ActivationType.Silu,torch.bfloat16,torch.float8_e4m3fnuz,torch.float8_e4m3fnuz,QuantType.per_Token,1,0,32,0,135.4677,_ZN5aiter47fmoe_stage1_bf16_pertokenFp8_g1u1_32x64_4tg_pf2E,0.0%,22.29,6970.73
stage1,304,32,6144,320,160,8,ActivationType.Silu,torch.bfloat16,torch.float8_e4m3fnuz,torch.float8_e4m3fnuz,QuantType.per_Token,1,0,32,0,144.9478,_ZN5aiter47fmoe_stage1_bf16_pertokenFp8_g1u1_32x64_4tg_pf3E,0.0%,20.83,6514.82
stage1,304,32,6144,320,160,8,ActivationType.Silu,torch.bfloat16,torch.float8_e4m3fnuz,torch.float8_e4m3fnuz,QuantType.per_Token,1,0,64,0,inf,_ZN5aiter48fmoe_stage1_bf16_pertokenFp8_g1u1_64x128_2tg_pf2E,100.0%,0.0,0.0
stage1,304,32,6144,320,160,8,ActivationType.Silu,torch.bfloat16,torch.float8_e4m3fnuz,torch.float8_e4m3fnuz,QuantType.per_Token,1,0,64,0,inf,_ZN5aiter48fmoe_stage1_bf16_pertokenFp8_g1u1_64x128_2tg_pf3E,100.0%,0.0,0.0
stage1,304,32,6144,320,160,8,ActivationType.Silu,torch.bfloat16,torch.float8_e4m3fnuz,torch.float8_e4m3fnuz,QuantType.per_Token,1,0,64,0,inf,_ZN5aiter44fmoe_stage1_bf16_pertokenFp8_g1u1_64x256_pf2E,100.0%,0.0,0.0
stage1,304,32,6144,320,160,8,ActivationType.Silu,torch.bfloat16,torch.float8_e4m3fnuz,torch.float8_e4m3fnuz,QuantType.per_Token,1,0,64,0,inf,_ZN5aiter44fmoe_stage1_bf16_pertokenFp8_g1u1_64x256_pf3E,100.0%,0.0,0.0
stage1,304,32,6144,320,160,8,ActivationType.Silu,torch.bfloat16,torch.float8_e4m3fnuz,torch.float8_e4m3fnuz,QuantType.per_Token,1,0,64,0,132.0726,_ZN5aiter47fmoe_stage1_bf16_pertokenFp8_g1u1_64x64_3tg_pf2E,0.0%,22.87,7149.92
stage1,304,32,6144,320,160,8,ActivationType.Silu,torch.bfloat16,torch.float8_e4m3fnuz,torch.float8_e4m3fnuz,QuantType.per_Token,1,0,64,0,147.2797,_ZN5aiter47fmoe_stage1_bf16_pertokenFp8_g1u1_64x64_2tg_pf3E,0.0%,20.5,6411.67
stage1,304,32,6144,320,160,8,ActivationType.Silu,torch.bfloat16,torch.float8_e4m3fnuz,torch.float8_e4m3fnuz,QuantType.per_Token,1,0,128,0,inf,_ZN5aiter45fmoe_stage1_bf16_pertokenFp8_g1u1_128x128_pf2E,100.0%,0.0,0.0
stage1,304,32,6144,320,160,8,ActivationType.Silu,torch.bfloat16,torch.float8_e4m3fnuz,torch.float8_e4m3fnuz,QuantType.per_Token,1,0,128,0,inf,_ZN5aiter45fmoe_stage1_bf16_pertokenFp8_g1u1_128x128_pf3E,100.0%,0.0,0.0
stage1,304,32,6144,320,160,8,ActivationType.Silu,torch.bfloat16,torch.float8_e4m3fnuz,torch.float8_e4m3fnuz,QuantType.per_Token,1,0,128,0,192.7237,_ZN5aiter44fmoe_stage1_bf16_pertokenFp8_g1u1_128x64_pf2E,0.0%,15.67,4899.8
stage1,304,32,6144,320,160,8,ActivationType.Silu,torch.bfloat16,torch.float8_e4m3fnuz,torch.float8_e4m3fnuz,QuantType.per_Token,1,0,128,0,187.4283,_ZN5aiter44fmoe_stage1_bf16_pertokenFp8_g1u1_128x64_pf3E,0.0%,16.11,5038.24
stage1,304,32,6144,320,160,8,ActivationType.Silu,torch.bfloat16,torch.float8_e4m3fnuz,torch.float8_e4m3fnuz,QuantType.per_Token,1,0,32,0,137.0007,moe_ck2stages_gemm1_256x32x64x256_1x4_MulABScale_v1_Nswizzle0_Quant2_MulRoutedWeight0_silu_F8_F8_B16,0.0%,22.04,6892.73
stage1,304,32,6144,320,160,8,ActivationType.Silu,torch.bfloat16,torch.float8_e4m3fnuz,torch.float8_e4m3fnuz,QuantType.per_Token,1,0,32,0,133.9429,moe_ck2stages_gemm1_256x32x64x128_1x4_MulABScale_v1_Nswizzle0_Quant2_MulRoutedWeight0_silu_F8_F8_B16,0.0%,22.55,7050.08
stage2,304,32,6144,320,160,8,ActivationType.Silu,torch.bfloat16,torch.float8_e4m3fnuz,torch.float8_e4m3fnuz,QuantType.per_Token,1,0,32,0,inf,moe_ck2stages_gemm2_256x32x64x256_1x4_MulABScaleExpertWeight_v1_Nswizzle0_Quant2_MulRoutedWeight1_F8_F8_B16,100.0%,0.0,0.0
stage2,304,32,6144,320,160,8,ActivationType.Silu,torch.bfloat16,torch.float8_e4m3fnuz,torch.float8_e4m3fnuz,QuantType.per_Token,1,0,32,0,inf,moe_ck2stages_gemm2_256x32x64x128_1x4_MulABScaleExpertWeight_v1_Nswizzle0_Quant2_MulRoutedWeight1_F8_F8_B16,100.0%,0.0,0.0
stage1,304,32,6144,320,160,8,ActivationType.Silu,torch.bfloat16,torch.float8_e4m3fnuz,torch.float8_e4m3fnuz,QuantType.per_Token,1,0,64,0,154.3048,moe_ck2stages_gemm1_256x64x64x256_1x4_MulABScale_v1_Nswizzle0_Quant2_MulRoutedWeight0_silu_F8_F8_B16,0.0%,19.57,6119.76
stage1,304,32,6144,320,160,8,ActivationType.Silu,torch.bfloat16,torch.float8_e4m3fnuz,torch.float8_e4m3fnuz,QuantType.per_Token,1,0,64,0,150.4727,moe_ck2stages_gemm1_256x64x64x128_1x4_MulABScale_v1_Nswizzle0_Quant2_MulRoutedWeight0_silu_F8_F8_B16,0.0%,20.07,6275.61
stage1,304,32,6144,320,160,8,ActivationType.Silu,torch.bfloat16,torch.float8_e4m3fnuz,torch.float8_e4m3fnuz,QuantType.per_Token,1,0,64,0,inf,moe_ck2stages_gemm1_256x64x128x256_1x4_MulABScale_v3_Nswizzle0_Quant2_MulRoutedWeight0_silu_F8_F8_B16,100.0%,0.0,0.0
stage1,304,32,6144,320,160,8,ActivationType.Silu,torch.bfloat16,torch.float8_e4m3fnuz,torch.float8_e4m3fnuz,QuantType.per_Token,1,0,64,0,inf,moe_ck2stages_gemm1_256x64x128x128_1x4_MulABScale_v3_Nswizzle0_Quant2_MulRoutedWeight0_silu_F8_F8_B16,100.0%,0.0,0.0
stage2,304,32,6144,320,160,8,ActivationType.Silu,torch.bfloat16,torch.float8_e4m3fnuz,torch.float8_e4m3fnuz,QuantType.per_Token,1,0,64,0,inf,moe_ck2stages_gemm2_256x64x64x256_1x4_MulABScaleExpertWeight_v1_Nswizzle0_Quant2_MulRoutedWeight1_F8_F8_B16,100.0%,0.0,0.0
stage2,304,32,6144,320,160,8,ActivationType.Silu,torch.bfloat16,torch.float8_e4m3fnuz,torch.float8_e4m3fnuz,QuantType.per_Token,1,0,64,0,inf,moe_ck2stages_gemm2_256x64x128x256_1x4_MulABScaleExpertWeight_v3_Nswizzle0_Quant2_MulRoutedWeight1_F8_F8_B16,100.0%,0.0,0.0
stage2,304,32,6144,320,160,8,ActivationType.Silu,torch.bfloat16,torch.float8_e4m3fnuz,torch.float8_e4m3fnuz,QuantType.per_Token,1,0,64,0,inf,moe_ck2stages_gemm2_256x64x128x128_1x4_MulABScaleExpertWeight_v3_Nswizzle0_Quant2_MulRoutedWeight1_F8_F8_B16,100.0%,0.0,0.0
stage1,304,32,6144,320,160,8,ActivationType.Silu,torch.bfloat16,torch.float8_e4m3fnuz,torch.float8_e4m3fnuz,QuantType.per_Token,1,0,128,0,181.2956,moe_ck2stages_gemm1_256x128x64x128_1x4_MulABScale_v1_Nswizzle0_Quant2_MulRoutedWeight0_silu_F8_F8_B16,0.0%,16.66,5208.67
stage1,304,32,6144,320,160,8,ActivationType.Silu,torch.bfloat16,torch.float8_e4m3fnuz,torch.float8_e4m3fnuz,QuantType.per_Token,1,0,128,0,inf,moe_ck2stages_gemm1_256x128x128x256_1x4_MulABScale_v3_Nswizzle0_Quant2_MulRoutedWeight0_silu_F8_F8_B16,100.0%,0.0,0.0
stage1,304,32,6144,320,160,8,ActivationType.Silu,torch.bfloat16,torch.float8_e4m3fnuz,torch.float8_e4m3fnuz,QuantType.per_Token,1,0,128,0,inf,moe_ck2stages_gemm1_256x128x128x128_1x4_MulABScale_v3_Nswizzle0_Quant2_MulRoutedWeight0_silu_F8_F8_B16,100.0%,0.0,0.0
stage2,304,32,6144,320,160,8,ActivationType.Silu,torch.bfloat16,torch.float8_e4m3fnuz,torch.float8_e4m3fnuz,QuantType.per_Token,1,0,128,0,inf,moe_ck2stages_gemm2_256x128x64x128_1x4_MulABScaleExpertWeight_v1_Nswizzle0_Quant2_MulRoutedWeight1_F8_F8_B16,100.0%,0.0,0.0
stage2,304,32,6144,320,160,8,ActivationType.Silu,torch.bfloat16,torch.float8_e4m3fnuz,torch.float8_e4m3fnuz,QuantType.per_Token,1,0,128,0,inf,moe_ck2stages_gemm2_256x128x128x128_1x4_MulABScaleExpertWeight_v3_Nswizzle0_Quant2_MulRoutedWeight1_F8_F8_B16,100.0%,0.0,0.0
asm_1stage,304,32,6144,320,160,8,ActivationType.Silu,torch.bfloat16,torch.float8_e4m3fnuz,torch.float8_e4m3fnuz,QuantType.per_Token,1,0,32,0,200.7908,_ZN5aiter45fmoe_bf16_pertokenFp8_g1u1_vs_silu_1tg_32x320E,0.0%,15.04,4702.95
asm_1stage,304,32,6144,320,160,8,ActivationType.Silu,torch.bfloat16,torch.float8_e4m3fnuz,torch.float8_e4m3fnuz,QuantType.per_Token,1,0,32,0,212.4088,_ZN5aiter48fmoe_bf16_pertokenFp8_g1u1_vs_silu_1tg_ps_32x320E,0.0%,14.22,4445.71
stage1,304,16,6144,320,160,8,ActivationType.Silu,torch.bfloat16,torch.float8_e4m3fnuz,torch.float8_e4m3fnuz,QuantType.per_Token,1,0,32,0,inf,_ZN5aiter48fmoe_stage1_bf16_pertokenFp8_g1u1_32x128_3tg_pf2E,100.0%,0.0,0.0
stage1,304,16,6144,320,160,8,ActivationType.Silu,torch.bfloat16,torch.float8_e4m3fnuz,torch.float8_e4m3fnuz,QuantType.per_Token,1,0,32,0,inf,_ZN5aiter48fmoe_stage1_bf16_pertokenFp8_g1u1_32x128_3tg_pf3E,100.0%,0.0,0.0
stage1,304,16,6144,320,160,8,ActivationType.Silu,torch.bfloat16,torch.float8_e4m3fnuz,torch.float8_e4m3fnuz,QuantType.per_Token,1,0,32,0,inf,_ZN5aiter48fmoe_stage1_bf16_pertokenFp8_g1u1_32x256_2tg_pf2E,100.0%,0.0,0.0
stage1,304,16,6144,320,160,8,ActivationType.Silu,torch.bfloat16,torch.float8_e4m3fnuz,torch.float8_e4m3fnuz,QuantType.per_Token,1,0,32,0,inf,_ZN5aiter48fmoe_stage1_bf16_pertokenFp8_g1u1_32x256_2tg_pf3E,100.0%,0.0,0.0
stage1,304,16,6144,320,160,8,ActivationType.Silu,torch.bfloat16,torch.float8_e4m3fnuz,torch.float8_e4m3fnuz,QuantType.per_Token,1,0,32,0,inf,_ZN5aiter44fmoe_stage1_bf16_pertokenFp8_g1u1_32x512_pf2E,100.0%,0.0,0.0
stage1,304,16,6144,320,160,8,ActivationType.Silu,torch.bfloat16,torch.float8_e4m3fnuz,torch.float8_e4m3fnuz,QuantType.per_Token,1,0,32,0,inf,_ZN5aiter44fmoe_stage1_bf16_pertokenFp8_g1u1_32x512_pf3E,100.0%,0.0,0.0
stage1,304,16,6144,320,160,8,ActivationType.Silu,torch.bfloat16,torch.float8_e4m3fnuz,torch.float8_e4m3fnuz,QuantType.per_Token,1,0,32,0,98.9561,_ZN5aiter47fmoe_stage1_bf16_pertokenFp8_g1u1_32x64_4tg_pf2E,0.0%,15.26,9539.72
stage1,304,16,6144,320,160,8,ActivationType.Silu,torch.bfloat16,torch.float8_e4m3fnuz,torch.float8_e4m3fnuz,QuantType.per_Token,1,0,32,0,101.6372,_ZN5aiter47fmoe_stage1_bf16_pertokenFp8_g1u1_32x64_4tg_pf3E,0.0%,14.86,9288.07
stage1,304,16,6144,320,160,8,ActivationType.Silu,torch.bfloat16,torch.float8_e4m3fnuz,torch.float8_e4m3fnuz,QuantType.per_Token,1,0,64,0,inf,_ZN5aiter48fmoe_stage1_bf16_pertokenFp8_g1u1_64x128_2tg_pf2E,100.0%,0.0,0.0
stage1,304,16,6144,320,160,8,ActivationType.Silu,torch.bfloat16,torch.float8_e4m3fnuz,torch.float8_e4m3fnuz,QuantType.per_Token,1,0,64,0,inf,_ZN5aiter48fmoe_stage1_bf16_pertokenFp8_g1u1_64x128_2tg_pf3E,100.0%,0.0,0.0
stage1,304,16,6144,320,160,8,ActivationType.Silu,torch.bfloat16,torch.float8_e4m3fnuz,torch.float8_e4m3fnuz,QuantType.per_Token,1,0,64,0,inf,_ZN5aiter44fmoe_stage1_bf16_pertokenFp8_g1u1_64x256_pf2E,100.0%,0.0,0.0
stage1,304,16,6144,320,160,8,ActivationType.Silu,torch.bfloat16,torch.float8_e4m3fnuz,torch.float8_e4m3fnuz,QuantType.per_Token,1,0,64,0,inf,_ZN5aiter44fmoe_stage1_bf16_pertokenFp8_g1u1_64x256_pf3E,100.0%,0.0,0.0
stage1,304,16,6144,320,160,8,ActivationType.Silu,torch.bfloat16,torch.float8_e4m3fnuz,torch.float8_e4m3fnuz,QuantType.per_Token,1,0,64,0,94.1352,_ZN5aiter47fmoe_stage1_bf16_pertokenFp8_g1u1_64x64_3tg_pf2E,0.0%,16.04,10028.27
stage1,304,16,6144,320,160,8,ActivationType.Silu,torch.bfloat16,torch.float8_e4m3fnuz,torch.float8_e4m3fnuz,QuantType.per_Token,1,0,64,0,97.484,_ZN5aiter47fmoe_stage1_bf16_pertokenFp8_g1u1_64x64_2tg_pf3E,0.0%,15.49,9683.78
stage1,304,16,6144,320,160,8,ActivationType.Silu,torch.bfloat16,torch.float8_e4m3fnuz,torch.float8_e4m3fnuz,QuantType.per_Token,1,0,128,0,inf,_ZN5aiter45fmoe_stage1_bf16_pertokenFp8_g1u1_128x128_pf2E,100.0%,0.0,0.0
stage1,304,16,6144,320,160,8,ActivationType.Silu,torch.bfloat16,torch.float8_e4m3fnuz,torch.float8_e4m3fnuz,QuantType.per_Token,1,0,128,0,inf,_ZN5aiter45fmoe_stage1_bf16_pertokenFp8_g1u1_128x128_pf3E,100.0%,0.0,0.0
stage1,304,16,6144,320,160,8,ActivationType.Silu,torch.bfloat16,torch.float8_e4m3fnuz,torch.float8_e4m3fnuz,QuantType.per_Token,1,0,128,0,132.2645,_ZN5aiter44fmoe_stage1_bf16_pertokenFp8_g1u1_128x64_pf2E,0.0%,11.42,7137.31
stage1,304,16,6144,320,160,8,ActivationType.Silu,torch.bfloat16,torch.float8_e4m3fnuz,torch.float8_e4m3fnuz,QuantType.per_Token,1,0,128,0,125.0358,_ZN5aiter44fmoe_stage1_bf16_pertokenFp8_g1u1_128x64_pf3E,0.0%,12.08,7549.94
stage1,304,16,6144,320,160,8,ActivationType.Silu,torch.bfloat16,torch.float8_e4m3fnuz,torch.float8_e4m3fnuz,QuantType.per_Token,1,0,32,0,90.3916,moe_ck2stages_gemm1_256x32x64x256_1x4_MulABScale_v1_Nswizzle0_Quant2_MulRoutedWeight0_silu_F8_F8_B16,0.0%,16.7,10443.6
stage1,304,16,6144,320,160,8,ActivationType.Silu,torch.bfloat16,torch.float8_e4m3fnuz,torch.float8_e4m3fnuz,QuantType.per_Token,1,0,32,0,98.5062,moe_ck2stages_gemm1_256x32x64x128_1x4_MulABScale_v1_Nswizzle0_Quant2_MulRoutedWeight0_silu_F8_F8_B16,0.0%,15.33,9583.29
stage2,304,16,6144,320,160,8,ActivationType.Silu,torch.bfloat16,torch.float8_e4m3fnuz,torch.float8_e4m3fnuz,QuantType.per_Token,1,0,32,0,inf,moe_ck2stages_gemm2_256x32x64x256_1x4_MulABScaleExpertWeight_v1_Nswizzle0_Quant2_MulRoutedWeight1_F8_F8_B16,100.0%,0.0,0.0
stage2,304,16,6144,320,160,8,ActivationType.Silu,torch.bfloat16,torch.float8_e4m3fnuz,torch.float8_e4m3fnuz,QuantType.per_Token,1,0,32,0,inf,moe_ck2stages_gemm2_256x32x64x128_1x4_MulABScaleExpertWeight_v1_Nswizzle0_Quant2_MulRoutedWeight1_F8_F8_B16,100.0%,0.0,0.0
stage1,304,16,6144,320,160,8,ActivationType.Silu,torch.bfloat16,torch.float8_e4m3fnuz,torch.float8_e4m3fnuz,QuantType.per_Token,1,0,64,0,102.4761,moe_ck2stages_gemm1_256x64x64x256_1x4_MulABScale_v1_Nswizzle0_Quant2_MulRoutedWeight0_silu_F8_F8_B16,0.0%,14.73,9212.03
stage1,304,16,6144,320,160,8,ActivationType.Silu,torch.bfloat16,torch.float8_e4m3fnuz,torch.float8_e4m3fnuz,QuantType.per_Token,1,0,64,0,103.3704,moe_ck2stages_gemm1_256x64x64x128_1x4_MulABScale_v1_Nswizzle0_Quant2_MulRoutedWeight0_silu_F8_F8_B16,0.0%,14.61,9132.34
stage1,304,16,6144,320,160,8,ActivationType.Silu,torch.bfloat16,torch.float8_e4m3fnuz,torch.float8_e4m3fnuz,QuantType.per_Token,1,0,64,0,inf,moe_ck2stages_gemm1_256x64x128x256_1x4_MulABScale_v3_Nswizzle0_Quant2_MulRoutedWeight0_silu_F8_F8_B16,100.0%,0.0,0.0
stage1,304,16,6144,320,160,8,ActivationType.Silu,torch.bfloat16,torch.float8_e4m3fnuz,torch.float8_e4m3fnuz,QuantType.per_Token,1,0,64,0,inf,moe_ck2stages_gemm1_256x64x128x128_1x4_MulABScale_v3_Nswizzle0_Quant2_MulRoutedWeight0_silu_F8_F8_B16,100.0%,0.0,0.0
stage2,304,16,6144,320,160,8,ActivationType.Silu,torch.bfloat16,torch.float8_e4m3fnuz,torch.float8_e4m3fnuz,QuantType.per_Token,1,0,64,0,inf,moe_ck2stages_gemm2_256x64x64x256_1x4_MulABScaleExpertWeight_v1_Nswizzle0_Quant2_MulRoutedWeight1_F8_F8_B16,100.0%,0.0,0.0
stage2,304,16,6144,320,160,8,ActivationType.Silu,torch.bfloat16,torch.float8_e4m3fnuz,torch.float8_e4m3fnuz,QuantType.per_Token,1,0,64,0,inf,moe_ck2stages_gemm2_256x64x128x256_1x4_MulABScaleExpertWeight_v3_Nswizzle0_Quant2_MulRoutedWeight1_F8_F8_B16,100.0%,0.0,0.0
stage2,304,16,6144,320,160,8,ActivationType.Silu,torch.bfloat16,torch.float8_e4m3fnuz,torch.float8_e4m3fnuz,QuantType.per_Token,1,0,64,0,inf,moe_ck2stages_gemm2_256x64x128x128_1x4_MulABScaleExpertWeight_v3_Nswizzle0_Quant2_MulRoutedWeight1_F8_F8_B16,100.0%,0.0,0.0
stage1,304,16,6144,320,160,8,ActivationType.Silu,torch.bfloat16,torch.float8_e4m3fnuz,torch.float8_e4m3fnuz,QuantType.per_Token,1,0,128,0,121.5025,moe_ck2stages_gemm1_256x128x64x128_1x4_MulABScale_v1_Nswizzle0_Quant2_MulRoutedWeight0_silu_F8_F8_B16,0.0%,12.43,7769.5
stage1,304,16,6144,320,160,8,ActivationType.Silu,torch.bfloat16,torch.float8_e4m3fnuz,torch.float8_e4m3fnuz,QuantType.per_Token,1,0,128,0,inf,moe_ck2stages_gemm1_256x128x128x256_1x4_MulABScale_v3_Nswizzle0_Quant2_MulRoutedWeight0_silu_F8_F8_B16,100.0%,0.0,0.0
stage1,304,16,6144,320,160,8,ActivationType.Silu,torch.bfloat16,torch.float8_e4m3fnuz,torch.float8_e4m3fnuz,QuantType.per_Token,1,0,128,0,inf,moe_ck2stages_gemm1_256x128x128x128_1x4_MulABScale_v3_Nswizzle0_Quant2_MulRoutedWeight0_silu_F8_F8_B16,100.0%,0.0,0.0
stage2,304,16,6144,320,160,8,ActivationType.Silu,torch.bfloat16,torch.float8_e4m3fnuz,torch.float8_e4m3fnuz,QuantType.per_Token,1,0,128,0,inf,moe_ck2stages_gemm2_256x128x64x128_1x4_MulABScaleExpertWeight_v1_Nswizzle0_Quant2_MulRoutedWeight1_F8_F8_B16,100.0%,0.0,0.0
stage2,304,16,6144,320,160,8,ActivationType.Silu,torch.bfloat16,torch.float8_e4m3fnuz,torch.float8_e4m3fnuz,QuantType.per_Token,1,0,128,0,inf,moe_ck2stages_gemm2_256x128x128x128_1x4_MulABScaleExpertWeight_v3_Nswizzle0_Quant2_MulRoutedWeight1_F8_F8_B16,100.0%,0.0,0.0
asm_1stage,304,16,6144,320,160,8,ActivationType.Silu,torch.bfloat16,torch.float8_e4m3fnuz,torch.float8_e4m3fnuz,QuantType.per_Token,1,0,32,0,156.9334,_ZN5aiter45fmoe_bf16_pertokenFp8_g1u1_vs_silu_1tg_32x320E,0.0%,9.62,6015.38
asm_1stage,304,16,6144,320,160,8,ActivationType.Silu,torch.bfloat16,torch.float8_e4m3fnuz,torch.float8_e4m3fnuz,QuantType.per_Token,1,0,32,0,166.4264,_ZN5aiter48fmoe_bf16_pertokenFp8_g1u1_vs_silu_1tg_ps_32x320E,0.0%,9.07,5672.26
stage1,304,1024,7168,256,256,8,ActivationType.Silu,torch.bfloat16,torch.float8_e4m3fnuz,torch.float8_e4m3fnuz,QuantType.per_Token,1,0,32,0,336.9768,_ZN5aiter48fmoe_stage1_bf16_pertokenFp8_g1u1_32x128_3tg_pf2E,0.0%,267.66,4247.49
stage1,304,1024,7168,256,256,8,ActivationType.Silu,torch.bfloat16,torch.float8_e4m3fnuz,torch.float8_e4m3fnuz,QuantType.per_Token,1,0,32,0,341.425,_ZN5aiter48fmoe_stage1_bf16_pertokenFp8_g1u1_32x128_3tg_pf3E,0.1%,264.17,4192.15
stage1,304,1024,7168,256,256,8,ActivationType.Silu,torch.bfloat16,torch.float8_e4m3fnuz,torch.float8_e4m3fnuz,QuantType.per_Token,1,0,32,0,332.5418,_ZN5aiter48fmoe_stage1_bf16_pertokenFp8_g1u1_32x256_2tg_pf2E,0.0%,271.23,4304.14
stage1,304,1024,7168,256,256,8,ActivationType.Silu,torch.bfloat16,torch.float8_e4m3fnuz,torch.float8_e4m3fnuz,QuantType.per_Token,1,0,32,0,331.2304,_ZN5aiter48fmoe_stage1_bf16_pertokenFp8_g1u1_32x256_2tg_pf3E,0.0%,272.3,4321.18
stage1,304,1024,7168,256,256,8,ActivationType.Silu,torch.bfloat16,torch.float8_e4m3fnuz,torch.float8_e4m3fnuz,QuantType.per_Token,1,0,32,0,inf,_ZN5aiter44fmoe_stage1_bf16_pertokenFp8_g1u1_32x512_pf2E,100.0%,0.0,0.0
stage1,304,1024,7168,256,256,8,ActivationType.Silu,torch.bfloat16,torch.float8_e4m3fnuz,torch.float8_e4m3fnuz,QuantType.per_Token,1,0,32,0,inf,_ZN5aiter44fmoe_stage1_bf16_pertokenFp8_g1u1_32x512_pf3E,100.0%,0.0,0.0
stage1,304,1024,7168,256,256,8,ActivationType.Silu,torch.bfloat16,torch.float8_e4m3fnuz,torch.float8_e4m3fnuz,QuantType.per_Token,1,0,32,0,358.1231,_ZN5aiter47fmoe_stage1_bf16_pertokenFp8_g1u1_32x64_4tg_pf2E,0.0%,251.85,3996.69
stage1,304,1024,7168,256,256,8,ActivationType.Silu,torch.bfloat16,torch.float8_e4m3fnuz,torch.float8_e4m3fnuz,QuantType.per_Token,1,0,32,0,364.0949,_ZN5aiter47fmoe_stage1_bf16_pertokenFp8_g1u1_32x64_4tg_pf3E,3.2%,247.72,3931.14
stage1,304,1024,7168,256,256,8,ActivationType.Silu,torch.bfloat16,torch.float8_e4m3fnuz,torch.float8_e4m3fnuz,QuantType.per_Token,1,0,64,0,268.5581,_ZN5aiter48fmoe_stage1_bf16_pertokenFp8_g1u1_64x128_2tg_pf2E,0.0%,335.85,5329.6
stage1,304,1024,7168,256,256,8,ActivationType.Silu,torch.bfloat16,torch.float8_e4m3fnuz,torch.float8_e4m3fnuz,QuantType.per_Token,1,0,64,0,267.5017,_ZN5aiter48fmoe_stage1_bf16_pertokenFp8_g1u1_64x128_2tg_pf3E,0.0%,337.17,5350.64
stage1,304,1024,7168,256,256,8,ActivationType.Silu,torch.bfloat16,torch.float8_e4m3fnuz,torch.float8_e4m3fnuz,QuantType.per_Token,1,0,64,0,265.4554,_ZN5aiter44fmoe_stage1_bf16_pertokenFp8_g1u1_64x256_pf2E,0.0%,339.77,5391.89
stage1,304,1024,7168,256,256,8,ActivationType.Silu,torch.bfloat16,torch.float8_e4m3fnuz,torch.float8_e4m3fnuz,QuantType.per_Token,1,0,64,0,268.2744,_ZN5aiter44fmoe_stage1_bf16_pertokenFp8_g1u1_64x256_pf3E,0.0%,336.2,5335.23
stage1,304,1024,7168,256,256,8,ActivationType.Silu,torch.bfloat16,torch.float8_e4m3fnuz,torch.float8_e4m3fnuz,QuantType.per_Token,1,0,64,0,308.3641,_ZN5aiter47fmoe_stage1_bf16_pertokenFp8_g1u1_64x64_3tg_pf2E,0.0%,292.49,4641.61
stage1,304,1024,7168,256,256,8,ActivationType.Silu,torch.bfloat16,torch.float8_e4m3fnuz,torch.float8_e4m3fnuz,QuantType.per_Token,1,0,64,0,272.6953,_ZN5aiter47fmoe_stage1_bf16_pertokenFp8_g1u1_64x64_2tg_pf3E,0.0%,330.75,5248.74
stage1,304,1024,7168,256,256,8,ActivationType.Silu,torch.bfloat16,torch.float8_e4m3fnuz,torch.float8_e4m3fnuz,QuantType.per_Token,1,0,128,0,303.381,_ZN5aiter45fmoe_stage1_bf16_pertokenFp8_g1u1_128x128_pf2E,0.0%,297.3,4717.85
stage1,304,1024,7168,256,256,8,ActivationType.Silu,torch.bfloat16,torch.float8_e4m3fnuz,torch.float8_e4m3fnuz,QuantType.per_Token,1,0,128,0,303.2868,_ZN5aiter45fmoe_stage1_bf16_pertokenFp8_g1u1_128x128_pf3E,0.0%,297.39,4719.32
stage1,304,1024,7168,256,256,8,ActivationType.Silu,torch.bfloat16,torch.float8_e4m3fnuz,torch.float8_e4m3fnuz,QuantType.per_Token,1,0,128,0,346.1217,_ZN5aiter44fmoe_stage1_bf16_pertokenFp8_g1u1_128x64_pf2E,0.0%,260.59,4135.27
stage1,304,1024,7168,256,256,8,ActivationType.Silu,torch.bfloat16,torch.float8_e4m3fnuz,torch.float8_e4m3fnuz,QuantType.per_Token,1,0,128,0,330.7889,_ZN5aiter44fmoe_stage1_bf16_pertokenFp8_g1u1_128x64_pf3E,0.0%,272.66,4326.95
stage1,304,1024,7168,256,256,8,ActivationType.Silu,torch.bfloat16,torch.float8_e4m3fnuz,torch.float8_e4m3fnuz,QuantType.per_Token,1,0,32,0,343.0859,moe_ck2stages_gemm1_256x32x64x256_1x4_MulABScale_v1_Nswizzle0_Quant2_MulRoutedWeight0_silu_F8_F8_B16,0.0%,262.89,4171.86
stage1,304,1024,7168,256,256,8,ActivationType.Silu,torch.bfloat16,torch.float8_e4m3fnuz,torch.float8_e4m3fnuz,QuantType.per_Token,1,0,32,0,345.6502,moe_ck2stages_gemm1_256x32x64x128_1x4_MulABScale_v1_Nswizzle0_Quant2_MulRoutedWeight0_silu_F8_F8_B16,0.0%,260.94,4140.91
stage2,304,1024,7168,256,256,8,ActivationType.Silu,torch.bfloat16,torch.float8_e4m3fnuz,torch.float8_e4m3fnuz,QuantType.per_Token,1,0,32,0,222.845,moe_ck2stages_gemm2_256x32x64x256_1x4_MulABScaleExpertWeight_v1_Nswizzle0_Quant2_MulRoutedWeight1_F8_F8_B16,1.3%,404.74,6422.88
stage2,304,1024,7168,256,256,8,ActivationType.Silu,torch.bfloat16,torch.float8_e4m3fnuz,torch.float8_e4m3fnuz,QuantType.per_Token,1,0,32,0,219.4072,moe_ck2stages_gemm2_256x32x64x128_1x4_MulABScaleExpertWeight_v1_Nswizzle0_Quant2_MulRoutedWeight1_F8_F8_B16,1.3%,411.08,6523.52
stage1,304,1024,7168,256,256,8,ActivationType.Silu,torch.bfloat16,torch.float8_e4m3fnuz,torch.float8_e4m3fnuz,QuantType.per_Token,1,0,64,0,281.2496,moe_ck2stages_gemm1_256x64x64x256_1x4_MulABScale_v1_Nswizzle0_Quant2_MulRoutedWeight0_silu_F8_F8_B16,0.0%,320.69,5089.1
stage1,304,1024,7168,256,256,8,ActivationType.Silu,torch.bfloat16,torch.float8_e4m3fnuz,torch.float8_e4m3fnuz,QuantType.per_Token,1,0,64,0,288.3844,moe_ck2stages_gemm1_256x64x64x128_1x4_MulABScale_v1_Nswizzle0_Quant2_MulRoutedWeight0_silu_F8_F8_B16,0.0%,312.76,4963.19
stage1,304,1024,7168,256,256,8,ActivationType.Silu,torch.bfloat16,torch.float8_e4m3fnuz,torch.float8_e4m3fnuz,QuantType.per_Token,1,0,64,0,281.6915,moe_ck2stages_gemm1_256x64x128x256_1x4_MulABScale_v3_Nswizzle0_Quant2_MulRoutedWeight0_silu_F8_F8_B16,0.0%,320.19,5081.11
stage1,304,1024,7168,256,256,8,ActivationType.Silu,torch.bfloat16,torch.float8_e4m3fnuz,torch.float8_e4m3fnuz,QuantType.per_Token,1,0,64,0,277.5695,moe_ck2stages_gemm1_256x64x128x128_1x4_MulABScale_v3_Nswizzle0_Quant2_MulRoutedWeight0_silu_F8_F8_B16,0.0%,324.94,5156.57
stage2,304,1024,7168,256,256,8,ActivationType.Silu,torch.bfloat16,torch.float8_e4m3fnuz,torch.float8_e4m3fnuz,QuantType.per_Token,1,0,64,0,257.318,moe_ck2stages_gemm2_256x64x64x256_1x4_MulABScaleExpertWeight_v1_Nswizzle0_Quant2_MulRoutedWeight1_F8_F8_B16,1.3%,350.52,5562.4
stage2,304,1024,7168,256,256,8,ActivationType.Silu,torch.bfloat16,torch.float8_e4m3fnuz,torch.float8_e4m3fnuz,QuantType.per_Token,1,0,64,0,250.067,moe_ck2stages_gemm2_256x64x128x256_1x4_MulABScaleExpertWeight_v3_Nswizzle0_Quant2_MulRoutedWeight1_F8_F8_B16,1.3%,360.68,5723.69
stage2,304,1024,7168,256,256,8,ActivationType.Silu,torch.bfloat16,torch.float8_e4m3fnuz,torch.float8_e4m3fnuz,QuantType.per_Token,1,0,64,0,299.6676,moe_ck2stages_gemm2_256x64x128x128_1x4_MulABScaleExpertWeight_v3_Nswizzle0_Quant2_MulRoutedWeight1_F8_F8_B16,1.3%,300.98,4776.31
stage1,304,1024,7168,256,256,8,ActivationType.Silu,torch.bfloat16,torch.float8_e4m3fnuz,torch.float8_e4m3fnuz,QuantType.per_Token,1,0,128,0,326.7016,moe_ck2stages_gemm1_256x128x64x128_1x4_MulABScale_v1_Nswizzle0_Quant2_MulRoutedWeight0_silu_F8_F8_B16,0.0%,276.08,4381.08
stage1,304,1024,7168,256,256,8,ActivationType.Silu,torch.bfloat16,torch.float8_e4m3fnuz,torch.float8_e4m3fnuz,QuantType.per_Token,1,0,128,0,326.0894,moe_ck2stages_gemm1_256x128x128x256_1x4_MulABScale_v3_Nswizzle0_Quant2_MulRoutedWeight0_silu_F8_F8_B16,0.0%,276.59,4389.31
stage1,304,1024,7168,256,256,8,ActivationType.Silu,torch.bfloat16,torch.float8_e4m3fnuz,torch.float8_e4m3fnuz,QuantType.per_Token,1,0,128,0,313.7153,moe_ck2stages_gemm1_256x128x128x128_1x4_MulABScale_v3_Nswizzle0_Quant2_MulRoutedWeight0_silu_F8_F8_B16,0.0%,287.5,4562.44
stage2,304,1024,7168,256,256,8,ActivationType.Silu,torch.bfloat16,torch.float8_e4m3fnuz,torch.float8_e4m3fnuz,QuantType.per_Token,1,0,128,0,333.3154,moe_ck2stages_gemm2_256x128x64x128_1x4_MulABScaleExpertWeight_v1_Nswizzle0_Quant2_MulRoutedWeight1_F8_F8_B16,1.3%,270.6,4294.15
stage2,304,1024,7168,256,256,8,ActivationType.Silu,torch.bfloat16,torch.float8_e4m3fnuz,torch.float8_e4m3fnuz,QuantType.per_Token,1,0,128,0,375.166,moe_ck2stages_gemm2_256x128x128x128_1x4_MulABScaleExpertWeight_v3_Nswizzle0_Quant2_MulRoutedWeight1_F8_F8_B16,1.3%,240.41,3815.13
asm_1stage,304,1024,7168,256,256,8,ActivationType.Silu,torch.bfloat16,torch.float8_e4m3fnuz,torch.float8_e4m3fnuz,QuantType.per_Token,1,0,32,0,576.0544,_ZN5aiter45fmoe_bf16_pertokenFp8_g1u1_vs_silu_1tg_32x128E,69.6%,156.57,2484.67
asm_1stage,304,1024,7168,256,256,8,ActivationType.Silu,torch.bfloat16,torch.float8_e4m3fnuz,torch.float8_e4m3fnuz,QuantType.per_Token,1,0,32,0,576.4129,_ZN5aiter48fmoe_bf16_pertokenFp8_g1u1_vs_silu_1tg_ps_32x128E,0.0%,156.48,2483.13
asm_1stage,304,1024,7168,256,256,8,ActivationType.Silu,torch.bfloat16,torch.float8_e4m3fnuz,torch.float8_e4m3fnuz,QuantType.per_Token,1,0,32,0,536.7514,_ZN5aiter48fmoe_bf16_pertokenFp8_g1u1_vs_silu_1tg_ps_32x256E,0.0%,168.04,2666.61
asm_1stage,304,1024,7168,256,256,8,ActivationType.Silu,torch.bfloat16,torch.float8_e4m3fnuz,torch.float8_e4m3fnuz,QuantType.per_Token,1,0,32,0,550.6697,_ZN5aiter45fmoe_bf16_pertokenFp8_g1u1_vs_silu_1tg_32x256E,0.0%,163.79,2599.21
stage1,304,512,7168,256,256,8,ActivationType.Silu,torch.bfloat16,torch.float8_e4m3fnuz,torch.float8_e4m3fnuz,QuantType.per_Token,1,0,32,0,250.754,_ZN5aiter48fmoe_stage1_bf16_pertokenFp8_g1u1_32x128_3tg_pf2E,0.0%,179.85,5664.1
stage1,304,512,7168,256,256,8,ActivationType.Silu,torch.bfloat16,torch.float8_e4m3fnuz,torch.float8_e4m3fnuz,QuantType.per_Token,1,0,32,0,257.5036,_ZN5aiter48fmoe_stage1_bf16_pertokenFp8_g1u1_32x128_3tg_pf3E,0.4%,175.13,5515.64
stage1,304,512,7168,256,256,8,ActivationType.Silu,torch.bfloat16,torch.float8_e4m3fnuz,torch.float8_e4m3fnuz,QuantType.per_Token,1,0,32,0,244.2545,_ZN5aiter48fmoe_stage1_bf16_pertokenFp8_g1u1_32x256_2tg_pf2E,0.0%,184.63,5814.82
stage1,304,512,7168,256,256,8,ActivationType.Silu,torch.bfloat16,torch.float8_e4m3fnuz,torch.float8_e4m3fnuz,QuantType.per_Token,1,0,32,0,254.7187,_ZN5aiter48fmoe_stage1_bf16_pertokenFp8_g1u1_32x256_2tg_pf3E,0.0%,177.05,5575.94
stage1,304,512,7168,256,256,8,ActivationType.Silu,torch.bfloat16,torch.float8_e4m3fnuz,torch.float8_e4m3fnuz,QuantType.per_Token,1,0,32,0,inf,_ZN5aiter44fmoe_stage1_bf16_pertokenFp8_g1u1_32x512_pf2E,100.0%,0.0,0.0
stage1,304,512,7168,256,256,8,ActivationType.Silu,torch.bfloat16,torch.float8_e4m3fnuz,torch.float8_e4m3fnuz,QuantType.per_Token,1,0,32,0,inf,_ZN5aiter44fmoe_stage1_bf16_pertokenFp8_g1u1_32x512_pf3E,100.0%,0.0,0.0
stage1,304,512,7168,256,256,8,ActivationType.Silu,torch.bfloat16,torch.float8_e4m3fnuz,torch.float8_e4m3fnuz,QuantType.per_Token,1,0,32,0,258.9405,_ZN5aiter47fmoe_stage1_bf16_pertokenFp8_g1u1_32x64_4tg_pf2E,0.0%,174.16,5485.03
stage1,304,512,7168,256,256,8,ActivationType.Silu,torch.bfloat16,torch.float8_e4m3fnuz,torch.float8_e4m3fnuz,QuantType.per_Token,1,0,32,0,268.8123,_ZN5aiter47fmoe_stage1_bf16_pertokenFp8_g1u1_32x64_4tg_pf3E,7.5%,167.76,5283.6
stage1,304,512,7168,256,256,8,ActivationType.Silu,torch.bfloat16,torch.float8_e4m3fnuz,torch.float8_e4m3fnuz,QuantType.per_Token,1,0,64,0,261.4119,_ZN5aiter48fmoe_stage1_bf16_pertokenFp8_g1u1_64x128_2tg_pf2E,0.0%,172.51,5433.17
stage1,304,512,7168,256,256,8,ActivationType.Silu,torch.bfloat16,torch.float8_e4m3fnuz,torch.float8_e4m3fnuz,QuantType.per_Token,1,0,64,0,262.1664,_ZN5aiter48fmoe_stage1_bf16_pertokenFp8_g1u1_64x128_2tg_pf3E,0.0%,172.02,5417.54
stage1,304,512,7168,256,256,8,ActivationType.Silu,torch.bfloat16,torch.float8_e4m3fnuz,torch.float8_e4m3fnuz,QuantType.per_Token,1,0,64,0,255.0302,_ZN5aiter44fmoe_stage1_bf16_pertokenFp8_g1u1_64x256_pf2E,0.0%,176.83,5569.13
stage1,304,512,7168,256,256,8,ActivationType.Silu,torch.bfloat16,torch.float8_e4m3fnuz,torch.float8_e4m3fnuz,QuantType.per_Token,1,0,64,0,260.1,_ZN5aiter44fmoe_stage1_bf16_pertokenFp8_g1u1_64x256_pf3E,0.0%,173.38,5460.58
stage1,304,512,7168,256,256,8,ActivationType.Silu,torch.bfloat16,torch.float8_e4m3fnuz,torch.float8_e4m3fnuz,QuantType.per_Token,1,0,64,0,291.3811,_ZN5aiter47fmoe_stage1_bf16_pertokenFp8_g1u1_64x64_3tg_pf2E,0.0%,154.77,4874.36
stage1,304,512,7168,256,256,8,ActivationType.Silu,torch.bfloat16,torch.float8_e4m3fnuz,torch.float8_e4m3fnuz,QuantType.per_Token,1,0,64,0,261.8193,_ZN5aiter47fmoe_stage1_bf16_pertokenFp8_g1u1_64x64_2tg_pf3E,0.0%,172.25,5424.72
stage1,304,512,7168,256,256,8,ActivationType.Silu,torch.bfloat16,torch.float8_e4m3fnuz,torch.float8_e4m3fnuz,QuantType.per_Token,1,0,128,0,296.742,_ZN5aiter45fmoe_stage1_bf16_pertokenFp8_g1u1_128x128_pf2E,0.0%,151.97,4786.3
stage1,304,512,7168,256,256,8,ActivationType.Silu,torch.bfloat16,torch.float8_e4m3fnuz,torch.float8_e4m3fnuz,QuantType.per_Token,1,0,128,0,294.6798,_ZN5aiter45fmoe_stage1_bf16_pertokenFp8_g1u1_128x128_pf3E,0.0%,153.04,4819.79
stage1,304,512,7168,256,256,8,ActivationType.Silu,torch.bfloat16,torch.float8_e4m3fnuz,torch.float8_e4m3fnuz,QuantType.per_Token,1,0,128,0,339.9125,_ZN5aiter44fmoe_stage1_bf16_pertokenFp8_g1u1_128x64_pf2E,0.0%,132.67,4178.42
stage1,304,512,7168,256,256,8,ActivationType.Silu,torch.bfloat16,torch.float8_e4m3fnuz,torch.float8_e4m3fnuz,QuantType.per_Token,1,0,128,0,320.0028,_ZN5aiter44fmoe_stage1_bf16_pertokenFp8_g1u1_128x64_pf3E,0.0%,140.93,4438.39
stage1,304,512,7168,256,256,8,ActivationType.Silu,torch.bfloat16,torch.float8_e4m3fnuz,torch.float8_e4m3fnuz,QuantType.per_Token,1,0,32,0,263.1911,moe_ck2stages_gemm1_256x32x64x256_1x4_MulABScale_v1_Nswizzle0_Quant2_MulRoutedWeight0_silu_F8_F8_B16,0.0%,171.35,5396.44
stage1,304,512,7168,256,256,8,ActivationType.Silu,torch.bfloat16,torch.float8_e4m3fnuz,torch.float8_e4m3fnuz,QuantType.per_Token,1,0,32,0,265.725,moe_ck2stages_gemm1_256x32x64x128_1x4_MulABScale_v1_Nswizzle0_Quant2_MulRoutedWeight0_silu_F8_F8_B16,0.0%,169.71,5344.99
stage2,304,512,7168,256,256,8,ActivationType.Silu,torch.bfloat16,torch.float8_e4m3fnuz,torch.float8_e4m3fnuz,QuantType.per_Token,1,0,32,0,161.3011,moe_ck2stages_gemm2_256x32x64x256_1x4_MulABScaleExpertWeight_v1_Nswizzle0_Quant2_MulRoutedWeight1_F8_F8_B16,1.3%,279.58,8805.25
stage2,304,512,7168,256,256,8,ActivationType.Silu,torch.bfloat16,torch.float8_e4m3fnuz,torch.float8_e4m3fnuz,QuantType.per_Token,1,0,32,0,168.1806,moe_ck2stages_gemm2_256x32x64x128_1x4_MulABScaleExpertWeight_v1_Nswizzle0_Quant2_MulRoutedWeight1_F8_F8_B16,1.3%,268.15,8445.07
stage1,304,512,7168,256,256,8,ActivationType.Silu,torch.bfloat16,torch.float8_e4m3fnuz,torch.float8_e4m3fnuz,QuantType.per_Token,1,0,64,0,276.9595,moe_ck2stages_gemm1_256x64x64x256_1x4_MulABScale_v1_Nswizzle0_Quant2_MulRoutedWeight0_silu_F8_F8_B16,0.0%,162.83,5128.17
stage1,304,512,7168,256,256,8,ActivationType.Silu,torch.bfloat16,torch.float8_e4m3fnuz,torch.float8_e4m3fnuz,QuantType.per_Token,1,0,64,0,276.264,moe_ck2stages_gemm1_256x64x64x128_1x4_MulABScale_v1_Nswizzle0_Quant2_MulRoutedWeight0_silu_F8_F8_B16,0.0%,163.24,5141.08
stage1,304,512,7168,256,256,8,ActivationType.Silu,torch.bfloat16,torch.float8_e4m3fnuz,torch.float8_e4m3fnuz,QuantType.per_Token,1,0,64,0,269.0174,moe_ck2stages_gemm1_256x64x128x256_1x4_MulABScale_v3_Nswizzle0_Quant2_MulRoutedWeight0_silu_F8_F8_B16,0.0%,167.64,5279.57
stage1,304,512,7168,256,256,8,ActivationType.Silu,torch.bfloat16,torch.float8_e4m3fnuz,torch.float8_e4m3fnuz,QuantType.per_Token,1,0,64,0,271.491,moe_ck2stages_gemm1_256x64x128x128_1x4_MulABScale_v3_Nswizzle0_Quant2_MulRoutedWeight0_silu_F8_F8_B16,0.0%,166.11,5231.47
stage2,304,512,7168,256,256,8,ActivationType.Silu,torch.bfloat16,torch.float8_e4m3fnuz,torch.float8_e4m3fnuz,QuantType.per_Token,1,0,64,0,228.5266,moe_ck2stages_gemm2_256x64x64x256_1x4_MulABScaleExpertWeight_v1_Nswizzle0_Quant2_MulRoutedWeight1_F8_F8_B16,1.3%,197.34,6215.01
stage2,304,512,7168,256,256,8,ActivationType.Silu,torch.bfloat16,torch.float8_e4m3fnuz,torch.float8_e4m3fnuz,QuantType.per_Token,1,0,64,0,207.2793,moe_ck2stages_gemm2_256x64x128x256_1x4_MulABScaleExpertWeight_v3_Nswizzle0_Quant2_MulRoutedWeight1_F8_F8_B16,1.3%,217.57,6852.09
stage2,304,512,7168,256,256,8,ActivationType.Silu,torch.bfloat16,torch.float8_e4m3fnuz,torch.float8_e4m3fnuz,QuantType.per_Token,1,0,64,0,243.6589,moe_ck2stages_gemm2_256x64x128x128_1x4_MulABScaleExpertWeight_v3_Nswizzle0_Quant2_MulRoutedWeight1_F8_F8_B16,1.3%,185.08,5829.03
stage1,304,512,7168,256,256,8,ActivationType.Silu,torch.bfloat16,torch.float8_e4m3fnuz,torch.float8_e4m3fnuz,QuantType.per_Token,1,0,128,0,314.7332,moe_ck2stages_gemm1_256x128x64x128_1x4_MulABScale_v1_Nswizzle0_Quant2_MulRoutedWeight0_silu_F8_F8_B16,0.0%,143.29,4512.7
stage1,304,512,7168,256,256,8,ActivationType.Silu,torch.bfloat16,torch.float8_e4m3fnuz,torch.float8_e4m3fnuz,QuantType.per_Token,1,0,128,0,309.2267,moe_ck2stages_gemm1_256x128x128x256_1x4_MulABScale_v3_Nswizzle0_Quant2_MulRoutedWeight0_silu_F8_F8_B16,0.0%,145.84,4593.06
stage1,304,512,7168,256,256,8,ActivationType.Silu,torch.bfloat16,torch.float8_e4m3fnuz,torch.float8_e4m3fnuz,QuantType.per_Token,1,0,128,0,315.6345,moe_ck2stages_gemm1_256x128x128x128_1x4_MulABScale_v3_Nswizzle0_Quant2_MulRoutedWeight0_silu_F8_F8_B16,0.0%,142.88,4499.81
stage2,304,512,7168,256,256,8,ActivationType.Silu,torch.bfloat16,torch.float8_e4m3fnuz,torch.float8_e4m3fnuz,QuantType.per_Token,1,0,128,0,308.2618,moe_ck2stages_gemm2_256x128x64x128_1x4_MulABScaleExpertWeight_v1_Nswizzle0_Quant2_MulRoutedWeight1_F8_F8_B16,1.3%,146.29,4607.43
stage2,304,512,7168,256,256,8,ActivationType.Silu,torch.bfloat16,torch.float8_e4m3fnuz,torch.float8_e4m3fnuz,QuantType.per_Token,1,0,128,0,328.9441,moe_ck2stages_gemm2_256x128x128x128_1x4_MulABScaleExpertWeight_v3_Nswizzle0_Quant2_MulRoutedWeight1_F8_F8_B16,1.3%,137.1,4317.74
asm_1stage,304,512,7168,256,256,8,ActivationType.Silu,torch.bfloat16,torch.float8_e4m3fnuz,torch.float8_e4m3fnuz,QuantType.per_Token,1,0,32,0,443.0644,_ZN5aiter45fmoe_bf16_pertokenFp8_g1u1_vs_silu_1tg_32x128E,70.2%,101.78,3205.62
asm_1stage,304,512,7168,256,256,8,ActivationType.Silu,torch.bfloat16,torch.float8_e4m3fnuz,torch.float8_e4m3fnuz,QuantType.per_Token,1,0,32,0,444.7653,_ZN5aiter48fmoe_bf16_pertokenFp8_g1u1_vs_silu_1tg_ps_32x128E,0.0%,101.4,3193.36
asm_1stage,304,512,7168,256,256,8,ActivationType.Silu,torch.bfloat16,torch.float8_e4m3fnuz,torch.float8_e4m3fnuz,QuantType.per_Token,1,0,32,0,418.1336,_ZN5aiter48fmoe_bf16_pertokenFp8_g1u1_vs_silu_1tg_ps_32x256E,0.0%,107.85,3396.75
asm_1stage,304,512,7168,256,256,8,ActivationType.Silu,torch.bfloat16,torch.float8_e4m3fnuz,torch.float8_e4m3fnuz,QuantType.per_Token,1,0,32,0,418.4537,_ZN5aiter45fmoe_bf16_pertokenFp8_g1u1_vs_silu_1tg_32x256E,0.0%,107.77,3394.15
stage1,304,64,7168,256,256,8,ActivationType.Silu,torch.bfloat16,torch.float8_e4m3fnuz,torch.float8_e4m3fnuz,QuantType.per_Token,1,0,32,0,216.0167,_ZN5aiter48fmoe_stage1_bf16_pertokenFp8_g1u1_32x128_3tg_pf2E,0.0%,26.1,6530.34
stage1,304,64,7168,256,256,8,ActivationType.Silu,torch.bfloat16,torch.float8_e4m3fnuz,torch.float8_e4m3fnuz,QuantType.per_Token,1,0,32,0,225.2239,_ZN5aiter48fmoe_stage1_bf16_pertokenFp8_g1u1_32x128_3tg_pf3E,0.0%,25.03,6263.38
stage1,304,64,7168,256,256,8,ActivationType.Silu,torch.bfloat16,torch.float8_e4m3fnuz,torch.float8_e4m3fnuz,QuantType.per_Token,1,0,32,0,216.5262,_ZN5aiter48fmoe_stage1_bf16_pertokenFp8_g1u1_32x256_2tg_pf2E,0.0%,26.03,6514.97
stage1,304,64,7168,256,256,8,ActivationType.Silu,torch.bfloat16,torch.float8_e4m3fnuz,torch.float8_e4m3fnuz,QuantType.per_Token,1,0,32,0,219.8067,_ZN5aiter48fmoe_stage1_bf16_pertokenFp8_g1u1_32x256_2tg_pf3E,0.0%,25.65,6417.74
stage1,304,64,7168,256,256,8,ActivationType.Silu,torch.bfloat16,torch.float8_e4m3fnuz,torch.float8_e4m3fnuz,QuantType.per_Token,1,0,32,0,inf,_ZN5aiter44fmoe_stage1_bf16_pertokenFp8_g1u1_32x512_pf2E,100.0%,0.0,0.0
stage1,304,64,7168,256,256,8,ActivationType.Silu,torch.bfloat16,torch.float8_e4m3fnuz,torch.float8_e4m3fnuz,QuantType.per_Token,1,0,32,0,inf,_ZN5aiter44fmoe_stage1_bf16_pertokenFp8_g1u1_32x512_pf3E,100.0%,0.0,0.0
stage1,304,64,7168,256,256,8,ActivationType.Silu,torch.bfloat16,torch.float8_e4m3fnuz,torch.float8_e4m3fnuz,QuantType.per_Token,1,0,32,0,220.1798,_ZN5aiter47fmoe_stage1_bf16_pertokenFp8_g1u1_32x64_4tg_pf2E,0.0%,25.6,6406.87
stage1,304,64,7168,256,256,8,ActivationType.Silu,torch.bfloat16,torch.float8_e4m3fnuz,torch.float8_e4m3fnuz,QuantType.per_Token,1,0,32,0,215.8505,_ZN5aiter47fmoe_stage1_bf16_pertokenFp8_g1u1_32x64_4tg_pf3E,9.9%,26.12,6535.37
stage1,304,64,7168,256,256,8,ActivationType.Silu,torch.bfloat16,torch.float8_e4m3fnuz,torch.float8_e4m3fnuz,QuantType.per_Token,1,0,64,0,229.0634,_ZN5aiter48fmoe_stage1_bf16_pertokenFp8_g1u1_64x128_2tg_pf2E,0.0%,24.61,6158.39
stage1,304,64,7168,256,256,8,ActivationType.Silu,torch.bfloat16,torch.float8_e4m3fnuz,torch.float8_e4m3fnuz,QuantType.per_Token,1,0,64,0,226.9939,_ZN5aiter48fmoe_stage1_bf16_pertokenFp8_g1u1_64x128_2tg_pf3E,0.0%,24.83,6214.54
stage1,304,64,7168,256,256,8,ActivationType.Silu,torch.bfloat16,torch.float8_e4m3fnuz,torch.float8_e4m3fnuz,QuantType.per_Token,1,0,64,0,230.8415,_ZN5aiter44fmoe_stage1_bf16_pertokenFp8_g1u1_64x256_pf2E,0.0%,24.42,6110.96
stage1,304,64,7168,256,256,8,ActivationType.Silu,torch.bfloat16,torch.float8_e4m3fnuz,torch.float8_e4m3fnuz,QuantType.per_Token,1,0,64,0,224.7299,_ZN5aiter44fmoe_stage1_bf16_pertokenFp8_g1u1_64x256_pf3E,0.0%,25.08,6277.15
stage1,304,64,7168,256,256,8,ActivationType.Silu,torch.bfloat16,torch.float8_e4m3fnuz,torch.float8_e4m3fnuz,QuantType.per_Token,1,0,64,0,232.1473,_ZN5aiter47fmoe_stage1_bf16_pertokenFp8_g1u1_64x64_3tg_pf2E,0.0%,24.28,6076.58
stage1,304,64,7168,256,256,8,ActivationType.Silu,torch.bfloat16,torch.float8_e4m3fnuz,torch.float8_e4m3fnuz,QuantType.per_Token,1,0,64,0,228.831,_ZN5aiter47fmoe_stage1_bf16_pertokenFp8_g1u1_64x64_2tg_pf3E,0.1%,24.63,6164.65
stage1,304,64,7168,256,256,8,ActivationType.Silu,torch.bfloat16,torch.float8_e4m3fnuz,torch.float8_e4m3fnuz,QuantType.per_Token,1,0,128,0,264.1225,_ZN5aiter45fmoe_stage1_bf16_pertokenFp8_g1u1_128x128_pf2E,0.0%,21.34,5340.94
stage1,304,64,7168,256,256,8,ActivationType.Silu,torch.bfloat16,torch.float8_e4m3fnuz,torch.float8_e4m3fnuz,QuantType.per_Token,1,0,128,0,271.3069,_ZN5aiter45fmoe_stage1_bf16_pertokenFp8_g1u1_128x128_pf3E,0.0%,20.78,5199.51
stage1,304,64,7168,256,256,8,ActivationType.Silu,torch.bfloat16,torch.float8_e4m3fnuz,torch.float8_e4m3fnuz,QuantType.per_Token,1,0,128,0,270.3485,_ZN5aiter44fmoe_stage1_bf16_pertokenFp8_g1u1_128x64_pf2E,0.0%,20.85,5217.94
stage1,304,64,7168,256,256,8,ActivationType.Silu,torch.bfloat16,torch.float8_e4m3fnuz,torch.float8_e4m3fnuz,QuantType.per_Token,1,0,128,0,245.0177,_ZN5aiter44fmoe_stage1_bf16_pertokenFp8_g1u1_128x64_pf3E,0.0%,23.01,5757.39
stage1,304,64,7168,256,256,8,ActivationType.Silu,torch.bfloat16,torch.float8_e4m3fnuz,torch.float8_e4m3fnuz,QuantType.per_Token,1,0,32,0,224.5497,moe_ck2stages_gemm1_256x32x64x256_1x4_MulABScale_v1_Nswizzle0_Quant2_MulRoutedWeight0_silu_F8_F8_B16,0.0%,25.1,6282.18
stage1,304,64,7168,256,256,8,ActivationType.Silu,torch.bfloat16,torch.float8_e4m3fnuz,torch.float8_e4m3fnuz,QuantType.per_Token,1,0,32,0,221.8951,moe_ck2stages_gemm1_256x32x64x128_1x4_MulABScale_v1_Nswizzle0_Quant2_MulRoutedWeight0_silu_F8_F8_B16,0.0%,25.4,6357.34
stage2,304,64,7168,256,256,8,ActivationType.Silu,torch.bfloat16,torch.float8_e4m3fnuz,torch.float8_e4m3fnuz,QuantType.per_Token,1,0,32,0,119.9251,moe_ck2stages_gemm2_256x32x64x256_1x4_MulABScaleExpertWeight_v1_Nswizzle0_Quant2_MulRoutedWeight1_F8_F8_B16,1.3%,47.01,11762.86
stage2,304,64,7168,256,256,8,ActivationType.Silu,torch.bfloat16,torch.float8_e4m3fnuz,torch.float8_e4m3fnuz,QuantType.per_Token,1,0,32,0,129.6406,moe_ck2stages_gemm2_256x32x64x128_1x4_MulABScaleExpertWeight_v1_Nswizzle0_Quant2_MulRoutedWeight1_F8_F8_B16,1.3%,43.48,10881.33
stage1,304,64,7168,256,256,8,ActivationType.Silu,torch.bfloat16,torch.float8_e4m3fnuz,torch.float8_e4m3fnuz,QuantType.per_Token,1,0,64,0,228.7124,moe_ck2stages_gemm1_256x64x64x256_1x4_MulABScale_v1_Nswizzle0_Quant2_MulRoutedWeight0_silu_F8_F8_B16,0.0%,24.65,6167.84
stage1,304,64,7168,256,256,8,ActivationType.Silu,torch.bfloat16,torch.float8_e4m3fnuz,torch.float8_e4m3fnuz,QuantType.per_Token,1,0,64,0,231.7168,moe_ck2stages_gemm1_256x64x64x128_1x4_MulABScale_v1_Nswizzle0_Quant2_MulRoutedWeight0_silu_F8_F8_B16,0.0%,24.33,6087.87
stage1,304,64,7168,256,256,8,ActivationType.Silu,torch.bfloat16,torch.float8_e4m3fnuz,torch.float8_e4m3fnuz,QuantType.per_Token,1,0,64,0,237.6076,moe_ck2stages_gemm1_256x64x128x256_1x4_MulABScale_v3_Nswizzle0_Quant2_MulRoutedWeight0_silu_F8_F8_B16,0.0%,23.72,5936.94
stage1,304,64,7168,256,256,8,ActivationType.Silu,torch.bfloat16,torch.float8_e4m3fnuz,torch.float8_e4m3fnuz,QuantType.per_Token,1,0,64,0,226.6159,moe_ck2stages_gemm1_256x64x128x128_1x4_MulABScale_v3_Nswizzle0_Quant2_MulRoutedWeight0_silu_F8_F8_B16,0.0%,24.88,6224.9
stage2,304,64,7168,256,256,8,ActivationType.Silu,torch.bfloat16,torch.float8_e4m3fnuz,torch.float8_e4m3fnuz,QuantType.per_Token,1,0,64,0,181.2033,moe_ck2stages_gemm2_256x64x64x256_1x4_MulABScaleExpertWeight_v1_Nswizzle0_Quant2_MulRoutedWeight1_F8_F8_B16,1.3%,31.11,7784.97
stage2,304,64,7168,256,256,8,ActivationType.Silu,torch.bfloat16,torch.float8_e4m3fnuz,torch.float8_e4m3fnuz,QuantType.per_Token,1,0,64,0,159.0302,moe_ck2stages_gemm2_256x64x128x256_1x4_MulABScaleExpertWeight_v3_Nswizzle0_Quant2_MulRoutedWeight1_F8_F8_B16,1.3%,35.45,8870.41
stage2,304,64,7168,256,256,8,ActivationType.Silu,torch.bfloat16,torch.float8_e4m3fnuz,torch.float8_e4m3fnuz,QuantType.per_Token,1,0,64,0,186.5052,moe_ck2stages_gemm2_256x64x128x128_1x4_MulABScaleExpertWeight_v3_Nswizzle0_Quant2_MulRoutedWeight1_F8_F8_B16,1.3%,30.23,7563.66
stage1,304,64,7168,256,256,8,ActivationType.Silu,torch.bfloat16,torch.float8_e4m3fnuz,torch.float8_e4m3fnuz,QuantType.per_Token,1,0,128,0,262.0549,moe_ck2stages_gemm1_256x128x64x128_1x4_MulABScale_v1_Nswizzle0_Quant2_MulRoutedWeight0_silu_F8_F8_B16,0.0%,21.51,5383.08
stage1,304,64,7168,256,256,8,ActivationType.Silu,torch.bfloat16,torch.float8_e4m3fnuz,torch.float8_e4m3fnuz,QuantType.per_Token,1,0,128,0,282.561,moe_ck2stages_gemm1_256x128x128x256_1x4_MulABScale_v3_Nswizzle0_Quant2_MulRoutedWeight0_silu_F8_F8_B16,0.0%,19.95,4992.42
stage1,304,64,7168,256,256,8,ActivationType.Silu,torch.bfloat16,torch.float8_e4m3fnuz,torch.float8_e4m3fnuz,QuantType.per_Token,1,0,128,0,285.1238,moe_ck2stages_gemm1_256x128x128x128_1x4_MulABScale_v3_Nswizzle0_Quant2_MulRoutedWeight0_silu_F8_F8_B16,0.0%,19.77,4947.54
stage2,304,64,7168,256,256,8,ActivationType.Silu,torch.bfloat16,torch.float8_e4m3fnuz,torch.float8_e4m3fnuz,QuantType.per_Token,1,0,128,0,246.9792,moe_ck2stages_gemm2_256x128x64x128_1x4_MulABScaleExpertWeight_v1_Nswizzle0_Quant2_MulRoutedWeight1_F8_F8_B16,1.3%,22.82,5711.66
stage2,304,64,7168,256,256,8,ActivationType.Silu,torch.bfloat16,torch.float8_e4m3fnuz,torch.float8_e4m3fnuz,QuantType.per_Token,1,0,128,0,258.987,moe_ck2stages_gemm2_256x128x128x128_1x4_MulABScaleExpertWeight_v3_Nswizzle0_Quant2_MulRoutedWeight1_F8_F8_B16,1.3%,21.77,5446.85
asm_1stage,304,64,7168,256,256,8,ActivationType.Silu,torch.bfloat16,torch.float8_e4m3fnuz,torch.float8_e4m3fnuz,QuantType.per_Token,1,0,32,0,340.4988,_ZN5aiter45fmoe_bf16_pertokenFp8_g1u1_vs_silu_1tg_32x128E,69.1%,16.56,4142.93
asm_1stage,304,64,7168,256,256,8,ActivationType.Silu,torch.bfloat16,torch.float8_e4m3fnuz,torch.float8_e4m3fnuz,QuantType.per_Token,1,0,32,0,360.6025,_ZN5aiter48fmoe_bf16_pertokenFp8_g1u1_vs_silu_1tg_ps_32x128E,0.0%,15.63,3911.96
asm_1stage,304,64,7168,256,256,8,ActivationType.Silu,torch.bfloat16,torch.float8_e4m3fnuz,torch.float8_e4m3fnuz,QuantType.per_Token,1,0,32,0,340.5909,_ZN5aiter48fmoe_bf16_pertokenFp8_g1u1_vs_silu_1tg_ps_32x256E,0.0%,16.55,4141.81
asm_1stage,304,64,7168,256,256,8,ActivationType.Silu,torch.bfloat16,torch.float8_e4m3fnuz,torch.float8_e4m3fnuz,QuantType.per_Token,1,0,32,0,335.7237,_ZN5aiter45fmoe_bf16_pertokenFp8_g1u1_vs_silu_1tg_32x256E,0.0%,16.79,4201.86
stage1,304,32,7168,256,256,8,ActivationType.Silu,torch.bfloat16,torch.float8_e4m3fnuz,torch.float8_e4m3fnuz,QuantType.per_Token,1,0,32,0,164.9982,_ZN5aiter48fmoe_stage1_bf16_pertokenFp8_g1u1_32x128_3tg_pf2E,0.0%,17.08,8545.39
stage1,304,32,7168,256,256,8,ActivationType.Silu,torch.bfloat16,torch.float8_e4m3fnuz,torch.float8_e4m3fnuz,QuantType.per_Token,1,0,32,0,179.0234,_ZN5aiter48fmoe_stage1_bf16_pertokenFp8_g1u1_32x128_3tg_pf3E,0.0%,15.74,7875.92
stage1,304,32,7168,256,256,8,ActivationType.Silu,torch.bfloat16,torch.float8_e4m3fnuz,torch.float8_e4m3fnuz,QuantType.per_Token,1,0,32,0,160.5802,_ZN5aiter48fmoe_stage1_bf16_pertokenFp8_g1u1_32x256_2tg_pf2E,0.0%,17.55,8780.5
stage1,304,32,7168,256,256,8,ActivationType.Silu,torch.bfloat16,torch.float8_e4m3fnuz,torch.float8_e4m3fnuz,QuantType.per_Token,1,0,32,0,161.9821,_ZN5aiter48fmoe_stage1_bf16_pertokenFp8_g1u1_32x256_2tg_pf3E,0.0%,17.4,8704.51
stage1,304,32,7168,256,256,8,ActivationType.Silu,torch.bfloat16,torch.float8_e4m3fnuz,torch.float8_e4m3fnuz,QuantType.per_Token,1,0,32,0,inf,_ZN5aiter44fmoe_stage1_bf16_pertokenFp8_g1u1_32x512_pf2E,100.0%,0.0,0.0
stage1,304,32,7168,256,256,8,ActivationType.Silu,torch.bfloat16,torch.float8_e4m3fnuz,torch.float8_e4m3fnuz,QuantType.per_Token,1,0,32,0,inf,_ZN5aiter44fmoe_stage1_bf16_pertokenFp8_g1u1_32x512_pf3E,100.0%,0.0,0.0
stage1,304,32,7168,256,256,8,ActivationType.Silu,torch.bfloat16,torch.float8_e4m3fnuz,torch.float8_e4m3fnuz,QuantType.per_Token,1,0,32,0,164.8134,_ZN5aiter47fmoe_stage1_bf16_pertokenFp8_g1u1_32x64_4tg_pf2E,0.0%,17.1,8554.97
stage1,304,32,7168,256,256,8,ActivationType.Silu,torch.bfloat16,torch.float8_e4m3fnuz,torch.float8_e4m3fnuz,QuantType.per_Token,1,0,32,0,165.63,_ZN5aiter47fmoe_stage1_bf16_pertokenFp8_g1u1_32x64_4tg_pf3E,6.8%,17.02,8512.8
stage1,304,32,7168,256,256,8,ActivationType.Silu,torch.bfloat16,torch.float8_e4m3fnuz,torch.float8_e4m3fnuz,QuantType.per_Token,1,0,64,0,167.5296,_ZN5aiter48fmoe_stage1_bf16_pertokenFp8_g1u1_64x128_2tg_pf2E,0.0%,16.82,8416.27
stage1,304,32,7168,256,256,8,ActivationType.Silu,torch.bfloat16,torch.float8_e4m3fnuz,torch.float8_e4m3fnuz,QuantType.per_Token,1,0,64,0,190.5931,_ZN5aiter48fmoe_stage1_bf16_pertokenFp8_g1u1_64x128_2tg_pf3E,0.0%,14.79,7397.82
stage1,304,32,7168,256,256,8,ActivationType.Silu,torch.bfloat16,torch.float8_e4m3fnuz,torch.float8_e4m3fnuz,QuantType.per_Token,1,0,64,0,168.6552,_ZN5aiter44fmoe_stage1_bf16_pertokenFp8_g1u1_64x256_pf2E,0.0%,16.71,8360.1
stage1,304,32,7168,256,256,8,ActivationType.Silu,torch.bfloat16,torch.float8_e4m3fnuz,torch.float8_e4m3fnuz,QuantType.per_Token,1,0,64,0,164.5788,_ZN5aiter44fmoe_stage1_bf16_pertokenFp8_g1u1_64x256_pf3E,0.0%,17.13,8567.17
stage1,304,32,7168,256,256,8,ActivationType.Silu,torch.bfloat16,torch.float8_e4m3fnuz,torch.float8_e4m3fnuz,QuantType.per_Token,1,0,64,0,168.1148,_ZN5aiter47fmoe_stage1_bf16_pertokenFp8_g1u1_64x64_3tg_pf2E,0.0%,16.77,8386.97
stage1,304,32,7168,256,256,8,ActivationType.Silu,torch.bfloat16,torch.float8_e4m3fnuz,torch.float8_e4m3fnuz,QuantType.per_Token,1,0,64,0,187.7201,_ZN5aiter47fmoe_stage1_bf16_pertokenFp8_g1u1_64x64_2tg_pf3E,0.0%,15.01,7511.05
stage1,304,32,7168,256,256,8,ActivationType.Silu,torch.bfloat16,torch.float8_e4m3fnuz,torch.float8_e4m3fnuz,QuantType.per_Token,1,0,128,0,234.051,_ZN5aiter45fmoe_stage1_bf16_pertokenFp8_g1u1_128x128_pf2E,0.0%,12.04,6024.22
stage1,304,32,7168,256,256,8,ActivationType.Silu,torch.bfloat16,torch.float8_e4m3fnuz,torch.float8_e4m3fnuz,QuantType.per_Token,1,0,128,0,228.5397,_ZN5aiter45fmoe_stage1_bf16_pertokenFp8_g1u1_128x128_pf3E,0.0%,12.33,6169.49
stage1,304,32,7168,256,256,8,ActivationType.Silu,torch.bfloat16,torch.float8_e4m3fnuz,torch.float8_e4m3fnuz,QuantType.per_Token,1,0,128,0,227.7107,_ZN5aiter44fmoe_stage1_bf16_pertokenFp8_g1u1_128x64_pf2E,0.0%,12.38,6191.95
stage1,304,32,7168,256,256,8,ActivationType.Silu,torch.bfloat16,torch.float8_e4m3fnuz,torch.float8_e4m3fnuz,QuantType.per_Token,1,0,128,0,216.3566,_ZN5aiter44fmoe_stage1_bf16_pertokenFp8_g1u1_128x64_pf3E,0.0%,13.03,6516.9
stage1,304,32,7168,256,256,8,ActivationType.Silu,torch.bfloat16,torch.float8_e4m3fnuz,torch.float8_e4m3fnuz,QuantType.per_Token,1,0,32,0,167.2459,moe_ck2stages_gemm1_256x32x64x256_1x4_MulABScale_v1_Nswizzle0_Quant2_MulRoutedWeight0_silu_F8_F8_B16,0.0%,16.85,8430.55
stage1,304,32,7168,256,256,8,ActivationType.Silu,torch.bfloat16,torch.float8_e4m3fnuz,torch.float8_e4m3fnuz,QuantType.per_Token,1,0,32,0,167.8416,moe_ck2stages_gemm1_256x32x64x128_1x4_MulABScale_v1_Nswizzle0_Quant2_MulRoutedWeight0_silu_F8_F8_B16,0.0%,16.79,8400.62
stage2,304,32,7168,256,256,8,ActivationType.Silu,torch.bfloat16,torch.float8_e4m3fnuz,torch.float8_e4m3fnuz,QuantType.per_Token,1,0,32,0,89.9952,moe_ck2stages_gemm2_256x32x64x256_1x4_MulABScaleExpertWeight_v1_Nswizzle0_Quant2_MulRoutedWeight1_F8_F8_B16,1.3%,31.32,15667.22
stage2,304,32,7168,256,256,8,ActivationType.Silu,torch.bfloat16,torch.float8_e4m3fnuz,torch.float8_e4m3fnuz,QuantType.per_Token,1,0,32,0,87.4451,moe_ck2stages_gemm2_256x32x64x128_1x4_MulABScaleExpertWeight_v1_Nswizzle0_Quant2_MulRoutedWeight1_F8_F8_B16,1.3%,32.23,16124.11
stage1,304,32,7168,256,256,8,ActivationType.Silu,torch.bfloat16,torch.float8_e4m3fnuz,torch.float8_e4m3fnuz,QuantType.per_Token,1,0,64,0,177.0127,moe_ck2stages_gemm1_256x64x64x256_1x4_MulABScale_v1_Nswizzle0_Quant2_MulRoutedWeight0_silu_F8_F8_B16,0.0%,15.92,7965.38
stage1,304,32,7168,256,256,8,ActivationType.Silu,torch.bfloat16,torch.float8_e4m3fnuz,torch.float8_e4m3fnuz,QuantType.per_Token,1,0,64,0,183.1961,moe_ck2stages_gemm1_256x64x64x128_1x4_MulABScale_v1_Nswizzle0_Quant2_MulRoutedWeight0_silu_F8_F8_B16,0.0%,15.39,7696.53
stage1,304,32,7168,256,256,8,ActivationType.Silu,torch.bfloat16,torch.float8_e4m3fnuz,torch.float8_e4m3fnuz,QuantType.per_Token,1,0,64,0,202.8345,moe_ck2stages_gemm1_256x64x128x256_1x4_MulABScale_v3_Nswizzle0_Quant2_MulRoutedWeight0_silu_F8_F8_B16,0.0%,13.9,6951.35
stage1,304,32,7168,256,256,8,ActivationType.Silu,torch.bfloat16,torch.float8_e4m3fnuz,torch.float8_e4m3fnuz,QuantType.per_Token,1,0,64,0,193.868,moe_ck2stages_gemm1_256x64x128x128_1x4_MulABScale_v3_Nswizzle0_Quant2_MulRoutedWeight0_silu_F8_F8_B16,0.0%,14.54,7272.86
stage2,304,32,7168,256,256,8,ActivationType.Silu,torch.bfloat16,torch.float8_e4m3fnuz,torch.float8_e4m3fnuz,QuantType.per_Token,1,0,64,0,132.2687,moe_ck2stages_gemm2_256x64x64x256_1x4_MulABScaleExpertWeight_v1_Nswizzle0_Quant2_MulRoutedWeight1_F8_F8_B16,1.3%,21.31,10659.92
stage2,304,32,7168,256,256,8,ActivationType.Silu,torch.bfloat16,torch.float8_e4m3fnuz,torch.float8_e4m3fnuz,QuantType.per_Token,1,0,64,0,104.8575,moe_ck2stages_gemm2_256x64x128x256_1x4_MulABScaleExpertWeight_v3_Nswizzle0_Quant2_MulRoutedWeight1_F8_F8_B16,1.3%,26.88,13446.58
stage2,304,32,7168,256,256,8,ActivationType.Silu,torch.bfloat16,torch.float8_e4m3fnuz,torch.float8_e4m3fnuz,QuantType.per_Token,1,0,64,0,131.4063,moe_ck2stages_gemm2_256x64x128x128_1x4_MulABScaleExpertWeight_v3_Nswizzle0_Quant2_MulRoutedWeight1_F8_F8_B16,1.3%,21.45,10729.88
stage1,304,32,7168,256,256,8,ActivationType.Silu,torch.bfloat16,torch.float8_e4m3fnuz,torch.float8_e4m3fnuz,QuantType.per_Token,1,0,128,0,215.9528,moe_ck2stages_gemm1_256x128x64x128_1x4_MulABScale_v1_Nswizzle0_Quant2_MulRoutedWeight0_silu_F8_F8_B16,0.0%,13.05,6529.09
stage1,304,32,7168,256,256,8,ActivationType.Silu,torch.bfloat16,torch.float8_e4m3fnuz,torch.float8_e4m3fnuz,QuantType.per_Token,1,0,128,0,246.4184,moe_ck2stages_gemm1_256x128x128x256_1x4_MulABScale_v3_Nswizzle0_Quant2_MulRoutedWeight0_silu_F8_F8_B16,0.0%,11.44,5721.87
stage1,304,32,7168,256,256,8,ActivationType.Silu,torch.bfloat16,torch.float8_e4m3fnuz,torch.float8_e4m3fnuz,QuantType.per_Token,1,0,128,0,251.9779,moe_ck2stages_gemm1_256x128x128x128_1x4_MulABScale_v3_Nswizzle0_Quant2_MulRoutedWeight0_silu_F8_F8_B16,0.0%,11.19,5595.63
stage2,304,32,7168,256,256,8,ActivationType.Silu,torch.bfloat16,torch.float8_e4m3fnuz,torch.float8_e4m3fnuz,QuantType.per_Token,1,0,128,0,177.3951,moe_ck2stages_gemm2_256x128x64x128_1x4_MulABScaleExpertWeight_v1_Nswizzle0_Quant2_MulRoutedWeight1_F8_F8_B16,1.3%,15.89,7948.21
stage2,304,32,7168,256,256,8,ActivationType.Silu,torch.bfloat16,torch.float8_e4m3fnuz,torch.float8_e4m3fnuz,QuantType.per_Token,1,0,128,0,191.7258,moe_ck2stages_gemm2_256x128x128x128_1x4_MulABScaleExpertWeight_v3_Nswizzle0_Quant2_MulRoutedWeight1_F8_F8_B16,1.3%,14.7,7354.12
asm_1stage,304,32,7168,256,256,8,ActivationType.Silu,torch.bfloat16,torch.float8_e4m3fnuz,torch.float8_e4m3fnuz,QuantType.per_Token,1,0,32,0,296.2836,_ZN5aiter45fmoe_bf16_pertokenFp8_g1u1_vs_silu_1tg_32x128E,69.3%,9.51,4758.87
asm_1stage,304,32,7168,256,256,8,ActivationType.Silu,torch.bfloat16,torch.float8_e4m3fnuz,torch.float8_e4m3fnuz,QuantType.per_Token,1,0,32,0,310.2174,_ZN5aiter48fmoe_bf16_pertokenFp8_g1u1_vs_silu_1tg_ps_32x128E,0.0%,9.09,4545.12
asm_1stage,304,32,7168,256,256,8,ActivationType.Silu,torch.bfloat16,torch.float8_e4m3fnuz,torch.float8_e4m3fnuz,QuantType.per_Token,1,0,32,0,251.9844,_ZN5aiter48fmoe_bf16_pertokenFp8_g1u1_vs_silu_1tg_ps_32x256E,0.0%,11.19,5595.48
asm_1stage,304,32,7168,256,256,8,ActivationType.Silu,torch.bfloat16,torch.float8_e4m3fnuz,torch.float8_e4m3fnuz,QuantType.per_Token,1,0,32,0,253.3349,_ZN5aiter45fmoe_bf16_pertokenFp8_g1u1_vs_silu_1tg_32x256E,0.0%,11.13,5565.65
stage1,304,16,7168,256,256,8,ActivationType.Silu,torch.bfloat16,torch.float8_e4m3fnuz,torch.float8_e4m3fnuz,QuantType.per_Token,1,0,32,0,107.6567,_ZN5aiter48fmoe_stage1_bf16_pertokenFp8_g1u1_32x128_3tg_pf2E,0.0%,13.09,13093.75
stage1,304,16,7168,256,256,8,ActivationType.Silu,torch.bfloat16,torch.float8_e4m3fnuz,torch.float8_e4m3fnuz,QuantType.per_Token,1,0,32,0,103.7346,_ZN5aiter48fmoe_stage1_bf16_pertokenFp8_g1u1_32x128_3tg_pf3E,0.0%,13.59,13588.81
stage1,304,16,7168,256,256,8,ActivationType.Silu,torch.bfloat16,torch.float8_e4m3fnuz,torch.float8_e4m3fnuz,QuantType.per_Token,1,0,32,0,108.7943,_ZN5aiter48fmoe_stage1_bf16_pertokenFp8_g1u1_32x256_2tg_pf2E,0.0%,12.95,12956.84
stage1,304,16,7168,256,256,8,ActivationType.Silu,torch.bfloat16,torch.float8_e4m3fnuz,torch.float8_e4m3fnuz,QuantType.per_Token,1,0,32,0,110.9876,_ZN5aiter48fmoe_stage1_bf16_pertokenFp8_g1u1_32x256_2tg_pf3E,0.0%,12.7,12700.79
stage1,304,16,7168,256,256,8,ActivationType.Silu,torch.bfloat16,torch.float8_e4m3fnuz,torch.float8_e4m3fnuz,QuantType.per_Token,1,0,32,0,inf,_ZN5aiter44fmoe_stage1_bf16_pertokenFp8_g1u1_32x512_pf2E,100.0%,0.0,0.0
stage1,304,16,7168,256,256,8,ActivationType.Silu,torch.bfloat16,torch.float8_e4m3fnuz,torch.float8_e4m3fnuz,QuantType.per_Token,1,0,32,0,inf,_ZN5aiter44fmoe_stage1_bf16_pertokenFp8_g1u1_32x512_pf3E,100.0%,0.0,0.0
stage1,304,16,7168,256,256,8,ActivationType.Silu,torch.bfloat16,torch.float8_e4m3fnuz,torch.float8_e4m3fnuz,QuantType.per_Token,1,0,32,0,102.6142,_ZN5aiter47fmoe_stage1_bf16_pertokenFp8_g1u1_32x64_4tg_pf2E,0.0%,13.73,13737.18
stage1,304,16,7168,256,256,8,ActivationType.Silu,torch.bfloat16,torch.float8_e4m3fnuz,torch.float8_e4m3fnuz,QuantType.per_Token,1,0,32,0,109.8221,_ZN5aiter47fmoe_stage1_bf16_pertokenFp8_g1u1_32x64_4tg_pf3E,0.0%,12.83,12835.58
stage1,304,16,7168,256,256,8,ActivationType.Silu,torch.bfloat16,torch.float8_e4m3fnuz,torch.float8_e4m3fnuz,QuantType.per_Token,1,0,64,0,114.8698,_ZN5aiter48fmoe_stage1_bf16_pertokenFp8_g1u1_64x128_2tg_pf2E,0.0%,12.27,12271.55
stage1,304,16,7168,256,256,8,ActivationType.Silu,torch.bfloat16,torch.float8_e4m3fnuz,torch.float8_e4m3fnuz,QuantType.per_Token,1,0,64,0,105.9472,_ZN5aiter48fmoe_stage1_bf16_pertokenFp8_g1u1_64x128_2tg_pf3E,0.0%,13.3,13305.03
stage1,304,16,7168,256,256,8,ActivationType.Silu,torch.bfloat16,torch.float8_e4m3fnuz,torch.float8_e4m3fnuz,QuantType.per_Token,1,0,64,0,119.8008,_ZN5aiter44fmoe_stage1_bf16_pertokenFp8_g1u1_64x256_pf2E,0.0%,11.76,11766.45
stage1,304,16,7168,256,256,8,ActivationType.Silu,torch.bfloat16,torch.float8_e4m3fnuz,torch.float8_e4m3fnuz,QuantType.per_Token,1,0,64,0,109.8144,_ZN5aiter44fmoe_stage1_bf16_pertokenFp8_g1u1_64x256_pf3E,0.0%,12.83,12836.48
stage1,304,16,7168,256,256,8,ActivationType.Silu,torch.bfloat16,torch.float8_e4m3fnuz,torch.float8_e4m3fnuz,QuantType.per_Token,1,0,64,0,105.8328,_ZN5aiter47fmoe_stage1_bf16_pertokenFp8_g1u1_64x64_3tg_pf2E,0.0%,13.32,13319.41
stage1,304,16,7168,256,256,8,ActivationType.Silu,torch.bfloat16,torch.float8_e4m3fnuz,torch.float8_e4m3fnuz,QuantType.per_Token,1,0,64,0,111.2485,_ZN5aiter47fmoe_stage1_bf16_pertokenFp8_g1u1_64x64_2tg_pf3E,0.0%,12.67,12671.0
stage1,304,16,7168,256,256,8,ActivationType.Silu,torch.bfloat16,torch.float8_e4m3fnuz,torch.float8_e4m3fnuz,QuantType.per_Token,1,0,128,0,121.9154,_ZN5aiter45fmoe_stage1_bf16_pertokenFp8_g1u1_128x128_pf2E,0.0%,11.56,11562.36
stage1,304,16,7168,256,256,8,ActivationType.Silu,torch.bfloat16,torch.float8_e4m3fnuz,torch.float8_e4m3fnuz,QuantType.per_Token,1,0,128,0,123.8248,_ZN5aiter45fmoe_stage1_bf16_pertokenFp8_g1u1_128x128_pf3E,0.0%,11.38,11384.07
stage1,304,16,7168,256,256,8,ActivationType.Silu,torch.bfloat16,torch.float8_e4m3fnuz,torch.float8_e4m3fnuz,QuantType.per_Token,1,0,128,0,150.2444,_ZN5aiter44fmoe_stage1_bf16_pertokenFp8_g1u1_128x64_pf2E,0.0%,9.38,9382.25
stage1,304,16,7168,256,256,8,ActivationType.Silu,torch.bfloat16,torch.float8_e4m3fnuz,torch.float8_e4m3fnuz,QuantType.per_Token,1,0,128,0,142.2851,_ZN5aiter44fmoe_stage1_bf16_pertokenFp8_g1u1_128x64_pf3E,0.0%,9.9,9907.08
stage1,304,16,7168,256,256,8,ActivationType.Silu,torch.bfloat16,torch.float8_e4m3fnuz,torch.float8_e4m3fnuz,QuantType.per_Token,1,0,32,0,102.1136,moe_ck2stages_gemm1_256x32x64x256_1x4_MulABScale_v1_Nswizzle0_Quant2_MulRoutedWeight0_silu_F8_F8_B16,0.0%,13.8,13804.53
stage1,304,16,7168,256,256,8,ActivationType.Silu,torch.bfloat16,torch.float8_e4m3fnuz,torch.float8_e4m3fnuz,QuantType.per_Token,1,0,32,0,104.9036,moe_ck2stages_gemm1_256x32x64x128_1x4_MulABScale_v1_Nswizzle0_Quant2_MulRoutedWeight0_silu_F8_F8_B16,0.0%,13.43,13437.39
stage2,304,16,7168,256,256,8,ActivationType.Silu,torch.bfloat16,torch.float8_e4m3fnuz,torch.float8_e4m3fnuz,QuantType.per_Token,1,0,32,0,54.4003,moe_ck2stages_gemm2_256x32x64x256_1x4_MulABScaleExpertWeight_v1_Nswizzle0_Quant2_MulRoutedWeight1_F8_F8_B16,1.4%,25.91,25912.18
stage2,304,16,7168,256,256,8,ActivationType.Silu,torch.bfloat16,torch.float8_e4m3fnuz,torch.float8_e4m3fnuz,QuantType.per_Token,1,0,32,0,54.7904,moe_ck2stages_gemm2_256x32x64x128_1x4_MulABScaleExpertWeight_v1_Nswizzle0_Quant2_MulRoutedWeight1_F8_F8_B16,1.4%,25.72,25727.69
stage1,304,16,7168,256,256,8,ActivationType.Silu,torch.bfloat16,torch.float8_e4m3fnuz,torch.float8_e4m3fnuz,QuantType.per_Token,1,0,64,0,113.7965,moe_ck2stages_gemm1_256x64x64x256_1x4_MulABScale_v1_Nswizzle0_Quant2_MulRoutedWeight0_silu_F8_F8_B16,0.0%,12.38,12387.29
stage1,304,16,7168,256,256,8,ActivationType.Silu,torch.bfloat16,torch.float8_e4m3fnuz,torch.float8_e4m3fnuz,QuantType.per_Token,1,0,64,0,112.0289,moe_ck2stages_gemm1_256x64x64x128_1x4_MulABScale_v1_Nswizzle0_Quant2_MulRoutedWeight0_silu_F8_F8_B16,0.0%,12.58,12582.74
stage1,304,16,7168,256,256,8,ActivationType.Silu,torch.bfloat16,torch.float8_e4m3fnuz,torch.float8_e4m3fnuz,QuantType.per_Token,1,0,64,0,112.2328,moe_ck2stages_gemm1_256x64x128x256_1x4_MulABScale_v3_Nswizzle0_Quant2_MulRoutedWeight0_silu_F8_F8_B16,0.0%,12.56,12559.88
stage1,304,16,7168,256,256,8,ActivationType.Silu,torch.bfloat16,torch.float8_e4m3fnuz,torch.float8_e4m3fnuz,QuantType.per_Token,1,0,64,0,111.9267,moe_ck2stages_gemm1_256x64x128x128_1x4_MulABScale_v3_Nswizzle0_Quant2_MulRoutedWeight0_silu_F8_F8_B16,0.0%,12.59,12594.23
stage2,304,16,7168,256,256,8,ActivationType.Silu,torch.bfloat16,torch.float8_e4m3fnuz,torch.float8_e4m3fnuz,QuantType.per_Token,1,0,64,0,89.3349,moe_ck2stages_gemm2_256x64x64x256_1x4_MulABScaleExpertWeight_v1_Nswizzle0_Quant2_MulRoutedWeight1_F8_F8_B16,1.4%,15.78,15779.17
stage2,304,16,7168,256,256,8,ActivationType.Silu,torch.bfloat16,torch.float8_e4m3fnuz,torch.float8_e4m3fnuz,QuantType.per_Token,1,0,64,0,74.3302,moe_ck2stages_gemm2_256x64x128x256_1x4_MulABScaleExpertWeight_v3_Nswizzle0_Quant2_MulRoutedWeight1_F8_F8_B16,1.4%,18.96,18964.43
stage2,304,16,7168,256,256,8,ActivationType.Silu,torch.bfloat16,torch.float8_e4m3fnuz,torch.float8_e4m3fnuz,QuantType.per_Token,1,0,64,0,74.3648,moe_ck2stages_gemm2_256x64x128x128_1x4_MulABScaleExpertWeight_v3_Nswizzle0_Quant2_MulRoutedWeight1_F8_F8_B16,1.4%,18.95,18955.61
stage1,304,16,7168,256,256,8,ActivationType.Silu,torch.bfloat16,torch.float8_e4m3fnuz,torch.float8_e4m3fnuz,QuantType.per_Token,1,0,128,0,132.8449,moe_ck2stages_gemm1_256x128x64x128_1x4_MulABScale_v1_Nswizzle0_Quant2_MulRoutedWeight0_silu_F8_F8_B16,0.0%,10.61,10611.1
stage1,304,16,7168,256,256,8,ActivationType.Silu,torch.bfloat16,torch.float8_e4m3fnuz,torch.float8_e4m3fnuz,QuantType.per_Token,1,0,128,0,130.8846,moe_ck2stages_gemm1_256x128x128x256_1x4_MulABScale_v3_Nswizzle0_Quant2_MulRoutedWeight0_silu_F8_F8_B16,0.0%,10.77,10770.02
stage1,304,16,7168,256,256,8,ActivationType.Silu,torch.bfloat16,torch.float8_e4m3fnuz,torch.float8_e4m3fnuz,QuantType.per_Token,1,0,128,0,130.5953,moe_ck2stages_gemm1_256x128x128x128_1x4_MulABScale_v3_Nswizzle0_Quant2_MulRoutedWeight0_silu_F8_F8_B16,0.0%,10.79,10793.88
stage2,304,16,7168,256,256,8,ActivationType.Silu,torch.bfloat16,torch.float8_e4m3fnuz,torch.float8_e4m3fnuz,QuantType.per_Token,1,0,128,0,104.4769,moe_ck2stages_gemm2_256x128x64x128_1x4_MulABScaleExpertWeight_v1_Nswizzle0_Quant2_MulRoutedWeight1_F8_F8_B16,1.4%,13.49,13492.27
stage2,304,16,7168,256,256,8,ActivationType.Silu,torch.bfloat16,torch.float8_e4m3fnuz,torch.float8_e4m3fnuz,QuantType.per_Token,1,0,128,0,125.7754,moe_ck2stages_gemm2_256x128x128x128_1x4_MulABScaleExpertWeight_v3_Nswizzle0_Quant2_MulRoutedWeight1_F8_F8_B16,1.4%,11.2,11207.52
asm_1stage,304,16,7168,256,256,8,ActivationType.Silu,torch.bfloat16,torch.float8_e4m3fnuz,torch.float8_e4m3fnuz,QuantType.per_Token,1,0,32,0,160.0234,_ZN5aiter45fmoe_bf16_pertokenFp8_g1u1_vs_silu_1tg_32x128E,70.3%,8.81,8808.9
asm_1stage,304,16,7168,256,256,8,ActivationType.Silu,torch.bfloat16,torch.float8_e4m3fnuz,torch.float8_e4m3fnuz,QuantType.per_Token,1,0,32,0,172.1645,_ZN5aiter48fmoe_bf16_pertokenFp8_g1u1_vs_silu_1tg_ps_32x128E,0.0%,8.19,8187.69
asm_1stage,304,16,7168,256,256,8,ActivationType.Silu,torch.bfloat16,torch.float8_e4m3fnuz,torch.float8_e4m3fnuz,QuantType.per_Token,1,0,32,0,178.1153,_ZN5aiter48fmoe_bf16_pertokenFp8_g1u1_vs_silu_1tg_ps_32x256E,0.0%,7.91,7914.14
asm_1stage,304,16,7168,256,256,8,ActivationType.Silu,torch.bfloat16,torch.float8_e4m3fnuz,torch.float8_e4m3fnuz,QuantType.per_Token,1,0,32,0,163.6794,_ZN5aiter45fmoe_bf16_pertokenFp8_g1u1_vs_silu_1tg_32x256E,0.0%,8.61,8612.14
